Keyword,Subreddit,Category,Members,Title,Upvotes,Comments,Moderator Interaction,Fact-Checking Mention,Total Awards,URL,Original Post URL,processed_text,Bias
trump,moderatepolitics,General Politics,296228,"Clinton-appointed judge pulls reverse retirement card on Trump, rescinds senior status bid",5,5,No,No,0,https://lawandcrime.com/high-profile/clinton-appointed-judge-pulls-reverse-retirement-card-on-trump-rescinds-senior-status-decision-after-his-election-win/,/r/moderatepolitics/comments/1gq16zs/clintonappointed_judge_pulls_reverse_retirement/,clintonappointed judge pulls reverse retirement card trump rescinds senior status bid,R
trump,democrats,Ideological Politics,480545,Trump wants to shut down the Department of Education. ,160,52,No,No,0,https://www.cnn.com/2024/09/20/politics/department-of-education-shut-down-trump/index.html,/r/democrats/comments/1gq0hdt/trump_wants_to_shut_down_the_department_of/,trump wants shut department education,N
trump,democrats,Ideological Politics,480545,Donald Trump wants reparations for white people ,46,22,No,No,0,https://v.redd.it/5jnf0qt8kk0e1,/r/democrats/comments/1gq0z1h/donald_trump_wants_reparations_for_white_people/,donald trump wants reparations white people,N
trump,Republican,Ideological Politics,205202,Actor Dick Van Dyke Says He'd Rather Die Than See Another Four Years of Trump,31,67,No,No,0,https://conservativeroof.com/actor-dick-van-dyke-says-hed-rather-die-than-see-another-four-years-of-trump/,/r/Republican/comments/1gpznqs/actor_dick_van_dyke_says_hed_rather_die_than_see/,actor dick van dyke says hed rather die see another four years trump,R
trump,Conservative,Ideological Politics,1145483,Fox News host Pete Hegseth to serve as defense secretary under Trump,233,235,No,No,0,https://www.foxnews.com/politics/fox-news-host-pete-hegseth-serve-defense-secretary-under-trump,/r/Conservative/comments/1gpzwv6/fox_news_host_pete_hegseth_to_serve_as_defense/,fox news host pete hegseth serve defense secretary trump,N
trump,Conservative,Ideological Politics,1145483,"Trump announces Elon Musk, Vivek Ramaswamy to lead new 'Department of Government Efficiency'",148,24,No,No,0,https://nypost.com/2024/11/12/us-news/trump-announces-elon-musk-vivek-ramaswamy-to-lead-new-department-of-government-efficiency/,/r/Conservative/comments/1gq0knz/trump_announces_elon_musk_vivek_ramaswamy_to_lead/,trump announces elon musk vivek ramaswamy lead new department government efficiency,N
uk,democrats,Ideological Politics,480545,Have you ever had a dream that the election last week was just a fluke and we should’ve had a do-over?,33,3,No,No,0,https://i.redd.it/xqtuaf13nk0e1.jpeg,/r/democrats/comments/1gq1amh/have_you_ever_had_a_dream_that_the_election_last/,ever dream election last week fluke shouldve doover,N
War,Republican,Ideological Politics,205202,NYC Warns Migrants Funding for Upstate Hotel Rooms Is Ending,20,4,No,No,0,https://www.breitbart.com/immigration/2024/11/12/nyc-warns-migrants-funding-for-upstate-hotel-rooms-is-ending/,/r/Republican/comments/1gq1qio/nyc_warns_migrants_funding_for_upstate_hotel/,nyc warns migrants funding upstate hotel rooms ending,N
trump,democrats,Ideological Politics,480540,No. Trump Did Not Win in a Landslide nor Did He Secure a Mandate,152,30,No,No,0,https://www.thenation.com/article/politics/harris-trump-election/,/r/democrats/comments/1gq1jsw/no_trump_did_not_win_in_a_landslide_nor_did_he/,trump win landslide secure mandate,N
trump,democrats,Ideological Politics,480540,Trump wants to weed out “woke” generals. A first step for a Trump friendly military? Ready to be used on its citizens? Who will be on this Warrior Board?,42,21,No,No,0,https://www.telegraph.co.uk/us/politics/2024/11/12/trump-woke-generals-warrior-board-executive-order/,/r/democrats/comments/1gq1ujx/trump_wants_to_weed_out_woke_generals_a_first/,trump wants weed woke generals first step trump friendly military ready used citizens warrior board,N
trump,Conservatives,Ideological Politics,108234,GOP vows to investigate FEMA over skipping Trump supporters,22,0,No,No,0,https://nypost.com/2024/11/12/us-news/gop-vows-to-investigate-fema-over-skipping-trump-supporters/,/r/conservatives/comments/1gq0r28/gop_vows_to_investigate_fema_over_skipping_trump/,gop vows investigate fema skipping trump supporters,R
vote,Conservative,Ideological Politics,1145549,Voters Decided Democrats Are The Biggest Threat To Democracy,324,10,No,No,0,https://thefederalist.com/2024/11/12/voters-decided-democrats-are-the-biggest-threat-to-democracy/,/r/Conservative/comments/1gpvsue/voters_decided_democrats_are_the_biggest_threat/,voters decided democrats biggest threat democracy,L
immigration,moderatepolitics,General Politics,296254,Canada’s immigration strategy: How reduced targets can preserve positive attitudes,2,0,No,No,0,https://theconversation.com/canadas-immigration-strategy-how-reduced-targets-can-preserve-positive-attitudes-242737,/r/moderatepolitics/comments/1gq27qf/canadas_immigration_strategy_how_reduced_targets/,canadas immigration strategy reduced targets preserve positive attitudes,N
ai,Libertarian,Ideological Politics,503628,Americans Just Said No to Drugs - Why legalization lost at the ballot box,1,0,No,No,0,https://www.thefp.com/p/no-to-drugs-marijuana-mushrooms,/r/Libertarian/comments/1gq33jm/americans_just_said_no_to_drugs_why_legalization/,americans said drugs legalization lost ballot box,R
trump,PoliticalDiscussion,General Politics,2184618,What do you think Trump will do about the Israel/Palestine conflict?,25,77,No,No,0,https://www.reddit.com/r/PoliticalDiscussion/comments/1gq3qzs/what_do_you_think_trump_will_do_about_the/,/r/PoliticalDiscussion/comments/1gq3qzs/what_do_you_think_trump_will_do_about_the/,think trump israelpalestine conflict,N
trump,technology,General Politics,17390561,Kellyanne Conway says Donald Trump is expected to try to block TikTok ban: report,201,84,No,No,0,https://nypost.com/2024/11/12/business/kellyanne-conway-says-donald-trump-is-expected-to-try-to-block-tiktok-ban-report/?utm_source=smartnews&utm_campaign=nypost&utm_medium=referral,/r/technology/comments/1gpzlqr/kellyanne_conway_says_donald_trump_is_expected_to/,kellyanne conway says donald trump expected try block tiktok ban report,N
trump,Republican,Ideological Politics,205215,Trump transition live updates: Trump picks Elon Musk and Fox News host for key jobs in second White House term - BBC News,18,4,No,No,0,https://www.bbc.com/news/live/cnvjr42yq39t,/r/Republican/comments/1gq2vmg/trump_transition_live_updates_trump_picks_elon/,trump transition live updates trump picks elon musk fox news host key jobs second white house term bbc news,R
trump,Conservative,Ideological Politics,1145608,FEMA not helping Trump voters wasn't isolated — and it's a massive scandal,140,15,No,No,0,https://nypost.com/2024/11/12/opinion/fema-not-helping-trump-voters-wasnt-isolated-and-its-a-massive-scandal/,/r/Conservative/comments/1gq27v8/fema_not_helping_trump_voters_wasnt_isolated_and/,fema helping trump voters wasnt isolated massive scandal,N
trump,Conservatives,Ideological Politics,108234,"Pete Hegseth, Trump’s Pick For Defense Secretary, Wrote The Book On Pentagon’s Fall To Wokeness",14,1,No,No,0,https://www.dailywire.com/news/pete-hegseth-trumps-pick-for-defense-secretary-wrote-the-book-on-pentagons-fall-to-wokeness,/r/conservatives/comments/1gq3my1/pete_hegseth_trumps_pick_for_defense_secretary/,pete hegseth trumps pick defense secretary wrote book pentagons fall wokeness,N
trump,Conservatives,Ideological Politics,108234,"""Fired"" FEMA Manager: Refusing to help victims with Trump signage was agency policy, not my decision, and in the Carolinas, not just Florida. I am being used as a scapegoat.",22,3,No,No,0,https://x.com/erichhartmann/status/1856361566754471976,/r/conservatives/comments/1gpvsui/fired_fema_manager_refusing_to_help_victims_with/,fired fema manager refusing help victims trump signage agency policy decision carolinas florida used scapegoat,N
vote,democrats,Ideological Politics,480538,Husband's Vote Wasn't Counted! This Should Not Be Happening!,254,24,No,No,0,https://i.redd.it/kvtfog6y1l0e1.jpeg,/r/democrats/comments/1gq2y70/husbands_vote_wasnt_counted_this_should_not_be/,husbands vote wasnt counted happening,L
harris,Libertarian,Ideological Politics,503633,Dave Smith Throws Out Official Debate Challenge to Sam Harris ,1,1,No,No,0,https://www.youtube.com/watch?v=9Mdx-gwF98s&t=,/r/Libertarian/comments/1gq3vj0/dave_smith_throws_out_official_debate_challenge/,dave smith throws official debate challenge sam harris,L
results,Anarchism,Ideological Politics,271051,technique for postering/posting flyers called…?,1,2,No,No,0,https://www.reddit.com/r/Anarchism/comments/1gq1cle/technique_for_posteringposting_flyers_called/,/r/Anarchism/comments/1gq1cle/technique_for_posteringposting_flyers_called/,technique posteringposting flyers called,N
president,Anarchism,Ideological Politics,271051,Living with ADHD in a 'radically' conservative community.,1,0,No,No,0,https://www.reddit.com/r/Anarchism/comments/1gpw5vj/living_with_adhd_in_a_radically_conservative/,/r/Anarchism/comments/1gpw5vj/living_with_adhd_in_a_radically_conservative/,living adhd radically conservative community,N
War,Conservatives,Ideological Politics,108236,"Elizabeth Warren Tries To Trash Pete Hegseth, Gets A Quick Lesson On Who He Really Is",15,0,No,No,0,https://www.dailywire.com/news/elizabeth-warren-tries-to-trash-pete-hegseth-gets-a-quick-lesson-on-who-he-really-is,/r/conservatives/comments/1gq3ngy/elizabeth_warren_tries_to_trash_pete_hegseth_gets/,elizabeth warren tries trash pete hegseth gets quick lesson really,L
ai,Anarchism,Ideological Politics,271051,Open Call for Radical Creatives: Submissions for a New Online Zine,1,0,No,No,0,https://www.reddit.com/r/Anarchism/comments/1gq1jet/open_call_for_radical_creatives_submissions_for_a/,/r/Anarchism/comments/1gq1jet/open_call_for_radical_creatives_submissions_for_a/,open call radical creatives submissions new online zine,N
trump,Republican,Ideological Politics,205227,FEMA not helping Trump voters wasn’t isolated — and it’s a massive scandal,26,6,No,No,0,https://nypost.com/2024/11/12/opinion/fema-not-helping-trump-voters-wasnt-isolated-and-its-a-massive-scandal/,/r/Republican/comments/1gq4rxe/fema_not_helping_trump_voters_wasnt_isolated_and/,fema helping trump voters wasnt isolated massive scandal,N
trump,Socialism,Ideological Politics,460890,What are the chances of Trump seriously suppressing leftist thought or cracking down on socialist/communist parties and organizations?,10,2,No,No,0,https://www.reddit.com/r/socialism/comments/1gq5vly/what_are_the_chances_of_trump_seriously/,/r/socialism/comments/1gq5vly/what_are_the_chances_of_trump_seriously/,chances trump seriously suppressing leftist thought cracking socialistcommunist parties organizations,N
recount,KamalaHarris,Ideological Politics,75786,Why the Democratic Party must demand a recount w/Dean Obaidallah,19,0,No,No,0,https://youtu.be/FqfEmXjNPnw?si=Kob7g-2fVWXlGvIj,/r/KamalaHarris/comments/1gq61ac/why_the_democratic_party_must_demand_a_recount/,democratic party must demand recount wdean obaidallah,L
latino,democrats,Ideological Politics,480534,Democrats are losing Latino men. Ruben Gallego has advice on winning them back.,56,15,No,No,0,https://www.cbsnews.com/news/ruben-gallego-next-senator-arizona/,/r/democrats/comments/1gq4m1y/democrats_are_losing_latino_men_ruben_gallego_has/,democrats losing latino men ruben gallego advice winning back,L
white,Socialism,Ideological Politics,460890,Stop being friends with white supremacists ,25,1,No,No,0,https://i.redd.it/oc2mt16byl0e1.jpeg,/r/socialism/comments/1gq65nu/stop_being_friends_with_white_supremacists/,stop friends white supremacists,N
immigration,Republican,Ideological Politics,205227,Thomas D. Homan - Acting Director of the U.S. Immigration and Customs Enforcement,57,6,No,No,0,https://www.reddit.com/gallery/1gq5m83,/r/Republican/comments/1gq5m83/thomas_d_homan_acting_director_of_the_us/,thomas homan acting director us immigration customs enforcement,N
ai,Anarchism,Ideological Politics,271054,Radical Women Wednesday,1,0,Yes,No,0,https://www.reddit.com/r/Anarchism/comments/1gq6ak2/radical_women_wednesday/,/r/Anarchism/comments/1gq6ak2/radical_women_wednesday/,radical women wednesday,N
trump,PoliticalDiscussion,General Politics,2184632,Why is there such confusion about whether or not Putin has spoken to Trump?,1,1,No,Yes,0,https://www.reddit.com/r/PoliticalDiscussion/comments/1gq4ztm/why_is_there_such_confusion_about_whether_or_not/,/r/PoliticalDiscussion/comments/1gq4ztm/why_is_there_such_confusion_about_whether_or_not/,confusion whether putin spoken trump,N
trump,democrats,Ideological Politics,480534,Democratic warnings about Trump were not simply campaign rhetoric,58,8,No,No,0,https://archive.ph/J8IMV#selection-534.0-534.1,/r/democrats/comments/1gq4nrh/democratic_warnings_about_trump_were_not_simply/,democratic warnings trump simply campaign rhetoric,R
trump,Conservative,Ideological Politics,1145767,Left-wing conspiracy theorists are saying Trump stole the election with help from Elon's Starlink satellites,179,46,No,No,0,https://notthebee.com/article/left-wing-conspiracy-theorists-are-saying-trump-stole-the-election-with-help-from-elons-starling-satellites,/r/Conservative/comments/1gq3evp/leftwing_conspiracy_theorists_are_saying_trump/,leftwing conspiracy theorists saying trump stole election help elons starlink satellites,N
trump,Liberal,Ideological Politics,119806,Judge Marchan,4,2,No,No,0,https://www.reddit.com/r/Liberal/comments/1gq6f2n/judge_marchan/,/r/Liberal/comments/1gq6f2n/judge_marchan/,judge marchan,N
china,technology,General Politics,17391236,China rated Canada’s most aggressive cyber threat,126,5,No,No,0,https://www.theregister.com/2024/10/31/canada_cybersec_threats/?td=keepreading,/r/technology/comments/1gq2tnm/china_rated_canadas_most_aggressive_cyber_threat/,china rated canadas aggressive cyber threat,N
trump,democrats,Ideological Politics,480540,What can I do?,55,24,No,No,0,https://i.redd.it/tnx3dwdvxl0e1.png,/r/democrats/comments/1gq649u/what_can_i_do/,,N
uk,Socialism,Ideological Politics,460892,Where can I get socialist stickers ?,1,1,No,No,0,https://www.reddit.com/r/socialism/comments/1gq7ai8/where_can_i_get_socialist_stickers/,/r/socialism/comments/1gq7ai8/where_can_i_get_socialist_stickers/,get socialist stickers,L
inflation,Libertarian,Ideological Politics,503641,"Argentina's monthly inflation drops to 2.7%, the lowest level in 3 years",4,0,No,No,0,https://abcnews.go.com/International/wireStory/argentinas-monthly-inflation-drops-27-lowest-level-3-115787902,/r/Libertarian/comments/1gq7ob2/argentinas_monthly_inflation_drops_to_27_the/,argentinas monthly inflation drops lowest level years,N
trump,Socialism,Ideological Politics,460890,Personally want to thank this community,7,1,No,No,0,https://www.reddit.com/r/socialism/comments/1gq8bnx/personally_want_to_thank_this_community/,/r/socialism/comments/1gq8bnx/personally_want_to_thank_this_community/,personally want thank community,N
recount,News,General Politics,28922841,Idaho women tearfully recounts nonviable pregnancy diagnoses under total abortion ban,98,9,No,No,0,https://abcnews.go.com/US/idaho-woman-tearfully-recounts-nonviable-pregnancy-diagnosis-total/story?id=115765542,/r/news/comments/1gq8htq/idaho_women_tearfully_recounts_nonviable/,idaho women tearfully recounts nonviable pregnancy diagnoses total abortion ban,L
house,democrats,Ideological Politics,480535,Democrat Dave Min wins California House seat to replace Porter,77,1,No,No,0,https://thehill.com/homenews/state-watch/4971643-democrat-wins-california-house-seat-to-replace-porter/,/r/democrats/comments/1gq4xc4/democrat_dave_min_wins_california_house_seat_to/,democrat dave min wins california house seat replace porter,L
trump,Impeach_Trump,Ideological Politics,60560,Trump's defense choice stuns the Pentagon | apnews.com,5,0,No,No,0,https://apnews.com/article/trump-hegseth-defense-secretary-pentagon-2d8030921ecef933778cf92afd40ec72,/r/Impeach_Trump/comments/1gqakjc/trumps_defense_choice_stuns_the_pentagon_apnewscom/,trumps defense choice stuns pentagon apnewscom,L
mexico,Socialism,Ideological Politics,460900,book recs?,1,1,No,No,0,https://www.reddit.com/r/socialism/comments/1gqavd6/book_recs/,/r/socialism/comments/1gqavd6/book_recs/,book recs,N
ai,Republican,Ideological Politics,205249,Politics sub is disgusting ,13,8,No,No,0,https://www.reddit.com/gallery/1gq8t9b,/r/Republican/comments/1gq8t9b/politics_sub_is_disgusting/,politics sub disgusting,N
ai,Socialism,Ideological Politics,460900,Protests and Mass Anger in Spain after catastrophic floods,2,1,No,No,0,https://www.socialistworld.net/2024/11/07/worst-flooding-kills-more-than-200-people-in-spain/,/r/socialism/comments/1gqal5z/protests_and_mass_anger_in_spain_after/,protests mass anger spain catastrophic floods,N
trump,Republican,Ideological Politics,205245,Donald Trump Taps Elon Musk to Lead New Department Focused on Government Efficiency,20,8,No,No,0,https://m10news.com/donald-trump-taps-elon-musk-to-lead-new-department-focused-on-government-efficiency/,/r/Republican/comments/1gq6wv5/donald_trump_taps_elon_musk_to_lead_new/,donald trump taps elon musk lead new department focused government efficiency,N
trump,Conservative,Ideological Politics,1145901,Trump to go after ‘woke generals’ with ‘warrior board’ executive order,127,15,No,No,0,https://www.telegraph.co.uk/us/politics/2024/11/12/trump-woke-generals-warrior-board-executive-order/,/r/Conservative/comments/1gqb7kp/trump_to_go_after_woke_generals_with_warrior/,trump go woke generals warrior board executive order,N
trump,Conservative,Ideological Politics,1145901,“F*** them to the moon and back”: Scientific American editor apologizes after calling Trump voters “f***ing fascists”,180,32,No,No,0,https://notthebee.com/article/f-them-to-the-moon-and-back-editor-of-scientific-american-apologizes-after-calling-trump-voters-fing-fascists,/r/Conservative/comments/1gq97z4/f_them_to_the_moon_and_back_scientific_american/,f moon back scientific american editor apologizes calling trump voters fing fascists,N
trump,dailywire,Ideological Politics,24196,Reddit liberals are losing their mind,29,9,No,No,0,https://www.reddit.com/gallery/1gqbvup,/r/dailywire/comments/1gqbvup/reddit_liberals_are_losing_their_mind/,reddit liberals losing mind,N
victory,dailywire,Ideological Politics,24196,MATGA' trend about poisoning husbands after Trump victory,9,2,No,No,0,https://i.redd.it/eu51p6zyun0e1.png,/r/dailywire/comments/1gqbjgl/matga_trend_about_poisoning_husbands_after_trump/,matga trend poisoning husbands trump victory,R
vote,democrats,Ideological Politics,480523,"To avoid being in an ""echo chamber"" I took the plunge and listened to Elon. He literally said that Democrats are flying in immigrants to swing states to primarily vote Democrat. The AP has said that this is untrue. Am I missing something? Is there any Truth to this claim? ",81,79,No,Yes,0,https://i.redd.it/mwjjems93m0e1.jpeg,/r/democrats/comments/1gq6ky0/to_avoid_being_in_an_echo_chamber_i_took_the/,avoid echo chamber took plunge listened elon literally said democrats flying immigrants swing states primarily vote democrat ap said untrue missing something truth claim,L
europe,Conservative,Ideological Politics,1145901,Americans are desperately Googling how to ‘move to Europe’. We should welcome them ,116,31,No,No,0,https://ebbow.com/americans-how-to-move-to-europe-we-should-welcome-them/,/r/Conservative/comments/1gqai7q/americans_are_desperately_googling_how_to_move_to/,americans desperately googling move europe welcome,N
loss,News,General Politics,28923162,Just Eat Takeaway to sell US arm Grubhub at a loss of more than $6.5bn | Food & drink industry ,68,7,No,No,0,https://www.theguardian.com/business/2024/nov/13/just-eat-takeaway-to-sell-us-arm-grubhub-in-cut-price-deal,/r/news/comments/1gqcxh5/just_eat_takeaway_to_sell_us_arm_grubhub_at_a/,eat takeaway sell us arm grubhub loss bn food drink industry,N
trump,technology,General Politics,17392347,Taiwan economic minister says TSMC's core tech will not leave country | There are concerns the Trump Administration could pressure TSMC to move its most advanced technology to the US,97,34,No,No,0,https://www.techspot.com/news/105552-taiwan-economic-minister-tsmc-core-tech-not-leave.html,/r/technology/comments/1gqb5ud/taiwan_economic_minister_says_tsmcs_core_tech/,taiwan economic minister says tsmcs core tech leave country concerns trump administration could pressure tsmc move advanced technology us,R
trump,Conservative,Ideological Politics,1145933,Special Counsel Jack Smith plans to retire before Trump takes office,54,11,No,No,0,https://nypost.com/2024/11/13/us-news/special-coounsel-jack-smith-plans-to-retire-before-trump-takes-office/,/r/Conservative/comments/1gqcdhr/special_counsel_jack_smith_plans_to_retire_before/,special counsel jack smith plans retire trump takes office,N
biden,Conservative,Ideological Politics,1145933,Federal Court Rejects Biden’s ‘Parole in Place' for Illegal Aliens,65,3,No,No,0,https://www.dailysignal.com/2024/11/12/federal-court-rejects-bidens-parole-in-place-for-illegal-aliens/?utm_source=TDS_Email&utm_medium=email&utm_campaign=MorningBell&mkt_tok=ODI0LU1IVC0zMDQAAAGWxDYSLQD6xhaWl0j36BH3V3SRUjuUwPTXqvSMuo5nuAYRbd07zO54NTq1sYFteP0f8N7JVXLRu4IXV3Wg0DBBaBl99nFW855qPPia6EZFvGOCqIY,/r/Conservative/comments/1gqaoyq/federal_court_rejects_bidens_parole_in_place_for/,federal court rejects bidens parole place illegal aliens,L
victory,Conservatives,Ideological Politics,108236,Hang It in the Louvre: Nancy Pelosi Gives Update on How She's Feeling Post-Trump's Victory,11,2,No,No,0,https://redstate.com/bonchie/2024/11/12/hang-it-in-the-louvre-nancy-pelosi-gives-update-on-how-shes-feeling-post-trumps-victory-n2181923,/r/conservatives/comments/1gqc91q/hang_it_in_the_louvre_nancy_pelosi_gives_update/,hang louvre nancy pelosi gives update shes feeling posttrumps victory,L
trump,Conservatives,Ideological Politics,108236,Trump Preparing Executive Order to Cull the Military of Woke Generals and Admirals,8,0,No,No,0,https://redstate.com/streiff/2024/11/12/trump-preparing-executive-order-to-cull-the-military-of-woke-generals-and-admirals-n2181909,/r/conservatives/comments/1gqd7uo/trump_preparing_executive_order_to_cull_the/,trump preparing executive order cull military woke generals admirals,N
harris,Conservatives,Ideological Politics,108236,Love to See It: MSDNC on Hot Seat After Revelations on Harris Campaign Donations to Sharpton Organization,9,0,No,No,0,https://redstate.com/sister-toldjah/2024/11/12/msnbcs-got-some-explaining-to-do-after-revelations-on-harris-campaign-donations-to-sharpton-organization-n2181918,/r/conservatives/comments/1gqc9ip/love_to_see_it_msdnc_on_hot_seat_after/,love see msdnc hot seat revelations harris campaign donations sharpton organization,R
white,Republican,Ideological Politics,205250,"Current NPR CEO Katherine Maher says that during her time leading Wikipedia, she abandoned a ""free and open"" internet, because this led to the platform to recapitulating a ""white male Westernized construct"".",14,2,No,No,0,https://x.com/kevinnbass/status/1856351326889820283,/r/Republican/comments/1gqd2yk/current_npr_ceo_katherine_maher_says_that_during/,current npr ceo katherine maher says time leading wikipedia abandoned free open internet led platform recapitulating white male westernized construct,R
War,technology,General Politics,17392350,FYI. A Warrant Isn’t Needed': Secret Service Says You Agreed To Be Tracked With Location Data,119,15,No,No,0,https://www.404media.co/fyi-a-warrant-isnt-needed-secret-service-says-you-agreed-to-be-tracked-with-location-data/,/r/technology/comments/1gqbil8/fyi_a_warrant_isnt_needed_secret_service_says_you/,fyi warrant isnt needed secret service says agreed tracked location data,N
elon musk,Republican,Ideological Politics,205250,Elon Musk Reveals the Real Reason Behind His $44B Twitter Gamble: ‘Something Weird Was Going On’ ,13,1,No,No,0,https://www.theviralpink.com/elon-musk-reveals-the-real-reason-behind-his-44b-twitter-gamble-something-weird-was-going-on/,/r/Republican/comments/1gq9tvz/elon_musk_reveals_the_real_reason_behind_his_44b/,elon musk reveals real reason behind b twitter gamble something weird going,L
ai,Socialism,Ideological Politics,460892,"Recommend Me A YouTube Channel Thread for November, 2024",2,1,Yes,No,0,https://www.reddit.com/r/socialism/comments/1gqdis8/recommend_me_a_youtube_channel_thread_for/,/r/socialism/comments/1gqdis8/recommend_me_a_youtube_channel_thread_for/,recommend youtube channel thread november,N
biden,Conservatives,Ideological Politics,108235,"WATCH: Doocy Goes There, Has Testy Exchange With Jean-Pierre About Harris and Biden Meeting",8,0,No,No,0,https://redstate.com/bonchie/2024/11/12/watch-doocy-goes-wild-after-trump-win-has-hilarious-exchange-with-jean-pierre-about-harris-and-biden-n2181904,/r/conservatives/comments/1gqd70u/watch_doocy_goes_there_has_testy_exchange_with/,watch doocy goes testy exchange jeanpierre harris biden meeting,R
russia,technology,General Politics,17392642,Prankster fools Russian teachers into wearing tinfoil hats to protect them from NATO satellites,68,15,No,No,0,https://tvpworld.com/83450569/belarusian-prankster-dupes-russian-teachers-into-wearing-tinfoil-hats,/r/technology/comments/1gqb8q7/prankster_fools_russian_teachers_into_wearing/,prankster fools russian teachers wearing tinfoil hats protect nato satellites,N
War,Libertarian,Ideological Politics,503641,Nominating AIPAC shills is not something you do if you want to end the wars,31,5,No,No,0,https://i.redd.it/zsesr1fmfo0e1.jpeg,/r/Libertarian/comments/1gqdr3b/nominating_aipac_shills_is_not_something_you_do/,nominating aipac shills something want end wars,L
