Keyword,Subreddit,Category,Members,Title,Upvotes,Comments,Moderator Interaction,Fact-Checking Mention,Total Awards,URL,Original Post URL,processed_text,Bias
trump,democrats,Ideological Politics,480556,High grocery prices got droves of Americans to vote for Trump but they shouldn’t expect to pay less over the next four years,49,6,No,No,0,https://www.cnn.com/2024/11/14/economy/trump-grocery-prices-inflation?cid=ios_app,/r/democrats/comments/1graf6u/high_grocery_prices_got_droves_of_americans_to/,high grocery prices got droves americans vote trump shouldnt expect pay less next four years,L
trump,Republican,Ideological Politics,205476,"Republicans Secure House Majority, Gaining Full Control of Government as Trump Prepares for Presidency",147,35,No,No,0,https://m10news.com/republicans-secure-house-majority-gaining-full-control-of-government-as-trump-prepares-for-presidency/,/r/Republican/comments/1gr3lyd/republicans_secure_house_majority_gaining_full/,republicans secure house majority gaining full control government trump prepares presidency,N
trump,Conservative,Ideological Politics,1147261,Does the left know that Fox only has 2.5 million viewers and 72 million poeople who don't watch Fox voted for Trump?,833,243,No,No,0,https://www.reddit.com/r/Conservative/comments/1gr6o39/does_the_left_know_that_fox_only_has_25_million/,/r/Conservative/comments/1gr6o39/does_the_left_know_that_fox_only_has_25_million/,left know fox million viewers million poeople dont watch fox voted trump,L
trump,Conservative,Ideological Politics,1147261,Woke 'Snow White' Rachel Zegler Just Burned Disney to the Ground With Her Comments on Trump Supporters,459,57,No,No,0,https://redstate.com/bonchie/2024/11/13/rachel-zegler-just-burned-disney-to-the-ground-with-her-comments-on-trump-supporters-n2181966,/r/Conservative/comments/1gr4t2a/woke_snow_white_rachel_zegler_just_burned_disney/,woke snow white rachel zegler burned disney ground comments trump supporters,N
trump,Conservative,Ideological Politics,1147261,Trump jokes about third term as Republicans win House,328,129,No,No,0,https://www.telegraph.co.uk/us/politics/2024/11/14/republicans-win-house-secure-government-donald-trump/,/r/Conservative/comments/1gr6qc5/trump_jokes_about_third_term_as_republicans_win/,trump jokes third term republicans win house,N
recount,Conservative,Ideological Politics,1147261,We're Heading for a Recount in PA...and the Dems Want Illegal Ballots Counted.,215,58,No,No,0,https://townhall.com/tipsheet/mattvespa/2024/11/14/sore-loser-dems-want-a-recount-in-pas-senate-race-heres-what-theyre-arguing-for-n2647774,/r/Conservative/comments/1gr5zwh/were_heading_for_a_recount_in_paand_the_dems_want/,heading recount paand dems want illegal ballots counted,L
trump,Conservative,Ideological Politics,1147261,"Liberal women have a plan to get revenge on Trump, and we 100% support them",336,59,No,No,0,https://www.theblaze.com/shows/normal-world/liberal-women-have-a-plan-to-get-revenge-on-trump-and-we-100-support-them,/r/Conservative/comments/1gr2gq8/liberal_women_have_a_plan_to_get_revenge_on_trump/,liberal women plan get revenge trump support,R
trump,Conservative,Ideological Politics,1147261,"Republicans win 218 US House seats, giving Donald Trump and the party control of government",311,28,No,No,0,https://apnews.com/article/republicans-house-elections-e3754a684a7b96b129841d4b207c15e9,/r/Conservative/comments/1gr1eif/republicans_win_218_us_house_seats_giving_donald/,republicans win us house seats giving donald trump party control government,N
biden,Conservative,Ideological Politics,1147261,"Nancy Pelosi: Biden ""immediately"" endorsing Kamala made planned open primary ""impossible""",724,134,No,No,0,https://notthebee.com/article/nancy-pelosi-says-there-was-supposed-to-be-an-open-primary-after-biden-dropped-out-but-then-he-endorsed-harris-which-made-this-impossible,/r/Conservative/comments/1gqx14x/nancy_pelosi_biden_immediately_endorsing_kamala/,nancy pelosi biden immediately endorsing kamala made planned open primary impossible,R
trump,Conservative,Ideological Politics,1147261,HILARIOUS: Parody Ad Features Company That Offers to Cryogenically Freeze Liberals for Duration of Trump's Presidency,134,5,No,No,0,https://thepatriotlight.com/340587/hilarious-parody-ad-features-company-that-offers-to-cryogenically-freeze-liberals-for-duration-of-trumps-presidency-video-the-gateway-pundit/,/r/Conservative/comments/1gr4ska/hilarious_parody_ad_features_company_that_offers/,hilarious parody ad features company offers cryogenically freeze liberals duration trumps presidency,N
trump,Socialism,Ideological Politics,460974,Stop condescendingly telling people to “read theory”,233,50,No,No,0,https://www.reddit.com/r/socialism/comments/1gr89t5/stop_condescendingly_telling_people_to_read_theory/,/r/socialism/comments/1gr89t5/stop_condescendingly_telling_people_to_read_theory/,stop condescendingly telling people read theory,N
vance,Socialism,Ideological Politics,460974,Isn't The UK Labour Party a leftist party?,11,22,No,No,0,https://www.reddit.com/r/socialism/comments/1gr88hm/isnt_the_uk_labour_party_a_leftist_party/,/r/socialism/comments/1gr88hm/isnt_the_uk_labour_party_a_leftist_party/,isnt uk labour party leftist party,N
harris,Conservatives,Ideological Politics,108261,The Truth Behind Why Kamala Harris Refused to Do a Joe Rogan Interview Comes Out,67,12,No,Yes,0,https://redstate.com/sister-toldjah/2024/11/13/the-truth-behind-why-kamala-harris-refused-to-do-a-joe-rogan-interview-comes-out-n2181976,/r/conservatives/comments/1gr42b0/the_truth_behind_why_kamala_harris_refused_to_do/,truth behind kamala harris refused joe rogan interview comes,R
trump,Conservatives,Ideological Politics,108261,"OH SHUT UP: Chicago Tribune Columnist Cries Trump Didn’t Win Election, ‘Disinformation Did’",32,6,No,Yes,0,https://www.newsbusters.org/blogs/free-speech/joseph-vazquez/2024/11/14/oh-shut-chicago-tribune-columnist-cries-trump-didnt-win,/r/conservatives/comments/1gr8g3s/oh_shut_up_chicago_tribune_columnist_cries_trump/,oh shut chicago tribune columnist cries trump didnt win election disinformation,N
trump,Conservatives,Ideological Politics,108261,Opinion: Progressives insult Americans because Trump won. Guess who that helps?,8,0,No,No,0,https://www.usatoday.com/story/opinion/columnist/2024/11/14/trump-election-win-progressive-meltdown-msnbc-colbert/76196558007/,/r/conservatives/comments/1gr9ni3/opinion_progressives_insult_americans_because/,opinion progressives insult americans trump guess helps,N
senate,Conservatives,Ideological Politics,108261,Video: Thomas Massie Asked If Gaetz Will Be Confirmed by Senate—His Response Will Drive Democrats Crazy,9,1,No,No,0,https://defiantamerica.com/video-thomas-massie-asked-if-gaetz-will-be-confirmed-by-senate-his-response-will-drive-democrats-crazy/,/r/conservatives/comments/1gr38vq/video_thomas_massie_asked_if_gaetz_will_be/,video thomas massie asked gaetz confirmed senatehis response drive democrats crazy,L
biden,Liberal,Ideological Politics,119859,We need to *actually* create Blue MAGA. ,42,45,No,No,0,https://www.reddit.com/r/Liberal/comments/1gr7var/we_need_to_actually_create_blue_maga/,/r/Liberal/comments/1gr7var/we_need_to_actually_create_blue_maga/,need actually create blue maga,N
biden,Liberal,Ideological Politics,119859,A bunch of people didn't vote for her,40,54,No,No,0,https://www.reddit.com/r/Liberal/comments/1gr3bm1/a_bunch_of_people_didnt_vote_for_her/,/r/Liberal/comments/1gr3bm1/a_bunch_of_people_didnt_vote_for_her/,bunch people didnt vote,L
trump,Liberal,Ideological Politics,119859,Life in limbo,6,7,No,No,0,https://www.reddit.com/r/Liberal/comments/1gr9pty/life_in_limbo/,/r/Liberal/comments/1gr9pty/life_in_limbo/,life limbo,N
trump,Liberal,Ideological Politics,119859,How long until Elon musk and Trump have a fall out? ,2,5,No,No,0,https://www.reddit.com/r/Liberal/comments/1gral4g/how_long_until_elon_musk_and_trump_have_a_fall_out/,/r/Liberal/comments/1gral4g/how_long_until_elon_musk_and_trump_have_a_fall_out/,long elon musk trump fall,N
trump,KamalaHarris,Ideological Politics,75509,"Where Trump AG Pick Matt Gaetz Stands on Abortion, LGBTQ Rights and Criminal Justice",133,26,No,No,0,https://open.substack.com/pub/uncloseted/p/where-trump-ag-pick-matt-gaetz-stands?r=48d6ye&utm_campaign=post&utm_medium=web,/r/KamalaHarris/comments/1gr8owz/where_trump_ag_pick_matt_gaetz_stands_on_abortion/,trump ag pick matt gaetz stands abortion lgbtq rights criminal justice,N
War,News,General Politics,28929918,The Onion wins Alex Jones' Infowars in bankruptcy auction,47455,1769,No,No,0,https://www.nbcnews.com/news/us-news/onion-wins-alex-jones-infowars-bankruptcy-auction-rcna179936,/r/news/comments/1gr5l2g/the_onion_wins_alex_jones_infowars_in_bankruptcy/,onion wins alex jones infowars bankruptcy auction,N
War,technology,General Politics,17398658,Satire publication The Onion buys Alex Jones’ Infowars at auction with help from Sandy Hook families,13773,361,No,No,0,https://apnews.com/article/onion-buys-infowars-alex-jones-6496f198d141c991087dcd937b3588e9,/r/technology/comments/1gr5tyr/satire_publication_the_onion_buys_alex_jones/,satire publication onion buys alex jones infowars auction help sandy hook families,N
russia,technology,General Politics,17398658,"Canada set to become nuclear ‘superpower’ with enough uranium to beat China, Russia | Countries depend on Russia and China for enriching uranium coming from Kazakhstan. Canada can enrich uranium from its own mines.",852,46,No,No,0,https://interestingengineering.com/energy/uranium-nuclear-fuel-supply-canada,/r/technology/comments/1gr47zz/canada_set_to_become_nuclear_superpower_with/,canada set become nuclear superpower enough uranium beat china russia countries depend russia china enriching uranium coming kazakhstan canada enrich uranium mines,L
War,technology,General Politics,17398658,Satirical publication The Onion says it bought Alex Jones' Infowars at auction,190,20,No,No,0,https://www.cbsnews.com/news/the-onion-buys-alex-jones-infowars-auction-sandy-hook-families/,/r/technology/comments/1gr5x9y/satirical_publication_the_onion_says_it_bought/,satirical publication onion says bought alex jones infowars auction,R
War,democrats,Ideological Politics,480556,"""The Onion"" wins auction to take control of Alex Jones’s ""Infowars""",99,2,No,No,0,https://www.washingtonpost.com/nation/2024/11/14/infowars-auction-alex-jones-sandy-hook-the-onion/,/r/democrats/comments/1gr5tuk/the_onion_wins_auction_to_take_control_of_alex/,onion wins auction take control alex joness infowars,N
War,Conservative,Ideological Politics,1147261,Parody site ‘The Onion’ buys Alex Jones’ ‘Infowars’ at auction ,196,57,No,No,0,https://apnews.com/article/6496f198d141c991087dcd937b3588e9,/r/Conservative/comments/1gr63we/parody_site_the_onion_buys_alex_jones_infowars_at/,parody site onion buys alex jones infowars auction,N
War,Conservative,Ideological Politics,1147261,Vivek and Elon Tag Team to Wreck Elizabeth Warren After She Attacks Dept. of Government Efficiency,218,25,No,No,0,https://redstate.com/nick-arama/2024/11/13/warren-on-doge-response-by-vivek-and-elon-n2181969,/r/Conservative/comments/1gr4r0f/vivek_and_elon_tag_team_to_wreck_elizabeth_warren/,vivek elon tag team wreck elizabeth warren attacks dept government efficiency,N
War,Libertarian,Ideological Politics,503686,Dave Smith explains how warmonger Republicans are just as bad as warmonger Democrats,66,2,No,No,0,https://v.redd.it/gcs2lqw5hv0e1,/r/Libertarian/comments/1gr58vz/dave_smith_explains_how_warmonger_republicans_are/,dave smith explains warmonger republicans bad warmonger democrats,L
israel,Socialism,Ideological Politics,460974,I'd like to be more informed about Israeli-Palestinian conflict,6,34,No,No,0,https://www.reddit.com/r/socialism/comments/1gr6fay/id_like_to_be_more_informed_about/,/r/socialism/comments/1gr6fay/id_like_to_be_more_informed_about/,id like informed israelipalestinian conflict,N
War,Socialism,Ideological Politics,460974,I hate western imperialism,22,18,No,No,0,https://www.reddit.com/r/socialism/comments/1gqw3mb/i_hate_western_imperialism/,/r/socialism/comments/1gqw3mb/i_hate_western_imperialism/,hate western imperialism,N
War,Liberal,Ideological Politics,119859,"The Onion wins Alex Jones' Infowars in bankruptcy auction; The satirical news company plans to shutter Jones’ Infowars and rebuild the website featuring well-known internet humor writers and content creators, according to a person with knowledge of the sale.",8,0,No,No,0,https://www.nbcnews.com/news/us-news/onion-wins-alex-jones-infowars-bankruptcy-auction-rcna179936,/r/Liberal/comments/1gr8wjs/the_onion_wins_alex_jones_infowars_in_bankruptcy/,onion wins alex jones infowars bankruptcy auction satirical news company plans shutter jones infowars rebuild website featuring wellknown internet humor writers content creators according person knowledge sale,N
mexico,Conservative,Ideological Politics,1147261,Eva Longoria reveals she has fled 'dystopian' America with her family and is now living in Mexico and Spain,635,366,No,No,0,https://www.dailymail.co.uk/news/article-14081643/eva-longoria-fled-america-family-mexico-spain.html,/r/Conservative/comments/1gr4ogw/eva_longoria_reveals_she_has_fled_dystopian/,eva longoria reveals fled dystopian america family living mexico spain,N
border,dailywire,Ideological Politics,24218,New border czar owned AOC,64,3,No,No,0,https://www.instagram.com/reel/DCP4TAnyNoZ/?igsh=MmI5ZmppaWlpYWs2,/r/dailywire/comments/1gr2vm4/new_border_czar_owned_aoc/,new border czar owned aoc,N
ai,technology,General Politics,17398662,"Phone network employs AI ""grandmother"" to waste scammers' time with meandering conversations | Scambaiting, Abe Simpson-style",3178,103,No,No,0,https://www.techspot.com/news/105571-phone-network-employs-ai-grandmother-waste-scammers-time.html,/r/technology/comments/1gr3cv3/phone_network_employs_ai_grandmother_to_waste/,phone network employs ai grandmother waste scammers time meandering conversations scambaiting abe simpsonstyle,L
ai,technology,General Politics,17398662,Bethesda Workers Go On Strike Against Microsoft,74,10,No,No,0,https://www.gamespot.com/articles/bethesda-workers-go-on-strike-against-microsoft/1100-6527751/?ftag=CAD-01-10abi2f,/r/technology/comments/1gra84a/bethesda_workers_go_on_strike_against_microsoft/,bethesda workers go strike microsoft,N
ai,Republican,Ideological Politics,205476,"Bye, Felicia: Joy Reid deletes her X account | Thanks For Helping Make Social Media Great Again 👍 ",198,23,No,No,0,https://notthebee.com/article/joy-reid-deletes-her-x-account,/r/Republican/comments/1gr8scu/bye_felicia_joy_reid_deletes_her_x_account_thanks/,bye felicia joy reid deletes x account thanks helping make social media great,N
ai,Conservative,Ideological Politics,1147261,Whoopi Goldberg claims NYC bakery 'refused' to make her a birthday dessert because of her 'politics',696,177,No,No,0,https://nypost.com/2024/11/14/entertainment/whoopi-goldberg-claims-nyc-bakery-refused-to-make-her-a-birthday-dessert-because-of-her-politics/,/r/Conservative/comments/1gr4fav/whoopi_goldberg_claims_nyc_bakery_refused_to_make/,whoopi goldberg claims nyc bakery refused make birthday dessert politics,N
ai,Conservative,Ideological Politics,1147261,"The supposed ""in-fighting"" amongst the right is gaslighting.",133,43,No,No,0,https://www.reddit.com/r/Conservative/comments/1gr46b9/the_supposed_infighting_amongst_the_right_is/,/r/Conservative/comments/1gr46b9/the_supposed_infighting_amongst_the_right_is/,supposed infighting amongst right gaslighting,N
ai,Libertarian,Ideological Politics,503686,Mom Jailed for Letting 10-Year-Old Walk Alone to Town,181,44,No,No,0,https://reason.com/2024/11/11/mom-jailed-for-letting-10-year-old-walk-alone-to-town/,/r/Libertarian/comments/1gr4l7z/mom_jailed_for_letting_10yearold_walk_alone_to/,mom jailed letting yearold walk alone town,N
ai,Conservatives,Ideological Politics,108261,AZ Judge Recuses Himself From 'Fake Electors' Case After Emails Surface Demanding Judges Defend Kamala,104,1,No,No,0,https://redstate.com/beccalower/2024/11/13/az-judge-recuses-himself-from-fake-electors-case-after-emails-surface-demanding-judges-defend-kamala-n2181972,/r/conservatives/comments/1gr41f3/az_judge_recuses_himself_from_fake_electors_case/,az judge recuses fake electors case emails surface demanding judges defend kamala,L
ai,dailywire,Ideological Politics,24218,Whoever is Brett Coopers memer needs a raise ,8,0,No,No,0,https://v.redd.it/z6xqi35fbw0e1,/r/dailywire/comments/1gr91j4/whoever_is_brett_coopers_memer_needs_a_raise/,whoever brett coopers memer needs raise,N
trump,moderatepolitics,General Politics,296486,The ‘Lost Boys’ of Gen Z: how Trump won the hearts of alienated young men,17,31,No,No,0,https://theconversation.com/the-lost-boys-of-gen-z-how-trump-won-the-hearts-of-alienated-young-men-243358,/r/moderatepolitics/comments/1grbshi/the_lost_boys_of_gen_z_how_trump_won_the_hearts/,lost boys gen z trump hearts alienated young men,R
trump,Conservative,Ideological Politics,1147306,"Connecticut teacher resigns, apologizes on-air after threatening Trump voters with violence on Snapchat",139,27,No,No,0,https://notthebee.com/article/watch-teacher-offers-tearful-apology-after-getting-fired-for-threatening-to-handle-trump-supporters,/r/Conservative/comments/1grakav/connecticut_teacher_resigns_apologizes_onair/,connecticut teacher resigns apologizes onair threatening trump voters violence snapchat,N
recount,Conservatives,Ideological Politics,108263,We're Heading for a Recount in Pennsylvania Senate race - and the Dems Want Illegal Ballots Counted.,28,6,No,No,0,https://townhall.com/tipsheet/mattvespa/2024/11/14/sore-loser-dems-want-a-recount-in-pas-senate-race-heres-what-theyre-arguing-for-n2647774,/r/conservatives/comments/1grayty/were_heading_for_a_recount_in_pennsylvania_senate/,heading recount pennsylvania senate race dems want illegal ballots counted,L
trump,Liberal,Ideological Politics,119861,Someone Take Away Steve Bannon's Copy of *The Prince*,1,0,No,No,0,https://www.reddit.com/r/Liberal/comments/1grc6za/someone_take_away_steve_bannons_copy_of_the_prince/,/r/Liberal/comments/1grc6za/someone_take_away_steve_bannons_copy_of_the_prince/,someone take away steve bannons copy prince,N
vote,dailywire,Ideological Politics,24218,These election meltdowns keep getting better,47,9,No,No,0,https://i.redd.it/rierxc82rw0e1.jpeg,/r/dailywire/comments/1grb58d/these_election_meltdowns_keep_getting_better/,election meltdowns keep getting better,N
gaza,News,General Politics,28930248,Exclusive: Ben & Jerry's says parent Unilever silenced it over Gaza stance,254,45,No,No,0,https://www.reuters.com/business/retail-consumer/ben-jerrys-says-parent-unilever-silenced-it-over-gaza-stance-2024-11-14/?utm_medium=Social&utm_source=twitter,/r/news/comments/1grbngn/exclusive_ben_jerrys_says_parent_unilever/,exclusive ben jerrys says parent unilever silenced gaza stance,N
ai,News,General Politics,28930250,Justice Department Says Jail Conditions in Georgia's Fulton County Violate Detainee Rights,163,10,No,No,0,https://apnews.com/article/justice-department-fulton-county-jail-investigation-c6c8e088d7e8aee58e6420cac15d7b49?utm_source=copy&utm_medium=share,/r/news/comments/1grbh0q/justice_department_says_jail_conditions_in/,justice department says jail conditions georgias fulton county violate detainee rights,N
biden,technology,General Politics,17399245,Exclusive: Trump's transition team aims to kill Biden EV tax credit,224,50,No,No,0,https://www.reuters.com/business/autos-transportation/trumps-transition-team-aims-kill-biden-ev-tax-credit-2024-11-14/,/r/technology/comments/1grd0zm/exclusive_trumps_transition_team_aims_to_kill/,exclusive trumps transition team aims kill biden ev tax credit,L
trump,democrats,Ideological Politics,480571,Undocumented mechanic says he won’t regret his support for Trump even if he’s deported,76,40,No,No,0,https://edition.cnn.com/2024/11/13/us/video/trump-mass-deportations-rosa-flores-dnt-ac360-digvid,/r/democrats/comments/1grd4y5/undocumented_mechanic_says_he_wont_regret_his/,undocumented mechanic says wont regret support trump even hes deported,R
trump,Conservative,Ideological Politics,1147327,Nikki Haley Calls Trump ‘Shallow’ After Being Rejected for Admin Job,152,60,No,No,0,https://www.breitbart.com/2024-election/2024/11/14/nikki-haley-calls-trump-shallow-rejected-admin-job/,/r/Conservative/comments/1grc68a/nikki_haley_calls_trump_shallow_after_being/,nikki haley calls trump shallow rejected admin job,N
trump,Anarchism,Ideological Politics,271129,"We've prepared a zine version of our text ""History Repeats Itself: First as Farce, Then as Tragedy,"" exploring why the Democrats are responsible for Donald Trump's return to power and what we have to do to regain the initiative.",8,0,No,No,0,/r/CrimethInc/comments/1grchqe/weve_prepared_a_zine_version_of_our_text_history/,/r/Anarchism/comments/1grchxa/weve_prepared_a_zine_version_of_our_text_history/,weve prepared zine version text history repeats first farce tragedy exploring democrats responsible donald trumps return power regain initiative,L
recount,Anarchism,Ideological Politics,271129,"We've prepared a zine version of ""The Eye of Every Storm,"" in which an anarchist involved in longstanding disaster response efforts in Appalachia recounts the lessons they learned in the course of responding to Hurricane Helene and offers advice about how to get ready for the disasters to come.",1,0,No,No,0,/r/CrimethInc/comments/1grdton/weve_prepared_a_zine_version_of_the_eye_of_every/,/r/Anarchism/comments/1grdtug/weve_prepared_a_zine_version_of_the_eye_of_every/,weve prepared zine version eye every storm anarchist involved longstanding disaster response efforts appalachia recounts lessons learned course responding hurricane helene offers advice get ready disasters come,L
trump,Liberal,Ideological Politics,119860,Everyone is hiding,27,18,No,No,0,https://www.reddit.com/r/Liberal/comments/1grcl53/everyone_is_hiding/,/r/Liberal/comments/1grcl53/everyone_is_hiding/,everyone hiding,N
trump,Liberal,Ideological Politics,119860,Trump taps Fox News host Pete Hegseth for defense secretary,4,0,No,No,0,https://www.cbsnews.com/news/trump-pete-hegseth-defense-secretary/,/r/Liberal/comments/1grdfzk/trump_taps_fox_news_host_pete_hegseth_for_defense/,trump taps fox news host pete hegseth defense secretary,N
white,Socialism,Ideological Politics,460988,Disillusioned and loosing my mind.,2,5,No,No,0,https://www.reddit.com/r/socialism/comments/1grcvrg/disillusioned_and_loosing_my_mind/,/r/socialism/comments/1grcvrg/disillusioned_and_loosing_my_mind/,disillusioned loosing mind,N
Arizona,Conservatives,Ideological Politics,108259,Arizona Judge Recuses Himself From 'Fake Electors' Case After Emails Surface Demanding Judges Defend Kamala,9,0,No,No,0,https://redstate.com/beccalower/2024/11/13/az-judge-recuses-himself-from-fake-electors-case-after-emails-surface-demanding-judges-defend-kamala-n2181972?bcid=3b1497a409aa349654180f08236547d7cf3c88d51141d3f44e7f1f59fb4c60ef&lctg=29718346,/r/conservatives/comments/1grcksh/arizona_judge_recuses_himself_from_fake_electors/,arizona judge recuses fake electors case emails surface demanding judges defend kamala,N
War,technology,General Politics,17399246,The Onion buys Alex Jones's Infowars at auction,93,13,No,No,0,https://www.bbc.com/news/articles/c30p1p0j0ddo,/r/technology/comments/1grb86m/the_onion_buys_alex_joness_infowars_at_auction/,onion buys alex joness infowars auction,N
War,Libertarian,Ideological Politics,503695,Can someone explain what the General Libertarian views on how a Libertarian led country interacts with other countries and businesses from other countries?,1,1,No,No,0,https://www.reddit.com/r/Libertarian/comments/1grdskw/can_someone_explain_what_the_general_libertarian/,/r/Libertarian/comments/1grdskw/can_someone_explain_what_the_general_libertarian/,someone explain general libertarian views libertarian led country interacts countries businesses countries,N
money,Republican,Ideological Politics,205500,Democrats Worried If Government Becomes More Efficient They'll Be Forced To Light Giant Piles Of Money On Fire On Their Own,32,1,No,No,0,https://babylonbee.com/news/democrats-worried-that-if-government-becomes-more-efficient-theyll-be-forced-to-light-giant-piles-of-money-on-fire-on-their-own,/r/Republican/comments/1grclwn/democrats_worried_if_government_becomes_more/,democrats worried government becomes efficient theyll forced light giant piles money fire,L
climate change,Socialism,Ideological Politics,460988,Book recs on neoliberalism?,2,4,No,No,0,https://www.reddit.com/r/socialism/comments/1grd3sq/book_recs_on_neoliberalism/,/r/socialism/comments/1grd3sq/book_recs_on_neoliberalism/,book recs neoliberalism,N
trump,moderatepolitics,General Politics,296482,Trump expected to select Robert F. Kennedy Jr. to lead HHS,13,3,No,No,0,https://www.politico.com/news/2024/11/14/robert-f-kennedy-jr-trump-hhs-secretary-pick-00188617,/r/moderatepolitics/comments/1grf4x1/trump_expected_to_select_robert_f_kennedy_jr_to/,trump expected select robert f kennedy jr lead hhs,N
trump,democrats,Ideological Politics,480592,What do you all think about Putin’s aide warning Trump?,39,48,No,No,0,https://i.redd.it/sc4alet32x0e1.jpeg,/r/democrats/comments/1grcm2n/what_do_you_all_think_about_putins_aide_warning/,think putins aide warning trump,R
harris,Republican,Ideological Politics,205513,Editorial Board Scolds Oprah Winfrey over $1 Million Kamala Harris Payment,14,6,No,No,0,https://www.breitbart.com/entertainment/2024/11/14/chicago-tribune-editorial-board-scolds-oprah-winfrey-over-1-million-kamala-harris-payment-to-harpo-productions/,/r/Republican/comments/1greldf/editorial_board_scolds_oprah_winfrey_over_1/,editorial board scolds oprah winfrey million kamala harris payment,R
