Keyword,Subreddit,Category,Members,Title,Upvotes,Comments,Moderator Interaction,Fact-Checking Mention,Total Awards,URL,Original Post URL,processed_text,Bias
results,Wikileaks,General Politics,177628,Censored Wikileaks content?,13,7,No,No,0,https://www.reddit.com/r/WikiLeaks/comments/1frr2wq/censored_wikileaks_content/,/r/WikiLeaks/comments/1frr2wq/censored_wikileaks_content/,censored wikileaks content,N
trump,PoliticalDiscussion,General Politics,2184599,Did the plethora of state level abortion amendments neuter the impact of abortion in the presidential race?,86,149,No,No,0,https://www.reddit.com/r/PoliticalDiscussion/comments/1gonhzy/did_the_plethora_of_state_level_abortion/,/r/PoliticalDiscussion/comments/1gonhzy/did_the_plethora_of_state_level_abortion/,plethora state level abortion amendments neuter impact abortion presidential race,L
biden,PoliticalDiscussion,General Politics,2184599,"Was Trump's win driven by an anti-incumbency sentiment? or was it a successful campaign strategy? had it been the former, would picking a candidate of the same party but not in the incumbent administration have levelled the playing field?",34,153,No,No,0,https://www.reddit.com/r/PoliticalDiscussion/comments/1goqx1f/was_trumps_win_driven_by_an_antiincumbency/,/r/PoliticalDiscussion/comments/1goqx1f/was_trumps_win_driven_by_an_antiincumbency/,trumps win driven antiincumbency sentiment successful campaign strategy former would picking candidate party incumbent administration levelled playing field,N
president,PoliticalDiscussion,General Politics,2184599,"If the 22nd Amendment had never been ratified, who would have been the first person since FDR to successfully run for a third term?",5,6,No,No,0,https://www.reddit.com/r/PoliticalDiscussion/comments/1goyi3t/if_the_22nd_amendment_had_never_been_ratified_who/,/r/PoliticalDiscussion/comments/1goyi3t/if_the_22nd_amendment_had_never_been_ratified_who/,nd amendment never ratified would first person since fdr successfully run third term,N
biden,PoliticalDiscussion,General Politics,2184599,How does the world deal with the schizophrenic foreign policy that America has? ,372,342,No,No,0,https://www.reddit.com/r/PoliticalDiscussion/comments/1go363q/how_does_the_world_deal_with_the_schizophrenic/,/r/PoliticalDiscussion/comments/1go363q/how_does_the_world_deal_with_the_schizophrenic/,world deal schizophrenic foreign policy america,L
trump,PoliticalDiscussion,General Politics,2184599,Birthright citizenship. ,50,207,No,No,0,https://www.reddit.com/r/PoliticalDiscussion/comments/1gogkpp/birthright_citizenship/,/r/PoliticalDiscussion/comments/1gogkpp/birthright_citizenship/,birthright citizenship,L
trump,PoliticalDiscussion,General Politics,2184599,"Some say: ""The Resistance is about to Ignite."" Referencing State Actors, such as Governors and AGs, Federal Courts, the Press and the Educators and Civil Society [the People.] Are those guardrails still there to thwart attempts by Trump to usurp the Constitution?",294,378,No,No,0,https://www.reddit.com/r/PoliticalDiscussion/comments/1gnmmyw/some_say_the_resistance_is_about_to_ignite/,/r/PoliticalDiscussion/comments/1gnmmyw/some_say_the_resistance_is_about_to_ignite/,say resistance ignite referencing state actors governors ags federal courts press educators civil society people guardrails still thwart attempts trump usurp constitution,L
biden,PoliticalDiscussion,General Politics,2184599,What are your thoughts on a purge of senior military by the incoming Trump administration?,564,511,No,Yes,0,https://www.reddit.com/r/PoliticalDiscussion/comments/1gnesig/what_are_your_thoughts_on_a_purge_of_senior/,/r/PoliticalDiscussion/comments/1gnesig/what_are_your_thoughts_on_a_purge_of_senior/,thoughts purge senior military incoming trump administration,N
trump,PoliticalDiscussion,General Politics,2184599,"If Marco Rubio gets picked as Secretary of State, who would Gov. DeSantis appoint to replace him in the U.S. Senate? And would he do a caretaker appt. or a strong appointee given how tough midterms will be?",1,5,No,Yes,0,https://www.reddit.com/r/PoliticalDiscussion/comments/1goi1av/if_marco_rubio_gets_picked_as_secretary_of_state/,/r/PoliticalDiscussion/comments/1goi1av/if_marco_rubio_gets_picked_as_secretary_of_state/,marco rubio gets picked secretary state would gov desantis appoint replace us senate would caretaker appt strong appointee given tough midterms,N
trump,PoliticalDiscussion,General Politics,2184599,How much more loyal are Congress Republicans compared to Trump's first term?,8,22,No,Yes,0,https://www.reddit.com/r/PoliticalDiscussion/comments/1go0b6f/how_much_more_loyal_are_congress_republicans/,/r/PoliticalDiscussion/comments/1go0b6f/how_much_more_loyal_are_congress_republicans/,much loyal congress republicans compared trumps first term,L
president,PoliticalDiscussion,General Politics,2184599,What happened to landslide victories?,1,5,No,No,0,https://www.reddit.com/r/PoliticalDiscussion/comments/1goeeuk/what_happened_to_landslide_victories/,/r/PoliticalDiscussion/comments/1goeeuk/what_happened_to_landslide_victories/,happened landslide victories,N
results,NeutralPolitics,General Politics,610490,What to expect after the U.S. election,282,26,Yes,Yes,0,https://www.reddit.com/r/NeutralPolitics/comments/1gflxpk/what_to_expect_after_the_us_election/,/r/NeutralPolitics/comments/1gflxpk/what_to_expect_after_the_us_election/,expect us election,N
results,NeutralPolitics,General Politics,610490,Trump won the presidency and popular vote running on the mass deportation of illegal aliens. Who saw this coming and what lessons can be learned?,169,302,No,No,0,https://www.reddit.com/r/NeutralPolitics/comments/1gnk7ih/trump_won_the_presidency_and_popular_vote_running/,/r/NeutralPolitics/comments/1gnk7ih/trump_won_the_presidency_and_popular_vote_running/,trump presidency popular vote running mass deportation illegal aliens saw coming lessons learned,L
results,NeutralPolitics,General Politics,610490,Is now the time for a NEW moderate third party in U.S. politics?,0,68,No,No,0,https://www.reddit.com/r/NeutralPolitics/comments/1gms9so/is_now_the_time_for_a_new_moderate_third_party_in/,/r/NeutralPolitics/comments/1gms9so/is_now_the_time_for_a_new_moderate_third_party_in/,time new moderate third party us politics,N
harris,NeutralPolitics,General Politics,610490,Why Are So Many Men Leaving The Democratic Party Over The Last Few Years?,376,156,No,No,0,https://www.reddit.com/r/NeutralPolitics/comments/1gklb9t/why_are_so_many_men_leaving_the_democratic_party/,/r/NeutralPolitics/comments/1gklb9t/why_are_so_many_men_leaving_the_democratic_party/,many men leaving democratic party last years,R
trump,NeutralPolitics,General Politics,610490,What plans about trump and kamala have on section 8 housing and dept of edu.,1,11,No,No,0,https://www.reddit.com/r/NeutralPolitics/comments/1gk1emp/what_plans_about_trump_and_kamala_have_on_section/,/r/NeutralPolitics/comments/1gk1emp/what_plans_about_trump_and_kamala_have_on_section/,plans trump kamala section housing dept edu,N
outcome,NeutralPolitics,General Politics,610490,"What are the pros and cons of predictive election models, like 538, for our discourse around elections?",38,94,No,No,0,https://www.reddit.com/r/NeutralPolitics/comments/1giqib5/what_are_the_pros_and_cons_of_predictive_election/,/r/NeutralPolitics/comments/1giqib5/what_are_the_pros_and_cons_of_predictive_election/,pros cons predictive election models like discourse around elections,N
harris,NeutralPolitics,General Politics,610490,How do the Trump and Harris plans for workforce pay and taxes compare?,3,6,No,No,0,https://www.reddit.com/r/NeutralPolitics/comments/1ggxh8w/how_do_the_trump_and_harris_plans_for_workforce/,/r/NeutralPolitics/comments/1ggxh8w/how_do_the_trump_and_harris_plans_for_workforce/,trump harris plans workforce pay taxes compare,N
fraud,NeutralPolitics,General Politics,610490,Has there been any investigative journalism or public legal discovery to examine process irregularities regarding the 2020 election?,11,15,No,No,0,https://www.reddit.com/r/NeutralPolitics/comments/1ggkpzr/has_there_been_any_investigative_journalism_or/,/r/NeutralPolitics/comments/1ggkpzr/has_there_been_any_investigative_journalism_or/,investigative journalism public legal discovery examine process irregularities regarding election,R
outcome,NeutralPolitics,General Politics,610490,"War involving Israel, Lebanon, and Iran--Motivations? Scale of Conflict?",15,6,No,No,0,https://www.reddit.com/r/NeutralPolitics/comments/1ge5sct/war_involving_israel_lebanon_and_iranmotivations/,/r/NeutralPolitics/comments/1ge5sct/war_involving_israel_lebanon_and_iranmotivations/,war involving israel lebanon iranmotivations scale conflict,N
results,NeutralPolitics,General Politics,610490,Military coup in Niger (2023-2024) and relationships with western countries/companies ,45,5,No,No,0,https://www.reddit.com/r/NeutralPolitics/comments/1gdv0aw/military_coup_in_niger_20232024_and_relationships/,/r/NeutralPolitics/comments/1gdv0aw/military_coup_in_niger_20232024_and_relationships/,military coup niger relationships western countriescompanies,N
trump,moderatepolitics,General Politics,296047,Trump wins biggest popular vote count by a Republican ever in history,144,232,No,No,0,https://nypost.com/2024/11/10/us-news/donald-trump-wins-most-popular-votes-by-a-republican-ever/,/r/moderatepolitics/comments/1gowcyo/trump_wins_biggest_popular_vote_count_by_a/,trump wins biggest popular vote count republican ever history,L
loss,moderatepolitics,General Politics,296047,Homeward bound: Tim Walz returns to Minnesota after election loss,135,178,No,No,0,https://www.usatoday.com/story/news/politics/elections/2024/11/06/tim-walz-loses-election/75719431007/,/r/moderatepolitics/comments/1gotdz8/homeward_bound_tim_walz_returns_to_minnesota/,homeward bound tim walz returns minnesota election loss,N
trump,moderatepolitics,General Politics,296047,Trump chooses New York Rep. Elise Stefanik as ambassador to United Nations,93,61,No,No,0,https://apnews.com/article/trump-united-nations-elise-stefanik-ambassador-2b482fb39a8d6f03d389d27cc8820056,/r/moderatepolitics/comments/1goui4f/trump_chooses_new_york_rep_elise_stefanik_as/,trump chooses new york rep elise stefanik ambassador united nations,N
trump,moderatepolitics,General Politics,296047,Trump says former Ice director Tom Homan will be in charge of borders and deportations,193,407,No,No,0,https://amp.theguardian.com/us-news/2024/nov/11/tom-homan-donald-trump-border-czar-immigration,/r/moderatepolitics/comments/1gop6wi/trump_says_former_ice_director_tom_homan_will_be/,trump says former ice director tom homan charge borders deportations,N
trump,moderatepolitics,General Politics,296047,What Donald Trump's 'concealed carry reciprocity' means for gun rights,64,130,No,No,0,https://www.newsweek.com/donald-trump-concealed-carry-reciprocity-1983740,/r/moderatepolitics/comments/1gov5qt/what_donald_trumps_concealed_carry_reciprocity/,donald trumps concealed carry reciprocity means gun rights,N
trump,moderatepolitics,General Politics,296047,Trump Told Putin Not to Escalate Ukraine War in Post-Election Call – Washington Post - The Moscow Times,209,376,No,No,0,https://www.themoscowtimes.com/2024/11/10/trump-told-putin-not-to-escalate-ukraine-war-in-post-election-call-washington-post-a86973,/r/moderatepolitics/comments/1goakc0/trump_told_putin_not_to_escalate_ukraine_war_in/,trump told putin escalate ukraine war postelection call washington post moscow times,N
harris,moderatepolitics,General Politics,296047,Harris campaign reportedly spent 6 figures on ‘Call Her Daddy’ podcast with fewer than 1 million YouTube views,542,545,No,No,0,https://www.msn.com/en-us/news/politics/harris-campaign-reportedly-spent-6-figures-on-call-her-daddy-podcast-with-fewer-than-1-million-youtube-views/ar-AA1tLAPk,/r/moderatepolitics/comments/1go1lnt/harris_campaign_reportedly_spent_6_figures_on/,harris campaign reportedly spent figures call daddy podcast fewer million youtube views,N
harris,moderatepolitics,General Politics,296047,Harris Raised $1 Billion. Where Did it All Go?,455,519,No,No,0,https://newrepublic.com/post/188216/kamala-harris-campaign-billion-fundraising,/r/moderatepolitics/comments/1go1apl/harris_raised_1_billion_where_did_it_all_go/,harris raised billion go,R
loss,moderatepolitics,General Politics,296047,Pelosi blames Harris' loss on Biden's late exit and no open Democratic primary,243,329,No,No,0,https://abcnews.go.com/Politics/pelosi-blames-harris-loss-bidens-late-exit-open/story?id=115652125,/r/moderatepolitics/comments/1gnuzdu/pelosi_blames_harris_loss_on_bidens_late_exit_and/,pelosi blames harris loss bidens late exit open democratic primary,L
bernie,moderatepolitics,General Politics,296047,Nancy Pelosi slams Bernie Sanders for comments about Democrats abandoning working class amid party blame game,259,431,No,No,0,https://www.the-independent.com/news/world/americas/us-politics/nancy-pelosi-bernie-sanders-democrats-election-biden-b2644295.html,/r/moderatepolitics/comments/1gnumsr/nancy_pelosi_slams_bernie_sanders_for_comments/,nancy pelosi slams bernie sanders comments democrats abandoning working class amid party blame game,R
trump,moderatepolitics,General Politics,296047,"Trump announces former WH officials Nikki Haley, Mike Pompeo will not be in his next administration",422,287,No,No,0,https://nypost.com/2024/11/09/us-news/trump-announces-former-wh-officials-nikki-haley-mike-pompeo-will-not-be-in-his-next-administration/,/r/moderatepolitics/comments/1gnnpqq/trump_announces_former_wh_officials_nikki_haley/,trump announces former wh officials nikki haley mike pompeo next administration,N
trump,moderatepolitics,General Politics,296047,FEMA Employee Fired For Directing Relief Workers Away From Trump Supporters,305,165,No,No,0,https://evrimagaci.org/tpg/fema-employee-fired-for-directing-relief-workers-away-from-trump-supporters-52779,/r/moderatepolitics/comments/1gnn3nt/fema_employee_fired_for_directing_relief_workers/,fema employee fired directing relief workers away trump supporters,N
vance,moderatepolitics,General Politics,296047,JD Vance says US could drop support for NATO if Europe tries to regulate Elon Musk’s platforms,231,383,No,No,0,https://www.independent.co.uk/news/world/americas/us-politics/jd-vance-elon-musk-x-twitter-donald-trump-b2614525.html,/r/moderatepolitics/comments/1gnhb1q/jd_vance_says_us_could_drop_support_for_nato_if/,jd vance says us could drop support nato europe tries regulate elon musks platforms,R
results,democrats,Ideological Politics,480447,You were cheated out of a free and fair democratic election. Everyday up until election day.,502,57,No,Yes,0,https://i.redd.it/da3t9ximz90e1.jpeg,/r/democrats/comments/1goscrp/you_were_cheated_out_of_a_free_and_fair/,cheated free fair democratic election everyday election day,L
trump,democrats,Ideological Politics,480447,Trump expected to announce Stephen Miller as deputy chief of staff for policy,121,46,No,No,0,https://www.cnn.com/2024/11/11/politics/stephen-miller-trump-administration/index.html,/r/democrats/comments/1gowpwk/trump_expected_to_announce_stephen_miller_as/,trump expected announce stephen miller deputy chief staff policy,N
trump,democrats,Ideological Politics,480447,"Holy shit: Trump voter says, 'I consider him like Hitler, but I voted for the man.'",60,14,No,No,0,https://i.redd.it/1s6mp3jp6b0e1.jpeg,/r/democrats/comments/1goy1rb/holy_shit_trump_voter_says_i_consider_him_like/,holy shit trump voter says consider like hitler voted man,R
results,democrats,Ideological Politics,480447,Happy Veteran's Day,94,14,No,No,0,https://i.redd.it/c7ls06gc7a0e1.jpeg,/r/democrats/comments/1got92r/happy_veterans_day/,happy veterans day,N
recount,democrats,Ideological Politics,480447,Is a recount happening??,468,149,No,No,0,https://i.redd.it/hho61t0eh70e1.jpeg,/r/democrats/comments/1goknyq/is_a_recount_happening/,recount happening,L
trump,democrats,Ideological Politics,480447,Trump Defending PDFiles over the years,42,3,No,No,0,https://v.redd.it/n8z99oioya0e1,/r/democrats/comments/1gowuui/trump_defending_pdfiles_over_the_years/,trump defending pdfiles years,R
biden,democrats,Ideological Politics,480447,Former Kamala Harris aide suggests Biden should resign so she can be the 47th president …,790,344,No,No,0,https://www.usatoday.com/story/news/politics/elections/2024/11/10/jamal-simmons-joe-biden-kamala-harris/76182658007/,/r/democrats/comments/1goe6qf/former_kamala_harris_aide_suggests_biden_should/,former kamala harris aide suggests biden resign th president,R
harris,democrats,Ideological Politics,480447,Why this Latino Harris voter says he's 'happy' Trump won,347,153,No,No,0,https://www.msnbc.com/top-stories/latest/latino-voters-trump-harris-win-rcna179359,/r/democrats/comments/1goiru5/why_this_latino_harris_voter_says_hes_happy_trump/,latino harris voter says hes happy trump,R
results,Republican,Ideological Politics,205055,Democrats denying the election results part III,374,100,No,No,0,https://www.reddit.com/gallery/1gooevo,/r/Republican/comments/1gooevo/democrats_denying_the_election_results_part_iii/,democrats denying election results part iii,L
trump,Republican,Ideological Politics,205055,How Is this Ok ? ,88,20,No,No,0,https://www.reddit.com/gallery/1gowak2,/r/Republican/comments/1gowak2/how_is_this_ok/,ok,N
trump,Republican,Ideological Politics,205055,FEMA Fires Official Who Ordered Workers to Skip Hurricane-Ravaged Homes With Trump Signs 👍,94,14,No,No,0,https://townhall.com/tipsheet/mattvespa/2024/11/11/fema-fires-official-who-ordered-workers-to-skip-hurricane-ravaged-homes-with-trump-signs-n2647555,/r/Republican/comments/1gow1nw/fema_fires_official_who_ordered_workers_to_skip/,fema fires official ordered workers skip hurricaneravaged homes trump signs,N
trump,Republican,Ideological Politics,205055,FBI brass 'stunned' and 'shell-shocked' over Donald Trump reelection,32,14,No,No,0,https://www.washingtontimes.com/news/2024/nov/7/fbi-brass-stunned-shell-shocked-donald-trump-reele/,/r/Republican/comments/1govr6b/fbi_brass_stunned_and_shellshocked_over_donald/,fbi brass stunned shellshocked donald trump reelection,N
trump,Republican,Ideological Politics,205055,Elise Stefanik Named U.S. Ambassador to the UN as Trump Assembles New Administration,40,1,No,No,0,https://m10news.com/elise-stefanik-named-u-s-ambassador-to-the-un-as-trump-assembles-new-administration/,/r/Republican/comments/1gosgsn/elise_stefanik_named_us_ambassador_to_the_un_as/,elise stefanik named us ambassador un trump assembles new administration,N
electoral,Republican,Ideological Politics,205055,This Election Shows Why The Electoral College Is A Genius Idea,180,44,No,No,0,https://issuesinsights.com/2024/11/11/this-election-shows-why-the-electoral-college-is-a-genius-idea/,/r/Republican/comments/1gol4j3/this_election_shows_why_the_electoral_college_is/,election shows electoral college genius idea,N
trump,Republican,Ideological Politics,205055,Trump appoints UN ambassador Elise Stefanik and border tsar Tom Homan,54,9,No,No,0,https://www.bbc.com/news/articles/c079m9mxx1no,/r/Republican/comments/1goqnt1/trump_appoints_un_ambassador_elise_stefanik_and/,trump appoints un ambassador elise stefanik border tsar tom homan,N
president,Republican,Ideological Politics,205055,I love this! We definitely picked right person as president!,498,74,No,No,0,https://x.com/RobertKennedyJr/status/1855346782433398956,/r/Republican/comments/1god3oy/i_love_this_we_definitely_picked_right_person_as/,love definitely picked right person president,R
harris,Republican,Ideological Politics,205055,2024 The Ultimate Uno Reverse Card,152,63,No,No,0,https://www.reddit.com/gallery/1goj69a,/r/Republican/comments/1goj69a/2024_the_ultimate_uno_reverse_card/,ultimate uno reverse card,R
trump,Republican,Ideological Politics,205055,Donald Trump names Tom Homan ‘border czar’,106,13,No,No,0,https://www.newsnationnow.com/politics/donald-trump-names-tom-homan-border-czar/,/r/Republican/comments/1goku77/donald_trump_names_tom_homan_border_czar/,donald trump names tom homan border czar,N
senate,Republican,Ideological Politics,205055,@VaughnHillyard - Kari Lake calls for @AZGOP Chair Jeff DeWit to resign after release of audio in which he can be heard bribing Lake to not run for the U.S. Senate in exchange for a potential job (and its salary): Video,92,10,No,No,0,https://x.com/VaughnHillyard/status/1749976071611580646,/r/Republican/comments/1goihst/vaughnhillyard_kari_lake_calls_for_azgop_chair/,vaughnhillyard kari lake calls azgop chair jeff dewit resign release audio heard bribing lake run us senate exchange potential job salary video,N
trump,Conservative,Ideological Politics,1144778,"Don’t stand in the way of my cabinet picks, Trump tells Senate",542,19,No,No,0,https://i.redd.it/doukarvi0a0e1.jpeg,/r/Conservative/comments/1gosgcm/dont_stand_in_the_way_of_my_cabinet_picks_trump/,dont stand way cabinet picks trump tells senate,N
victory,Conservative,Ideological Politics,1144778,"Obama Is ‘Nervous About His Legacy’ After Trump Victory, Biographer Says",507,237,No,No,0,https://www.dailywire.com/news/obama-is-nervous-about-his-legacy-after-trump-victory-biographer-says,/r/Conservative/comments/1gosbfm/obama_is_nervous_about_his_legacy_after_trump/,obama nervous legacy trump victory biographer says,R
trump,Conservative,Ideological Politics,1144778,Trump announces Tom Homan to be his Border Czar ,2548,719,No,No,0,https://i.redd.it/9iotu0otc70e1.jpeg,/r/Conservative/comments/1gok7lq/trump_announces_tom_homan_to_be_his_border_czar/,trump announces tom homan border czar,N
trump,Conservative,Ideological Politics,1144778,President-Elect Trump Announces Push for National Concealed Carry Reciprocity,434,57,No,No,0,https://www.breitbart.com/2nd-amendment/2024/11/11/president-elect-trump-announces-push-for-national-concealed-carry-reciprocity/,/r/Conservative/comments/1gos0hs/presidentelect_trump_announces_push_for_national/,presidentelect trump announces push national concealed carry reciprocity,N
trump,Conservative,Ideological Politics,1144778,EXCLUSIVE: Senator Demands Mayorkas Answer Over FEMA Employee Guidance To Skip Trump Homes,232,31,No,No,0,https://www.dailywire.com/news/exclusive-senator-demands-mayorkas-answer-over-fema-employee-guidance-to-skip-trump-homes,/r/Conservative/comments/1govg1p/exclusive_senator_demands_mayorkas_answer_over/,exclusive senator demands mayorkas answer fema employee guidance skip trump homes,N
biden,Conservative,Ideological Politics,1144778,Muh Democratcy: Former Harris Aide Calls for Biden to Resign to Make Kamala President,296,79,No,No,0,https://hotair.com/ed-morrissey/2024/11/11/muh-democratcy-former-harris-aide-calls-for-biden-to-resign-to-make-kamala-president-n3796875,/r/Conservative/comments/1gosuhi/muh_democratcy_former_harris_aide_calls_for_biden/,muh democratcy former harris aide calls biden resign make kamala president,R
harris,Conservative,Ideological Politics,1144778,Taliban Official Mocks US for Rejecting Kamala Harris: 'Americans Are Not Ready to Hand Over' Country 'to a Woman',265,76,No,No,0,https://www.latintimes.com/taliban-official-mocks-us-rejecting-kamala-harris-americans-are-not-ready-hand-over-country-565083,/r/Conservative/comments/1goth3e/taliban_official_mocks_us_for_rejecting_kamala/,taliban official mocks us rejecting kamala harris americans ready hand country woman,R
harris,Conservative,Ideological Politics,1144778,"Harris. Kamala, Harris. 007",2615,38,No,No,0,https://i.redd.it/6r3rvbuga60e1.jpeg,/r/Conservative/comments/1gog91w/harris_kamala_harris_007/,harris kamala harris,I
trump,Conservative,Ideological Politics,1144778,Donald Trump wins most popular votes by a Republican ever,2309,199,No,No,0,https://nypost.com/2024/11/10/us-news/donald-trump-wins-most-popular-votes-by-a-republican-ever/,/r/Conservative/comments/1gog5uk/donald_trump_wins_most_popular_votes_by_a/,donald trump wins popular votes republican ever,R
vance,Conservative,Ideological Politics,1144778,"JD Vance, First Marine to Become Vice President, Wishes Fellow Marines Happy Birthday",2297,44,No,No,0,https://www.breitbart.com/politics/2024/11/10/jd-vance-first-marine-to-become-vice-president-wishes-fellow-marines-happy-birthday/,/r/Conservative/comments/1gof96i/jd_vance_first_marine_to_become_vice_president/,jd vance first marine become vice president wishes fellow marines happy birthday,N
biden,Libertarian,Ideological Politics,503611,Can someone explain how Tariffs will be good for the economy?,15,21,No,No,0,https://www.reddit.com/r/Libertarian/comments/1gorx9d/can_someone_explain_how_tariffs_will_be_good_for/,/r/Libertarian/comments/1gorx9d/can_someone_explain_how_tariffs_will_be_good_for/,someone explain tariffs good economy,N
biden,Libertarian,Ideological Politics,503611,This can't be real..,306,53,No,Yes,0,https://youtu.be/c4jxUSq-MV8?si=MR5vdh93PChAyrQK,/r/Libertarian/comments/1gnsyb2/this_cant_be_real/,cant real,N
biden,Anarchism,Ideological Politics,270974,"Im a disabled person, and im begging you to get informed about covid.",111,30,No,No,0,https://www.reddit.com/r/Anarchism/comments/1goj9ja/im_a_disabled_person_and_im_begging_you_to_get/,/r/Anarchism/comments/1goj9ja/im_a_disabled_person_and_im_begging_you_to_get/,im disabled person im begging get informed covid,L
vance,Anarchism,Ideological Politics,270974,DIY Digital Community Library--Advice Needed,7,1,No,No,0,https://www.reddit.com/r/Anarchism/comments/1gor9da/diy_digital_community_libraryadvice_needed/,/r/Anarchism/comments/1gor9da/diy_digital_community_libraryadvice_needed/,diy digital community libraryadvice needed,N
