Keyword,Subreddit,Category,Members,Title,Upvotes,Comments,Moderator Interaction,Fact-Checking Mention,Total Awards,URL,Original Post URL,processed_text,Bias
trump,democrats,Ideological Politics,480477,Saw this yesterday ,30,23,No,No,0,https://i.redd.it/10mmg5e4wb0e1.jpeg,/r/democrats/comments/1gp1kbk/saw_this_yesterday/,saw yesterday,N
president,Republican,Ideological Politics,205080,When you thought Joe was bad,15,6,No,No,0,https://x.com/elonmusk/status/1856021153359286325?t=jF-bQyWOXZWaymqYBUyz8A&s=34,/r/Republican/comments/1gp10hf/when_you_thought_joe_was_bad/,thought joe bad,N
trump,Conservative,Ideological Politics,1144890,President-elect Trump selects Lee Zeldin to run the Environmental Protection Agency (EPA),172,38,No,No,0,https://i.redd.it/7by8uc7xzb0e1.jpeg,/r/Conservative/comments/1gp23ov/presidentelect_trump_selects_lee_zeldin_to_run/,presidentelect trump selects lee zeldin run environmental protection agency epa,N
trump,Conservatives,Ideological Politics,108232,Donald Trump Made The GOP Cool Again,11,0,No,No,0,https://thefederalist.com/2024/11/11/donald-trump-made-the-gop-cool-again/,/r/conservatives/comments/1gp25h5/donald_trump_made_the_gop_cool_again/,donald trump made gop cool,N
victory,Conservatives,Ideological Politics,108232,"Despite Dem Suppression, Helene-Hit NC Lifted Trump To Victory",7,4,No,No,0,https://thefederalist.com/2024/11/11/despite-dem-voter-suppression-efforts-helene-stricken-western-n-c-cast-even-more-trump-votes-in-2024/,/r/conservatives/comments/1gp1hj7/despite_dem_suppression_helenehit_nc_lifted_trump/,despite dem suppression helenehit nc lifted trump victory,N
vote,Libertarian,Ideological Politics,503620,What do we do?,7,17,No,No,0,https://www.reddit.com/r/Libertarian/comments/1gp24tr/what_do_we_do/,/r/Libertarian/comments/1gp24tr/what_do_we_do/,,N
china,Socialism,Ideological Politics,460759,"A Summary of Xi Jinping's Governance of China I-IV
",3,1,No,No,0,https://www.youtube.com/watch?v=llTZ-drTvSY,/r/socialism/comments/1gp16rs/a_summary_of_xi_jinpings_governance_of_china_iiv/,summary xi jinpings governance china iiv,N
border,News,General Politics,28914651,"Fire at New Jersey-New York border still uncontrolled after burning over 2,500 acres",50,1,No,No,0,https://abcnews.go.com/US/wildfire-new-jersey-new-york-border-zero-percent-containment/story?id=115713454,/r/news/comments/1gp2tj6/fire_at_new_jerseynew_york_border_still/,fire new jerseynew york border still uncontrolled burning acres,N
president,Libertarian,Ideological Politics,503617,Living in a very pro-Zionist area and unable to express my feelings on the topic out of fear of losing work and punishment at school.,0,5,No,No,0,https://www.reddit.com/r/Libertarian/comments/1gp40z6/living_in_a_very_prozionist_area_and_unable_to/,/r/Libertarian/comments/1gp40z6/living_in_a_very_prozionist_area_and_unable_to/,living prozionist area unable express feelings topic fear losing work punishment school,N
harris,Conservatives,Ideological Politics,108232,Report: Kamala Harris’s Campaign Keeps Badgering Donors for Cash,8,1,No,No,0,https://www.breitbart.com/2024-election/2024/11/11/kamala-harriss-campaign-keeps-badgering-donors-cash/,/r/conservatives/comments/1gp3p5b/report_kamala_harriss_campaign_keeps_badgering/,report kamala harriss campaign keeps badgering donors cash,N
vote,democrats,Ideological Politics,480478,Can’t believe some vets voted for him. ,248,18,No,No,0,https://i.redd.it/v8zgrbrj8c0e1.jpeg,/r/democrats/comments/1gp3b0k/cant_believe_some_vets_voted_for_him/,cant believe vets voted,N
ai,News,General Politics,28914952,Haiti: Airlines suspend flights as Spirit plane hit by gunfire,464,37,No,No,0,https://www.bbc.com/news/articles/cy9jpnl3j5wo,/r/news/comments/1gp3zw2/haiti_airlines_suspend_flights_as_spirit_plane/,haiti airlines suspend flights spirit plane hit gunfire,N
harris,moderatepolitics,General Politics,296070,Carville: Harris had ‘every advantage’ in the race,36,30,No,No,0,https://thehill.com/homenews/campaign/4983934-carville-harris-presidential-campaign/,/r/moderatepolitics/comments/1gp4yrc/carville_harris_had_every_advantage_in_the_race/,carville harris every advantage race,L
trump,moderatepolitics,General Politics,296070,Trump taps former Rep. Lee Zeldin to lead the Environmental Protection Agency,23,9,No,No,0,https://www.nbcnews.com/politics/donald-trump/trump-taps-lee-zeldin-lead-environmental-protection-agency-rcna179658,/r/moderatepolitics/comments/1gp58af/trump_taps_former_rep_lee_zeldin_to_lead_the/,trump taps former rep lee zeldin lead environmental protection agency,N
house,technology,General Politics,17385514,U.S. Advocates Urge White House Support for 'RISE' Initiative to Keep U.S. Ahead in 'Edge Science' - The Debrief,106,23,No,No,0,https://thedebrief.org/u-s-advocates-urge-white-house-support-for-rise-initiative-to-keep-u-s-ahead-in-edge-science/,/r/technology/comments/1gp0pbp/us_advocates_urge_white_house_support_for_rise/,us advocates urge white house support rise initiative keep us ahead edge science debrief,N
trump,Republican,Ideological Politics,205097,Trump picks Lee Zeldin to lead EPA — adding second NYer to cabinet,10,1,No,No,0,https://nypost.com/2024/11/11/us-news/trump-picks-lee-zeldin-to-lead-epa-adding-second-nyer-to-cabinet/,/r/Republican/comments/1gp4zzf/trump_picks_lee_zeldin_to_lead_epa_adding_second/,trump picks lee zeldin lead epa adding second nyer cabinet,N
harris,Conservative,Ideological Politics,1144953,Progressive billionaire Mark Cuban deletes his tweets supporting Kamala Harris,295,41,No,No,0,https://www.dailymail.co.uk/news/article-14069907/mark-cuban-deletes-tweets-supporting-kamala-harris-trump-election-victory.html?ico=topics_pagination_desktop,/r/Conservative/comments/1gp4goy/progressive_billionaire_mark_cuban_deletes_his/,progressive billionaire mark cuban deletes tweets supporting kamala harris,R
trump,Conservative,Ideological Politics,1144953,Breaking: Trump Paid Hulk Hogan For His Appearance At The RNC With 3 Scratch-Offs And A Meatball Sub,208,24,No,No,0,https://babylonbee.com/news/breaking-trump-paid-hulk-hogan-for-his-appearance-at-the-rnc-with-3-scratch-offs-and-a-meatball-sub,/r/Conservative/comments/1gp2zil/breaking_trump_paid_hulk_hogan_for_his_appearance/,breaking trump paid hulk hogan appearance rnc scratchoffs meatball sub,R
vance,Socialism,Ideological Politics,460778,"Benjamin Norton discusses how the CIA has spent decades supporting pro-imperialist factions of the Western left, which it calls the ""compatible left"" or ""non-communist left,"" in order to advance US foreign-policy interests.",12,2,No,No,0,https://v.redd.it/v5xhp1hzkc0e1,/r/socialism/comments/1gp4zz7/benjamin_norton_discusses_how_the_cia_has_spent/,benjamin norton discusses cia spent decades supporting proimperialist factions western left calls compatible left noncommunist left order advance us foreignpolicy interests,N
trump,Socialism,Ideological Politics,460778,Congress About to Gift Trump Sweeping Powers to Crush Political Enemies,10,1,No,No,0,https://theintercept.com/2024/11/10/trump-nonprofit-tax-exempt-political-enemies/,/r/socialism/comments/1gp4ges/congress_about_to_gift_trump_sweeping_powers_to/,congress gift trump sweeping powers crush political enemies,N
harris,Conservatives,Ideological Politics,108233,Report: Kamala Harris Campaign Paid Oprah Winfrey $1 Million,16,1,No,No,0,https://www.breitbart.com/entertainment/2024/11/11/report-kamala-harris-campaign-paid-oprah-winfrey-1-million/,/r/conservatives/comments/1gp3nw2/report_kamala_harris_campaign_paid_oprah_winfrey/,report kamala harris campaign paid oprah winfrey million,R
Zelenskyy,KamalaHarris,Ideological Politics,76090,"""We are not ready to give our freedom to this F***  Terrorist"" Volodymyr Zelenskyy",10,0,No,No,0,https://youtu.be/sJgrXDjkDCo?si=7msAy6Xcgh9Wg9vi,/r/KamalaHarris/comments/1gp5w42/we_are_not_ready_to_give_our_freedom_to_this_f/,ready give freedom f terrorist volodymyr zelenskyy,N
ai,News,General Politics,28915263,Bird flu infections more widespread among US dairy workers than thought – study | US news,78,5,No,No,0,https://www.theguardian.com/us-news/2024/nov/11/us-bird-flu-dairy-workers,/r/news/comments/1goynr2/bird_flu_infections_more_widespread_among_us/,bird flu infections widespread among us dairy workers thought study us news,N
ai,PoliticalDiscussion,General Politics,2184636,How likely is Trump to convert the US to a totalitarian dictatorship?,1,1,No,No,0,https://www.reddit.com/r/PoliticalDiscussion/comments/1gp56t4/how_likely_is_trump_to_convert_the_us_to_a/,/r/PoliticalDiscussion/comments/1gp56t4/how_likely_is_trump_to_convert_the_us_to_a/,likely trump convert us totalitarian dictatorship,R
ai,Conservatives,Ideological Politics,108233,How we discovered Fauci's secret $15 million taxpayer-funded security detail,21,1,No,No,0,https://www.dossier.today/p/how-we-discovered-faucis-secret-15,/r/conservatives/comments/1gp466e/how_we_discovered_faucis_secret_15_million/,discovered faucis secret million taxpayerfunded security detail,N
trump,technology,General Politics,17385679,Trump’s techno-libertarian dream team goes to Washington,269,69,No,No,0,https://www.vox.com/technology/383859/musk-trump-vance-silicon-valley,/r/technology/comments/1gp665k/trumps_technolibertarian_dream_team_goes_to/,trumps technolibertarian dream team goes washington,L
trump,Republican,Ideological Politics,205109,"You’re welcome, America. From a group of highly educated women drs, engineers, teachers, entrepreneurs, and moms in PA, who are ethnically and racially diverse but get called nazis and uneducated. MAGA bitches! Hot moms for trump baby!",166,25,No,No,0,https://www.reddit.com/gallery/1gp6q91,/r/Republican/comments/1gp6q91/youre_welcome_america_from_a_group_of_highly/,youre welcome america group highly educated women drs engineers teachers entrepreneurs moms pa ethnically racially diverse get called nazis uneducated maga bitches hot moms trump baby,L
trump,Republican,Ideological Politics,205109,Scientific American Magazine Editor Called to Resign After Profane Anti-Trump Rant | Another One Loses Their Mind 😁,35,6,No,No,0,https://www.breitbart.com/politics/2024/11/11/scientific-american-magazine-editor-called-to-resign-after-profane-anti-trump-rant/,/r/Republican/comments/1gp5v6l/scientific_american_magazine_editor_called_to/,scientific american magazine editor called resign profane antitrump rant another one loses mind,L
trump,Conservative,Ideological Politics,1144976,Cruise line offers 4-year voyage for those wanting to leave the USA because Trump won,479,98,No,No,0,https://notthebee.com/article/cruise-line-offers-4-year-cruise-for-those-wanting-to-leave-the-us-now-that-trump-has-won,/r/Conservative/comments/1gp56gt/cruise_line_offers_4year_voyage_for_those_wanting/,cruise line offers year voyage wanting leave usa trump,N
fraud,Conservative,Ideological Politics,1144976,Apparently the left now believe in election fraud,250,63,No,No,0,https://www.reddit.com/r/Conservative/comments/1gp67if/apparently_the_left_now_believe_in_election_fraud/,/r/Conservative/comments/1gp67if/apparently_the_left_now_believe_in_election_fraud/,apparently left believe election fraud,N
results,Anarchism,Ideological Politics,271002,Seeking Community Input- A Prediction and Scenario for Analysis,1,0,No,No,0,https://www.reddit.com/r/Anarchism/comments/1gp5ol0/seeking_community_input_a_prediction_and_scenario/,/r/Anarchism/comments/1gp5ol0/seeking_community_input_a_prediction_and_scenario/,seeking community input prediction scenario analysis,N
trump,Conservatives,Ideological Politics,108232,"It’s Not Just Nick Bosa - NFL Players Unleash “Trump Dances” Across Multiple Games, and the Fans Love It (Videos)",12,1,No,No,0,https://redstatenation.com/its-not-just-nick-bosa-nfl-players-unleash-trump-dances-across-multiple-games-and-the-fans-love-it-videos/,/r/conservatives/comments/1gp4fyh/its_not_just_nick_bosa_nfl_players_unleash_trump/,nick bosa nfl players unleash trump dances across multiple games fans love videos,N
War,PoliticalDiscussion,General Politics,2184635,"How likely is it that the ACA will be repealed, as per the GOP's plans?",13,28,No,No,0,https://www.reddit.com/r/PoliticalDiscussion/comments/1gp1l4g/how_likely_is_it_that_the_aca_will_be_repealed_as/,/r/PoliticalDiscussion/comments/1gp1l4g/how_likely_is_it_that_the_aca_will_be_repealed_as/,likely aca repealed per gops plans,N
israel,Socialism,Ideological Politics,460781,Hope music is allowed,2,1,No,No,0,https://youtu.be/KEj3V4eZamI?si=72s1a_Ke27IxES5D,/r/socialism/comments/1gp6s49/hope_music_is_allowed/,hope music allowed,N
ai,Republican,Ideological Politics,205109,"I swear to God, I think I actually feel bad for the brainwashed libs at this point 🤦‍♀️ ",84,75,No,No,0,https://www.reddit.com/gallery/1gp5z0j,/r/Republican/comments/1gp5z0j/i_swear_to_god_i_think_i_actually_feel_bad_for/,swear god think actually feel bad brainwashed libs point,N
house,moderatepolitics,General Politics,296083,Decision Desk HQ projects that Republicans have won enough seats to control the US House.,48,38,No,No,0,https://decisiondeskhq.com/results/2024/General/US-House/,/r/moderatepolitics/comments/1gp80yx/decision_desk_hq_projects_that_republicans_have/,decision desk hq projects republicans enough seats control us house,N
trump,democrats,Ideological Politics,480491,Deported Veterans worry Trump will “stonewall” bill meant to bring them home,101,6,No,No,0,https://www.valleycentral.com/news/deported-veterans-worry-trump-will-stonewall-bill-meant-to-bring-them-home/,/r/democrats/comments/1gp6x0l/deported_veterans_worry_trump_will_stonewall_bill/,deported veterans worry trump stonewall bill meant bring home,R
trump,Socialism,Ideological Politics,460772,Trumps First 100 Days (Leeja Miller),2,1,No,No,0,https://www.youtube.com/watch?v=9EsFKcyMpSI,/r/socialism/comments/1gp7vmu/trumps_first_100_days_leeja_miller/,trumps first days leeja miller,L
trump,Conservatives,Ideological Politics,108231,Trump’s Border Czar Has A Plan To Stop Illegal Immigration,11,1,No,No,0,https://www.dailywire.com/news/trumps-border-czar-has-a-plan-to-stop-illegal-immigration,/r/conservatives/comments/1gp7wqj/trumps_border_czar_has_a_plan_to_stop_illegal/,trumps border czar plan stop illegal immigration,L
trump,Conservatives,Ideological Politics,108231,Cruz: ‘Serious Consequences’ Coming For Iran After Trump Murder Plot,8,1,No,No,0,https://www.dailywire.com/news/cruz-serious-consequences-coming-for-iran-after-trump-murder-plot,/r/conservatives/comments/1gp7x52/cruz_serious_consequences_coming_for_iran_after/,cruz serious consequences coming iran trump murder plot,L
trump,dailywire,Ideological Politics,24169,Another claim in which Trump was right ,4,0,No,No,0,https://v.redd.it/26hradrdcd0e1,/r/dailywire/comments/1gp8glb/another_claim_in_which_trump_was_right/,another claim trump right,R
War,Socialism,Ideological Politics,460772,Privileged Students Warned Not To Be Snobs Following Gentrification,3,1,No,No,0,https://www.bbc.co.uk/news/articles/cx2nyrr16g2o,/r/socialism/comments/1gp8g12/privileged_students_warned_not_to_be_snobs/,privileged students warned snobs following gentrification,N
trump,moderatepolitics,General Politics,296100,Trump selects Mike Waltz as national security adviser,17,10,No,No,0,https://ground.news/article/trump-selects-mike-waltz-as-national-security-adviser-source-says_a33643?utm_source=mobile-app&utm_medium=article-share,/r/moderatepolitics/comments/1gp9fq3/trump_selects_mike_waltz_as_national_security/,trump selects mike waltz national security adviser,N
trump,democrats,Ideological Politics,480504,Trump is stacking his White House with immigration hawks,100,44,No,No,0,https://www.politico.com/news/2024/11/11/donald-trump-immigration-white-house-00188845,/r/democrats/comments/1gp8ba7/trump_is_stacking_his_white_house_with/,trump stacking white house immigration hawks,R
house,Conservative,Ideological Politics,1144975,Republicans win majority of US House seats in government sweep,414,41,No,No,0,https://www.reuters.com/world/us/republicans-win-majority-us-house-seats-government-sweep-2024-11-12/,/r/Conservative/comments/1gp8hus/republicans_win_majority_of_us_house_seats_in/,republicans win majority us house seats government sweep,N
trump,Conservative,Ideological Politics,1144975,"My hope for Reddit is not completely lost, thanks to you guys",255,53,No,No,0,https://www.reddit.com/r/Conservative/comments/1gp5lys/my_hope_for_reddit_is_not_completely_lost_thanks/,/r/Conservative/comments/1gp5lys/my_hope_for_reddit_is_not_completely_lost_thanks/,hope reddit completely lost thanks guys,N
trump,Conservatives,Ideological Politics,108233,Exclusive | Trump border czar Tom Homan vows sanctuary city crackdown,25,2,No,No,0,https://nypost.com/2024/11/11/us-news/trump-border-czar-tom-homan-vows-sanctuary-city-crackdown/,/r/conservatives/comments/1gp8qsb/exclusive_trump_border_czar_tom_homan_vows/,exclusive trump border czar tom homan vows sanctuary city crackdown,N
trump,KamalaHarris,Ideological Politics,76065,"Republicans win House, delivering Trump a trifecta",11,4,No,No,0,https://thehill.com/homenews/state-watch/4974235-house-republicans-control-majority/,/r/KamalaHarris/comments/1gp9psj/republicans_win_house_delivering_trump_a_trifecta/,republicans win house delivering trump trifecta,R
trump,democrats,Ideological Politics,480514,Trump transition figure warns DOJ lawyers: Get on board or get out (but Project 2025 isn't real),110,20,No,No,0,https://www.politico.com/live-updates/2024/11/11/congress/mark-paoletta-justice-department-lawyers-00188772,/r/democrats/comments/1gp8t3h/trump_transition_figure_warns_doj_lawyers_get_on/,trump transition figure warns doj lawyers get board get project isnt real,N
trump,Republican,Ideological Politics,205110,Trump set to select Sen. Marco Rubio to serve as secretary of state in historic appointment: report,31,13,No,No,0,https://nypost.com/2024/11/11/us-news/trump-selects-sen-marco-rubio-to-serve-as-secretary-of-state-in-historic-appointment-report/,/r/Republican/comments/1gpa3g5/trump_set_to_select_sen_marco_rubio_to_serve_as/,trump set select sen marco rubio serve secretary state historic appointment report,N
house,Republican,Ideological Politics,205110,According to PJ Media Republicans Keep the House,35,8,No,No,0,https://pjmedia.com/paula-bolyard/2024/11/11/breaking-republicans-will-keep-control-of-the-house-n4933998,/r/Republican/comments/1gp9934/according_to_pj_media_republicans_keep_the_house/,according pj media republicans keep house,L
trump,Republican,Ideological Politics,205110,"Our democracy is still in danger: Head of Rasmussen Reports says that ""Trump needs to go on an Election Integrity Jihad"" There's evidence they did try to steal 2024",27,2,No,No,0,https://x.com/RealAlexJones/status/1856063710210503071,/r/Republican/comments/1gpa2ov/our_democracy_is_still_in_danger_head_of/,democracy still danger head rasmussen reports says trump needs go election integrity jihad theres evidence try steal,R
trump,Conservative,Ideological Politics,1145014,Trump selects Sen. Marco Rubio to serve as secretary of state in historic appointment: report,322,126,No,No,0,https://nypost.com/2024/11/11/us-news/trump-selects-sen-marco-rubio-to-serve-as-secretary-of-state-in-historic-appointment-report/,/r/Conservative/comments/1gp9kjv/trump_selects_sen_marco_rubio_to_serve_as/,trump selects sen marco rubio serve secretary state historic appointment report,N
house,Conservative,Ideological Politics,1145014,GOP HOLDS THE HOUSE ,209,16,No,No,0,https://i.redd.it/gwqrgz58od0e1.jpeg,/r/Conservative/comments/1gp9svx/gop_holds_the_house/,gop holds house,L
vote,Socialism,Ideological Politics,460783,Best Socialist org in the USA to join?,15,11,No,No,0,https://www.reddit.com/r/socialism/comments/1gpabtf/best_socialist_org_in_the_usa_to_join/,/r/socialism/comments/1gpabtf/best_socialist_org_in_the_usa_to_join/,best socialist org usa join,N
War,Libertarian,Ideological Politics,503618,Education and religion,8,2,No,No,0,https://www.reddit.com/r/Libertarian/comments/1gpa2dv/education_and_religion/,/r/Libertarian/comments/1gpa2dv/education_and_religion/,education religion,N
trump,moderatepolitics,General Politics,296114,"Trump expected to tap US Senator Marco Rubio for secretary of state, sources say",48,52,No,No,0,https://www.reuters.com/world/us/trump-taps-us-senator-marco-rubio-secretary-state-2024-11-12/,/r/moderatepolitics/comments/1gpbb2f/trump_expected_to_tap_us_senator_marco_rubio_for/,trump expected tap us senator marco rubio secretary state sources say,L
trump,technology,General Politics,17385892,Trump Already Preparing to Load Up Government with Pro-Crypto Officials,220,45,No,No,0,https://gizmodo.com/trump-already-preparing-to-load-up-government-with-pro-crypto-officials-2000523234,/r/technology/comments/1gpasi8/trump_already_preparing_to_load_up_government/,trump already preparing load government procrypto officials,N
trump,Conservative,Ideological Politics,1145044,"Trump’s back, Jerry ",204,1,No,No,0,https://i.redd.it/a4gm5z03od0e1.jpeg,/r/Conservative/comments/1gp9s8s/trumps_back_jerry/,trumps back jerry,L
biden,Conservatives,Ideological Politics,108234,"Melania Trump declines to meet with Jill Biden at White House, citing Mar-a-Lago raid: source",79,7,No,No,0,https://nypost.com/2024/11/11/us-news/melania-trump-declines-to-meet-with-jill-biden-at-white-house-citing-mar-a-lago-raid-source/,/r/conservatives/comments/1gpaxk5/melania_trump_declines_to_meet_with_jill_biden_at/,melania trump declines meet jill biden white house citing maralago raid source,L
latino,dailywire,Ideological Politics,24177,"I’m a Latino, I’m legal, I follow the Law. This guy is talking a Lot of BS",8,9,No,No,0,https://v.redd.it/d90m6cxd6e0e1,/r/dailywire/comments/1gpbrqh/im_a_latino_im_legal_i_follow_the_law_this_guy_is/,im latino im legal follow law guy talking lot bs,L
economy,Republican,Ideological Politics,205114,Sad: Candidate Who Bankrupted Campaign Will Never Have Opportunity To Fix Nation’s Economy,20,4,No,No,0,https://babylonbee.com/news/sad-candidate-who-bankrupted-campaign-account-will-never-have-opportunity-to-fix-nations-economy,/r/Republican/comments/1gpaxop/sad_candidate_who_bankrupted_campaign_will_never/,sad candidate bankrupted campaign never opportunity fix nations economy,N
biden,democrats,Ideological Politics,480513,Biden needs to order an immediate audit of all starlink sats.,116,16,No,No,0,https://i.redd.it/lo3z8uvl2e0e1.jpeg,/r/democrats/comments/1gpbdjd/biden_needs_to_order_an_immediate_audit_of_all/,biden needs order immediate audit starlink sats,N
prices,Libertarian,Ideological Politics,503625,How would emergency healthcare work in a purely free market?,3,11,No,No,0,https://www.reddit.com/r/Libertarian/comments/1gpc8bc/how_would_emergency_healthcare_work_in_a_purely/,/r/Libertarian/comments/1gpc8bc/how_would_emergency_healthcare_work_in_a_purely/,would emergency healthcare work purely free market,N
ai,Libertarian,Ideological Politics,503625,Is this true? I'm taking this with a grain of salt since this article was written by a Fascist ,1,0,No,Yes,0,https://i.redd.it/m1v9h1czhe0e1.png,/r/Libertarian/comments/1gpcywb/is_this_true_im_taking_this_with_a_grain_of_salt/,true im taking grain salt since article written fascist,N
senate,moderatepolitics,General Politics,296126,Dem Rep Ruben Gallego beats Kari Lake in battle for Arizona Senate seat,28,10,No,No,0,https://www.foxnews.com/politics/dem-rep-ruben-gallego-beats-kari-lake-battle-arizona-senate-seat,/r/moderatepolitics/comments/1gpdig0/dem_rep_ruben_gallego_beats_kari_lake_in_battle/,dem rep ruben gallego beats kari lake battle arizona senate seat,L
house,democrats,Ideological Politics,480514,Republicans win control of the US House of Representatives,148,152,No,No,0,https://www.wfla.com/election/republicans-win-control-of-the-us-house-of-representatives/,/r/democrats/comments/1gp8r34/republicans_win_control_of_the_us_house_of/,republicans win control us house representatives,N
vote,Conservatives,Ideological Politics,108238,"AZ Representative Rachel Jones - Can someone please explain this to me?
Maybe this is part of the problem in Pima Co. Can anyone explain to me why if Pima has about 635,000 registered voters why as of Oct 20th did they have 1,010,067 ballots mailed out? Who did they get mailed to.",15,0,No,No,0,https://x.com/RJ4arizona/status/1856155729989607482,/r/conservatives/comments/1gpcq3m/az_representative_rachel_jones_can_someone_please/,az representative rachel jones someone please explain maybe part problem pima co anyone explain pima registered voters oct th ballots mailed get mailed,L
War,KamalaHarris,Ideological Politics,76010,Jon Stewart On What Went Wrong For Democrats,5,2,No,No,0,https://youtu.be/TKBJoj4XyFc,/r/KamalaHarris/comments/1gpdn6m/jon_stewart_on_what_went_wrong_for_democrats/,jon stewart went wrong democrats,L
climate change,Anarchism,Ideological Politics,271013,"A few months ago, the conservative party came to power in Valencia, Spain with the support of the far right. One of their first acts was to eliminate climate emergency services. At the end of October, flooding exacerbated by climate change killed over 200 people in the region.",3,0,No,No,0,/r/CrimethInc/comments/1gpe123/a_few_months_ago_the_conservative_party_came_to/,/r/Anarchism/comments/1gpe16v/a_few_months_ago_the_conservative_party_came_to/,months ago conservative party came power valencia spain support far right one first acts eliminate climate emergency services end october flooding exacerbated climate change killed people region,N
trump,Republican,Ideological Politics,205129,These people are delusional my comment will probably get deleted and I'll be banned but whatever,42,18,No,No,0,https://www.reddit.com/gallery/1gpdoog,/r/Republican/comments/1gpdoog/these_people_are_delusional_my_comment_will/,people delusional comment probably get deleted ill banned whatever,L
