Keyword,Subreddit,Category,Members,Title,Upvotes,Comments,Moderator Interaction,Fact-Checking Mention,Total Awards,URL,Original Post URL
treasury,Wikileaks,General Politics,177637,Why does the US still control every penny of Iraqi oil revenues?,40,6,No,No,0,https://www.reddit.com/r/WikiLeaks/comments/1fso9v7/why_does_the_us_still_control_every_penny_of/,/r/WikiLeaks/comments/1fso9v7/why_does_the_us_still_control_every_penny_of/
hurricane,News,General Politics,28917802,"His wife was swept away by Hurricane Helene’s floodwaters. Now he’s been scammed out of nearly $40,000",4443,204,No,No,0,https://www.cnn.com/2024/11/09/us/hurricane-helene-vehicle-scam/index.html,/r/news/comments/1govfmb/his_wife_was_swept_away_by_hurricane_helenes/
tariffs,PoliticalDiscussion,General Politics,2184593,How likely is Trump to convert the US to a totalitarian dictatorship?,276,1031,No,No,0,https://www.reddit.com/r/PoliticalDiscussion/comments/1gp56t4/how_likely_is_trump_to_convert_the_us_to_a/,/r/PoliticalDiscussion/comments/1gp56t4/how_likely_is_trump_to_convert_the_us_to_a/
inflation,PoliticalDiscussion,General Politics,2184593,"Was Trump's win driven by an anti-incumbency sentiment? or was it a successful campaign strategy? had it been the former, would picking a candidate of the same party but not in the incumbent administration have levelled the playing field?",92,287,No,No,0,https://www.reddit.com/r/PoliticalDiscussion/comments/1goqx1f/was_trumps_win_driven_by_an_antiincumbency/,/r/PoliticalDiscussion/comments/1goqx1f/was_trumps_win_driven_by_an_antiincumbency/
prices,NeutralPolitics,General Politics,610552,What to expect after the U.S. election,286,26,Yes,Yes,0,https://www.reddit.com/r/NeutralPolitics/comments/1gflxpk/what_to_expect_after_the_us_election/,/r/NeutralPolitics/comments/1gflxpk/what_to_expect_after_the_us_election/
economy,NeutralPolitics,General Politics,610552,Trump won the presidency and popular vote running on the mass deportation of illegal aliens. Who saw this coming and what lessons can be learned?,182,326,No,No,0,https://www.reddit.com/r/NeutralPolitics/comments/1gnk7ih/trump_won_the_presidency_and_popular_vote_running/,/r/NeutralPolitics/comments/1gnk7ih/trump_won_the_presidency_and_popular_vote_running/
economy,NeutralPolitics,General Politics,610552,How do the Trump and Harris plans for workforce pay and taxes compare?,6,6,No,No,0,https://www.reddit.com/r/NeutralPolitics/comments/1ggxh8w/how_do_the_trump_and_harris_plans_for_workforce/,/r/NeutralPolitics/comments/1ggxh8w/how_do_the_trump_and_harris_plans_for_workforce/
economy,NeutralPolitics,General Politics,610552,"Why does Israel, a nation with a modern first world economy, need ""aid"" from the US as a part of its conflict?",268,77,No,No,0,https://www.reddit.com/r/NeutralPolitics/comments/1gewboa/why_does_israel_a_nation_with_a_modern_first/,/r/NeutralPolitics/comments/1gewboa/why_does_israel_a_nation_with_a_modern_first/
economy,Republican,Ideological Politics,205140,Sad: Candidate Who Bankrupted Campaign Will Never Have Opportunity To Fix Nation’s Economy,139,15,No,No,0,https://babylonbee.com/news/sad-candidate-who-bankrupted-campaign-account-will-never-have-opportunity-to-fix-nations-economy,/r/Republican/comments/1gpaxop/sad_candidate_who_bankrupted_campaign_will_never/
hurricane,Republican,Ideological Politics,205140,FEMA Fires Official Who Ordered Workers to Skip Hurricane-Ravaged Homes With Trump Signs 👍,367,33,No,No,0,https://townhall.com/tipsheet/mattvespa/2024/11/11/fema-fires-official-who-ordered-workers-to-skip-hurricane-ravaged-homes-with-trump-signs-n2647555,/r/Republican/comments/1gow1nw/fema_fires_official_who_ordered_workers_to_skip/
prices,Libertarian,Ideological Politics,503623,How would emergency healthcare work in a purely free market?,8,13,No,No,0,https://www.reddit.com/r/Libertarian/comments/1gpc8bc/how_would_emergency_healthcare_work_in_a_purely/,/r/Libertarian/comments/1gpc8bc/how_would_emergency_healthcare_work_in_a_purely/
economy,Libertarian,Ideological Politics,503623,Can someone explain how Tariffs will be good for the economy?,122,82,No,No,0,https://www.reddit.com/r/Libertarian/comments/1gorx9d/can_someone_explain_how_tariffs_will_be_good_for/,/r/Libertarian/comments/1gorx9d/can_someone_explain_how_tariffs_will_be_good_for/
climate change,Anarchism,Ideological Politics,271013,"A few months ago, the conservative party came to power in Valencia, Spain with the support of the far right. One of their first acts was to eliminate climate emergency services. At the end of October, flooding exacerbated by climate change killed over 200 people in the region.",65,4,No,No,0,/r/CrimethInc/comments/1gpe123/a_few_months_ago_the_conservative_party_came_to/,/r/Anarchism/comments/1gpe16v/a_few_months_ago_the_conservative_party_came_to/
prices,Republicanism,Ideological Politics,917,“Away with college gen ed”,0,4,No,Yes,0,https://www.reddit.com/r/republicanism/comments/19asm4l/away_with_college_gen_ed/,/r/republicanism/comments/19asm4l/away_with_college_gen_ed/
inflation,Liberal,Ideological Politics,119781,What I think needs changing,26,132,No,No,0,https://www.reddit.com/r/Liberal/comments/1goxogz/what_i_think_needs_changing/,/r/Liberal/comments/1goxogz/what_i_think_needs_changing/
economy,Liberal,Ideological Politics,119781,Glad to see we have visitors.,95,57,No,Yes,0,https://www.reddit.com/r/Liberal/comments/1gon2jn/glad_to_see_we_have_visitors/,/r/Liberal/comments/1gon2jn/glad_to_see_we_have_visitors/
gas,Liberal,Ideological Politics,119781,Why were the polls so wrong?,139,168,No,No,0,https://www.reddit.com/r/Liberal/comments/1go7sv1/why_were_the_polls_so_wrong/,/r/Liberal/comments/1go7sv1/why_were_the_polls_so_wrong/
economy,Liberal,Ideological Politics,119781,"Liberals need to stop blaming themselves, and stop blaming Trump voters",146,116,No,Yes,0,https://www.reddit.com/r/Liberal/comments/1gnk7ug/liberals_need_to_stop_blaming_themselves_and_stop/,/r/Liberal/comments/1gnk7ug/liberals_need_to_stop_blaming_themselves_and_stop/
money,Liberal,Ideological Politics,119781,Thinking about these big blue cities where the majority of red states money comes from.  These blue cities could bring their red states to there knees. ,127,125,No,No,0,https://www.reddit.com/r/Liberal/comments/1gne8ji/thinking_about_these_big_blue_cities_where_the/,/r/Liberal/comments/1gne8ji/thinking_about_these_big_blue_cities_where_the/
