Keyword,Subreddit,Category,Members,Title,Upvotes,Comments,Moderator Interaction,Fact-Checking Mention,Total Awards,URL,Original Post URL
treasury,Wikileaks,General Politics,177653,Why does the US still control every penny of Iraqi oil revenues?,38,6,No,No,0,https://www.reddit.com/r/WikiLeaks/comments/1fso9v7/why_does_the_us_still_control_every_penny_of/,/r/WikiLeaks/comments/1fso9v7/why_does_the_us_still_control_every_penny_of/
prices,NeutralPolitics,General Politics,610695,What to expect after the U.S. election,281,26,Yes,Yes,0,https://www.reddit.com/r/NeutralPolitics/comments/1gflxpk/what_to_expect_after_the_us_election/,/r/NeutralPolitics/comments/1gflxpk/what_to_expect_after_the_us_election/
inflation,NeutralPolitics,General Politics,610695,Do any countries have laws to combat politically-driven misinformation?,14,25,No,Yes,0,https://www.reddit.com/r/NeutralPolitics/comments/1gq4agt/do_any_countries_have_laws_to_combat/,/r/NeutralPolitics/comments/1gq4agt/do_any_countries_have_laws_to_combat/
economy,NeutralPolitics,General Politics,610695,Trump won the presidency and popular vote running on the mass deportation of illegal aliens. Who saw this coming and what lessons can be learned?,222,326,No,No,0,https://www.reddit.com/r/NeutralPolitics/comments/1gnk7ih/trump_won_the_presidency_and_popular_vote_running/,/r/NeutralPolitics/comments/1gnk7ih/trump_won_the_presidency_and_popular_vote_running/
economy,NeutralPolitics,General Politics,610695,How do the Trump and Harris plans for workforce pay and taxes compare?,5,6,No,No,0,https://www.reddit.com/r/NeutralPolitics/comments/1ggxh8w/how_do_the_trump_and_harris_plans_for_workforce/,/r/NeutralPolitics/comments/1ggxh8w/how_do_the_trump_and_harris_plans_for_workforce/
gas,technology,General Politics,17399586,"CD Projekt-owned GOG has launched the GOG Preservation Program to ensure the longevity of over 100 games such as Fallout: New Vegas, The Witcher 2: Assassin's of Kings, Resident Evil, and more.",182,4,No,No,0,https://www.ign.com/articles/cd-projekt-owned-gog-begins-preservation-program-to-ensure-the-longevity-of-fallout-the-witcher-and-more,/r/technology/comments/1grd87m/cd_projektowned_gog_has_launched_the_gog/
gas,democrats,Ideological Politics,480684,"I'm convinced this Gaetz nomination is a 'smoke screen'. While everybody's flabbergasted with the selection, some truly nefarious shit is going on that we're not paying attention to.  ",906,201,No,No,0,https://i.redd.it/w3qmr20hcx0e1.jpeg,/r/democrats/comments/1grdz9f/im_convinced_this_gaetz_nomination_is_a_smoke/
prices,democrats,Ideological Politics,480684,High grocery prices got droves of Americans to vote for Trump but they shouldn’t expect to pay less over the next four years,488,89,No,No,0,https://www.cnn.com/2024/11/14/economy/trump-grocery-prices-inflation?cid=ios_app,/r/democrats/comments/1graf6u/high_grocery_prices_got_droves_of_americans_to/
money,Republican,Ideological Politics,205533,Democrats Worried If Government Becomes More Efficient They'll Be Forced To Light Giant Piles Of Money On Fire On Their Own,81,1,No,No,0,https://babylonbee.com/news/democrats-worried-that-if-government-becomes-more-efficient-theyll-be-forced-to-light-giant-piles-of-money-on-fire-on-their-own,/r/Republican/comments/1grclwn/democrats_worried_if_government_becomes_more/
hurricane,Anarchism,Ideological Politics,271139,"We've prepared a zine version of ""The Eye of Every Storm,"" in which an anarchist involved in longstanding disaster response efforts in Appalachia recounts the lessons they learned in the course of responding to Hurricane Helene and offers advice about how to get ready for the disasters to come.",23,1,No,No,0,/r/CrimethInc/comments/1grdton/weve_prepared_a_zine_version_of_the_eye_of_every/,/r/Anarchism/comments/1grdtug/weve_prepared_a_zine_version_of_the_eye_of_every/
hurricane,Anarchism,Ideological Politics,271139,The Eye of Every Storm: Anarchist Response to Hurricane Helene,33,0,No,No,0,/r/CrimethInc/comments/1gqok6z/the_eye_of_every_storm_anarchist_response_to/,/r/Anarchism/comments/1gqokmq/the_eye_of_every_storm_anarchist_response_to/
global warming,Anarchism,Ideological Politics,271139,"Climate change, diesel emissions, and anarchist solutions ",9,2,No,No,0,https://www.reddit.com/r/Anarchism/comments/1gqj6jw/climate_change_diesel_emissions_and_anarchist/,/r/Anarchism/comments/1gqj6jw/climate_change_diesel_emissions_and_anarchist/
economy,Socialism,Ideological Politics,460988,I see people that argue Capitalism has increased quality of life over the past 100 years,11,10,No,No,0,https://www.reddit.com/r/socialism/comments/1grj17w/i_see_people_that_argue_capitalism_has_increased/,/r/socialism/comments/1grj17w/i_see_people_that_argue_capitalism_has_increased/
climate change,Socialism,Ideological Politics,460988,Book recs on neoliberalism?,8,11,No,No,0,https://www.reddit.com/r/socialism/comments/1grd3sq/book_recs_on_neoliberalism/,/r/socialism/comments/1grd3sq/book_recs_on_neoliberalism/
inflation,Socialism,Ideological Politics,460988,"Trump wants to blame all the problems we face under the capitalist system – inflation, homelessness, crime, unemployment – on immigrants. ",200,5,No,No,0,https://www.reddit.com/gallery/1gqjiv5,/r/socialism/comments/1gqjiv5/trump_wants_to_blame_all_the_problems_we_face/
prices,Republicanism,Ideological Politics,918,“Away with college gen ed”,0,4,No,Yes,0,https://www.reddit.com/r/republicanism/comments/19asm4l/away_with_college_gen_ed/,/r/republicanism/comments/19asm4l/away_with_college_gen_ed/
coal,Conservatives,Ideological Politics,108259,Farewell to the “Rising American Electorate”: The Obama coalition is not coming back.,51,1,No,No,0,https://www.liberalpatriot.com/p/farewell-to-the-rising-american-electorate,/r/conservatives/comments/1gre5aj/farewell_to_the_rising_american_electorate_the/
