Keyword,Subreddit,Category,Members,Title,Upvotes,Comments,Moderator Interaction,Fact-Checking Mention,Total Awards,URL,Original Post URL
border,News,General Politics,28919173,"Fire at New Jersey-New York border still uncontrolled after burning over 2,500 acres",1828,49,No,No,0,https://abcnews.go.com/US/wildfire-new-jersey-new-york-border-zero-percent-containment/story?id=115713454,/r/news/comments/1gp2tj6/fire_at_new_jerseynew_york_border_still/
border,PoliticalDiscussion,General Politics,2184605,"Was Trump's win driven by an anti-incumbency sentiment? or was it a successful campaign strategy? had it been the former, would picking a candidate of the same party but not in the incumbent administration have levelled the playing field?",91,296,No,No,0,https://www.reddit.com/r/PoliticalDiscussion/comments/1goqx1f/was_trumps_win_driven_by_an_antiincumbency/,/r/PoliticalDiscussion/comments/1goqx1f/was_trumps_win_driven_by_an_antiincumbency/
treaties,PoliticalDiscussion,General Politics,2184605,How does the world deal with the schizophrenic foreign policy that America has? ,393,351,No,No,0,https://www.reddit.com/r/PoliticalDiscussion/comments/1go363q/how_does_the_world_deal_with_the_schizophrenic/,/r/PoliticalDiscussion/comments/1go363q/how_does_the_world_deal_with_the_schizophrenic/
immigration,NeutralPolitics,General Politics,610593,Trump won the presidency and popular vote running on the mass deportation of illegal aliens. Who saw this coming and what lessons can be learned?,195,326,No,No,0,https://www.reddit.com/r/NeutralPolitics/comments/1gnk7ih/trump_won_the_presidency_and_popular_vote_running/,/r/NeutralPolitics/comments/1gnk7ih/trump_won_the_presidency_and_popular_vote_running/
texas,moderatepolitics,General Politics,296165,"Judge says New York can't use 'antiquated, unconstitutional' law to block migrant buses from Texas",263,228,No,No,0,https://abcnews.go.com/US/wireStory/judge-new-york-antiquated-unconstitutional-law-block-migrant-115661358,/r/moderatepolitics/comments/1govzpd/judge_says_new_york_cant_use_antiquated/
border,moderatepolitics,General Politics,296165,Trump says former Ice director Tom Homan will be in charge of borders and deportations,271,543,No,No,0,https://amp.theguardian.com/us-news/2024/nov/11/tom-homan-donald-trump-border-czar-immigration,/r/moderatepolitics/comments/1gop6wi/trump_says_former_ice_director_tom_homan_will_be/
illegal,technology,General Politics,17388858,"Apple illegally threatened workers over their talk about pay and remote work, feds charge",953,27,No,No,0,https://www.msn.com/en-us/news/us/apple-illegally-threatened-workers-over-their-talk-about-pay-and-remote-work-feds-charge/ar-AA1tD6mm,/r/technology/comments/1gpibsb/apple_illegally_threatened_workers_over_their/
immigration,democrats,Ideological Politics,480519,"Harris did not lose because of young white men or immigration or “wokeism”. It was the economy, stupid.",183,201,No,No,0,https://www.ft.com/content/e8ac09ea-c300-4249-af7d-109003afb893,/r/democrats/comments/1gpn6ue/harris_did_not_lose_because_of_young_white_men_or/
border,Conservative,Ideological Politics,1145287,"Border Patrol, ICE morale surging after Trump election win: 'They know they can get the bad guys now'",489,12,No,No,0,https://www.foxnews.com/us/border-patrol-ice-morale-surging-trump-election-win-they-know-they-can-get-the-bad-guys-now,/r/Conservative/comments/1gpj4kr/border_patrol_ice_morale_surging_after_trump/
border,Libertarian,Ideological Politics,503631,"I’m a near total libertarian, but to reinforce my ideas I like to ‘steel man’ opposing arguments a lot. Here are some quandaries I think about a lot that might challenge my positions. Please provide rebuttals! ",79,47,No,No,0,https://www.reddit.com/r/Libertarian/comments/1gp19wj/im_a_near_total_libertarian_but_to_reinforce_my/,/r/Libertarian/comments/1gp19wj/im_a_near_total_libertarian_but_to_reinforce_my/
texas,Anarchism,Ideological Politics,271029,What can a 13 year old do,27,19,No,No,0,https://www.reddit.com/r/Anarchism/comments/1gpderb/what_can_a_13_year_old_do/,/r/Anarchism/comments/1gpderb/what_can_a_13_year_old_do/
texas,Progressive,Ideological Politics,78041,A Texas Woman Died After Waiting 40 Hours for Miscarriage Care,297,5,No,No,0,https://www.propublica.org/article/josseli-barnica-death-miscarriage-texas-abortion-ban,/r/progressive/comments/1gfmamd/a_texas_woman_died_after_waiting_40_hours_for/
border,Conservatives,Ideological Politics,108235,Exclusive | Trump border czar Tom Homan vows sanctuary city crackdown,190,5,No,No,0,https://nypost.com/2024/11/11/us-news/trump-border-czar-tom-homan-vows-sanctuary-city-crackdown/,/r/conservatives/comments/1gp8qsb/exclusive_trump_border_czar_tom_homan_vows/
immigration,Conservatives,Ideological Politics,108235,Trump’s Border Czar Has A Plan To Stop Illegal Immigration,136,14,No,No,0,https://www.dailywire.com/news/trumps-border-czar-has-a-plan-to-stop-illegal-immigration,/r/conservatives/comments/1gp7wqj/trumps_border_czar_has_a_plan_to_stop_illegal/
border,Liberal,Ideological Politics,119789,What I think needs changing,30,135,No,No,0,https://www.reddit.com/r/Liberal/comments/1goxogz/what_i_think_needs_changing/,/r/Liberal/comments/1goxogz/what_i_think_needs_changing/
immigration,Liberal,Ideological Politics,119789,Glad to see we have visitors.,113,65,No,Yes,0,https://www.reddit.com/r/Liberal/comments/1gon2jn/glad_to_see_we_have_visitors/,/r/Liberal/comments/1gon2jn/glad_to_see_we_have_visitors/
border,Liberal,Ideological Politics,119789,"Liberals need to stop blaming themselves, and stop blaming Trump voters",147,117,No,Yes,0,https://www.reddit.com/r/Liberal/comments/1gnk7ug/liberals_need_to_stop_blaming_themselves_and_stop/,/r/Liberal/comments/1gnk7ug/liberals_need_to_stop_blaming_themselves_and_stop/
