Keyword,Subreddit,Category,Members,Title,Upvotes,Comments,Moderator Interaction,Fact-Checking Mention,Total Awards,URL,Original Post URL
border,News,General Politics,28914950,"Fire at New Jersey-New York border still uncontrolled after burning over 2,500 acres",330,10,No,No,0,https://abcnews.go.com/US/wildfire-new-jersey-new-york-border-zero-percent-containment/story?id=115713454,/r/news/comments/1gp2tj6/fire_at_new_jerseynew_york_border_still/
border,PoliticalDiscussion,General Politics,2184631,"Was Trump's win driven by an anti-incumbency sentiment? or was it a successful campaign strategy? had it been the former, would picking a candidate of the same party but not in the incumbent administration have levelled the playing field?",57,231,No,No,0,https://www.reddit.com/r/PoliticalDiscussion/comments/1goqx1f/was_trumps_win_driven_by_an_antiincumbency/,/r/PoliticalDiscussion/comments/1goqx1f/was_trumps_win_driven_by_an_antiincumbency/
treaties,PoliticalDiscussion,General Politics,2184631,How does the world deal with the schizophrenic foreign policy that America has? ,379,345,No,No,0,https://www.reddit.com/r/PoliticalDiscussion/comments/1go363q/how_does_the_world_deal_with_the_schizophrenic/,/r/PoliticalDiscussion/comments/1go363q/how_does_the_world_deal_with_the_schizophrenic/
immigration,NeutralPolitics,General Politics,610514,Trump won the presidency and popular vote running on the mass deportation of illegal aliens. Who saw this coming and what lessons can be learned?,170,306,No,No,0,https://www.reddit.com/r/NeutralPolitics/comments/1gnk7ih/trump_won_the_presidency_and_popular_vote_running/,/r/NeutralPolitics/comments/1gnk7ih/trump_won_the_presidency_and_popular_vote_running/
texas,moderatepolitics,General Politics,296072,"Judge says New York can't use 'antiquated, unconstitutional' law to block migrant buses from Texas",180,153,No,No,0,https://abcnews.go.com/US/wireStory/judge-new-york-antiquated-unconstitutional-law-block-migrant-115661358,/r/moderatepolitics/comments/1govzpd/judge_says_new_york_cant_use_antiquated/
border,moderatepolitics,General Politics,296072,Trump says former Ice director Tom Homan will be in charge of borders and deportations,223,473,No,No,0,https://amp.theguardian.com/us-news/2024/nov/11/tom-homan-donald-trump-border-czar-immigration,/r/moderatepolitics/comments/1gop6wi/trump_says_former_ice_director_tom_homan_will_be/
illegal,technology,General Politics,17385279,"Apple illegally threatened workers over their talk about pay and remote work, feds charge",6865,167,No,No,0,https://www.spokesman.com/stories/2024/nov/06/apple-illegally-threatened-workers-over-their-talk/,/r/technology/comments/1gogo9r/apple_illegally_threatened_workers_over_their/
illegal,Republican,Ideological Politics,205089,How Is this Ok ? ,199,38,No,No,0,https://www.reddit.com/gallery/1gowak2,/r/Republican/comments/1gowak2/how_is_this_ok/
texas,Republican,Ideological Politics,205089,"Republicans flipped 23 Democrat-held seats in five appellate courts across Texas, winning 25 of 26 contested courts of appeals races on Tuesday’s ballot.",160,5,No,No,0,https://texasscorecard.com/state/monumental-win-republicans-flip-23-texas-appeals-court-seats/,/r/Republican/comments/1gouker/republicans_flipped_23_democratheld_seats_in_five/
immigration,Republican,Ideological Politics,205089,Trump appoints UN ambassador Elise Stefanik and border tsar Tom Homan,66,11,No,No,0,https://www.bbc.com/news/articles/c079m9mxx1no,/r/Republican/comments/1goqnt1/trump_appoints_un_ambassador_elise_stefanik_and/
border,Conservative,Ideological Politics,1144925,"'If I Offend Anyone, I Don't Give a S**T': America's New Border Czar is Tom Homan and LET'S Effing GOOO (Watch)",1197,107,No,No,0,https://twitchy.com/samj/2024/11/11/meet-our-new-border-czar-tom-homan-n2403614,/r/Conservative/comments/1gosvp8/if_i_offend_anyone_i_dont_give_a_st_americas_new/
border,Conservative,Ideological Politics,1144925,Trump announces Tom Homan to be his Border Czar ,3047,781,No,No,0,https://i.redd.it/9iotu0otc70e1.jpeg,/r/Conservative/comments/1gok7lq/trump_announces_tom_homan_to_be_his_border_czar/
border,Libertarian,Ideological Politics,503617,"I’m a near total libertarian, but to reinforce my ideas I like to ‘steel man’ opposing arguments a lot. Here are some quandaries I think about a lot that might challenge my positions. Please provide rebuttals! ",27,17,No,No,0,https://www.reddit.com/r/Libertarian/comments/1gp19wj/im_a_near_total_libertarian_but_to_reinforce_my/,/r/Libertarian/comments/1gp19wj/im_a_near_total_libertarian_but_to_reinforce_my/
immigration,Anarchism,Ideological Politics,270995,So should we prepare for a massive civil war under the Trump administration? What do you think is going to look like? I'm imagining some return of the occupy movement with far more intensity,50,74,No,No,0,https://www.reddit.com/r/Anarchism/comments/1gnjmy2/so_should_we_prepare_for_a_massive_civil_war/,/r/Anarchism/comments/1gnjmy2/so_should_we_prepare_for_a_massive_civil_war/
texas,Progressive,Ideological Politics,78031,A Texas Woman Died After Waiting 40 Hours for Miscarriage Care,297,5,No,No,0,https://www.propublica.org/article/josseli-barnica-death-miscarriage-texas-abortion-ban,/r/progressive/comments/1gfmamd/a_texas_woman_died_after_waiting_40_hours_for/
border,Conservatives,Ideological Politics,108232,"Donald Trump Picks Tom Homan to Oversee Border Security, Deportations",93,10,No,No,0,https://www.breitbart.com/immigration/2024/11/11/trump-picks-tom-homan-to-oversee-border-security-deportations/,/r/conservatives/comments/1govuq0/donald_trump_picks_tom_homan_to_oversee_border/
border,Conservatives,Ideological Politics,108232,Trump Picks Tom Homan to Be His 'Border Czar',30,0,No,No,0,https://www.newsmax.com/politics/ice-immigration-border/2024/11/11/id/1187501/,/r/conservatives/comments/1govlps/trump_picks_tom_homan_to_be_his_border_czar/
illegal,Conservatives,Ideological Politics,108232,Pelosi: ‘Fewer’ Illegal Aliens Came In Under Biden Than Trump,154,68,No,No,0,https://www.dailywire.com/news/pelosi-fewer-illegal-aliens-came-in-under-biden-than-trump,/r/conservatives/comments/1gok15c/pelosi_fewer_illegal_aliens_came_in_under_biden/
border,Liberal,Ideological Politics,119750,What I think needs changing,17,66,No,No,0,https://www.reddit.com/r/Liberal/comments/1goxogz/what_i_think_needs_changing/,/r/Liberal/comments/1goxogz/what_i_think_needs_changing/
immigration,Liberal,Ideological Politics,119750,Glad to see we have visitors.,53,40,No,Yes,0,https://www.reddit.com/r/Liberal/comments/1gon2jn/glad_to_see_we_have_visitors/,/r/Liberal/comments/1gon2jn/glad_to_see_we_have_visitors/
border,Liberal,Ideological Politics,119750,"Liberals need to stop blaming themselves, and stop blaming Trump voters",146,116,No,Yes,0,https://www.reddit.com/r/Liberal/comments/1gnk7ug/liberals_need_to_stop_blaming_themselves_and_stop/,/r/Liberal/comments/1gnk7ug/liberals_need_to_stop_blaming_themselves_and_stop/
