Keyword,Subreddit,Category,Members,Title,Upvotes,Comments,Moderator Interaction,Fact-Checking Mention,Total Awards,URL,Original Post URL
border,News,General Politics,28915516,"Fire at New Jersey-New York border still uncontrolled after burning over 2,500 acres",637,25,No,No,0,https://abcnews.go.com/US/wildfire-new-jersey-new-york-border-zero-percent-containment/story?id=115713454,/r/news/comments/1gp2tj6/fire_at_new_jerseynew_york_border_still/
border,PoliticalDiscussion,General Politics,2184635,"Was Trump's win driven by an anti-incumbency sentiment? or was it a successful campaign strategy? had it been the former, would picking a candidate of the same party but not in the incumbent administration have levelled the playing field?",63,248,No,No,0,https://www.reddit.com/r/PoliticalDiscussion/comments/1goqx1f/was_trumps_win_driven_by_an_antiincumbency/,/r/PoliticalDiscussion/comments/1goqx1f/was_trumps_win_driven_by_an_antiincumbency/
treaties,PoliticalDiscussion,General Politics,2184635,How does the world deal with the schizophrenic foreign policy that America has? ,383,349,No,No,0,https://www.reddit.com/r/PoliticalDiscussion/comments/1go363q/how_does_the_world_deal_with_the_schizophrenic/,/r/PoliticalDiscussion/comments/1go363q/how_does_the_world_deal_with_the_schizophrenic/
immigration,NeutralPolitics,General Politics,610520,Trump won the presidency and popular vote running on the mass deportation of illegal aliens. Who saw this coming and what lessons can be learned?,174,307,No,No,0,https://www.reddit.com/r/NeutralPolitics/comments/1gnk7ih/trump_won_the_presidency_and_popular_vote_running/,/r/NeutralPolitics/comments/1gnk7ih/trump_won_the_presidency_and_popular_vote_running/
texas,moderatepolitics,General Politics,296078,"Judge says New York can't use 'antiquated, unconstitutional' law to block migrant buses from Texas",201,183,No,No,0,https://abcnews.go.com/US/wireStory/judge-new-york-antiquated-unconstitutional-law-block-migrant-115661358,/r/moderatepolitics/comments/1govzpd/judge_says_new_york_cant_use_antiquated/
border,moderatepolitics,General Politics,296078,Trump says former Ice director Tom Homan will be in charge of borders and deportations,239,503,No,No,0,https://amp.theguardian.com/us-news/2024/nov/11/tom-homan-donald-trump-border-czar-immigration,/r/moderatepolitics/comments/1gop6wi/trump_says_former_ice_director_tom_homan_will_be/
illegal,technology,General Politics,17385674,"Apple illegally threatened workers over their talk about pay and remote work, feds charge",6984,169,No,No,0,https://www.spokesman.com/stories/2024/nov/06/apple-illegally-threatened-workers-over-their-talk/,/r/technology/comments/1gogo9r/apple_illegally_threatened_workers_over_their/
illegal,Republican,Ideological Politics,205109,How Is this Ok ? ,210,39,No,No,0,https://www.reddit.com/gallery/1gowak2,/r/Republican/comments/1gowak2/how_is_this_ok/
texas,Republican,Ideological Politics,205109,"Republicans flipped 23 Democrat-held seats in five appellate courts across Texas, winning 25 of 26 contested courts of appeals races on Tuesday’s ballot.",178,6,No,No,0,https://texasscorecard.com/state/monumental-win-republicans-flip-23-texas-appeals-court-seats/,/r/Republican/comments/1gouker/republicans_flipped_23_democratheld_seats_in_five/
border,Conservative,Ideological Politics,1144976,"'If I Offend Anyone, I Don't Give a S**T': America's New Border Czar is Tom Homan and LET'S Effing GOOO (Watch)",1419,120,No,No,0,https://twitchy.com/samj/2024/11/11/meet-our-new-border-czar-tom-homan-n2403614,/r/Conservative/comments/1gosvp8/if_i_offend_anyone_i_dont_give_a_st_americas_new/
border,Libertarian,Ideological Politics,503615,"I’m a near total libertarian, but to reinforce my ideas I like to ‘steel man’ opposing arguments a lot. Here are some quandaries I think about a lot that might challenge my positions. Please provide rebuttals! ",41,25,No,No,0,https://www.reddit.com/r/Libertarian/comments/1gp19wj/im_a_near_total_libertarian_but_to_reinforce_my/,/r/Libertarian/comments/1gp19wj/im_a_near_total_libertarian_but_to_reinforce_my/
border,Anarchism,Ideological Politics,271002,Seeking Community Input- A Prediction and Scenario for Analysis,1,0,No,No,0,https://www.reddit.com/r/Anarchism/comments/1gp5ol0/seeking_community_input_a_prediction_and_scenario/,/r/Anarchism/comments/1gp5ol0/seeking_community_input_a_prediction_and_scenario/
texas,Progressive,Ideological Politics,78038,A Texas Woman Died After Waiting 40 Hours for Miscarriage Care,296,5,No,No,0,https://www.propublica.org/article/josseli-barnica-death-miscarriage-texas-abortion-ban,/r/progressive/comments/1gfmamd/a_texas_woman_died_after_waiting_40_hours_for/
border,Conservatives,Ideological Politics,108232,"Donald Trump Picks Tom Homan to Oversee Border Security, Deportations",127,15,No,No,0,https://www.breitbart.com/immigration/2024/11/11/trump-picks-tom-homan-to-oversee-border-security-deportations/,/r/conservatives/comments/1govuq0/donald_trump_picks_tom_homan_to_oversee_border/
border,Conservatives,Ideological Politics,108232,Trump Picks Tom Homan to Be His 'Border Czar',38,0,No,No,0,https://www.newsmax.com/politics/ice-immigration-border/2024/11/11/id/1187501/,/r/conservatives/comments/1govlps/trump_picks_tom_homan_to_be_his_border_czar/
border,Liberal,Ideological Politics,119756,What I think needs changing,15,88,No,No,0,https://www.reddit.com/r/Liberal/comments/1goxogz/what_i_think_needs_changing/,/r/Liberal/comments/1goxogz/what_i_think_needs_changing/
immigration,Liberal,Ideological Politics,119756,Glad to see we have visitors.,70,43,No,Yes,0,https://www.reddit.com/r/Liberal/comments/1gon2jn/glad_to_see_we_have_visitors/,/r/Liberal/comments/1gon2jn/glad_to_see_we_have_visitors/
border,Liberal,Ideological Politics,119756,"Liberals need to stop blaming themselves, and stop blaming Trump voters",149,116,No,Yes,0,https://www.reddit.com/r/Liberal/comments/1gnk7ug/liberals_need_to_stop_blaming_themselves_and_stop/,/r/Liberal/comments/1gnk7ug/liberals_need_to_stop_blaming_themselves_and_stop/
