Keyword,Subreddit,Category,Members,Title,Upvotes,Comments,Moderator Interaction,Fact-Checking Mention,Total Awards,URL,Original Post URL
border,PoliticalDiscussion,General Politics,2184630,"Was Trump's win driven by an anti-incumbency sentiment? or was it a successful campaign strategy? had it been the former, would picking a candidate of the same party but not in the incumbent administration have levelled the playing field?",100,326,No,No,0,https://www.reddit.com/r/PoliticalDiscussion/comments/1goqx1f/was_trumps_win_driven_by_an_antiincumbency/,/r/PoliticalDiscussion/comments/1goqx1f/was_trumps_win_driven_by_an_antiincumbency/
treaties,PoliticalDiscussion,General Politics,2184630,How does the world deal with the schizophrenic foreign policy that America has? ,407,352,No,No,0,https://www.reddit.com/r/PoliticalDiscussion/comments/1go363q/how_does_the_world_deal_with_the_schizophrenic/,/r/PoliticalDiscussion/comments/1go363q/how_does_the_world_deal_with_the_schizophrenic/
immigration,NeutralPolitics,General Politics,610650,Trump won the presidency and popular vote running on the mass deportation of illegal aliens. Who saw this coming and what lessons can be learned?,215,326,No,No,0,https://www.reddit.com/r/NeutralPolitics/comments/1gnk7ih/trump_won_the_presidency_and_popular_vote_running/,/r/NeutralPolitics/comments/1gnk7ih/trump_won_the_presidency_and_popular_vote_running/
immigration,Republican,Ideological Politics,205276,Thomas D. Homan - Acting Director of the U.S. Immigration and Customs Enforcement,462,33,No,No,0,https://www.reddit.com/gallery/1gq5m83,/r/Republican/comments/1gq5m83/thomas_d_homan_acting_director_of_the_us/
border,Republican,Ideological Politics,205276,Liberals Enraged At Border Czar Vowing To Secure The Border,59,4,No,No,0,https://babylonbee.com/news/liberals-enraged-at-border-czar-vowing-to-secure-the-border,/r/Republican/comments/1gqfo9o/liberals_enraged_at_border_czar_vowing_to_secure/
texas,Anarchism,Ideological Politics,271076,What can a 13 year old do,96,26,No,No,0,https://www.reddit.com/r/Anarchism/comments/1gpderb/what_can_a_13_year_old_do/,/r/Anarchism/comments/1gpderb/what_can_a_13_year_old_do/
mexico,Socialism,Ideological Politics,460906,Personally want to thank this community,27,3,No,No,0,https://www.reddit.com/r/socialism/comments/1gq8bnx/personally_want_to_thank_this_community/,/r/socialism/comments/1gq8bnx/personally_want_to_thank_this_community/
mexico,Socialism,Ideological Politics,460906,book recs?,3,2,No,No,0,https://www.reddit.com/r/socialism/comments/1gqavd6/book_recs/,/r/socialism/comments/1gqavd6/book_recs/
texas,Progressive,Ideological Politics,78051,A Texas Woman Died After Waiting 40 Hours for Miscarriage Care,298,5,No,No,0,https://www.propublica.org/article/josseli-barnica-death-miscarriage-texas-abortion-ban,/r/progressive/comments/1gfmamd/a_texas_woman_died_after_waiting_40_hours_for/
border,Liberal,Ideological Politics,119817,What I think needs changing,41,145,No,No,0,https://www.reddit.com/r/Liberal/comments/1goxogz/what_i_think_needs_changing/,/r/Liberal/comments/1goxogz/what_i_think_needs_changing/
immigration,Liberal,Ideological Politics,119817,Glad to see we have visitors.,126,85,No,Yes,0,https://www.reddit.com/r/Liberal/comments/1gon2jn/glad_to_see_we_have_visitors/,/r/Liberal/comments/1gon2jn/glad_to_see_we_have_visitors/
