Keyword,Subreddit,Category,Members,Title,Upvotes,Comments,Moderator Interaction,Fact-Checking Mention,Total Awards,URL,Original Post URL
europe,Wikileaks,General Politics,177641,"Finally Free, Assange Receives a Measure of Justice From the Council of Europe",42,1,No,No,0,https://truthout.org/articles/finally-free-assange-receives-a-measure-of-justice-from-the-council-of-europe/,/r/WikiLeaks/comments/1fxlpkt/finally_free_assange_receives_a_measure_of/
War,Wikileaks,General Politics,177641,Parliamentary Assembly recognises Julian Assange as a ‘political prisoner’ and warns against the chilling effect of his harsh treatment,43,0,No,No,0,https://www.coe.int/en/web/portal/-/pace-recognises-julian-assange-as-a-political-prisoner-and-warns-against-the-chilling-effect-of-his-harsh-treatment,/r/WikiLeaks/comments/1fx0tn0/parliamentary_assembly_recognises_julian_assange/
europe,Wikileaks,General Politics,177641,Julian Assange attends hearing on his detention and conviction at the Council of Europe,20,1,No,No,0,https://www.youtube.com/watch?v=hzHktIKyt-w,/r/WikiLeaks/comments/1fu7cca/julian_assange_attends_hearing_on_his_detention/
europe,Wikileaks,General Politics,177641,Julian to speak at a parliamentary hearing in Strasbourg on the chilling effect on human rights his treatment has had.,22,0,No,No,0,https://www.reddit.com/r/WikiLeaks/comments/1ftadxc/julian_to_speak_at_a_parliamentary_hearing_in/,/r/WikiLeaks/comments/1ftadxc/julian_to_speak_at_a_parliamentary_hearing_in/
israel,Wikileaks,General Politics,177641,The Hezbollah leader killed by Israel professed to want peace,0,20,No,No,0,https://youtu.be/3M1fHfKenTM?si=5By4wuDaS7IRM2hb&t=185s,/r/WikiLeaks/comments/1fryvhy/the_hezbollah_leader_killed_by_israel_professed/
War,News,General Politics,28922523,Spirit Airlines Moves Toward Bankruptcy Filing After Frontier Drops Merger Bid,1649,170,No,No,0,https://www.wsj.com/business/airlines/spirit-airlines-moves-toward-bankruptcy-filing-after-frontier-drops-merger-bid-5d492e80,/r/news/comments/1gpysea/spirit_airlines_moves_toward_bankruptcy_filing/
europe,News,General Politics,28922523,"Missing Wisconsin kayaker likely faked his own death, fled to Europe; charges are possible: Sheriff",4999,328,No,No,0,https://abcnews.go.com/US/missing-wisconsin-kayaker-faked-death-fled-europe/story?id=11576703,/r/news/comments/1gpq7ak/missing_wisconsin_kayaker_likely_faked_his_own/
gaza,News,General Politics,28922523,US says it will not limit Israel arms transfers after some improvements in flow of aid to Gaza,893,350,No,No,0,https://apnews.com/article/israel-palestinians-hamas-war-aid-us-48cd09c1c007cacd6d7a309589490320,/r/news/comments/1gpxex8/us_says_it_will_not_limit_israel_arms_transfers/
china,News,General Politics,28922523,35 people killed as driver rams into crowd at a sports center in China,2590,143,No,No,0,https://www.nbcnews.com/news/world/zhuhai-china-car-ramming-driver-hits-crowd-sports-center-35-killed-rcna179732,/r/news/comments/1gpl923/35_people_killed_as_driver_rams_into_crowd_at_a/
ukraine,PoliticalDiscussion,General Politics,2184644,What do you think Trump will do about the Israel/Palestine conflict?,109,328,No,No,0,https://www.reddit.com/r/PoliticalDiscussion/comments/1gq3qzs/what_do_you_think_trump_will_do_about_the/,/r/PoliticalDiscussion/comments/1gq3qzs/what_do_you_think_trump_will_do_about_the/
War,PoliticalDiscussion,General Politics,2184644,How likely is Trump to convert the US to a totalitarian dictatorship?,358,1410,No,No,0,https://www.reddit.com/r/PoliticalDiscussion/comments/1gp56t4/how_likely_is_trump_to_convert_the_us_to_a/,/r/PoliticalDiscussion/comments/1gp56t4/how_likely_is_trump_to_convert_the_us_to_a/
ukraine,PoliticalDiscussion,General Politics,2184644,Why is there such confusion about whether or not Putin has spoken to Trump?,1,1,No,Yes,0,https://www.reddit.com/r/PoliticalDiscussion/comments/1gq4ztm/why_is_there_such_confusion_about_whether_or_not/,/r/PoliticalDiscussion/comments/1gq4ztm/why_is_there_such_confusion_about_whether_or_not/
War,PoliticalDiscussion,General Politics,2184644,"How likely is it that the ACA will be repealed, as per the GOP's plans?",244,305,No,No,0,https://www.reddit.com/r/PoliticalDiscussion/comments/1gp1l4g/how_likely_is_it_that_the_aca_will_be_repealed_as/,/r/PoliticalDiscussion/comments/1gp1l4g/how_likely_is_it_that_the_aca_will_be_repealed_as/
War,PoliticalDiscussion,General Politics,2184644,"Was Trump's win driven by an anti-incumbency sentiment? or was it a successful campaign strategy? had it been the former, would picking a candidate of the same party but not in the incumbent administration have levelled the playing field?",97,318,No,No,0,https://www.reddit.com/r/PoliticalDiscussion/comments/1goqx1f/was_trumps_win_driven_by_an_antiincumbency/,/r/PoliticalDiscussion/comments/1goqx1f/was_trumps_win_driven_by_an_antiincumbency/
War,PoliticalDiscussion,General Politics,2184644,What takeaways and legacies do you think that the First World War was most significant in doing in your view?,35,37,No,No,0,https://www.reddit.com/r/PoliticalDiscussion/comments/1gowg8k/what_takeaways_and_legacies_do_you_think_that_the/,/r/PoliticalDiscussion/comments/1gowg8k/what_takeaways_and_legacies_do_you_think_that_the/
War,PoliticalDiscussion,General Politics,2184644,Birthright citizenship. ,190,475,No,No,0,https://www.reddit.com/r/PoliticalDiscussion/comments/1gogkpp/birthright_citizenship/,/r/PoliticalDiscussion/comments/1gogkpp/birthright_citizenship/
ukraine,PoliticalDiscussion,General Politics,2184644,How does the world deal with the schizophrenic foreign policy that America has? ,396,351,No,No,0,https://www.reddit.com/r/PoliticalDiscussion/comments/1go363q/how_does_the_world_deal_with_the_schizophrenic/,/r/PoliticalDiscussion/comments/1go363q/how_does_the_world_deal_with_the_schizophrenic/
War,NeutralPolitics,General Politics,610645,What to expect after the U.S. election,281,26,Yes,Yes,0,https://www.reddit.com/r/NeutralPolitics/comments/1gflxpk/what_to_expect_after_the_us_election/,/r/NeutralPolitics/comments/1gflxpk/what_to_expect_after_the_us_election/
War,NeutralPolitics,General Politics,610645,Is now the time for a NEW moderate third party in U.S. politics?,0,73,No,No,0,https://www.reddit.com/r/NeutralPolitics/comments/1gms9so/is_now_the_time_for_a_new_moderate_third_party_in/,/r/NeutralPolitics/comments/1gms9so/is_now_the_time_for_a_new_moderate_third_party_in/
War,NeutralPolitics,General Politics,610645,Where is the Western world’s paradigm shift coming from?,111,127,No,Yes,0,https://www.reddit.com/r/NeutralPolitics/comments/1glkk8q/where_is_the_western_worlds_paradigm_shift_coming/,/r/NeutralPolitics/comments/1glkk8q/where_is_the_western_worlds_paradigm_shift_coming/
War,NeutralPolitics,General Politics,610645,Why Are So Many Men Leaving The Democratic Party Over The Last Few Years?,383,156,No,No,0,https://www.reddit.com/r/NeutralPolitics/comments/1gklb9t/why_are_so_many_men_leaving_the_democratic_party/,/r/NeutralPolitics/comments/1gklb9t/why_are_so_many_men_leaving_the_democratic_party/
War,NeutralPolitics,General Politics,610645,How do the Trump and Harris plans for workforce pay and taxes compare?,5,6,No,No,0,https://www.reddit.com/r/NeutralPolitics/comments/1ggxh8w/how_do_the_trump_and_harris_plans_for_workforce/,/r/NeutralPolitics/comments/1ggxh8w/how_do_the_trump_and_harris_plans_for_workforce/
israel,NeutralPolitics,General Politics,610645,"Why does Israel, a nation with a modern first world economy, need ""aid"" from the US as a part of its conflict?",268,77,No,No,0,https://www.reddit.com/r/NeutralPolitics/comments/1gewboa/why_does_israel_a_nation_with_a_modern_first/,/r/NeutralPolitics/comments/1gewboa/why_does_israel_a_nation_with_a_modern_first/
gaza,NeutralPolitics,General Politics,610645,"War involving Israel, Lebanon, and Iran--Motivations? Scale of Conflict?",16,6,No,No,0,https://www.reddit.com/r/NeutralPolitics/comments/1ge5sct/war_involving_israel_lebanon_and_iranmotivations/,/r/NeutralPolitics/comments/1ge5sct/war_involving_israel_lebanon_and_iranmotivations/
War,moderatepolitics,General Politics,296303,Bernie Sanders blasts Democrats for their attitude towards Joe Rogan,565,740,No,No,0,https://thehill.com/homenews/media/4983254-bernie-sanders-blasts-democrats-attitude-towards-joe-rogan/,/r/moderatepolitics/comments/1gppd5i/bernie_sanders_blasts_democrats_for_their/
china,moderatepolitics,General Politics,296303,Trump selects Mike Waltz as national security adviser,123,114,No,No,0,https://ground.news/article/trump-selects-mike-waltz-as-national-security-adviser-source-says_a33643?utm_source=mobile-app&utm_medium=article-share,/r/moderatepolitics/comments/1gp9fq3/trump_selects_mike_waltz_as_national_security/
War,technology,General Politics,17391423,Russia Issues Ominous Warning About Undersea Internet Cables,10243,1131,No,No,0,https://www.newsweek.com/russia-pipeline-gas-patrushev-putin-1984215,/r/technology/comments/1gpikhr/russia_issues_ominous_warning_about_undersea/
china,technology,General Politics,17391423,"TikTok and its owner ramped up their hiring from China, even as Congress raised national security concerns",867,44,No,No,0,https://www.businessinsider.com/tiktok-ramped-up-hiring-chinese-employees-amid-us-political-scrutiny-2024-11,/r/technology/comments/1gpq5xw/tiktok_and_its_owner_ramped_up_their_hiring_from/
china,technology,General Politics,17391423,China rated Canada’s most aggressive cyber threat,148,6,No,No,0,https://www.theregister.com/2024/10/31/canada_cybersec_threats/?td=keepreading,/r/technology/comments/1gq2tnm/china_rated_canadas_most_aggressive_cyber_threat/
War,democrats,Ideological Politics,480540,Husband's Vote Wasn't Counted! This Should Not Be Happening!,595,71,No,No,0,https://i.redd.it/kvtfog6y1l0e1.jpeg,/r/democrats/comments/1gq2y70/husbands_vote_wasnt_counted_this_should_not_be/
War,democrats,Ideological Politics,480540,Trump wants to weed out “woke” generals. A first step for a Trump friendly military? Ready to be used on its citizens? Who will be on this Warrior Board?,195,76,No,No,0,https://www.telegraph.co.uk/us/politics/2024/11/12/trump-woke-generals-warrior-board-executive-order/,/r/democrats/comments/1gq1ujx/trump_wants_to_weed_out_woke_generals_a_first/
uk,democrats,Ideological Politics,480540,Have you ever had a dream that the election last week was just a fluke and we should’ve had a do-over?,191,22,No,No,0,https://i.redd.it/xqtuaf13nk0e1.jpeg,/r/democrats/comments/1gq1amh/have_you_ever_had_a_dream_that_the_election_last/
War,democrats,Ideological Politics,480540,Democratic warnings about Trump were not simply campaign rhetoric,69,8,No,No,0,https://archive.ph/J8IMV#selection-534.0-534.1,/r/democrats/comments/1gq4nrh/democratic_warnings_about_trump_were_not_simply/
War,Republican,Ideological Politics,205235,NYC Warns Migrants Funding for Upstate Hotel Rooms Is Ending,152,23,No,No,0,https://www.breitbart.com/immigration/2024/11/12/nyc-warns-migrants-funding-for-upstate-hotel-rooms-is-ending/,/r/Republican/comments/1gq1qio/nyc_warns_migrants_funding_for_upstate_hotel/
War,Republican,Ideological Politics,205235,Trump transition live updates: Trump picks Elon Musk and Fox News host for key jobs in second White House term - BBC News,27,9,No,No,0,https://www.bbc.com/news/live/cnvjr42yq39t,/r/Republican/comments/1gq2vmg/trump_transition_live_updates_trump_picks_elon/
israel,Conservative,Ideological Politics,1145801,"Trump Nominated  U.S. Ambassador to Israel, Mike Huckabee",1178,305,No,No,0,https://i.redd.it/7j7n30grwi0e1.jpeg,/r/Conservative/comments/1gptct2/trump_nominated_us_ambassador_to_israel_mike/
russia,Libertarian,Ideological Politics,503641,Russia's inflation is so bad that potatoes cost 64% more than they did at the start of the year,83,14,No,No,0,https://www.yahoo.com/news/russias-inflation-bad-potatoes-cost-093703658.html,/r/Libertarian/comments/1gpukpf/russias_inflation_is_so_bad_that_potatoes_cost_64/
War,Libertarian,Ideological Politics,503641,"Marco Rubio is a pro-war neocon, he'd be a disaster for Secretary of State",381,81,No,No,0,https://i.redd.it/npq98bda9g0e1.jpeg,/r/Libertarian/comments/1gphxc5/marco_rubio_is_a_prowar_neocon_hed_be_a_disaster/
europe,Libertarian,Ideological Politics,503641,How should an Eastern European libertarian vote ?,61,16,No,No,0,https://www.reddit.com/gallery/1gpj52l,/r/Libertarian/comments/1gpj52l/how_should_an_eastern_european_libertarian_vote/
War,Libertarian,Ideological Politics,503641,Trump Picks Neocon Warmonger Mike Waltz as National Security Advisor,37,5,No,No,0,https://news.antiwar.com/2024/11/11/trump-picks-rep-mike-waltz-as-national-security-advisor/,/r/Libertarian/comments/1gpltjl/trump_picks_neocon_warmonger_mike_waltz_as/
War,Anarchism,Ideological Politics,271059,"I'm finally getting the chance to start organizing, anyone got advice for a newbie?",36,8,No,No,0,https://www.reddit.com/r/Anarchism/comments/1gppyeh/im_finally_getting_the_chance_to_start_organizing/,/r/Anarchism/comments/1gppyeh/im_finally_getting_the_chance_to_start_organizing/
War,Anarchism,Ideological Politics,271059,Warm lines that don't call the v police,93,5,No,No,0,https://i.redd.it/3tq0o7hmmzzd1.jpeg,/r/Anarchism/comments/1gp6btk/warm_lines_that_dont_call_the_v_police/
north korea,Socialism,Ideological Politics,460892,What are some examples of capitalist countries failing?,142,75,No,No,0,https://www.reddit.com/r/socialism/comments/1gppxwl/what_are_some_examples_of_capitalist_countries/,/r/socialism/comments/1gppxwl/what_are_some_examples_of_capitalist_countries/
War,Socialism,Ideological Politics,460892,The far right populist surge,72,15,No,No,0,https://www.reddit.com/r/socialism/comments/1gpqu4y/the_far_right_populist_surge/,/r/socialism/comments/1gpqu4y/the_far_right_populist_surge/
europe,Socialism,Ideological Politics,460892,"Serious question, Is China really that homophobic? What are homosexual people's rights actually like in China?",40,10,No,Yes,0,https://www.reddit.com/r/socialism/comments/1gpm4pr/serious_question_is_china_really_that_homophobic/,/r/socialism/comments/1gpm4pr/serious_question_is_china_really_that_homophobic/
uk,Socialism,Ideological Politics,460892,Where can I get socialist stickers ?,1,1,No,No,0,https://www.reddit.com/r/socialism/comments/1gq7ai8/where_can_i_get_socialist_stickers/,/r/socialism/comments/1gq7ai8/where_can_i_get_socialist_stickers/
british,Republicanism,Ideological Politics,917,WANTED: Submissions from around the globe.,6,1,Yes,No,0,https://www.reddit.com/r/republicanism/comments/361f2w/wanted_submissions_from_around_the_globe/,/r/republicanism/comments/361f2w/wanted_submissions_from_around_the_globe/
War,Republicanism,Ideological Politics,917,Why are monarchists cherry-pickers?,6,0,No,No,0,https://www.reddit.com/r/republicanism/comments/1c22ytx/why_are_monarchists_cherrypickers/,/r/republicanism/comments/1c22ytx/why_are_monarchists_cherrypickers/
british,Republicanism,Ideological Politics,917,Pro-British monarchy Indian Christian saying mocking the name-reverting done by our governments (especially the renaming of Bombay to Mumbai) and openly doing sedition by saying that Charles III should be the Emperor of India and 'God Save the King' should be the Indian anthem.,3,0,No,No,0,https://www.reddit.com/gallery/1b2xwq8,/r/republicanism/comments/1b2xwq8/probritish_monarchy_indian_christian_saying/
uk,Republicanism,Ideological Politics,917,Survey about your political worldview (18+; 12-14 mins to complete),3,0,No,No,0,https://www.reddit.com/r/republicanism/comments/1aq418a/survey_about_your_political_worldview_18_1214/,/r/republicanism/comments/1aq418a/survey_about_your_political_worldview_18_1214/
War,Conservatives,Ideological Politics,108237,"Elizabeth Warren Tries To Trash Pete Hegseth, Gets A Quick Lesson On Who He Really Is",23,2,No,No,0,https://www.dailywire.com/news/elizabeth-warren-tries-to-trash-pete-hegseth-gets-a-quick-lesson-on-who-he-really-is,/r/conservatives/comments/1gq3ngy/elizabeth_warren_tries_to_trash_pete_hegseth_gets/
War,Conservatives,Ideological Politics,108237,"Elizabeth Warren and CNN Accuse Trump of Breaking the Law, As Second Term Hysteria Begins",161,30,No,No,0,https://redstate.com/bonchie/2024/11/11/elizabeth-warren-and-cnn-accuse-trump-of-breaking-the-law-as-second-term-hysteria-begins-n2181852,/r/conservatives/comments/1gpoc7k/elizabeth_warren_and_cnn_accuse_trump_of_breaking/
gaza,dailywire,Ideological Politics,24195,Israel Eliminates Hamas Leader Yahya Sinwar In Gaza: Reports,139,6,Yes,No,0,https://www.dailywire.com/news/israel-eliminates-hamas-leader-yahya-sinwar-in-gaza-reports?topStoryPosition=1,/r/dailywire/comments/1g5wl85/israel_eliminates_hamas_leader_yahya_sinwar_in/
War,Liberal,Ideological Politics,119808,Warren: Trump transition ‘already breaking the law’,204,40,No,No,0,https://thehill.com/homenews/campaign/4984590-trump-transition-law-violation-elizabeth-warren/,/r/Liberal/comments/1gps6f2/warren_trump_transition_already_breaking_the_law/
War,Liberal,Ideological Politics,119808,What I think needs changing,36,144,No,No,0,https://www.reddit.com/r/Liberal/comments/1goxogz/what_i_think_needs_changing/,/r/Liberal/comments/1goxogz/what_i_think_needs_changing/
russia,Liberal,Ideological Politics,119808,Glad to see we have visitors.,122,81,No,Yes,0,https://www.reddit.com/r/Liberal/comments/1gon2jn/glad_to_see_we_have_visitors/,/r/Liberal/comments/1gon2jn/glad_to_see_we_have_visitors/
putin,Liberal,Ideological Politics,119808,I keep hearing theories about how 15m people staying home didn't actually stay home and I'm not buying it.,327,365,No,No,0,https://www.reddit.com/r/Liberal/comments/1gnrlns/i_keep_hearing_theories_about_how_15m_people/,/r/Liberal/comments/1gnrlns/i_keep_hearing_theories_about_how_15m_people/
Zelenskyy,KamalaHarris,Ideological Politics,75778,"""We are not ready to give our freedom to this F***  Terrorist"" Volodymyr Zelenskyy",470,33,No,No,0,https://youtu.be/sJgrXDjkDCo?si=7msAy6Xcgh9Wg9vi,/r/KamalaHarris/comments/1gp5w42/we_are_not_ready_to_give_our_freedom_to_this_f/
