Keyword,Subreddit,Category,Members,Title,Upvotes,Comments,Moderator Interaction,Fact-Checking Mention,Total Awards,URL,Original Post URL
europe,Wikileaks,General Politics,177638,"Finally Free, Assange Receives a Measure of Justice From the Council of Europe",41,1,No,No,0,https://truthout.org/articles/finally-free-assange-receives-a-measure-of-justice-from-the-council-of-europe/,/r/WikiLeaks/comments/1fxlpkt/finally_free_assange_receives_a_measure_of/
War,Wikileaks,General Politics,177638,Parliamentary Assembly recognises Julian Assange as a ‘political prisoner’ and warns against the chilling effect of his harsh treatment,41,0,No,No,0,https://www.coe.int/en/web/portal/-/pace-recognises-julian-assange-as-a-political-prisoner-and-warns-against-the-chilling-effect-of-his-harsh-treatment,/r/WikiLeaks/comments/1fx0tn0/parliamentary_assembly_recognises_julian_assange/
europe,Wikileaks,General Politics,177638,Julian Assange attends hearing on his detention and conviction at the Council of Europe,18,1,No,No,0,https://www.youtube.com/watch?v=hzHktIKyt-w,/r/WikiLeaks/comments/1fu7cca/julian_assange_attends_hearing_on_his_detention/
europe,Wikileaks,General Politics,177638,Julian to speak at a parliamentary hearing in Strasbourg on the chilling effect on human rights his treatment has had.,23,0,No,No,0,https://www.reddit.com/r/WikiLeaks/comments/1ftadxc/julian_to_speak_at_a_parliamentary_hearing_in/,/r/WikiLeaks/comments/1ftadxc/julian_to_speak_at_a_parliamentary_hearing_in/
israel,Wikileaks,General Politics,177638,The Hezbollah leader killed by Israel professed to want peace,0,20,No,No,0,https://youtu.be/3M1fHfKenTM?si=5By4wuDaS7IRM2hb&t=185s,/r/WikiLeaks/comments/1fryvhy/the_hezbollah_leader_killed_by_israel_professed/
china,News,General Politics,28918616,35 people killed as driver rams into crowd at a sports center in China,345,31,No,No,0,https://www.nbcnews.com/news/world/zhuhai-china-car-ramming-driver-hits-crowd-sports-center-35-killed-rcna179732,/r/news/comments/1gpl923/35_people_killed_as_driver_rams_into_crowd_at_a/
War,PoliticalDiscussion,General Politics,2184606,How likely is Trump to convert the US to a totalitarian dictatorship?,296,1127,No,No,0,https://www.reddit.com/r/PoliticalDiscussion/comments/1gp56t4/how_likely_is_trump_to_convert_the_us_to_a/,/r/PoliticalDiscussion/comments/1gp56t4/how_likely_is_trump_to_convert_the_us_to_a/
War,PoliticalDiscussion,General Politics,2184606,"How likely is it that the ACA will be repealed, as per the GOP's plans?",191,235,No,No,0,https://www.reddit.com/r/PoliticalDiscussion/comments/1gp1l4g/how_likely_is_it_that_the_aca_will_be_repealed_as/,/r/PoliticalDiscussion/comments/1gp1l4g/how_likely_is_it_that_the_aca_will_be_repealed_as/
War,PoliticalDiscussion,General Politics,2184606,"Was Trump's win driven by an anti-incumbency sentiment? or was it a successful campaign strategy? had it been the former, would picking a candidate of the same party but not in the incumbent administration have levelled the playing field?",92,292,No,No,0,https://www.reddit.com/r/PoliticalDiscussion/comments/1goqx1f/was_trumps_win_driven_by_an_antiincumbency/,/r/PoliticalDiscussion/comments/1goqx1f/was_trumps_win_driven_by_an_antiincumbency/
War,PoliticalDiscussion,General Politics,2184606,What takeaways and legacies do you think that the First World War was most significant in doing in your view?,34,28,No,No,0,https://www.reddit.com/r/PoliticalDiscussion/comments/1gowg8k/what_takeaways_and_legacies_do_you_think_that_the/,/r/PoliticalDiscussion/comments/1gowg8k/what_takeaways_and_legacies_do_you_think_that_the/
War,PoliticalDiscussion,General Politics,2184606,Birthright citizenship. ,175,427,No,No,0,https://www.reddit.com/r/PoliticalDiscussion/comments/1gogkpp/birthright_citizenship/,/r/PoliticalDiscussion/comments/1gogkpp/birthright_citizenship/
ukraine,PoliticalDiscussion,General Politics,2184606,How does the world deal with the schizophrenic foreign policy that America has? ,392,350,No,No,0,https://www.reddit.com/r/PoliticalDiscussion/comments/1go363q/how_does_the_world_deal_with_the_schizophrenic/,/r/PoliticalDiscussion/comments/1go363q/how_does_the_world_deal_with_the_schizophrenic/
War,PoliticalDiscussion,General Politics,2184606,"Some say: ""The Resistance is about to Ignite."" Referencing State Actors, such as Governors and AGs, Federal Courts, the Press and the Educators and Civil Society [the People.] Are those guardrails still there to thwart attempts by Trump to usurp the Constitution?",299,386,No,No,0,https://www.reddit.com/r/PoliticalDiscussion/comments/1gnmmyw/some_say_the_resistance_is_about_to_ignite/,/r/PoliticalDiscussion/comments/1gnmmyw/some_say_the_resistance_is_about_to_ignite/
War,NeutralPolitics,General Politics,610566,What to expect after the U.S. election,280,26,Yes,Yes,0,https://www.reddit.com/r/NeutralPolitics/comments/1gflxpk/what_to_expect_after_the_us_election/,/r/NeutralPolitics/comments/1gflxpk/what_to_expect_after_the_us_election/
War,NeutralPolitics,General Politics,610566,Is now the time for a NEW moderate third party in U.S. politics?,0,70,No,No,0,https://www.reddit.com/r/NeutralPolitics/comments/1gms9so/is_now_the_time_for_a_new_moderate_third_party_in/,/r/NeutralPolitics/comments/1gms9so/is_now_the_time_for_a_new_moderate_third_party_in/
War,NeutralPolitics,General Politics,610566,Where is the Western world’s paradigm shift coming from?,110,128,No,Yes,0,https://www.reddit.com/r/NeutralPolitics/comments/1glkk8q/where_is_the_western_worlds_paradigm_shift_coming/,/r/NeutralPolitics/comments/1glkk8q/where_is_the_western_worlds_paradigm_shift_coming/
War,NeutralPolitics,General Politics,610566,Why Are So Many Men Leaving The Democratic Party Over The Last Few Years?,383,156,No,No,0,https://www.reddit.com/r/NeutralPolitics/comments/1gklb9t/why_are_so_many_men_leaving_the_democratic_party/,/r/NeutralPolitics/comments/1gklb9t/why_are_so_many_men_leaving_the_democratic_party/
War,NeutralPolitics,General Politics,610566,How do the Trump and Harris plans for workforce pay and taxes compare?,5,6,No,No,0,https://www.reddit.com/r/NeutralPolitics/comments/1ggxh8w/how_do_the_trump_and_harris_plans_for_workforce/,/r/NeutralPolitics/comments/1ggxh8w/how_do_the_trump_and_harris_plans_for_workforce/
israel,NeutralPolitics,General Politics,610566,"Why does Israel, a nation with a modern first world economy, need ""aid"" from the US as a part of its conflict?",273,77,No,No,0,https://www.reddit.com/r/NeutralPolitics/comments/1gewboa/why_does_israel_a_nation_with_a_modern_first/,/r/NeutralPolitics/comments/1gewboa/why_does_israel_a_nation_with_a_modern_first/
gaza,NeutralPolitics,General Politics,610566,"War involving Israel, Lebanon, and Iran--Motivations? Scale of Conflict?",16,6,No,No,0,https://www.reddit.com/r/NeutralPolitics/comments/1ge5sct/war_involving_israel_lebanon_and_iranmotivations/,/r/NeutralPolitics/comments/1ge5sct/war_involving_israel_lebanon_and_iranmotivations/
china,moderatepolitics,General Politics,296156,Trump selects Mike Waltz as national security adviser,98,97,No,No,0,https://ground.news/article/trump-selects-mike-waltz-as-national-security-adviser-source-says_a33643?utm_source=mobile-app&utm_medium=article-share,/r/moderatepolitics/comments/1gp9fq3/trump_selects_mike_waltz_as_national_security/
War,moderatepolitics,General Politics,296156,Homeward bound: Tim Walz returns to Minnesota after election loss,233,318,No,No,0,https://www.usatoday.com/story/news/politics/elections/2024/11/06/tim-walz-loses-election/75719431007/,/r/moderatepolitics/comments/1gotdz8/homeward_bound_tim_walz_returns_to_minnesota/
israel,moderatepolitics,General Politics,296156,Trump chooses New York Rep. Elise Stefanik as ambassador to United Nations,188,104,No,No,0,https://apnews.com/article/trump-united-nations-elise-stefanik-ambassador-2b482fb39a8d6f03d389d27cc8820056,/r/moderatepolitics/comments/1goui4f/trump_chooses_new_york_rep_elise_stefanik_as/
ukraine,moderatepolitics,General Politics,296156,Trump Told Putin Not to Escalate Ukraine War in Post-Election Call – Washington Post - The Moscow Times,221,399,No,No,0,https://www.themoscowtimes.com/2024/11/10/trump-told-putin-not-to-escalate-ukraine-war-in-post-election-call-washington-post-a86973,/r/moderatepolitics/comments/1goakc0/trump_told_putin_not_to_escalate_ukraine_war_in/
War,technology,General Politics,17388286,Russia Issues Ominous Warning About Undersea Internet Cables,1787,339,No,No,0,https://www.newsweek.com/russia-pipeline-gas-patrushev-putin-1984215,/r/technology/comments/1gpikhr/russia_issues_ominous_warning_about_undersea/
War,Libertarian,Ideological Politics,503631,"Marco Rubio is a pro-war neocon, he'd be a disaster for Secretary of State",112,16,No,No,0,https://i.redd.it/npq98bda9g0e1.jpeg,/r/Libertarian/comments/1gphxc5/marco_rubio_is_a_prowar_neocon_hed_be_a_disaster/
europe,Libertarian,Ideological Politics,503631,How should an Eastern European libertarian vote ?,37,11,No,No,0,https://www.reddit.com/gallery/1gpj52l,/r/Libertarian/comments/1gpj52l/how_should_an_eastern_european_libertarian_vote/
War,Libertarian,Ideological Politics,503631,Trump Picks Neocon Warmonger Mike Waltz as National Security Advisor,2,1,No,No,0,https://news.antiwar.com/2024/11/11/trump-picks-rep-mike-waltz-as-national-security-advisor/,/r/Libertarian/comments/1gpltjl/trump_picks_neocon_warmonger_mike_waltz_as/
War,Libertarian,Ideological Politics,503631,Mises on the Human and Financial Disaster that Was World War I.,2,0,No,No,0,https://mises.org/mises-wire/mises-human-and-financial-disaster-was-world-war-i,/r/Libertarian/comments/1gplrrl/mises_on_the_human_and_financial_disaster_that/
War,Libertarian,Ideological Politics,503631,"Happy Veterans Day, let's ACTUALLY honor our veterans.",122,5,No,No,0,https://www.reddit.com/r/Libertarian/comments/1gov401/happy_veterans_day_lets_actually_honor_our/,/r/Libertarian/comments/1gov401/happy_veterans_day_lets_actually_honor_our/
War,Anarchism,Ideological Politics,271022,"Im a disabled person, and im begging you to get informed about covid.",386,127,No,No,0,https://www.reddit.com/r/Anarchism/comments/1goj9ja/im_a_disabled_person_and_im_begging_you_to_get/,/r/Anarchism/comments/1goj9ja/im_a_disabled_person_and_im_begging_you_to_get/
War,Anarchism,Ideological Politics,271022,Warm lines that don't call the v police,3,1,No,No,0,https://i.redd.it/3tq0o7hmmzzd1.jpeg,/r/Anarchism/comments/1gp6btk/warm_lines_that_dont_call_the_v_police/
uk,Socialism,Ideological Politics,460812,UK socialist parties,9,11,No,No,0,https://www.reddit.com/r/socialism/comments/1gphy2m/uk_socialist_parties/,/r/socialism/comments/1gphy2m/uk_socialist_parties/
israel,Socialism,Ideological Politics,460812,"Following the pro-genocidors' attack on Amsterdam, former Israeli minister Avigdor Liberman declared that Jews' home was in ""Israel"", not Europe, and called on them to leave their home societies. This is an analysis of how politicizing identity leads to holocausts everywhere",305,8,No,No,0,https://www.reddit.com/gallery/1goqq16,/r/socialism/comments/1goqq16/following_the_progenocidors_attack_on_amsterdam/
british,Republicanism,Ideological Politics,917,WANTED: Submissions from around the globe.,6,1,Yes,No,0,https://www.reddit.com/r/republicanism/comments/361f2w/wanted_submissions_from_around_the_globe/,/r/republicanism/comments/361f2w/wanted_submissions_from_around_the_globe/
War,Republicanism,Ideological Politics,917,Why are monarchists cherry-pickers?,8,0,No,No,0,https://www.reddit.com/r/republicanism/comments/1c22ytx/why_are_monarchists_cherrypickers/,/r/republicanism/comments/1c22ytx/why_are_monarchists_cherrypickers/
british,Republicanism,Ideological Politics,917,Pro-British monarchy Indian Christian saying mocking the name-reverting done by our governments (especially the renaming of Bombay to Mumbai) and openly doing sedition by saying that Charles III should be the Emperor of India and 'God Save the King' should be the Indian anthem.,3,0,No,No,0,https://www.reddit.com/gallery/1b2xwq8,/r/republicanism/comments/1b2xwq8/probritish_monarchy_indian_christian_saying/
uk,Republicanism,Ideological Politics,917,Survey about your political worldview (18+; 12-14 mins to complete),3,0,No,No,0,https://www.reddit.com/r/republicanism/comments/1aq418a/survey_about_your_political_worldview_18_1214/,/r/republicanism/comments/1aq418a/survey_about_your_political_worldview_18_1214/
gaza,dailywire,Ideological Politics,24183,Israel Eliminates Hamas Leader Yahya Sinwar In Gaza: Reports,139,6,Yes,No,0,https://www.dailywire.com/news/israel-eliminates-hamas-leader-yahya-sinwar-in-gaza-reports?topStoryPosition=1,/r/dailywire/comments/1g5wl85/israel_eliminates_hamas_leader_yahya_sinwar_in/
War,Liberal,Ideological Politics,119784,What I think needs changing,28,134,No,No,0,https://www.reddit.com/r/Liberal/comments/1goxogz/what_i_think_needs_changing/,/r/Liberal/comments/1goxogz/what_i_think_needs_changing/
russia,Liberal,Ideological Politics,119784,Glad to see we have visitors.,109,62,No,Yes,0,https://www.reddit.com/r/Liberal/comments/1gon2jn/glad_to_see_we_have_visitors/,/r/Liberal/comments/1gon2jn/glad_to_see_we_have_visitors/
putin,Liberal,Ideological Politics,119784,I keep hearing theories about how 15m people staying home didn't actually stay home and I'm not buying it.,322,356,No,No,0,https://www.reddit.com/r/Liberal/comments/1gnrlns/i_keep_hearing_theories_about_how_15m_people/,/r/Liberal/comments/1gnrlns/i_keep_hearing_theories_about_how_15m_people/
War,Liberal,Ideological Politics,119784,"Liberals need to stop blaming themselves, and stop blaming Trump voters",151,117,No,Yes,0,https://www.reddit.com/r/Liberal/comments/1gnk7ug/liberals_need_to_stop_blaming_themselves_and_stop/,/r/Liberal/comments/1gnk7ug/liberals_need_to_stop_blaming_themselves_and_stop/
War,Liberal,Ideological Politics,119784,Thinking about these big blue cities where the majority of red states money comes from.  These blue cities could bring their red states to there knees. ,126,125,No,No,0,https://www.reddit.com/r/Liberal/comments/1gne8ji/thinking_about_these_big_blue_cities_where_the/,/r/Liberal/comments/1gne8ji/thinking_about_these_big_blue_cities_where_the/
Zelenskyy,KamalaHarris,Ideological Politics,75922,"""We are not ready to give our freedom to this F***  Terrorist"" Volodymyr Zelenskyy",405,29,No,No,0,https://youtu.be/sJgrXDjkDCo?si=7msAy6Xcgh9Wg9vi,/r/KamalaHarris/comments/1gp5w42/we_are_not_ready_to_give_our_freedom_to_this_f/
War,KamalaHarris,Ideological Politics,75922,Jon Stewart On What Went Wrong For Democrats,42,41,No,No,0,https://youtu.be/TKBJoj4XyFc,/r/KamalaHarris/comments/1gpdn6m/jon_stewart_on_what_went_wrong_for_democrats/
War,KamalaHarris,Ideological Politics,75922,"The best path forward for Democrats (Pod Save America convo with Carlos Odio, 20min) ",53,21,No,No,0,https://youtu.be/jPJYFjQyWHU?feature=shared&t=2793,/r/KamalaHarris/comments/1gohu4f/the_best_path_forward_for_democrats_pod_save/
