Keyword,Subreddit,Category,Members,Title,Upvotes,Comments,Moderator Interaction,Fact-Checking Mention,Total Awards,URL,Original Post URL
recount,Conservatives,Ideological Politics,108263,We're Heading for a Recount in Pennsylvania Senate race - and the Dems Want Illegal Ballots Counted.,144,14,No,No,0,https://townhall.com/tipsheet/mattvespa/2024/11/14/sore-loser-dems-want-a-recount-in-pas-senate-race-heres-what-theyre-arguing-for-n2647774,/r/conservatives/comments/1grayty/were_heading_for_a_recount_in_pennsylvania_senate/
trump,Conservatives,Ideological Politics,108263,John Bolton Asks Deep State To Deep-Six Trump Nominees,24,6,No,No,0,https://thefederalist.com/2024/11/14/john-bolton-asks-deep-state-to-deep-six-trump-nominees-before-they-fix-corrupt-intel-agencies/,/r/conservatives/comments/1grk1t5/john_bolton_asks_deep_state_to_deepsix_trump/
trump,Conservatives,Ideological Politics,108263,"OH SHUT UP: Chicago Tribune Columnist Cries Trump Didn’t Win Election, ‘Disinformation Did’",97,11,No,Yes,0,https://www.newsbusters.org/blogs/free-speech/joseph-vazquez/2024/11/14/oh-shut-chicago-tribune-columnist-cries-trump-didnt-win,/r/conservatives/comments/1gr8g3s/oh_shut_up_chicago_tribune_columnist_cries_trump/
trump,Conservatives,Ideological Politics,108263,Elizabeth Warren Gets Demolished After She Blasts Trump's SecDef Pick,39,0,No,No,0,https://redstate.com/nick-arama/2024/11/13/elizabeth-warren-gets-demolished-after-she-blasts-trumps-sec-of-defense-pick-n2181927,/r/conservatives/comments/1grelaj/elizabeth_warren_gets_demolished_after_she_blasts/
trump,Conservatives,Ideological Politics,108263,Trump Should Stop Feds From Hiding Docs By Classifying Them,25,1,No,No,0,https://thefederalist.com/2024/11/14/trump-should-immediately-stop-federal-agencies-from-hiding-documents-by-needlessly-marking-them-classified/,/r/conservatives/comments/1grgj2c/trump_should_stop_feds_from_hiding_docs_by/
trump,dailywire,Ideological Politics,24225,Wall of Hate - Help Document Hatred Against Trump on July13th.com,79,16,Yes,No,0,https://july13th.com/hate/,/r/dailywire/comments/1e3cqx8/wall_of_hate_help_document_hatred_against_trump/
trump,dailywire,Ideological Politics,24225,A murder-suicide because Trump won,71,21,No,No,0,https://nypost.com/2024/11/10/us-news/minn-dad-anthony-nephew-ranted-against-trump-killed-family-in-murder-suicide/,/r/dailywire/comments/1grkks1/a_murdersuicide_because_trump_won/
trump,dailywire,Ideological Politics,24225,Trump is to select Kristi Neom as Homeland Security Secretary. I thought he was a misogynist. Did the left lie to me again? ,272,32,No,No,0,https://amp.cnn.com/cnn/2024/11/12/politics/kristi-noem-homeland-security-secretary,/r/dailywire/comments/1gqn3y3/trump_is_to_select_kristi_neom_as_homeland/
victory,dailywire,Ideological Politics,24225,MATGA' trend about poisoning husbands after Trump victory,65,6,No,No,0,https://i.redd.it/eu51p6zyun0e1.png,/r/dailywire/comments/1gqbjgl/matga_trend_about_poisoning_husbands_after_trump/
house,Liberal,Ideological Politics,119869,Woman testified to House Ethics Committee that Gaetz had sex with her when she was 17,362,32,No,No,0,https://abcnews.go.com/US/woman-testified-house-ethics-committee-gaetz-sex-17/story?id=115867555,/r/Liberal/comments/1grfwzd/woman_testified_to_house_ethics_committee_that/
biden,Liberal,Ideological Politics,119869,We need to *actually* create Blue MAGA. ,188,207,No,No,0,https://www.reddit.com/r/Liberal/comments/1gr7var/we_need_to_actually_create_blue_maga/,/r/Liberal/comments/1gr7var/we_need_to_actually_create_blue_maga/
trump,Liberal,Ideological Politics,119869,How long until Elon musk and Trump have a fall out? ,76,58,No,No,0,https://www.reddit.com/r/Liberal/comments/1gral4g/how_long_until_elon_musk_and_trump_have_a_fall_out/,/r/Liberal/comments/1gral4g/how_long_until_elon_musk_and_trump_have_a_fall_out/
trump,Liberal,Ideological Politics,119869,Trump Administration Bingo,9,11,No,No,0,https://www.reddit.com/r/Liberal/comments/1grh541/trump_administration_bingo/,/r/Liberal/comments/1grh541/trump_administration_bingo/
trump,Liberal,Ideological Politics,119869,Life in limbo,22,33,No,No,0,https://www.reddit.com/r/Liberal/comments/1gr9pty/life_in_limbo/,/r/Liberal/comments/1gr9pty/life_in_limbo/
trump,Liberal,Ideological Politics,119869,Trump taps Fox News host Pete Hegseth for defense secretary,9,2,No,No,0,https://www.cbsnews.com/news/trump-pete-hegseth-defense-secretary/,/r/Liberal/comments/1grdfzk/trump_taps_fox_news_host_pete_hegseth_for_defense/
house,Liberal,Ideological Politics,119869,"Republicans won the house majority and have secured the power, what will happen?",41,85,No,No,0,https://www.reddit.com/r/Liberal/comments/1gr0fio/republicans_won_the_house_majority_and_have/,/r/Liberal/comments/1gr0fio/republicans_won_the_house_majority_and_have/
trump,Liberal,Ideological Politics,119869,Someone Take Away Steve Bannon's Copy of *The Prince*,6,0,No,No,0,https://www.reddit.com/r/Liberal/comments/1grc6za/someone_take_away_steve_bannons_copy_of_the_prince/,/r/Liberal/comments/1grc6za/someone_take_away_steve_bannons_copy_of_the_prince/
trump,Liberal,Ideological Politics,119869,A message from a young white man in the trenches:  How to debate Trumpers.,154,140,No,No,0,https://www.reddit.com/r/Liberal/comments/1gqhod1/a_message_from_a_young_white_man_in_the_trenches/,/r/Liberal/comments/1gqhod1/a_message_from_a_young_white_man_in_the_trenches/
harris,KamalaHarris,Ideological Politics,75420,Kamala Harris *Did* Listen To Working-Class Voters. And They Didn't Listen to Her Opponent.,1781,108,Yes,No,0,https://washingtonmonthly.substack.com/p/kamala-harris-did-listen-to-working,/r/KamalaHarris/comments/1gpves2/kamala_harris_did_listen_to_workingclass_voters/
recount,KamalaHarris,Ideological Politics,75420,Computer Scientists: Breaches of Voting System Software Warrant Recounts to Ensure Election Verification,364,14,No,No,0,https://freespeechforpeople.org/computer-scientists-breaches-of-voting-system-software-warrant-recounts-to-ensure-election-verification/,/r/KamalaHarris/comments/1grlu7t/computer_scientists_breaches_of_voting_system/
biden,KamalaHarris,Ideological Politics,75420,"Biden Administration's Dept. of Ed. Investigation Finds Nex Benedict's School District ""Failed to Address"" Sexual Harassment",533,7,No,No,0,https://substack.com/@unclosetedmedia/note/c-77184595,/r/KamalaHarris/comments/1grfnf6/biden_administrations_dept_of_ed_investigation/
trump,KamalaHarris,Ideological Politics,75420,"Where Trump AG Pick Matt Gaetz Stands on Abortion, LGBTQ Rights and Criminal Justice",371,77,No,No,0,https://open.substack.com/pub/uncloseted/p/where-trump-ag-pick-matt-gaetz-stands?r=48d6ye&utm_campaign=post&utm_medium=web,/r/KamalaHarris/comments/1gr8owz/where_trump_ag_pick_matt_gaetz_stands_on_abortion/
harris,KamalaHarris,Ideological Politics,75420,Kamala Harris’s Concession Was a Masterclass in Resilience,402,60,No,No,0,https://www.inc.com/jessica-stillman/kamala-harriss-concession-speech-was-a-masterclass-in-why-hope-beats-optimism-for-resilience/91000662,/r/KamalaHarris/comments/1gr0164/kamala_harriss_concession_was_a_masterclass_in/
trump,KamalaHarris,Ideological Politics,75420,"No, Trump Did Not Win in a Landslide—nor Did He Secure a Mandate",1690,158,No,No,0,https://www.thenation.com/article/politics/harris-trump-election/,/r/KamalaHarris/comments/1gpzsdx/no_trump_did_not_win_in_a_landslidenor_did_he/
harris,KamalaHarris,Ideological Politics,75420,Kamala Harris greeted as she returns to the White House,3085,245,No,No,0,https://v.redd.it/qhewboav9j0e1,/r/KamalaHarris/comments/1gpv41o/kamala_harris_greeted_as_she_returns_to_the_white/
recount,KamalaHarris,Ideological Politics,75420,Why the Democratic Party must demand a recount w/Dean Obaidallah,515,59,No,No,0,https://youtu.be/FqfEmXjNPnw?si=Kob7g-2fVWXlGvIj,/r/KamalaHarris/comments/1gq61ac/why_the_democratic_party_must_demand_a_recount/
trump,Impeach_Trump,Ideological Politics,60526,Trump also appoints Matt Gaetz to serve as attorney general… the insanity of all of this is so outrageous and other worldly. ,150,4,No,No,0,https://www.cnbc.com/amp/2024/11/13/trump-taps-rep-matt-gaetz-as-attorney-general.html,/r/Impeach_Trump/comments/1gqnbam/trump_also_appoints_matt_gaetz_to_serve_as/
trump,Impeach_Trump,Ideological Politics,60526,Trump's defense choice stuns the Pentagon | apnews.com,100,1,No,No,0,https://apnews.com/article/trump-hegseth-defense-secretary-pentagon-2d8030921ecef933778cf92afd40ec72,/r/Impeach_Trump/comments/1gqakjc/trumps_defense_choice_stuns_the_pentagon_apnewscom/
trump,Impeach_Trump,Ideological Politics,60526,"Far-right extremists celebrate Trump’s win — In a burst of hate and misogyny, MAGA militants cheered the return of a president they consider an ally",160,1,No,No,0,https://www.washingtonpost.com/politics/2024/11/07/right-wing-extremists-celebrate-trump-victory/,/r/Impeach_Trump/comments/1gmvba5/farright_extremists_celebrate_trumps_win_in_a/
trump,Impeach_Trump,Ideological Politics,60526,Trump feigned ignorance of Project 2025,219,10,No,No,0,https://imghoster.co/en/FhQ7EhPjtSXOF4R,/r/Impeach_Trump/comments/1glm47g/trump_feigned_ignorance_of_project_2025/
trump,Impeach_Trump,Ideological Politics,60526,The Deep Roots of 4 of Donald Trump’s Highly Xenophobic Remarks,36,2,No,No,0,https://www.nytimes.com/2024/11/01/us/politics/trump-immigration-rhetoric-history.html,/r/Impeach_Trump/comments/1glhq62/the_deep_roots_of_4_of_donald_trumps_highly/
trump,Impeach_Trump,Ideological Politics,60526,Literal Neo-Nazi Leader Endorses Trump,216,1,No,No,0,https://www.rollingstone.com/politics/politics-news/trump-endorsement-neo-nazi-leader-nsc-131-1235154089/,/r/Impeach_Trump/comments/1gkmq6t/literal_neonazi_leader_endorses_trump/
trump,Impeach_Trump,Ideological Politics,60526,Trump's crowds are dwindling as his campaign winds down — Empty seats and early exits have grown more common,431,18,No,No,0,https://www.nytimes.com/2024/11/04/us/politics/trump-rally-crowds.html,/r/Impeach_Trump/comments/1gjn8sb/trumps_crowds_are_dwindling_as_his_campaign_winds/
trump,Impeach_Trump,Ideological Politics,60526,"Donald Trump talks about women at his rallies like they are objects, he doesn't see them as equals",299,3,No,No,0,https://imghoster.co/v3YtmBuQO5WqVHF,/r/Impeach_Trump/comments/1ggdie6/donald_trump_talks_about_women_at_his_rallies/
trump,Impeach_Trump,Ideological Politics,60526,"Donald Trump called half of America ""human scum""",194,5,No,No,0,https://imghoster.co/VN2ORQf6SinlHXJ?utm_source=reddit&utm_medium=impeach_trump,/r/Impeach_Trump/comments/1gg9nmz/donald_trump_called_half_of_america_human_scum/
trump,Impeach_Trump,Ideological Politics,60526,This is an amazing article written by user u/SilkyFluffs in r/democrats which is an amazing resource for combating GOP and Trump misinformation and possibly even converting family members or undecided voters,45,0,No,Yes,0,https://pdflink.to/d6e0bc9d/,/r/Impeach_Trump/comments/1ggd0pc/this_is_an_amazing_article_written_by_user/
trump,Impeach_Trump,Ideological Politics,60526,"Elon Musk predicts ‘hardship,’ economic turmoil and a stock-market crash if Trump wins",59,4,No,No,0,https://www.marketwatch.com/story/kaboom-elon-musk-predicts-hardship-economic-turmoil-and-a-stock-market-crash-if-trump-wins-20483008,/r/Impeach_Trump/comments/1gfwy5u/elon_musk_predicts_hardship_economic_turmoil_and/
