Keyword,Subreddit,Category,Members,Title,Upvotes,Comments,Moderator Interaction,Fact-Checking Mention,Total Awards,URL,Original Post URL
results,Wikileaks,General Politics,177643,Censored Wikileaks content?,12,7,No,No,0,https://www.reddit.com/r/WikiLeaks/comments/1frr2wq/censored_wikileaks_content/,/r/WikiLeaks/comments/1frr2wq/censored_wikileaks_content/
president,PoliticalDiscussion,General Politics,2184626,"If Democrats do shift to the populist left in 2028, who will be the leader of the movement with Bernie likely being too old?",304,1109,No,No,0,https://www.reddit.com/r/PoliticalDiscussion/comments/1gpgnc8/if_democrats_do_shift_to_the_populist_left_in/,/r/PoliticalDiscussion/comments/1gpgnc8/if_democrats_do_shift_to_the_populist_left_in/
trump,PoliticalDiscussion,General Politics,2184626,How likely is Trump to convert the US to a totalitarian dictatorship?,306,1268,No,No,0,https://www.reddit.com/r/PoliticalDiscussion/comments/1gp56t4/how_likely_is_trump_to_convert_the_us_to_a/,/r/PoliticalDiscussion/comments/1gp56t4/how_likely_is_trump_to_convert_the_us_to_a/
president,PoliticalDiscussion,General Politics,2184626,"If the 22nd Amendment had never been ratified, who would have been the first person since FDR to successfully run for a third term?",178,282,No,No,0,https://www.reddit.com/r/PoliticalDiscussion/comments/1goyi3t/if_the_22nd_amendment_had_never_been_ratified_who/,/r/PoliticalDiscussion/comments/1goyi3t/if_the_22nd_amendment_had_never_been_ratified_who/
trump,PoliticalDiscussion,General Politics,2184626,Do you expect Republican Infighting or Republican Unity to be more prominent in Trumps second term?,54,127,No,No,0,https://www.reddit.com/r/PoliticalDiscussion/comments/1goyjaq/do_you_expect_republican_infighting_or_republican/,/r/PoliticalDiscussion/comments/1goyjaq/do_you_expect_republican_infighting_or_republican/
biden,PoliticalDiscussion,General Politics,2184626,"Was Trump's win driven by an anti-incumbency sentiment? or was it a successful campaign strategy? had it been the former, would picking a candidate of the same party but not in the incumbent administration have levelled the playing field?",92,304,No,No,0,https://www.reddit.com/r/PoliticalDiscussion/comments/1goqx1f/was_trumps_win_driven_by_an_antiincumbency/,/r/PoliticalDiscussion/comments/1goqx1f/was_trumps_win_driven_by_an_antiincumbency/
trump,PoliticalDiscussion,General Politics,2184626,Did the plethora of state level abortion amendments neuter the impact of abortion in the presidential race?,111,207,No,No,0,https://www.reddit.com/r/PoliticalDiscussion/comments/1gonhzy/did_the_plethora_of_state_level_abortion/,/r/PoliticalDiscussion/comments/1gonhzy/did_the_plethora_of_state_level_abortion/
trump,PoliticalDiscussion,General Politics,2184626,Birthright citizenship. ,177,454,No,No,0,https://www.reddit.com/r/PoliticalDiscussion/comments/1gogkpp/birthright_citizenship/,/r/PoliticalDiscussion/comments/1gogkpp/birthright_citizenship/
trump,PoliticalDiscussion,General Politics,2184626,"If Marco Rubio gets picked as Secretary of State, who would Gov. DeSantis appoint to replace him in the U.S. Senate? And would he do a caretaker appt. or a strong appointee given how tough midterms will be?",64,121,No,Yes,0,https://www.reddit.com/r/PoliticalDiscussion/comments/1goi1av/if_marco_rubio_gets_picked_as_secretary_of_state/,/r/PoliticalDiscussion/comments/1goi1av/if_marco_rubio_gets_picked_as_secretary_of_state/
biden,PoliticalDiscussion,General Politics,2184626,How does the world deal with the schizophrenic foreign policy that America has? ,392,351,No,No,0,https://www.reddit.com/r/PoliticalDiscussion/comments/1go363q/how_does_the_world_deal_with_the_schizophrenic/,/r/PoliticalDiscussion/comments/1go363q/how_does_the_world_deal_with_the_schizophrenic/
president,PoliticalDiscussion,General Politics,2184626,What happened to landslide victories?,11,43,No,No,0,https://www.reddit.com/r/PoliticalDiscussion/comments/1goeeuk/what_happened_to_landslide_victories/,/r/PoliticalDiscussion/comments/1goeeuk/what_happened_to_landslide_victories/
trump,PoliticalDiscussion,General Politics,2184626,"Some say: ""The Resistance is about to Ignite."" Referencing State Actors, such as Governors and AGs, Federal Courts, the Press and the Educators and Civil Society [the People.] Are those guardrails still there to thwart attempts by Trump to usurp the Constitution?",300,388,No,No,0,https://www.reddit.com/r/PoliticalDiscussion/comments/1gnmmyw/some_say_the_resistance_is_about_to_ignite/,/r/PoliticalDiscussion/comments/1gnmmyw/some_say_the_resistance_is_about_to_ignite/
results,NeutralPolitics,General Politics,610619,What to expect after the U.S. election,281,26,Yes,Yes,0,https://www.reddit.com/r/NeutralPolitics/comments/1gflxpk/what_to_expect_after_the_us_election/,/r/NeutralPolitics/comments/1gflxpk/what_to_expect_after_the_us_election/
results,NeutralPolitics,General Politics,610619,Trump won the presidency and popular vote running on the mass deportation of illegal aliens. Who saw this coming and what lessons can be learned?,200,326,No,No,0,https://www.reddit.com/r/NeutralPolitics/comments/1gnk7ih/trump_won_the_presidency_and_popular_vote_running/,/r/NeutralPolitics/comments/1gnk7ih/trump_won_the_presidency_and_popular_vote_running/
results,NeutralPolitics,General Politics,610619,Is now the time for a NEW moderate third party in U.S. politics?,0,70,No,No,0,https://www.reddit.com/r/NeutralPolitics/comments/1gms9so/is_now_the_time_for_a_new_moderate_third_party_in/,/r/NeutralPolitics/comments/1gms9so/is_now_the_time_for_a_new_moderate_third_party_in/
harris,NeutralPolitics,General Politics,610619,Why Are So Many Men Leaving The Democratic Party Over The Last Few Years?,384,156,No,No,0,https://www.reddit.com/r/NeutralPolitics/comments/1gklb9t/why_are_so_many_men_leaving_the_democratic_party/,/r/NeutralPolitics/comments/1gklb9t/why_are_so_many_men_leaving_the_democratic_party/
trump,NeutralPolitics,General Politics,610619,What plans about trump and kamala have on section 8 housing and dept of edu.,1,11,No,No,0,https://www.reddit.com/r/NeutralPolitics/comments/1gk1emp/what_plans_about_trump_and_kamala_have_on_section/,/r/NeutralPolitics/comments/1gk1emp/what_plans_about_trump_and_kamala_have_on_section/
outcome,NeutralPolitics,General Politics,610619,"What are the pros and cons of predictive election models, like 538, for our discourse around elections?",43,94,No,No,0,https://www.reddit.com/r/NeutralPolitics/comments/1giqib5/what_are_the_pros_and_cons_of_predictive_election/,/r/NeutralPolitics/comments/1giqib5/what_are_the_pros_and_cons_of_predictive_election/
harris,NeutralPolitics,General Politics,610619,How do the Trump and Harris plans for workforce pay and taxes compare?,4,6,No,No,0,https://www.reddit.com/r/NeutralPolitics/comments/1ggxh8w/how_do_the_trump_and_harris_plans_for_workforce/,/r/NeutralPolitics/comments/1ggxh8w/how_do_the_trump_and_harris_plans_for_workforce/
fraud,NeutralPolitics,General Politics,610619,Has there been any investigative journalism or public legal discovery to examine process irregularities regarding the 2020 election?,12,15,No,No,0,https://www.reddit.com/r/NeutralPolitics/comments/1ggkpzr/has_there_been_any_investigative_journalism_or/,/r/NeutralPolitics/comments/1ggkpzr/has_there_been_any_investigative_journalism_or/
outcome,NeutralPolitics,General Politics,610619,"War involving Israel, Lebanon, and Iran--Motivations? Scale of Conflict?",15,6,No,No,0,https://www.reddit.com/r/NeutralPolitics/comments/1ge5sct/war_involving_israel_lebanon_and_iranmotivations/,/r/NeutralPolitics/comments/1ge5sct/war_involving_israel_lebanon_and_iranmotivations/
bernie,moderatepolitics,General Politics,296194,Bernie Sanders blasts Democrats for their attitude towards Joe Rogan,380,564,No,No,0,https://thehill.com/homenews/media/4983254-bernie-sanders-blasts-democrats-attitude-towards-joe-rogan/,/r/moderatepolitics/comments/1gppd5i/bernie_sanders_blasts_democrats_for_their/
trump,moderatepolitics,General Politics,296194,FEMA worker breaks silence after telling staff to avoid Trump homes,129,110,No,No,0,https://www.msn.com/en-xl/news/other/fema-worker-breaks-silence-after-telling-staff-to-avoid-trump-homes/ar-AA1tX6YY?cvid=CD4898BA60F64268BB242705C270829D&ocid=wispr,/r/moderatepolitics/comments/1gpqc41/fema_worker_breaks_silence_after_telling_staff_to/
house,moderatepolitics,General Politics,296194,Revitalizing the House: Bipartisan Recommendations on Rules and Process,21,4,No,No,0,https://www.hoover.org/research/revitalizing-house-bipartisan-recommendations-rules-and-process,/r/moderatepolitics/comments/1gppszh/revitalizing_the_house_bipartisan_recommendations/
house,moderatepolitics,General Politics,296194,Decision Desk HQ projects that Republicans have won enough seats to control the US House.,393,526,No,No,0,https://decisiondeskhq.com/results/2024/General/US-House/,/r/moderatepolitics/comments/1gp80yx/decision_desk_hq_projects_that_republicans_have/
trump,moderatepolitics,General Politics,296194,"Trump expected to tap US Senator Marco Rubio for secretary of state, sources say",223,265,No,No,0,https://www.reuters.com/world/us/trump-taps-us-senator-marco-rubio-secretary-state-2024-11-12/,/r/moderatepolitics/comments/1gpbb2f/trump_expected_to_tap_us_senator_marco_rubio_for/
trump,moderatepolitics,General Politics,296194,Trump selects Mike Waltz as national security adviser,117,111,No,No,0,https://ground.news/article/trump-selects-mike-waltz-as-national-security-adviser-source-says_a33643?utm_source=mobile-app&utm_medium=article-share,/r/moderatepolitics/comments/1gp9fq3/trump_selects_mike_waltz_as_national_security/
trump,moderatepolitics,General Politics,296194,Trump wins biggest popular vote count by a Republican ever in history,553,819,No,No,0,https://nypost.com/2024/11/10/us-news/donald-trump-wins-most-popular-votes-by-a-republican-ever/,/r/moderatepolitics/comments/1gowcyo/trump_wins_biggest_popular_vote_count_by_a/
harris,moderatepolitics,General Politics,296194,Carville: Harris had ‘every advantage’ in the race,182,419,No,No,0,https://thehill.com/homenews/campaign/4983934-carville-harris-presidential-campaign/,/r/moderatepolitics/comments/1gp4yrc/carville_harris_had_every_advantage_in_the_race/
trump,moderatepolitics,General Politics,296194,Trump taps former Rep. Lee Zeldin to lead the Environmental Protection Agency,108,84,No,No,0,https://www.nbcnews.com/politics/donald-trump/trump-taps-lee-zeldin-lead-environmental-protection-agency-rcna179658,/r/moderatepolitics/comments/1gp58af/trump_taps_former_rep_lee_zeldin_to_lead_the/
loss,moderatepolitics,General Politics,296194,Homeward bound: Tim Walz returns to Minnesota after election loss,250,325,No,No,0,https://www.usatoday.com/story/news/politics/elections/2024/11/06/tim-walz-loses-election/75719431007/,/r/moderatepolitics/comments/1gotdz8/homeward_bound_tim_walz_returns_to_minnesota/
trump,moderatepolitics,General Politics,296194,Trump chooses New York Rep. Elise Stefanik as ambassador to United Nations,190,104,No,No,0,https://apnews.com/article/trump-united-nations-elise-stefanik-ambassador-2b482fb39a8d6f03d389d27cc8820056,/r/moderatepolitics/comments/1goui4f/trump_chooses_new_york_rep_elise_stefanik_as/
trump,moderatepolitics,General Politics,296194,What Donald Trump's 'concealed carry reciprocity' means for gun rights,104,215,No,No,0,https://www.newsweek.com/donald-trump-concealed-carry-reciprocity-1983740,/r/moderatepolitics/comments/1gov5qt/what_donald_trumps_concealed_carry_reciprocity/
trump,technology,General Politics,17389987,"Trump expected to try to halt TikTok ban, allies say",1173,236,No,No,0,https://www.washingtonpost.com/business/2024/11/12/trump-tiktok-ban-sale/,/r/technology/comments/1gpth9g/trump_expected_to_try_to_halt_tiktok_ban_allies/
trump,technology,General Politics,17389987,Will the CHIPS Act survive a Trump presidency?,1457,286,No,No,0,https://www.computerworld.com/article/3601464/will-the-chips-act-survive-a-trump-presidency.html,/r/technology/comments/1gpkyjv/will_the_chips_act_survive_a_trump_presidency/
biden,technology,General Politics,17389987,"Trump's Re-Election Could Reignite Battle Over Space Command Headquarters | Biden reversed a controversial decision to relocate the U.S. Space Command to Alabama, but Trump is expected to follow through with his original plan.",1439,348,No,No,0,https://gizmodo.com/trumps-re-election-could-reignite-battle-over-space-command-headquarters-2000523256,/r/technology/comments/1gpjzrx/trumps_reelection_could_reignite_battle_over/
trump,technology,General Politics,17389987,Trump Already Preparing to Load Up Government with Pro-Crypto Officials,5733,805,No,No,0,https://gizmodo.com/trump-already-preparing-to-load-up-government-with-pro-crypto-officials-2000523234,/r/technology/comments/1gpasi8/trump_already_preparing_to_load_up_government/
victory,democrats,Ideological Politics,480544,MSNBC Viewership Drops by Half in Days After Trump Victory,791,372,No,No,0,https://www.thewrap.com/msnbc-cnn-fox-news-ratings-after-trump-election/,/r/democrats/comments/1gprvlu/msnbc_viewership_drops_by_half_in_days_after/
biden,democrats,Ideological Politics,480544,"Biden wants Americans to ""bring down the temperature"" — but MAGA will not let that happen",599,165,No,No,0,https://www.salon.com/2024/11/12/biden-wants-americans-to-bring-down-the-temperature--but-maga-will-not-let-that-happen/,/r/democrats/comments/1gpn6a4/biden_wants_americans_to_bring_down_the/
harris,democrats,Ideological Politics,480544,"Harris did not lose because of young white men or immigration or “wokeism”. It was the economy, stupid.",399,362,No,No,0,https://www.ft.com/content/e8ac09ea-c300-4249-af7d-109003afb893,/r/democrats/comments/1gpn6ue/harris_did_not_lose_because_of_young_white_men_or/
recount,democrats,Ideological Politics,480544,Harris fundraising page says a portion of donations will be directed to recount effort,479,74,No,No,0,https://www.usatoday.com/story/news/politics/elections/2024/11/11/kamala-harris-fundraiser-donations-election-recount/76195287007/,/r/democrats/comments/1gplefe/harris_fundraising_page_says_a_portion_of/
senate,democrats,Ideological Politics,480544,Democrat Ruben Gallego beats far-right Republican Kari Lake to win Arizona senate seat ,469,20,No,No,0,https://www.theguardian.com/us-news/2024/nov/12/us-election-arizona-senate-race-ruben-gallego-kari-lake,/r/democrats/comments/1gpjd4c/democrat_ruben_gallego_beats_farright_republican/
victory,Republican,Ideological Politics,205175,Insult to Injury: MSNBC and CNN Suffer Staggering Ratings Plunge Following Trump Victory,270,43,No,No,0,https://www.westernjournal.com/insult-injury-msnbc-cnn-suffer-staggering-ratings-plunge-following-trump-victory/,/r/Republican/comments/1gpo9d3/insult_to_injury_msnbc_and_cnn_suffer_staggering/
harris,Republican,Ideological Politics,205175,Fans Rush to Roast Celebrities Reportedly Paid Off to Endorse Horrible Harris 😁👍,129,4,No,No,0,https://www.breitbart.com/entertainment/2024/11/12/fans-rush-to-roast-celebrities-reportedly-paid-off-to-endorse-kamala-and-beyonce-didnt-even-perform/,/r/Republican/comments/1gpot7g/fans_rush_to_roast_celebrities_reportedly_paid/
supreme court,Republican,Ideological Politics,205175,Remember all those Democrat Senators saying they wanted to end the Filibuster and Pack the Supreme Court?,102,17,No,No,0,https://www.dailywire.com/news/we-asked-every-dem-senator-about-the-filibuster-and-scotus-here-are-their-responses,/r/Republican/comments/1gpplue/remember_all_those_democrat_senators_saying_they/
biden,Republican,Ideological Politics,205175,Melania Declines White House Meeting with Jill Biden for a Startling Reason – Booyah !!!,143,17,No,No,0,https://pjmedia.com/robert-spencer/2024/11/12/she-aint-going-melania-declines-white-house-meeting-with-jill-biden-for-a-startling-reason-n4934197,/r/Republican/comments/1gpn3ei/melania_declines_white_house_meeting_with_jill/
trump,Republican,Ideological Politics,205175,"""Fired"" FEMA Manager: Refusing to help victims with Trump signage was agency policy, not my decision, and in the Carolinas also, not just Florida. I am being used as a scapegoat.",13,4,No,No,0,https://x.com/erichhartmann/status/1856361566754471976,/r/Republican/comments/1gpvtg2/fired_fema_manager_refusing_to_help_victims_with/
trump,Republican,Ideological Politics,205175,"Trump Appoints Rep. Elise Stefanik as UN Ambassador, Signaling Strong U.S. Stance on Global Issues",48,6,No,No,0,https://m10news.com/trump-appoints-rep-elise-stefanik-as-un-ambassador-signaling-strong-u-s-stance-on-global-issues/,/r/Republican/comments/1gpjdyh/trump_appoints_rep_elise_stefanik_as_un/
trump,Conservative,Ideological Politics,1145403,"Trump Nominated  U.S. Ambassador to Israel, Mike Huckabee",708,143,No,No,0,https://i.redd.it/7j7n30grwi0e1.jpeg,/r/Conservative/comments/1gptct2/trump_nominated_us_ambassador_to_israel_mike/
harris,Conservative,Ideological Politics,1145403,Donald Trump Was Such a Threat to Democracy That Oprah Charged $1 Million to Endorse Kamala Harris,1792,336,No,No,0,https://redstate.com/joesquire/2024/11/11/donald-trump-was-such-a-threat-to-democracy-that-oprah-charged-1-million-to-endorse-kamala-harris-n2181859,/r/Conservative/comments/1gpjzb7/donald_trump_was_such_a_threat_to_democracy_that/
trump,Conservative,Ideological Politics,1145403,FEMA worker accused of telling staff to skip hurricane-ravaged Trump homes claims it was common practice: ‘This is not isolated,548,64,No,No,0,https://nypost.com/2024/11/12/us-news/fema-worker-accused-of-telling-staff-to-skip-hurricane-ravaged-trump-homes-claims-it-was-common-practice-this-is-not-isolated/,/r/Conservative/comments/1gprj3k/fema_worker_accused_of_telling_staff_to_skip/
trump,Conservative,Ideological Politics,1145403,MSNBC’s Viewership Sinks More Than 50 Percent After Trump’s Landslide Win ,470,33,No,No,0,https://www.breitbart.com/2024-election/2024/11/12/report-msnbcs-viewership-sinks-over-50-percent-after-trumps-landslide-win/,/r/Conservative/comments/1gps7cx/msnbcs_viewership_sinks_more_than_50_percent/
electoral,Conservative,Ideological Politics,1145403,Lefties on reddit are already losing their mind and claiming election fraud. 🤦‍♂️,351,86,No,No,0,https://www.reddit.com/r/Conservative/comments/1gpujis/lefties_on_reddit_are_already_losing_their_mind/,/r/Conservative/comments/1gpujis/lefties_on_reddit_are_already_losing_their_mind/
trump,Conservative,Ideological Politics,1145403,"No Trump bump: MSNBC hemorrhaging viewers since Election Day, sheds more than half of primetime audience",984,84,No,No,0,https://www.foxnews.com/media/msnbc-hemorrhaging-viewers-since-election-day-sheds-more-than-half-of-primetime-audience,/r/Conservative/comments/1gpk927/no_trump_bump_msnbc_hemorrhaging_viewers_since/
biden,Conservative,Ideological Politics,1145403,"Melania Stiff-Arms Jill Biden, Will Reportedly Skip Traditional Tea Between First Ladies Despite Invite",1008,77,No,No,0,https://redstate.com/rusty-weiss/2024/11/11/melania-stiff-arms-jill-biden-will-reportedly-skip-traditional-tea-between-first-ladies-despite-invite-n2181857,/r/Conservative/comments/1gpjzsf/melania_stiffarms_jill_biden_will_reportedly_skip/
harris,Conservative,Ideological Politics,1145403,A Man of Principle: Mark Cuban Busy Deleting All His Pro-Kamala Harris Tweets,775,38,No,No,0,https://redstate.com/bobhoge/2024/11/11/a-man-of-principle-mark-cuban-deletes-all-his-pro-kamala-harris-tweets-less-than-a-week-after-election-n2181861,/r/Conservative/comments/1gpjyvl/a_man_of_principle_mark_cuban_busy_deleting_all/
trump,Conservative,Ideological Politics,1145403,SCOTUS Associate Justice Sonia Sotomayor Will Not Resign Before Trump Reenters Office,399,90,No,No,0,https://www.breitbart.com/pre-viral/2024/11/11/report-scotus-associate-justice-sonia-sotomayor-will-not-resign-before-trump-reenters-office/,/r/Conservative/comments/1gpols7/scotus_associate_justice_sonia_sotomayor_will_not/
trump,Conservative,Ideological Politics,1145403,"Border Patrol, ICE morale surging after Trump election win: 'They know they can get the bad guys now'",713,16,No,No,0,https://www.foxnews.com/us/border-patrol-ice-morale-surging-trump-election-win-they-know-they-can-get-the-bad-guys-now,/r/Conservative/comments/1gpj4kr/border_patrol_ice_morale_surging_after_trump/
biden,Conservative,Ideological Politics,1145403,TDS-Riddled Pelosi Absurdly Claims 'Fewer' Illegal Aliens Entered the US Under Biden Than Trump,154,20,No,No,0,https://redstate.com/mike_miller/2024/11/11/tds-riddled-pelosi-absurdly-claims-fewer-illegal-aliens-entered-the-us-under-biden-than-trump-n2181831,/r/Conservative/comments/1gpu8hp/tdsriddled_pelosi_absurdly_claims_fewer_illegal/
vance,Conservative,Ideological Politics,1145403,It Has Begun: JD Vance Sneaks Into Woman's House To Check If She's On Her Period,313,11,No,No,0,https://babylonbee.com/news/it-has-begun-jd-vance-sneaks-into-womans-house-to-check-if-shes-on-her-period,/r/Conservative/comments/1gpojzm/it_has_begun_jd_vance_sneaks_into_womans_house_to/
president,Libertarian,Ideological Politics,503639,"Argentina reachs2,7% inflation rate in october and still decreasing",167,8,No,No,0,https://i.redd.it/o8snadk63j0e1.jpeg,/r/Libertarian/comments/1gpu7hq/argentina_reachs27_inflation_rate_in_october_and/
trump,Libertarian,Ideological Politics,503639,President-elect Trump Reaffirms Push for National Concealed Carry Reciprocity,24,5,No,No,0,https://www.thetruthaboutguns.com/trump-reaffirms-push-for-national-concealed-carry-reciprocity/,/r/Libertarian/comments/1gpuuhy/presidentelect_trump_reaffirms_push_for_national/
trump,Libertarian,Ideological Politics,503639,Trump Picks Neocon Warmonger Mike Waltz as National Security Advisor,23,5,No,No,0,https://news.antiwar.com/2024/11/11/trump-picks-rep-mike-waltz-as-national-security-advisor/,/r/Libertarian/comments/1gpltjl/trump_picks_neocon_warmonger_mike_waltz_as/
trump,Anarchism,Ideological Politics,271040,What can a 13 year old do,46,20,No,No,0,https://www.reddit.com/r/Anarchism/comments/1gpderb/what_can_a_13_year_old_do/,/r/Anarchism/comments/1gpderb/what_can_a_13_year_old_do/
biden,Anarchism,Ideological Politics,271040,"Im a disabled person, and im begging you to get informed about covid.",411,134,No,No,0,https://www.reddit.com/r/Anarchism/comments/1goj9ja/im_a_disabled_person_and_im_begging_you_to_get/,/r/Anarchism/comments/1goj9ja/im_a_disabled_person_and_im_begging_you_to_get/
trump,Socialism,Ideological Politics,460864,Don’t Despair: Trump Isn’t Invincible,70,6,No,No,0,https://jacobin.com/2024/11/trump-election-lessons-democrats-labor,/r/socialism/comments/1gpmrzt/dont_despair_trump_isnt_invincible/
vance,Socialism,Ideological Politics,460864,"Benjamin Norton discusses how the CIA has spent decades supporting pro-imperialist factions of the Western left, which it calls the ""compatible left"" or ""non-communist left,"" in order to advance US foreign-policy interests.",176,8,No,No,0,https://v.redd.it/v5xhp1hzkc0e1,/r/socialism/comments/1gp4zz7/benjamin_norton_discusses_how_the_cia_has_spent/
president,Socialism,Ideological Politics,460864,What to do when individuals you're engaging with turn out to express intense racism?,36,19,No,No,0,https://www.reddit.com/r/socialism/comments/1gped6k/what_to_do_when_individuals_youre_engaging_with/,/r/socialism/comments/1gped6k/what_to_do_when_individuals_youre_engaging_with/
vance,Socialism,Ideological Politics,460864,"Serious question, Is China really that homophobic? What are homosexual people's rights actually like in China?",8,2,No,Yes,0,https://www.reddit.com/r/socialism/comments/1gpm4pr/serious_question_is_china_really_that_homophobic/,/r/socialism/comments/1gpm4pr/serious_question_is_china_really_that_homophobic/
results,Socialism,Ideological Politics,460864,UK socialist parties,11,16,No,No,0,https://www.reddit.com/r/socialism/comments/1gphy2m/uk_socialist_parties/,/r/socialism/comments/1gphy2m/uk_socialist_parties/
trump,Progressive,Ideological Politics,78042,Behind the Curtain: Trump's business bonanza,13,1,No,No,0,https://www.axios.com/2024/11/07/trump-elon-musk-business-tax-cuts,/r/progressive/comments/1gm4w17/behind_the_curtain_trumps_business_bonanza/
victory,Progressive,Ideological Politics,78042,Far-Right Donald Trump Supporters Celebrate His Victory with Violent Memes and Calls for Executions,247,13,No,No,0,https://www.wired.com/story/donald-trump-far-right-supporters-violent-memes/,/r/progressive/comments/1glfnyf/farright_donald_trump_supporters_celebrate_his/
trump,Progressive,Ideological Politics,78042,What Trump's first 100 days in office could look like,26,4,No,No,0,https://www.npr.org/2024/11/06/nx-s1-5181800/2024-election-trump-first-100-days-agenda,/r/progressive/comments/1glo04a/what_trumps_first_100_days_in_office_could_look/
trump,Progressive,Ideological Politics,78042,Americans in Puerto Rico can't vote for US president. Their anger at Trump is shaping the race.,341,31,No,No,0,https://apnews.com/article/puerto-rico-trump-joke-garbage-a91e2aafd93a06d32365efa013581b85,/r/progressive/comments/1gh2ab4/americans_in_puerto_rico_cant_vote_for_us/
harris,Progressive,Ideological Politics,78042,"Trump loyalists spew racist, vulgar attacks at Harris and Democrats at New York City rally",261,6,No,No,0,https://www.cnn.com/2024/10/27/politics/trump-rally-madison-square-garden-vulgar-attacks/index.html,/r/progressive/comments/1gdskia/trump_loyalists_spew_racist_vulgar_attacks_at/
results,Republicanism,Ideological Politics,917,Survey about your political worldview (18+; 12-14 mins to complete),3,0,No,No,0,https://www.reddit.com/r/republicanism/comments/1aq418a/survey_about_your_political_worldview_18_1214/,/r/republicanism/comments/1aq418a/survey_about_your_political_worldview_18_1214/
