Keyword,Subreddit,Category,Members,Title,Upvotes,Comments,Moderator Interaction,Fact-Checking Mention,Total Awards,URL,Original Post URL
victory,Conservatives,Ideological Politics,108263,"Don Lemon, Jamie Lee Curtis Announce They Are Leaving X Following Trump Victory",310,74,No,No,0,https://www.dailywire.com/news/don-lemon-jamie-lee-curtis-announce-they-are-leaving-x-following-trump-victory,/r/conservatives/comments/1gqulnz/don_lemon_jamie_lee_curtis_announce_they_are/
trump,Conservatives,Ideological Politics,108263,Opinion: Progressives insult Americans because Trump won. Guess who that helps?,12,0,No,No,0,https://www.usatoday.com/story/opinion/columnist/2024/11/14/trump-election-win-progressive-meltdown-msnbc-colbert/76196558007/,/r/conservatives/comments/1gr9ni3/opinion_progressives_insult_americans_because/
trump,Conservatives,Ideological Politics,108263,"Disney’s ‘Snow White’ Actress Attacks Trump Voters, Tells People To Leave X",128,22,No,No,0,https://www.dailywire.com/news/disneys-snow-white-actress-attacks-trump-voters-tells-people-to-leave-x,/r/conservatives/comments/1gquxp9/disneys_snow_white_actress_attacks_trump_voters/
trump,Conservatives,Ideological Politics,108263,Trump Taps Tulsi Gabbard For Director Of National Intelligence,82,7,No,No,0,https://www.dailywire.com/news/trump-taps-tulsi-gabbard-for-director-of-national-intelligence,/r/conservatives/comments/1gqwc9c/trump_taps_tulsi_gabbard_for_director_of_national/
trump,Conservatives,Ideological Politics,108263,President Trump nominates Rep. Matt Gaetz for attorney general,156,47,No,No,0,https://www.foxnews.com/politics/matt-gaetz-faces-gop-senate-opposition-after-trump-selection-attorney-general,/r/conservatives/comments/1gqqzei/president_trump_nominates_rep_matt_gaetz_for/
trump,Conservatives,Ideological Politics,108263,Report: Trump Team Focuses on Pentagon Officers to Fire,91,12,No,No,0,https://www.newsmax.com/politics/donald-trump-transition-team-pentagon/2024/11/13/id/1187952/,/r/conservatives/comments/1gqsqdu/report_trump_team_focuses_on_pentagon_officers_to/
trump,dailywire,Ideological Politics,24218,Wall of Hate - Help Document Hatred Against Trump on July13th.com,79,16,Yes,No,0,https://july13th.com/hate/,/r/dailywire/comments/1e3cqx8/wall_of_hate_help_document_hatred_against_trump/
trump,dailywire,Ideological Politics,24218,Trump is to select Kristi Neom as Homeland Security Secretary. I thought he was a misogynist. Did the left lie to me again? ,262,32,No,No,0,https://amp.cnn.com/cnn/2024/11/12/politics/kristi-noem-homeland-security-secretary,/r/dailywire/comments/1gqn3y3/trump_is_to_select_kristi_neom_as_homeland/
victory,dailywire,Ideological Politics,24218,MATGA' trend about poisoning husbands after Trump victory,68,6,No,No,0,https://i.redd.it/eu51p6zyun0e1.png,/r/dailywire/comments/1gqbjgl/matga_trend_about_poisoning_husbands_after_trump/
biden,Liberal,Ideological Politics,119861,We need to *actually* create Blue MAGA. ,55,88,No,No,0,https://www.reddit.com/r/Liberal/comments/1gr7var/we_need_to_actually_create_blue_maga/,/r/Liberal/comments/1gr7var/we_need_to_actually_create_blue_maga/
trump,Liberal,Ideological Politics,119861,How long until Elon musk and Trump have a fall out? ,26,19,No,No,0,https://www.reddit.com/r/Liberal/comments/1gral4g/how_long_until_elon_musk_and_trump_have_a_fall_out/,/r/Liberal/comments/1gral4g/how_long_until_elon_musk_and_trump_have_a_fall_out/
trump,Liberal,Ideological Politics,119861,Could this be the end of democracy? ,176,155,No,No,0,https://www.reddit.com/r/Liberal/comments/1gqy3z3/could_this_be_the_end_of_democracy/,/r/Liberal/comments/1gqy3z3/could_this_be_the_end_of_democracy/
biden,Liberal,Ideological Politics,119861,A bunch of people didn't vote for her,47,58,No,No,0,https://www.reddit.com/r/Liberal/comments/1gr3bm1/a_bunch_of_people_didnt_vote_for_her/,/r/Liberal/comments/1gr3bm1/a_bunch_of_people_didnt_vote_for_her/
house,Liberal,Ideological Politics,119861,"Republicans won the house majority and have secured the power, what will happen?",30,68,No,No,0,https://www.reddit.com/r/Liberal/comments/1gr0fio/republicans_won_the_house_majority_and_have/,/r/Liberal/comments/1gr0fio/republicans_won_the_house_majority_and_have/
trump,Liberal,Ideological Politics,119861,Life in limbo,6,12,No,No,0,https://www.reddit.com/r/Liberal/comments/1gr9pty/life_in_limbo/,/r/Liberal/comments/1gr9pty/life_in_limbo/
trump,Liberal,Ideological Politics,119861,A message from a young white man in the trenches:  How to debate Trumpers.,153,136,No,No,0,https://www.reddit.com/r/Liberal/comments/1gqhod1/a_message_from_a_young_white_man_in_the_trenches/,/r/Liberal/comments/1gqhod1/a_message_from_a_young_white_man_in_the_trenches/
trump,Liberal,Ideological Politics,119861,Someone Take Away Steve Bannon's Copy of *The Prince*,1,0,No,No,0,https://www.reddit.com/r/Liberal/comments/1grc6za/someone_take_away_steve_bannons_copy_of_the_prince/,/r/Liberal/comments/1grc6za/someone_take_away_steve_bannons_copy_of_the_prince/
harris,KamalaHarris,Ideological Politics,75505,Kamala Harris *Did* Listen To Working-Class Voters. And They Didn't Listen to Her Opponent.,1746,102,Yes,No,0,https://washingtonmonthly.substack.com/p/kamala-harris-did-listen-to-working,/r/KamalaHarris/comments/1gpves2/kamala_harris_did_listen_to_workingclass_voters/
trump,KamalaHarris,Ideological Politics,75505,"Where Trump AG Pick Matt Gaetz Stands on Abortion, LGBTQ Rights and Criminal Justice",187,37,No,No,0,https://open.substack.com/pub/uncloseted/p/where-trump-ag-pick-matt-gaetz-stands?r=48d6ye&utm_campaign=post&utm_medium=web,/r/KamalaHarris/comments/1gr8owz/where_trump_ag_pick_matt_gaetz_stands_on_abortion/
harris,KamalaHarris,Ideological Politics,75505,Kamala Harris’s Concession Was a Masterclass in Resilience,265,30,No,No,0,https://www.inc.com/jessica-stillman/kamala-harriss-concession-speech-was-a-masterclass-in-why-hope-beats-optimism-for-resilience/91000662,/r/KamalaHarris/comments/1gr0164/kamala_harriss_concession_was_a_masterclass_in/
trump,KamalaHarris,Ideological Politics,75505,"No, Trump Did Not Win in a Landslide—nor Did He Secure a Mandate",1625,146,No,No,0,https://www.thenation.com/article/politics/harris-trump-election/,/r/KamalaHarris/comments/1gpzsdx/no_trump_did_not_win_in_a_landslidenor_did_he/
harris,KamalaHarris,Ideological Politics,75505,Kamala Harris greeted as she returns to the White House,3025,239,No,No,0,https://v.redd.it/qhewboav9j0e1,/r/KamalaHarris/comments/1gpv41o/kamala_harris_greeted_as_she_returns_to_the_white/
recount,KamalaHarris,Ideological Politics,75505,Why the Democratic Party must demand a recount w/Dean Obaidallah,478,42,No,No,0,https://youtu.be/FqfEmXjNPnw?si=Kob7g-2fVWXlGvIj,/r/KamalaHarris/comments/1gq61ac/why_the_democratic_party_must_demand_a_recount/
recount,KamalaHarris,Ideological Politics,75505,Harris fundraising page says a portion of donations will be directed to recount effort,1255,136,No,No,0,https://www.usatoday.com/story/news/politics/elections/2024/11/11/kamala-harris-fundraiser-donations-election-recount/76195287007/,/r/KamalaHarris/comments/1gplf80/harris_fundraising_page_says_a_portion_of/
trump,Impeach_Trump,Ideological Politics,60531,Trump also appoints Matt Gaetz to serve as attorney general… the insanity of all of this is so outrageous and other worldly. ,131,4,No,No,0,https://www.cnbc.com/amp/2024/11/13/trump-taps-rep-matt-gaetz-as-attorney-general.html,/r/Impeach_Trump/comments/1gqnbam/trump_also_appoints_matt_gaetz_to_serve_as/
trump,Impeach_Trump,Ideological Politics,60531,Trump's defense choice stuns the Pentagon | apnews.com,99,1,No,No,0,https://apnews.com/article/trump-hegseth-defense-secretary-pentagon-2d8030921ecef933778cf92afd40ec72,/r/Impeach_Trump/comments/1gqakjc/trumps_defense_choice_stuns_the_pentagon_apnewscom/
trump,Impeach_Trump,Ideological Politics,60531,"Far-right extremists celebrate Trump’s win — In a burst of hate and misogyny, MAGA militants cheered the return of a president they consider an ally",161,1,No,No,0,https://www.washingtonpost.com/politics/2024/11/07/right-wing-extremists-celebrate-trump-victory/,/r/Impeach_Trump/comments/1gmvba5/farright_extremists_celebrate_trumps_win_in_a/
trump,Impeach_Trump,Ideological Politics,60531,Trump feigned ignorance of Project 2025,219,10,No,No,0,https://imghoster.co/en/FhQ7EhPjtSXOF4R,/r/Impeach_Trump/comments/1glm47g/trump_feigned_ignorance_of_project_2025/
trump,Impeach_Trump,Ideological Politics,60531,The Deep Roots of 4 of Donald Trump’s Highly Xenophobic Remarks,33,2,No,No,0,https://www.nytimes.com/2024/11/01/us/politics/trump-immigration-rhetoric-history.html,/r/Impeach_Trump/comments/1glhq62/the_deep_roots_of_4_of_donald_trumps_highly/
trump,Impeach_Trump,Ideological Politics,60531,Literal Neo-Nazi Leader Endorses Trump,218,1,No,No,0,https://www.rollingstone.com/politics/politics-news/trump-endorsement-neo-nazi-leader-nsc-131-1235154089/,/r/Impeach_Trump/comments/1gkmq6t/literal_neonazi_leader_endorses_trump/
trump,Impeach_Trump,Ideological Politics,60531,Trump's crowds are dwindling as his campaign winds down — Empty seats and early exits have grown more common,430,18,No,No,0,https://www.nytimes.com/2024/11/04/us/politics/trump-rally-crowds.html,/r/Impeach_Trump/comments/1gjn8sb/trumps_crowds_are_dwindling_as_his_campaign_winds/
trump,Impeach_Trump,Ideological Politics,60531,"Donald Trump talks about women at his rallies like they are objects, he doesn't see them as equals",300,3,No,No,0,https://imghoster.co/v3YtmBuQO5WqVHF,/r/Impeach_Trump/comments/1ggdie6/donald_trump_talks_about_women_at_his_rallies/
trump,Impeach_Trump,Ideological Politics,60531,"Donald Trump called half of America ""human scum""",192,5,No,No,0,https://imghoster.co/VN2ORQf6SinlHXJ?utm_source=reddit&utm_medium=impeach_trump,/r/Impeach_Trump/comments/1gg9nmz/donald_trump_called_half_of_america_human_scum/
trump,Impeach_Trump,Ideological Politics,60531,This is an amazing article written by user u/SilkyFluffs in r/democrats which is an amazing resource for combating GOP and Trump misinformation and possibly even converting family members or undecided voters,47,0,No,Yes,0,https://pdflink.to/d6e0bc9d/,/r/Impeach_Trump/comments/1ggd0pc/this_is_an_amazing_article_written_by_user/
trump,Impeach_Trump,Ideological Politics,60531,"Elon Musk predicts ‘hardship,’ economic turmoil and a stock-market crash if Trump wins",58,4,No,No,0,https://www.marketwatch.com/story/kaboom-elon-musk-predicts-hardship-economic-turmoil-and-a-stock-market-crash-if-trump-wins-20483008,/r/Impeach_Trump/comments/1gfwy5u/elon_musk_predicts_hardship_economic_turmoil_and/
