Keyword,Subreddit,Category,Members,Title,Upvotes,Comments,Moderator Interaction,Fact-Checking Mention,Total Awards,URL,Original Post URL
house,Republicanism,Ideological Politics,917,Meet Susanna Gibson: Virginia Democrat in key state House race calls sharing of pornographic videos ‘the worst gutter politics’,2,0,No,No,0,https://www.celebsweek.com/susanna-gibson/,/r/republicanism/comments/16hfi9k/meet_susanna_gibson_virginia_democrat_in_key/
president,Republicanism,Ideological Politics,917,About the Lopez,4,2,No,No,0,https://www.reddit.com/r/republicanism/comments/1094bh5/about_the_lopez/,/r/republicanism/comments/1094bh5/about_the_lopez/
victory,Conservatives,Ideological Politics,108238,Insult to Injury: MSNBC and CNN Suffer Staggering Ratings Plunge Following Trump Victory,232,19,No,No,0,https://www.westernjournal.com/insult-injury-msnbc-cnn-suffer-staggering-ratings-plunge-following-trump-victory/,/r/conservatives/comments/1gpm534/insult_to_injury_msnbc_and_cnn_suffer_staggering/
harris,Conservatives,Ideological Politics,108238,Donald Trump Was Such a Threat to Democracy That Oprah Charged $1 Million to Endorse Kamala Harris,308,11,No,No,0,https://redstate.com/joesquire/2024/11/11/donald-trump-was-such-a-threat-to-democracy-that-oprah-charged-1-million-to-endorse-kamala-harris-n2181859,/r/conservatives/comments/1gpjz1d/donald_trump_was_such_a_threat_to_democracy_that/
trump,Conservatives,Ideological Politics,108238,"Elizabeth Warren and CNN Accuse Trump of Breaking the Law, As Second Term Hysteria Begins",112,22,No,No,0,https://redstate.com/bonchie/2024/11/11/elizabeth-warren-and-cnn-accuse-trump-of-breaking-the-law-as-second-term-hysteria-begins-n2181852,/r/conservatives/comments/1gpoc7k/elizabeth_warren_and_cnn_accuse_trump_of_breaking/
trump,Conservatives,Ideological Politics,108238,"Trump Vowed to Torpedo Dept. Of Education, Ending an Era of Government Waste and Abuse",50,2,No,No,0,https://redstate.com/brandon_morse/2024/11/11/trump-vows-to-torpedo-dept-of-education-ending-an-era-of-government-waste-and-abuse-n2181844,/r/conservatives/comments/1gpr4c4/trump_vowed_to_torpedo_dept_of_education_ending/
house,Conservatives,Ideological Politics,108238,One at a Time Is How Republicans Keep Winning - Fed Up Average American Wins Texas House Seat,43,0,No,No,0,https://redstate.com/beckynoble/2024/11/11/one-at-a-time-is-how-republicans-keep-winning-fed-up-average-american-wins-texas-house-seat-n2181839,/r/conservatives/comments/1gpr0lb/one_at_a_time_is_how_republicans_keep_winning_fed/
harris,Conservatives,Ideological Politics,108238,A Man of Principle: Mark Cuban Busy Deleting All His Pro-Kamala Harris Tweets,85,5,No,No,0,https://redstate.com/bobhoge/2024/11/11/a-man-of-principle-mark-cuban-deletes-all-his-pro-kamala-harris-tweets-less-than-a-week-after-election-n2181861,/r/conservatives/comments/1gpjyo1/a_man_of_principle_mark_cuban_busy_deleting_all/
senate,Conservatives,Ideological Politics,108238,GOP Can't Afford To Elect Another McConnell As Senate Leader,21,1,No,No,0,https://thefederalist.com/2024/11/12/republicans-cant-afford-to-elect-another-mitch-mcconnell-as-senate-leader/,/r/conservatives/comments/1gpuah6/gop_cant_afford_to_elect_another_mcconnell_as/
biden,Conservatives,Ideological Politics,108238,"Melania Trump declines to meet with Jill Biden at White House, citing Mar-a-Lago raid: source",436,43,No,No,0,https://nypost.com/2024/11/11/us-news/melania-trump-declines-to-meet-with-jill-biden-at-white-house-citing-mar-a-lago-raid-source/,/r/conservatives/comments/1gpaxk5/melania_trump_declines_to_meet_with_jill_biden_at/
harris,Conservatives,Ideological Politics,108238,"After Spending Like Drunken Sailors, the Harris Campaign Is STILL Begging Supporters for Cash",36,1,No,No,0,https://redstate.com/mike_miller/2024/11/11/after-spending-like-drunken-sailors-the-harris-walz-campaign-is-still-begging-supporters-fo-cash-n2181848,/r/conservatives/comments/1gpofve/after_spending_like_drunken_sailors_the_harris/
trump,Conservatives,Ideological Politics,108238,'The View' Spew: Co-Host Ana Navarro Loses Her Mind Over Tom Homan's Appointment As Trump Border Czar,18,3,No,No,0,https://redstate.com/mike_miller/2024/11/11/the-view-spew-co-host-ana-navarro-loses-her-mind-over-tom-homans-appointment-as-trump-border-czar-n2181841,/r/conservatives/comments/1gpr35c/the_view_spew_cohost_ana_navarro_loses_her_mind/
biden,Conservatives,Ideological Politics,108238,TDS-Riddled Pelosi Absurdly Claims 'Fewer' Illegal Aliens Entered the US Under Biden Than Trump,13,1,No,No,0,https://redstate.com/mike_miller/2024/11/11/tds-riddled-pelosi-absurdly-claims-fewer-illegal-aliens-entered-the-us-under-biden-than-trump-n2181831,/r/conservatives/comments/1gpu8rj/tdsriddled_pelosi_absurdly_claims_fewer_illegal/
supreme court,Conservatives,Ideological Politics,108238,Remember all those Democrat Senators saying they wanted to end the Filibuster and Pack the Supreme Court?,19,1,No,No,0,https://www.dailywire.com/news/we-asked-every-dem-senator-about-the-filibuster-and-scotus-here-are-their-responses,/r/conservatives/comments/1gppmni/remember_all_those_democrat_senators_saying_they/
trump,Conservatives,Ideological Politics,108238,Katie Porter's Parenting Called Out After Bizarre Story She Told About Daughter's Reaction to Trump's Win,8,1,No,No,0,https://redstate.com/sister-toldjah/2024/11/11/story-katie-porter-told-about-her-12-year-old-daughter-after-trump-won-election-n2181832,/r/conservatives/comments/1gpu82v/katie_porters_parenting_called_out_after_bizarre/
trump,dailywire,Ideological Politics,24189,Wall of Hate - Help Document Hatred Against Trump on July13th.com,78,16,Yes,No,0,https://july13th.com/hate/,/r/dailywire/comments/1e3cqx8/wall_of_hate_help_document_hatred_against_trump/
trump,dailywire,Ideological Politics,24189,Another claim in which Trump was right ,131,2,No,No,0,https://v.redd.it/26hradrdcd0e1,/r/dailywire/comments/1gp8glb/another_claim_in_which_trump_was_right/
trump,dailywire,Ideological Politics,24189,Cause Trump won,128,46,No,No,0,https://i.redd.it/4gasjjjbva0e1.png,/r/dailywire/comments/1gowe6q/cause_trump_won/
trump,dailywire,Ideological Politics,24189,19 year old here. So I'm Gen Z. I am a female!,74,6,No,No,0,https://www.youtube.com/watch?v=ybgV3jSNKEE,/r/dailywire/comments/1gokaic/19_year_old_here_so_im_gen_z_i_am_a_female/
trump,Liberal,Ideological Politics,119790,Warren: Trump transition ‘already breaking the law’,96,21,No,No,0,https://thehill.com/homenews/campaign/4984590-trump-transition-law-violation-elizabeth-warren/,/r/Liberal/comments/1gps6f2/warren_trump_transition_already_breaking_the_law/
trump,Liberal,Ideological Politics,119790,"‘All dogs, please, this is not a drill’: Donald Trump appoints a puppy killer as his Secretary of Homeland Security",61,14,No,No,0,https://www.themarysue.com/all-dogs-please-this-is-not-a-drill-donald-trump-appoints-a-puppy-killer-as-his-secretary-of-homeland-security/?utm_source=tms_smartnews_redirect,/r/Liberal/comments/1gpsyg8/all_dogs_please_this_is_not_a_drill_donald_trump/
biden,Liberal,Ideological Politics,119790,Who were the 9M Biden 2020 voters who stayed home this year and what are their reasons? 90% did not vote for Trump last week.,29,33,No,No,0,https://cardinalnews.org/2024/11/11/the-key-election-statistic-many-democrats-simply-didnt-vote/,/r/Liberal/comments/1gpubmj/who_were_the_9m_biden_2020_voters_who_stayed_home/
trump,Liberal,Ideological Politics,119790,Week of rest,2,0,No,No,0,https://www.reddit.com/r/Liberal/comments/1gpwf4a/week_of_rest/,/r/Liberal/comments/1gpwf4a/week_of_rest/
trump,Liberal,Ideological Politics,119790,Arizona AG says she won't drop state's fake electors case against Trump allies,514,20,No,No,0,https://www.upi.com/Top_News/US/2024/11/10/Arizona-fake-electors-case/4001731292312/,/r/Liberal/comments/1gosjeh/arizona_ag_says_she_wont_drop_states_fake/
trump,Liberal,Ideological Politics,119790,Authoritarianism Expert Shatters A Trump ‘Illusion’: ‘One Of The Biggest Scams Of All’,209,41,No,No,0,https://www.huffpost.com/entry/ruth-ben-ghiat-donald-trump-scam_n_6731e1a0e4b0231a203af70c,/r/Liberal/comments/1gotekd/authoritarianism_expert_shatters_a_trump_illusion/
president,Liberal,Ideological Politics,119790,What I think needs changing,40,138,No,No,0,https://www.reddit.com/r/Liberal/comments/1goxogz/what_i_think_needs_changing/,/r/Liberal/comments/1goxogz/what_i_think_needs_changing/
recount,Liberal,Ideological Politics,119790,Glad to see we have visitors.,113,72,No,Yes,0,https://www.reddit.com/r/Liberal/comments/1gon2jn/glad_to_see_we_have_visitors/,/r/Liberal/comments/1gon2jn/glad_to_see_we_have_visitors/
president,Liberal,Ideological Politics,119790,I've always wanted to see a woman President in my lifetime.,0,10,No,No,0,https://www.reddit.com/r/Liberal/comments/1gpsp2s/ive_always_wanted_to_see_a_woman_president_in_my/,/r/Liberal/comments/1gpsp2s/ive_always_wanted_to_see_a_woman_president_in_my/
harris,Liberal,Ideological Politics,119790,Why were the polls so wrong?,157,171,No,No,0,https://www.reddit.com/r/Liberal/comments/1go7sv1/why_were_the_polls_so_wrong/,/r/Liberal/comments/1go7sv1/why_were_the_polls_so_wrong/
biden,Liberal,Ideological Politics,119790,Purely Symbolic I know....,21,1,No,No,0,https://www.reddit.com/r/Liberal/comments/1gody1k/purely_symbolic_i_know/,/r/Liberal/comments/1gody1k/purely_symbolic_i_know/
harris,Liberal,Ideological Politics,119790,I keep hearing theories about how 15m people staying home didn't actually stay home and I'm not buying it.,325,361,No,No,0,https://www.reddit.com/r/Liberal/comments/1gnrlns/i_keep_hearing_theories_about_how_15m_people/,/r/Liberal/comments/1gnrlns/i_keep_hearing_theories_about_how_15m_people/
harris,KamalaHarris,Ideological Politics,75878,Kamala Harris greeted as she returns to the White House,316,28,No,No,0,https://v.redd.it/qhewboav9j0e1,/r/KamalaHarris/comments/1gpv41o/kamala_harris_greeted_as_she_returns_to_the_white/
recount,KamalaHarris,Ideological Politics,75878,Harris fundraising page says a portion of donations will be directed to recount effort,762,83,No,No,0,https://www.usatoday.com/story/news/politics/elections/2024/11/11/kamala-harris-fundraiser-donations-election-recount/76195287007/,/r/KamalaHarris/comments/1gplf80/harris_fundraising_page_says_a_portion_of/
harris,KamalaHarris,Ideological Politics,75878,Kamala Harris *Did* Listen To Working-Class Voters. And They Didn't Listen to Her Opponent.,156,6,No,No,0,https://washingtonmonthly.substack.com/p/kamala-harris-did-listen-to-working,/r/KamalaHarris/comments/1gpves2/kamala_harris_did_listen_to_workingclass_voters/
trump,KamalaHarris,Ideological Politics,75878,"Republicans win House, delivering Trump a trifecta",723,319,No,No,0,https://thehill.com/homenews/state-watch/4974235-house-republicans-control-majority/,/r/KamalaHarris/comments/1gp9psj/republicans_win_house_delivering_trump_a_trifecta/
harris,KamalaHarris,Ideological Politics,75878,The Crass but Winning Political Tactic That Kamala Harris Missed,269,121,No,No,0,https://slate.com/news-and-politics/2024/11/donald-trump-win-presidential-election-kamala-harris-economy.html,/r/KamalaHarris/comments/1gozjze/the_crass_but_winning_political_tactic_that/
president,KamalaHarris,Ideological Politics,75878,"Watching this is so heartbreakingly sad. She would’ve been a great president. She wants to empower us, he wants to control us. ",3017,449,No,No,0,https://v.redd.it/iklqyeyl970e1,/r/KamalaHarris/comments/1gojwnq/watching_this_is_so_heartbreakingly_sad_she/
results,KamalaHarris,Ideological Politics,75878,I'm heartbroken over the results of this election - and here's why,600,51,No,No,0,https://youtu.be/7n7SoOTIlZY?si=b5q0Jb-sJSzoULRx,/r/KamalaHarris/comments/1golbbu/im_heartbroken_over_the_results_of_this_election/
trump,Impeach_Trump,Ideological Politics,60562,"Far-right extremists celebrate Trump’s win — In a burst of hate and misogyny, MAGA militants cheered the return of a president they consider an ally",150,1,No,No,0,https://www.washingtonpost.com/politics/2024/11/07/right-wing-extremists-celebrate-trump-victory/,/r/Impeach_Trump/comments/1gmvba5/farright_extremists_celebrate_trumps_win_in_a/
trump,Impeach_Trump,Ideological Politics,60562,Trump feigned ignorance of Project 2025,217,10,No,No,0,https://imghoster.co/en/FhQ7EhPjtSXOF4R,/r/Impeach_Trump/comments/1glm47g/trump_feigned_ignorance_of_project_2025/
trump,Impeach_Trump,Ideological Politics,60562,The Deep Roots of 4 of Donald Trump’s Highly Xenophobic Remarks,32,1,No,No,0,https://www.nytimes.com/2024/11/01/us/politics/trump-immigration-rhetoric-history.html,/r/Impeach_Trump/comments/1glhq62/the_deep_roots_of_4_of_donald_trumps_highly/
trump,Impeach_Trump,Ideological Politics,60562,Literal Neo-Nazi Leader Endorses Trump,220,1,No,No,0,https://www.rollingstone.com/politics/politics-news/trump-endorsement-neo-nazi-leader-nsc-131-1235154089/,/r/Impeach_Trump/comments/1gkmq6t/literal_neonazi_leader_endorses_trump/
trump,Impeach_Trump,Ideological Politics,60562,Trump's crowds are dwindling as his campaign winds down — Empty seats and early exits have grown more common,428,18,No,No,0,https://www.nytimes.com/2024/11/04/us/politics/trump-rally-crowds.html,/r/Impeach_Trump/comments/1gjn8sb/trumps_crowds_are_dwindling_as_his_campaign_winds/
trump,Impeach_Trump,Ideological Politics,60562,"Donald Trump talks about women at his rallies like they are objects, he doesn't see them as equals",300,3,No,No,0,https://imghoster.co/v3YtmBuQO5WqVHF,/r/Impeach_Trump/comments/1ggdie6/donald_trump_talks_about_women_at_his_rallies/
trump,Impeach_Trump,Ideological Politics,60562,"Donald Trump called half of America ""human scum""",194,5,No,No,0,https://imghoster.co/VN2ORQf6SinlHXJ?utm_source=reddit&utm_medium=impeach_trump,/r/Impeach_Trump/comments/1gg9nmz/donald_trump_called_half_of_america_human_scum/
trump,Impeach_Trump,Ideological Politics,60562,This is an amazing article written by user u/SilkyFluffs in r/democrats which is an amazing resource for combating GOP and Trump misinformation and possibly even converting family members or undecided voters,43,0,No,Yes,0,https://pdflink.to/d6e0bc9d/,/r/Impeach_Trump/comments/1ggd0pc/this_is_an_amazing_article_written_by_user/
trump,Impeach_Trump,Ideological Politics,60562,"Elon Musk predicts ‘hardship,’ economic turmoil and a stock-market crash if Trump wins",65,4,No,No,0,https://www.marketwatch.com/story/kaboom-elon-musk-predicts-hardship-economic-turmoil-and-a-stock-market-crash-if-trump-wins-20483008,/r/Impeach_Trump/comments/1gfwy5u/elon_musk_predicts_hardship_economic_turmoil_and/
trump,Impeach_Trump,Ideological Politics,60562,Kamala's rally in DC vs. Trump's rally in DC,130,0,No,No,0,https://imghoster.co/en/D370Y9JxmPOx6x3,/r/Impeach_Trump/comments/1gfnege/kamalas_rally_in_dc_vs_trumps_rally_in_dc/
trump,Impeach_Trump,Ideological Politics,60562,Trump is 10x more corrupt than all the rest put together,319,3,No,No,0,https://imghoster.co/en/R3aE5Zdu1UQvWSj,/r/Impeach_Trump/comments/1getadg/trump_is_10x_more_corrupt_than_all_the_rest_put/
