Keyword,Subreddit,Category,Members,Title,Upvotes,Comments,Moderator Interaction,Fact-Checking Mention,Total Awards,URL,Original Post URL
results,Wikileaks,General Politics,177654,Censored Wikileaks content?,12,7,No,No,0,https://www.reddit.com/r/WikiLeaks/comments/1frr2wq/censored_wikileaks_content/,/r/WikiLeaks/comments/1frr2wq/censored_wikileaks_content/
trump,News,General Politics,28930245,Judge overseeing 'fake elector' case recuses himself after defense accuses him of anti-Trump bias,11004,761,No,No,0,https://abcnews.go.com/Politics/judge-overseeing-fake-elector-case-recuses-after-defense/story?id=115801484,/r/news/comments/1gqfnbf/judge_overseeing_fake_elector_case_recuses/
trump,PoliticalDiscussion,General Politics,2184666,Why did Trump choose Matt Gaetz for Attorney General? ,791,898,No,No,0,https://www.reddit.com/r/PoliticalDiscussion/comments/1gqo32j/why_did_trump_choose_matt_gaetz_for_attorney/,/r/PoliticalDiscussion/comments/1gqo32j/why_did_trump_choose_matt_gaetz_for_attorney/
electoral,PoliticalDiscussion,General Politics,2184666,What could (or should) be done to make political parties less at risk of being a mere engine of a particular leader or person?,25,58,No,No,0,https://www.reddit.com/r/PoliticalDiscussion/comments/1gr65n9/what_could_or_should_be_done_to_make_political/,/r/PoliticalDiscussion/comments/1gr65n9/what_could_or_should_be_done_to_make_political/
trump,PoliticalDiscussion,General Politics,2184666,What is the plan for Ukraine and the rest of NATO here if U.S. turns neutral?,50,171,No,No,0,https://www.reddit.com/r/PoliticalDiscussion/comments/1gr0dng/what_is_the_plan_for_ukraine_and_the_rest_of_nato/,/r/PoliticalDiscussion/comments/1gr0dng/what_is_the_plan_for_ukraine_and_the_rest_of_nato/
trump,PoliticalDiscussion,General Politics,2184666,"What is stopping MAGA from engaging in rampant federal crimes, if Trump will pardon them for the next 4 years? ",394,375,No,No,0,https://www.reddit.com/r/PoliticalDiscussion/comments/1gqlak4/what_is_stopping_maga_from_engaging_in_rampant/,/r/PoliticalDiscussion/comments/1gqlak4/what_is_stopping_maga_from_engaging_in_rampant/
trump,PoliticalDiscussion,General Politics,2184666,How will Marco Rubio as SoS influence relations?,26,60,No,No,0,https://www.reddit.com/r/PoliticalDiscussion/comments/1gqxts1/how_will_marco_rubio_as_sos_influence_relations/,/r/PoliticalDiscussion/comments/1gqxts1/how_will_marco_rubio_as_sos_influence_relations/
biden,PoliticalDiscussion,General Politics,2184666,Could Biden Have Won If he was sharp as he was in 2012?,140,236,No,No,0,https://www.reddit.com/r/PoliticalDiscussion/comments/1gqa7bs/could_biden_have_won_if_he_was_sharp_as_he_was_in/,/r/PoliticalDiscussion/comments/1gqa7bs/could_biden_have_won_if_he_was_sharp_as_he_was_in/
trump,PoliticalDiscussion,General Politics,2184666,What do you think Trump will do about the Israel/Palestine conflict?,239,829,No,No,0,https://www.reddit.com/r/PoliticalDiscussion/comments/1gq3qzs/what_do_you_think_trump_will_do_about_the/,/r/PoliticalDiscussion/comments/1gq3qzs/what_do_you_think_trump_will_do_about_the/
president,PoliticalDiscussion,General Politics,2184666,What can the electorate or legislators do in cases of Executive Branch Scandals or Convictions? ,18,32,No,No,0,https://www.reddit.com/r/PoliticalDiscussion/comments/1gqgb8t/what_can_the_electorate_or_legislators_do_in/,/r/PoliticalDiscussion/comments/1gqgb8t/what_can_the_electorate_or_legislators_do_in/
trump,PoliticalDiscussion,General Politics,2184666,Why is there such confusion about whether or not Putin has spoken to Trump?,137,105,No,Yes,0,https://www.reddit.com/r/PoliticalDiscussion/comments/1gq4ztm/why_is_there_such_confusion_about_whether_or_not/,/r/PoliticalDiscussion/comments/1gq4ztm/why_is_there_such_confusion_about_whether_or_not/
results,PoliticalDiscussion,General Politics,2184666,"In 2016, Republicans controlled the House and Senate with larger margins over Democrats than they have in 2024. What does this potentially mean for proposed changes that may land on the floor?",152,58,No,No,0,https://www.reddit.com/r/PoliticalDiscussion/comments/1gq3dwr/in_2016_republicans_controlled_the_house_and/,/r/PoliticalDiscussion/comments/1gq3dwr/in_2016_republicans_controlled_the_house_and/
president,PoliticalDiscussion,General Politics,2184666,"If Democrats do shift to the populist left in 2028, who will be the leader of the movement with Bernie likely being too old?",475,1501,No,No,0,https://www.reddit.com/r/PoliticalDiscussion/comments/1gpgnc8/if_democrats_do_shift_to_the_populist_left_in/,/r/PoliticalDiscussion/comments/1gpgnc8/if_democrats_do_shift_to_the_populist_left_in/
trump,PoliticalDiscussion,General Politics,2184666,"Tulsi Gabbard is up for Secretary of Intelligence. What affect will this have on US actions globally, and Trump's administration?",0,79,No,No,0,https://www.reddit.com/r/PoliticalDiscussion/comments/1gqz93e/tulsi_gabbard_is_up_for_secretary_of_intelligence/,/r/PoliticalDiscussion/comments/1gqz93e/tulsi_gabbard_is_up_for_secretary_of_intelligence/
trump,PoliticalDiscussion,General Politics,2184666,Was Trump good or bad for the economy?,0,45,No,No,0,https://www.reddit.com/r/PoliticalDiscussion/comments/1gqxop6/was_trump_good_or_bad_for_the_economy/,/r/PoliticalDiscussion/comments/1gqxop6/was_trump_good_or_bad_for_the_economy/
results,NeutralPolitics,General Politics,610691,What to expect after the U.S. election,284,26,Yes,Yes,0,https://www.reddit.com/r/NeutralPolitics/comments/1gflxpk/what_to_expect_after_the_us_election/,/r/NeutralPolitics/comments/1gflxpk/what_to_expect_after_the_us_election/
house,NeutralPolitics,General Politics,610691,Tracking what bills/decisions are coming to contact reps/senators in a timely manner,32,6,No,No,0,https://www.reddit.com/r/NeutralPolitics/comments/1gqkpdp/tracking_what_billsdecisions_are_coming_to/,/r/NeutralPolitics/comments/1gqkpdp/tracking_what_billsdecisions_are_coming_to/
loss,NeutralPolitics,General Politics,610691,Do any countries have laws to combat politically-driven misinformation?,13,22,No,Yes,0,https://www.reddit.com/r/NeutralPolitics/comments/1gq4agt/do_any_countries_have_laws_to_combat/,/r/NeutralPolitics/comments/1gq4agt/do_any_countries_have_laws_to_combat/
results,NeutralPolitics,General Politics,610691,Trump won the presidency and popular vote running on the mass deportation of illegal aliens. Who saw this coming and what lessons can be learned?,218,326,No,No,0,https://www.reddit.com/r/NeutralPolitics/comments/1gnk7ih/trump_won_the_presidency_and_popular_vote_running/,/r/NeutralPolitics/comments/1gnk7ih/trump_won_the_presidency_and_popular_vote_running/
results,NeutralPolitics,General Politics,610691,Is now the time for a NEW moderate third party in U.S. politics?,0,75,No,No,0,https://www.reddit.com/r/NeutralPolitics/comments/1gms9so/is_now_the_time_for_a_new_moderate_third_party_in/,/r/NeutralPolitics/comments/1gms9so/is_now_the_time_for_a_new_moderate_third_party_in/
harris,NeutralPolitics,General Politics,610691,Why Are So Many Men Leaving The Democratic Party Over The Last Few Years?,381,156,No,No,0,https://www.reddit.com/r/NeutralPolitics/comments/1gklb9t/why_are_so_many_men_leaving_the_democratic_party/,/r/NeutralPolitics/comments/1gklb9t/why_are_so_many_men_leaving_the_democratic_party/
trump,NeutralPolitics,General Politics,610691,What plans about trump and kamala have on section 8 housing and dept of edu.,1,11,No,No,0,https://www.reddit.com/r/NeutralPolitics/comments/1gk1emp/what_plans_about_trump_and_kamala_have_on_section/,/r/NeutralPolitics/comments/1gk1emp/what_plans_about_trump_and_kamala_have_on_section/
outcome,NeutralPolitics,General Politics,610691,"What are the pros and cons of predictive election models, like 538, for our discourse around elections?",40,94,No,No,0,https://www.reddit.com/r/NeutralPolitics/comments/1giqib5/what_are_the_pros_and_cons_of_predictive_election/,/r/NeutralPolitics/comments/1giqib5/what_are_the_pros_and_cons_of_predictive_election/
harris,NeutralPolitics,General Politics,610691,How do the Trump and Harris plans for workforce pay and taxes compare?,4,6,No,No,0,https://www.reddit.com/r/NeutralPolitics/comments/1ggxh8w/how_do_the_trump_and_harris_plans_for_workforce/,/r/NeutralPolitics/comments/1ggxh8w/how_do_the_trump_and_harris_plans_for_workforce/
fraud,NeutralPolitics,General Politics,610691,Has there been any investigative journalism or public legal discovery to examine process irregularities regarding the 2020 election?,11,15,No,No,0,https://www.reddit.com/r/NeutralPolitics/comments/1ggkpzr/has_there_been_any_investigative_journalism_or/,/r/NeutralPolitics/comments/1ggkpzr/has_there_been_any_investigative_journalism_or/
trump,moderatepolitics,General Politics,296486,The ‘Lost Boys’ of Gen Z: how Trump won the hearts of alienated young men,17,31,No,No,0,https://theconversation.com/the-lost-boys-of-gen-z-how-trump-won-the-hearts-of-alienated-young-men-243358,/r/moderatepolitics/comments/1grbshi/the_lost_boys_of_gen_z_how_trump_won_the_hearts/
trump,moderatepolitics,General Politics,296486,Trump taps Rep. Matt Gaetz as attorney general,437,629,No,No,0,https://www.cnbc.com/amp/2024/11/13/trump-taps-rep-matt-gaetz-as-attorney-general.html,/r/moderatepolitics/comments/1gqnmqd/trump_taps_rep_matt_gaetz_as_attorney_general/
harris,moderatepolitics,General Politics,296486,Kamala Harris ditched Joe Rogan podcast interview over progressive backlash fears,446,607,No,No,0,https://www.ft.com/content/9292db59-8291-4507-8d86-f8d4788da467,/r/moderatepolitics/comments/1gqmu15/kamala_harris_ditched_joe_rogan_podcast_interview/
trump,moderatepolitics,General Politics,296486,Trump picks Tulsi Gabbard for Director of National Intelligence,401,463,No,No,0,https://search.app?link=https%3A%2F%2Fwww.cnn.com%2F2024%2F11%2F13%2Fpolitics%2Ftrump-picks-tulsi-gabbard-director-of-national-intelligence%2Findex.html&utm_campaign=aga&utm_source=agsadl2%2Csh%2Fx%2Fgs%2Fm2%2F4,/r/moderatepolitics/comments/1gqmj7d/trump_picks_tulsi_gabbard_for_director_of/
senate,moderatepolitics,General Politics,296486,John Thune of South Dakota Elected as Next Senate Majority Leader,251,131,No,No,0,https://www.nytimes.com/2024/11/13/us/politics/trump-senate-thune-cornyn-scott.html,/r/moderatepolitics/comments/1gqj5h4/john_thune_of_south_dakota_elected_as_next_senate/
trump,moderatepolitics,General Politics,296486,Elon Musk and Vivek Ramaswamy will lead new ‘Department of Government Efficiency’ in Trump administration,503,812,No,No,0,https://www.cnn.com/2024/11/12/politics/elon-musk-vivek-ramaswamy-department-of-government-efficiency-trump/index.html,/r/moderatepolitics/comments/1gq0ozd/elon_musk_and_vivek_ramaswamy_will_lead_new/
trump,moderatepolitics,General Politics,296486,Trump Draft Executive Order Would Create Board to Purge Generals,281,297,No,No,0,https://www.wsj.com/politics/national-security/trump-draft-executive-order-would-create-board-to-purge-generals-7ebaa606?st=ikAgWH&reflink=article_copyURL_share,/r/moderatepolitics/comments/1gq1ko4/trump_draft_executive_order_would_create_board_to/
trump,moderatepolitics,General Politics,296486,Donald Trump Nominates Fox News Host Pete Hegseth As Secretary Of Defense,332,556,No,No,0,https://deadline.com/2024/11/trump-pete-hegseth-secretary-of-defense-1236174786/,/r/moderatepolitics/comments/1gq034k/donald_trump_nominates_fox_news_host_pete_hegseth/
trump,moderatepolitics,General Politics,296486,Trump to name William McGinley to be White House counsel,96,58,No,No,0,https://www.nbcnews.com/politics/donald-trump/trump-name-william-mcginley-white-house-counsel-rcna179892,/r/moderatepolitics/comments/1gq4zng/trump_to_name_william_mcginley_to_be_white_house/
bernie,moderatepolitics,General Politics,296486,Bernie Sanders blasts Democrats for their attitude towards Joe Rogan,652,807,No,No,0,https://thehill.com/homenews/media/4983254-bernie-sanders-blasts-democrats-attitude-towards-joe-rogan/,/r/moderatepolitics/comments/1gppd5i/bernie_sanders_blasts_democrats_for_their/
trump,moderatepolitics,General Politics,296486,Trump picks close ally John Ratcliffe for CIA director,108,66,No,No,0,https://search.app?link=https%3A%2F%2Fwww.politico.com%2Fnews%2F2024%2F11%2F12%2Fjohn-ratcliffe-cia-trump-00189143&utm_campaign=aga&utm_source=agsadl2%2Csh%2Fx%2Fgs%2Fm2%2F4,/r/moderatepolitics/comments/1gpyxis/trump_picks_close_ally_john_ratcliffe_for_cia/
trump,technology,General Politics,17398953,"Thune Is Big Fan of Wind Power, an Energy Source Trump Hates",211,45,No,No,0,https://www.bloomberg.com/news/articles/2024-11-14/thune-is-big-fan-of-wind-power-an-energy-source-trump-hates,/r/technology/comments/1gr9e81/thune_is_big_fan_of_wind_power_an_energy_source/
trump,democrats,Ideological Politics,480564,Elizabeth Warren smells something fishy going on with Trump’s transition team,1996,428,No,No,0,https://www.msnbc.com/the-reidout/reidout-blog/elizabeth-warren-trump-transition-ethics-corruption-rcna179861,/r/democrats/comments/1gr7iwb/elizabeth_warren_smells_something_fishy_going_on/
president,democrats,Ideological Politics,480564,"The Onion Buys Infowars”, and no, this is not a joke ",568,46,No,No,0,https://www.nytimes.com/2024/11/14/business/media/alex-jones-infowars-the-onion.html?smid=nytcore-ios-share&referringSource=articleShare,/r/democrats/comments/1gr6vdb/the_onion_buys_infowars_and_no_this_is_not_a_joke/
trump,democrats,Ideological Politics,480564,High grocery prices got droves of Americans to vote for Trump but they shouldn’t expect to pay less over the next four years,246,57,No,No,0,https://www.cnn.com/2024/11/14/economy/trump-grocery-prices-inflation?cid=ios_app,/r/democrats/comments/1graf6u/high_grocery_prices_got_droves_of_americans_to/
house,democrats,Ideological Politics,480564,Matt Gaetz has abruptly resigned from the US House.,1806,261,No,No,0,https://www.politico.com/news/2024/11/13/matt-gaetz-resigns-congress-00189488,/r/democrats/comments/1gqsqgz/matt_gaetz_has_abruptly_resigned_from_the_us_house/
trump,democrats,Ideological Politics,480564,Trump’s defense secretary pick said women shouldn’t be in combat roles. These female veterans fear what comes next | CNN,104,10,No,No,0,https://www.cnn.com/2024/11/14/us/military-women-pete-hegseth-defense-secretary/index.html?Date=20241114&Profile=CNN&utm_content=1731598207&utm_medium=social&utm_source=facebook&fbclid=IwZXh0bgNhZW0CMTEAAR0fzjn5e6gcrNOJT-KK0DhyRX2wv3q4WYU3jTSxtWao4jpiKe4sX67PWMM_aem_4nRIuvXvGGNbq-eraTpn0Q,/r/democrats/comments/1gr7xsd/trumps_defense_secretary_pick_said_women_shouldnt/
trump,democrats,Ideological Politics,480564,"Republicans ""stunned and disgusted"" as Trump taps Matt Gaetz for AG",1646,326,No,No,0,https://www.axios.com/2024/11/13/matt-gaetz-republicans-trump-attorney-general,/r/democrats/comments/1gqqesw/republicans_stunned_and_disgusted_as_trump_taps/
biden,democrats,Ideological Politics,480564,"As an American, I feel insulted by Trump thanking Biden for a smooth transition of power without acknowledging the lack of one he provided when he lost, leading directly to the deaths of countless Americans.",1264,132,No,No,0,https://www.nbcnews.com/politics/white-house/biden-host-trump-white-house-symbolic-peaceful-transfer-power-rcna179619,/r/democrats/comments/1gqpss0/as_an_american_i_feel_insulted_by_trump_thanking/
trump,democrats,Ideological Politics,480564,Trump taps Gabbard for director of national intelligence,971,544,No,No,0,https://thehill.com/policy/national-security/4989036-tulsi-gabbard-trump-intelligence/,/r/democrats/comments/1gqmqgr/trump_taps_gabbard_for_director_of_national/
trump,Republican,Ideological Politics,205493,"Republicans Secure House Majority, Gaining Full Control of Government as Trump Prepares for Presidency",154,37,No,No,0,https://m10news.com/republicans-secure-house-majority-gaining-full-control-of-government-as-trump-prepares-for-presidency/,/r/Republican/comments/1gr3lyd/republicans_secure_house_majority_gaining_full/
harris,Republican,Ideological Politics,205493,Joe Rogan says Kamala Harris campaign had a condition to avoid 'marijuana legalization' talk for interview,275,42,No,No,0,https://www.foxnews.com/media/joe-rogan-says-kamala-harris-campaign-had-condition-avoid-marijuana-legalization-talk-interview,/r/Republican/comments/1gqs5sm/joe_rogan_says_kamala_harris_campaign_had_a/
trump,Republican,Ideological Politics,205493,"Matt Gaetz resigns from Congress over Trump nod to be attorney general, Johnson says",111,34,No,No,0,https://www.foxnews.com/politics/matt-gaetz-resigns-from-congress-over-trump-nod-attorney-general-johnson-says,/r/Republican/comments/1gqxhl9/matt_gaetz_resigns_from_congress_over_trump_nod/
trump,Republican,Ideological Politics,205493,"Trump picks Rubio, Gaetz and Gabbard for top jobs in blitz of nominations",312,119,No,No,0,https://www.bbc.com/news/live/cnvjr42yq39t,/r/Republican/comments/1gqni1p/trump_picks_rubio_gaetz_and_gabbard_for_top_jobs/
biden,Republican,Ideological Politics,205493,WoPo Gives Nancy Pelosi ‘Four Pinocchios' for Saying Biden Was Better than Trump on Border,162,22,No,No,0,https://www.breitbart.com/2024-election/2024/11/13/wopo-gives-nancy-pelosi-four-pinocchios-for-saying-biden-was-better-than-trump-on-border/,/r/Republican/comments/1gqjv7n/wopo_gives_nancy_pelosi_four_pinocchios_for/
trump,Republican,Ideological Politics,205493,Speaking Of Putting Ones Tail Between Their Legs... Jack Smith to Resign Before Trump Inaugurated,194,28,No,No,0,https://townhall.com/tipsheet/rebeccadowns/2024/11/13/jack-smith-to-resign-before-trump-inaugurated-n2647719,/r/Republican/comments/1gqi06k/speaking_of_putting_ones_tail_between_their_legs/
trump,Conservative,Ideological Politics,1147306,Does the left know that Fox only has 2.5 million viewers and 72 million poeople who don't watch Fox voted for Trump?,881,300,No,No,0,https://www.reddit.com/r/Conservative/comments/1gr6o39/does_the_left_know_that_fox_only_has_25_million/,/r/Conservative/comments/1gr6o39/does_the_left_know_that_fox_only_has_25_million/
trump,Conservative,Ideological Politics,1147306,Trump jokes about third term as Republicans win House,479,170,No,No,0,https://www.telegraph.co.uk/us/politics/2024/11/14/republicans-win-house-secure-government-donald-trump/,/r/Conservative/comments/1gr6qc5/trump_jokes_about_third_term_as_republicans_win/
trump,Conservative,Ideological Politics,1147306,Woke 'Snow White' Rachel Zegler Just Burned Disney to the Ground With Her Comments on Trump Supporters,507,66,No,No,0,https://redstate.com/bonchie/2024/11/13/rachel-zegler-just-burned-disney-to-the-ground-with-her-comments-on-trump-supporters-n2181966,/r/Conservative/comments/1gr4t2a/woke_snow_white_rachel_zegler_just_burned_disney/
recount,Conservative,Ideological Politics,1147306,We're Heading for a Recount in PA...and the Dems Want Illegal Ballots Counted.,321,86,No,No,0,https://townhall.com/tipsheet/mattvespa/2024/11/14/sore-loser-dems-want-a-recount-in-pas-senate-race-heres-what-theyre-arguing-for-n2647774,/r/Conservative/comments/1gr5zwh/were_heading_for_a_recount_in_paand_the_dems_want/
trump,Conservative,Ideological Politics,1147306,"Connecticut teacher resigns, apologizes on-air after threatening Trump voters with violence on Snapchat",139,27,No,No,0,https://notthebee.com/article/watch-teacher-offers-tearful-apology-after-getting-fired-for-threatening-to-handle-trump-supporters,/r/Conservative/comments/1grakav/connecticut_teacher_resigns_apologizes_onair/
trump,Conservative,Ideological Politics,1147306,"Liberal women have a plan to get revenge on Trump, and we 100% support them",355,61,No,No,0,https://www.theblaze.com/shows/normal-world/liberal-women-have-a-plan-to-get-revenge-on-trump-and-we-100-support-them,/r/Conservative/comments/1gr2gq8/liberal_women_have_a_plan_to_get_revenge_on_trump/
victory,Conservative,Ideological Politics,1147306,"Don Lemon, Jamie Lee Curtis Announce They Are Leaving X Following Trump Victory",1429,390,No,No,0,https://www.dailywire.com/news/don-lemon-jamie-lee-curtis-announce-they-are-leaving-x-following-trump-victory,/r/Conservative/comments/1gqulzz/don_lemon_jamie_lee_curtis_announce_they_are/
trump,Conservative,Ideological Politics,1147306,"Republicans win 218 US House seats, giving Donald Trump and the party control of government",360,34,No,No,0,https://apnews.com/article/republicans-house-elections-e3754a684a7b96b129841d4b207c15e9,/r/Conservative/comments/1gr1eif/republicans_win_218_us_house_seats_giving_donald/
president,Libertarian,Ideological Politics,503692,I asked ChatGPT to make a presidential tier list from the perspective of a libertarian,74,105,No,No,0,https://i.redd.it/3b3v8q2has0e1.jpeg,/r/Libertarian/comments/1gqvcuh/i_asked_chatgpt_to_make_a_presidential_tier_list/
trump,Libertarian,Ideological Politics,503692,Brandon Herrera For Director of The ATF.,93,11,No,No,0,https://www.reddit.com/r/Libertarian/comments/1gql47x/brandon_herrera_for_director_of_the_atf/,/r/Libertarian/comments/1gql47x/brandon_herrera_for_director_of_the_atf/
trump,Socialism,Ideological Politics,460981,Stop condescendingly telling people to “read theory”,324,64,No,No,0,https://www.reddit.com/r/socialism/comments/1gr89t5/stop_condescendingly_telling_people_to_read_theory/,/r/socialism/comments/1gr89t5/stop_condescendingly_telling_people_to_read_theory/
vance,Socialism,Ideological Politics,460981,Isn't The UK Labour Party a leftist party?,19,28,No,No,0,https://www.reddit.com/r/socialism/comments/1gr88hm/isnt_the_uk_labour_party_a_leftist_party/,/r/socialism/comments/1gr88hm/isnt_the_uk_labour_party_a_leftist_party/
trump,Socialism,Ideological Politics,460981,"Trump wants to blame all the problems we face under the capitalist system – inflation, homelessness, crime, unemployment – on immigrants. ",185,4,No,No,0,https://www.reddit.com/gallery/1gqjiv5,/r/socialism/comments/1gqjiv5/trump_wants_to_blame_all_the_problems_we_face/
trump,Progressive,Ideological Politics,78071,Behind the Curtain: Trump's business bonanza,13,1,No,No,0,https://www.axios.com/2024/11/07/trump-elon-musk-business-tax-cuts,/r/progressive/comments/1gm4w17/behind_the_curtain_trumps_business_bonanza/
victory,Progressive,Ideological Politics,78071,Far-Right Donald Trump Supporters Celebrate His Victory with Violent Memes and Calls for Executions,250,13,No,No,0,https://www.wired.com/story/donald-trump-far-right-supporters-violent-memes/,/r/progressive/comments/1glfnyf/farright_donald_trump_supporters_celebrate_his/
trump,Progressive,Ideological Politics,78071,What Trump's first 100 days in office could look like,25,6,No,No,0,https://www.npr.org/2024/11/06/nx-s1-5181800/2024-election-trump-first-100-days-agenda,/r/progressive/comments/1glo04a/what_trumps_first_100_days_in_office_could_look/
trump,Progressive,Ideological Politics,78071,Americans in Puerto Rico can't vote for US president. Their anger at Trump is shaping the race.,346,32,No,No,0,https://apnews.com/article/puerto-rico-trump-joke-garbage-a91e2aafd93a06d32365efa013581b85,/r/progressive/comments/1gh2ab4/americans_in_puerto_rico_cant_vote_for_us/
harris,Progressive,Ideological Politics,78071,"Trump loyalists spew racist, vulgar attacks at Harris and Democrats at New York City rally",260,6,No,No,0,https://www.cnn.com/2024/10/27/politics/trump-rally-madison-square-garden-vulgar-attacks/index.html,/r/progressive/comments/1gdskia/trump_loyalists_spew_racist_vulgar_attacks_at/
results,Republicanism,Ideological Politics,918,Survey about your political worldview (18+; 12-14 mins to complete),3,0,No,No,0,https://www.reddit.com/r/republicanism/comments/1aq418a/survey_about_your_political_worldview_18_1214/,/r/republicanism/comments/1aq418a/survey_about_your_political_worldview_18_1214/
house,Republicanism,Ideological Politics,918,Meet Susanna Gibson: Virginia Democrat in key state House race calls sharing of pornographic videos ‘the worst gutter politics’,2,0,No,No,0,https://www.celebsweek.com/susanna-gibson/,/r/republicanism/comments/16hfi9k/meet_susanna_gibson_virginia_democrat_in_key/
president,Republicanism,Ideological Politics,918,About the Lopez,4,2,No,No,0,https://www.reddit.com/r/republicanism/comments/1094bh5/about_the_lopez/,/r/republicanism/comments/1094bh5/about_the_lopez/
harris,Conservatives,Ideological Politics,108263,The Truth Behind Why Kamala Harris Refused to Do a Joe Rogan Interview Comes Out,89,15,No,Yes,0,https://redstate.com/sister-toldjah/2024/11/13/the-truth-behind-why-kamala-harris-refused-to-do-a-joe-rogan-interview-comes-out-n2181976,/r/conservatives/comments/1gr42b0/the_truth_behind_why_kamala_harris_refused_to_do/
trump,Conservatives,Ideological Politics,108263,"OH SHUT UP: Chicago Tribune Columnist Cries Trump Didn’t Win Election, ‘Disinformation Did’",44,8,No,Yes,0,https://www.newsbusters.org/blogs/free-speech/joseph-vazquez/2024/11/14/oh-shut-chicago-tribune-columnist-cries-trump-didnt-win,/r/conservatives/comments/1gr8g3s/oh_shut_up_chicago_tribune_columnist_cries_trump/
recount,Conservatives,Ideological Politics,108263,We're Heading for a Recount in Pennsylvania Senate race - and the Dems Want Illegal Ballots Counted.,28,6,No,No,0,https://townhall.com/tipsheet/mattvespa/2024/11/14/sore-loser-dems-want-a-recount-in-pas-senate-race-heres-what-theyre-arguing-for-n2647774,/r/conservatives/comments/1grayty/were_heading_for_a_recount_in_pennsylvania_senate/
trump,Conservatives,Ideological Politics,108263,Woke 'Snow White' Rachel Zegler Just Burned Disney to the Ground With Her Comments on Trump Supporters,46,7,No,No,0,https://redstate.com/bonchie/2024/11/13/rachel-zegler-just-burned-disney-to-the-ground-with-her-comments-on-trump-supporters-n2181966,/r/conservatives/comments/1gr4tdd/woke_snow_white_rachel_zegler_just_burned_disney/
