Keyword,Subreddit,Category,Members,Title,Upvotes,Comments,Moderator Interaction,Fact-Checking Mention,Total Awards,URL,Original Post URL
results,Wikileaks,General Politics,177655,Censored Wikileaks content?,13,7,No,No,0,https://www.reddit.com/r/WikiLeaks/comments/1frr2wq/censored_wikileaks_content/,/r/WikiLeaks/comments/1frr2wq/censored_wikileaks_content/
trump,PoliticalDiscussion,General Politics,2184653,"Trump has picked RFK Jr for HHS secretary. Will the Pharma industry lobby hard to block his confirmation and if so, will they succeed?",535,432,No,No,0,https://www.reddit.com/r/PoliticalDiscussion/comments/1grgblk/trump_has_picked_rfk_jr_for_hhs_secretary_will/,/r/PoliticalDiscussion/comments/1grgblk/trump_has_picked_rfk_jr_for_hhs_secretary_will/
trump,PoliticalDiscussion,General Politics,2184653,Why did Trump choose Matt Gaetz for Attorney General? ,862,992,No,No,0,https://www.reddit.com/r/PoliticalDiscussion/comments/1gqo32j/why_did_trump_choose_matt_gaetz_for_attorney/,/r/PoliticalDiscussion/comments/1gqo32j/why_did_trump_choose_matt_gaetz_for_attorney/
electoral,PoliticalDiscussion,General Politics,2184653,What could (or should) be done to make political parties less at risk of being a mere engine of a particular leader or person?,34,135,No,No,0,https://www.reddit.com/r/PoliticalDiscussion/comments/1gr65n9/what_could_or_should_be_done_to_make_political/,/r/PoliticalDiscussion/comments/1gr65n9/what_could_or_should_be_done_to_make_political/
trump,PoliticalDiscussion,General Politics,2184653,What is the plan for Ukraine and the rest of NATO here if U.S. turns neutral?,91,219,No,No,0,https://www.reddit.com/r/PoliticalDiscussion/comments/1gr0dng/what_is_the_plan_for_ukraine_and_the_rest_of_nato/,/r/PoliticalDiscussion/comments/1gr0dng/what_is_the_plan_for_ukraine_and_the_rest_of_nato/
trump,PoliticalDiscussion,General Politics,2184653,"What is stopping MAGA from engaging in rampant federal crimes, if Trump will pardon them for the next 4 years? ",424,392,No,No,0,https://www.reddit.com/r/PoliticalDiscussion/comments/1gqlak4/what_is_stopping_maga_from_engaging_in_rampant/,/r/PoliticalDiscussion/comments/1gqlak4/what_is_stopping_maga_from_engaging_in_rampant/
trump,PoliticalDiscussion,General Politics,2184653,How will Marco Rubio as SoS influence relations?,48,89,No,No,0,https://www.reddit.com/r/PoliticalDiscussion/comments/1gqxts1/how_will_marco_rubio_as_sos_influence_relations/,/r/PoliticalDiscussion/comments/1gqxts1/how_will_marco_rubio_as_sos_influence_relations/
biden,PoliticalDiscussion,General Politics,2184653,Could Biden Have Won If he was sharp as he was in 2012?,163,274,No,No,0,https://www.reddit.com/r/PoliticalDiscussion/comments/1gqa7bs/could_biden_have_won_if_he_was_sharp_as_he_was_in/,/r/PoliticalDiscussion/comments/1gqa7bs/could_biden_have_won_if_he_was_sharp_as_he_was_in/
trump,PoliticalDiscussion,General Politics,2184653,What do you think Trump will do about the Israel/Palestine conflict?,245,842,No,No,0,https://www.reddit.com/r/PoliticalDiscussion/comments/1gq3qzs/what_do_you_think_trump_will_do_about_the/,/r/PoliticalDiscussion/comments/1gq3qzs/what_do_you_think_trump_will_do_about_the/
president,PoliticalDiscussion,General Politics,2184653,What can the electorate or legislators do in cases of Executive Branch Scandals or Convictions? ,21,33,No,No,0,https://www.reddit.com/r/PoliticalDiscussion/comments/1gqgb8t/what_can_the_electorate_or_legislators_do_in/,/r/PoliticalDiscussion/comments/1gqgb8t/what_can_the_electorate_or_legislators_do_in/
trump,PoliticalDiscussion,General Politics,2184653,Why is there such confusion about whether or not Putin has spoken to Trump?,141,111,No,Yes,0,https://www.reddit.com/r/PoliticalDiscussion/comments/1gq4ztm/why_is_there_such_confusion_about_whether_or_not/,/r/PoliticalDiscussion/comments/1gq4ztm/why_is_there_such_confusion_about_whether_or_not/
results,PoliticalDiscussion,General Politics,2184653,"In 2016, Republicans controlled the House and Senate with larger margins over Democrats than they have in 2024. What does this potentially mean for proposed changes that may land on the floor?",164,61,No,No,0,https://www.reddit.com/r/PoliticalDiscussion/comments/1gq3dwr/in_2016_republicans_controlled_the_house_and/,/r/PoliticalDiscussion/comments/1gq3dwr/in_2016_republicans_controlled_the_house_and/
president,PoliticalDiscussion,General Politics,2184653,"If Democrats do shift to the populist left in 2028, who will be the leader of the movement with Bernie likely being too old?",483,1512,No,No,0,https://www.reddit.com/r/PoliticalDiscussion/comments/1gpgnc8/if_democrats_do_shift_to_the_populist_left_in/,/r/PoliticalDiscussion/comments/1gpgnc8/if_democrats_do_shift_to_the_populist_left_in/
trump,PoliticalDiscussion,General Politics,2184653,"Tulsi Gabbard is up for Secretary of Intelligence. What affect will this have on US actions globally, and Trump's administration?",0,87,No,No,0,https://www.reddit.com/r/PoliticalDiscussion/comments/1gqz93e/tulsi_gabbard_is_up_for_secretary_of_intelligence/,/r/PoliticalDiscussion/comments/1gqz93e/tulsi_gabbard_is_up_for_secretary_of_intelligence/
results,NeutralPolitics,General Politics,610702,What to expect after the U.S. election,282,26,Yes,Yes,0,https://www.reddit.com/r/NeutralPolitics/comments/1gflxpk/what_to_expect_after_the_us_election/,/r/NeutralPolitics/comments/1gflxpk/what_to_expect_after_the_us_election/
house,NeutralPolitics,General Politics,610702,Tracking what bills/decisions are coming to contact reps/senators in a timely manner,27,6,No,No,0,https://www.reddit.com/r/NeutralPolitics/comments/1gqkpdp/tracking_what_billsdecisions_are_coming_to/,/r/NeutralPolitics/comments/1gqkpdp/tracking_what_billsdecisions_are_coming_to/
loss,NeutralPolitics,General Politics,610702,Do any countries have laws to combat politically-driven misinformation?,18,29,No,Yes,0,https://www.reddit.com/r/NeutralPolitics/comments/1gq4agt/do_any_countries_have_laws_to_combat/,/r/NeutralPolitics/comments/1gq4agt/do_any_countries_have_laws_to_combat/
results,NeutralPolitics,General Politics,610702,Trump won the presidency and popular vote running on the mass deportation of illegal aliens. Who saw this coming and what lessons can be learned?,219,326,No,No,0,https://www.reddit.com/r/NeutralPolitics/comments/1gnk7ih/trump_won_the_presidency_and_popular_vote_running/,/r/NeutralPolitics/comments/1gnk7ih/trump_won_the_presidency_and_popular_vote_running/
results,NeutralPolitics,General Politics,610702,Is now the time for a NEW moderate third party in U.S. politics?,0,79,No,No,0,https://www.reddit.com/r/NeutralPolitics/comments/1gms9so/is_now_the_time_for_a_new_moderate_third_party_in/,/r/NeutralPolitics/comments/1gms9so/is_now_the_time_for_a_new_moderate_third_party_in/
harris,NeutralPolitics,General Politics,610702,Why Are So Many Men Leaving The Democratic Party Over The Last Few Years?,382,156,No,No,0,https://www.reddit.com/r/NeutralPolitics/comments/1gklb9t/why_are_so_many_men_leaving_the_democratic_party/,/r/NeutralPolitics/comments/1gklb9t/why_are_so_many_men_leaving_the_democratic_party/
trump,NeutralPolitics,General Politics,610702,What plans about trump and kamala have on section 8 housing and dept of edu.,0,11,No,No,0,https://www.reddit.com/r/NeutralPolitics/comments/1gk1emp/what_plans_about_trump_and_kamala_have_on_section/,/r/NeutralPolitics/comments/1gk1emp/what_plans_about_trump_and_kamala_have_on_section/
outcome,NeutralPolitics,General Politics,610702,"What are the pros and cons of predictive election models, like 538, for our discourse around elections?",44,94,No,No,0,https://www.reddit.com/r/NeutralPolitics/comments/1giqib5/what_are_the_pros_and_cons_of_predictive_election/,/r/NeutralPolitics/comments/1giqib5/what_are_the_pros_and_cons_of_predictive_election/
harris,NeutralPolitics,General Politics,610702,How do the Trump and Harris plans for workforce pay and taxes compare?,4,6,No,No,0,https://www.reddit.com/r/NeutralPolitics/comments/1ggxh8w/how_do_the_trump_and_harris_plans_for_workforce/,/r/NeutralPolitics/comments/1ggxh8w/how_do_the_trump_and_harris_plans_for_workforce/
fraud,NeutralPolitics,General Politics,610702,Has there been any investigative journalism or public legal discovery to examine process irregularities regarding the 2020 election?,12,15,No,No,0,https://www.reddit.com/r/NeutralPolitics/comments/1ggkpzr/has_there_been_any_investigative_journalism_or/,/r/NeutralPolitics/comments/1ggkpzr/has_there_been_any_investigative_journalism_or/
trump,moderatepolitics,General Politics,296559,Trump expected to select Robert F. Kennedy Jr. to lead HHS,407,602,No,No,0,https://www.politico.com/news/2024/11/14/robert-f-kennedy-jr-trump-hhs-secretary-pick-00188617,/r/moderatepolitics/comments/1grf4x1/trump_expected_to_select_robert_f_kennedy_jr_to/
trump,moderatepolitics,General Politics,296559,Democratic Colorado governor praises Trump for nominating RFK Jr. as HHS secretary,145,185,No,No,0,https://kfoxtv.com/news/nation-world/democratic-colorado-governor-praises-trump-for-nominating-rfk-jr-as-hhs-secretary-democratic-gov-jared-polis-praised-president-elect-donald-trump-on-thursday-for-nominating-robert-f-kennedy-jr-democratic-us-department-of-health-and-human-services,/r/moderatepolitics/comments/1grhcyw/democratic_colorado_governor_praises_trump_for/
trump,moderatepolitics,General Politics,296559,The ‘Lost Boys’ of Gen Z: how Trump won the hearts of alienated young men,297,794,No,No,0,https://theconversation.com/the-lost-boys-of-gen-z-how-trump-won-the-hearts-of-alienated-young-men-243358,/r/moderatepolitics/comments/1grbshi/the_lost_boys_of_gen_z_how_trump_won_the_hearts/
trump,moderatepolitics,General Politics,296559,Trump taps Rep. Matt Gaetz as attorney general,447,641,No,No,0,https://www.cnbc.com/amp/2024/11/13/trump-taps-rep-matt-gaetz-as-attorney-general.html,/r/moderatepolitics/comments/1gqnmqd/trump_taps_rep_matt_gaetz_as_attorney_general/
harris,moderatepolitics,General Politics,296559,Kamala Harris ditched Joe Rogan podcast interview over progressive backlash fears,471,633,No,No,0,https://www.ft.com/content/9292db59-8291-4507-8d86-f8d4788da467,/r/moderatepolitics/comments/1gqmu15/kamala_harris_ditched_joe_rogan_podcast_interview/
trump,moderatepolitics,General Politics,296559,Trump picks Tulsi Gabbard for Director of National Intelligence,413,497,No,No,0,https://search.app?link=https%3A%2F%2Fwww.cnn.com%2F2024%2F11%2F13%2Fpolitics%2Ftrump-picks-tulsi-gabbard-director-of-national-intelligence%2Findex.html&utm_campaign=aga&utm_source=agsadl2%2Csh%2Fx%2Fgs%2Fm2%2F4,/r/moderatepolitics/comments/1gqmj7d/trump_picks_tulsi_gabbard_for_director_of/
senate,moderatepolitics,General Politics,296559,John Thune of South Dakota Elected as Next Senate Majority Leader,261,134,No,No,0,https://www.nytimes.com/2024/11/13/us/politics/trump-senate-thune-cornyn-scott.html,/r/moderatepolitics/comments/1gqj5h4/john_thune_of_south_dakota_elected_as_next_senate/
trump,moderatepolitics,General Politics,296559,Elon Musk and Vivek Ramaswamy will lead new ‘Department of Government Efficiency’ in Trump administration,503,830,No,No,0,https://www.cnn.com/2024/11/12/politics/elon-musk-vivek-ramaswamy-department-of-government-efficiency-trump/index.html,/r/moderatepolitics/comments/1gq0ozd/elon_musk_and_vivek_ramaswamy_will_lead_new/
trump,moderatepolitics,General Politics,296559,Trump Draft Executive Order Would Create Board to Purge Generals,288,303,No,No,0,https://www.wsj.com/politics/national-security/trump-draft-executive-order-would-create-board-to-purge-generals-7ebaa606?st=ikAgWH&reflink=article_copyURL_share,/r/moderatepolitics/comments/1gq1ko4/trump_draft_executive_order_would_create_board_to/
trump,moderatepolitics,General Politics,296559,Donald Trump Nominates Fox News Host Pete Hegseth As Secretary Of Defense,334,562,No,No,0,https://deadline.com/2024/11/trump-pete-hegseth-secretary-of-defense-1236174786/,/r/moderatepolitics/comments/1gq034k/donald_trump_nominates_fox_news_host_pete_hegseth/
recount,technology,General Politics,17400239,Computer Scientists: Breaches of Voting System Software Warrant Recounts to Ensure Election Verification,16742,1837,No,No,0,https://freespeechforpeople.org/computer-scientists-breaches-of-voting-system-software-warrant-recounts-to-ensure-election-verification/,/r/technology/comments/1grg9r4/computer_scientists_breaches_of_voting_system/
biden,technology,General Politics,17400239,Exclusive: Trump's transition team aims to kill Biden EV tax credit,5018,613,No,No,0,https://www.reuters.com/business/autos-transportation/trumps-transition-team-aims-kill-biden-ev-tax-credit-2024-11-14/,/r/technology/comments/1grd0zm/exclusive_trumps_transition_team_aims_to_kill/
trump,technology,General Politics,17400239,"Thune Is Big Fan of Wind Power, an Energy Source Trump Hates",1477,125,No,No,0,https://www.bloomberg.com/news/articles/2024-11-14/thune-is-big-fan-of-wind-power-an-energy-source-trump-hates,/r/technology/comments/1gr9e81/thune_is_big_fan_of_wind_power_an_energy_source/
trump,democrats,Ideological Politics,480718,Elizabeth Warren smells something fishy going on with Trump’s transition team,6396,1059,No,No,0,https://www.msnbc.com/the-reidout/reidout-blog/elizabeth-warren-trump-transition-ethics-corruption-rcna179861,/r/democrats/comments/1gr7iwb/elizabeth_warren_smells_something_fishy_going_on/
trump,democrats,Ideological Politics,480718,Undocumented mechanic says he won’t regret his support for Trump even if he’s deported,786,252,No,No,0,https://edition.cnn.com/2024/11/13/us/video/trump-mass-deportations-rosa-flores-dnt-ac360-digvid,/r/democrats/comments/1grd4y5/undocumented_mechanic_says_he_wont_regret_his/
president,democrats,Ideological Politics,480718,"The Onion Buys Infowars”, and no, this is not a joke ",947,60,No,No,0,https://www.nytimes.com/2024/11/14/business/media/alex-jones-infowars-the-onion.html?smid=nytcore-ios-share&referringSource=articleShare,/r/democrats/comments/1gr6vdb/the_onion_buys_infowars_and_no_this_is_not_a_joke/
trump,democrats,Ideological Politics,480718,High grocery prices got droves of Americans to vote for Trump but they shouldn’t expect to pay less over the next four years,526,92,No,No,0,https://www.cnn.com/2024/11/14/economy/trump-grocery-prices-inflation?cid=ios_app,/r/democrats/comments/1graf6u/high_grocery_prices_got_droves_of_americans_to/
trump,Republican,Ideological Politics,205559,Trump Picks RFK Jr. as Secretary of Health and Human Services,245,36,No,No,0,https://www.theepochtimes.com/us/trump-expected-to-pick-rfk-jr-as-secretary-of-health-and-human-services-5759936?utm_source=partner,/r/Republican/comments/1grhg6q/trump_picks_rfk_jr_as_secretary_of_health_and/
senate,Republican,Ideological Politics,205559,"So, That's Why Bob Casey Didn't Concede the PA Senate Race | PA commissioner says she knows it's illegal but simply does not care",175,24,No,No,0,https://townhall.com/tipsheet/mattvespa/2024/11/14/bucks-county-dems-should-be-indicted-for-trying-to-steal-the-pa-senate-race-n2647807,/r/Republican/comments/1grhr5s/so_thats_why_bob_casey_didnt_concede_the_pa/
trump,Republican,Ideological Politics,205559,Florida AG sues FEMA for skipping over Trump supporters 😡👍,133,5,No,No,0,https://nypost.com/2024/11/14/us-news/florida-ag-sues-fema-for-skipping-over-trump-supporters/,/r/Republican/comments/1grj36z/florida_ag_sues_fema_for_skipping_over_trump/
trump,Republican,Ideological Politics,205559,"Trump Nominates Robert F. Kennedy Jr. to Lead Health and Human Services, Vows to End Chronic Disease Epidemic",131,30,No,No,0,https://m10news.com/trump-nominates-robert-f-kennedy-jr-to-lead-health-and-human-services-vows-to-end-chronic-disease-epidemic/,/r/Republican/comments/1grh8f3/trump_nominates_robert_f_kennedy_jr_to_lead/
trump,Republican,Ideological Politics,205559,Sylvester Stallone Hails Donald Trump as ‘Second George Washington’ | Video,48,2,No,No,0,https://www.yahoo.com/entertainment/sylvester-stallone-hails-donald-trump-022225745.html,/r/Republican/comments/1grn4d1/sylvester_stallone_hails_donald_trump_as_second/
harris,Republican,Ideological Politics,205559,Editorial Board Scolds Oprah Winfrey over $1 Million Kamala Harris Payment,134,25,No,No,0,https://www.breitbart.com/entertainment/2024/11/14/chicago-tribune-editorial-board-scolds-oprah-winfrey-over-1-million-kamala-harris-payment-to-harpo-productions/,/r/Republican/comments/1greldf/editorial_board_scolds_oprah_winfrey_over_1/
victory,Republican,Ideological Politics,205559,Corey Burke hacked father to death after Trump's Election Night victory,36,19,No,No,0,https://nypost.com/2024/11/13/us-news/corey-burke-hacked-father-to-death-after-trumps-election-night-victory/,/r/Republican/comments/1gri1zj/corey_burke_hacked_father_to_death_after_trumps/
trump,Republican,Ideological Politics,205559,Trump Announces North Dakota Gov. Doug Burgum as Department of the Interior Secretary,15,1,No,No,0,https://www.foxnews.com/politics/trump-announces-north-dakota-gov-doug-burgum-department-the-interior-secretary,/r/Republican/comments/1grn05i/trump_announces_north_dakota_gov_doug_burgum_as/
trump,Republican,Ideological Politics,205559,"Republicans Secure House Majority, Gaining Full Control of Government as Trump Prepares for Presidency",195,42,No,No,0,https://m10news.com/republicans-secure-house-majority-gaining-full-control-of-government-as-trump-prepares-for-presidency/,/r/Republican/comments/1gr3lyd/republicans_secure_house_majority_gaining_full/
trump,Conservative,Ideological Politics,1147566,President-elect Trump with President Milei and Elon Musk (11/14),820,72,No,No,0,https://i.redd.it/b8vxksw0az0e1.jpeg,/r/Conservative/comments/1grmaxt/presidentelect_trump_with_president_milei_and/
trump,Conservative,Ideological Politics,1147566,Trump to universities: Stamp out antisemitism or lose accreditation,1426,114,No,No,0,https://www.jpost.com/diaspora/antisemitism/article-829167,/r/Conservative/comments/1grg9mz/trump_to_universities_stamp_out_antisemitism_or/
trump,Conservative,Ideological Politics,1147566,President elect Trump announces that Robert F Kennedy Jr will be the Secretary of HHS,1517,738,No,No,0,https://i.redd.it/brxei6fbox0e1.jpeg,/r/Conservative/comments/1grfif6/president_elect_trump_announces_that_robert_f/
trump,Conservative,Ideological Politics,1147566,Trump to nominate RFK Jr. to head Department of Health and Human Services,1311,471,No,No,0,https://nypost.com/2024/11/14/us-news/trump-to-nominate-rfk-jr-to-head-department-of-health-and-human-services-sources/?utm_source=chatgpt.com,/r/Conservative/comments/1greyd9/trump_to_nominate_rfk_jr_to_head_department_of/
recount,Conservative,Ideological Politics,1147566,Casey Wants Unregistered Voters To be Counted In PA Recount,361,75,No,No,0,https://thefederalist.com/2024/11/14/sen-casey-wants-ballots-from-unregistered-voters-to-be-counted-in-pennsylvania-recount/,/r/Conservative/comments/1grk2h3/casey_wants_unregistered_voters_to_be_counted_in/
trump,Conservative,Ideological Politics,1147566,Does the left know that Fox only has 2.5 million viewers and 72 million poeople who don't watch Fox voted for Trump?,1652,473,No,No,0,https://www.reddit.com/r/Conservative/comments/1gr6o39/does_the_left_know_that_fox_only_has_25_million/,/r/Conservative/comments/1gr6o39/does_the_left_know_that_fox_only_has_25_million/
trump,Conservative,Ideological Politics,1147566,Kick streamer Adin Ross is sending a PC to the kid in Chicago who debated and defended Donald Trump against his teacher and classmates at his high school,1043,8,No,No,0,https://x.com/FearedBuck/status/1856375928378589417,/r/Conservative/comments/1gr9l8t/kick_streamer_adin_ross_is_sending_a_pc_to_the/
trump,Conservative,Ideological Politics,1147566,Nikki Haley Calls Trump ‘Shallow’ After Being Rejected for Admin Job,652,175,No,No,0,https://www.breitbart.com/2024-election/2024/11/14/nikki-haley-calls-trump-shallow-rejected-admin-job/,/r/Conservative/comments/1grc68a/nikki_haley_calls_trump_shallow_after_being/
trump,Conservative,Ideological Politics,1147566,Megyn Kelly predicts MSNBC will fire ‘racist’ Joy Reid for saying Trump will deport ‘brown people’: ‘She wants a race riot’,311,20,No,No,0,https://nypost.com/2024/11/12/media/megyn-kelly-says-msnbc-should-fire-racist-joy-reid/,/r/Conservative/comments/1grh1a8/megyn_kelly_predicts_msnbc_will_fire_racist_joy/
biden,Libertarian,Ideological Politics,503682,Trump's transition team aims to kill Biden EV tax credit,115,52,No,No,0,https://www.reuters.com/business/autos-transportation/trumps-transition-team-aims-kill-biden-ev-tax-credit-2024-11-14/,/r/Libertarian/comments/1grcl2s/trumps_transition_team_aims_to_kill_biden_ev_tax/
recount,Anarchism,Ideological Politics,271154,"We've prepared a zine version of ""The Eye of Every Storm,"" in which an anarchist involved in longstanding disaster response efforts in Appalachia recounts the lessons they learned in the course of responding to Hurricane Helene and offers advice about how to get ready for the disasters to come.",34,1,No,No,0,/r/CrimethInc/comments/1grdton/weve_prepared_a_zine_version_of_the_eye_of_every/,/r/Anarchism/comments/1grdtug/weve_prepared_a_zine_version_of_the_eye_of_every/
trump,Anarchism,Ideological Politics,271154,"We've prepared a zine version of our text ""History Repeats Itself: First as Farce, Then as Tragedy,"" exploring why the Democrats are responsible for Donald Trump's return to power and what we have to do to regain the initiative.",40,1,No,No,0,/r/CrimethInc/comments/1grchqe/weve_prepared_a_zine_version_of_our_text_history/,/r/Anarchism/comments/1grchxa/weve_prepared_a_zine_version_of_our_text_history/
trump,Socialism,Ideological Politics,461000,Stop condescendingly telling people to “read theory”,708,120,No,No,0,https://www.reddit.com/r/socialism/comments/1gr89t5/stop_condescendingly_telling_people_to_read_theory/,/r/socialism/comments/1gr89t5/stop_condescendingly_telling_people_to_read_theory/
trump,Socialism,Ideological Politics,461000,"Trump named Elon Musk and Vivek Ramaswamy, two billionaires, to lead a new “Department of Government Efficiency” and launch an assault on every public program that benefits the working class. Meet the billionaires in charge of Trump’s war on the working class ➡️",81,5,No,No,0,https://www.reddit.com/gallery/1grj6yx,/r/socialism/comments/1grj6yx/trump_named_elon_musk_and_vivek_ramaswamy_two/
vance,Socialism,Ideological Politics,461000,Isn't The UK Labour Party a leftist party?,35,50,No,No,0,https://www.reddit.com/r/socialism/comments/1gr88hm/isnt_the_uk_labour_party_a_leftist_party/,/r/socialism/comments/1gr88hm/isnt_the_uk_labour_party_a_leftist_party/
trump,Socialism,Ideological Politics,461000,"Trump wants to blame all the problems we face under the capitalist system – inflation, homelessness, crime, unemployment – on immigrants. ",204,5,No,No,0,https://www.reddit.com/gallery/1gqjiv5,/r/socialism/comments/1gqjiv5/trump_wants_to_blame_all_the_problems_we_face/
trump,Progressive,Ideological Politics,78068,Behind the Curtain: Trump's business bonanza,16,1,No,No,0,https://www.axios.com/2024/11/07/trump-elon-musk-business-tax-cuts,/r/progressive/comments/1gm4w17/behind_the_curtain_trumps_business_bonanza/
victory,Progressive,Ideological Politics,78068,Far-Right Donald Trump Supporters Celebrate His Victory with Violent Memes and Calls for Executions,249,13,No,No,0,https://www.wired.com/story/donald-trump-far-right-supporters-violent-memes/,/r/progressive/comments/1glfnyf/farright_donald_trump_supporters_celebrate_his/
trump,Progressive,Ideological Politics,78068,What Trump's first 100 days in office could look like,24,6,No,No,0,https://www.npr.org/2024/11/06/nx-s1-5181800/2024-election-trump-first-100-days-agenda,/r/progressive/comments/1glo04a/what_trumps_first_100_days_in_office_could_look/
trump,Progressive,Ideological Politics,78068,Americans in Puerto Rico can't vote for US president. Their anger at Trump is shaping the race.,352,32,No,No,0,https://apnews.com/article/puerto-rico-trump-joke-garbage-a91e2aafd93a06d32365efa013581b85,/r/progressive/comments/1gh2ab4/americans_in_puerto_rico_cant_vote_for_us/
harris,Progressive,Ideological Politics,78068,"Trump loyalists spew racist, vulgar attacks at Harris and Democrats at New York City rally",259,6,No,No,0,https://www.cnn.com/2024/10/27/politics/trump-rally-madison-square-garden-vulgar-attacks/index.html,/r/progressive/comments/1gdskia/trump_loyalists_spew_racist_vulgar_attacks_at/
results,Republicanism,Ideological Politics,918,Survey about your political worldview (18+; 12-14 mins to complete),3,0,No,No,0,https://www.reddit.com/r/republicanism/comments/1aq418a/survey_about_your_political_worldview_18_1214/,/r/republicanism/comments/1aq418a/survey_about_your_political_worldview_18_1214/
house,Republicanism,Ideological Politics,918,Meet Susanna Gibson: Virginia Democrat in key state House race calls sharing of pornographic videos ‘the worst gutter politics’,2,0,No,No,0,https://www.celebsweek.com/susanna-gibson/,/r/republicanism/comments/16hfi9k/meet_susanna_gibson_virginia_democrat_in_key/
president,Republicanism,Ideological Politics,918,About the Lopez,3,2,No,No,0,https://www.reddit.com/r/republicanism/comments/1094bh5/about_the_lopez/,/r/republicanism/comments/1094bh5/about_the_lopez/
harris,Conservatives,Ideological Politics,108263,Voters Rejected Not Just Harris But Democrats' Politics Of Division,130,4,No,No,0,https://thefederalist.com/2024/11/14/voters-rejected-not-just-kamala-harris-but-democrats-politics-of-division/,/r/conservatives/comments/1grgii8/voters_rejected_not_just_harris_but_democrats/
recount,Conservatives,Ideological Politics,108263,Casey Wants Unregistered Voters To be Counted In PA Recount,66,21,No,No,0,https://thefederalist.com/2024/11/14/sen-casey-wants-ballots-from-unregistered-voters-to-be-counted-in-pennsylvania-recount/,/r/conservatives/comments/1grk2bz/casey_wants_unregistered_voters_to_be_counted_in/
