Keyword,Subreddit,Category,Members,Title,Upvotes,Comments,Moderator Interaction,Fact-Checking Mention,Total Awards,URL,Original Post URL
results,Republicanism,Ideological Politics,917,Survey about your political worldview (18+; 12-14 mins to complete),3,0,No,No,0,https://www.reddit.com/r/republicanism/comments/1aq418a/survey_about_your_political_worldview_18_1214/,/r/republicanism/comments/1aq418a/survey_about_your_political_worldview_18_1214/
house,Republicanism,Ideological Politics,917,Meet Susanna Gibson: Virginia Democrat in key state House race calls sharing of pornographic videos ‘the worst gutter politics’,2,0,No,No,0,https://www.celebsweek.com/susanna-gibson/,/r/republicanism/comments/16hfi9k/meet_susanna_gibson_virginia_democrat_in_key/
president,Republicanism,Ideological Politics,917,About the Lopez,5,2,No,No,0,https://www.reddit.com/r/republicanism/comments/1094bh5/about_the_lopez/,/r/republicanism/comments/1094bh5/about_the_lopez/
harris,Conservatives,Ideological Politics,108232,Donald Trump Was Such a Threat to Democracy That Oprah Charged $1 Million to Endorse Kamala Harris,96,3,No,No,0,https://redstate.com/joesquire/2024/11/11/donald-trump-was-such-a-threat-to-democracy-that-oprah-charged-1-million-to-endorse-kamala-harris-n2181859,/r/conservatives/comments/1gpjz1d/donald_trump_was_such_a_threat_to_democracy_that/
biden,Conservatives,Ideological Politics,108232,"Melania Trump declines to meet with Jill Biden at White House, citing Mar-a-Lago raid: source",363,38,No,No,0,https://nypost.com/2024/11/11/us-news/melania-trump-declines-to-meet-with-jill-biden-at-white-house-citing-mar-a-lago-raid-source/,/r/conservatives/comments/1gpaxk5/melania_trump_declines_to_meet_with_jill_biden_at/
trump,Conservatives,Ideological Politics,108232,Exclusive | Trump border czar Tom Homan vows sanctuary city crackdown,174,4,No,No,0,https://nypost.com/2024/11/11/us-news/trump-border-czar-tom-homan-vows-sanctuary-city-crackdown/,/r/conservatives/comments/1gp8qsb/exclusive_trump_border_czar_tom_homan_vows/
victory,Conservatives,Ideological Politics,108232,Insult to Injury: MSNBC and CNN Suffer Staggering Ratings Plunge Following Trump Victory,12,0,No,No,0,https://www.westernjournal.com/insult-injury-msnbc-cnn-suffer-staggering-ratings-plunge-following-trump-victory/,/r/conservatives/comments/1gpm534/insult_to_injury_msnbc_and_cnn_suffer_staggering/
trump,Conservatives,Ideological Politics,108232,Trump’s Border Czar Has A Plan To Stop Illegal Immigration,134,8,No,No,0,https://www.dailywire.com/news/trumps-border-czar-has-a-plan-to-stop-illegal-immigration,/r/conservatives/comments/1gp7wqj/trumps_border_czar_has_a_plan_to_stop_illegal/
harris,Conservatives,Ideological Politics,108232,A Man of Principle: Mark Cuban Busy Deleting All His Pro-Kamala Harris Tweets,10,1,No,No,0,https://redstate.com/bobhoge/2024/11/11/a-man-of-principle-mark-cuban-deletes-all-his-pro-kamala-harris-tweets-less-than-a-week-after-election-n2181861,/r/conservatives/comments/1gpjyo1/a_man_of_principle_mark_cuban_busy_deleting_all/
trump,Conservatives,Ideological Politics,108232,REPORT: Donald Trump Will Select Sen. Marco Rubio As Secretary of State,6,0,No,No,0,https://redstate.com/jenvanlaar/2024/11/11/breaking-donald-trump-selects-sen-marco-rubio-as-secretary-of-state-n2181860,/r/conservatives/comments/1gpk03q/report_donald_trump_will_select_sen_marco_rubio/
trump,Conservatives,Ideological Politics,108232,"Donald Trump Picks Tom Homan to Oversee Border Security, Deportations",260,24,No,No,0,https://www.breitbart.com/immigration/2024/11/11/trump-picks-tom-homan-to-oversee-border-security-deportations/,/r/conservatives/comments/1govuq0/donald_trump_picks_tom_homan_to_oversee_border/
harris,Conservatives,Ideological Politics,108232,Report: Kamala Harris Campaign Paid Oprah Winfrey $1 Million,99,5,No,No,0,https://www.breitbart.com/entertainment/2024/11/11/report-kamala-harris-campaign-paid-oprah-winfrey-1-million/,/r/conservatives/comments/1gp3nw2/report_kamala_harris_campaign_paid_oprah_winfrey/
trump,dailywire,Ideological Politics,24181,Wall of Hate - Help Document Hatred Against Trump on July13th.com,81,16,Yes,No,0,https://july13th.com/hate/,/r/dailywire/comments/1e3cqx8/wall_of_hate_help_document_hatred_against_trump/
trump,dailywire,Ideological Politics,24181,Another claim in which Trump was right ,117,2,No,No,0,https://v.redd.it/26hradrdcd0e1,/r/dailywire/comments/1gp8glb/another_claim_in_which_trump_was_right/
trump,dailywire,Ideological Politics,24181,Cause Trump won,122,43,No,No,0,https://i.redd.it/4gasjjjbva0e1.png,/r/dailywire/comments/1gowe6q/cause_trump_won/
trump,dailywire,Ideological Politics,24181,I think we got played. ,87,45,No,No,0,https://www.reddit.com/gallery/1goxduw,/r/dailywire/comments/1goxduw/i_think_we_got_played/
trump,dailywire,Ideological Politics,24181,19 year old here. So I'm Gen Z. I am a female!,71,6,No,No,0,https://www.youtube.com/watch?v=ybgV3jSNKEE,/r/dailywire/comments/1gokaic/19_year_old_here_so_im_gen_z_i_am_a_female/
trump,Liberal,Ideological Politics,119782,Arizona AG says she won't drop state's fake electors case against Trump allies,489,17,No,No,0,https://www.upi.com/Top_News/US/2024/11/10/Arizona-fake-electors-case/4001731292312/,/r/Liberal/comments/1gosjeh/arizona_ag_says_she_wont_drop_states_fake/
trump,Liberal,Ideological Politics,119782,Authoritarianism Expert Shatters A Trump ‘Illusion’: ‘One Of The Biggest Scams Of All’,200,41,No,No,0,https://www.huffpost.com/entry/ruth-ben-ghiat-donald-trump-scam_n_6731e1a0e4b0231a203af70c,/r/Liberal/comments/1gotekd/authoritarianism_expert_shatters_a_trump_illusion/
president,Liberal,Ideological Politics,119782,What I think needs changing,29,135,No,No,0,https://www.reddit.com/r/Liberal/comments/1goxogz/what_i_think_needs_changing/,/r/Liberal/comments/1goxogz/what_i_think_needs_changing/
recount,Liberal,Ideological Politics,119782,Glad to see we have visitors.,104,59,No,Yes,0,https://www.reddit.com/r/Liberal/comments/1gon2jn/glad_to_see_we_have_visitors/,/r/Liberal/comments/1gon2jn/glad_to_see_we_have_visitors/
harris,Liberal,Ideological Politics,119782,Why were the polls so wrong?,142,168,No,No,0,https://www.reddit.com/r/Liberal/comments/1go7sv1/why_were_the_polls_so_wrong/,/r/Liberal/comments/1go7sv1/why_were_the_polls_so_wrong/
biden,Liberal,Ideological Politics,119782,Purely Symbolic I know....,21,1,No,No,0,https://www.reddit.com/r/Liberal/comments/1gody1k/purely_symbolic_i_know/,/r/Liberal/comments/1gody1k/purely_symbolic_i_know/
harris,Liberal,Ideological Politics,119782,I keep hearing theories about how 15m people staying home didn't actually stay home and I'm not buying it.,318,355,No,No,0,https://www.reddit.com/r/Liberal/comments/1gnrlns/i_keep_hearing_theories_about_how_15m_people/,/r/Liberal/comments/1gnrlns/i_keep_hearing_theories_about_how_15m_people/
harris,Liberal,Ideological Politics,119782,America will NOT elect a woman President.,281,404,No,No,0,https://www.reddit.com/r/Liberal/comments/1gnhckm/america_will_not_elect_a_woman_president/,/r/Liberal/comments/1gnhckm/america_will_not_elect_a_woman_president/
harris,Liberal,Ideological Politics,119782,"Liberals need to stop blaming themselves, and stop blaming Trump voters",152,117,No,Yes,0,https://www.reddit.com/r/Liberal/comments/1gnk7ug/liberals_need_to_stop_blaming_themselves_and_stop/,/r/Liberal/comments/1gnk7ug/liberals_need_to_stop_blaming_themselves_and_stop/
house,Liberal,Ideological Politics,119782,We're all in this together,64,50,No,No,0,https://www.reddit.com/r/Liberal/comments/1gnpdn0/were_all_in_this_together/,/r/Liberal/comments/1gnpdn0/were_all_in_this_together/
supreme court,Liberal,Ideological Politics,119782,Thinking about these big blue cities where the majority of red states money comes from.  These blue cities could bring their red states to there knees. ,127,125,No,No,0,https://www.reddit.com/r/Liberal/comments/1gne8ji/thinking_about_these_big_blue_cities_where_the/,/r/Liberal/comments/1gne8ji/thinking_about_these_big_blue_cities_where_the/
house,Liberal,Ideological Politics,119782,The House is still in play and you can help by curing votes!,29,0,No,No,0,https://votesaveamerica.com/,/r/Liberal/comments/1gnlz7c/the_house_is_still_in_play_and_you_can_help_by/
recount,KamalaHarris,Ideological Politics,75936,Harris fundraising page says a portion of donations will be directed to recount effort,159,19,No,No,0,https://www.usatoday.com/story/news/politics/elections/2024/11/11/kamala-harris-fundraiser-donations-election-recount/76195287007/,/r/KamalaHarris/comments/1gplf80/harris_fundraising_page_says_a_portion_of/
trump,KamalaHarris,Ideological Politics,75936,"Republicans win House, delivering Trump a trifecta",631,260,No,No,0,https://thehill.com/homenews/state-watch/4974235-house-republicans-control-majority/,/r/KamalaHarris/comments/1gp9psj/republicans_win_house_delivering_trump_a_trifecta/
harris,KamalaHarris,Ideological Politics,75936,The Crass but Winning Political Tactic That Kamala Harris Missed,256,115,No,No,0,https://slate.com/news-and-politics/2024/11/donald-trump-win-presidential-election-kamala-harris-economy.html,/r/KamalaHarris/comments/1gozjze/the_crass_but_winning_political_tactic_that/
president,KamalaHarris,Ideological Politics,75936,"Watching this is so heartbreakingly sad. She would’ve been a great president. She wants to empower us, he wants to control us. ",2894,427,No,No,0,https://v.redd.it/iklqyeyl970e1,/r/KamalaHarris/comments/1gojwnq/watching_this_is_so_heartbreakingly_sad_she/
results,KamalaHarris,Ideological Politics,75936,I'm heartbroken over the results of this election - and here's why,570,49,No,No,0,https://youtu.be/7n7SoOTIlZY?si=b5q0Jb-sJSzoULRx,/r/KamalaHarris/comments/1golbbu/im_heartbroken_over_the_results_of_this_election/
loss,KamalaHarris,Ideological Politics,75936,LGBTQ Women of Color Reflect on Kamala Harris' Loss and Donald Trump's Win,306,21,No,No,0,https://www.unclosetedmedia.com/p/lgbtq-women-of-color-reflect-on-kamala,/r/KamalaHarris/comments/1go1m95/lgbtq_women_of_color_reflect_on_kamala_harris/
trump,Impeach_Trump,Ideological Politics,60564,"Far-right extremists celebrate Trump’s win — In a burst of hate and misogyny, MAGA militants cheered the return of a president they consider an ally",141,1,No,No,0,https://www.washingtonpost.com/politics/2024/11/07/right-wing-extremists-celebrate-trump-victory/,/r/Impeach_Trump/comments/1gmvba5/farright_extremists_celebrate_trumps_win_in_a/
trump,Impeach_Trump,Ideological Politics,60564,Trump feigned ignorance of Project 2025,218,10,No,No,0,https://imghoster.co/en/FhQ7EhPjtSXOF4R,/r/Impeach_Trump/comments/1glm47g/trump_feigned_ignorance_of_project_2025/
trump,Impeach_Trump,Ideological Politics,60564,The Deep Roots of 4 of Donald Trump’s Highly Xenophobic Remarks,32,1,No,No,0,https://www.nytimes.com/2024/11/01/us/politics/trump-immigration-rhetoric-history.html,/r/Impeach_Trump/comments/1glhq62/the_deep_roots_of_4_of_donald_trumps_highly/
trump,Impeach_Trump,Ideological Politics,60564,Literal Neo-Nazi Leader Endorses Trump,220,1,No,No,0,https://www.rollingstone.com/politics/politics-news/trump-endorsement-neo-nazi-leader-nsc-131-1235154089/,/r/Impeach_Trump/comments/1gkmq6t/literal_neonazi_leader_endorses_trump/
trump,Impeach_Trump,Ideological Politics,60564,Trump's crowds are dwindling as his campaign winds down — Empty seats and early exits have grown more common,431,18,No,No,0,https://www.nytimes.com/2024/11/04/us/politics/trump-rally-crowds.html,/r/Impeach_Trump/comments/1gjn8sb/trumps_crowds_are_dwindling_as_his_campaign_winds/
trump,Impeach_Trump,Ideological Politics,60564,"Donald Trump talks about women at his rallies like they are objects, he doesn't see them as equals",302,3,No,No,0,https://imghoster.co/v3YtmBuQO5WqVHF,/r/Impeach_Trump/comments/1ggdie6/donald_trump_talks_about_women_at_his_rallies/
trump,Impeach_Trump,Ideological Politics,60564,"Donald Trump called half of America ""human scum""",194,5,No,No,0,https://imghoster.co/VN2ORQf6SinlHXJ?utm_source=reddit&utm_medium=impeach_trump,/r/Impeach_Trump/comments/1gg9nmz/donald_trump_called_half_of_america_human_scum/
trump,Impeach_Trump,Ideological Politics,60564,This is an amazing article written by user u/SilkyFluffs in r/democrats which is an amazing resource for combating GOP and Trump misinformation and possibly even converting family members or undecided voters,45,0,No,Yes,0,https://pdflink.to/d6e0bc9d/,/r/Impeach_Trump/comments/1ggd0pc/this_is_an_amazing_article_written_by_user/
trump,Impeach_Trump,Ideological Politics,60564,"Elon Musk predicts ‘hardship,’ economic turmoil and a stock-market crash if Trump wins",65,4,No,No,0,https://www.marketwatch.com/story/kaboom-elon-musk-predicts-hardship-economic-turmoil-and-a-stock-market-crash-if-trump-wins-20483008,/r/Impeach_Trump/comments/1gfwy5u/elon_musk_predicts_hardship_economic_turmoil_and/
trump,Impeach_Trump,Ideological Politics,60564,Kamala's rally in DC vs. Trump's rally in DC,127,0,No,No,0,https://imghoster.co/en/D370Y9JxmPOx6x3,/r/Impeach_Trump/comments/1gfnege/kamalas_rally_in_dc_vs_trumps_rally_in_dc/
trump,Impeach_Trump,Ideological Politics,60564,Trump is 10x more corrupt than all the rest put together,318,3,No,No,0,https://imghoster.co/en/R3aE5Zdu1UQvWSj,/r/Impeach_Trump/comments/1getadg/trump_is_10x_more_corrupt_than_all_the_rest_put/
