Keyword,Subreddit,Category,Members,Title,Upvotes,Comments,Moderator Interaction,Fact-Checking Mention,Total Awards,URL,Original Post URL
results,Wikileaks,General Politics,177637,Censored Wikileaks content?,15,7,No,No,0,https://www.reddit.com/r/WikiLeaks/comments/1frr2wq/censored_wikileaks_content/,/r/WikiLeaks/comments/1frr2wq/censored_wikileaks_content/
president,PoliticalDiscussion,General Politics,2184603,"If Democrats do shift to the populist left in 2028, who will be the leader of the movement with Bernie likely being too old?",104,494,No,No,0,https://www.reddit.com/r/PoliticalDiscussion/comments/1gpgnc8/if_democrats_do_shift_to_the_populist_left_in/,/r/PoliticalDiscussion/comments/1gpgnc8/if_democrats_do_shift_to_the_populist_left_in/
trump,PoliticalDiscussion,General Politics,2184603,How likely is Trump to convert the US to a totalitarian dictatorship?,285,1101,No,No,0,https://www.reddit.com/r/PoliticalDiscussion/comments/1gp56t4/how_likely_is_trump_to_convert_the_us_to_a/,/r/PoliticalDiscussion/comments/1gp56t4/how_likely_is_trump_to_convert_the_us_to_a/
president,PoliticalDiscussion,General Politics,2184603,"If the 22nd Amendment had never been ratified, who would have been the first person since FDR to successfully run for a third term?",163,270,No,No,0,https://www.reddit.com/r/PoliticalDiscussion/comments/1goyi3t/if_the_22nd_amendment_had_never_been_ratified_who/,/r/PoliticalDiscussion/comments/1goyi3t/if_the_22nd_amendment_had_never_been_ratified_who/
biden,PoliticalDiscussion,General Politics,2184603,"Was Trump's win driven by an anti-incumbency sentiment? or was it a successful campaign strategy? had it been the former, would picking a candidate of the same party but not in the incumbent administration have levelled the playing field?",91,291,No,No,0,https://www.reddit.com/r/PoliticalDiscussion/comments/1goqx1f/was_trumps_win_driven_by_an_antiincumbency/,/r/PoliticalDiscussion/comments/1goqx1f/was_trumps_win_driven_by_an_antiincumbency/
trump,PoliticalDiscussion,General Politics,2184603,Do you expect Republican Infighting or Republican Unity to be more prominent in Trumps second term?,20,52,No,No,0,https://www.reddit.com/r/PoliticalDiscussion/comments/1goyjaq/do_you_expect_republican_infighting_or_republican/,/r/PoliticalDiscussion/comments/1goyjaq/do_you_expect_republican_infighting_or_republican/
trump,PoliticalDiscussion,General Politics,2184603,Did the plethora of state level abortion amendments neuter the impact of abortion in the presidential race?,106,197,No,No,0,https://www.reddit.com/r/PoliticalDiscussion/comments/1gonhzy/did_the_plethora_of_state_level_abortion/,/r/PoliticalDiscussion/comments/1gonhzy/did_the_plethora_of_state_level_abortion/
trump,PoliticalDiscussion,General Politics,2184603,Birthright citizenship. ,176,427,No,No,0,https://www.reddit.com/r/PoliticalDiscussion/comments/1gogkpp/birthright_citizenship/,/r/PoliticalDiscussion/comments/1gogkpp/birthright_citizenship/
trump,PoliticalDiscussion,General Politics,2184603,"If Marco Rubio gets picked as Secretary of State, who would Gov. DeSantis appoint to replace him in the U.S. Senate? And would he do a caretaker appt. or a strong appointee given how tough midterms will be?",54,116,No,Yes,0,https://www.reddit.com/r/PoliticalDiscussion/comments/1goi1av/if_marco_rubio_gets_picked_as_secretary_of_state/,/r/PoliticalDiscussion/comments/1goi1av/if_marco_rubio_gets_picked_as_secretary_of_state/
biden,PoliticalDiscussion,General Politics,2184603,How does the world deal with the schizophrenic foreign policy that America has? ,389,350,No,No,0,https://www.reddit.com/r/PoliticalDiscussion/comments/1go363q/how_does_the_world_deal_with_the_schizophrenic/,/r/PoliticalDiscussion/comments/1go363q/how_does_the_world_deal_with_the_schizophrenic/
president,PoliticalDiscussion,General Politics,2184603,What happened to landslide victories?,4,38,No,No,0,https://www.reddit.com/r/PoliticalDiscussion/comments/1goeeuk/what_happened_to_landslide_victories/,/r/PoliticalDiscussion/comments/1goeeuk/what_happened_to_landslide_victories/
trump,PoliticalDiscussion,General Politics,2184603,"Some say: ""The Resistance is about to Ignite."" Referencing State Actors, such as Governors and AGs, Federal Courts, the Press and the Educators and Civil Society [the People.] Are those guardrails still there to thwart attempts by Trump to usurp the Constitution?",302,386,No,No,0,https://www.reddit.com/r/PoliticalDiscussion/comments/1gnmmyw/some_say_the_resistance_is_about_to_ignite/,/r/PoliticalDiscussion/comments/1gnmmyw/some_say_the_resistance_is_about_to_ignite/
results,NeutralPolitics,General Politics,610562,What to expect after the U.S. election,286,26,Yes,Yes,0,https://www.reddit.com/r/NeutralPolitics/comments/1gflxpk/what_to_expect_after_the_us_election/,/r/NeutralPolitics/comments/1gflxpk/what_to_expect_after_the_us_election/
results,NeutralPolitics,General Politics,610562,Trump won the presidency and popular vote running on the mass deportation of illegal aliens. Who saw this coming and what lessons can be learned?,191,326,No,No,0,https://www.reddit.com/r/NeutralPolitics/comments/1gnk7ih/trump_won_the_presidency_and_popular_vote_running/,/r/NeutralPolitics/comments/1gnk7ih/trump_won_the_presidency_and_popular_vote_running/
results,NeutralPolitics,General Politics,610562,Is now the time for a NEW moderate third party in U.S. politics?,0,70,No,No,0,https://www.reddit.com/r/NeutralPolitics/comments/1gms9so/is_now_the_time_for_a_new_moderate_third_party_in/,/r/NeutralPolitics/comments/1gms9so/is_now_the_time_for_a_new_moderate_third_party_in/
harris,NeutralPolitics,General Politics,610562,Why Are So Many Men Leaving The Democratic Party Over The Last Few Years?,383,156,No,No,0,https://www.reddit.com/r/NeutralPolitics/comments/1gklb9t/why_are_so_many_men_leaving_the_democratic_party/,/r/NeutralPolitics/comments/1gklb9t/why_are_so_many_men_leaving_the_democratic_party/
trump,NeutralPolitics,General Politics,610562,What plans about trump and kamala have on section 8 housing and dept of edu.,1,11,No,No,0,https://www.reddit.com/r/NeutralPolitics/comments/1gk1emp/what_plans_about_trump_and_kamala_have_on_section/,/r/NeutralPolitics/comments/1gk1emp/what_plans_about_trump_and_kamala_have_on_section/
outcome,NeutralPolitics,General Politics,610562,"What are the pros and cons of predictive election models, like 538, for our discourse around elections?",38,94,No,No,0,https://www.reddit.com/r/NeutralPolitics/comments/1giqib5/what_are_the_pros_and_cons_of_predictive_election/,/r/NeutralPolitics/comments/1giqib5/what_are_the_pros_and_cons_of_predictive_election/
harris,NeutralPolitics,General Politics,610562,How do the Trump and Harris plans for workforce pay and taxes compare?,5,6,No,No,0,https://www.reddit.com/r/NeutralPolitics/comments/1ggxh8w/how_do_the_trump_and_harris_plans_for_workforce/,/r/NeutralPolitics/comments/1ggxh8w/how_do_the_trump_and_harris_plans_for_workforce/
fraud,NeutralPolitics,General Politics,610562,Has there been any investigative journalism or public legal discovery to examine process irregularities regarding the 2020 election?,11,15,No,No,0,https://www.reddit.com/r/NeutralPolitics/comments/1ggkpzr/has_there_been_any_investigative_journalism_or/,/r/NeutralPolitics/comments/1ggkpzr/has_there_been_any_investigative_journalism_or/
outcome,NeutralPolitics,General Politics,610562,"War involving Israel, Lebanon, and Iran--Motivations? Scale of Conflict?",15,6,No,No,0,https://www.reddit.com/r/NeutralPolitics/comments/1ge5sct/war_involving_israel_lebanon_and_iranmotivations/,/r/NeutralPolitics/comments/1ge5sct/war_involving_israel_lebanon_and_iranmotivations/
house,moderatepolitics,General Politics,296151,Decision Desk HQ projects that Republicans have won enough seats to control the US House.,351,450,No,No,0,https://decisiondeskhq.com/results/2024/General/US-House/,/r/moderatepolitics/comments/1gp80yx/decision_desk_hq_projects_that_republicans_have/
trump,moderatepolitics,General Politics,296151,"Trump expected to tap US Senator Marco Rubio for secretary of state, sources say",183,197,No,No,0,https://www.reuters.com/world/us/trump-taps-us-senator-marco-rubio-secretary-state-2024-11-12/,/r/moderatepolitics/comments/1gpbb2f/trump_expected_to_tap_us_senator_marco_rubio_for/
trump,moderatepolitics,General Politics,296151,Trump wins biggest popular vote count by a Republican ever in history,519,781,No,No,0,https://nypost.com/2024/11/10/us-news/donald-trump-wins-most-popular-votes-by-a-republican-ever/,/r/moderatepolitics/comments/1gowcyo/trump_wins_biggest_popular_vote_count_by_a/
trump,moderatepolitics,General Politics,296151,Trump selects Mike Waltz as national security adviser,97,93,No,No,0,https://ground.news/article/trump-selects-mike-waltz-as-national-security-adviser-source-says_a33643?utm_source=mobile-app&utm_medium=article-share,/r/moderatepolitics/comments/1gp9fq3/trump_selects_mike_waltz_as_national_security/
harris,moderatepolitics,General Politics,296151,Carville: Harris had ‘every advantage’ in the race,161,362,No,No,0,https://thehill.com/homenews/campaign/4983934-carville-harris-presidential-campaign/,/r/moderatepolitics/comments/1gp4yrc/carville_harris_had_every_advantage_in_the_race/
trump,moderatepolitics,General Politics,296151,Trump taps former Rep. Lee Zeldin to lead the Environmental Protection Agency,94,59,No,No,0,https://www.nbcnews.com/politics/donald-trump/trump-taps-lee-zeldin-lead-environmental-protection-agency-rcna179658,/r/moderatepolitics/comments/1gp58af/trump_taps_former_rep_lee_zeldin_to_lead_the/
loss,moderatepolitics,General Politics,296151,Homeward bound: Tim Walz returns to Minnesota after election loss,232,312,No,No,0,https://www.usatoday.com/story/news/politics/elections/2024/11/06/tim-walz-loses-election/75719431007/,/r/moderatepolitics/comments/1gotdz8/homeward_bound_tim_walz_returns_to_minnesota/
trump,moderatepolitics,General Politics,296151,Trump chooses New York Rep. Elise Stefanik as ambassador to United Nations,185,105,No,No,0,https://apnews.com/article/trump-united-nations-elise-stefanik-ambassador-2b482fb39a8d6f03d389d27cc8820056,/r/moderatepolitics/comments/1goui4f/trump_chooses_new_york_rep_elise_stefanik_as/
trump,moderatepolitics,General Politics,296151,Trump says former Ice director Tom Homan will be in charge of borders and deportations,263,534,No,No,0,https://amp.theguardian.com/us-news/2024/nov/11/tom-homan-donald-trump-border-czar-immigration,/r/moderatepolitics/comments/1gop6wi/trump_says_former_ice_director_tom_homan_will_be/
trump,moderatepolitics,General Politics,296151,What Donald Trump's 'concealed carry reciprocity' means for gun rights,100,210,No,No,0,https://www.newsweek.com/donald-trump-concealed-carry-reciprocity-1983740,/r/moderatepolitics/comments/1gov5qt/what_donald_trumps_concealed_carry_reciprocity/
trump,moderatepolitics,General Politics,296151,Trump Told Putin Not to Escalate Ukraine War in Post-Election Call – Washington Post - The Moscow Times,218,399,No,No,0,https://www.themoscowtimes.com/2024/11/10/trump-told-putin-not-to-escalate-ukraine-war-in-post-election-call-washington-post-a86973,/r/moderatepolitics/comments/1goakc0/trump_told_putin_not_to_escalate_ukraine_war_in/
harris,moderatepolitics,General Politics,296151,Harris campaign reportedly spent 6 figures on ‘Call Her Daddy’ podcast with fewer than 1 million YouTube views,560,589,No,No,0,https://www.msn.com/en-us/news/politics/harris-campaign-reportedly-spent-6-figures-on-call-her-daddy-podcast-with-fewer-than-1-million-youtube-views/ar-AA1tLAPk,/r/moderatepolitics/comments/1go1lnt/harris_campaign_reportedly_spent_6_figures_on/
trump,technology,General Politics,17387981,Trump Already Preparing to Load Up Government with Pro-Crypto Officials,4161,619,No,No,0,https://gizmodo.com/trump-already-preparing-to-load-up-government-with-pro-crypto-officials-2000523234,/r/technology/comments/1gpasi8/trump_already_preparing_to_load_up_government/
biden,technology,General Politics,17387981,"Trump's Re-Election Could Reignite Battle Over Space Command Headquarters | Biden reversed a controversial decision to relocate the U.S. Space Command to Alabama, but Trump is expected to follow through with his original plan.",195,57,No,No,0,https://gizmodo.com/trumps-re-election-could-reignite-battle-over-space-command-headquarters-2000523256,/r/technology/comments/1gpjzrx/trumps_reelection_could_reignite_battle_over/
trump,technology,General Politics,17387981,Trump’s techno-libertarian dream team goes to Washington,1953,284,No,No,0,https://www.vox.com/technology/383859/musk-trump-vance-silicon-valley,/r/technology/comments/1gp665k/trumps_technolibertarian_dream_team_goes_to/
trump,technology,General Politics,17387981,Will the CHIPS Act survive a Trump presidency?,135,90,No,No,0,https://www.computerworld.com/article/3601464/will-the-chips-act-survive-a-trump-presidency.html,/r/technology/comments/1gpkyjv/will_the_chips_act_survive_a_trump_presidency/
recount,democrats,Ideological Politics,480498,Harris fundraising page says a portion of donations will be directed to recount effort,106,19,No,No,0,https://www.usatoday.com/story/news/politics/elections/2024/11/11/kamala-harris-fundraiser-donations-election-recount/76195287007/,/r/democrats/comments/1gplefe/harris_fundraising_page_says_a_portion_of/
senate,democrats,Ideological Politics,480498,Democrat Ruben Gallego beats far-right Republican Kari Lake to win Arizona senate seat ,141,5,No,No,0,https://www.theguardian.com/us-news/2024/nov/12/us-election-arizona-senate-race-ruben-gallego-kari-lake,/r/democrats/comments/1gpjd4c/democrat_ruben_gallego_beats_farright_republican/
house,democrats,Ideological Politics,480498,Republicans win control of the US House of Representatives,421,232,No,No,0,https://www.wfla.com/election/republicans-win-control-of-the-us-house-of-representatives/,/r/democrats/comments/1gp8r34/republicans_win_control_of_the_us_house_of/
trump,democrats,Ideological Politics,480498,Trump is stacking his White House with immigration hawks,334,110,No,No,0,https://www.politico.com/news/2024/11/11/donald-trump-immigration-white-house-00188845,/r/democrats/comments/1gp8ba7/trump_is_stacking_his_white_house_with/
trump,democrats,Ideological Politics,480498,"Holy shit: Trump voter says, 'I consider him like Hitler, but I voted for the man.'",1041,355,No,No,0,https://i.redd.it/1s6mp3jp6b0e1.jpeg,/r/democrats/comments/1goy1rb/holy_shit_trump_voter_says_i_consider_him_like/
trump,Republican,Ideological Politics,205141,"You’re welcome, America. From a group of highly educated women drs, engineers, teachers, entrepreneurs, and moms in PA, who are ethnically and racially diverse but get called nazis and uneducated. MAGA bitches! Hot moms for trump baby!",1057,186,No,No,0,https://www.reddit.com/gallery/1gp6q91,/r/Republican/comments/1gp6q91/youre_welcome_america_from_a_group_of_highly/
trump,Republican,Ideological Politics,205141,These people are delusional my comment will probably get deleted and I'll be banned but whatever,174,52,No,No,0,https://www.reddit.com/gallery/1gpdoog,/r/Republican/comments/1gpdoog/these_people_are_delusional_my_comment_will/
trump,Republican,Ideological Politics,205141,"Trump Appoints Rep. Elise Stefanik as UN Ambassador, Signaling Strong U.S. Stance on Global Issues",25,3,No,No,0,https://m10news.com/trump-appoints-rep-elise-stefanik-as-un-ambassador-signaling-strong-u-s-stance-on-global-issues/,/r/Republican/comments/1gpjdyh/trump_appoints_rep_elise_stefanik_as_un/
trump,Republican,Ideological Politics,205141,Trump set to select Sen. Marco Rubio to serve as secretary of state in historic appointment: report,98,20,No,No,0,https://nypost.com/2024/11/11/us-news/trump-selects-sen-marco-rubio-to-serve-as-secretary-of-state-in-historic-appointment-report/,/r/Republican/comments/1gpa3g5/trump_set_to_select_sen_marco_rubio_to_serve_as/
trump,Republican,Ideological Politics,205141,Scientific American Magazine Editor Called to Resign After Profane Anti-Trump Rant | Another One Loses Their Mind 😁,142,14,No,No,0,https://www.breitbart.com/politics/2024/11/11/scientific-american-magazine-editor-called-to-resign-after-profane-anti-trump-rant/,/r/Republican/comments/1gp5v6l/scientific_american_magazine_editor_called_to/
trump,Republican,Ideological Politics,205141,"Our democracy is still in danger: Head of Rasmussen Reports says that ""Trump needs to go on an Election Integrity Jihad"" There's evidence they did try to steal 2024",76,5,No,No,0,https://x.com/RealAlexJones/status/1856063710210503071,/r/Republican/comments/1gpa2ov/our_democracy_is_still_in_danger_head_of/
house,Republican,Ideological Politics,205141,According to PJ Media Republicans Keep the House,74,11,No,No,0,https://pjmedia.com/paula-bolyard/2024/11/11/breaking-republicans-will-keep-control-of-the-house-n4933998,/r/Republican/comments/1gp9934/according_to_pj_media_republicans_keep_the_house/
trump,Republican,Ideological Politics,205141,FEMA Fires Official Who Ordered Workers to Skip Hurricane-Ravaged Homes With Trump Signs 👍,374,33,No,No,0,https://townhall.com/tipsheet/mattvespa/2024/11/11/fema-fires-official-who-ordered-workers-to-skip-hurricane-ravaged-homes-with-trump-signs-n2647555,/r/Republican/comments/1gow1nw/fema_fires_official_who_ordered_workers_to_skip/
recount,Republican,Ideological Politics,205141,"Harris' failed campaign rakes in cash for 'recount account' — Smells a bit like a scam, you decide 🤔",186,32,No,No,0,https://nypost.com/2024/11/11/us-news/harris-failed-campaign-rakes-in-cash-for-recount-account-apparently-to-pay-off-other-elex-expenses/,/r/Republican/comments/1gp13sz/harris_failed_campaign_rakes_in_cash_for_recount/
harris,Conservative,Ideological Politics,1145235,Donald Trump Was Such a Threat to Democracy That Oprah Charged $1 Million to Endorse Kamala Harris,809,99,No,No,0,https://redstate.com/joesquire/2024/11/11/donald-trump-was-such-a-threat-to-democracy-that-oprah-charged-1-million-to-endorse-kamala-harris-n2181859,/r/Conservative/comments/1gpjzb7/donald_trump_was_such_a_threat_to_democracy_that/
trump,Conservative,Ideological Politics,1145235,"No Trump bump: MSNBC hemorrhaging viewers since Election Day, sheds more than half of primetime audience",287,29,No,No,0,https://www.foxnews.com/media/msnbc-hemorrhaging-viewers-since-election-day-sheds-more-than-half-of-primetime-audience,/r/Conservative/comments/1gpk927/no_trump_bump_msnbc_hemorrhaging_viewers_since/
biden,Conservative,Ideological Politics,1145235,"Melania Trump declines to meet with Jill Biden at White House, citing Mar-a-Lago raid: source",1455,164,No,No,0,https://nypost.com/2024/11/11/us-news/melania-trump-declines-to-meet-with-jill-biden-at-white-house-citing-mar-a-lago-raid-source/,/r/Conservative/comments/1gpay3p/melania_trump_declines_to_meet_with_jill_biden_at/
trump,Conservative,Ideological Politics,1145235,"Border Patrol, ICE morale surging after Trump election win: 'They know they can get the bad guys now'",247,5,No,No,0,https://www.foxnews.com/us/border-patrol-ice-morale-surging-trump-election-win-they-know-they-can-get-the-bad-guys-now,/r/Conservative/comments/1gpj4kr/border_patrol_ice_morale_surging_after_trump/
biden,Conservative,Ideological Politics,1145235,"Melania Stiff-Arms Jill Biden, Will Reportedly Skip Traditional Tea Between First Ladies Despite Invite",177,19,No,No,0,https://redstate.com/rusty-weiss/2024/11/11/melania-stiff-arms-jill-biden-will-reportedly-skip-traditional-tea-between-first-ladies-despite-invite-n2181857,/r/Conservative/comments/1gpjzsf/melania_stiffarms_jill_biden_will_reportedly_skip/
trump,Conservative,Ideological Politics,1145235,Trump won by uniting those who think liberal rulers have gone too far,431,8,No,No,0,https://nypost.com/2024/11/11/opinion/trump-won-by-uniting-those-who-think-liberal-rulers-have-gone-too-far/,/r/Conservative/comments/1gpfubt/trump_won_by_uniting_those_who_think_liberal/
house,Conservative,Ideological Politics,1145235,GOP HOLDS THE HOUSE ,1248,67,No,No,0,https://i.redd.it/gwqrgz58od0e1.jpeg,/r/Conservative/comments/1gp9svx/gop_holds_the_house/
trump,Conservative,Ideological Politics,1145235,RFK Jr. suggests 600 people from NIH will be fired on day 1 of Trump’s second term,785,52,No,No,0,https://nypost.com/2024/11/11/us-news/rfk-jr-suggests-600-people-from-the-national-institutes-of-health-will-be-fired-on-day-1-of-trumps-second-term/,/r/Conservative/comments/1gpcdk7/rfk_jr_suggests_600_people_from_nih_will_be_fired/
house,Conservative,Ideological Politics,1145235,Republicans win majority of US House seats in government sweep,1446,190,No,No,0,https://www.reuters.com/world/us/republicans-win-majority-us-house-seats-government-sweep-2024-11-12/,/r/Conservative/comments/1gp8hus/republicans_win_majority_of_us_house_seats_in/
trump,Conservative,Ideological Politics,1145235,Trump selects Sen. Marco Rubio to serve as secretary of state in historic appointment: report,1051,370,No,No,0,https://nypost.com/2024/11/11/us-news/trump-selects-sen-marco-rubio-to-serve-as-secretary-of-state-in-historic-appointment-report/,/r/Conservative/comments/1gp9kjv/trump_selects_sen_marco_rubio_to_serve_as/
trump,Conservative,Ideological Politics,1145235,"Trump’s back, Jerry ",840,5,No,No,0,https://i.redd.it/a4gm5z03od0e1.jpeg,/r/Conservative/comments/1gp9s8s/trumps_back_jerry/
trump,Libertarian,Ideological Politics,503628,Maybe the best choice for ATF Director,9,0,No,No,0,https://www.reddit.com/r/Libertarian/comments/1gpc1ps/maybe_the_best_choice_for_atf_director/,/r/Libertarian/comments/1gpc1ps/maybe_the_best_choice_for_atf_director/
biden,Libertarian,Ideological Politics,503628,Can someone explain how Tariffs will be good for the economy?,121,85,No,No,0,https://www.reddit.com/r/Libertarian/comments/1gorx9d/can_someone_explain_how_tariffs_will_be_good_for/,/r/Libertarian/comments/1gorx9d/can_someone_explain_how_tariffs_will_be_good_for/
trump,Anarchism,Ideological Politics,271020,What can a 13 year old do,4,4,No,No,0,https://www.reddit.com/r/Anarchism/comments/1gpderb/what_can_a_13_year_old_do/,/r/Anarchism/comments/1gpderb/what_can_a_13_year_old_do/
biden,Anarchism,Ideological Politics,271020,"Im a disabled person, and im begging you to get informed about covid.",386,126,No,No,0,https://www.reddit.com/r/Anarchism/comments/1goj9ja/im_a_disabled_person_and_im_begging_you_to_get/,/r/Anarchism/comments/1goj9ja/im_a_disabled_person_and_im_begging_you_to_get/
vance,Anarchism,Ideological Politics,271020,DIY Digital Community Library--Advice Needed,9,1,No,No,0,https://www.reddit.com/r/Anarchism/comments/1gor9da/diy_digital_community_libraryadvice_needed/,/r/Anarchism/comments/1gor9da/diy_digital_community_libraryadvice_needed/
house,Anarchism,Ideological Politics,271020,Chicago Punk Collectives?,1,0,No,No,0,https://www.reddit.com/r/Anarchism/comments/1gp7tcj/chicago_punk_collectives/,/r/Anarchism/comments/1gp7tcj/chicago_punk_collectives/
vance,Socialism,Ideological Politics,460810,"Benjamin Norton discusses how the CIA has spent decades supporting pro-imperialist factions of the Western left, which it calls the ""compatible left"" or ""non-communist left,"" in order to advance US foreign-policy interests.",156,8,No,No,0,https://v.redd.it/v5xhp1hzkc0e1,/r/socialism/comments/1gp4zz7/benjamin_norton_discusses_how_the_cia_has_spent/
president,Socialism,Ideological Politics,460810,What to do when individuals you're engaging with turn out to express intense racism?,28,19,No,No,0,https://www.reddit.com/r/socialism/comments/1gped6k/what_to_do_when_individuals_youre_engaging_with/,/r/socialism/comments/1gped6k/what_to_do_when_individuals_youre_engaging_with/
results,Socialism,Ideological Politics,460810,UK socialist parties,10,11,No,No,0,https://www.reddit.com/r/socialism/comments/1gphy2m/uk_socialist_parties/,/r/socialism/comments/1gphy2m/uk_socialist_parties/
trump,Socialism,Ideological Politics,460810,Congress About to Gift Trump Sweeping Powers to Crush Political Enemies,54,1,No,No,0,https://theintercept.com/2024/11/10/trump-nonprofit-tax-exempt-political-enemies/,/r/socialism/comments/1gp4ges/congress_about_to_gift_trump_sweeping_powers_to/
loss,Socialism,Ideological Politics,460810,There's a lot of discussion around the loss of the election and whether or not the Democratic party will learn any lessons from this decisive loss. They won't.,109,13,No,No,0,https://www.youtube.com/watch?v=ElvSYVswnIo,/r/socialism/comments/1goyeqc/theres_a_lot_of_discussion_around_the_loss_of_the/
trump,Progressive,Ideological Politics,78039,Behind the Curtain: Trump's business bonanza,13,1,No,No,0,https://www.axios.com/2024/11/07/trump-elon-musk-business-tax-cuts,/r/progressive/comments/1gm4w17/behind_the_curtain_trumps_business_bonanza/
victory,Progressive,Ideological Politics,78039,Far-Right Donald Trump Supporters Celebrate His Victory with Violent Memes and Calls for Executions,247,13,No,No,0,https://www.wired.com/story/donald-trump-far-right-supporters-violent-memes/,/r/progressive/comments/1glfnyf/farright_donald_trump_supporters_celebrate_his/
trump,Progressive,Ideological Politics,78039,What Trump's first 100 days in office could look like,23,4,No,No,0,https://www.npr.org/2024/11/06/nx-s1-5181800/2024-election-trump-first-100-days-agenda,/r/progressive/comments/1glo04a/what_trumps_first_100_days_in_office_could_look/
trump,Progressive,Ideological Politics,78039,Americans in Puerto Rico can't vote for US president. Their anger at Trump is shaping the race.,345,31,No,No,0,https://apnews.com/article/puerto-rico-trump-joke-garbage-a91e2aafd93a06d32365efa013581b85,/r/progressive/comments/1gh2ab4/americans_in_puerto_rico_cant_vote_for_us/
harris,Progressive,Ideological Politics,78039,"Trump loyalists spew racist, vulgar attacks at Harris and Democrats at New York City rally",258,6,No,No,0,https://www.cnn.com/2024/10/27/politics/trump-rally-madison-square-garden-vulgar-attacks/index.html,/r/progressive/comments/1gdskia/trump_loyalists_spew_racist_vulgar_attacks_at/
