Keyword,Subreddit,Category,Members,Title,Upvotes,Comments,Moderator Interaction,Fact-Checking Mention,Total Awards,URL,Original Post URL
ai,Wikileaks,General Politics,177639,Parliamentary Assembly recognises Julian Assange as a ‘political prisoner’ and warns against the chilling effect of his harsh treatment,44,0,No,No,0,https://www.coe.int/en/web/portal/-/pace-recognises-julian-assange-as-a-political-prisoner-and-warns-against-the-chilling-effect-of-his-harsh-treatment,/r/WikiLeaks/comments/1fx0tn0/parliamentary_assembly_recognises_julian_assange/
ai,Wikileaks,General Politics,177639,"Julian Assange speaks out against deep state, ‘wolves in MAGA hats’: Interview",44,5,No,No,0,https://thehill.com/video/julian-assange-speaks-out-against-deep-state-%e2%80%98wolves-in-maga-hats%e2%80%99-interview/10098442/,/r/WikiLeaks/comments/1fvetjh/julian_assange_speaks_out_against_deep_state/
ai,Wikileaks,General Politics,177639,Julian to speak at a parliamentary hearing in Strasbourg on the chilling effect on human rights his treatment has had.,23,0,No,No,0,https://www.reddit.com/r/WikiLeaks/comments/1ftadxc/julian_to_speak_at_a_parliamentary_hearing_in/,/r/WikiLeaks/comments/1ftadxc/julian_to_speak_at_a_parliamentary_hearing_in/
ai,Wikileaks,General Politics,177639,Why does the US still control every penny of Iraqi oil revenues?,40,6,No,No,0,https://www.reddit.com/r/WikiLeaks/comments/1fso9v7/why_does_the_us_still_control_every_penny_of/,/r/WikiLeaks/comments/1fso9v7/why_does_the_us_still_control_every_penny_of/
ai,Wikileaks,General Politics,177639,Censored Wikileaks content?,12,7,No,No,0,https://www.reddit.com/r/WikiLeaks/comments/1frr2wq/censored_wikileaks_content/,/r/WikiLeaks/comments/1frr2wq/censored_wikileaks_content/
ai,News,General Politics,28922913,FAA bans U.S.-Haiti flights for 30 days after Spirit Airlines flight struck by gunfire,2812,130,No,No,0,https://www.cnbc.com/2024/11/12/faa-ban-us-haiti-flights.html,/r/news/comments/1gpwznq/faa_bans_ushaiti_flights_for_30_days_after_spirit/
ai,News,General Politics,28922913,Spirit Airlines Moves Toward Bankruptcy Filing After Frontier Drops Merger Bid,1968,184,No,No,0,https://www.wsj.com/business/airlines/spirit-airlines-moves-toward-bankruptcy-filing-after-frontier-drops-merger-bid-5d492e80,/r/news/comments/1gpysea/spirit_airlines_moves_toward_bankruptcy_filing/
ai,News,General Politics,28922913,Wisconsin man accused of hurling baby against wall because he was losing in NBA video game,20672,1323,No,No,0,https://www.the-independent.com/news/world/americas/crime/wisconsin-jalin-white-arrest-nba2k-b2645350.html,/r/news/comments/1gplbjw/wisconsin_man_accused_of_hurling_baby_against/
ai,News,General Politics,28922913,US says it will not limit Israel arms transfers after some improvements in flow of aid to Gaza,1058,413,No,No,0,https://apnews.com/article/israel-palestinians-hamas-war-aid-us-48cd09c1c007cacd6d7a309589490320,/r/news/comments/1gpxex8/us_says_it_will_not_limit_israel_arms_transfers/
ai,PoliticalDiscussion,General Politics,2184608,A reminder - Please read our rules and participate civilly,47,18,Yes,No,0,https://www.reddit.com/r/PoliticalDiscussion/comments/1gl71w2/a_reminder_please_read_our_rules_and_participate/,/r/PoliticalDiscussion/comments/1gl71w2/a_reminder_please_read_our_rules_and_participate/
ai,PoliticalDiscussion,General Politics,2184608,Casual Questions Thread,43,4782,Yes,No,0,https://www.reddit.com/r/PoliticalDiscussion/comments/1bwbuka/casual_questions_thread/,/r/PoliticalDiscussion/comments/1bwbuka/casual_questions_thread/
ai,PoliticalDiscussion,General Politics,2184608,What do you think Trump will do about the Israel/Palestine conflict?,149,421,No,No,0,https://www.reddit.com/r/PoliticalDiscussion/comments/1gq3qzs/what_do_you_think_trump_will_do_about_the/,/r/PoliticalDiscussion/comments/1gq3qzs/what_do_you_think_trump_will_do_about_the/
ai,PoliticalDiscussion,General Politics,2184608,Why is there such confusion about whether or not Putin has spoken to Trump?,28,26,No,Yes,0,https://www.reddit.com/r/PoliticalDiscussion/comments/1gq4ztm/why_is_there_such_confusion_about_whether_or_not/,/r/PoliticalDiscussion/comments/1gq4ztm/why_is_there_such_confusion_about_whether_or_not/
ai,PoliticalDiscussion,General Politics,2184608,"If Democrats do shift to the populist left in 2028, who will be the leader of the movement with Bernie likely being too old?",418,1386,No,No,0,https://www.reddit.com/r/PoliticalDiscussion/comments/1gpgnc8/if_democrats_do_shift_to_the_populist_left_in/,/r/PoliticalDiscussion/comments/1gpgnc8/if_democrats_do_shift_to_the_populist_left_in/
ai,PoliticalDiscussion,General Politics,2184608,How likely is Trump to convert the US to a totalitarian dictatorship?,364,1422,No,No,0,https://www.reddit.com/r/PoliticalDiscussion/comments/1gp56t4/how_likely_is_trump_to_convert_the_us_to_a/,/r/PoliticalDiscussion/comments/1gp56t4/how_likely_is_trump_to_convert_the_us_to_a/
ai,PoliticalDiscussion,General Politics,2184608,"How likely is it that the ACA will be repealed, as per the GOP's plans?",251,306,No,No,0,https://www.reddit.com/r/PoliticalDiscussion/comments/1gp1l4g/how_likely_is_it_that_the_aca_will_be_repealed_as/,/r/PoliticalDiscussion/comments/1gp1l4g/how_likely_is_it_that_the_aca_will_be_repealed_as/
ai,PoliticalDiscussion,General Politics,2184608,Do you expect Republican Infighting or Republican Unity to be more prominent in Trumps second term?,88,178,No,No,0,https://www.reddit.com/r/PoliticalDiscussion/comments/1goyjaq/do_you_expect_republican_infighting_or_republican/,/r/PoliticalDiscussion/comments/1goyjaq/do_you_expect_republican_infighting_or_republican/
ai,PoliticalDiscussion,General Politics,2184608,"Was Trump's win driven by an anti-incumbency sentiment? or was it a successful campaign strategy? had it been the former, would picking a candidate of the same party but not in the incumbent administration have levelled the playing field?",100,319,No,No,0,https://www.reddit.com/r/PoliticalDiscussion/comments/1goqx1f/was_trumps_win_driven_by_an_antiincumbency/,/r/PoliticalDiscussion/comments/1goqx1f/was_trumps_win_driven_by_an_antiincumbency/
ai,PoliticalDiscussion,General Politics,2184608,How does the world deal with the schizophrenic foreign policy that America has? ,402,351,No,No,0,https://www.reddit.com/r/PoliticalDiscussion/comments/1go363q/how_does_the_world_deal_with_the_schizophrenic/,/r/PoliticalDiscussion/comments/1go363q/how_does_the_world_deal_with_the_schizophrenic/
ai,NeutralPolitics,General Politics,610637,What to expect after the U.S. election,283,26,Yes,Yes,0,https://www.reddit.com/r/NeutralPolitics/comments/1gflxpk/what_to_expect_after_the_us_election/,/r/NeutralPolitics/comments/1gflxpk/what_to_expect_after_the_us_election/
ai,NeutralPolitics,General Politics,610637,Are neocons just hawkish cons?,13,22,No,No,0,https://www.reddit.com/r/NeutralPolitics/comments/1gm80f7/are_neocons_just_hawkish_cons/,/r/NeutralPolitics/comments/1gm80f7/are_neocons_just_hawkish_cons/
ai,NeutralPolitics,General Politics,610637,Is now the time for a NEW moderate third party in U.S. politics?,0,73,No,No,0,https://www.reddit.com/r/NeutralPolitics/comments/1gms9so/is_now_the_time_for_a_new_moderate_third_party_in/,/r/NeutralPolitics/comments/1gms9so/is_now_the_time_for_a_new_moderate_third_party_in/
ai,NeutralPolitics,General Politics,610637,Where is the Western world’s paradigm shift coming from?,112,127,No,Yes,0,https://www.reddit.com/r/NeutralPolitics/comments/1glkk8q/where_is_the_western_worlds_paradigm_shift_coming/,/r/NeutralPolitics/comments/1glkk8q/where_is_the_western_worlds_paradigm_shift_coming/
ai,NeutralPolitics,General Politics,610637,Why Are So Many Men Leaving The Democratic Party Over The Last Few Years?,382,156,No,No,0,https://www.reddit.com/r/NeutralPolitics/comments/1gklb9t/why_are_so_many_men_leaving_the_democratic_party/,/r/NeutralPolitics/comments/1gklb9t/why_are_so_many_men_leaving_the_democratic_party/
elon musk,NeutralPolitics,General Politics,610637,What is the impact of Elon Musk's political engagement on the current U.S. election?,66,40,No,No,0,https://www.reddit.com/r/NeutralPolitics/comments/1gki55b/what_is_the_impact_of_elon_musks_political/,/r/NeutralPolitics/comments/1gki55b/what_is_the_impact_of_elon_musks_political/
ai,NeutralPolitics,General Politics,610637,"What are the pros and cons of predictive election models, like 538, for our discourse around elections?",44,94,No,No,0,https://www.reddit.com/r/NeutralPolitics/comments/1giqib5/what_are_the_pros_and_cons_of_predictive_election/,/r/NeutralPolitics/comments/1giqib5/what_are_the_pros_and_cons_of_predictive_election/
ai,NeutralPolitics,General Politics,610637,Why are there organizations whose only goal is to make sure people vote? ,47,36,No,No,0,https://www.reddit.com/r/NeutralPolitics/comments/1ggtk67/why_are_there_organizations_whose_only_goal_is_to/,/r/NeutralPolitics/comments/1ggtk67/why_are_there_organizations_whose_only_goal_is_to/
ai,NeutralPolitics,General Politics,610637,How do the Trump and Harris plans for workforce pay and taxes compare?,3,6,No,No,0,https://www.reddit.com/r/NeutralPolitics/comments/1ggxh8w/how_do_the_trump_and_harris_plans_for_workforce/,/r/NeutralPolitics/comments/1ggxh8w/how_do_the_trump_and_harris_plans_for_workforce/
ai,NeutralPolitics,General Politics,610637,Has there been any investigative journalism or public legal discovery to examine process irregularities regarding the 2020 election?,11,15,No,No,0,https://www.reddit.com/r/NeutralPolitics/comments/1ggkpzr/has_there_been_any_investigative_journalism_or/,/r/NeutralPolitics/comments/1ggkpzr/has_there_been_any_investigative_journalism_or/
ai,NeutralPolitics,General Politics,610637,"Why does Israel, a nation with a modern first world economy, need ""aid"" from the US as a part of its conflict?",267,77,No,No,0,https://www.reddit.com/r/NeutralPolitics/comments/1gewboa/why_does_israel_a_nation_with_a_modern_first/,/r/NeutralPolitics/comments/1gewboa/why_does_israel_a_nation_with_a_modern_first/
ai,NeutralPolitics,General Politics,610637,"War involving Israel, Lebanon, and Iran--Motivations? Scale of Conflict?",17,6,No,No,0,https://www.reddit.com/r/NeutralPolitics/comments/1ge5sct/war_involving_israel_lebanon_and_iranmotivations/,/r/NeutralPolitics/comments/1ge5sct/war_involving_israel_lebanon_and_iranmotivations/
elon musk,moderatepolitics,General Politics,296326,Elon Musk and Vivek Ramaswamy will lead new ‘Department of Government Efficiency’ in Trump administration,410,589,No,No,0,https://www.cnn.com/2024/11/12/politics/elon-musk-vivek-ramaswamy-department-of-government-efficiency-trump/index.html,/r/moderatepolitics/comments/1gq0ozd/elon_musk_and_vivek_ramaswamy_will_lead_new/
ai,moderatepolitics,General Politics,296326,Conservatives plot challenge against Johnson in internal Speaker elections,85,62,No,No,0,https://thehill.com/homenews/house/4986503-gop-conservatives-challenge-speaker-johnson/,/r/moderatepolitics/comments/1gpujp6/conservatives_plot_challenge_against_johnson_in/
ai,technology,General Politics,17392085,Hi! We're the hosts of WIRED's new tech culture podcast Uncanny Valley. AM(us)A!,42,49,Yes,No,0,https://www.reddit.com/r/technology/comments/1gftoz0/hi_were_the_hosts_of_wireds_new_tech_culture/,/r/technology/comments/1gftoz0/hi_were_the_hosts_of_wireds_new_tech_culture/
ai,technology,General Politics,17392085,I Hacked NASA and they thanked me for it - Ask Me Anything! ,0,181,Yes,No,0,https://www.reddit.com/r/technology/comments/1gmcrja/i_hacked_nasa_and_they_thanked_me_for_it_ask_me/,/r/technology/comments/1gmcrja/i_hacked_nasa_and_they_thanked_me_for_it_ask_me/
ai,technology,General Politics,17392085,"Salesforce is hiring 1,000 salespeople to sell AI tools that replace salespeople",2656,150,No,No,0,https://www.verdict.co.uk/salesforce-to-hire-1000-people/,/r/technology/comments/1gpwdgb/salesforce_is_hiring_1000_salespeople_to_sell_ai/
ai,democrats,Ideological Politics,480523,What can I do?,276,60,No,No,0,https://i.redd.it/tnx3dwdvxl0e1.png,/r/democrats/comments/1gq649u/what_can_i_do/
ai,democrats,Ideological Politics,480523,Democratic warnings about Trump were not simply campaign rhetoric,139,13,No,No,0,https://archive.ph/J8IMV#selection-534.0-534.1,/r/democrats/comments/1gq4nrh/democratic_warnings_about_trump_were_not_simply/
ai,democrats,Ideological Politics,480523,"To avoid being in an ""echo chamber"" I took the plunge and listened to Elon. He literally said that Democrats are flying in immigrants to swing states to primarily vote Democrat. The AP has said that this is untrue. Am I missing something? Is there any Truth to this claim? ",82,79,No,Yes,0,https://i.redd.it/mwjjems93m0e1.jpeg,/r/democrats/comments/1gq6ky0/to_avoid_being_in_an_echo_chamber_i_took_the/
ai,Republican,Ideological Politics,205245,Politics sub is disgusting ,42,33,No,No,0,https://www.reddit.com/gallery/1gq8t9b,/r/Republican/comments/1gq8t9b/politics_sub_is_disgusting/
ai,Republican,Ideological Politics,205245,Exclusive — Speaker Johnson Orders Entire Biden Administration to Preserve and Retain All Records and Documents,115,11,No,No,0,https://www.breitbart.com/politics/2024/11/12/exclusive-speaker-johnson-orders-entire-biden-administration-preserve-retain-all-records-documents/,/r/Republican/comments/1gpw84f/exclusive_speaker_johnson_orders_entire_biden/
elon musk,Republican,Ideological Politics,205245,Donald Trump Taps Elon Musk to Lead New Department Focused on Government Efficiency,21,8,No,No,0,https://m10news.com/donald-trump-taps-elon-musk-to-lead-new-department-focused-on-government-efficiency/,/r/Republican/comments/1gq6wv5/donald_trump_taps_elon_musk_to_lead_new/
elon musk,Conservative,Ideological Politics,1145902,Trump announces Elon Musk and Vivek Ramaswamy will head the Department of Government Efficiency,3314,1995,No,No,0,https://i.redd.it/8ksi7yy6ek0e1.jpeg,/r/Conservative/comments/1gq097j/trump_announces_elon_musk_and_vivek_ramaswamy/
elon musk,Conservative,Ideological Politics,1145902,"Trump announces Elon Musk, Vivek Ramaswamy to lead new 'Department of Government Efficiency'",822,79,No,No,0,https://nypost.com/2024/11/12/us-news/trump-announces-elon-musk-vivek-ramaswamy-to-lead-new-department-of-government-efficiency/,/r/Conservative/comments/1gq0knz/trump_announces_elon_musk_vivek_ramaswamy_to_lead/
ai,Conservative,Ideological Politics,1145902,FEMA worker accused of telling staff to skip hurricane-ravaged Trump homes claims it was common practice: ‘This is not isolated,1256,113,No,No,0,https://nypost.com/2024/11/12/us-news/fema-worker-accused-of-telling-staff-to-skip-hurricane-ravaged-trump-homes-claims-it-was-common-practice-this-is-not-isolated/,/r/Conservative/comments/1gprj3k/fema_worker_accused_of_telling_staff_to_skip/
ai,Libertarian,Ideological Politics,503640,Americans Just Said No to Drugs - Why legalization lost at the ballot box,11,6,No,No,0,https://www.thefp.com/p/no-to-drugs-marijuana-mushrooms,/r/Libertarian/comments/1gq33jm/americans_just_said_no_to_drugs_why_legalization/
ai,Anarchism,Ideological Politics,271059,Radical Women Wednesday,3,0,Yes,No,0,https://www.reddit.com/r/Anarchism/comments/1gq6ak2/radical_women_wednesday/,/r/Anarchism/comments/1gq6ak2/radical_women_wednesday/
ai,Anarchism,Ideological Politics,271059,STAYING ALIVE IS PUNK AS FUCK,527,37,No,No,0,https://www.reddit.com/r/Anarchism/comments/1gphrhm/staying_alive_is_punk_as_fuck/,/r/Anarchism/comments/1gphrhm/staying_alive_is_punk_as_fuck/
ai,Anarchism,Ideological Politics,271059,Book recs,124,35,No,Yes,0,https://i.redd.it/19i11ebaeh0e1.jpeg,/r/Anarchism/comments/1gpm0ra/book_recs/
ai,Anarchism,Ideological Politics,271059,"I'm finally getting the chance to start organizing, anyone got advice for a newbie?",37,11,No,No,0,https://www.reddit.com/r/Anarchism/comments/1gppyeh/im_finally_getting_the_chance_to_start_organizing/,/r/Anarchism/comments/1gppyeh/im_finally_getting_the_chance_to_start_organizing/
ai,Anarchism,Ideological Politics,271059,"A few months ago, the conservative party came to power in Valencia, Spain with the support of the far right. One of their first acts was to eliminate climate emergency services. At the end of October, flooding exacerbated by climate change killed over 200 people in the region.",185,4,No,No,0,/r/CrimethInc/comments/1gpe123/a_few_months_ago_the_conservative_party_came_to/,/r/Anarchism/comments/1gpe16v/a_few_months_ago_the_conservative_party_came_to/
ai,Anarchism,Ideological Politics,271059,Hopes up and alone,7,12,No,No,0,https://www.reddit.com/r/Anarchism/comments/1gpveyk/hopes_up_and_alone/,/r/Anarchism/comments/1gpveyk/hopes_up_and_alone/
ai,Anarchism,Ideological Politics,271059,Open Call for Radical Creatives: Submissions for a New Online Zine,1,0,No,No,0,https://www.reddit.com/r/Anarchism/comments/1gq1jet/open_call_for_radical_creatives_submissions_for_a/,/r/Anarchism/comments/1gq1jet/open_call_for_radical_creatives_submissions_for_a/
ai,Socialism,Ideological Politics,460884,Personally want to thank this community,16,2,No,No,0,https://www.reddit.com/r/socialism/comments/1gq8bnx/personally_want_to_thank_this_community/,/r/socialism/comments/1gq8bnx/personally_want_to_thank_this_community/
ai,Socialism,Ideological Politics,460884,What are some examples of capitalist countries failing?,159,76,No,No,0,https://www.reddit.com/r/socialism/comments/1gppxwl/what_are_some_examples_of_capitalist_countries/,/r/socialism/comments/1gppxwl/what_are_some_examples_of_capitalist_countries/
ai,Socialism,Ideological Politics,460884,"Join us for a Know Your Rights Teach In! Many cases from the Auraria Encampment for Palestine are being dropped but many still face persistent political repression. To learn more about your rights, the legal system, and the support available at our teach in with the Protest Defense Committee. ",41,2,No,No,0,https://i.redd.it/vfo9hpussj0e1.jpeg,/r/socialism/comments/1gpxmr4/join_us_for_a_know_your_rights_teach_in_many/
ai,Socialism,Ideological Politics,460884,Don’t Despair: Trump Isn’t Invincible,141,19,No,No,0,https://jacobin.com/2024/11/trump-election-lessons-democrats-labor,/r/socialism/comments/1gpmrzt/dont_despair_trump_isnt_invincible/
ai,Socialism,Ideological Politics,460884,The far right populist surge,77,16,No,No,0,https://www.reddit.com/r/socialism/comments/1gpqu4y/the_far_right_populist_surge/,/r/socialism/comments/1gpqu4y/the_far_right_populist_surge/
ai,Socialism,Ideological Politics,460884,Protests and Mass Anger in Spain after catastrophic floods,2,1,No,No,0,https://www.socialistworld.net/2024/11/07/worst-flooding-kills-more-than-200-people-in-spain/,/r/socialism/comments/1gqal5z/protests_and_mass_anger_in_spain_after/
ai,Progressive,Ideological Politics,78045,Behind the Curtain: Trump's business bonanza,13,1,No,No,0,https://www.axios.com/2024/11/07/trump-elon-musk-business-tax-cuts,/r/progressive/comments/1gm4w17/behind_the_curtain_trumps_business_bonanza/
ai,Progressive,Ideological Politics,78045,Billionaires vs Democracy - The rich are trying to buy elections all over the world and consign democracy to the trash bin of history.,292,12,No,No,0,https://inequality.org/research/billionaires-vs-democracy/,/r/progressive/comments/1ggh1hg/billionaires_vs_democracy_the_rich_are_trying_to/
ai,Progressive,Ideological Politics,78045,A Texas Woman Died After Waiting 40 Hours for Miscarriage Care,300,5,No,No,0,https://www.propublica.org/article/josseli-barnica-death-miscarriage-texas-abortion-ban,/r/progressive/comments/1gfmamd/a_texas_woman_died_after_waiting_40_hours_for/
ai,Progressive,Ideological Politics,78045,These teachers often live in poverty. A pay raise could help — but there’s a cost,76,3,No,No,0,https://www.npr.org/2024/10/22/nx-s1-5144162/biden-preschool-head-start-teacher-poverty,/r/progressive/comments/1ga8u8y/these_teachers_often_live_in_poverty_a_pay_raise/
ai,Republicanism,Ideological Politics,917,Why are monarchists cherry-pickers?,7,0,No,No,0,https://www.reddit.com/r/republicanism/comments/1c22ytx/why_are_monarchists_cherrypickers/,/r/republicanism/comments/1c22ytx/why_are_monarchists_cherrypickers/
ai,Republicanism,Ideological Politics,917,Pro-British monarchy Indian Christian saying mocking the name-reverting done by our governments (especially the renaming of Bombay to Mumbai) and openly doing sedition by saying that Charles III should be the Emperor of India and 'God Save the King' should be the Indian anthem.,3,0,No,No,0,https://www.reddit.com/gallery/1b2xwq8,/r/republicanism/comments/1b2xwq8/probritish_monarchy_indian_christian_saying/
ai,Republicanism,Ideological Politics,917,“Away with college gen ed”,0,4,No,Yes,0,https://www.reddit.com/r/republicanism/comments/19asm4l/away_with_college_gen_ed/,/r/republicanism/comments/19asm4l/away_with_college_gen_ed/
ai,Republicanism,Ideological Politics,917,Question from a Monarchist,8,20,No,No,0,https://www.reddit.com/r/republicanism/comments/z0zqv0/question_from_a_monarchist/,/r/republicanism/comments/z0zqv0/question_from_a_monarchist/
ai,Conservatives,Ideological Politics,108234,FEMA worker accused of telling staff to skip hurricane-ravaged Trump homes claims it was common practice: 'This is not isolated',212,22,No,No,0,https://nypost.com/2024/11/12/us-news/fema-worker-accused-of-telling-staff-to-skip-hurricane-ravaged-trump-homes-claims-it-was-common-practice-this-is-not-isolated/,/r/conservatives/comments/1gpvybf/fema_worker_accused_of_telling_staff_to_skip/
elon musk,Conservatives,Ideological Politics,108234,"Trump announces Elon Musk, Vivek Ramaswamy to lead new 'Department of Government Efficiency'",109,11,No,No,0,https://nypost.com/2024/11/12/us-news/trump-announces-elon-musk-vivek-ramaswamy-to-lead-new-department-of-government-efficiency/,/r/conservatives/comments/1gq0kjj/trump_announces_elon_musk_vivek_ramaswamy_to_lead/
ai,Conservatives,Ideological Politics,108234,TDS-Riddled Pelosi Absurdly Claims 'Fewer' Illegal Aliens Entered the US Under Biden Than Trump,75,9,No,No,0,https://redstate.com/mike_miller/2024/11/11/tds-riddled-pelosi-absurdly-claims-fewer-illegal-aliens-entered-the-us-under-biden-than-trump-n2181831,/r/conservatives/comments/1gpu8rj/tdsriddled_pelosi_absurdly_claims_fewer_illegal/
ai,dailywire,Ideological Politics,24196,Wall of Hate - Help Document Hatred Against Trump on July13th.com,79,16,Yes,No,0,https://july13th.com/hate/,/r/dailywire/comments/1e3cqx8/wall_of_hate_help_document_hatred_against_trump/
ai,dailywire,Ideological Politics,24196,Another claim in which Trump was right ,149,3,No,No,0,https://v.redd.it/26hradrdcd0e1,/r/dailywire/comments/1gp8glb/another_claim_in_which_trump_was_right/
ai,dailywire,Ideological Politics,24196,19 year old here. So I'm Gen Z. I am a female!,74,6,No,No,0,https://www.youtube.com/watch?v=ybgV3jSNKEE,/r/dailywire/comments/1gokaic/19_year_old_here_so_im_gen_z_i_am_a_female/
ai,Liberal,Ideological Politics,119808,Arizona AG says she won't drop state's fake electors case against Trump allies,539,22,No,No,0,https://www.upi.com/Top_News/US/2024/11/10/Arizona-fake-electors-case/4001731292312/,/r/Liberal/comments/1gosjeh/arizona_ag_says_she_wont_drop_states_fake/
ai,Liberal,Ideological Politics,119808,What I think needs changing,40,145,No,No,0,https://www.reddit.com/r/Liberal/comments/1goxogz/what_i_think_needs_changing/,/r/Liberal/comments/1goxogz/what_i_think_needs_changing/
ai,Liberal,Ideological Politics,119808,Glad to see we have visitors.,122,82,No,Yes,0,https://www.reddit.com/r/Liberal/comments/1gon2jn/glad_to_see_we_have_visitors/,/r/Liberal/comments/1gon2jn/glad_to_see_we_have_visitors/
ai,Liberal,Ideological Politics,119808,Why were the polls so wrong?,160,176,No,No,0,https://www.reddit.com/r/Liberal/comments/1go7sv1/why_were_the_polls_so_wrong/,/r/Liberal/comments/1go7sv1/why_were_the_polls_so_wrong/
ai,Liberal,Ideological Politics,119808,I keep hearing theories about how 15m people staying home didn't actually stay home and I'm not buying it.,331,365,No,No,0,https://www.reddit.com/r/Liberal/comments/1gnrlns/i_keep_hearing_theories_about_how_15m_people/,/r/Liberal/comments/1gnrlns/i_keep_hearing_theories_about_how_15m_people/
ai,KamalaHarris,Ideological Politics,75733,Why the Democratic Party must demand a recount w/Dean Obaidallah,125,2,No,No,0,https://youtu.be/FqfEmXjNPnw?si=Kob7g-2fVWXlGvIj,/r/KamalaHarris/comments/1gq61ac/why_the_democratic_party_must_demand_a_recount/
ai,KamalaHarris,Ideological Politics,75733,"NEVADA VOTERS: Over 10,000 mail-in ballots in Nevada are at risk of being rejected. But if voters cure their ballots by 5 pm PT today, their votes will be counted. Check your status here.  Please share!",1265,77,No,No,0,https://www.nvsos.gov/sos/elections/voters/cure,/r/KamalaHarris/comments/1gpnmvb/nevada_voters_over_10000_mailin_ballots_in_nevada/
ai,KamalaHarris,Ideological Politics,75733,Harris fundraising page says a portion of donations will be directed to recount effort,1044,109,No,No,0,https://www.usatoday.com/story/news/politics/elections/2024/11/11/kamala-harris-fundraiser-donations-election-recount/76195287007/,/r/KamalaHarris/comments/1gplf80/harris_fundraising_page_says_a_portion_of/
ai,KamalaHarris,Ideological Politics,75733,"Anti-abortion groups unveil “Make America Pro-Life Again Roadmap,” an effort to block federal and state access, including in nearly a dozen states that enshrined protections through ballot measures over the last two years",325,18,No,No,0,https://www.politico.com/news/2024/11/12/groups-undermine-abortion-ballot-measures-strategy-00188874,/r/KamalaHarris/comments/1gppyyh/antiabortion_groups_unveil_make_america_prolife/
ai,KamalaHarris,Ideological Politics,75733,How to BLOCK PROJECT 2025 (and other things you can do! ) | Zaid Talks,192,56,No,No,0,https://youtu.be/g9UKnU3dRDM?si=v67B-A3CIwywuPwj,/r/KamalaHarris/comments/1gppiee/how_to_block_project_2025_and_other_things_you/
