Keyword,Subreddit,Category,Members,Title,Upvotes,Comments,Moderator Interaction,Fact-Checking Mention,Total Awards,URL,Original Post URL
ai,KamalaHarris,Ideological Politics,75606,"NEVADA VOTERS: Over 10,000 mail-in ballots in Nevada are at risk of being rejected. But if voters cure their ballots by 5 pm PT today, their votes will be counted. Check your status here.  Please share!",1452,99,No,No,0,https://www.nvsos.gov/sos/elections/voters/cure,/r/KamalaHarris/comments/1gpnmvb/nevada_voters_over_10000_mailin_ballots_in_nevada/
ai,KamalaHarris,Ideological Politics,75606,Harris fundraising page says a portion of donations will be directed to recount effort,1235,130,No,No,0,https://www.usatoday.com/story/news/politics/elections/2024/11/11/kamala-harris-fundraiser-donations-election-recount/76195287007/,/r/KamalaHarris/comments/1gplf80/harris_fundraising_page_says_a_portion_of/
ai,KamalaHarris,Ideological Politics,75606,"Anti-abortion groups unveil “Make America Pro-Life Again Roadmap,” an effort to block federal and state access, including in nearly a dozen states that enshrined protections through ballot measures over the last two years",380,22,No,No,0,https://www.politico.com/news/2024/11/12/groups-undermine-abortion-ballot-measures-strategy-00188874,/r/KamalaHarris/comments/1gppyyh/antiabortion_groups_unveil_make_america_prolife/
ai,KamalaHarris,Ideological Politics,75606,How to BLOCK PROJECT 2025 (and other things you can do! ) | Zaid Talks,217,58,No,No,0,https://youtu.be/g9UKnU3dRDM?si=v67B-A3CIwywuPwj,/r/KamalaHarris/comments/1gppiee/how_to_block_project_2025_and_other_things_you/
ai,Impeach_Trump,Ideological Politics,60542,Trump's crowds are dwindling as his campaign winds down — Empty seats and early exits have grown more common,423,18,No,No,0,https://www.nytimes.com/2024/11/04/us/politics/trump-rally-crowds.html,/r/Impeach_Trump/comments/1gjn8sb/trumps_crowds_are_dwindling_as_his_campaign_winds/
ai,Impeach_Trump,Ideological Politics,60542,Let's make him lose again,138,1,No,No,0,https://imghoster.co/5ysKrAQZLXV2ObZ,/r/Impeach_Trump/comments/1gj9krk/lets_make_him_lose_again/
elon musk,Impeach_Trump,Ideological Politics,60542,"Elon Musk predicts ‘hardship,’ economic turmoil and a stock-market crash if Trump wins",62,4,No,No,0,https://www.marketwatch.com/story/kaboom-elon-musk-predicts-hardship-economic-turmoil-and-a-stock-market-crash-if-trump-wins-20483008,/r/Impeach_Trump/comments/1gfwy5u/elon_musk_predicts_hardship_economic_turmoil_and/
