Keyword,Subreddit,Category,Members,Title,Upvotes,Comments,Moderator Interaction,Fact-Checking Mention,Total Awards,URL,Original Post URL
ai,Wikileaks,General Politics,177647,Parliamentary Assembly recognises Julian Assange as a ‘political prisoner’ and warns against the chilling effect of his harsh treatment,44,0,No,No,0,https://www.coe.int/en/web/portal/-/pace-recognises-julian-assange-as-a-political-prisoner-and-warns-against-the-chilling-effect-of-his-harsh-treatment,/r/WikiLeaks/comments/1fx0tn0/parliamentary_assembly_recognises_julian_assange/
ai,Wikileaks,General Politics,177647,"Julian Assange speaks out against deep state, ‘wolves in MAGA hats’: Interview",44,5,No,No,0,https://thehill.com/video/julian-assange-speaks-out-against-deep-state-%e2%80%98wolves-in-maga-hats%e2%80%99-interview/10098442/,/r/WikiLeaks/comments/1fvetjh/julian_assange_speaks_out_against_deep_state/
ai,Wikileaks,General Politics,177647,Julian to speak at a parliamentary hearing in Strasbourg on the chilling effect on human rights his treatment has had.,24,0,No,No,0,https://www.reddit.com/r/WikiLeaks/comments/1ftadxc/julian_to_speak_at_a_parliamentary_hearing_in/,/r/WikiLeaks/comments/1ftadxc/julian_to_speak_at_a_parliamentary_hearing_in/
ai,Wikileaks,General Politics,177647,Why does the US still control every penny of Iraqi oil revenues?,40,6,No,No,0,https://www.reddit.com/r/WikiLeaks/comments/1fso9v7/why_does_the_us_still_control_every_penny_of/,/r/WikiLeaks/comments/1fso9v7/why_does_the_us_still_control_every_penny_of/
ai,Wikileaks,General Politics,177647,Censored Wikileaks content?,15,7,No,No,0,https://www.reddit.com/r/WikiLeaks/comments/1frr2wq/censored_wikileaks_content/,/r/WikiLeaks/comments/1frr2wq/censored_wikileaks_content/
elon musk,News,General Politics,28928096,"Bluesky gains more than 1.25 million followers since U.S. election. The social media platform, a competitor to Elon Musk's X, says it has surpassed 15 million users.",8953,368,No,No,0,https://www.cbc.ca/news/bluesky-election-gains-1.7382384,/r/news/comments/1gqtxbw/bluesky_gains_more_than_125_million_followers/
ai,News,General Politics,28928096,Loyal dog helped solve owner's grisly murder as cousin is jailed for life,2201,73,No,No,0,https://www.nbcnews.com/news/us-news/loyal-dog-helped-solve-owners-grisly-murder-cousin-jailed-life-rcna179735?os=httpwww.google.com&ref=app,/r/news/comments/1gqpgrj/loyal_dog_helped_solve_owners_grisly_murder_as/
ai,News,General Politics,28928096,An Idaho baby’s unexplained death got no autopsy and a scant coroner’s investigation. State law says that’s fine.,4020,184,No,No,0,https://www.cnn.com/2024/11/13/health/idaho-baby-unexplained-death-propublica/index.html,/r/news/comments/1gqjzkf/an_idaho_babys_unexplained_death_got_no_autopsy/
ai,News,General Politics,28928096,US government employee charged with leaking apparent Israeli plans to retaliate against Iran,1700,81,No,No,0,https://abcnews.go.com/Politics/us-government-employee-charged-leaking-israeli-plans-retaliate/story?id=115810060,/r/news/comments/1gqp5nc/us_government_employee_charged_with_leaking/
ai,News,General Politics,28928096,"A former Australian Federal Police officer has avoided prison despite being found with a quantity of drugs 50 times higher than the threshold for trafficking, in a case a magistrate said was “shrouded in mystery”.",1044,30,No,No,0,https://www.theage.com.au/national/victoria/shrouded-in-mystery-afp-officer-caught-with-200-grams-of-meth-avoids-jail-20241111-p5kpn2.html,/r/news/comments/1gqjtze/a_former_australian_federal_police_officer_has/
ai,News,General Politics,28928096,Delhi pollution: 'Apocalyptic' air engulfs Indian capital as subcontinent chokes on toxic smog,1570,177,No,No,0,https://bbc.com/news/articles/c0k8dxpr8x5o,/r/news/comments/1gqg13q/delhi_pollution_apocalyptic_air_engulfs_indian/
ai,PoliticalDiscussion,General Politics,2184658,A reminder - Please read our rules and participate civilly,47,18,Yes,No,0,https://www.reddit.com/r/PoliticalDiscussion/comments/1gl71w2/a_reminder_please_read_our_rules_and_participate/,/r/PoliticalDiscussion/comments/1gl71w2/a_reminder_please_read_our_rules_and_participate/
ai,PoliticalDiscussion,General Politics,2184658,Casual Questions Thread,42,4815,Yes,No,0,https://www.reddit.com/r/PoliticalDiscussion/comments/1bwbuka/casual_questions_thread/,/r/PoliticalDiscussion/comments/1bwbuka/casual_questions_thread/
ai,PoliticalDiscussion,General Politics,2184658,Why did Trump choose Matt Gaetz for Attorney General? ,602,682,No,No,0,https://www.reddit.com/r/PoliticalDiscussion/comments/1gqo32j/why_did_trump_choose_matt_gaetz_for_attorney/,/r/PoliticalDiscussion/comments/1gqo32j/why_did_trump_choose_matt_gaetz_for_attorney/
ai,PoliticalDiscussion,General Politics,2184658,What do you think Trump will do about the Israel/Palestine conflict?,229,787,No,No,0,https://www.reddit.com/r/PoliticalDiscussion/comments/1gq3qzs/what_do_you_think_trump_will_do_about_the/,/r/PoliticalDiscussion/comments/1gq3qzs/what_do_you_think_trump_will_do_about_the/
ai,PoliticalDiscussion,General Politics,2184658,Why is there such confusion about whether or not Putin has spoken to Trump?,129,98,No,Yes,0,https://www.reddit.com/r/PoliticalDiscussion/comments/1gq4ztm/why_is_there_such_confusion_about_whether_or_not/,/r/PoliticalDiscussion/comments/1gq4ztm/why_is_there_such_confusion_about_whether_or_not/
ai,PoliticalDiscussion,General Politics,2184658,What can the electorate or legislators do in cases of Executive Branch Scandals or Convictions? ,14,25,No,No,0,https://www.reddit.com/r/PoliticalDiscussion/comments/1gqgb8t/what_can_the_electorate_or_legislators_do_in/,/r/PoliticalDiscussion/comments/1gqgb8t/what_can_the_electorate_or_legislators_do_in/
ai,PoliticalDiscussion,General Politics,2184658,"In 2016, Republicans controlled the House and Senate with larger margins over Democrats than they have in 2024. What does this potentially mean for proposed changes that may land on the floor?",129,47,No,No,0,https://www.reddit.com/r/PoliticalDiscussion/comments/1gq3dwr/in_2016_republicans_controlled_the_house_and/,/r/PoliticalDiscussion/comments/1gq3dwr/in_2016_republicans_controlled_the_house_and/
ai,PoliticalDiscussion,General Politics,2184658,"If Democrats do shift to the populist left in 2028, who will be the leader of the movement with Bernie likely being too old?",472,1482,No,No,0,https://www.reddit.com/r/PoliticalDiscussion/comments/1gpgnc8/if_democrats_do_shift_to_the_populist_left_in/,/r/PoliticalDiscussion/comments/1gpgnc8/if_democrats_do_shift_to_the_populist_left_in/
ai,PoliticalDiscussion,General Politics,2184658,How likely is Trump to convert the US to a totalitarian dictatorship?,387,1506,No,No,0,https://www.reddit.com/r/PoliticalDiscussion/comments/1gp56t4/how_likely_is_trump_to_convert_the_us_to_a/,/r/PoliticalDiscussion/comments/1gp56t4/how_likely_is_trump_to_convert_the_us_to_a/
ai,PoliticalDiscussion,General Politics,2184658,"How likely is it that the ACA will be repealed, as per the GOP's plans?",261,324,No,No,0,https://www.reddit.com/r/PoliticalDiscussion/comments/1gp1l4g/how_likely_is_it_that_the_aca_will_be_repealed_as/,/r/PoliticalDiscussion/comments/1gp1l4g/how_likely_is_it_that_the_aca_will_be_repealed_as/
ai,PoliticalDiscussion,General Politics,2184658,"How will Trump better the economy for the average person, family, or small business owner?",0,88,No,No,0,https://www.reddit.com/r/PoliticalDiscussion/comments/1gqa9wk/how_will_trump_better_the_economy_for_the_average/,/r/PoliticalDiscussion/comments/1gqa9wk/how_will_trump_better_the_economy_for_the_average/
ai,PoliticalDiscussion,General Politics,2184658,"Who will Gov. DeWine appoint to replace JD Vance in the senate, and will the special election actually be competitive? Could Sherrod Brown run again?",1,1,No,No,0,https://www.reddit.com/r/PoliticalDiscussion/comments/1gq0u7e/who_will_gov_dewine_appoint_to_replace_jd_vance/,/r/PoliticalDiscussion/comments/1gq0u7e/who_will_gov_dewine_appoint_to_replace_jd_vance/
ai,NeutralPolitics,General Politics,610665,What to expect after the U.S. election,283,26,Yes,Yes,0,https://www.reddit.com/r/NeutralPolitics/comments/1gflxpk/what_to_expect_after_the_us_election/,/r/NeutralPolitics/comments/1gflxpk/what_to_expect_after_the_us_election/
ai,NeutralPolitics,General Politics,610665,Tracking what bills/decisions are coming to contact reps/senators in a timely manner,18,2,No,No,0,https://www.reddit.com/r/NeutralPolitics/comments/1gqkpdp/tracking_what_billsdecisions_are_coming_to/,/r/NeutralPolitics/comments/1gqkpdp/tracking_what_billsdecisions_are_coming_to/
ai,NeutralPolitics,General Politics,610665,Do any countries have laws to combat politically-driven misinformation?,6,21,No,Yes,0,https://www.reddit.com/r/NeutralPolitics/comments/1gq4agt/do_any_countries_have_laws_to_combat/,/r/NeutralPolitics/comments/1gq4agt/do_any_countries_have_laws_to_combat/
ai,NeutralPolitics,General Politics,610665,Is now the time for a NEW moderate third party in U.S. politics?,0,74,No,No,0,https://www.reddit.com/r/NeutralPolitics/comments/1gms9so/is_now_the_time_for_a_new_moderate_third_party_in/,/r/NeutralPolitics/comments/1gms9so/is_now_the_time_for_a_new_moderate_third_party_in/
ai,NeutralPolitics,General Politics,610665,Are neocons just hawkish cons?,11,22,No,No,0,https://www.reddit.com/r/NeutralPolitics/comments/1gm80f7/are_neocons_just_hawkish_cons/,/r/NeutralPolitics/comments/1gm80f7/are_neocons_just_hawkish_cons/
ai,NeutralPolitics,General Politics,610665,Where is the Western world’s paradigm shift coming from?,113,128,No,Yes,0,https://www.reddit.com/r/NeutralPolitics/comments/1glkk8q/where_is_the_western_worlds_paradigm_shift_coming/,/r/NeutralPolitics/comments/1glkk8q/where_is_the_western_worlds_paradigm_shift_coming/
ai,NeutralPolitics,General Politics,610665,Why Are So Many Men Leaving The Democratic Party Over The Last Few Years?,385,156,No,No,0,https://www.reddit.com/r/NeutralPolitics/comments/1gklb9t/why_are_so_many_men_leaving_the_democratic_party/,/r/NeutralPolitics/comments/1gklb9t/why_are_so_many_men_leaving_the_democratic_party/
elon musk,NeutralPolitics,General Politics,610665,What is the impact of Elon Musk's political engagement on the current U.S. election?,61,40,No,No,0,https://www.reddit.com/r/NeutralPolitics/comments/1gki55b/what_is_the_impact_of_elon_musks_political/,/r/NeutralPolitics/comments/1gki55b/what_is_the_impact_of_elon_musks_political/
ai,NeutralPolitics,General Politics,610665,"What are the pros and cons of predictive election models, like 538, for our discourse around elections?",38,94,No,No,0,https://www.reddit.com/r/NeutralPolitics/comments/1giqib5/what_are_the_pros_and_cons_of_predictive_election/,/r/NeutralPolitics/comments/1giqib5/what_are_the_pros_and_cons_of_predictive_election/
ai,NeutralPolitics,General Politics,610665,Why are there organizations whose only goal is to make sure people vote? ,49,36,No,No,0,https://www.reddit.com/r/NeutralPolitics/comments/1ggtk67/why_are_there_organizations_whose_only_goal_is_to/,/r/NeutralPolitics/comments/1ggtk67/why_are_there_organizations_whose_only_goal_is_to/
ai,NeutralPolitics,General Politics,610665,How do the Trump and Harris plans for workforce pay and taxes compare?,5,6,No,No,0,https://www.reddit.com/r/NeutralPolitics/comments/1ggxh8w/how_do_the_trump_and_harris_plans_for_workforce/,/r/NeutralPolitics/comments/1ggxh8w/how_do_the_trump_and_harris_plans_for_workforce/
ai,NeutralPolitics,General Politics,610665,Has there been any investigative journalism or public legal discovery to examine process irregularities regarding the 2020 election?,11,15,No,No,0,https://www.reddit.com/r/NeutralPolitics/comments/1ggkpzr/has_there_been_any_investigative_journalism_or/,/r/NeutralPolitics/comments/1ggkpzr/has_there_been_any_investigative_journalism_or/
ai,moderatepolitics,General Politics,296442,Ukraine’s European allies eye once-taboo ‘land-for-peace’ negotiations,61,187,No,No,0,https://www.washingtonpost.com/world/2024/11/13/europe-ukraine-russia-negotiations-trump/,/r/moderatepolitics/comments/1gqh9s9/ukraines_european_allies_eye_oncetaboo/
elon musk,moderatepolitics,General Politics,296442,Elon Musk and Vivek Ramaswamy will lead new ‘Department of Government Efficiency’ in Trump administration,500,809,No,No,0,https://www.cnn.com/2024/11/12/politics/elon-musk-vivek-ramaswamy-department-of-government-efficiency-trump/index.html,/r/moderatepolitics/comments/1gq0ozd/elon_musk_and_vivek_ramaswamy_will_lead_new/
ai,technology,General Politics,17396576,Hi! We're the hosts of WIRED's new tech culture podcast Uncanny Valley. AM(us)A!,45,49,Yes,No,0,https://www.reddit.com/r/technology/comments/1gftoz0/hi_were_the_hosts_of_wireds_new_tech_culture/,/r/technology/comments/1gftoz0/hi_were_the_hosts_of_wireds_new_tech_culture/
ai,technology,General Politics,17396576,Hospitals are reporting more insurance denials. Is AI behind them?,3320,155,No,No,0,https://www.newsweek.com/hospitals-are-reporting-more-insurance-denials-ai-driving-them-1977706,/r/technology/comments/1gqlf8e/hospitals_are_reporting_more_insurance_denials_is/
ai,technology,General Politics,17396576,FBI raids home and seizes phone of Polymarket founder | Technology,1035,48,No,No,0,https://www.theguardian.com/technology/2024/nov/13/fbi-raid-polymarket-founder-trump-election,/r/technology/comments/1gqsy88/fbi_raids_home_and_seizes_phone_of_polymarket/
ai,technology,General Politics,17396576,Ukraine: Downed Russian Drone Is Full of Western Tech,2093,88,No,No,0,https://www.extremetech.com/defense/ukraine-downed-russian-drone-is-full-of-western-tech,/r/technology/comments/1gqmdle/ukraine_downed_russian_drone_is_full_of_western/
ai,technology,General Politics,17396576,Supreme Court seems likely to allow class action to proceed against tech company Nvidia,639,27,No,No,0,https://apnews.com/article/supreme-court-nvidia-securities-fraud-cryptocurrency-e146e0d9a4d6887b187ea662bf4c9a6c,/r/technology/comments/1gqqo8j/supreme_court_seems_likely_to_allow_class_action/
ai,technology,General Politics,17396576,Some YouTube Premium subscribers complain of seeing ads,291,69,No,No,0,https://www.androidheadlines.com/2024/11/some-youtube-premium-subscribers-complain-of-seeing-ads.html,/r/technology/comments/1gqvtv6/some_youtube_premium_subscribers_complain_of/
ai,democrats,Ideological Politics,480555,I’m the Governor of Kentucky. Here’s How Democrats Can Win Again. ,56,15,Yes,No,0,https://www.nytimes.com/2024/11/12/opinion/democratic-party-future-kentucky.html?unlocked_article_code=1.Zk4.2UPg.IdQ02kUDdV7X&smid=url-share,/r/democrats/comments/1gqsb2h/im_the_governor_of_kentucky_heres_how_democrats/
ai,Republican,Ideological Politics,205427,Joe Rogan says Kamala Harris campaign had a condition to avoid 'marijuana legalization' talk for interview,151,26,No,No,0,https://www.foxnews.com/media/joe-rogan-says-kamala-harris-campaign-had-condition-avoid-marijuana-legalization-talk-interview,/r/Republican/comments/1gqs5sm/joe_rogan_says_kamala_harris_campaign_had_a/
elon musk,Republican,Ideological Politics,205427,"Trump picks Rubio, Gaetz and Gabbard for top jobs in blitz of nominations",262,95,No,No,0,https://www.bbc.com/news/live/cnvjr42yq39t,/r/Republican/comments/1gqni1p/trump_picks_rubio_gaetz_and_gabbard_for_top_jobs/
ai,Republican,Ideological Politics,205427,The Handmaid's Tale Redux,371,26,No,No,0,https://i.imgur.com/UsuyE6K.jpeg,/r/Republican/comments/1gqgjla/the_handmaids_tale_redux/
ai,Republican,Ideological Politics,205427,Speaking Of Putting Ones Tail Between Their Legs... Jack Smith to Resign Before Trump Inaugurated,166,26,No,No,0,https://townhall.com/tipsheet/rebeccadowns/2024/11/13/jack-smith-to-resign-before-trump-inaugurated-n2647719,/r/Republican/comments/1gqi06k/speaking_of_putting_ones_tail_between_their_legs/
ai,Republican,Ideological Politics,205427,Mike Johnson wins Republican support to be House speaker again after Trump endorsement ,48,2,No,No,0,https://www.foxnews.com/politics/mike-johnson-wins-republican-support-house-speaker-again-after-trump-endorsement,/r/Republican/comments/1gqo8bh/mike_johnson_wins_republican_support_to_be_house/
ai,Republican,Ideological Politics,205427,The Babylon Bee Is Graciously Offering To Hire Any Laid-Off Employee From Fake News Rival CNN,99,10,No,No,0,https://babylonbee.com/news/the-babylon-bee-is-graciously-offering-to-hire-any-laid-off-employee-from-fake-news-rival-cnn,/r/Republican/comments/1gqiinh/the_babylon_bee_is_graciously_offering_to_hire/
ai,Conservative,Ideological Politics,1146950,BREAKING: French prosecutors want to JAIL Marine Le Pen for 2 years and BAN her from running in the 2027 French Presidential Election,224,45,No,No,0,https://www.reddit.com/r/Conservative/comments/1gqvyqn/breaking_french_prosecutors_want_to_jail_marine/,/r/Conservative/comments/1gqvyqn/breaking_french_prosecutors_want_to_jail_marine/
ai,Conservative,Ideological Politics,1146950,"Polymarket Predicted Trump’s Victory, and Now the FBI Has Raided Its CEO’s Home",343,23,No,No,0,https://pjmedia.com/robert-spencer/2024/11/13/polymarket-predicted-trumps-victory-and-now-the-fbi-has-raided-its-ceos-home-n4934260,/r/Conservative/comments/1gqqbqa/polymarket_predicted_trumps_victory_and_now_the/
ai,Libertarian,Ideological Politics,503686,The GOP runs around talking like they're Ron Paul but always end up governing like John McCain,425,41,No,No,0,https://v.redd.it/0cqtu95mio0e1,/r/Libertarian/comments/1gqe3uq/the_gop_runs_around_talking_like_theyre_ron_paul/
ai,Libertarian,Ideological Politics,503686,Trying to get a permit for some work on my home is showing me the inefficiency of the government.,102,21,No,No,0,https://www.reddit.com/r/Libertarian/comments/1gqn7rm/trying_to_get_a_permit_for_some_work_on_my_home/,/r/Libertarian/comments/1gqn7rm/trying_to_get_a_permit_for_some_work_on_my_home/
ai,Libertarian,Ideological Politics,503686,Nominating AIPAC shills is not something you do if you want to end the wars,125,19,No,No,0,https://i.redd.it/zsesr1fmfo0e1.jpeg,/r/Libertarian/comments/1gqdr3b/nominating_aipac_shills_is_not_something_you_do/
ai,Anarchism,Ideological Politics,271114,Radical BIPOC Thursday,2,0,Yes,No,0,https://www.reddit.com/r/Anarchism/comments/1gqybl7/radical_bipoc_thursday/,/r/Anarchism/comments/1gqybl7/radical_bipoc_thursday/
ai,Anarchism,Ideological Politics,271114,Never give into despair. Organize. Anyone in? Questions?,142,10,No,No,0,https://i.redd.it/5nxkucuimp0e1.png,/r/Anarchism/comments/1gqjegr/never_give_into_despair_organize_anyone_in/
ai,Anarchism,Ideological Politics,271114,Published books that could be a gateway for liberals,94,66,No,No,0,https://www.reddit.com/r/Anarchism/comments/1gql17h/published_books_that_could_be_a_gateway_for/,/r/Anarchism/comments/1gql17h/published_books_that_could_be_a_gateway_for/
ai,Anarchism,Ideological Politics,271114,Plan B distro,32,0,No,No,0,https://www.reddit.com/r/Anarchism/comments/1gqm4ic/plan_b_distro/,/r/Anarchism/comments/1gqm4ic/plan_b_distro/
ai,Anarchism,Ideological Politics,271114,STAYING ALIVE IS PUNK AS FUCK,613,44,No,No,0,https://www.reddit.com/r/Anarchism/comments/1gphrhm/staying_alive_is_punk_as_fuck/,/r/Anarchism/comments/1gphrhm/staying_alive_is_punk_as_fuck/
ai,Anarchism,Ideological Politics,271114,Book recs,152,38,No,Yes,0,https://i.redd.it/19i11ebaeh0e1.jpeg,/r/Anarchism/comments/1gpm0ra/book_recs/
ai,Anarchism,Ideological Politics,271114,Radical Women Wednesday,5,0,No,No,0,https://www.reddit.com/r/Anarchism/comments/1gq6ak2/radical_women_wednesday/,/r/Anarchism/comments/1gq6ak2/radical_women_wednesday/
ai,Anarchism,Ideological Politics,271114,Hopes up and alone,16,13,No,No,0,https://www.reddit.com/r/Anarchism/comments/1gpveyk/hopes_up_and_alone/,/r/Anarchism/comments/1gpveyk/hopes_up_and_alone/
ai,Anarchism,Ideological Politics,271114,"A few months ago, the conservative party came to power in Valencia, Spain with the support of the far right. One of their first acts was to eliminate climate emergency services. At the end of October, flooding exacerbated by climate change killed over 200 people in the region.",202,4,No,No,0,/r/CrimethInc/comments/1gpe123/a_few_months_ago_the_conservative_party_came_to/,/r/Anarchism/comments/1gpe16v/a_few_months_ago_the_conservative_party_came_to/
ai,Socialism,Ideological Politics,460961,"Recommend Me A YouTube Channel Thread for November, 2024",2,7,Yes,No,0,https://www.reddit.com/r/socialism/comments/1gqdis8/recommend_me_a_youtube_channel_thread_for/,/r/socialism/comments/1gqdis8/recommend_me_a_youtube_channel_thread_for/
ai,Socialism,Ideological Politics,460961,"Tom Bateman, Matt Lee, and Said Arikat and more press State Department's Vedant Patel about the (lack of) results from Blinken's 30 day letter to Israel. They ask about specifics while Patel says ""Israel has taken some steps""",9,1,No,No,0,https://www.youtube.com/watch?v=_AG7OojTtJg,/r/socialism/comments/1gqppmt/tom_bateman_matt_lee_and_said_arikat_and_more/
ai,Socialism,Ideological Politics,460961,Protests and Mass Anger in Spain after catastrophic floods,21,1,No,No,0,https://www.socialistworld.net/2024/11/07/worst-flooding-kills-more-than-200-people-in-spain/,/r/socialism/comments/1gqal5z/protests_and_mass_anger_in_spain_after/
ai,Progressive,Ideological Politics,78064,Behind the Curtain: Trump's business bonanza,13,1,No,No,0,https://www.axios.com/2024/11/07/trump-elon-musk-business-tax-cuts,/r/progressive/comments/1gm4w17/behind_the_curtain_trumps_business_bonanza/
ai,Progressive,Ideological Politics,78064,Billionaires vs Democracy - The rich are trying to buy elections all over the world and consign democracy to the trash bin of history.,288,12,No,No,0,https://inequality.org/research/billionaires-vs-democracy/,/r/progressive/comments/1ggh1hg/billionaires_vs_democracy_the_rich_are_trying_to/
ai,Progressive,Ideological Politics,78064,A Texas Woman Died After Waiting 40 Hours for Miscarriage Care,299,6,No,No,0,https://www.propublica.org/article/josseli-barnica-death-miscarriage-texas-abortion-ban,/r/progressive/comments/1gfmamd/a_texas_woman_died_after_waiting_40_hours_for/
ai,Progressive,Ideological Politics,78064,These teachers often live in poverty. A pay raise could help — but there’s a cost,73,4,No,No,0,https://www.npr.org/2024/10/22/nx-s1-5144162/biden-preschool-head-start-teacher-poverty,/r/progressive/comments/1ga8u8y/these_teachers_often_live_in_poverty_a_pay_raise/
ai,Republicanism,Ideological Politics,918,Why are monarchists cherry-pickers?,7,0,No,No,0,https://www.reddit.com/r/republicanism/comments/1c22ytx/why_are_monarchists_cherrypickers/,/r/republicanism/comments/1c22ytx/why_are_monarchists_cherrypickers/
ai,Republicanism,Ideological Politics,918,Pro-British monarchy Indian Christian saying mocking the name-reverting done by our governments (especially the renaming of Bombay to Mumbai) and openly doing sedition by saying that Charles III should be the Emperor of India and 'God Save the King' should be the Indian anthem.,3,0,No,No,0,https://www.reddit.com/gallery/1b2xwq8,/r/republicanism/comments/1b2xwq8/probritish_monarchy_indian_christian_saying/
ai,Republicanism,Ideological Politics,918,“Away with college gen ed”,0,4,No,Yes,0,https://www.reddit.com/r/republicanism/comments/19asm4l/away_with_college_gen_ed/,/r/republicanism/comments/19asm4l/away_with_college_gen_ed/
ai,Republicanism,Ideological Politics,918,Question from a Monarchist,8,20,No,No,0,https://www.reddit.com/r/republicanism/comments/z0zqv0/question_from_a_monarchist/,/r/republicanism/comments/z0zqv0/question_from_a_monarchist/
ai,Conservatives,Ideological Politics,108245,Ted Cruz: ‘Kamala Harris Ran The Fyre Festival Of Campaigns’,20,1,No,No,0,https://www.dailywire.com/news/ted-cruz-kamala-harris-ran-the-fyre-festival-of-campaigns,/r/conservatives/comments/1gqubqw/ted_cruz_kamala_harris_ran_the_fyre_festival_of/
ai,dailywire,Ideological Politics,24213,Wall of Hate - Help Document Hatred Against Trump on July13th.com,79,16,Yes,No,0,https://july13th.com/hate/,/r/dailywire/comments/1e3cqx8/wall_of_hate_help_document_hatred_against_trump/
ai,dailywire,Ideological Politics,24213,Trump is to select Kristi Neom as Homeland Security Secretary. I thought he was a misogynist. Did the left lie to me again? ,233,29,No,No,0,https://amp.cnn.com/cnn/2024/11/12/politics/kristi-noem-homeland-security-secretary,/r/dailywire/comments/1gqn3y3/trump_is_to_select_kristi_neom_as_homeland/
ai,dailywire,Ideological Politics,24213,America striving for energy independence again!,51,0,No,No,0,https://www.bloomberg.com/news/articles/2024-11-12/cop29-us-has-plan-to-triple-nuclear-power-as-energy-demand-soars,/r/dailywire/comments/1gqiv3j/america_striving_for_energy_independence_again/
ai,dailywire,Ideological Politics,24213,Another claim in which Trump was right ,161,3,No,No,0,https://v.redd.it/26hradrdcd0e1,/r/dailywire/comments/1gp8glb/another_claim_in_which_trump_was_right/
ai,Liberal,Ideological Politics,119854,The election & my youtube theory. ,0,4,No,No,0,https://www.reddit.com/r/Liberal/comments/1gqyg96/the_election_my_youtube_theory/,/r/Liberal/comments/1gqyg96/the_election_my_youtube_theory/
ai,Liberal,Ideological Politics,119854,Do we have enough guardrails to survive the next 4 years?,1,1,No,No,0,https://www.reddit.com/r/Liberal/comments/1gqxmm6/do_we_have_enough_guardrails_to_survive_the_next/,/r/Liberal/comments/1gqxmm6/do_we_have_enough_guardrails_to_survive_the_next/
ai,Liberal,Ideological Politics,119854,Arizona AG says she won't drop state's fake electors case against Trump allies,555,24,No,No,0,https://www.upi.com/Top_News/US/2024/11/10/Arizona-fake-electors-case/4001731292312/,/r/Liberal/comments/1gosjeh/arizona_ag_says_she_wont_drop_states_fake/
ai,KamalaHarris,Ideological Politics,75606,Why the Democratic Party must demand a recount w/Dean Obaidallah,418,36,No,No,0,https://youtu.be/FqfEmXjNPnw?si=Kob7g-2fVWXlGvIj,/r/KamalaHarris/comments/1gq61ac/why_the_democratic_party_must_demand_a_recount/
