Keyword,Subreddit,Category,Members,Title,Upvotes,Comments,Moderator Interaction,Fact-Checking Mention,Total Awards,URL,Original Post URL
ai,Conservatives,Ideological Politics,108264,Arizona Judge Recuses Himself From 'Fake Electors' Case After Emails Surface Demanding Judges Defend Kamala,15,0,No,No,0,https://redstate.com/beccalower/2024/11/13/az-judge-recuses-himself-from-fake-electors-case-after-emails-surface-demanding-judges-defend-kamala-n2181972?bcid=3b1497a409aa349654180f08236547d7cf3c88d51141d3f44e7f1f59fb4c60ef&lctg=29718346,/r/conservatives/comments/1grcksh/arizona_judge_recuses_himself_from_fake_electors/
ai,dailywire,Ideological Politics,24222,Wall of Hate - Help Document Hatred Against Trump on July13th.com,80,16,Yes,No,0,https://july13th.com/hate/,/r/dailywire/comments/1e3cqx8/wall_of_hate_help_document_hatred_against_trump/
ai,dailywire,Ideological Politics,24222,Whoever is Brett Coopers memer needs a raise ,18,0,No,No,0,https://v.redd.it/z6xqi35fbw0e1,/r/dailywire/comments/1gr91j4/whoever_is_brett_coopers_memer_needs_a_raise/
ai,dailywire,Ideological Politics,24222,Trump is to select Kristi Neom as Homeland Security Secretary. I thought he was a misogynist. Did the left lie to me again? ,262,32,No,No,0,https://amp.cnn.com/cnn/2024/11/12/politics/kristi-noem-homeland-security-secretary,/r/dailywire/comments/1gqn3y3/trump_is_to_select_kristi_neom_as_homeland/
ai,dailywire,Ideological Politics,24222,America striving for energy independence again!,53,0,No,No,0,https://www.bloomberg.com/news/articles/2024-11-12/cop29-us-has-plan-to-triple-nuclear-power-as-energy-demand-soars,/r/dailywire/comments/1gqiv3j/america_striving_for_energy_independence_again/
ai,Liberal,Ideological Politics,119863,We need to *actually* create Blue MAGA. ,128,153,No,No,0,https://www.reddit.com/r/Liberal/comments/1gr7var/we_need_to_actually_create_blue_maga/,/r/Liberal/comments/1gr7var/we_need_to_actually_create_blue_maga/
elon musk,Liberal,Ideological Politics,119863,How long until Elon musk and Trump have a fall out? ,57,41,No,No,0,https://www.reddit.com/r/Liberal/comments/1gral4g/how_long_until_elon_musk_and_trump_have_a_fall_out/,/r/Liberal/comments/1gral4g/how_long_until_elon_musk_and_trump_have_a_fall_out/
ai,Liberal,Ideological Politics,119863,Everyone is hiding,42,50,No,No,0,https://www.reddit.com/r/Liberal/comments/1grcl53/everyone_is_hiding/,/r/Liberal/comments/1grcl53/everyone_is_hiding/
ai,Liberal,Ideological Politics,119863,Life in limbo,11,20,No,No,0,https://www.reddit.com/r/Liberal/comments/1gr9pty/life_in_limbo/,/r/Liberal/comments/1gr9pty/life_in_limbo/
ai,Liberal,Ideological Politics,119863,Someone Take Away Steve Bannon's Copy of *The Prince*,3,0,No,No,0,https://www.reddit.com/r/Liberal/comments/1grc6za/someone_take_away_steve_bannons_copy_of_the_prince/,/r/Liberal/comments/1grc6za/someone_take_away_steve_bannons_copy_of_the_prince/
ai,KamalaHarris,Ideological Politics,75484,"Biden Administration's Dept. of Ed. Investigation Finds Nex Benedict's School District ""Failed to Address"" Sexual Harassment",98,2,No,No,0,https://substack.com/@unclosetedmedia/note/c-77184595,/r/KamalaHarris/comments/1grfnf6/biden_administrations_dept_of_ed_investigation/
ai,KamalaHarris,Ideological Politics,75484,Why the Democratic Party must demand a recount w/Dean Obaidallah,492,44,No,No,0,https://youtu.be/FqfEmXjNPnw?si=Kob7g-2fVWXlGvIj,/r/KamalaHarris/comments/1gq61ac/why_the_democratic_party_must_demand_a_recount/
ai,KamalaHarris,Ideological Politics,75484,"NEVADA VOTERS: Over 10,000 mail-in ballots in Nevada are at risk of being rejected. But if voters cure their ballots by 5 pm PT today, their votes will be counted. Check your status here.  Please share!",1488,105,No,No,0,https://www.nvsos.gov/sos/elections/voters/cure,/r/KamalaHarris/comments/1gpnmvb/nevada_voters_over_10000_mailin_ballots_in_nevada/
ai,KamalaHarris,Ideological Politics,75484,Harris fundraising page says a portion of donations will be directed to recount effort,1265,139,No,No,0,https://www.usatoday.com/story/news/politics/elections/2024/11/11/kamala-harris-fundraiser-donations-election-recount/76195287007/,/r/KamalaHarris/comments/1gplf80/harris_fundraising_page_says_a_portion_of/
ai,KamalaHarris,Ideological Politics,75484,"Anti-abortion groups unveil “Make America Pro-Life Again Roadmap,” an effort to block federal and state access, including in nearly a dozen states that enshrined protections through ballot measures over the last two years",398,23,No,No,0,https://www.politico.com/news/2024/11/12/groups-undermine-abortion-ballot-measures-strategy-00188874,/r/KamalaHarris/comments/1gppyyh/antiabortion_groups_unveil_make_america_prolife/
ai,Impeach_Trump,Ideological Politics,60530,Trump's crowds are dwindling as his campaign winds down — Empty seats and early exits have grown more common,425,18,No,No,0,https://www.nytimes.com/2024/11/04/us/politics/trump-rally-crowds.html,/r/Impeach_Trump/comments/1gjn8sb/trumps_crowds_are_dwindling_as_his_campaign_winds/
ai,Impeach_Trump,Ideological Politics,60530,Let's make him lose again,133,1,No,No,0,https://imghoster.co/5ysKrAQZLXV2ObZ,/r/Impeach_Trump/comments/1gj9krk/lets_make_him_lose_again/
elon musk,Impeach_Trump,Ideological Politics,60530,"Elon Musk predicts ‘hardship,’ economic turmoil and a stock-market crash if Trump wins",63,4,No,No,0,https://www.marketwatch.com/story/kaboom-elon-musk-predicts-hardship-economic-turmoil-and-a-stock-market-crash-if-trump-wins-20483008,/r/Impeach_Trump/comments/1gfwy5u/elon_musk_predicts_hardship_economic_turmoil_and/
