Keyword,Subreddit,Category,Members,Title,Upvotes,Comments,Moderator Interaction,Fact-Checking Mention,Total Awards,URL,Original Post URL
ai,Wikileaks,General Politics,177657,Parliamentary Assembly recognises Julian Assange as a ‘political prisoner’ and warns against the chilling effect of his harsh treatment,45,0,No,No,0,https://www.coe.int/en/web/portal/-/pace-recognises-julian-assange-as-a-political-prisoner-and-warns-against-the-chilling-effect-of-his-harsh-treatment,/r/WikiLeaks/comments/1fx0tn0/parliamentary_assembly_recognises_julian_assange/
ai,Wikileaks,General Politics,177657,"Julian Assange speaks out against deep state, ‘wolves in MAGA hats’: Interview",44,5,No,No,0,https://thehill.com/video/julian-assange-speaks-out-against-deep-state-%e2%80%98wolves-in-maga-hats%e2%80%99-interview/10098442/,/r/WikiLeaks/comments/1fvetjh/julian_assange_speaks_out_against_deep_state/
ai,Wikileaks,General Politics,177657,Julian to speak at a parliamentary hearing in Strasbourg on the chilling effect on human rights his treatment has had.,22,0,No,No,0,https://www.reddit.com/r/WikiLeaks/comments/1ftadxc/julian_to_speak_at_a_parliamentary_hearing_in/,/r/WikiLeaks/comments/1ftadxc/julian_to_speak_at_a_parliamentary_hearing_in/
ai,Wikileaks,General Politics,177657,Why does the US still control every penny of Iraqi oil revenues?,39,6,No,No,0,https://www.reddit.com/r/WikiLeaks/comments/1fso9v7/why_does_the_us_still_control_every_penny_of/,/r/WikiLeaks/comments/1fso9v7/why_does_the_us_still_control_every_penny_of/
ai,Wikileaks,General Politics,177657,Censored Wikileaks content?,14,7,No,No,0,https://www.reddit.com/r/WikiLeaks/comments/1frr2wq/censored_wikileaks_content/,/r/WikiLeaks/comments/1frr2wq/censored_wikileaks_content/
ai,News,General Politics,28930884,Justice Department Says Jail Conditions in Georgia's Fulton County Violate Detainee Rights,584,16,No,No,0,https://apnews.com/article/justice-department-fulton-county-jail-investigation-c6c8e088d7e8aee58e6420cac15d7b49?utm_source=copy&utm_medium=share,/r/news/comments/1grbh0q/justice_department_says_jail_conditions_in/
elon musk,News,General Politics,28930884,"Bluesky gains more than 1.25 million followers since U.S. election. The social media platform, a competitor to Elon Musk's X, says it has surpassed 15 million users.",17131,666,No,No,0,https://www.cbc.ca/news/bluesky-election-gains-1.7382384,/r/news/comments/1gqtxbw/bluesky_gains_more_than_125_million_followers/
ai,News,General Politics,28930884,Loyal dog helped solve owner's grisly murder as cousin is jailed for life,3782,129,No,No,0,https://www.nbcnews.com/news/us-news/loyal-dog-helped-solve-owners-grisly-murder-cousin-jailed-life-rcna179735?os=httpwww.google.com&ref=app,/r/news/comments/1gqpgrj/loyal_dog_helped_solve_owners_grisly_murder_as/
ai,PoliticalDiscussion,General Politics,2184676,A reminder - Please read our rules and participate civilly,51,18,Yes,No,0,https://www.reddit.com/r/PoliticalDiscussion/comments/1gl71w2/a_reminder_please_read_our_rules_and_participate/,/r/PoliticalDiscussion/comments/1gl71w2/a_reminder_please_read_our_rules_and_participate/
ai,PoliticalDiscussion,General Politics,2184676,Casual Questions Thread,43,4828,Yes,No,0,https://www.reddit.com/r/PoliticalDiscussion/comments/1bwbuka/casual_questions_thread/,/r/PoliticalDiscussion/comments/1bwbuka/casual_questions_thread/
RFK,PoliticalDiscussion,General Politics,2184676,"Trump has picked RFK Jr for HHS secretary. Will the Pharma industry lobby hard to block his confirmation and if so, will they succeed?",39,26,No,No,0,https://www.reddit.com/r/PoliticalDiscussion/comments/1grgblk/trump_has_picked_rfk_jr_for_hhs_secretary_will/,/r/PoliticalDiscussion/comments/1grgblk/trump_has_picked_rfk_jr_for_hhs_secretary_will/
ai,PoliticalDiscussion,General Politics,2184676,Why did Trump choose Matt Gaetz for Attorney General? ,816,951,No,No,0,https://www.reddit.com/r/PoliticalDiscussion/comments/1gqo32j/why_did_trump_choose_matt_gaetz_for_attorney/,/r/PoliticalDiscussion/comments/1gqo32j/why_did_trump_choose_matt_gaetz_for_attorney/
ai,PoliticalDiscussion,General Politics,2184676,What could (or should) be done to make political parties less at risk of being a mere engine of a particular leader or person?,34,105,No,No,0,https://www.reddit.com/r/PoliticalDiscussion/comments/1gr65n9/what_could_or_should_be_done_to_make_political/,/r/PoliticalDiscussion/comments/1gr65n9/what_could_or_should_be_done_to_make_political/
ai,PoliticalDiscussion,General Politics,2184676,What is the plan for Ukraine and the rest of NATO here if U.S. turns neutral?,83,202,No,No,0,https://www.reddit.com/r/PoliticalDiscussion/comments/1gr0dng/what_is_the_plan_for_ukraine_and_the_rest_of_nato/,/r/PoliticalDiscussion/comments/1gr0dng/what_is_the_plan_for_ukraine_and_the_rest_of_nato/
ai,PoliticalDiscussion,General Politics,2184676,What do you think Trump will do about the Israel/Palestine conflict?,244,836,No,No,0,https://www.reddit.com/r/PoliticalDiscussion/comments/1gq3qzs/what_do_you_think_trump_will_do_about_the/,/r/PoliticalDiscussion/comments/1gq3qzs/what_do_you_think_trump_will_do_about_the/
ai,PoliticalDiscussion,General Politics,2184676,What can the electorate or legislators do in cases of Executive Branch Scandals or Convictions? ,18,32,No,No,0,https://www.reddit.com/r/PoliticalDiscussion/comments/1gqgb8t/what_can_the_electorate_or_legislators_do_in/,/r/PoliticalDiscussion/comments/1gqgb8t/what_can_the_electorate_or_legislators_do_in/
ai,PoliticalDiscussion,General Politics,2184676,Why is there such confusion about whether or not Putin has spoken to Trump?,137,106,No,Yes,0,https://www.reddit.com/r/PoliticalDiscussion/comments/1gq4ztm/why_is_there_such_confusion_about_whether_or_not/,/r/PoliticalDiscussion/comments/1gq4ztm/why_is_there_such_confusion_about_whether_or_not/
ai,PoliticalDiscussion,General Politics,2184676,"In 2016, Republicans controlled the House and Senate with larger margins over Democrats than they have in 2024. What does this potentially mean for proposed changes that may land on the floor?",166,61,No,No,0,https://www.reddit.com/r/PoliticalDiscussion/comments/1gq3dwr/in_2016_republicans_controlled_the_house_and/,/r/PoliticalDiscussion/comments/1gq3dwr/in_2016_republicans_controlled_the_house_and/
ai,PoliticalDiscussion,General Politics,2184676,"If Democrats do shift to the populist left in 2028, who will be the leader of the movement with Bernie likely being too old?",475,1505,No,No,0,https://www.reddit.com/r/PoliticalDiscussion/comments/1gpgnc8/if_democrats_do_shift_to_the_populist_left_in/,/r/PoliticalDiscussion/comments/1gpgnc8/if_democrats_do_shift_to_the_populist_left_in/
ai,PoliticalDiscussion,General Politics,2184676,"Tulsi Gabbard is up for Secretary of Intelligence. What affect will this have on US actions globally, and Trump's administration?",0,83,No,No,0,https://www.reddit.com/r/PoliticalDiscussion/comments/1gqz93e/tulsi_gabbard_is_up_for_secretary_of_intelligence/,/r/PoliticalDiscussion/comments/1gqz93e/tulsi_gabbard_is_up_for_secretary_of_intelligence/
ai,NeutralPolitics,General Politics,610698,What to expect after the U.S. election,283,26,Yes,Yes,0,https://www.reddit.com/r/NeutralPolitics/comments/1gflxpk/what_to_expect_after_the_us_election/,/r/NeutralPolitics/comments/1gflxpk/what_to_expect_after_the_us_election/
ai,NeutralPolitics,General Politics,610698,Tracking what bills/decisions are coming to contact reps/senators in a timely manner,28,6,No,No,0,https://www.reddit.com/r/NeutralPolitics/comments/1gqkpdp/tracking_what_billsdecisions_are_coming_to/,/r/NeutralPolitics/comments/1gqkpdp/tracking_what_billsdecisions_are_coming_to/
ai,NeutralPolitics,General Politics,610698,Do any countries have laws to combat politically-driven misinformation?,10,25,No,Yes,0,https://www.reddit.com/r/NeutralPolitics/comments/1gq4agt/do_any_countries_have_laws_to_combat/,/r/NeutralPolitics/comments/1gq4agt/do_any_countries_have_laws_to_combat/
ai,NeutralPolitics,General Politics,610698,Is now the time for a NEW moderate third party in U.S. politics?,0,75,No,No,0,https://www.reddit.com/r/NeutralPolitics/comments/1gms9so/is_now_the_time_for_a_new_moderate_third_party_in/,/r/NeutralPolitics/comments/1gms9so/is_now_the_time_for_a_new_moderate_third_party_in/
ai,NeutralPolitics,General Politics,610698,Are neocons just hawkish cons?,12,23,No,No,0,https://www.reddit.com/r/NeutralPolitics/comments/1gm80f7/are_neocons_just_hawkish_cons/,/r/NeutralPolitics/comments/1gm80f7/are_neocons_just_hawkish_cons/
ai,NeutralPolitics,General Politics,610698,Where is the Western world’s paradigm shift coming from?,112,128,No,Yes,0,https://www.reddit.com/r/NeutralPolitics/comments/1glkk8q/where_is_the_western_worlds_paradigm_shift_coming/,/r/NeutralPolitics/comments/1glkk8q/where_is_the_western_worlds_paradigm_shift_coming/
ai,NeutralPolitics,General Politics,610698,Why Are So Many Men Leaving The Democratic Party Over The Last Few Years?,381,156,No,No,0,https://www.reddit.com/r/NeutralPolitics/comments/1gklb9t/why_are_so_many_men_leaving_the_democratic_party/,/r/NeutralPolitics/comments/1gklb9t/why_are_so_many_men_leaving_the_democratic_party/
elon musk,NeutralPolitics,General Politics,610698,What is the impact of Elon Musk's political engagement on the current U.S. election?,68,40,No,No,0,https://www.reddit.com/r/NeutralPolitics/comments/1gki55b/what_is_the_impact_of_elon_musks_political/,/r/NeutralPolitics/comments/1gki55b/what_is_the_impact_of_elon_musks_political/
ai,NeutralPolitics,General Politics,610698,"What are the pros and cons of predictive election models, like 538, for our discourse around elections?",38,94,No,No,0,https://www.reddit.com/r/NeutralPolitics/comments/1giqib5/what_are_the_pros_and_cons_of_predictive_election/,/r/NeutralPolitics/comments/1giqib5/what_are_the_pros_and_cons_of_predictive_election/
ai,NeutralPolitics,General Politics,610698,Why are there organizations whose only goal is to make sure people vote? ,50,36,No,No,0,https://www.reddit.com/r/NeutralPolitics/comments/1ggtk67/why_are_there_organizations_whose_only_goal_is_to/,/r/NeutralPolitics/comments/1ggtk67/why_are_there_organizations_whose_only_goal_is_to/
ai,NeutralPolitics,General Politics,610698,How do the Trump and Harris plans for workforce pay and taxes compare?,3,6,No,No,0,https://www.reddit.com/r/NeutralPolitics/comments/1ggxh8w/how_do_the_trump_and_harris_plans_for_workforce/,/r/NeutralPolitics/comments/1ggxh8w/how_do_the_trump_and_harris_plans_for_workforce/
ai,NeutralPolitics,General Politics,610698,Has there been any investigative journalism or public legal discovery to examine process irregularities regarding the 2020 election?,11,15,No,No,0,https://www.reddit.com/r/NeutralPolitics/comments/1ggkpzr/has_there_been_any_investigative_journalism_or/,/r/NeutralPolitics/comments/1ggkpzr/has_there_been_any_investigative_journalism_or/
ai,moderatepolitics,General Politics,296486,Ukraine’s European allies eye once-taboo ‘land-for-peace’ negotiations,78,209,No,No,0,https://www.washingtonpost.com/world/2024/11/13/europe-ukraine-russia-negotiations-trump/,/r/moderatepolitics/comments/1gqh9s9/ukraines_european_allies_eye_oncetaboo/
elon musk,moderatepolitics,General Politics,296486,Elon Musk and Vivek Ramaswamy will lead new ‘Department of Government Efficiency’ in Trump administration,504,822,No,No,0,https://www.cnn.com/2024/11/12/politics/elon-musk-vivek-ramaswamy-department-of-government-efficiency-trump/index.html,/r/moderatepolitics/comments/1gq0ozd/elon_musk_and_vivek_ramaswamy_will_lead_new/
ai,technology,General Politics,17399574,Hi! We're the hosts of WIRED's new tech culture podcast Uncanny Valley. AM(us)A!,44,50,Yes,No,0,https://www.reddit.com/r/technology/comments/1gftoz0/hi_were_the_hosts_of_wireds_new_tech_culture/,/r/technology/comments/1gftoz0/hi_were_the_hosts_of_wireds_new_tech_culture/
ai,technology,General Politics,17399574,Exclusive: Trump's transition team aims to kill Biden EV tax credit,2170,348,No,No,0,https://www.reuters.com/business/autos-transportation/trumps-transition-team-aims-kill-biden-ev-tax-credit-2024-11-14/,/r/technology/comments/1grd0zm/exclusive_trumps_transition_team_aims_to_kill/
ai,technology,General Politics,17399574,"Phone network employs AI ""grandmother"" to waste scammers' time with meandering conversations | Scambaiting, Abe Simpson-style",5426,136,No,No,0,https://www.techspot.com/news/105571-phone-network-employs-ai-grandmother-waste-scammers-time.html,/r/technology/comments/1gr3cv3/phone_network_employs_ai_grandmother_to_waste/
ai,technology,General Politics,17399574,Bethesda Workers Go On Strike Against Microsoft,910,66,No,No,0,https://www.gamespot.com/articles/bethesda-workers-go-on-strike-against-microsoft/1100-6527751/?ftag=CAD-01-10abi2f,/r/technology/comments/1gra84a/bethesda_workers_go_on_strike_against_microsoft/
ai,technology,General Politics,17399574,FBI raids home and seizes phone of Polymarket founder | Technology,2899,194,No,No,0,https://www.theguardian.com/technology/2024/nov/13/fbi-raid-polymarket-founder-trump-election,/r/technology/comments/1gqsy88/fbi_raids_home_and_seizes_phone_of_polymarket/
ai,democrats,Ideological Politics,480624,I’m the Governor of Kentucky. Here’s How Democrats Can Win Again. ,105,26,Yes,No,0,https://www.nytimes.com/2024/11/12/opinion/democratic-party-future-kentucky.html?unlocked_article_code=1.Zk4.2UPg.IdQ02kUDdV7X&smid=url-share,/r/democrats/comments/1gqsb2h/im_the_governor_of_kentucky_heres_how_democrats/
ai,democrats,Ideological Politics,480624,"The Onion Buys Infowars”, and no, this is not a joke ",757,52,No,No,0,https://www.nytimes.com/2024/11/14/business/media/alex-jones-infowars-the-onion.html?smid=nytcore-ios-share&referringSource=articleShare,/r/democrats/comments/1gr6vdb/the_onion_buys_infowars_and_no_this_is_not_a_joke/
ai,democrats,Ideological Politics,480624,A message from Europe ,88,11,No,No,0,https://v.redd.it/7lz57frxfx0e1,/r/democrats/comments/1gref0j/a_message_from_europe/
ai,democrats,Ideological Politics,480624,Trump’s defense secretary pick said women shouldn’t be in combat roles. These female veterans fear what comes next | CNN,161,16,No,No,0,https://www.cnn.com/2024/11/14/us/military-women-pete-hegseth-defense-secretary/index.html?Date=20241114&Profile=CNN&utm_content=1731598207&utm_medium=social&utm_source=facebook&fbclid=IwZXh0bgNhZW0CMTEAAR0fzjn5e6gcrNOJT-KK0DhyRX2wv3q4WYU3jTSxtWao4jpiKe4sX67PWMM_aem_4nRIuvXvGGNbq-eraTpn0Q,/r/democrats/comments/1gr7xsd/trumps_defense_secretary_pick_said_women_shouldnt/
ai,democrats,Ideological Politics,480624,What do you all think about Putin’s aide warning Trump?,55,56,No,No,0,https://i.redd.it/sc4alet32x0e1.jpeg,/r/democrats/comments/1grcm2n/what_do_you_all_think_about_putins_aide_warning/
ai,Republican,Ideological Politics,205526,"Bye, Felicia: Joy Reid deletes her X account | Thanks For Helping Make Social Media Great Again 👍 ",397,41,No,No,0,https://notthebee.com/article/joy-reid-deletes-her-x-account,/r/Republican/comments/1gr8scu/bye_felicia_joy_reid_deletes_her_x_account_thanks/
ai,Republican,Ideological Politics,205526,"Republicans Secure House Majority, Gaining Full Control of Government as Trump Prepares for Presidency",178,40,No,No,0,https://m10news.com/republicans-secure-house-majority-gaining-full-control-of-government-as-trump-prepares-for-presidency/,/r/Republican/comments/1gr3lyd/republicans_secure_house_majority_gaining_full/
ai,Republican,Ideological Politics,205526,Joe Rogan says Kamala Harris campaign had a condition to avoid 'marijuana legalization' talk for interview,290,42,No,No,0,https://www.foxnews.com/media/joe-rogan-says-kamala-harris-campaign-had-condition-avoid-marijuana-legalization-talk-interview,/r/Republican/comments/1gqs5sm/joe_rogan_says_kamala_harris_campaign_had_a/
elon musk,Republican,Ideological Politics,205526,"Trump picks Rubio, Gaetz and Gabbard for top jobs in blitz of nominations",324,124,No,No,0,https://www.bbc.com/news/live/cnvjr42yq39t,/r/Republican/comments/1gqni1p/trump_picks_rubio_gaetz_and_gabbard_for_top_jobs/
ai,Republican,Ideological Politics,205526,The Handmaid's Tale Redux,432,30,No,No,0,https://i.imgur.com/UsuyE6K.jpeg,/r/Republican/comments/1gqgjla/the_handmaids_tale_redux/
RFK,Conservative,Ideological Politics,1147386,Trump to nominate RFK Jr. to head Department of Health and Human Services,720,188,No,No,0,https://nypost.com/2024/11/14/us-news/trump-to-nominate-rfk-jr-to-head-department-of-health-and-human-services-sources/?utm_source=chatgpt.com,/r/Conservative/comments/1greyd9/trump_to_nominate_rfk_jr_to_head_department_of/
ai,Conservative,Ideological Politics,1147386,"Connecticut teacher resigns, apologizes on-air after threatening Trump voters with violence on Snapchat",463,67,No,No,0,https://notthebee.com/article/watch-teacher-offers-tearful-apology-after-getting-fired-for-threatening-to-handle-trump-supporters,/r/Conservative/comments/1grakav/connecticut_teacher_resigns_apologizes_onair/
ai,Conservative,Ideological Politics,1147386,Eva Longoria reveals she has fled 'dystopian' America with her family and is now living in Mexico and Spain,930,534,No,No,0,https://www.dailymail.co.uk/news/article-14081643/eva-longoria-fled-america-family-mexico-spain.html,/r/Conservative/comments/1gr4ogw/eva_longoria_reveals_she_has_fled_dystopian/
ai,Conservative,Ideological Politics,1147386,"A Los Angeles County, California, high school teacher is reportedly under fire for storming out of her classroom at the sight of a student wearing a “Make America Great Again” shirt last week.",272,28,No,No,0,https://www.breitbart.com/education/2024/11/14/california-teacher-storms-out-classroom-over-student-maga-shirt-accuses-teen-hate-crime/,/r/Conservative/comments/1grddi4/a_los_angeles_county_california_high_school/
ai,Conservative,Ideological Politics,1147386,Whoopi Goldberg claims NYC bakery 'refused' to make her a birthday dessert because of her 'politics',811,206,No,No,0,https://nypost.com/2024/11/14/entertainment/whoopi-goldberg-claims-nyc-bakery-refused-to-make-her-a-birthday-dessert-because-of-her-politics/,/r/Conservative/comments/1gr4fav/whoopi_goldberg_claims_nyc_bakery_refused_to_make/
ai,Libertarian,Ideological Politics,503698,Mom Jailed for Letting 10-Year-Old Walk Alone to Town,278,53,No,No,0,https://reason.com/2024/11/11/mom-jailed-for-letting-10-year-old-walk-alone-to-town/,/r/Libertarian/comments/1gr4l7z/mom_jailed_for_letting_10yearold_walk_alone_to/
ai,Libertarian,Ideological Politics,503698,Dave Smith explains how warmonger Republicans are just as bad as warmonger Democrats,116,4,No,No,0,https://v.redd.it/gcs2lqw5hv0e1,/r/Libertarian/comments/1gr58vz/dave_smith_explains_how_warmonger_republicans_are/
ai,Libertarian,Ideological Politics,503698,Trump's transition team aims to kill Biden EV tax credit,35,19,No,No,0,https://www.reuters.com/business/autos-transportation/trumps-transition-team-aims-kill-biden-ev-tax-credit-2024-11-14/,/r/Libertarian/comments/1grcl2s/trumps_transition_team_aims_to_kill_biden_ev_tax/
ai,Libertarian,Ideological Politics,503698,Can someone explain what the General Libertarian views on how a Libertarian led country interacts with other countries and businesses from other countries?,4,7,No,No,0,https://www.reddit.com/r/Libertarian/comments/1grdskw/can_someone_explain_what_the_general_libertarian/,/r/Libertarian/comments/1grdskw/can_someone_explain_what_the_general_libertarian/
ai,Libertarian,Ideological Politics,503698,The GOP runs around talking like they're Ron Paul but always end up governing like John McCain,466,42,No,No,0,https://v.redd.it/0cqtu95mio0e1,/r/Libertarian/comments/1gqe3uq/the_gop_runs_around_talking_like_theyre_ron_paul/
ai,Libertarian,Ideological Politics,503698,Trying to get a permit for some work on my home is showing me the inefficiency of the government.,122,25,No,No,0,https://www.reddit.com/r/Libertarian/comments/1gqn7rm/trying_to_get_a_permit_for_some_work_on_my_home/,/r/Libertarian/comments/1gqn7rm/trying_to_get_a_permit_for_some_work_on_my_home/
ai,Anarchism,Ideological Politics,271138,Radical BIPOC Thursday,3,0,Yes,No,0,https://www.reddit.com/r/Anarchism/comments/1gqybl7/radical_bipoc_thursday/,/r/Anarchism/comments/1gqybl7/radical_bipoc_thursday/
ai,Anarchism,Ideological Politics,271138,"We've prepared a zine version of our text ""History Repeats Itself: First as Farce, Then as Tragedy,"" exploring why the Democrats are responsible for Donald Trump's return to power and what we have to do to regain the initiative.",18,1,No,No,0,/r/CrimethInc/comments/1grchqe/weve_prepared_a_zine_version_of_our_text_history/,/r/Anarchism/comments/1grchxa/weve_prepared_a_zine_version_of_our_text_history/
ai,Anarchism,Ideological Politics,271138,Never give into despair. Organize. Anyone in? Questions?,184,11,No,No,0,https://i.redd.it/5nxkucuimp0e1.png,/r/Anarchism/comments/1gqjegr/never_give_into_despair_organize_anyone_in/
ai,Anarchism,Ideological Politics,271138,Published books that could be a gateway for liberals,119,80,No,No,0,https://www.reddit.com/r/Anarchism/comments/1gql17h/published_books_that_could_be_a_gateway_for/,/r/Anarchism/comments/1gql17h/published_books_that_could_be_a_gateway_for/
ai,Anarchism,Ideological Politics,271138,Plan B distro,52,0,No,No,0,https://www.reddit.com/r/Anarchism/comments/1gqm4ic/plan_b_distro/,/r/Anarchism/comments/1gqm4ic/plan_b_distro/
ai,Anarchism,Ideological Politics,271138,STAYING ALIVE IS PUNK AS FUCK,647,47,No,No,0,https://www.reddit.com/r/Anarchism/comments/1gphrhm/staying_alive_is_punk_as_fuck/,/r/Anarchism/comments/1gphrhm/staying_alive_is_punk_as_fuck/
ai,Socialism,Ideological Politics,460996,"Recommend Me A YouTube Channel Thread for November, 2024",1,7,Yes,No,0,https://www.reddit.com/r/socialism/comments/1gqdis8/recommend_me_a_youtube_channel_thread_for/,/r/socialism/comments/1gqdis8/recommend_me_a_youtube_channel_thread_for/
ai,Socialism,Ideological Politics,460996,Stop condescendingly telling people to “read theory”,488,90,No,No,0,https://www.reddit.com/r/socialism/comments/1gr89t5/stop_condescendingly_telling_people_to_read_theory/,/r/socialism/comments/1gr89t5/stop_condescendingly_telling_people_to_read_theory/
ai,Socialism,Ideological Politics,460996,Disillusioned and loosing my mind.,22,11,No,No,0,https://www.reddit.com/r/socialism/comments/1grcvrg/disillusioned_and_loosing_my_mind/,/r/socialism/comments/1grcvrg/disillusioned_and_loosing_my_mind/
ai,Socialism,Ideological Politics,460996,Isn't The UK Labour Party a leftist party?,25,47,No,No,0,https://www.reddit.com/r/socialism/comments/1gr88hm/isnt_the_uk_labour_party_a_leftist_party/,/r/socialism/comments/1gr88hm/isnt_the_uk_labour_party_a_leftist_party/
ai,Socialism,Ideological Politics,460996,I hate western imperialism,52,23,No,No,0,https://www.reddit.com/r/socialism/comments/1gqw3mb/i_hate_western_imperialism/,/r/socialism/comments/1gqw3mb/i_hate_western_imperialism/
ai,Socialism,Ideological Politics,460996,Looking for ideas on how to radicalize prostitutes and sex slaves into rebellion.,1,4,No,No,0,https://www.reddit.com/r/socialism/comments/1grd3he/looking_for_ideas_on_how_to_radicalize/,/r/socialism/comments/1grd3he/looking_for_ideas_on_how_to_radicalize/
ai,Progressive,Ideological Politics,78071,Behind the Curtain: Trump's business bonanza,12,1,No,No,0,https://www.axios.com/2024/11/07/trump-elon-musk-business-tax-cuts,/r/progressive/comments/1gm4w17/behind_the_curtain_trumps_business_bonanza/
ai,Progressive,Ideological Politics,78071,Billionaires vs Democracy - The rich are trying to buy elections all over the world and consign democracy to the trash bin of history.,294,12,No,No,0,https://inequality.org/research/billionaires-vs-democracy/,/r/progressive/comments/1ggh1hg/billionaires_vs_democracy_the_rich_are_trying_to/
ai,Progressive,Ideological Politics,78071,A Texas Woman Died After Waiting 40 Hours for Miscarriage Care,296,6,No,No,0,https://www.propublica.org/article/josseli-barnica-death-miscarriage-texas-abortion-ban,/r/progressive/comments/1gfmamd/a_texas_woman_died_after_waiting_40_hours_for/
ai,Progressive,Ideological Politics,78071,These teachers often live in poverty. A pay raise could help — but there’s a cost,73,4,No,No,0,https://www.npr.org/2024/10/22/nx-s1-5144162/biden-preschool-head-start-teacher-poverty,/r/progressive/comments/1ga8u8y/these_teachers_often_live_in_poverty_a_pay_raise/
ai,Republicanism,Ideological Politics,918,Why are monarchists cherry-pickers?,6,0,No,No,0,https://www.reddit.com/r/republicanism/comments/1c22ytx/why_are_monarchists_cherrypickers/,/r/republicanism/comments/1c22ytx/why_are_monarchists_cherrypickers/
ai,Republicanism,Ideological Politics,918,Pro-British monarchy Indian Christian saying mocking the name-reverting done by our governments (especially the renaming of Bombay to Mumbai) and openly doing sedition by saying that Charles III should be the Emperor of India and 'God Save the King' should be the Indian anthem.,3,0,No,No,0,https://www.reddit.com/gallery/1b2xwq8,/r/republicanism/comments/1b2xwq8/probritish_monarchy_indian_christian_saying/
ai,Republicanism,Ideological Politics,918,“Away with college gen ed”,0,4,No,Yes,0,https://www.reddit.com/r/republicanism/comments/19asm4l/away_with_college_gen_ed/,/r/republicanism/comments/19asm4l/away_with_college_gen_ed/
ai,Republicanism,Ideological Politics,918,Question from a Monarchist,9,20,No,No,0,https://www.reddit.com/r/republicanism/comments/z0zqv0/question_from_a_monarchist/,/r/republicanism/comments/z0zqv0/question_from_a_monarchist/
ai,Conservatives,Ideological Politics,108264,AZ Judge Recuses Himself From 'Fake Electors' Case After Emails Surface Demanding Judges Defend Kamala,127,1,No,No,0,https://redstate.com/beccalower/2024/11/13/az-judge-recuses-himself-from-fake-electors-case-after-emails-surface-demanding-judges-defend-kamala-n2181972,/r/conservatives/comments/1gr41f3/az_judge_recuses_himself_from_fake_electors_case/
