Keyword,Subreddit,Category,Members,Title,Upvotes,Comments,Moderator Interaction,Fact-Checking Mention,Total Awards,URL,Original Post URL
black,News,General Politics,28915312,6.8 magnitude earthquake shakes Cuba after hurricanes and blackouts,11684,461,No,No,0,https://apnews.com/article/cuba-earthquake-hurricanes-natural-disaster-c28bbf4496a1bbe27a39f80728d63b2d,/r/news/comments/1go9c5c/68_magnitude_earthquake_shakes_cuba_after/
survey,PoliticalDiscussion,General Politics,2184592,Casual Questions Thread,43,4741,Yes,No,0,https://www.reddit.com/r/PoliticalDiscussion/comments/1bwbuka/casual_questions_thread/,/r/PoliticalDiscussion/comments/1bwbuka/casual_questions_thread/
vote,PoliticalDiscussion,General Politics,2184592,How likely is Trump to convert the US to a totalitarian dictatorship?,64,358,No,No,0,https://www.reddit.com/r/PoliticalDiscussion/comments/1gp56t4/how_likely_is_trump_to_convert_the_us_to_a/,/r/PoliticalDiscussion/comments/1gp56t4/how_likely_is_trump_to_convert_the_us_to_a/
vote,PoliticalDiscussion,General Politics,2184592,"Was Trump's win driven by an anti-incumbency sentiment? or was it a successful campaign strategy? had it been the former, would picking a candidate of the same party but not in the incumbent administration have levelled the playing field?",68,254,No,No,0,https://www.reddit.com/r/PoliticalDiscussion/comments/1goqx1f/was_trumps_win_driven_by_an_antiincumbency/,/r/PoliticalDiscussion/comments/1goqx1f/was_trumps_win_driven_by_an_antiincumbency/
vote,PoliticalDiscussion,General Politics,2184592,Did the plethora of state level abortion amendments neuter the impact of abortion in the presidential race?,95,196,No,No,0,https://www.reddit.com/r/PoliticalDiscussion/comments/1gonhzy/did_the_plethora_of_state_level_abortion/,/r/PoliticalDiscussion/comments/1gonhzy/did_the_plethora_of_state_level_abortion/
white,PoliticalDiscussion,General Politics,2184592,What are your thoughts on a purge of senior military by the incoming Trump administration?,567,517,No,Yes,0,https://www.reddit.com/r/PoliticalDiscussion/comments/1gnesig/what_are_your_thoughts_on_a_purge_of_senior/,/r/PoliticalDiscussion/comments/1gnesig/what_are_your_thoughts_on_a_purge_of_senior/
vote,NeutralPolitics,General Politics,610503,What to expect after the U.S. election,283,26,Yes,Yes,0,https://www.reddit.com/r/NeutralPolitics/comments/1gflxpk/what_to_expect_after_the_us_election/,/r/NeutralPolitics/comments/1gflxpk/what_to_expect_after_the_us_election/
vote,NeutralPolitics,General Politics,610503,Trump won the presidency and popular vote running on the mass deportation of illegal aliens. Who saw this coming and what lessons can be learned?,178,315,No,No,0,https://www.reddit.com/r/NeutralPolitics/comments/1gnk7ih/trump_won_the_presidency_and_popular_vote_running/,/r/NeutralPolitics/comments/1gnk7ih/trump_won_the_presidency_and_popular_vote_running/
poll,NeutralPolitics,General Politics,610503,Is now the time for a NEW moderate third party in U.S. politics?,0,70,No,No,0,https://www.reddit.com/r/NeutralPolitics/comments/1gms9so/is_now_the_time_for_a_new_moderate_third_party_in/,/r/NeutralPolitics/comments/1gms9so/is_now_the_time_for_a_new_moderate_third_party_in/
vote,NeutralPolitics,General Politics,610503,Why Are So Many Men Leaving The Democratic Party Over The Last Few Years?,377,156,No,No,0,https://www.reddit.com/r/NeutralPolitics/comments/1gklb9t/why_are_so_many_men_leaving_the_democratic_party/,/r/NeutralPolitics/comments/1gklb9t/why_are_so_many_men_leaving_the_democratic_party/
vote,NeutralPolitics,General Politics,610503,"What are the pros and cons of predictive election models, like 538, for our discourse around elections?",43,94,No,No,0,https://www.reddit.com/r/NeutralPolitics/comments/1giqib5/what_are_the_pros_and_cons_of_predictive_election/,/r/NeutralPolitics/comments/1giqib5/what_are_the_pros_and_cons_of_predictive_election/
vote,NeutralPolitics,General Politics,610503,Why are there organizations whose only goal is to make sure people vote? ,50,36,No,No,0,https://www.reddit.com/r/NeutralPolitics/comments/1ggtk67/why_are_there_organizations_whose_only_goal_is_to/,/r/NeutralPolitics/comments/1ggtk67/why_are_there_organizations_whose_only_goal_is_to/
vote,NeutralPolitics,General Politics,610503,Has there been any investigative journalism or public legal discovery to examine process irregularities regarding the 2020 election?,11,15,No,No,0,https://www.reddit.com/r/NeutralPolitics/comments/1ggkpzr/has_there_been_any_investigative_journalism_or/,/r/NeutralPolitics/comments/1ggkpzr/has_there_been_any_investigative_journalism_or/
vote,moderatepolitics,General Politics,296083,Trump wins biggest popular vote count by a Republican ever in history,393,701,No,No,0,https://nypost.com/2024/11/10/us-news/donald-trump-wins-most-popular-votes-by-a-republican-ever/,/r/moderatepolitics/comments/1gowcyo/trump_wins_biggest_popular_vote_count_by_a/
Texas,moderatepolitics,General Politics,296083,"Judge says New York can't use 'antiquated, unconstitutional' law to block migrant buses from Texas",212,192,No,No,0,https://abcnews.go.com/US/wireStory/judge-new-york-antiquated-unconstitutional-law-block-migrant-115661358,/r/moderatepolitics/comments/1govzpd/judge_says_new_york_cant_use_antiquated/
white,technology,General Politics,17385331,U.S. Advocates Urge White House Support for 'RISE' Initiative to Keep U.S. Ahead in 'Edge Science' - The Debrief,185,40,No,No,0,https://thedebrief.org/u-s-advocates-urge-white-house-support-for-rise-initiative-to-keep-u-s-ahead-in-edge-science/,/r/technology/comments/1gp0pbp/us_advocates_urge_white_house_support_for_rise/
vote,democrats,Ideological Politics,480491,Can’t believe some vets voted for him. ,814,64,No,No,0,https://i.redd.it/v8zgrbrj8c0e1.jpeg,/r/democrats/comments/1gp3b0k/cant_believe_some_vets_voted_for_him/
vote,democrats,Ideological Politics,480491,"Holy shit: Trump voter says, 'I consider him like Hitler, but I voted for the man.'",803,283,No,No,0,https://i.redd.it/1s6mp3jp6b0e1.jpeg,/r/democrats/comments/1goy1rb/holy_shit_trump_voter_says_i_consider_him_like/
vote,democrats,Ideological Politics,480491,"AZ still has 200,000 votes by mail! And their court won’t allow extension of time to “cure” signatures.",940,88,No,No,0,https://apnews.com/article/648adc7d3a0439eec756f4cf2e6eb10d,/r/democrats/comments/1gov13c/az_still_has_200000_votes_by_mail_and_their_court/
vote,democrats,Ideological Politics,480491,You were cheated out of a free and fair democratic election. Everyday up until election day.,820,94,No,Yes,0,https://i.redd.it/da3t9ximz90e1.jpeg,/r/democrats/comments/1goscrp/you_were_cheated_out_of_a_free_and_fair/
Arizona,democrats,Ideological Politics,480491,Gallego defeats lake in Arizona race !!!!,940,44,No,No,0,https://thehill.com/homenews/campaign/4969256-ruben-gallego-defeats-kari-lake/,/r/democrats/comments/1goq3ea/gallego_defeats_lake_in_arizona_race/
Texas,Republican,Ideological Politics,205100,How Is this Ok ? ,214,41,No,No,0,https://www.reddit.com/gallery/1gowak2,/r/Republican/comments/1gowak2/how_is_this_ok/
Texas,Republican,Ideological Politics,205100,"Republicans flipped 23 Democrat-held seats in five appellate courts across Texas, winning 25 of 26 contested courts of appeals races on Tuesday’s ballot.",192,6,No,No,0,https://texasscorecard.com/state/monumental-win-republicans-flip-23-texas-appeals-court-seats/,/r/Republican/comments/1gouker/republicans_flipped_23_democratheld_seats_in_five/
vote,Republican,Ideological Politics,205100,Lying Corporate Media Are Responsible For Kamala Voters’ Delusional Despair,123,17,No,No,0,https://thefederalist.com/2024/11/11/lying-corporate-media-is-responsible-for-kamala-voters-delusional-despair/,/r/Republican/comments/1gotx0n/lying_corporate_media_are_responsible_for_kamala/
vote,Conservative,Ideological Politics,1144947,Apparently the left now believe in election fraud,638,188,No,No,0,https://www.reddit.com/r/Conservative/comments/1gp67if/apparently_the_left_now_believe_in_election_fraud/,/r/Conservative/comments/1gp67if/apparently_the_left_now_believe_in_election_fraud/
vote,Libertarian,Ideological Politics,503604,What do we do?,14,39,No,No,0,https://www.reddit.com/r/Libertarian/comments/1gp24tr/what_do_we_do/,/r/Libertarian/comments/1gp24tr/what_do_we_do/
vote,Libertarian,Ideological Politics,503604,Don't Vote! | Dave Smith On: Voting,14,21,No,No,0,https://youtu.be/e-gdPGrRM2I?si=rXa3V3FrcWVpfjsu,/r/Libertarian/comments/1goi568/dont_vote_dave_smith_on_voting/
white,Anarchism,Ideological Politics,270997,"Im a disabled person, and im begging you to get informed about covid.",308,103,No,No,0,https://www.reddit.com/r/Anarchism/comments/1goj9ja/im_a_disabled_person_and_im_begging_you_to_get/,/r/Anarchism/comments/1goj9ja/im_a_disabled_person_and_im_begging_you_to_get/
black,Anarchism,Ideological Politics,270997,want to buy anarchist stickers,11,10,No,No,0,https://www.reddit.com/r/Anarchism/comments/1goca8x/want_to_buy_anarchist_stickers/,/r/Anarchism/comments/1goca8x/want_to_buy_anarchist_stickers/
vote,Anarchism,Ideological Politics,270997,The fact that an aspiring autocrat has won an election does not oblige us to submit to him. No one should excuse being complicit in tyranny on the grounds that other people voted for it.,217,2,No,No,0,/r/CrimethInc/comments/1gnj01a/the_fact_that_an_aspiring_autocrat_has_won_an/,/r/Anarchism/comments/1gnj0d0/the_fact_that_an_aspiring_autocrat_has_won_an/
vote,Socialism,Ideological Politics,460772,Bridging the Liberal Socialist Divide ,97,23,No,No,0,https://www.reddit.com/r/socialism/comments/1gowl7m/bridging_the_liberal_socialist_divide/,/r/socialism/comments/1gowl7m/bridging_the_liberal_socialist_divide/
vote,Progressive,Ideological Politics,78038,Americans in Puerto Rico can't vote for US president. Their anger at Trump is shaping the race.,344,31,No,No,0,https://apnews.com/article/puerto-rico-trump-joke-garbage-a91e2aafd93a06d32365efa013581b85,/r/progressive/comments/1gh2ab4/americans_in_puerto_rico_cant_vote_for_us/
Texas,Progressive,Ideological Politics,78038,A Texas Woman Died After Waiting 40 Hours for Miscarriage Care,296,5,No,No,0,https://www.propublica.org/article/josseli-barnica-death-miscarriage-texas-abortion-ban,/r/progressive/comments/1gfmamd/a_texas_woman_died_after_waiting_40_hours_for/
michigan,Progressive,Ideological Politics,78038,20k+ attend Michigan Rally,141,2,No,No,0,https://i.redd.it/ywmuqgzbhlxd1.jpeg,/r/progressive/comments/1gelsyg/20k_attend_michigan_rally/
survey,Republicanism,Ideological Politics,917,Survey about your political worldview (18+; 12-14 mins to complete),3,0,No,No,0,https://www.reddit.com/r/republicanism/comments/1aq418a/survey_about_your_political_worldview_18_1214/,/r/republicanism/comments/1aq418a/survey_about_your_political_worldview_18_1214/
vote,Republicanism,Ideological Politics,917,About the Lopez,4,2,No,No,0,https://www.reddit.com/r/republicanism/comments/1094bh5/about_the_lopez/,/r/republicanism/comments/1094bh5/about_the_lopez/
black,Conservatives,Ideological Politics,108231,Young Black and Latino Men Say They Chose Trump Because of the Economy and Jobs. Here's How and Why,50,2,No,No,0,https://www.newsmax.com/finance/streettalk/young-black-latino-men-trump-economy-jobs/2024/11/10/id/1187447/,/r/conservatives/comments/1govnjt/young_black_and_latino_men_say_they_chose_trump/
vote,dailywire,Ideological Politics,24169,19 year old here. So I'm Gen Z. I am a female!,62,5,No,No,0,https://www.youtube.com/watch?v=ybgV3jSNKEE,/r/dailywire/comments/1gokaic/19_year_old_here_so_im_gen_z_i_am_a_female/
Arizona,Liberal,Ideological Politics,119756,Arizona AG says she won't drop state's fake electors case against Trump allies,397,18,No,No,0,https://www.upi.com/Top_News/US/2024/11/10/Arizona-fake-electors-case/4001731292312/,/r/Liberal/comments/1gosjeh/arizona_ag_says_she_wont_drop_states_fake/
vote,Liberal,Ideological Politics,119756,What I think needs changing,18,97,No,No,0,https://www.reddit.com/r/Liberal/comments/1goxogz/what_i_think_needs_changing/,/r/Liberal/comments/1goxogz/what_i_think_needs_changing/
vote,Liberal,Ideological Politics,119756,Glad to see we have visitors.,66,44,No,Yes,0,https://www.reddit.com/r/Liberal/comments/1gon2jn/glad_to_see_we_have_visitors/,/r/Liberal/comments/1gon2jn/glad_to_see_we_have_visitors/
vote,Liberal,Ideological Politics,119756,Why were the polls so wrong?,128,162,No,No,0,https://www.reddit.com/r/Liberal/comments/1go7sv1/why_were_the_polls_so_wrong/,/r/Liberal/comments/1go7sv1/why_were_the_polls_so_wrong/
vote,Liberal,Ideological Politics,119756,I keep hearing theories about how 15m people staying home didn't actually stay home and I'm not buying it.,313,346,No,No,0,https://www.reddit.com/r/Liberal/comments/1gnrlns/i_keep_hearing_theories_about_how_15m_people/,/r/Liberal/comments/1gnrlns/i_keep_hearing_theories_about_how_15m_people/
vote,Liberal,Ideological Politics,119756,"My liberal parents say they will no longer watch any political news on TV, nor will they ever vote in another election.",489,248,No,No,0,https://www.reddit.com/r/Liberal/comments/1gnof4d/my_liberal_parents_say_they_will_no_longer_watch/,/r/Liberal/comments/1gnof4d/my_liberal_parents_say_they_will_no_longer_watch/
vote,Liberal,Ideological Politics,119756,America will NOT elect a woman President.,274,401,No,No,0,https://www.reddit.com/r/Liberal/comments/1gnhckm/america_will_not_elect_a_woman_president/,/r/Liberal/comments/1gnhckm/america_will_not_elect_a_woman_president/
vote,Liberal,Ideological Politics,119756,"Liberals need to stop blaming themselves, and stop blaming Trump voters",148,116,No,Yes,0,https://www.reddit.com/r/Liberal/comments/1gnk7ug/liberals_need_to_stop_blaming_themselves_and_stop/,/r/Liberal/comments/1gnk7ug/liberals_need_to_stop_blaming_themselves_and_stop/
white,Liberal,Ideological Politics,119756,We're all in this together,60,51,No,No,0,https://www.reddit.com/r/Liberal/comments/1gnpdn0/were_all_in_this_together/,/r/Liberal/comments/1gnpdn0/were_all_in_this_together/
vote,Liberal,Ideological Politics,119756,The House is still in play and you can help by curing votes!,29,0,No,No,0,https://votesaveamerica.com/,/r/Liberal/comments/1gnlz7c/the_house_is_still_in_play_and_you_can_help_by/
vote,KamalaHarris,Ideological Politics,76065,...STARLINK was used to transmit votes??,1983,696,No,No,0,https://abc30.com/post/tulare-county-sees-larger-voter-turnout-during-2024-presidential-election/15519472/,/r/KamalaHarris/comments/1gnswq9/starlink_was_used_to_transmit_votes/
vote,KamalaHarris,Ideological Politics,76065,Pennsylvania looking in to fraudulent votes,1662,274,No,No,0,https://cbs6albany.com/news/nation-world/pennsylvania-da-finds-fraud-in-hundreds-of-voter-registrations-amid-ongoing-investigations-lancaster-county-district-attorneys-office-heather-adams,/r/KamalaHarris/comments/1gnmynj/pennsylvania_looking_in_to_fraudulent_votes/
vote,Impeach_Trump,Ideological Politics,60566,This is an amazing article written by user u/SilkyFluffs in r/democrats which is an amazing resource for combating GOP and Trump misinformation and possibly even converting family members or undecided voters,45,0,No,Yes,0,https://pdflink.to/d6e0bc9d/,/r/Impeach_Trump/comments/1ggd0pc/this_is_an_amazing_article_written_by_user/
