Keyword,Subreddit,Category,Members,Title,Upvotes,Comments,Moderator Interaction,Fact-Checking Mention,Total Awards,URL,Original Post URL
michigan,News,General Politics,28920699,Demonstrators wave Nazi flags outside local theater performance of ‘The Diary of Anne Frank’ in Michigan,19606,1912,No,No,0,https://www.cnn.com/2024/11/12/us/michigan-nazi-flags-anne-frank-theater/index.html,/r/news/comments/1gpmin5/demonstrators_wave_nazi_flags_outside_local/
Wisconsin,News,General Politics,28920699,Wisconsin man accused of hurling baby against wall because he was losing in NBA video game,15943,1329,No,No,0,https://www.the-independent.com/news/world/americas/crime/wisconsin-jalin-white-arrest-nba2k-b2645350.html,/r/news/comments/1gplbjw/wisconsin_man_accused_of_hurling_baby_against/
Wisconsin,News,General Politics,28920699,"Missing Wisconsin kayaker likely faked his own death, fled to Europe; charges are possible: Sheriff",2518,210,No,No,0,https://abcnews.go.com/US/missing-wisconsin-kayaker-faked-death-fled-europe/story?id=11576703,/r/news/comments/1gpq7ak/missing_wisconsin_kayaker_likely_faked_his_own/
male,News,General Politics,28920699,Magic Circle on the hunt for first female member who tricked her way into society - to apologise to her,132,25,No,No,0,https://news.sky.com/story/magic-circle-on-the-hunt-for-first-female-member-who-tricked-her-way-into-society-to-apologise-to-her-13253259,/r/news/comments/1gpvslm/magic_circle_on_the_hunt_for_first_female_member/
survey,PoliticalDiscussion,General Politics,2184631,Casual Questions Thread,42,4765,Yes,No,0,https://www.reddit.com/r/PoliticalDiscussion/comments/1bwbuka/casual_questions_thread/,/r/PoliticalDiscussion/comments/1bwbuka/casual_questions_thread/
vote,PoliticalDiscussion,General Politics,2184631,How likely is Trump to convert the US to a totalitarian dictatorship?,317,1285,No,No,0,https://www.reddit.com/r/PoliticalDiscussion/comments/1gp56t4/how_likely_is_trump_to_convert_the_us_to_a/,/r/PoliticalDiscussion/comments/1gp56t4/how_likely_is_trump_to_convert_the_us_to_a/
vote,PoliticalDiscussion,General Politics,2184631,"Was Trump's win driven by an anti-incumbency sentiment? or was it a successful campaign strategy? had it been the former, would picking a candidate of the same party but not in the incumbent administration have levelled the playing field?",95,308,No,No,0,https://www.reddit.com/r/PoliticalDiscussion/comments/1goqx1f/was_trumps_win_driven_by_an_antiincumbency/,/r/PoliticalDiscussion/comments/1goqx1f/was_trumps_win_driven_by_an_antiincumbency/
vote,PoliticalDiscussion,General Politics,2184631,Did the plethora of state level abortion amendments neuter the impact of abortion in the presidential race?,112,207,No,No,0,https://www.reddit.com/r/PoliticalDiscussion/comments/1gonhzy/did_the_plethora_of_state_level_abortion/,/r/PoliticalDiscussion/comments/1gonhzy/did_the_plethora_of_state_level_abortion/
vote,NeutralPolitics,General Politics,610626,What to expect after the U.S. election,281,26,Yes,Yes,0,https://www.reddit.com/r/NeutralPolitics/comments/1gflxpk/what_to_expect_after_the_us_election/,/r/NeutralPolitics/comments/1gflxpk/what_to_expect_after_the_us_election/
vote,NeutralPolitics,General Politics,610626,Trump won the presidency and popular vote running on the mass deportation of illegal aliens. Who saw this coming and what lessons can be learned?,201,326,No,No,0,https://www.reddit.com/r/NeutralPolitics/comments/1gnk7ih/trump_won_the_presidency_and_popular_vote_running/,/r/NeutralPolitics/comments/1gnk7ih/trump_won_the_presidency_and_popular_vote_running/
poll,NeutralPolitics,General Politics,610626,Is now the time for a NEW moderate third party in U.S. politics?,0,73,No,No,0,https://www.reddit.com/r/NeutralPolitics/comments/1gms9so/is_now_the_time_for_a_new_moderate_third_party_in/,/r/NeutralPolitics/comments/1gms9so/is_now_the_time_for_a_new_moderate_third_party_in/
vote,NeutralPolitics,General Politics,610626,Why Are So Many Men Leaving The Democratic Party Over The Last Few Years?,386,156,No,No,0,https://www.reddit.com/r/NeutralPolitics/comments/1gklb9t/why_are_so_many_men_leaving_the_democratic_party/,/r/NeutralPolitics/comments/1gklb9t/why_are_so_many_men_leaving_the_democratic_party/
vote,NeutralPolitics,General Politics,610626,"What are the pros and cons of predictive election models, like 538, for our discourse around elections?",40,94,No,No,0,https://www.reddit.com/r/NeutralPolitics/comments/1giqib5/what_are_the_pros_and_cons_of_predictive_election/,/r/NeutralPolitics/comments/1giqib5/what_are_the_pros_and_cons_of_predictive_election/
vote,NeutralPolitics,General Politics,610626,Why are there organizations whose only goal is to make sure people vote? ,50,36,No,No,0,https://www.reddit.com/r/NeutralPolitics/comments/1ggtk67/why_are_there_organizations_whose_only_goal_is_to/,/r/NeutralPolitics/comments/1ggtk67/why_are_there_organizations_whose_only_goal_is_to/
vote,NeutralPolitics,General Politics,610626,Has there been any investigative journalism or public legal discovery to examine process irregularities regarding the 2020 election?,11,15,No,No,0,https://www.reddit.com/r/NeutralPolitics/comments/1ggkpzr/has_there_been_any_investigative_journalism_or/,/r/NeutralPolitics/comments/1ggkpzr/has_there_been_any_investigative_journalism_or/
poll,moderatepolitics,General Politics,296200,Ann Selzer Vows Changes After Iowa Poll Wrong by 16 Points,204,85,No,No,0,https://www.newsweek.com/ann-selzer-iowa-vows-changes-poll-wrong-1981297,/r/moderatepolitics/comments/1gpsaoq/ann_selzer_vows_changes_after_iowa_poll_wrong_by/
vote,moderatepolitics,General Politics,296200,Trump wins biggest popular vote count by a Republican ever in history,560,820,No,No,0,https://nypost.com/2024/11/10/us-news/donald-trump-wins-most-popular-votes-by-a-republican-ever/,/r/moderatepolitics/comments/1gowcyo/trump_wins_biggest_popular_vote_count_by_a/
Texas,moderatepolitics,General Politics,296200,"Judge says New York can't use 'antiquated, unconstitutional' law to block migrant buses from Texas",271,232,No,No,0,https://abcnews.go.com/US/wireStory/judge-new-york-antiquated-unconstitutional-law-block-migrant-115661358,/r/moderatepolitics/comments/1govzpd/judge_says_new_york_cant_use_antiquated/
vote,democrats,Ideological Politics,480532,"Harris did not lose because of young white men or immigration or “wokeism”. It was the economy, stupid.",440,375,No,No,0,https://www.ft.com/content/e8ac09ea-c300-4249-af7d-109003afb893,/r/democrats/comments/1gpn6ue/harris_did_not_lose_because_of_young_white_men_or/
Arizona,democrats,Ideological Politics,480532,Democrat Ruben Gallego beats far-right Republican Kari Lake to win Arizona senate seat ,512,21,No,No,0,https://www.theguardian.com/us-news/2024/nov/12/us-election-arizona-senate-race-ruben-gallego-kari-lake,/r/democrats/comments/1gpjd4c/democrat_ruben_gallego_beats_farright_republican/
vote,democrats,Ideological Politics,480532,Import tips,102,28,No,No,0,https://i.redd.it/0dybxs2nji0e1.png,/r/democrats/comments/1gprizf/import_tips/
white,Republican,Ideological Politics,205181,Melania Declines White House Meeting with Jill Biden for a Startling Reason – Booyah !!!,148,22,No,No,0,https://pjmedia.com/robert-spencer/2024/11/12/she-aint-going-melania-declines-white-house-meeting-with-jill-biden-for-a-startling-reason-n4934197,/r/Republican/comments/1gpn3ei/melania_declines_white_house_meeting_with_jill/
vote,Libertarian,Ideological Politics,503643,How should an Eastern European libertarian vote ?,55,16,No,No,0,https://www.reddit.com/gallery/1gpj52l,/r/Libertarian/comments/1gpj52l/how_should_an_eastern_european_libertarian_vote/
rural,Anarchism,Ideological Politics,271045,STAYING ALIVE IS PUNK AS FUCK,389,34,No,No,0,https://www.reddit.com/r/Anarchism/comments/1gphrhm/staying_alive_is_punk_as_fuck/,/r/Anarchism/comments/1gphrhm/staying_alive_is_punk_as_fuck/
Texas,Anarchism,Ideological Politics,271045,What can a 13 year old do,49,20,No,No,0,https://www.reddit.com/r/Anarchism/comments/1gpderb/what_can_a_13_year_old_do/,/r/Anarchism/comments/1gpderb/what_can_a_13_year_old_do/
white,Anarchism,Ideological Politics,271045,"Im a disabled person, and im begging you to get informed about covid.",407,137,No,No,0,https://www.reddit.com/r/Anarchism/comments/1goj9ja/im_a_disabled_person_and_im_begging_you_to_get/,/r/Anarchism/comments/1goj9ja/im_a_disabled_person_and_im_begging_you_to_get/
vote,Socialism,Ideological Politics,460868,Best Socialist org in the USA to join?,276,106,No,No,0,https://www.reddit.com/r/socialism/comments/1gpabtf/best_socialist_org_in_the_usa_to_join/,/r/socialism/comments/1gpabtf/best_socialist_org_in_the_usa_to_join/
poll,Socialism,Ideological Politics,460868,"Serious question, Is China really that homophobic? What are homosexual people's rights actually like in China?",15,5,No,Yes,0,https://www.reddit.com/r/socialism/comments/1gpm4pr/serious_question_is_china_really_that_homophobic/,/r/socialism/comments/1gpm4pr/serious_question_is_china_really_that_homophobic/
vote,Socialism,Ideological Politics,460868,What to do when individuals you're engaging with turn out to express intense racism?,41,19,No,No,0,https://www.reddit.com/r/socialism/comments/1gped6k/what_to_do_when_individuals_youre_engaging_with/,/r/socialism/comments/1gped6k/what_to_do_when_individuals_youre_engaging_with/
vote,Progressive,Ideological Politics,78043,Americans in Puerto Rico can't vote for US president. Their anger at Trump is shaping the race.,344,31,No,No,0,https://apnews.com/article/puerto-rico-trump-joke-garbage-a91e2aafd93a06d32365efa013581b85,/r/progressive/comments/1gh2ab4/americans_in_puerto_rico_cant_vote_for_us/
Texas,Progressive,Ideological Politics,78043,A Texas Woman Died After Waiting 40 Hours for Miscarriage Care,294,5,No,No,0,https://www.propublica.org/article/josseli-barnica-death-miscarriage-texas-abortion-ban,/r/progressive/comments/1gfmamd/a_texas_woman_died_after_waiting_40_hours_for/
michigan,Progressive,Ideological Politics,78043,20k+ attend Michigan Rally,138,2,No,No,0,https://i.redd.it/ywmuqgzbhlxd1.jpeg,/r/progressive/comments/1gelsyg/20k_attend_michigan_rally/
survey,Republicanism,Ideological Politics,917,Survey about your political worldview (18+; 12-14 mins to complete),3,0,No,No,0,https://www.reddit.com/r/republicanism/comments/1aq418a/survey_about_your_political_worldview_18_1214/,/r/republicanism/comments/1aq418a/survey_about_your_political_worldview_18_1214/
vote,Republicanism,Ideological Politics,917,About the Lopez,4,2,No,No,0,https://www.reddit.com/r/republicanism/comments/1094bh5/about_the_lopez/,/r/republicanism/comments/1094bh5/about_the_lopez/
Texas,Conservatives,Ideological Politics,108238,One at a Time Is How Republicans Keep Winning - Fed Up Average American Wins Texas House Seat,46,0,No,No,0,https://redstate.com/beckynoble/2024/11/11/one-at-a-time-is-how-republicans-keep-winning-fed-up-average-american-wins-texas-house-seat-n2181839,/r/conservatives/comments/1gpr0lb/one_at_a_time_is_how_republicans_keep_winning_fed/
white,Conservatives,Ideological Politics,108238,"Melania Trump declines to meet with Jill Biden at White House, citing Mar-a-Lago raid: source",443,43,No,No,0,https://nypost.com/2024/11/11/us-news/melania-trump-declines-to-meet-with-jill-biden-at-white-house-citing-mar-a-lago-raid-source/,/r/conservatives/comments/1gpaxk5/melania_trump_declines_to_meet_with_jill_biden_at/
vote,Conservatives,Ideological Politics,108238,Reddit's front page accuses hispanics of misogyny because they didn't vote for Kamala,130,18,No,No,0,https://thehill.com/opinion/columnists/juan-williams/4980787-latino-men-just-didnt-want-a-woman-president/,/r/conservatives/comments/1gpgvb1/reddits_front_page_accuses_hispanics_of_misogyny/
latino,dailywire,Ideological Politics,24191,"I’m a Latino, I’m legal, I follow the Law. This guy is talking a Lot of BS",120,56,No,No,0,https://v.redd.it/d90m6cxd6e0e1,/r/dailywire/comments/1gpbrqh/im_a_latino_im_legal_i_follow_the_law_this_guy_is/
vote,dailywire,Ideological Politics,24191,19 year old here. So I'm Gen Z. I am a female!,72,6,No,No,0,https://www.youtube.com/watch?v=ybgV3jSNKEE,/r/dailywire/comments/1gokaic/19_year_old_here_so_im_gen_z_i_am_a_female/
vote,Liberal,Ideological Politics,119793,Who were the 9M Biden 2020 voters who stayed home this year and what are their reasons? 90% did not vote for Trump last week.,36,44,No,No,0,https://cardinalnews.org/2024/11/11/the-key-election-statistic-many-democrats-simply-didnt-vote/,/r/Liberal/comments/1gpubmj/who_were_the_9m_biden_2020_voters_who_stayed_home/
Arizona,Liberal,Ideological Politics,119793,Arizona AG says she won't drop state's fake electors case against Trump allies,520,20,No,No,0,https://www.upi.com/Top_News/US/2024/11/10/Arizona-fake-electors-case/4001731292312/,/r/Liberal/comments/1gosjeh/arizona_ag_says_she_wont_drop_states_fake/
vote,Liberal,Ideological Politics,119793,What I think needs changing,39,138,No,No,0,https://www.reddit.com/r/Liberal/comments/1goxogz/what_i_think_needs_changing/,/r/Liberal/comments/1goxogz/what_i_think_needs_changing/
vote,Liberal,Ideological Politics,119793,Glad to see we have visitors.,117,75,No,Yes,0,https://www.reddit.com/r/Liberal/comments/1gon2jn/glad_to_see_we_have_visitors/,/r/Liberal/comments/1gon2jn/glad_to_see_we_have_visitors/
male,Liberal,Ideological Politics,119793,I've always wanted to see a woman President in my lifetime.,0,10,No,No,0,https://www.reddit.com/r/Liberal/comments/1gpsp2s/ive_always_wanted_to_see_a_woman_president_in_my/,/r/Liberal/comments/1gpsp2s/ive_always_wanted_to_see_a_woman_president_in_my/
vote,Liberal,Ideological Politics,119793,Why were the polls so wrong?,157,172,No,No,0,https://www.reddit.com/r/Liberal/comments/1go7sv1/why_were_the_polls_so_wrong/,/r/Liberal/comments/1go7sv1/why_were_the_polls_so_wrong/
vote,Liberal,Ideological Politics,119793,I keep hearing theories about how 15m people staying home didn't actually stay home and I'm not buying it.,329,361,No,No,0,https://www.reddit.com/r/Liberal/comments/1gnrlns/i_keep_hearing_theories_about_how_15m_people/,/r/Liberal/comments/1gnrlns/i_keep_hearing_theories_about_how_15m_people/
vote,Liberal,Ideological Politics,119793,"My liberal parents say they will no longer watch any political news on TV, nor will they ever vote in another election.",504,254,No,No,0,https://www.reddit.com/r/Liberal/comments/1gnof4d/my_liberal_parents_say_they_will_no_longer_watch/,/r/Liberal/comments/1gnof4d/my_liberal_parents_say_they_will_no_longer_watch/
white,KamalaHarris,Ideological Politics,75868,Kamala Harris greeted as she returns to the White House,725,65,No,No,0,https://v.redd.it/qhewboav9j0e1,/r/KamalaHarris/comments/1gpv41o/kamala_harris_greeted_as_she_returns_to_the_white/
vote,KamalaHarris,Ideological Politics,75868,Kamala Harris *Did* Listen To Working-Class Voters. And They Didn't Listen to Her Opponent.,401,22,No,No,0,https://washingtonmonthly.substack.com/p/kamala-harris-did-listen-to-working,/r/KamalaHarris/comments/1gpves2/kamala_harris_did_listen_to_workingclass_voters/
vote,KamalaHarris,Ideological Politics,75868,"NEVADA VOTERS: Over 10,000 mail-in ballots in Nevada are at risk of being rejected. But if voters cure their ballots by 5 pm PT today, their votes will be counted. Check your status here.  Please share!",1071,60,No,No,0,https://www.nvsos.gov/sos/elections/voters/cure,/r/KamalaHarris/comments/1gpnmvb/nevada_voters_over_10000_mailin_ballots_in_nevada/
vote,Impeach_Trump,Ideological Politics,60562,This is an amazing article written by user u/SilkyFluffs in r/democrats which is an amazing resource for combating GOP and Trump misinformation and possibly even converting family members or undecided voters,43,0,No,Yes,0,https://pdflink.to/d6e0bc9d/,/r/Impeach_Trump/comments/1ggd0pc/this_is_an_amazing_article_written_by_user/
