Keyword,Subreddit,Category,Members,Title,Upvotes,Comments,Moderator Interaction,Fact-Checking Mention,Total Awards,URL,Original Post URL
poll,News,General Politics,28926290,Delhi pollution: 'Apocalyptic' air engulfs Indian capital as subcontinent chokes on toxic smog,1099,132,No,No,0,https://bbc.com/news/articles/c0k8dxpr8x5o,/r/news/comments/1gqg13q/delhi_pollution_apocalyptic_air_engulfs_indian/
survey,PoliticalDiscussion,General Politics,2184669,Casual Questions Thread,47,4815,Yes,No,0,https://www.reddit.com/r/PoliticalDiscussion/comments/1bwbuka/casual_questions_thread/,/r/PoliticalDiscussion/comments/1bwbuka/casual_questions_thread/
vote,PoliticalDiscussion,General Politics,2184669,What can the electorate or legislators do in cases of Executive Branch Scandals or Convictions? ,11,14,No,No,0,https://www.reddit.com/r/PoliticalDiscussion/comments/1gqgb8t/what_can_the_electorate_or_legislators_do_in/,/r/PoliticalDiscussion/comments/1gqgb8t/what_can_the_electorate_or_legislators_do_in/
vote,PoliticalDiscussion,General Politics,2184669,"In 2016, Republicans controlled the House and Senate with larger margins over Democrats than they have in 2024. What does this potentially mean for proposed changes that may land on the floor?",60,29,No,No,0,https://www.reddit.com/r/PoliticalDiscussion/comments/1gq3dwr/in_2016_republicans_controlled_the_house_and/,/r/PoliticalDiscussion/comments/1gq3dwr/in_2016_republicans_controlled_the_house_and/
vote,PoliticalDiscussion,General Politics,2184669,How likely is Trump to convert the US to a totalitarian dictatorship?,375,1465,No,No,0,https://www.reddit.com/r/PoliticalDiscussion/comments/1gp56t4/how_likely_is_trump_to_convert_the_us_to_a/,/r/PoliticalDiscussion/comments/1gp56t4/how_likely_is_trump_to_convert_the_us_to_a/
vote,NeutralPolitics,General Politics,610658,What to expect after the U.S. election,284,26,Yes,Yes,0,https://www.reddit.com/r/NeutralPolitics/comments/1gflxpk/what_to_expect_after_the_us_election/,/r/NeutralPolitics/comments/1gflxpk/what_to_expect_after_the_us_election/
vote,NeutralPolitics,General Politics,610658,Tracking what bills/decisions are coming to contact reps/senators in a timely manner,8,2,No,No,0,https://www.reddit.com/r/NeutralPolitics/comments/1gqkpdp/tracking_what_billsdecisions_are_coming_to/,/r/NeutralPolitics/comments/1gqkpdp/tracking_what_billsdecisions_are_coming_to/
vote,NeutralPolitics,General Politics,610658,Do any countries have laws to combat politically-driven misinformation?,0,10,No,Yes,0,https://www.reddit.com/r/NeutralPolitics/comments/1gq4agt/do_any_countries_have_laws_to_combat/,/r/NeutralPolitics/comments/1gq4agt/do_any_countries_have_laws_to_combat/
vote,NeutralPolitics,General Politics,610658,Trump won the presidency and popular vote running on the mass deportation of illegal aliens. Who saw this coming and what lessons can be learned?,219,326,No,No,0,https://www.reddit.com/r/NeutralPolitics/comments/1gnk7ih/trump_won_the_presidency_and_popular_vote_running/,/r/NeutralPolitics/comments/1gnk7ih/trump_won_the_presidency_and_popular_vote_running/
poll,NeutralPolitics,General Politics,610658,Is now the time for a NEW moderate third party in U.S. politics?,0,73,No,No,0,https://www.reddit.com/r/NeutralPolitics/comments/1gms9so/is_now_the_time_for_a_new_moderate_third_party_in/,/r/NeutralPolitics/comments/1gms9so/is_now_the_time_for_a_new_moderate_third_party_in/
vote,NeutralPolitics,General Politics,610658,Why Are So Many Men Leaving The Democratic Party Over The Last Few Years?,379,156,No,No,0,https://www.reddit.com/r/NeutralPolitics/comments/1gklb9t/why_are_so_many_men_leaving_the_democratic_party/,/r/NeutralPolitics/comments/1gklb9t/why_are_so_many_men_leaving_the_democratic_party/
vote,NeutralPolitics,General Politics,610658,"What are the pros and cons of predictive election models, like 538, for our discourse around elections?",41,94,No,No,0,https://www.reddit.com/r/NeutralPolitics/comments/1giqib5/what_are_the_pros_and_cons_of_predictive_election/,/r/NeutralPolitics/comments/1giqib5/what_are_the_pros_and_cons_of_predictive_election/
vote,NeutralPolitics,General Politics,610658,Why are there organizations whose only goal is to make sure people vote? ,50,36,No,No,0,https://www.reddit.com/r/NeutralPolitics/comments/1ggtk67/why_are_there_organizations_whose_only_goal_is_to/,/r/NeutralPolitics/comments/1ggtk67/why_are_there_organizations_whose_only_goal_is_to/
vote,NeutralPolitics,General Politics,610658,Has there been any investigative journalism or public legal discovery to examine process irregularities regarding the 2020 election?,10,15,No,No,0,https://www.reddit.com/r/NeutralPolitics/comments/1ggkpzr/has_there_been_any_investigative_journalism_or/,/r/NeutralPolitics/comments/1ggkpzr/has_there_been_any_investigative_journalism_or/
white,moderatepolitics,General Politics,296409,Trump to name William McGinley to be White House counsel,84,56,No,No,0,https://www.nbcnews.com/politics/donald-trump/trump-name-william-mcginley-white-house-counsel-rcna179892,/r/moderatepolitics/comments/1gq4zng/trump_to_name_william_mcginley_to_be_white_house/
poll,moderatepolitics,General Politics,296409,Ann Selzer Vows Changes After Iowa Poll Wrong by 16 Points,302,176,No,No,0,https://www.newsweek.com/ann-selzer-iowa-vows-changes-poll-wrong-1981297,/r/moderatepolitics/comments/1gpsaoq/ann_selzer_vows_changes_after_iowa_poll_wrong_by/
white,Republican,Ideological Politics,205354,"Current NPR CEO Katherine Maher says that during her time leading Wikipedia, she abandoned a ""free and open"" internet, because this led to the platform to recapitulating a ""white male Westernized construct"".",164,39,No,No,0,https://x.com/kevinnbass/status/1856351326889820283,/r/Republican/comments/1gqd2yk/current_npr_ceo_katherine_maher_says_that_during/
white,Conservative,Ideological Politics,1146477,"Biden congratulates Trump, tells him ‘welcome back’ to White House in historic meeting",1303,304,No,No,0,https://nypost.com/2024/11/13/us-news/trump-biden-hold-post-election-white-house-meeting/,/r/Conservative/comments/1gqjhme/biden_congratulates_trump_tells_him_welcome_back/
white,Conservative,Ideological Politics,1146477,"Disney’s ‘Snow White’ Star Rachel Zegler Hopes Trump Supporters ‘Never Know Peace’ — Are Part of a ‘Deep, Deep Sickness in This Country’",135,77,No,No,0,https://www.breitbart.com/entertainment/2024/11/13/disneys-snow-white-star-rachel-zegler-hopes-trump-supporters-never-know-peace-are-part-of-a-deep-deep-sickness-in-this-country/,/r/Conservative/comments/1gqq5s5/disneys_snow_white_star_rachel_zegler_hopes_trump/
vote,Libertarian,Ideological Politics,503680,Brandon Herrera For Director of The ATF.,34,7,No,No,0,https://www.reddit.com/r/Libertarian/comments/1gql47x/brandon_herrera_for_director_of_the_atf/,/r/Libertarian/comments/1gql47x/brandon_herrera_for_director_of_the_atf/
rural,Anarchism,Ideological Politics,271094,STAYING ALIVE IS PUNK AS FUCK,579,44,No,No,0,https://www.reddit.com/r/Anarchism/comments/1gphrhm/staying_alive_is_punk_as_fuck/,/r/Anarchism/comments/1gphrhm/staying_alive_is_punk_as_fuck/
vote,Progressive,Ideological Politics,78058,Americans in Puerto Rico can't vote for US president. Their anger at Trump is shaping the race.,345,32,No,No,0,https://apnews.com/article/puerto-rico-trump-joke-garbage-a91e2aafd93a06d32365efa013581b85,/r/progressive/comments/1gh2ab4/americans_in_puerto_rico_cant_vote_for_us/
Texas,Progressive,Ideological Politics,78058,A Texas Woman Died After Waiting 40 Hours for Miscarriage Care,299,6,No,No,0,https://www.propublica.org/article/josseli-barnica-death-miscarriage-texas-abortion-ban,/r/progressive/comments/1gfmamd/a_texas_woman_died_after_waiting_40_hours_for/
michigan,Progressive,Ideological Politics,78058,20k+ attend Michigan Rally,140,2,No,No,0,https://i.redd.it/ywmuqgzbhlxd1.jpeg,/r/progressive/comments/1gelsyg/20k_attend_michigan_rally/
survey,Republicanism,Ideological Politics,918,Survey about your political worldview (18+; 12-14 mins to complete),3,0,No,No,0,https://www.reddit.com/r/republicanism/comments/1aq418a/survey_about_your_political_worldview_18_1214/,/r/republicanism/comments/1aq418a/survey_about_your_political_worldview_18_1214/
vote,Republicanism,Ideological Politics,918,About the Lopez,3,2,No,No,0,https://www.reddit.com/r/republicanism/comments/1094bh5/about_the_lopez/,/r/republicanism/comments/1094bh5/about_the_lopez/
vote,Conservatives,Ideological Politics,108243,"After Trump Landslide, GOP Senate Votes For Business As Usual",70,8,No,No,0,https://thefederalist.com/2024/11/13/after-trump-landslide-gop-senate-votes-for-business-as-usual-in-leadership-race/,/r/conservatives/comments/1gqm9fx/after_trump_landslide_gop_senate_votes_for/
vote,dailywire,Ideological Politics,24209,"I didn't vote for him, but if I had known about this....",78,6,No,No,0,https://i.redd.it/w8qyb438tq0e1.jpeg,/r/dailywire/comments/1gqp4an/i_didnt_vote_for_him_but_if_i_had_known_about_this/
latino,dailywire,Ideological Politics,24209,"I’m a Latino, I’m legal, I follow the Law. This guy is talking a Lot of BS",155,63,No,No,0,https://v.redd.it/d90m6cxd6e0e1,/r/dailywire/comments/1gpbrqh/im_a_latino_im_legal_i_follow_the_law_this_guy_is/
vote,Liberal,Ideological Politics,119828,A message from a young white man in the trenches:  How to debate Trumpers.,94,112,No,No,0,https://www.reddit.com/r/Liberal/comments/1gqhod1/a_message_from_a_young_white_man_in_the_trenches/,/r/Liberal/comments/1gqhod1/a_message_from_a_young_white_man_in_the_trenches/
vote,Liberal,Ideological Politics,119828,"When they talk about getting rid of the ""woke"" military wtf are they really talking about?",42,62,No,No,0,https://www.reddit.com/r/Liberal/comments/1gqlg0t/when_they_talk_about_getting_rid_of_the_woke/,/r/Liberal/comments/1gqlg0t/when_they_talk_about_getting_rid_of_the_woke/
vote,Liberal,Ideological Politics,119828,Who were the 9M Biden 2020 voters who stayed home this year and what are their reasons? 90% did not vote for Trump last week.,185,106,No,No,0,https://cardinalnews.org/2024/11/11/the-key-election-statistic-many-democrats-simply-didnt-vote/,/r/Liberal/comments/1gpubmj/who_were_the_9m_biden_2020_voters_who_stayed_home/
vote,Liberal,Ideological Politics,119828,"It took some time for ChatGPT 4.o1 to play along, but it is hypothetically possible the election was manipulated.",0,10,No,Yes,0,https://www.reddit.com/r/Liberal/comments/1gqkjdz/it_took_some_time_for_chatgpt_4o1_to_play_along/,/r/Liberal/comments/1gqkjdz/it_took_some_time_for_chatgpt_4o1_to_play_along/
Arizona,Liberal,Ideological Politics,119828,Arizona AG says she won't drop state's fake electors case against Trump allies,552,24,No,No,0,https://www.upi.com/Top_News/US/2024/11/10/Arizona-fake-electors-case/4001731292312/,/r/Liberal/comments/1gosjeh/arizona_ag_says_she_wont_drop_states_fake/
vote,Liberal,Ideological Politics,119828,What I think needs changing,41,148,No,No,0,https://www.reddit.com/r/Liberal/comments/1goxogz/what_i_think_needs_changing/,/r/Liberal/comments/1goxogz/what_i_think_needs_changing/
vote,Liberal,Ideological Politics,119828,Glad to see we have visitors.,125,86,No,Yes,0,https://www.reddit.com/r/Liberal/comments/1gon2jn/glad_to_see_we_have_visitors/,/r/Liberal/comments/1gon2jn/glad_to_see_we_have_visitors/
male,Liberal,Ideological Politics,119828,I've always wanted to see a woman President in my lifetime.,0,13,No,No,0,https://www.reddit.com/r/Liberal/comments/1gpsp2s/ive_always_wanted_to_see_a_woman_president_in_my/,/r/Liberal/comments/1gpsp2s/ive_always_wanted_to_see_a_woman_president_in_my/
vote,KamalaHarris,Ideological Politics,75655,Kamala Harris *Did* Listen To Working-Class Voters. And They Didn't Listen to Her Opponent.,1571,85,Yes,No,0,https://washingtonmonthly.substack.com/p/kamala-harris-did-listen-to-working,/r/KamalaHarris/comments/1gpves2/kamala_harris_did_listen_to_workingclass_voters/
white,KamalaHarris,Ideological Politics,75655,Kamala Harris greeted as she returns to the White House,2723,228,No,No,0,https://v.redd.it/qhewboav9j0e1,/r/KamalaHarris/comments/1gpv41o/kamala_harris_greeted_as_she_returns_to_the_white/
vote,KamalaHarris,Ideological Politics,75655,"NEVADA VOTERS: Over 10,000 mail-in ballots in Nevada are at risk of being rejected. But if voters cure their ballots by 5 pm PT today, their votes will be counted. Check your status here.  Please share!",1382,91,No,No,0,https://www.nvsos.gov/sos/elections/voters/cure,/r/KamalaHarris/comments/1gpnmvb/nevada_voters_over_10000_mailin_ballots_in_nevada/
vote,Impeach_Trump,Ideological Politics,60553,This is an amazing article written by user u/SilkyFluffs in r/democrats which is an amazing resource for combating GOP and Trump misinformation and possibly even converting family members or undecided voters,43,0,No,Yes,0,https://pdflink.to/d6e0bc9d/,/r/Impeach_Trump/comments/1ggd0pc/this_is_an_amazing_article_written_by_user/
