Keyword,Subreddit,Category,Members,Title,Upvotes,Comments,Moderator Interaction,Fact-Checking Mention,Total Awards,URL,Original Post URL
survey,PoliticalDiscussion,General Politics,2184665,Casual Questions Thread,42,4833,Yes,No,0,https://www.reddit.com/r/PoliticalDiscussion/comments/1bwbuka/casual_questions_thread/,/r/PoliticalDiscussion/comments/1bwbuka/casual_questions_thread/
vote,PoliticalDiscussion,General Politics,2184665,What would improve the low voter turnout in western societies?,1,4,No,No,0,https://www.reddit.com/r/PoliticalDiscussion/comments/1grrs3m/what_would_improve_the_low_voter_turnout_in/,/r/PoliticalDiscussion/comments/1grrs3m/what_would_improve_the_low_voter_turnout_in/
vote,PoliticalDiscussion,General Politics,2184665,Will the Senate reject Gaetz?,7,14,No,No,0,https://www.reddit.com/r/PoliticalDiscussion/comments/1gr6t5n/will_the_senate_reject_gaetz/,/r/PoliticalDiscussion/comments/1gr6t5n/will_the_senate_reject_gaetz/
vote,PoliticalDiscussion,General Politics,2184665,Can electors cast their votes against their pledged candidate to change the outcome of this election? ,0,1,No,No,0,https://www.reddit.com/r/PoliticalDiscussion/comments/1groky3/can_electors_cast_their_votes_against_their/,/r/PoliticalDiscussion/comments/1groky3/can_electors_cast_their_votes_against_their/
vote,NeutralPolitics,General Politics,610708,What to expect after the U.S. election,282,26,Yes,Yes,0,https://www.reddit.com/r/NeutralPolitics/comments/1gflxpk/what_to_expect_after_the_us_election/,/r/NeutralPolitics/comments/1gflxpk/what_to_expect_after_the_us_election/
vote,NeutralPolitics,General Politics,610708,Tracking what bills/decisions are coming to contact reps/senators in a timely manner,33,6,No,No,0,https://www.reddit.com/r/NeutralPolitics/comments/1gqkpdp/tracking_what_billsdecisions_are_coming_to/,/r/NeutralPolitics/comments/1gqkpdp/tracking_what_billsdecisions_are_coming_to/
vote,NeutralPolitics,General Politics,610708,Do any countries have laws to combat politically-driven misinformation?,22,33,No,Yes,0,https://www.reddit.com/r/NeutralPolitics/comments/1gq4agt/do_any_countries_have_laws_to_combat/,/r/NeutralPolitics/comments/1gq4agt/do_any_countries_have_laws_to_combat/
vote,NeutralPolitics,General Politics,610708,Trump won the presidency and popular vote running on the mass deportation of illegal aliens. Who saw this coming and what lessons can be learned?,221,326,No,No,0,https://www.reddit.com/r/NeutralPolitics/comments/1gnk7ih/trump_won_the_presidency_and_popular_vote_running/,/r/NeutralPolitics/comments/1gnk7ih/trump_won_the_presidency_and_popular_vote_running/
poll,NeutralPolitics,General Politics,610708,Is now the time for a NEW moderate third party in U.S. politics?,0,79,No,No,0,https://www.reddit.com/r/NeutralPolitics/comments/1gms9so/is_now_the_time_for_a_new_moderate_third_party_in/,/r/NeutralPolitics/comments/1gms9so/is_now_the_time_for_a_new_moderate_third_party_in/
vote,NeutralPolitics,General Politics,610708,Why Are So Many Men Leaving The Democratic Party Over The Last Few Years?,387,156,No,No,0,https://www.reddit.com/r/NeutralPolitics/comments/1gklb9t/why_are_so_many_men_leaving_the_democratic_party/,/r/NeutralPolitics/comments/1gklb9t/why_are_so_many_men_leaving_the_democratic_party/
vote,NeutralPolitics,General Politics,610708,"What are the pros and cons of predictive election models, like 538, for our discourse around elections?",43,94,No,No,0,https://www.reddit.com/r/NeutralPolitics/comments/1giqib5/what_are_the_pros_and_cons_of_predictive_election/,/r/NeutralPolitics/comments/1giqib5/what_are_the_pros_and_cons_of_predictive_election/
vote,NeutralPolitics,General Politics,610708,Why are there organizations whose only goal is to make sure people vote? ,49,36,No,No,0,https://www.reddit.com/r/NeutralPolitics/comments/1ggtk67/why_are_there_organizations_whose_only_goal_is_to/,/r/NeutralPolitics/comments/1ggtk67/why_are_there_organizations_whose_only_goal_is_to/
vote,NeutralPolitics,General Politics,610708,Has there been any investigative journalism or public legal discovery to examine process irregularities regarding the 2020 election?,11,15,No,No,0,https://www.reddit.com/r/NeutralPolitics/comments/1ggkpzr/has_there_been_any_investigative_journalism_or/,/r/NeutralPolitics/comments/1ggkpzr/has_there_been_any_investigative_journalism_or/
vote,moderatepolitics,General Politics,296583,We Spoke With 13 Young Undecided Americans for Months. Here’s How They Voted.,79,168,No,No,0,https://www.nytimes.com/interactive/2024/11/13/opinion/focusgroup-young-undecided-voters.html?searchResultPosition=1,/r/moderatepolitics/comments/1grft9d/we_spoke_with_13_young_undecided_americans_for/
white,technology,General Politics,17402024,"White Supremacist, Nazi Content Spread on Steam Game Service - Bloomberg",938,156,No,No,0,https://www.bloomberg.com/news/articles/2024-11-14/white-supremacist-nazi-content-spread-on-steam-gaming-platform?srnd=undefined&embedded-checkout=true,/r/technology/comments/1grcnsc/white_supremacist_nazi_content_spread_on_steam/
vote,democrats,Ideological Politics,480756,High grocery prices got droves of Americans to vote for Trump but they shouldn’t expect to pay less over the next four years,580,101,No,No,0,https://www.cnn.com/2024/11/14/economy/trump-grocery-prices-inflation?cid=ios_app,/r/democrats/comments/1graf6u/high_grocery_prices_got_droves_of_americans_to/
vote,Conservative,Ideological Politics,1147716,Casey Wants Unregistered Voters To be Counted In PA Recount,596,109,No,No,0,https://thefederalist.com/2024/11/14/sen-casey-wants-ballots-from-unregistered-voters-to-be-counted-in-pennsylvania-recount/,/r/Conservative/comments/1grk2h3/casey_wants_unregistered_voters_to_be_counted_in/
black,Anarchism,Ideological Politics,271162,Radical BIPOC Thursday,3,0,No,No,0,https://www.reddit.com/r/Anarchism/comments/1gqybl7/radical_bipoc_thursday/,/r/Anarchism/comments/1gqybl7/radical_bipoc_thursday/
white,Socialism,Ideological Politics,461020,Disillusioned and loosing my mind.,94,28,No,No,0,https://www.reddit.com/r/socialism/comments/1grcvrg/disillusioned_and_loosing_my_mind/,/r/socialism/comments/1grcvrg/disillusioned_and_loosing_my_mind/
vote,Progressive,Ideological Politics,78073,Americans in Puerto Rico can't vote for US president. Their anger at Trump is shaping the race.,345,32,No,No,0,https://apnews.com/article/puerto-rico-trump-joke-garbage-a91e2aafd93a06d32365efa013581b85,/r/progressive/comments/1gh2ab4/americans_in_puerto_rico_cant_vote_for_us/
Texas,Progressive,Ideological Politics,78073,A Texas Woman Died After Waiting 40 Hours for Miscarriage Care,296,6,No,No,0,https://www.propublica.org/article/josseli-barnica-death-miscarriage-texas-abortion-ban,/r/progressive/comments/1gfmamd/a_texas_woman_died_after_waiting_40_hours_for/
michigan,Progressive,Ideological Politics,78073,20k+ attend Michigan Rally,141,2,No,No,0,https://i.redd.it/ywmuqgzbhlxd1.jpeg,/r/progressive/comments/1gelsyg/20k_attend_michigan_rally/
survey,Republicanism,Ideological Politics,918,Survey about your political worldview (18+; 12-14 mins to complete),3,0,No,No,0,https://www.reddit.com/r/republicanism/comments/1aq418a/survey_about_your_political_worldview_18_1214/,/r/republicanism/comments/1aq418a/survey_about_your_political_worldview_18_1214/
vote,Republicanism,Ideological Politics,918,About the Lopez,4,2,No,No,0,https://www.reddit.com/r/republicanism/comments/1094bh5/about_the_lopez/,/r/republicanism/comments/1094bh5/about_the_lopez/
vote,Conservatives,Ideological Politics,108267,Casey Wants Unregistered Voters To be Counted In PA Recount,127,27,No,No,0,https://thefederalist.com/2024/11/14/sen-casey-wants-ballots-from-unregistered-voters-to-be-counted-in-pennsylvania-recount/,/r/conservatives/comments/1grk2bz/casey_wants_unregistered_voters_to_be_counted_in/
vote,Conservatives,Ideological Politics,108267,Voters Rejected Not Just Harris But Democrats' Politics Of Division,161,4,No,No,0,https://thefederalist.com/2024/11/14/voters-rejected-not-just-kamala-harris-but-democrats-politics-of-division/,/r/conservatives/comments/1grgii8/voters_rejected_not_just_harris_but_democrats/
vote,Conservatives,Ideological Politics,108267,PA Dems Defy State Law To Count Hundreds Of Illegal Votes,72,11,No,No,0,https://thefederalist.com/2024/11/14/people-violate-laws-anytime-they-want-pa-county-dems-defy-state-law-to-count-hundreds-of-illegal-votes/,/r/conservatives/comments/1grk2vn/pa_dems_defy_state_law_to_count_hundreds_of/
white,Conservatives,Ideological Politics,108267,“Snow White” Actress Rachel Zegler Wishes Harm on Trump Supporters,32,8,No,No,0,https://amgreatness.com/2024/11/14/snow-white-actress-rachel-zegler-wishes-harm-on-trump-supporters/,/r/conservatives/comments/1grlwbi/snow_white_actress_rachel_zegler_wishes_harm_on/
vote,dailywire,Ideological Politics,24230,These election meltdowns keep getting better,250,30,No,No,0,https://i.redd.it/rierxc82rw0e1.jpeg,/r/dailywire/comments/1grb58d/these_election_meltdowns_keep_getting_better/
vote,dailywire,Ideological Politics,24230,"I didn't vote for him, but if I had known about this....",335,17,No,No,0,https://i.redd.it/w8qyb438tq0e1.jpeg,/r/dailywire/comments/1gqp4an/i_didnt_vote_for_him_but_if_i_had_known_about_this/
vote,Liberal,Ideological Politics,119880,Help me be a better Liberal,8,15,No,No,0,https://www.reddit.com/r/Liberal/comments/1grr55m/help_me_be_a_better_liberal/,/r/Liberal/comments/1grr55m/help_me_be_a_better_liberal/
vote,Liberal,Ideological Politics,119880,Anyone struggling with relatives over the holidays? ,16,18,No,No,0,https://www.reddit.com/r/Liberal/comments/1grbd75/anyone_struggling_with_relatives_over_the_holidays/,/r/Liberal/comments/1grbd75/anyone_struggling_with_relatives_over_the_holidays/
white,Liberal,Ideological Politics,119880,Trump taps Fox News host Pete Hegseth for defense secretary,11,3,No,No,0,https://www.cbsnews.com/news/trump-pete-hegseth-defense-secretary/,/r/Liberal/comments/1grdfzk/trump_taps_fox_news_host_pete_hegseth_for_defense/
vote,Liberal,Ideological Politics,119880,It was Never About Us,0,0,No,No,0,https://www.reddit.com/r/Liberal/comments/1grkdli/it_was_never_about_us/,/r/Liberal/comments/1grkdli/it_was_never_about_us/
vote,KamalaHarris,Ideological Politics,75397,Kamala Harris *Did* Listen To Working-Class Voters. And They Didn't Listen to Her Opponent.,1784,109,Yes,No,0,https://washingtonmonthly.substack.com/p/kamala-harris-did-listen-to-working,/r/KamalaHarris/comments/1gpves2/kamala_harris_did_listen_to_workingclass_voters/
white,KamalaHarris,Ideological Politics,75397,Kamala Harris greeted as she returns to the White House,3106,247,No,No,0,https://v.redd.it/qhewboav9j0e1,/r/KamalaHarris/comments/1gpv41o/kamala_harris_greeted_as_she_returns_to_the_white/
vote,KamalaHarris,Ideological Politics,75397,"NEVADA VOTERS: Over 10,000 mail-in ballots in Nevada are at risk of being rejected. But if voters cure their ballots by 5 pm PT today, their votes will be counted. Check your status here.  Please share!",1491,105,No,No,0,https://www.nvsos.gov/sos/elections/voters/cure,/r/KamalaHarris/comments/1gpnmvb/nevada_voters_over_10000_mailin_ballots_in_nevada/
vote,Impeach_Trump,Ideological Politics,60523,This is an amazing article written by user u/SilkyFluffs in r/democrats which is an amazing resource for combating GOP and Trump misinformation and possibly even converting family members or undecided voters,47,0,No,Yes,0,https://pdflink.to/d6e0bc9d/,/r/Impeach_Trump/comments/1ggd0pc/this_is_an_amazing_article_written_by_user/
