Keyword,Subreddit,Category,Members,Title,Upvotes,Comments,Moderator Interaction,Fact-Checking Mention,Total Awards,URL,Original Post URL
oil,Wikileaks,General Politics,177601,Why does the US still control every penny of Iraqi oil revenues?,39,7,No,No,0,https://www.reddit.com/r/WikiLeaks/comments/1fso9v7/why_does_the_us_still_control_every_penny_of/,/r/WikiLeaks/comments/1fso9v7/why_does_the_us_still_control_every_penny_of/
hurricane,News,General Politics,28890193,Hurricane Rafael is intensifying and closing in on Cuba/Gulf of Mexico,2481,270,No,No,0,https://www.cnn.com/2024/11/06/weather/hurricane-rafael-path-forecast-climate/index.html,/r/news/comments/1gl1efx/hurricane_rafael_is_intensifying_and_closing_in/
carbon,PoliticalDiscussion,General Politics,2185137,"2024 Congressional, State, and Local Results Megathread",65,51,Yes,No,0,https://www.reddit.com/r/PoliticalDiscussion/comments/1gkj8py/2024_congressional_state_and_local_results/,/r/PoliticalDiscussion/comments/1gkj8py/2024_congressional_state_and_local_results/
inflation,PoliticalDiscussion,General Politics,2185137,"Until inauguration Democrats have the White House and the Senate. After inauguration they will not have the White House, Senate and House looks out of reach. What actions can the Democrats take [if any] to minimize impact of 4 Trump years on IRA, Infrastructure Laws, Chips, Climate, Fuel, EVA]?  ",178,308,No,No,0,https://www.reddit.com/r/PoliticalDiscussion/comments/1gl3749/until_inauguration_democrats_have_the_white_house/,/r/PoliticalDiscussion/comments/1gl3749/until_inauguration_democrats_have_the_white_house/
carbon,PoliticalDiscussion,General Politics,2185137,2024 Presidential Election Results Megathread,562,7651,No,No,0,https://www.reddit.com/r/PoliticalDiscussion/comments/1gkj668/2024_presidential_election_results_megathread/,/r/PoliticalDiscussion/comments/1gkj668/2024_presidential_election_results_megathread/
economy,PoliticalDiscussion,General Politics,2185137,"If we can't get a national holiday passed for Voting Day, why don't states do it?",129,50,No,No,0,https://www.reddit.com/r/PoliticalDiscussion/comments/1gkfxlp/if_we_cant_get_a_national_holiday_passed_for/,/r/PoliticalDiscussion/comments/1gkfxlp/if_we_cant_get_a_national_holiday_passed_for/
percent,PoliticalDiscussion,General Politics,2185137,PBS has released its final [NPR/Marist] election poll giving Harris a 4% [51-47] lead among likely voters. The 2020 election was also 51 to 47 percent.  Just hours from election day does this data have some predictive value in assessing electoral college map? ,504,277,No,No,0,https://www.reddit.com/r/PoliticalDiscussion/comments/1gjqw99/pbs_has_released_its_final_nprmarist_election/,/r/PoliticalDiscussion/comments/1gjqw99/pbs_has_released_its_final_nprmarist_election/
plan,NeutralPolitics,General Politics,610428,What plans about trump and kamala have on section 8 housing and dept of edu.,0,6,No,No,0,https://www.reddit.com/r/NeutralPolitics/comments/1gk1emp/what_plans_about_trump_and_kamala_have_on_section/,/r/NeutralPolitics/comments/1gk1emp/what_plans_about_trump_and_kamala_have_on_section/
economy,NeutralPolitics,General Politics,610428,How do the Trump and Harris plans for workforce pay and taxes compare?,4,6,No,No,0,https://www.reddit.com/r/NeutralPolitics/comments/1ggxh8w/how_do_the_trump_and_harris_plans_for_workforce/,/r/NeutralPolitics/comments/1ggxh8w/how_do_the_trump_and_harris_plans_for_workforce/
economy,NeutralPolitics,General Politics,610428,"Why does Israel, a nation with a modern first world economy, need ""aid"" from the US as a part of its conflict?",258,77,No,No,0,https://www.reddit.com/r/NeutralPolitics/comments/1gewboa/why_does_israel_a_nation_with_a_modern_first/,/r/NeutralPolitics/comments/1gewboa/why_does_israel_a_nation_with_a_modern_first/
China,NeutralPolitics,General Politics,610428,Military coup in Niger (2023-2024) and relationships with western countries/companies ,48,5,No,No,0,https://www.reddit.com/r/NeutralPolitics/comments/1gdv0aw/military_coup_in_niger_20232024_and_relationships/,/r/NeutralPolitics/comments/1gdv0aw/military_coup_in_niger_20232024_and_relationships/
economic,moderatepolitics,General Politics,295363,"As a former Democrat who split his ticket, here's what Dems need to understand to win again.",693,470,No,Yes,0,https://www.reddit.com/r/moderatepolitics/comments/1gl545l/as_a_former_democrat_who_split_his_ticket_heres/,/r/moderatepolitics/comments/1gl545l/as_a_former_democrat_who_split_his_ticket_heres/
economic,moderatepolitics,General Politics,295363,Any speculation on what the election results mean for Ukraine?,83,260,No,No,0,https://www.reddit.com/r/moderatepolitics/comments/1gkwih5/any_speculation_on_what_the_election_results_mean/,/r/moderatepolitics/comments/1gkwih5/any_speculation_on_what_the_election_results_mean/
plan,democrats,Ideological Politics,480234,Complacency,578,236,No,No,0,https://i.redd.it/9yfce45gbazd1.jpeg,/r/democrats/comments/1gkypm9/complacency/
economy,democrats,Ideological Politics,480234,Early Reaction: Why did Kamala lose?,1156,3185,No,No,0,https://i.redd.it/ckfpe5w0d8zd1.jpeg,/r/democrats/comments/1gksn3l/early_reaction_why_did_kamala_lose/
economic,Libertarian,Ideological Politics,503563,Trump won by a slim margin that represents libertarian voters. Libertarians acted as kingmaker in this election. It's time to demand action on what we were promised!,0,67,Yes,Yes,0,https://www.reddit.com/r/Libertarian/comments/1gl156r/trump_won_by_a_slim_margin_that_represents/,/r/Libertarian/comments/1gl156r/trump_won_by_a_slim_margin_that_represents/
tax,Libertarian,Ideological Politics,503563,Today is a Dark Day for Liberty,37,39,Yes,Yes,0,https://www.reddit.com/r/Libertarian/comments/1gkk9pv/today_is_a_dark_day_for_liberty/,/r/Libertarian/comments/1gkk9pv/today_is_a_dark_day_for_liberty/
plan,Anarchism,Ideological Politics,270468,Practicing self-care is praxis. Please take care of yourselves and loved ones!,20,3,No,No,0,https://www.reddit.com/r/Anarchism/comments/1gl5yn3/practicing_selfcare_is_praxis_please_take_care_of/,/r/Anarchism/comments/1gl5yn3/practicing_selfcare_is_praxis_please_take_care_of/
plan,Anarchism,Ideological Politics,270468,How would you save a forest?,23,12,No,No,0,https://www.reddit.com/r/Anarchism/comments/1gko3iv/how_would_you_save_a_forest/,/r/Anarchism/comments/1gko3iv/how_would_you_save_a_forest/
China,Socialism,Ideological Politics,460264,Do not let liberals play the blame game,751,123,No,Yes,0,https://www.reddit.com/r/socialism/comments/1gkw7ee/do_not_let_liberals_play_the_blame_game/,/r/socialism/comments/1gkw7ee/do_not_let_liberals_play_the_blame_game/
plan,Socialism,Ideological Politics,460264,"Lesser evilism results in MORE EVIL. It cost Dems the election, but it'll cost ordinary workers our basic rights and living standards. It'll cost more Gazans their lives. We need to be bold as socialists and fight for what we really believe in. Stop VOTING Dem and start ORGANIZING as SOCIALISTS ",16,2,No,Yes,0,https://www.reddit.com/r/socialism/comments/1gl82na/lesser_evilism_results_in_more_evil_it_cost_dems/,/r/socialism/comments/1gl82na/lesser_evilism_results_in_more_evil_it_cost_dems/
plan,Socialism,Ideological Politics,460264,What now?,59,34,No,No,0,https://www.reddit.com/r/socialism/comments/1gky4lv/what_now/,/r/socialism/comments/1gky4lv/what_now/
economy,dailywire,Ideological Politics,24040,"Once Trump is back in office and the economy is moving in the right direction, the Republicans need to consider 2028",229,50,No,No,0,https://i.redd.it/7ebmcjr8lazd1.gif,/r/dailywire/comments/1gkzvuo/once_trump_is_back_in_office_and_the_economy_is/
economy,Liberal,Ideological Politics,119651,When can we talk about the 12M-15M people who voted for Biden and didn't vote for Hillary or Harris as being due to sexism/unconscious bias?,93,64,No,No,0,https://www.reddit.com/r/Liberal/comments/1gl2ros/when_can_we_talk_about_the_12m15m_people_who/,/r/Liberal/comments/1gl2ros/when_can_we_talk_about_the_12m15m_people_who/
plan,Liberal,Ideological Politics,119651,Former conservative: WTAF America?,702,463,No,No,0,https://www.reddit.com/r/Liberal/comments/1gkrao0/former_conservative_wtaf_america/,/r/Liberal/comments/1gkrao0/former_conservative_wtaf_america/
plan,Liberal,Ideological Politics,119651,Can Anyone Help Me Find A Reason To Get Out Of Bed?,201,315,No,No,0,https://www.reddit.com/r/Liberal/comments/1gkwhol/can_anyone_help_me_find_a_reason_to_get_out_of_bed/,/r/Liberal/comments/1gkwhol/can_anyone_help_me_find_a_reason_to_get_out_of_bed/
tariff,Liberal,Ideological Politics,119651,Off my chest,31,31,No,No,0,https://www.reddit.com/r/Liberal/comments/1gl600v/off_my_chest/,/r/Liberal/comments/1gl600v/off_my_chest/
plan,Liberal,Ideological Politics,119651,Wondering if it might be best to move to a Blue state,79,152,No,No,0,https://www.reddit.com/r/Liberal/comments/1gkxz9b/wondering_if_it_might_be_best_to_move_to_a_blue/,/r/Liberal/comments/1gkxz9b/wondering_if_it_might_be_best_to_move_to_a_blue/
China,Liberal,Ideological Politics,119651,As much as I'm sick of elections,11,2,No,No,0,https://www.reddit.com/r/Liberal/comments/1gl205y/as_much_as_im_sick_of_elections/,/r/Liberal/comments/1gl205y/as_much_as_im_sick_of_elections/
percent,KamalaHarris,Ideological Politics,79716,"The 2020 election was CLOSE, don't lose Hope ",556,340,No,No,0,https://www.cnn.com/2020/11/09/politics/2020-election-trump-biden-closest-states/index.html,/r/KamalaHarris/comments/1gkql0e/the_2020_election_was_close_dont_lose_hope/
plan,KamalaHarris,Ideological Politics,79716,My whole family is made up of Republicans who have always voted republican. This time all of them voted for Kamala.,5126,332,No,No,0,https://www.reddit.com/r/KamalaHarris/comments/1gk82hi/my_whole_family_is_made_up_of_republicans_who/,/r/KamalaHarris/comments/1gk82hi/my_whole_family_is_made_up_of_republicans_who/
economy,KamalaHarris,Ideological Politics,79716,Voted for Harris 2 hours ago. ,3612,176,No,No,0,https://www.reddit.com/r/KamalaHarris/comments/1gk9ve8/voted_for_harris_2_hours_ago/,/r/KamalaHarris/comments/1gk9ve8/voted_for_harris_2_hours_ago/
economic,Impeach_Trump,Ideological Politics,60658,"Elon Musk predicts ‘hardship,’ economic turmoil and a stock-market crash if Trump wins",59,4,No,No,0,https://www.marketwatch.com/story/kaboom-elon-musk-predicts-hardship-economic-turmoil-and-a-stock-market-crash-if-trump-wins-20483008,/r/Impeach_Trump/comments/1gfwy5u/elon_musk_predicts_hardship_economic_turmoil_and/
