Keyword,Subreddit,Category,Members,Title,Upvotes,Comments,Moderator Interaction,Fact-Checking Mention,Total Awards,URL,Original Post URL
win,Wikileaks,General Politics,177601,Julian to speak at a parliamentary hearing in Strasbourg on the chilling effect on human rights his treatment has had.,22,0,No,No,0,https://www.reddit.com/r/WikiLeaks/comments/1ftadxc/julian_to_speak_at_a_parliamentary_hearing_in/,/r/WikiLeaks/comments/1ftadxc/julian_to_speak_at_a_parliamentary_hearing_in/
win,Wikileaks,General Politics,177601,Why does the US still control every penny of Iraqi oil revenues?,40,7,No,No,0,https://www.reddit.com/r/WikiLeaks/comments/1fso9v7/why_does_the_us_still_control_every_penny_of/,/r/WikiLeaks/comments/1fso9v7/why_does_the_us_still_control_every_penny_of/
ballot,News,General Politics,28890188,"Abortion rights ballot measures pass in 7 states, fail in 3 others
",15053,1637,No,No,0,https://www.nbcnews.com/politics/2024-election/abortion-rights-ballot-measures-pass-7-states-fail-3-others-rcna178718,/r/news/comments/1gkw4z8/abortion_rights_ballot_measures_pass_in_7_states/
win,News,General Politics,28890188,Donald Trump wins 2nd term in historic return to White House,35382,23894,No,No,0,https://abcnews.go.com/Politics/donald-trump-wins-2nd-term-historic-return-white/story?id=115358710,/r/news/comments/1gkvrmr/donald_trump_wins_2nd_term_in_historic_return_to/
election,News,General Politics,28890188,Elon Musk is sued over $1 million election giveaway,17101,416,No,No,0,https://www.reuters.com/legal/elon-musk-is-sued-over-1-million-election-giveaway-2024-11-05/,/r/news/comments/1gkoaz1/elon_musk_is_sued_over_1_million_election_giveaway/
election,News,General Politics,28890188,‘F around and find out': Philly DA says city set to handle Election Day concerns,8497,165,No,No,0,https://www.nbcphiladelphia.com/news/local/f-around-and-find-out-philly-da-election-day-concerns/4017882/,/r/news/comments/1gkhqgs/f_around_and_find_out_philly_da_says_city_set_to/
election,News,General Politics,28890188,24-year-old man punches election judge in the face while waiting in line to vote: Police,16193,782,No,No,0,https://abcnews.go.com/Politics/24-year-man-punches-election-judge-face-waiting/story?id=115508484,/r/news/comments/1gkdby0/24yearold_man_punches_election_judge_in_the_face/
election,News,General Politics,28890188,Federal election monitors will not enter Texas polling locations after Paxton lawsuit. A Trump-appointed Texas judge denied a request to block the Department of Justice from monitoring polls. ,9106,504,No,No,0,https://www.chron.com/politics/article/texas-polling-monitors-paxton-19889589.php,/r/news/comments/1gkd0bp/federal_election_monitors_will_not_enter_texas/
election,PoliticalDiscussion,General Politics,2185137,"2024 Congressional, State, and Local Results Megathread",68,51,Yes,No,0,https://www.reddit.com/r/PoliticalDiscussion/comments/1gkj8py/2024_congressional_state_and_local_results/,/r/PoliticalDiscussion/comments/1gkj8py/2024_congressional_state_and_local_results/
election,PoliticalDiscussion,General Politics,2185137,A reminder - Please read our rules and participate civilly,28,17,Yes,No,0,https://www.reddit.com/r/PoliticalDiscussion/comments/1gl71w2/a_reminder_please_read_our_rules_and_participate/,/r/PoliticalDiscussion/comments/1gl71w2/a_reminder_please_read_our_rules_and_participate/
election,PoliticalDiscussion,General Politics,2185137,Where does the Democratic Party go from here?,557,1869,No,No,0,https://www.reddit.com/r/PoliticalDiscussion/comments/1gkyrlz/where_does_the_democratic_party_go_from_here/,/r/PoliticalDiscussion/comments/1gkyrlz/where_does_the_democratic_party_go_from_here/
election,PoliticalDiscussion,General Politics,2185137,Why did Kamala Harris lose the election?,1670,3699,No,No,0,https://www.reddit.com/r/PoliticalDiscussion/comments/1gksts4/why_did_kamala_harris_lose_the_election/,/r/PoliticalDiscussion/comments/1gksts4/why_did_kamala_harris_lose_the_election/
election,PoliticalDiscussion,General Politics,2185137,"Until inauguration Democrats have the White House and the Senate. After inauguration they will not have the White House, Senate and House looks out of reach. What actions can the Democrats take [if any] to minimize impact of 4 Trump years on IRA, Infrastructure Laws, Chips, Climate, Fuel, EVA]?  ",173,307,No,No,0,https://www.reddit.com/r/PoliticalDiscussion/comments/1gl3749/until_inauguration_democrats_have_the_white_house/,/r/PoliticalDiscussion/comments/1gl3749/until_inauguration_democrats_have_the_white_house/
election,PoliticalDiscussion,General Politics,2185137,"Tonight, Zelensky's post on X congratulated Trump on his win stating he hopes for peace in Ukraine through strength.  Is Trump likely to sacrifice Donbass to Putin to accomplish peace? ",301,386,No,No,0,https://www.reddit.com/r/PoliticalDiscussion/comments/1gkv4av/tonight_zelenskys_post_on_x_congratulated_trump/,/r/PoliticalDiscussion/comments/1gkv4av/tonight_zelenskys_post_on_x_congratulated_trump/
election,PoliticalDiscussion,General Politics,2185137,2024 Presidential Election Results Megathread,563,7651,No,No,0,https://www.reddit.com/r/PoliticalDiscussion/comments/1gkj668/2024_presidential_election_results_megathread/,/r/PoliticalDiscussion/comments/1gkj668/2024_presidential_election_results_megathread/
election,PoliticalDiscussion,General Politics,2185137,"How much does ""ground game"" and canvassing actually help a candidate? Does it ever backfire?",145,70,No,No,0,https://www.reddit.com/r/PoliticalDiscussion/comments/1gkiejf/how_much_does_ground_game_and_canvassing_actually/,/r/PoliticalDiscussion/comments/1gkiejf/how_much_does_ground_game_and_canvassing_actually/
America,PoliticalDiscussion,General Politics,2185137,"If we can't get a national holiday passed for Voting Day, why don't states do it?",124,50,No,No,0,https://www.reddit.com/r/PoliticalDiscussion/comments/1gkfxlp/if_we_cant_get_a_national_holiday_passed_for/,/r/PoliticalDiscussion/comments/1gkfxlp/if_we_cant_get_a_national_holiday_passed_for/
election,PoliticalDiscussion,General Politics,2185137,"How would this election, the 2024 election, be the last election that the American people will get to decide if Donald Trump wins? ",368,717,No,No,0,https://www.reddit.com/r/PoliticalDiscussion/comments/1gk7jem/how_would_this_election_the_2024_election_be_the/,/r/PoliticalDiscussion/comments/1gk7jem/how_would_this_election_the_2024_election_be_the/
election,PoliticalDiscussion,General Politics,2185137,Should Harris challenge the election results if she suspects that election integrity has been compromised?,214,257,No,No,0,https://www.reddit.com/r/PoliticalDiscussion/comments/1gkawwn/should_harris_challenge_the_election_results_if/,/r/PoliticalDiscussion/comments/1gkawwn/should_harris_challenge_the_election_results_if/
win,PoliticalDiscussion,General Politics,2185137,"Why are other federations relatively receptive to amending their constitutions, even when they need ratification by subnational governments, when the US and Canada are so incapable of amending theirs?",31,28,No,No,0,https://www.reddit.com/r/PoliticalDiscussion/comments/1gkis5y/why_are_other_federations_relatively_receptive_to/,/r/PoliticalDiscussion/comments/1gkis5y/why_are_other_federations_relatively_receptive_to/
vote,PoliticalDiscussion,General Politics,2185137,Doing away with Electoral College would fundamentally change the electorate,765,445,No,No,0,https://www.reddit.com/r/PoliticalDiscussion/comments/1gjy0s5/doing_away_with_electoral_college_would/,/r/PoliticalDiscussion/comments/1gjy0s5/doing_away_with_electoral_college_would/
election,PoliticalDiscussion,General Politics,2185137,"What does Donald Trump do if he loses the election tomorrow, what happens to Trumpism? ",527,786,No,No,0,https://www.reddit.com/r/PoliticalDiscussion/comments/1gjw1uo/what_does_donald_trump_do_if_he_loses_the/,/r/PoliticalDiscussion/comments/1gjw1uo/what_does_donald_trump_do_if_he_loses_the/
election,PoliticalDiscussion,General Politics,2185137,PBS has released its final [NPR/Marist] election poll giving Harris a 4% [51-47] lead among likely voters. The 2020 election was also 51 to 47 percent.  Just hours from election day does this data have some predictive value in assessing electoral college map? ,501,277,No,No,0,https://www.reddit.com/r/PoliticalDiscussion/comments/1gjqw99/pbs_has_released_its_final_nprmarist_election/,/r/PoliticalDiscussion/comments/1gjqw99/pbs_has_released_its_final_nprmarist_election/
election,NeutralPolitics,General Politics,610428,What to expect after the U.S. election,279,23,Yes,Yes,0,https://www.reddit.com/r/NeutralPolitics/comments/1gflxpk/what_to_expect_after_the_us_election/,/r/NeutralPolitics/comments/1gflxpk/what_to_expect_after_the_us_election/
election,NeutralPolitics,General Politics,610428,Why Are So Many Men Leaving The Democratic Party Over The Last Few Years?,206,158,No,No,0,https://www.reddit.com/r/NeutralPolitics/comments/1gklb9t/why_are_so_many_men_leaving_the_democratic_party/,/r/NeutralPolitics/comments/1gklb9t/why_are_so_many_men_leaving_the_democratic_party/
election,NeutralPolitics,General Politics,610428,What is the impact of Elon Musk's political engagement on the current U.S. election?,36,25,No,No,0,https://www.reddit.com/r/NeutralPolitics/comments/1gki55b/what_is_the_impact_of_elon_musks_political/,/r/NeutralPolitics/comments/1gki55b/what_is_the_impact_of_elon_musks_political/
Trump,NeutralPolitics,General Politics,610428,What plans about trump and kamala have on section 8 housing and dept of edu.,0,6,No,No,0,https://www.reddit.com/r/NeutralPolitics/comments/1gk1emp/what_plans_about_trump_and_kamala_have_on_section/,/r/NeutralPolitics/comments/1gk1emp/what_plans_about_trump_and_kamala_have_on_section/
election,NeutralPolitics,General Politics,610428,"What are the pros and cons of predictive election models, like 538, for our discourse around elections?",41,73,No,No,0,https://www.reddit.com/r/NeutralPolitics/comments/1giqib5/what_are_the_pros_and_cons_of_predictive_election/,/r/NeutralPolitics/comments/1giqib5/what_are_the_pros_and_cons_of_predictive_election/
election,NeutralPolitics,General Politics,610428,Why are there organizations whose only goal is to make sure people vote? ,50,36,No,No,0,https://www.reddit.com/r/NeutralPolitics/comments/1ggtk67/why_are_there_organizations_whose_only_goal_is_to/,/r/NeutralPolitics/comments/1ggtk67/why_are_there_organizations_whose_only_goal_is_to/
win,NeutralPolitics,General Politics,610428,How do the Trump and Harris plans for workforce pay and taxes compare?,3,6,No,No,0,https://www.reddit.com/r/NeutralPolitics/comments/1ggxh8w/how_do_the_trump_and_harris_plans_for_workforce/,/r/NeutralPolitics/comments/1ggxh8w/how_do_the_trump_and_harris_plans_for_workforce/
election,NeutralPolitics,General Politics,610428,Has there been any investigative journalism or public legal discovery to examine process irregularities regarding the 2020 election?,11,15,No,No,0,https://www.reddit.com/r/NeutralPolitics/comments/1ggkpzr/has_there_been_any_investigative_journalism_or/,/r/NeutralPolitics/comments/1ggkpzr/has_there_been_any_investigative_journalism_or/
election,NeutralPolitics,General Politics,610428,What are the pros and cons of voting?,0,52,No,No,0,https://www.reddit.com/r/NeutralPolitics/comments/1gcoa3z/what_are_the_pros_and_cons_of_voting/,/r/NeutralPolitics/comments/1gcoa3z/what_are_the_pros_and_cons_of_voting/
election,NeutralPolitics,General Politics,610428,"When, if ever, have have UK political parties sent delegates to the USA to help with election campaigns?",101,38,No,No,0,https://www.reddit.com/r/NeutralPolitics/comments/1ga59yb/when_if_ever_have_have_uk_political_parties_sent/,/r/NeutralPolitics/comments/1ga59yb/when_if_ever_have_have_uk_political_parties_sent/
win,moderatepolitics,General Politics,295361,Donald Trump Wins US Presidency,620,1860,Yes,No,0,https://apnews.com/live/trump-harris-election-updates-11-5-2024,/r/moderatepolitics/comments/1gkxmai/donald_trump_wins_us_presidency/
win,moderatepolitics,General Politics,295361,"As a former Democrat who split his ticket, here's what Dems need to understand to win again.",690,467,No,Yes,0,https://www.reddit.com/r/moderatepolitics/comments/1gl545l/as_a_former_democrat_who_split_his_ticket_heres/,/r/moderatepolitics/comments/1gl545l/as_a_former_democrat_who_split_his_ticket_heres/
election,moderatepolitics,General Politics,295361,"I know Reddit meta discussion isn't usually allowed, but in the wake of the election result is it worth having a conversation about the health of the site?",340,261,No,No,0,https://www.reddit.com/r/moderatepolitics/comments/1gl28vl/i_know_reddit_meta_discussion_isnt_usually/,/r/moderatepolitics/comments/1gl28vl/i_know_reddit_meta_discussion_isnt_usually/
election,moderatepolitics,General Politics,295361,Case Preview: Delligatti v. United States,41,4,No,No,0,https://www.reddit.com/r/moderatepolitics/comments/1gl46gw/case_preview_delligatti_v_united_states/,/r/moderatepolitics/comments/1gl46gw/case_preview_delligatti_v_united_states/
election,moderatepolitics,General Politics,295361,Any speculation on what the election results mean for Ukraine?,82,260,No,No,0,https://www.reddit.com/r/moderatepolitics/comments/1gkwih5/any_speculation_on_what_the_election_results_mean/,/r/moderatepolitics/comments/1gkwih5/any_speculation_on_what_the_election_results_mean/
election,moderatepolitics,General Politics,295361,Megathread: 2024 Election Results Wind-down (We Hope!),125,1795,No,No,0,https://www.reddit.com/r/moderatepolitics/comments/1gkqwdl/megathread_2024_election_results_winddown_we_hope/,/r/moderatepolitics/comments/1gkqwdl/megathread_2024_election_results_winddown_we_hope/
election,moderatepolitics,General Politics,295361,Megathread: 2024 Election Results,297,9865,No,No,0,https://www.reddit.com/r/moderatepolitics/comments/1gkiney/megathread_2024_election_results/,/r/moderatepolitics/comments/1gkiney/megathread_2024_election_results/
election,moderatepolitics,General Politics,295361,Best independent source of live coverage for the elections?,222,167,No,No,0,https://www.reddit.com/r/moderatepolitics/comments/1gk956i/best_independent_source_of_live_coverage_for_the/,/r/moderatepolitics/comments/1gk956i/best_independent_source_of_live_coverage_for_the/
election,moderatepolitics,General Politics,295361,"Botswana’s ruling party loses election, ending 58-year rule",290,34,No,No,0,https://www.cnn.com/2024/11/01/africa/botswana-party-loses-election-masisi-boko-intl/index.html,/r/moderatepolitics/comments/1gjysmf/botswanas_ruling_party_loses_election_ending/
election,moderatepolitics,General Politics,295361,Megathread: 2024 Election,229,2477,No,No,0,https://www.reddit.com/r/moderatepolitics/comments/1gjy31y/megathread_2024_election/,/r/moderatepolitics/comments/1gjy31y/megathread_2024_election/
win,moderatepolitics,General Politics,295361,Musk PAC tells Philadelphia judge the $1 million sweepstakes winners are not chosen by chance,409,190,No,No,0,https://apnews.com/article/musk-million-sweepstakes-lottery-pennsylvania-krasner-4f683c48eb7dcc57f183e54ef16e7320,/r/moderatepolitics/comments/1gjl3rj/musk_pac_tells_philadelphia_judge_the_1_million/
election,moderatepolitics,General Politics,295361,Iowa Republicans lead Democrats in voter registration totals going into Election Day,270,323,No,No,0,https://www.desmoinesregister.com/story/news/politics/elections/2024/11/04/iowa-republicans-lead-democrats-in-voter-registration-totals-ahead-of-election-day/75894681007/,/r/moderatepolitics/comments/1gjnbr7/iowa_republicans_lead_democrats_in_voter/
Trump,moderatepolitics,General Politics,295361,Trump on RFK's role in banning vaccines in his administration: 'I'll make a decision',167,217,No,No,0,https://thehill.com/policy/healthcare/4969663-trump-vaccine-banning-kennedy/,/r/moderatepolitics/comments/1gjlx2i/trump_on_rfks_role_in_banning_vaccines_in_his/
win,technology,General Politics,17364026,What a Trump win means for the FCC and telecom policy,3848,634,No,No,0,https://www.fierce-network.com/broadband/what-trump-win-means-fcc-and-telecom-policy,/r/technology/comments/1gl3tgh/what_a_trump_win_means_for_the_fcc_and_telecom/
Trump,technology,General Politics,17364026,How Donald Trump Could Weaponize US Surveillance in a Second Term,4836,1059,No,No,0,https://www.wired.com/story/trump-second-term-surveillance-state/,/r/technology/comments/1gkxdh8/how_donald_trump_could_weaponize_us_surveillance/
election,technology,General Politics,17364026,"Misleading ‘pro-Harris’ texts are bombarding swing state voters | As Election Day approached, Democratic voters in Michigan and Pennsylvania were flooded with suspicious messages about Harris’ stance on Israel.",13647,646,No,No,0,https://www.theverge.com/2024/11/5/24288263/harris-texts-israel-gaza-michigan-pennsylvania,/r/technology/comments/1gkep9o/misleading_proharris_texts_are_bombarding_swing/
election,democrats,Ideological Politics,480235,I Want to Share Words of Hope and Positivity and Encouragement ,178,226,Yes,No,0,https://i.redd.it/76uy69jbhazd1.jpeg,/r/democrats/comments/1gkzekh/i_want_to_share_words_of_hope_and_positivity_and/
Trump,democrats,Ideological Politics,480235,Real talk: I don't think there's anything Kamala could have done differently than would have changed the result (Gaza/border/trans policy/whatever). It wouldn't have mattered. I think Trump could've jerked off on stage and still won. We are a very stupid country where a cynical few control the news.,2278,974,No,No,0,https://i.redd.it/nehq1h219bzd1.jpeg,/r/democrats/comments/1gl2xx3/real_talk_i_dont_think_theres_anything_kamala/
vote,democrats,Ideological Politics,480235,"If you didn't vote, or voted 3rd party, in protest - IT DIDN'T WORK. The message that you transmitted wasn't be more progressive. It was ""be more republican."" 15 million Dem voters didn't show up. Is Gaza safer, Ukraine safer, income more equal, or gun control closer, did you fix the 2 party system?",678,240,No,No,0,https://www.yahoo.com/news/donny-deutsch-think-democrats-move-155827344.html,/r/democrats/comments/1gl54pa/if_you_didnt_vote_or_voted_3rd_party_in_protest/
win,democrats,Ideological Politics,480235,Second stage mood,520,131,No,No,0,https://i.redd.it/kf2f7apnabzd1.jpeg,/r/democrats/comments/1gl3561/second_stage_mood/
vote,democrats,Ideological Politics,480235,Complacency,581,236,No,No,0,https://i.redd.it/9yfce45gbazd1.jpeg,/r/democrats/comments/1gkypm9/complacency/
election,democrats,Ideological Politics,480235,"I’m a Canadian, and I suspect I’ve been duped by social media and Reddit into thinking that Harris was going to resoundingly win this election. Where do all these votes for Trump come from?",2088,1365,No,No,0,https://i.redd.it/6xjbqcsqt7zd1.jpeg,/r/democrats/comments/1gkqyza/im_a_canadian_and_i_suspect_ive_been_duped_by/
vote,democrats,Ideological Politics,480235,Anyone else just genuinely shocked? ,1576,1078,No,No,0,https://www.nytimes.com/interactive/2024/11/05/us/elections/results-president-forecast-needle.html,/r/democrats/comments/1gkrek0/anyone_else_just_genuinely_shocked/
Kamala,democrats,Ideological Politics,480235,Early Reaction: Why did Kamala lose?,1162,3185,No,No,0,https://i.redd.it/ckfpe5w0d8zd1.jpeg,/r/democrats/comments/1gksn3l/early_reaction_why_did_kamala_lose/
election,democrats,Ideological Politics,480235,Donald J. Trump has Won the 2024 Presidential Election,856,868,No,No,0,https://i.redd.it/18i6djtzc8zd1.jpeg,/r/democrats/comments/1gksmzg/donald_j_trump_has_won_the_2024_presidential/
election,Republican,Ideological Politics,203351,Donald Trump has won the election!,0,641,Yes,No,0,https://www.reddit.com/r/Republican/comments/1gks6zr/donald_trump_has_won_the_election/,/r/Republican/comments/1gks6zr/donald_trump_has_won_the_election/
Trump,Republican,Ideological Politics,203351,TRUMP WON! WE'RE SO BACK!,2192,373,No,No,0,https://i.redd.it/bwrk5acoh8zd1.jpeg,/r/Republican/comments/1gkt0sk/trump_won_were_so_back/
Trump,Republican,Ideological Politics,203351,“Women’s Rights”,626,145,No,No,0,https://www.reddit.com/r/Republican/comments/1gkyu2y/womens_rights/,/r/Republican/comments/1gkyu2y/womens_rights/
America,Republican,Ideological Politics,203351,Greatest comeback story in American History 🇺🇸,1029,22,No,No,0,https://i.redd.it/x3c61408q8zd1.jpeg,/r/Republican/comments/1gktp39/greatest_comeback_story_in_american_history/
win,Republican,Ideological Politics,203351,Remember to respect our fellow Americans.,801,158,No,No,0,https://www.reddit.com/r/Republican/comments/1gkurfm/remember_to_respect_our_fellow_americans/,/r/Republican/comments/1gkurfm/remember_to_respect_our_fellow_americans/
Trump,Republican,Ideological Politics,203351,"R.I.P. Hollywood Celebrity Presidential Endorsements: Taylor Swift, George Clooney, Robert De Niro, Beyonce Fail to Secure Victory for Kamala",207,58,No,No,0,https://www.breitbart.com/entertainment/2024/11/06/r-i-p-hollywood-celebrity-presidential-endorsements-taylor-swift-george-clooney-robert-de-niro-beyonce-fail-to-secure-victory-for-kamala/,/r/Republican/comments/1gl24sv/rip_hollywood_celebrity_presidential_endorsements/
Trump,Republican,Ideological Politics,203351,Whos gonna tell the rest of Reddit trumps not gonna get them,973,228,No,No,0,https://www.reddit.com/r/Republican/comments/1gkt592/whos_gonna_tell_the_rest_of_reddit_trumps_not/,/r/Republican/comments/1gkt592/whos_gonna_tell_the_rest_of_reddit_trumps_not/
win,Republican,Ideological Politics,203351,Trump wins three times in a row.,184,8,No,No,0,https://babylonbee.com/news/trump-wins-3rd-election-in-a-row,/r/Republican/comments/1gl1k6b/trump_wins_three_times_in_a_row/
Trump,Republican,Ideological Politics,203351,r/pics banned me for being in r/Trump! A reddit page support OUR president!!,80,44,No,No,0,https://www.reddit.com/gallery/1gl7p8t,/r/Republican/comments/1gl7p8t/rpics_banned_me_for_being_in_rtrump_a_reddit_page/
election,Conservative,Ideological Politics,1139677,Election live updates: Harris calls President-elect Trump to congratulate him on win,189,52,Yes,No,0,https://apnews.com/live/trump-harris-election-updates-11-5-2024#00000193-02c8-d414-a79f-1fdd435e0000,/r/Conservative/comments/1gl60e1/election_live_updates_harris_calls_presidentelect/
Trump,Conservative,Ideological Politics,1139677,BREAKING: Kamala Harris has called President-elected Donald Trump to congratulate him on victory - AP,1642,347,No,No,0,https://x.com/ericldaugh/status/1854233003330773382?s=46&t=AwX37EOWy1lQm64wqhPcWw,/r/Conservative/comments/1gl5pka/breaking_kamala_harris_has_called/
Kamala,Conservative,Ideological Politics,1139677,"Are you telling me a whooping 18 million Democrat voters stayed home this year, as opposed to 2020",2859,1088,No,No,0,https://www.reddit.com/r/Conservative/comments/1gl0v8t/are_you_telling_me_a_whooping_18_million_democrat/,/r/Conservative/comments/1gl0v8t/are_you_telling_me_a_whooping_18_million_democrat/
election,Conservative,Ideological Politics,1139677,The fact that Trump won 40% of the vote in California and 44% of the vote in New York is nothing short of astounding.,935,144,No,No,0,https://www.reddit.com/r/Conservative/comments/1gl62gg/the_fact_that_trump_won_40_of_the_vote_in/,/r/Conservative/comments/1gl62gg/the_fact_that_trump_won_40_of_the_vote_in/
Trump,Conservative,Ideological Politics,1139677,Thanks is due to the 15 million Biden voters who stayed home.,2066,346,No,No,0,https://www.reddit.com/r/Conservative/comments/1gkzqlc/thanks_is_due_to_the_15_million_biden_voters_who/,/r/Conservative/comments/1gkzqlc/thanks_is_due_to_the_15_million_biden_voters_who/
win,Conservative,Ideological Politics,1139677,Reading r/politics overnight would have you believe it was a Kamala landslide. ,3491,1143,No,No,0,https://www.reddit.com/r/Conservative/comments/1gkxt46/reading_rpolitics_overnight_would_have_you/,/r/Conservative/comments/1gkxt46/reading_rpolitics_overnight_would_have_you/
win,Conservative,Ideological Politics,1139677,"Swing state voters, you guys are the real heroes.",1896,203,No,No,0,https://www.reddit.com/r/Conservative/comments/1gkxzv8/swing_state_voters_you_guys_are_the_real_heroes/,/r/Conservative/comments/1gkxzv8/swing_state_voters_you_guys_are_the_real_heroes/
Trump,Conservative,Ideological Politics,1139677,Don’t you find it weird that Kamala didn’t even come out to say anything to her supporters?,1051,439,No,No,0,https://www.reddit.com/r/Conservative/comments/1gl1k8f/dont_you_find_it_weird_that_kamala_didnt_even/,/r/Conservative/comments/1gl1k8f/dont_you_find_it_weird_that_kamala_didnt_even/
election,Conservative,Ideological Politics,1139677,Not a single post about the us presidential election on the popular page of Reddit. Wow. ,4006,473,No,No,0,https://www.reddit.com/r/Conservative/comments/1gktlf7/not_a_single_post_about_the_us_presidential/,/r/Conservative/comments/1gktlf7/not_a_single_post_about_the_us_presidential/
election,Libertarian,Ideological Politics,503563,Trump won by a slim margin that represents libertarian voters. Libertarians acted as kingmaker in this election. It's time to demand action on what we were promised!,0,67,Yes,Yes,0,https://www.reddit.com/r/Libertarian/comments/1gl156r/trump_won_by_a_slim_margin_that_represents/,/r/Libertarian/comments/1gl156r/trump_won_by_a_slim_margin_that_represents/
win,Libertarian,Ideological Politics,503563,Today is a Dark Day for Liberty,37,39,Yes,Yes,0,https://www.reddit.com/r/Libertarian/comments/1gkk9pv/today_is_a_dark_day_for_liberty/,/r/Libertarian/comments/1gkk9pv/today_is_a_dark_day_for_liberty/
vote,Libertarian,Ideological Politics,503563,The Libertarian Party candidate is losing to the Green Party and a guy who dropped out of the race and begged people not to vote for him. This is what happens when you nominate weak candidates,867,155,No,No,0,https://i.redd.it/rks85t9usazd1.jpeg,/r/Libertarian/comments/1gl0ur8/the_libertarian_party_candidate_is_losing_to_the/
