Keyword,Subreddit,Category,Members,Title,Upvotes,Comments,Moderator Interaction,Fact-Checking Mention,Total Awards,URL,Original Post URL
win,Libertarian,Ideological Politics,503563,We made the presidency too powerful ,270,26,No,Yes,0,https://www.reddit.com/r/Libertarian/comments/1gl2q25/we_made_the_presidency_too_powerful/,/r/Libertarian/comments/1gl2q25/we_made_the_presidency_too_powerful/
vote,Libertarian,Ideological Politics,503563,California doesn’t make sense,265,82,No,No,0,https://i.redd.it/t4n96n1caazd1.jpeg,/r/Libertarian/comments/1gkykwu/california_doesnt_make_sense/
election,Libertarian,Ideological Politics,503563,"If you have friends/family breaking down over the election, they may be receptive to the only logical conclusion to draw from this election: No president should be powerful enough to have such a large impact on your life that a single election could ruin your life. ",139,4,No,No,0,https://www.reddit.com/r/Libertarian/comments/1gl2csl/if_you_have_friendsfamily_breaking_down_over_the/,/r/Libertarian/comments/1gl2csl/if_you_have_friendsfamily_breaking_down_over_the/
win,Libertarian,Ideological Politics,503563,how is everyone NOT excited about RON FREAKIN PAUL being called into the admin,979,105,No,Yes,0,https://www.reddit.com/r/Libertarian/comments/1gkqer8/how_is_everyone_not_excited_about_ron_freakin/,/r/Libertarian/comments/1gkqer8/how_is_everyone_not_excited_about_ron_freakin/
election,Anarchism,Ideological Politics,270468,holding all of you in my heart today,221,19,No,Yes,0,https://www.reddit.com/r/Anarchism/comments/1gkz5br/holding_all_of_you_in_my_heart_today/,/r/Anarchism/comments/1gkz5br/holding_all_of_you_in_my_heart_today/
America,Anarchism,Ideological Politics,270468,A quote by Emma Goldman along with all of what else she said is more than true today.,108,3,No,Yes,0,https://www.reddit.com/r/Anarchism/comments/1gl4alh/a_quote_by_emma_goldman_along_with_all_of_what/,/r/Anarchism/comments/1gl4alh/a_quote_by_emma_goldman_along_with_all_of_what/
Trump,Anarchism,Ideological Politics,270468,"History Repeats Itself: First as Farce, Then as Tragedy: Why the Democrats Are Responsible for Donald Trump’s Return to Power",269,45,No,No,0,/r/CrimethInc/comments/1gkv16z/history_repeats_itself_first_as_farce_then_as/,/r/Anarchism/comments/1gkv1c3/history_repeats_itself_first_as_farce_then_as/
Trump,Anarchism,Ideological Politics,270468,"Don't Panic, Organize: Meeting the Moment of Trump's Second Term",40,3,No,No,0,https://blackrosefed.org/dont-panic-organize-trump-election/,/r/Anarchism/comments/1gl3ikg/dont_panic_organize_meeting_the_moment_of_trumps/
election,Anarchism,Ideological Politics,270468,"To everyone living in the States, don’t let this break you",48,10,No,No,0,https://www.reddit.com/r/Anarchism/comments/1gl21ia/to_everyone_living_in_the_states_dont_let_this/,/r/Anarchism/comments/1gl21ia/to_everyone_living_in_the_states_dont_let_this/
election,Anarchism,Ideological Politics,270468,Practicing self-care is praxis. Please take care of yourselves and loved ones!,19,3,No,No,0,https://www.reddit.com/r/Anarchism/comments/1gl5yn3/practicing_selfcare_is_praxis_please_take_care_of/,/r/Anarchism/comments/1gl5yn3/practicing_selfcare_is_praxis_please_take_care_of/
election,Anarchism,Ideological Politics,270468,I hope that the US election will be evidence,36,10,No,No,0,https://www.reddit.com/r/Anarchism/comments/1gl0h5n/i_hope_that_the_us_election_will_be_evidence/,/r/Anarchism/comments/1gl0h5n/i_hope_that_the_us_election_will_be_evidence/
Trump,Anarchism,Ideological Politics,270468,Trying to be active ,1,0,No,No,0,https://www.reddit.com/r/Anarchism/comments/1gl4sni/trying_to_be_active/,/r/Anarchism/comments/1gl4sni/trying_to_be_active/
vote,Anarchism,Ideological Politics,270468,My thoughts today,34,10,No,No,0,https://i.redd.it/17kqn8l6j5zd1.jpeg,/r/Anarchism/comments/1gkhzs1/my_thoughts_today/
election,Anarchism,Ideological Politics,270468,The Lure of Elections,17,0,No,No,0,https://www.reddit.com/r/Anarchism/comments/1gklial/the_lure_of_elections/,/r/Anarchism/comments/1gklial/the_lure_of_elections/
election,Socialism,Ideological Politics,460264,Do not let liberals play the blame game,755,123,No,Yes,0,https://www.reddit.com/r/socialism/comments/1gkw7ee/do_not_let_liberals_play_the_blame_game/,/r/socialism/comments/1gkw7ee/do_not_let_liberals_play_the_blame_game/
America,Socialism,Ideological Politics,460264,American socialists - time to break away from the Democratic Party and build your own independent organisation instead. ,776,110,No,No,0,https://www.reddit.com/r/socialism/comments/1gktxeh/american_socialists_time_to_break_away_from_the/,/r/socialism/comments/1gktxeh/american_socialists_time_to_break_away_from_the/
Trump,Socialism,Ideological Politics,460264,"A Message to All  Comrades, Young and Old.",37,12,No,Yes,0,https://www.reddit.com/r/socialism/comments/1gl5pyl/a_message_to_all_comrades_young_and_old/,/r/socialism/comments/1gl5pyl/a_message_to_all_comrades_young_and_old/
vote,Socialism,Ideological Politics,460264,Dems are blaming left third party voters despite the fact our numbers were non influential,73,6,No,No,0,https://i.redd.it/t0zianqm1azd1.jpeg,/r/socialism/comments/1gkxmy6/dems_are_blaming_left_third_party_voters_despite/
win,Socialism,Ideological Politics,460264,Is America / Democracy totally over now that Trump won again? Are are some people just over dramatic? ,22,59,No,No,0,https://www.reddit.com/r/socialism/comments/1gl6e7a/is_america_democracy_totally_over_now_that_trump/,/r/socialism/comments/1gl6e7a/is_america_democracy_totally_over_now_that_trump/
election,Socialism,Ideological Politics,460264,"Lesser evilism results in MORE EVIL. It cost Dems the election, but it'll cost ordinary workers our basic rights and living standards. It'll cost more Gazans their lives. We need to be bold as socialists and fight for what we really believe in. Stop VOTING Dem and start ORGANIZING as SOCIALISTS ",17,2,No,Yes,0,https://www.reddit.com/r/socialism/comments/1gl82na/lesser_evilism_results_in_more_evil_it_cost_dems/,/r/socialism/comments/1gl82na/lesser_evilism_results_in_more_evil_it_cost_dems/
election,Socialism,Ideological Politics,460264,What now?,56,33,No,No,0,https://www.reddit.com/r/socialism/comments/1gky4lv/what_now/,/r/socialism/comments/1gky4lv/what_now/
Trump,Socialism,Ideological Politics,460264,"CrimethInc. : History Repeats Itself: First as Farce, Then as Tragedy : Why the Democrats Are Responsible for Donald Trump’s Return to Power",41,3,No,No,0,https://crimethinc.com/FightTrump2024,/r/socialism/comments/1gkztr7/crimethinc_history_repeats_itself_first_as_farce/
election,Progressive,Ideological Politics,77970,"Election 2024 live updates: President-elect Trump defeats Harris, NBC News projects",23,11,No,No,0,https://www.nbcnews.com/politics/2024-election/live-blog/presidential-election-trump-harris-2024-live-updates-rcna178894,/r/progressive/comments/1gkvumi/election_2024_live_updates_presidentelect_trump/
election,Progressive,Ideological Politics,77970,Will Abortion Rights Decide 2024 Election?,65,7,No,No,0,https://www.democracynow.org/2024/11/1/amy_littlefield_abortion_2024_election,/r/progressive/comments/1gigwsj/will_abortion_rights_decide_2024_election/
Trump,Progressive,Ideological Politics,77970,Americans in Puerto Rico can't vote for US president. Their anger at Trump is shaping the race.,348,30,No,No,0,https://apnews.com/article/puerto-rico-trump-joke-garbage-a91e2aafd93a06d32365efa013581b85,/r/progressive/comments/1gh2ab4/americans_in_puerto_rico_cant_vote_for_us/
election,Progressive,Ideological Politics,77970,Billionaires vs Democracy - The rich are trying to buy elections all over the world and consign democracy to the trash bin of history.,289,11,No,No,0,https://inequality.org/research/billionaires-vs-democracy/,/r/progressive/comments/1ggh1hg/billionaires_vs_democracy_the_rich_are_trying_to/
Trump,Progressive,Ideological Politics,77970,"Trump loyalists spew racist, vulgar attacks at Harris and Democrats at New York City rally",255,6,No,No,0,https://www.cnn.com/2024/10/27/politics/trump-rally-madison-square-garden-vulgar-attacks/index.html,/r/progressive/comments/1gdskia/trump_loyalists_spew_racist_vulgar_attacks_at/
ballot,Progressive,Ideological Politics,77970,"Ron DeSantis, using the levers of state government, ramps up efforts to defeat Florida abortion-rights ballot measure",181,4,No,No,0,https://www.nbcnews.com/politics/2024-election/ron-desantis-florida-abortion-ballot-measure-rcna175337,/r/progressive/comments/1g6fyiv/ron_desantis_using_the_levers_of_state_government/
Kamala,Progressive,Ideological Politics,77970,"Jimmy Carter Achieves His Goal, Lives Long Enough to Vote for Kamala Harris",629,29,No,No,0,https://meidasnews.com/news/jimmy-carter-achieves-his-goal-lives-long-enough-to-vote-for-kamala-harris,/r/progressive/comments/1g4dqdz/jimmy_carter_achieves_his_goal_lives_long_enough/
vote,Republicanism,Ideological Politics,915,About the Lopez,5,2,No,No,0,https://www.reddit.com/r/republicanism/comments/1094bh5/about_the_lopez/,/r/republicanism/comments/1094bh5/about_the_lopez/
election,Conservatives,Ideological Politics,108157,"Donald Trump wins 2024 presidential election, defying the odds again",448,39,No,No,0,https://nypost.com/2024/11/06/us-news/donald-trump-wins-2024-presidential-election-defying-the-odds-again/,/r/conservatives/comments/1gkwhzx/donald_trump_wins_2024_presidential_election/
Trump,Conservatives,Ideological Politics,108157,"WELL DONE, PATRIOTS!",373,54,No,Yes,0,https://www.reddit.com/r/conservatives/comments/1gkwwnb/well_done_patriots/,/r/conservatives/comments/1gkwwnb/well_done_patriots/
America,Conservatives,Ideological Politics,108157,America Unburdens Itself From What Has Been,408,23,No,No,0,https://babylonbee.com/news/america-unburdens-itself-from-what-has-been,/r/conservatives/comments/1gku1dk/america_unburdens_itself_from_what_has_been/
Trump,Conservatives,Ideological Politics,108157,"I’ve never met a conservative in the flesh, but I am one now",114,29,No,No,0,https://www.reddit.com/r/conservatives/comments/1gkzsgt/ive_never_met_a_conservative_in_the_flesh_but_i/,/r/conservatives/comments/1gkzsgt/ive_never_met_a_conservative_in_the_flesh_but_i/
campaign,Conservatives,Ideological Politics,108157,"Actor Scott Baio read off many celebrities' names, including Robert De Niro, Taylor Swift and Julia Roberts, who had endorsed or campaigned for Harris, before blowing a raspberry.",33,3,No,No,0,https://x.com/ScottBaio/status/1854201127400567160,/r/conservatives/comments/1gl5v3f/actor_scott_baio_read_off_many_celebrities_names/
Kamala,Conservatives,Ideological Politics,108157,Jake Tapper stunned as Kamala Harris fails to outperform Biden,26,8,No,No,0,https://nypost.com/2024/11/06/us-news/jake-tapper-stunned-as-harris-fails-to-outperform-biden/,/r/conservatives/comments/1gl6w0o/jake_tapper_stunned_as_kamala_harris_fails_to/
Trump,Conservatives,Ideological Politics,108157,"Dollar soars, bitcoin hits record, as Trump claims victory",103,0,No,No,0,https://www.breitbart.com/news/asian-markets-rise-with-dollar-bitcoin-as-ealy-us-results-roll-in/,/r/conservatives/comments/1gkwo0x/dollar_soars_bitcoin_hits_record_as_trump_claims/
America,Conservatives,Ideological Politics,108157,"Scott Jennings Brings Reality Crashing Down on CNN and Its Viewers, 'This Is Revenge of Regular America'",31,6,No,No,0,https://redstate.com/brandon_morse/2024/11/06/scott-jennings-brings-reality-crashing-down-on-cnn-and-its-viewers-this-is-revenge-of-regular-america-n2181634,/r/conservatives/comments/1gl3kuj/scott_jennings_brings_reality_crashing_down_on/
Trump,Conservatives,Ideological Politics,108157,Breaking: Houthis Allegedly Surrender Hours After Trump’s Victory—Is This the Power Shift the World Was Waiting For?,80,16,No,No,0,https://defiantamerica.com/breaking-houthis-allegedly-surrender-hours-after-trumps-victory/,/r/conservatives/comments/1gkxdlk/breaking_houthis_allegedly_surrender_hours_after/
election,Conservatives,Ideological Politics,108157,Trump Speaks With Humility to Supporters at HQ After Victory on Election Night,84,3,No,No,0,https://redstate.com/beccalower/2024/11/06/trump-addresses-supporters-at-campaign-hq-in-west-palm-beach-fl-n2181626,/r/conservatives/comments/1gkwnck/trump_speaks_with_humility_to_supporters_at_hq/
election,Conservatives,Ideological Politics,108157,Exit Polls: 25% of Black Men in Georgia Voted for Donald Trump this Election,528,30,No,No,0,https://www.breitbart.com/politics/2024/11/05/exit-polls-25-of-black-men-in-georgia-voted-for-donald-trump-this-election/,/r/conservatives/comments/1gkn72a/exit_polls_25_of_black_men_in_georgia_voted_for/
Trump,Conservatives,Ideological Politics,108157,Trump Declares Victory: 'God Spared My Life For A Reason',75,2,No,No,0,https://thefederalist.com/2024/11/06/donald-trump-declares-victory-god-spared-my-life-for-a-reason/,/r/conservatives/comments/1gkwm1u/trump_declares_victory_god_spared_my_life_for_a/
Trump,Conservatives,Ideological Politics,108157,Best of Leftist Trump Victory Meltdowns,10,1,No,No,0,https://x.com/RealAlexJones/status/1854245946692919622,/r/conservatives/comments/1gl82rh/best_of_leftist_trump_victory_meltdowns/
Trump,dailywire,Ideological Politics,24040,Wall of Hate - Help Document Hatred Against Trump on July13th.com,77,12,Yes,No,0,https://july13th.com/hate/,/r/dailywire/comments/1e3cqx8/wall_of_hate_help_document_hatred_against_trump/
Trump,dailywire,Ideological Politics,24040,R/pics removed my President Donald Trump picture,684,80,No,No,0,https://i.redd.it/2ovwke7haazd1.png,/r/dailywire/comments/1gkyljd/rpics_removed_my_president_donald_trump_picture/
election,dailywire,Ideological Politics,24040,Harris having to certify her own election loss is pure chef's kiss.,320,36,No,No,0,https://i.redd.it/8ifrp6jk2bzd1.jpeg,/r/dailywire/comments/1gl23dd/harris_having_to_certify_her_own_election_loss_is/
election,dailywire,Ideological Politics,24040,"Once Trump is back in office and the economy is moving in the right direction, the Republicans need to consider 2028",228,50,No,No,0,https://i.redd.it/7ebmcjr8lazd1.gif,/r/dailywire/comments/1gkzvuo/once_trump_is_back_in_office_and_the_economy_is/
win,dailywire,Ideological Politics,24040,Trump wins!,882,59,No,No,0,https://i.redd.it/ec06bp10b8zd1.jpeg,/r/dailywire/comments/1gksgsk/trump_wins/
Trump,dailywire,Ideological Politics,24040,"Woman Cries Over Trump’s Victory, Claiming There’s No Hope for Her Body’s Future",114,8,No,No,0,https://v.redd.it/ar3p7c6odbzd1,/r/dailywire/comments/1gl3ke0/woman_cries_over_trumps_victory_claiming_theres/
campaign,Liberal,Ideological Politics,119652,When can we talk about the 12M-15M people who voted for Biden and didn't vote for Hillary or Harris as being due to sexism/unconscious bias?,91,63,No,No,0,https://www.reddit.com/r/Liberal/comments/1gl2ros/when_can_we_talk_about_the_12m15m_people_who/,/r/Liberal/comments/1gl2ros/when_can_we_talk_about_the_12m15m_people_who/
election,Liberal,Ideological Politics,119652,Former conservative: WTAF America?,698,462,No,No,0,https://www.reddit.com/r/Liberal/comments/1gkrao0/former_conservative_wtaf_america/,/r/Liberal/comments/1gkrao0/former_conservative_wtaf_america/
election,Liberal,Ideological Politics,119652,Can Anyone Help Me Find A Reason To Get Out Of Bed?,201,315,No,No,0,https://www.reddit.com/r/Liberal/comments/1gkwhol/can_anyone_help_me_find_a_reason_to_get_out_of_bed/,/r/Liberal/comments/1gkwhol/can_anyone_help_me_find_a_reason_to_get_out_of_bed/
election,Liberal,Ideological Politics,119652,Kamala Harris has conceded the 2024 election.,50,17,No,No,0,https://www.cnn.com/politics/live-news/election-trump-harris-11-06-24/index.html,/r/Liberal/comments/1gl5t42/kamala_harris_has_conceded_the_2024_election/
win,Liberal,Ideological Politics,119652,You’re Not Alone ,104,76,No,No,0,https://www.reddit.com/r/Liberal/comments/1gkyiyg/youre_not_alone/,/r/Liberal/comments/1gkyiyg/youre_not_alone/
win,Liberal,Ideological Politics,119652,How can Trump be on track to win the popular vote?,230,420,No,No,0,https://www.reddit.com/r/Liberal/comments/1gkttot/how_can_trump_be_on_track_to_win_the_popular_vote/,/r/Liberal/comments/1gkttot/how_can_trump_be_on_track_to_win_the_popular_vote/
Trump,Liberal,Ideological Politics,119652,Let's play a lightning round of leopards eating my face,42,61,No,No,0,https://www.reddit.com/r/Liberal/comments/1gl45yh/lets_play_a_lightning_round_of_leopards_eating_my/,/r/Liberal/comments/1gl45yh/lets_play_a_lightning_round_of_leopards_eating_my/
Trump,Liberal,Ideological Politics,119652,Off my chest,32,31,No,No,0,https://www.reddit.com/r/Liberal/comments/1gl600v/off_my_chest/,/r/Liberal/comments/1gl600v/off_my_chest/
Trump,Liberal,Ideological Politics,119652,Welcome to the Divided States of Trumpistan,43,67,No,No,0,https://www.reddit.com/r/Liberal/comments/1gl1cei/welcome_to_the_divided_states_of_trumpistan/,/r/Liberal/comments/1gl1cei/welcome_to_the_divided_states_of_trumpistan/
Trump,Liberal,Ideological Politics,119652,They want you to feel beaten. Don't give them the satisfaction.,32,30,No,No,0,https://www.reddit.com/r/Liberal/comments/1gl2ekg/they_want_you_to_feel_beaten_dont_give_them_the/,/r/Liberal/comments/1gl2ekg/they_want_you_to_feel_beaten_dont_give_them_the/
Trump,Liberal,Ideological Politics,119652,It's not the Left's job to save the Right from themselves!!!,18,11,No,No,0,https://www.reddit.com/r/Liberal/comments/1gl5up5/its_not_the_lefts_job_to_save_the_right_from/,/r/Liberal/comments/1gl5up5/its_not_the_lefts_job_to_save_the_right_from/
America,Liberal,Ideological Politics,119652,Death of Democracy,21,37,No,No,0,https://www.reddit.com/r/Liberal/comments/1gl1rqu/death_of_democracy/,/r/Liberal/comments/1gl1rqu/death_of_democracy/
Trump,Liberal,Ideological Politics,119652,What is your most reasonable prediction of what will happen because of Trump's second term?,43,207,No,No,0,https://www.reddit.com/r/Liberal/comments/1gkuz6x/what_is_your_most_reasonable_prediction_of_what/,/r/Liberal/comments/1gkuz6x/what_is_your_most_reasonable_prediction_of_what/
election,Liberal,Ideological Politics,119652,As much as I'm sick of elections,12,2,No,No,0,https://www.reddit.com/r/Liberal/comments/1gl205y/as_much_as_im_sick_of_elections/,/r/Liberal/comments/1gl205y/as_much_as_im_sick_of_elections/
vote,KamalaHarris,Ideological Politics,79719,"My car broke down, so I walked almost three miles to vote. NO EXCUSES, NOT GOING BACK!!",38057,1015,No,No,0,https://i.redd.it/49vykhsll4zd1.jpeg,/r/KamalaHarris/comments/1gkdid8/my_car_broke_down_so_i_walked_almost_three_miles/
Trump,KamalaHarris,Ideological Politics,79719,It’s less about Trump but more about men not wanting a women President ,1504,463,No,No,0,http://Cnn.com,/r/KamalaHarris/comments/1gkqdu8/its_less_about_trump_but_more_about_men_not/
election,KamalaHarris,Ideological Politics,79719,Jon Stewart’s Election Night Takeaway,669,539,No,No,0,https://youtu.be/XLiagIdA84c,/r/KamalaHarris/comments/1gktt4g/jon_stewarts_election_night_takeaway/
election,KamalaHarris,Ideological Politics,79719,"Remember we are Americans first. And even if Trump wins, we are not going back",1011,436,No,No,0,https://v.redd.it/9nlmxburm7zd1,/r/KamalaHarris/comments/1gkqclh/remember_we_are_americans_first_and_even_if_trump/
Trump,KamalaHarris,Ideological Politics,79719,Donald Trump has accomplished what no other American president ever has: He convinced me to vote for a Democrat. ,3724,134,No,No,0,https://www.reddit.com/r/KamalaHarris/comments/1gkg0ml/donald_trump_has_accomplished_what_no_other/,/r/KamalaHarris/comments/1gkg0ml/donald_trump_has_accomplished_what_no_other/
Kamala,KamalaHarris,Ideological Politics,79719,First Time Veteran Voter- Kamala and Tim and a Straight Blue Ticket in Texas!!,18578,376,No,No,0,https://i.redd.it/htpxkfms63zd1.jpeg,/r/KamalaHarris/comments/1gk6wr9/first_time_veteran_voter_kamala_and_tim_and_a/
Trump,KamalaHarris,Ideological Politics,79719,Trump supporter asked to see pictures of men voting for Harris. I obliged them.,1365,118,No,No,0,https://i.redd.it/80wap4iab6zd1.jpeg,/r/KamalaHarris/comments/1gkli7v/trump_supporter_asked_to_see_pictures_of_men/
election,KamalaHarris,Ideological Politics,79719,"The 2020 election was CLOSE, don't lose Hope ",558,340,No,No,0,https://www.cnn.com/2020/11/09/politics/2020-election-trump-biden-closest-states/index.html,/r/KamalaHarris/comments/1gkql0e/the_2020_election_was_close_dont_lose_hope/
election,KamalaHarris,Ideological Politics,79719,Registered Republican Here; Officially cast my ballot for Kamala! ,2706,152,No,No,0,https://www.reddit.com/r/KamalaHarris/comments/1gkesy2/registered_republican_here_officially_cast_my/,/r/KamalaHarris/comments/1gkesy2/registered_republican_here_officially_cast_my/
Kamala,KamalaHarris,Ideological Politics,79719,51 - registered republican for 30 years. Changed party to democrat and voted for Kamala to end the crazy !!,1808,64,No,No,0,https://i.redd.it/szit763jc5zd1.jpeg,/r/KamalaHarris/comments/1gkh3si/51_registered_republican_for_30_years_changed/
Trump,KamalaHarris,Ideological Politics,79719,"My grandma hated the Orange Man, but sadly passed in February. She would have been so excited to vote for Kamala, so my vote is for her. ",1013,43,No,No,0,https://www.reddit.com/gallery/1gkle1j,/r/KamalaHarris/comments/1gkle1j/my_grandma_hated_the_orange_man_but_sadly_passed/
election,KamalaHarris,Ideological Politics,79719,"i, a christian, can’t tell anyone i voted for kamala and it’s making me sick to my stomach.",1147,183,No,No,0,https://www.reddit.com/r/KamalaHarris/comments/1gkjt6d/i_a_christian_cant_tell_anyone_i_voted_for_kamala/,/r/KamalaHarris/comments/1gkjt6d/i_a_christian_cant_tell_anyone_i_voted_for_kamala/
Trump,KamalaHarris,Ideological Politics,79719,My whole family is made up of Republicans who have always voted republican. This time all of them voted for Kamala.,5125,332,No,No,0,https://www.reddit.com/r/KamalaHarris/comments/1gk82hi/my_whole_family_is_made_up_of_republicans_who/,/r/KamalaHarris/comments/1gk82hi/my_whole_family_is_made_up_of_republicans_who/
election,KamalaHarris,Ideological Politics,79719,Voted for Harris 2 hours ago. ,3608,176,No,No,0,https://www.reddit.com/r/KamalaHarris/comments/1gk9ve8/voted_for_harris_2_hours_ago/,/r/KamalaHarris/comments/1gk9ve8/voted_for_harris_2_hours_ago/
Trump,Impeach_Trump,Ideological Politics,60658,Literal Neo-Nazi Leader Endorses Trump,181,1,No,No,0,https://www.rollingstone.com/politics/politics-news/trump-endorsement-neo-nazi-leader-nsc-131-1235154089/,/r/Impeach_Trump/comments/1gkmq6t/literal_neonazi_leader_endorses_trump/
campaign,Impeach_Trump,Ideological Politics,60658,Trump's crowds are dwindling as his campaign winds down — Empty seats and early exits have grown more common,419,18,No,No,0,https://www.nytimes.com/2024/11/04/us/politics/trump-rally-crowds.html,/r/Impeach_Trump/comments/1gjn8sb/trumps_crowds_are_dwindling_as_his_campaign_winds/
Trump,Impeach_Trump,Ideological Politics,60658,"Donald Trump talks about women at his rallies like they are objects, he doesn't see them as equals",300,3,No,No,0,https://imghoster.co/v3YtmBuQO5WqVHF,/r/Impeach_Trump/comments/1ggdie6/donald_trump_talks_about_women_at_his_rallies/
Trump,Impeach_Trump,Ideological Politics,60658,"Donald Trump called half of America ""human scum""",190,5,No,No,0,https://imghoster.co/VN2ORQf6SinlHXJ?utm_source=reddit&utm_medium=impeach_trump,/r/Impeach_Trump/comments/1gg9nmz/donald_trump_called_half_of_america_human_scum/
Trump,Impeach_Trump,Ideological Politics,60658,This is an amazing article written by user u/SilkyFluffs in r/democrats which is an amazing resource for combating GOP and Trump misinformation and possibly even converting family members or undecided voters,45,0,No,Yes,0,https://pdflink.to/d6e0bc9d/,/r/Impeach_Trump/comments/1ggd0pc/this_is_an_amazing_article_written_by_user/
win,Impeach_Trump,Ideological Politics,60658,"Elon Musk predicts ‘hardship,’ economic turmoil and a stock-market crash if Trump wins",62,4,No,No,0,https://www.marketwatch.com/story/kaboom-elon-musk-predicts-hardship-economic-turmoil-and-a-stock-market-crash-if-trump-wins-20483008,/r/Impeach_Trump/comments/1gfwy5u/elon_musk_predicts_hardship_economic_turmoil_and/
Trump,Impeach_Trump,Ideological Politics,60658,Kamala's rally in DC vs. Trump's rally in DC,133,0,No,No,0,https://imghoster.co/en/D370Y9JxmPOx6x3,/r/Impeach_Trump/comments/1gfnege/kamalas_rally_in_dc_vs_trumps_rally_in_dc/
Trump,Impeach_Trump,Ideological Politics,60658,Trump is 10x more corrupt than all the rest put together,320,3,No,No,0,https://imghoster.co/en/R3aE5Zdu1UQvWSj,/r/Impeach_Trump/comments/1getadg/trump_is_10x_more_corrupt_than_all_the_rest_put/
Trump,Impeach_Trump,Ideological Politics,60658,60 Reasons NOT to Vote Trump,141,6,No,No,0,https://imghoster.co/en/6ErQCOzq6Aqo5bH?utm_source=reddit&utm_medium=impeach_trump,/r/Impeach_Trump/comments/1geqmj2/60_reasons_not_to_vote_trump/
Trump,Impeach_Trump,Ideological Politics,60658,A quote from John Oliver for more reasons not to vote for Trump,23,0,No,No,0,https://imghoster.co/en/m3KOprcF1vwi76n,/r/Impeach_Trump/comments/1gexjzw/a_quote_from_john_oliver_for_more_reasons_not_to/
Trump,Impeach_Trump,Ideological Politics,60658,Trump’s Biggest Con: Pretending to Support American Workers [𝑵𝒐 𝑷𝒂𝒚𝒘𝒂𝒍𝒍!],154,0,No,No,0,https://www.nytimes.com/2024/10/28/opinion/trump-american-workers.html?unlocked_article_code=1.Vk4.MjsT.VUigyDoGZ9rX&smid=re-nytopinion,/r/Impeach_Trump/comments/1gehvf2/trumps_biggest_con_pretending_to_support_american/
Trump,Impeach_Trump,Ideological Politics,60658,"Trump fills Madison Square Garden with anger, vitriol and racist threats",339,3,No,No,0,https://www.theguardian.com/us-news/2024/oct/27/trump-madison-square-garden-rally,/r/Impeach_Trump/comments/1gdyv1d/trump_fills_madison_square_garden_with_anger/
