Keyword,Subreddit,Category,Members,Title,Upvotes,Comments,Moderator Interaction,Fact-Checking Mention,Total Awards,URL,Original Post URL
Trump,Conservatives,Ideological Politics,108141,BREAKING: Donald Trump Wins North Carolina,48,1,No,No,0,https://redstate.com/sister-toldjah/2024/11/05/donald-trump-wins-north-carolina-n2181560,/r/conservatives/comments/1gkomph/breaking_donald_trump_wins_north_carolina/
Trump,Conservatives,Ideological Politics,108141,The Best Thing For America Would Be A Donald Trump Blowout,206,9,No,No,0,https://thefederalist.com/2024/11/05/the-best-thing-for-america-would-be-a-donald-trump-blowout/,/r/conservatives/comments/1gkef54/the_best_thing_for_america_would_be_a_donald/
Trump,Conservatives,Ideological Politics,108141,Donald Trump Presses Americans to Stay in Line to Vote: ‘Do Not Let Them Move You’,98,1,No,No,0,https://www.breitbart.com/politics/2024/11/05/donald-trump-presses-americans-stay-in-line-vote-do-not-let-them-move-you/,/r/conservatives/comments/1gkijv1/donald_trump_presses_americans_to_stay_in_line_to/
Trump,Conservatives,Ideological Politics,108141,‘He Will Be A Protector Of Women’: Megyn Kelly Takes Stage With Trump At PA Rally,51,0,No,No,0,https://www.dailywire.com/news/he-will-be-a-protector-of-women-megyn-kelly-takes-stage-with-trump-at-pa-rally,/r/conservatives/comments/1gkmewm/he_will_be_a_protector_of_women_megyn_kelly_takes/
Trump,Conservatives,Ideological Politics,108141,Elon Musk expected to join Trump to watch presidential results come in,96,2,No,No,0,https://nypost.com/2024/11/05/us-news/elon-musk-expected-to-join-trump-to-watch-presidential-results-come-in/,/r/conservatives/comments/1gkg90r/elon_musk_expected_to_join_trump_to_watch/
Trump,dailywire,Ideological Politics,24019,Wall of Hate - Help Document Hatred Against Trump on July13th.com,77,12,Yes,No,0,https://july13th.com/hate/,/r/dailywire/comments/1e3cqx8/wall_of_hate_help_document_hatred_against_trump/
israel,dailywire,Ideological Politics,24019,Israel Eliminates Hamas Leader Yahya Sinwar In Gaza: Reports,131,6,Yes,No,0,https://www.dailywire.com/news/israel-eliminates-hamas-leader-yahya-sinwar-in-gaza-reports?topStoryPosition=1,/r/dailywire/comments/1g5wl85/israel_eliminates_hamas_leader_yahya_sinwar_in/
God,dailywire,Ideological Politics,24019,90% of Redditist are left libs. They must be losing their minds. God forbid you post in r/pics this pic. You would get downvoted to hell. ,178,38,No,No,0,https://i.redd.it/xgh53691p7zd1.jpeg,/r/dailywire/comments/1gkqjnx/90_of_redditist_are_left_libs_they_must_be_losing/
Trump,dailywire,Ideological Politics,24019,Trump!!,262,12,No,No,0,https://i.redd.it/6gx755z2u5zd1.jpeg,/r/dailywire/comments/1gkjep4/trump/
Trump,dailywire,Ideological Politics,24019,Trump closed the gap in Guam and Republicans may flip the legislature,154,12,No,No,0,https://i.redd.it/81l9wu5wr3zd1.jpeg,/r/dailywire/comments/1gk9jde/trump_closed_the_gap_in_guam_and_republicans_may/
Trump,dailywire,Ideological Politics,24019,Kamala's hats selling like hotcakes???,113,8,No,No,0,https://i.redd.it/6bq27ghg50zd1.png,/r/dailywire/comments/1gjxi1y/kamalas_hats_selling_like_hotcakes/
Trump,Liberal,Ideological Politics,119768,I swear headlines are suddenly backpedaling on Trump/Harris being a close race.,407,162,No,No,0,https://www.reddit.com/r/Liberal/comments/1gkcxo2/i_swear_headlines_are_suddenly_backpedaling_on/,/r/Liberal/comments/1gkcxo2/i_swear_headlines_are_suddenly_backpedaling_on/
Trump,Liberal,Ideological Politics,119768,"So if Harris wins, would this finally be a wake-up call for the GOP?",204,137,No,No,0,https://www.reddit.com/r/Liberal/comments/1gkh3e3/so_if_harris_wins_would_this_finally_be_a_wakeup/,/r/Liberal/comments/1gkh3e3/so_if_harris_wins_would_this_finally_be_a_wakeup/
Trump,Liberal,Ideological Politics,119768,Trump says Liz Cheney wouldn't be a 'war hawk' if 'guns are trained on her face',141,35,No,No,0,https://www.nbcnews.com/politics/2024-election/trump-liz-cheney-war-hawk-guns-pointed-rcna178349,/r/Liberal/comments/1gjqqpf/trump_says_liz_cheney_wouldnt_be_a_war_hawk_if/
abortion,Liberal,Ideological Politics,119768,The right and choice,32,19,No,Yes,0,https://www.reddit.com/r/Liberal/comments/1gi9qf2/the_right_and_choice/,/r/Liberal/comments/1gi9qf2/the_right_and_choice/
Trump,KamalaHarris,Ideological Politics,83062,Sitting here sobbing. ,4570,231,No,No,0,https://www.reddit.com/r/KamalaHarris/comments/1gkg9pc/sitting_here_sobbing/,/r/KamalaHarris/comments/1gkg9pc/sitting_here_sobbing/
Trump,KamalaHarris,Ideological Politics,83062,Donald Trump has accomplished what no other American president ever has: He convinced me to vote for a Democrat. ,3486,93,No,No,0,https://www.reddit.com/r/KamalaHarris/comments/1gkg0ml/donald_trump_has_accomplished_what_no_other/,/r/KamalaHarris/comments/1gkg0ml/donald_trump_has_accomplished_what_no_other/
Trump,KamalaHarris,Ideological Politics,83062,"No college, blue collar white guy just voted for Harris/Walz. I'm so anxious to see the results. I can't sit through another Trump term.",1691,73,No,No,0,https://i.redd.it/9s036ooi06zd1.jpeg,/r/KamalaHarris/comments/1gkk7ak/no_college_blue_collar_white_guy_just_voted_for/
Trump,KamalaHarris,Ideological Politics,83062,Trump supporter asked to see pictures of men voting for Harris. I obliged them.,911,59,No,No,0,https://i.redd.it/80wap4iab6zd1.jpeg,/r/KamalaHarris/comments/1gkli7v/trump_supporter_asked_to_see_pictures_of_men/
Trump,KamalaHarris,Ideological Politics,83062,My whole family is made up of Republicans who have always voted republican. This time all of them voted for Kamala.,5025,309,No,No,0,https://www.reddit.com/r/KamalaHarris/comments/1gk82hi/my_whole_family_is_made_up_of_republicans_who/,/r/KamalaHarris/comments/1gk82hi/my_whole_family_is_made_up_of_republicans_who/
Trump,KamalaHarris,Ideological Politics,83062,"i, a christian, can’t tell anyone i voted for kamala and it’s making me sick to my stomach.",982,155,No,No,0,https://www.reddit.com/r/KamalaHarris/comments/1gkjt6d/i_a_christian_cant_tell_anyone_i_voted_for_kamala/,/r/KamalaHarris/comments/1gkjt6d/i_a_christian_cant_tell_anyone_i_voted_for_kamala/
Trump,KamalaHarris,Ideological Politics,83062,Voted for Harris 2 hours ago. ,3548,165,No,No,0,https://www.reddit.com/r/KamalaHarris/comments/1gk9ve8/voted_for_harris_2_hours_ago/,/r/KamalaHarris/comments/1gk9ve8/voted_for_harris_2_hours_ago/
Trump,KamalaHarris,Ideological Politics,83062,"My grandma hated the Orange Man, but sadly passed in February. She would have been so excited to vote for Kamala, so my vote is for her. ",744,16,No,No,0,https://www.reddit.com/gallery/1gkle1j,/r/KamalaHarris/comments/1gkle1j/my_grandma_hated_the_orange_man_but_sadly_passed/
Trump,Impeach_Trump,Ideological Politics,60719,Literal Neo-Nazi Leader Endorses Trump,111,1,No,No,0,https://www.rollingstone.com/politics/politics-news/trump-endorsement-neo-nazi-leader-nsc-131-1235154089/,/r/Impeach_Trump/comments/1gkmq6t/literal_neonazi_leader_endorses_trump/
Trump,Impeach_Trump,Ideological Politics,60719,Trump's crowds are dwindling as his campaign winds down — Empty seats and early exits have grown more common,417,15,No,No,0,https://www.nytimes.com/2024/11/04/us/politics/trump-rally-crowds.html,/r/Impeach_Trump/comments/1gjn8sb/trumps_crowds_are_dwindling_as_his_campaign_winds/
Trump,Impeach_Trump,Ideological Politics,60719,"Donald Trump talks about women at his rallies like they are objects, he doesn't see them as equals",296,3,No,No,0,https://imghoster.co/v3YtmBuQO5WqVHF,/r/Impeach_Trump/comments/1ggdie6/donald_trump_talks_about_women_at_his_rallies/
Trump,Impeach_Trump,Ideological Politics,60719,"Donald Trump called half of America ""human scum""",192,5,No,No,0,https://imghoster.co/VN2ORQf6SinlHXJ?utm_source=reddit&utm_medium=impeach_trump,/r/Impeach_Trump/comments/1gg9nmz/donald_trump_called_half_of_america_human_scum/
Trump,Impeach_Trump,Ideological Politics,60719,This is an amazing article written by user u/SilkyFluffs in r/democrats which is an amazing resource for combating GOP and Trump misinformation and possibly even converting family members or undecided voters,44,0,No,Yes,0,https://pdflink.to/d6e0bc9d/,/r/Impeach_Trump/comments/1ggd0pc/this_is_an_amazing_article_written_by_user/
Trump,Impeach_Trump,Ideological Politics,60719,"Elon Musk predicts ‘hardship,’ economic turmoil and a stock-market crash if Trump wins",60,4,No,No,0,https://www.marketwatch.com/story/kaboom-elon-musk-predicts-hardship-economic-turmoil-and-a-stock-market-crash-if-trump-wins-20483008,/r/Impeach_Trump/comments/1gfwy5u/elon_musk_predicts_hardship_economic_turmoil_and/
Trump,Impeach_Trump,Ideological Politics,60719,Kamala's rally in DC vs. Trump's rally in DC,131,0,No,No,0,https://imghoster.co/en/D370Y9JxmPOx6x3,/r/Impeach_Trump/comments/1gfnege/kamalas_rally_in_dc_vs_trumps_rally_in_dc/
Trump,Impeach_Trump,Ideological Politics,60719,Trump is 10x more corrupt than all the rest put together,320,3,No,No,0,https://imghoster.co/en/R3aE5Zdu1UQvWSj,/r/Impeach_Trump/comments/1getadg/trump_is_10x_more_corrupt_than_all_the_rest_put/
Trump,Impeach_Trump,Ideological Politics,60719,60 Reasons NOT to Vote Trump,141,6,No,No,0,https://imghoster.co/en/6ErQCOzq6Aqo5bH?utm_source=reddit&utm_medium=impeach_trump,/r/Impeach_Trump/comments/1geqmj2/60_reasons_not_to_vote_trump/
Trump,Impeach_Trump,Ideological Politics,60719,A quote from John Oliver for more reasons not to vote for Trump,21,0,No,No,0,https://imghoster.co/en/m3KOprcF1vwi76n,/r/Impeach_Trump/comments/1gexjzw/a_quote_from_john_oliver_for_more_reasons_not_to/
Trump,Impeach_Trump,Ideological Politics,60719,Trump’s Biggest Con: Pretending to Support American Workers [𝑵𝒐 𝑷𝒂𝒚𝒘𝒂𝒍𝒍!],157,0,No,No,0,https://www.nytimes.com/2024/10/28/opinion/trump-american-workers.html?unlocked_article_code=1.Vk4.MjsT.VUigyDoGZ9rX&smid=re-nytopinion,/r/Impeach_Trump/comments/1gehvf2/trumps_biggest_con_pretending_to_support_american/
Madison Square Garden,Impeach_Trump,Ideological Politics,60719,"Trump fills Madison Square Garden with anger, vitriol and racist threats",342,3,No,No,0,https://www.theguardian.com/us-news/2024/oct/27/trump-madison-square-garden-rally,/r/Impeach_Trump/comments/1gdyv1d/trump_fills_madison_square_garden_with_anger/
