Keyword,Subreddit,Category,Members,Title,Upvotes,Comments,Moderator Interaction,Fact-Checking Mention,Total Awards,URL,Original Post URL
justice,Wikileaks,General Politics,177604,"Finally Free, Assange Receives a Measure of Justice From the Council of Europe",38,1,No,No,0,https://truthout.org/articles/finally-free-assange-receives-a-measure-of-justice-from-the-council-of-europe/,/r/WikiLeaks/comments/1fxlpkt/finally_free_assange_receives_a_measure_of/
rally,Wikileaks,General Politics,177604,Why does the US still control every penny of Iraqi oil revenues?,39,7,No,No,0,https://www.reddit.com/r/WikiLeaks/comments/1fso9v7/why_does_the_us_still_control_every_penny_of/,/r/WikiLeaks/comments/1fso9v7/why_does_the_us_still_control_every_penny_of/
israel,Wikileaks,General Politics,177604,The Hezbollah leader killed by Israel professed to want peace,0,20,No,No,0,https://youtu.be/3M1fHfKenTM?si=5By4wuDaS7IRM2hb&t=185s,/r/WikiLeaks/comments/1fryvhy/the_hezbollah_leader_killed_by_israel_professed/
police,News,General Politics,28889743,Police say they’ve arrested a man trying to enter the US Capitol with a torch and flare gun,38910,1209,No,No,0,https://apnews.com/live/senate-house-election-updates-11-5-2024#00000192-fdaf-dd3b-abfa-ffef7f0c0000?utm_source=reddit&utm_medium=share,/r/news/comments/1gkeoz1/police_say_theyve_arrested_a_man_trying_to_enter/
police,News,General Politics,28889743,24-year-old man punches election judge in the face while waiting in line to vote: Police,14372,758,No,No,0,https://abcnews.go.com/Politics/24-year-man-punches-election-judge-face-waiting/story?id=115508484,/r/news/comments/1gkdby0/24yearold_man_punches_election_judge_in_the_face/
Trump,News,General Politics,28889743,Federal election monitors will not enter Texas polling locations after Paxton lawsuit. A Trump-appointed Texas judge denied a request to block the Department of Justice from monitoring polls. ,8050,497,No,No,0,https://www.chron.com/politics/article/texas-polling-monitors-paxton-19889589.php,/r/news/comments/1gkd0bp/federal_election_monitors_will_not_enter_texas/
Trump,PoliticalDiscussion,General Politics,2185450,2024 Presidential Election Results Megathread,483,7116,Yes,No,0,https://www.reddit.com/r/PoliticalDiscussion/comments/1gkj668/2024_presidential_election_results_megathread/,/r/PoliticalDiscussion/comments/1gkj668/2024_presidential_election_results_megathread/
cop,PoliticalDiscussion,General Politics,2185450,"2024 Congressional, State, and Local Results Megathread",52,31,Yes,No,0,https://www.reddit.com/r/PoliticalDiscussion/comments/1gkj8py/2024_congressional_state_and_local_results/,/r/PoliticalDiscussion/comments/1gkj8py/2024_congressional_state_and_local_results/
Trump,PoliticalDiscussion,General Politics,2185450,"How much does ""ground game"" and canvassing actually help a candidate? Does it ever backfire?",102,55,No,No,0,https://www.reddit.com/r/PoliticalDiscussion/comments/1gkiejf/how_much_does_ground_game_and_canvassing_actually/,/r/PoliticalDiscussion/comments/1gkiejf/how_much_does_ground_game_and_canvassing_actually/
Trump,PoliticalDiscussion,General Politics,2185450,"How would this election, the 2024 election, be the last election that the American people will get to decide if Donald Trump wins? ",300,668,No,No,0,https://www.reddit.com/r/PoliticalDiscussion/comments/1gk7jem/how_would_this_election_the_2024_election_be_the/,/r/PoliticalDiscussion/comments/1gk7jem/how_would_this_election_the_2024_election_be_the/
Trump,PoliticalDiscussion,General Politics,2185450,Should Harris challenge the election results if she suspects that election integrity has been compromised?,133,169,No,No,0,https://www.reddit.com/r/PoliticalDiscussion/comments/1gkawwn/should_harris_challenge_the_election_results_if/,/r/PoliticalDiscussion/comments/1gkawwn/should_harris_challenge_the_election_results_if/
Trump,PoliticalDiscussion,General Politics,2185450,"What does Donald Trump do if he loses the election tomorrow, what happens to Trumpism? ",539,764,No,No,0,https://www.reddit.com/r/PoliticalDiscussion/comments/1gjw1uo/what_does_donald_trump_do_if_he_loses_the/,/r/PoliticalDiscussion/comments/1gjw1uo/what_does_donald_trump_do_if_he_loses_the/
white,PoliticalDiscussion,General Politics,2185450,"FiveThirtyEight currently gives Republicans a 90% chance of winning the Senate and 51% chance of winning the House. If Kamala Harris becomes president but both chambers of Congress go red, what will the next 4 years look like?",789,646,No,No,0,https://www.reddit.com/r/PoliticalDiscussion/comments/1gjn8aq/fivethirtyeight_currently_gives_republicans_a_90/,/r/PoliticalDiscussion/comments/1gjn8aq/fivethirtyeight_currently_gives_republicans_a_90/
Trump,PoliticalDiscussion,General Politics,2185450,PBS has released its final [NPR/Marist] election poll giving Harris a 4% [51-47] lead among likely voters. The 2020 election was also 51 to 47 percent.  Just hours from election day does this data have some predictive value in assessing electoral college map? ,497,268,No,No,0,https://www.reddit.com/r/PoliticalDiscussion/comments/1gjqw99/pbs_has_released_its_final_nprmarist_election/,/r/PoliticalDiscussion/comments/1gjqw99/pbs_has_released_its_final_nprmarist_election/
Trump,PoliticalDiscussion,General Politics,2185450,What Made Trump's Favorability to Win Rise in October?,94,314,No,No,0,https://www.reddit.com/r/PoliticalDiscussion/comments/1gjyjhm/what_made_trumps_favorability_to_win_rise_in/,/r/PoliticalDiscussion/comments/1gjyjhm/what_made_trumps_favorability_to_win_rise_in/
abortion,PoliticalDiscussion,General Politics,2185450,"It's November 4. Was there an ""October Surprise"" as that term is used in American political discourse?",208,244,No,No,0,https://www.reddit.com/r/PoliticalDiscussion/comments/1gjqq00/its_november_4_was_there_an_october_surprise_as/,/r/PoliticalDiscussion/comments/1gjqq00/its_november_4_was_there_an_october_surprise_as/
Trump,PoliticalDiscussion,General Politics,2185450,"In a popular vote election, how would campaigns change?",56,95,No,No,0,https://www.reddit.com/r/PoliticalDiscussion/comments/1gjoez8/in_a_popular_vote_election_how_would_campaigns/,/r/PoliticalDiscussion/comments/1gjoez8/in_a_popular_vote_election_how_would_campaigns/
Trump,NeutralPolitics,General Politics,610606,What to expect after the U.S. election,278,23,Yes,Yes,0,https://www.reddit.com/r/NeutralPolitics/comments/1gflxpk/what_to_expect_after_the_us_election/,/r/NeutralPolitics/comments/1gflxpk/what_to_expect_after_the_us_election/
Trump,NeutralPolitics,General Politics,610606,What is the best website to view live election results?,202,61,No,Yes,0,https://www.reddit.com/r/NeutralPolitics/comments/1gk42lg/what_is_the_best_website_to_view_live_election/,/r/NeutralPolitics/comments/1gk42lg/what_is_the_best_website_to_view_live_election/
Trump,NeutralPolitics,General Politics,610606,What plans about trump and kamala have on section 8 housing and dept of edu.,0,6,No,No,0,https://www.reddit.com/r/NeutralPolitics/comments/1gk1emp/what_plans_about_trump_and_kamala_have_on_section/,/r/NeutralPolitics/comments/1gk1emp/what_plans_about_trump_and_kamala_have_on_section/
Trump,NeutralPolitics,General Politics,610606,How do the Trump and Harris plans for workforce pay and taxes compare?,2,4,No,No,0,https://www.reddit.com/r/NeutralPolitics/comments/1ggxh8w/how_do_the_trump_and_harris_plans_for_workforce/,/r/NeutralPolitics/comments/1ggxh8w/how_do_the_trump_and_harris_plans_for_workforce/
israel,NeutralPolitics,General Politics,610606,"Why does Israel, a nation with a modern first world economy, need ""aid"" from the US as a part of its conflict?",262,77,No,No,0,https://www.reddit.com/r/NeutralPolitics/comments/1gewboa/why_does_israel_a_nation_with_a_modern_first/,/r/NeutralPolitics/comments/1gewboa/why_does_israel_a_nation_with_a_modern_first/
palestine,NeutralPolitics,General Politics,610606,"War involving Israel, Lebanon, and Iran--Motivations? Scale of Conflict?",18,6,No,No,0,https://www.reddit.com/r/NeutralPolitics/comments/1ge5sct/war_involving_israel_lebanon_and_iranmotivations/,/r/NeutralPolitics/comments/1ge5sct/war_involving_israel_lebanon_and_iranmotivations/
Trump,NeutralPolitics,General Politics,610606,"When, if ever, have have UK political parties sent delegates to the USA to help with election campaigns?",100,38,No,No,0,https://www.reddit.com/r/NeutralPolitics/comments/1ga59yb/when_if_ever_have_have_uk_political_parties_sent/,/r/NeutralPolitics/comments/1ga59yb/when_if_ever_have_have_uk_political_parties_sent/
Trump,moderatepolitics,General Politics,295352,Trump on RFK's role in banning vaccines in his administration: 'I'll make a decision',164,214,No,No,0,https://thehill.com/policy/healthcare/4969663-trump-vaccine-banning-kennedy/,/r/moderatepolitics/comments/1gjlx2i/trump_on_rfks_role_in_banning_vaccines_in_his/
Trump,moderatepolitics,General Politics,295352,Supreme Court's Ruling on Presidential Immunity,60,324,No,No,0,https://www.reddit.com/r/moderatepolitics/comments/1gjqz6i/supreme_courts_ruling_on_presidential_immunity/,/r/moderatepolitics/comments/1gjqz6i/supreme_courts_ruling_on_presidential_immunity/
Trump,moderatepolitics,General Politics,295352,Trump says RFK Jr.’s proposal to remove fluoride from public water ‘sounds OK to me’ | CNN Politics,440,458,No,No,0,https://edition.cnn.com/2024/11/03/politics/rfk-jr-fluoride-trump/index.html,/r/moderatepolitics/comments/1gjal4y/trump_says_rfk_jrs_proposal_to_remove_fluoride/
Trump,moderatepolitics,General Politics,295352,Trump campaign leaving some cities with hundreds of thousands in unpaid bills after rallies,234,123,No,No,0,https://abcnews.go.com/Politics/trump-campaign-leaving-cities-hundreds-thousands-unpaid-bills/story?id=115415455,/r/moderatepolitics/comments/1gjchpq/trump_campaign_leaving_some_cities_with_hundreds/
Trump,moderatepolitics,General Politics,295352,NBC Gives Donald Trump Campaign Time During NASCAR Race in Response to Kamala Harris’ ‘SNL’ Appearance,271,75,No,No,0,https://www.hollywoodreporter.com/tv/tv-news/nbc-donald-trump-campaign-free-ad-time-nascar-race-kamala-harris-snl-sketch-1236052709/,/r/moderatepolitics/comments/1gj5u4d/nbc_gives_donald_trump_campaign_time_during/
Trump,moderatepolitics,General Politics,295352,Trump Tells Supporters He ‘Shouldn’t Have Left’ the White House,197,148,No,No,0,https://www.removepaywall.com/search?url=https://www.nytimes.com/2024/11/03/us/politics/trump-pa-rally-election.html?unlocked_article_code=1.XE4.p7LV.XXVdYcQXqCE8&smid=url-share,/r/moderatepolitics/comments/1gj2g92/trump_tells_supporters_he_shouldnt_have_left_the/
white,technology,General Politics,17361687,X Is a White-Supremacist Site - The Atlantic,29283,967,No,No,0,https://www.theatlantic.com/technology/archive/2024/11/x-white-supremacist-site/680538/,/r/technology/comments/1gkkxt1/x_is_a_whitesupremacist_site_the_atlantic/
israel,technology,General Politics,17361687,"Misleading ‘pro-Harris’ texts are bombarding swing state voters | As Election Day approached, Democratic voters in Michigan and Pennsylvania were flooded with suspicious messages about Harris’ stance on Israel.",11889,612,No,No,0,https://www.theverge.com/2024/11/5/24288263/harris-texts-israel-gaza-michigan-pennsylvania,/r/technology/comments/1gkep9o/misleading_proharris_texts_are_bombarding_swing/
Trump,technology,General Politics,17361687,Will Social Platforms Take Down a Premature Donald Trump Victory Post?,2001,157,No,No,0,https://www.wired.com/story/will-social-platforms-take-down-a-premature-trump-victory-post/,/r/technology/comments/1gkj6cp/will_social_platforms_take_down_a_premature/
Trump,technology,General Politics,17361687,AI-driven bot network trying to help Trump win US election,1386,56,No,No,0,https://www.dw.com/en/ai-driven-bot-network-trying-to-help-trump-win-us-election/a-70695526?maca=en-rss-en-world-4025-rdf,/r/technology/comments/1gkc0a1/aidriven_bot_network_trying_to_help_trump_win_us/
Trump,democrats,Ideological Politics,480989,Look what these Trump supporters did to my uncle’s car today,3397,570,No,No,0,https://www.reddit.com/gallery/1gkgynv,/r/democrats/comments/1gkgynv/look_what_these_trump_supporters_did_to_my_uncles/
white,democrats,Ideological Politics,480989,"Straight white 18 year old from Wyoming, voting against the Nazi. Vote! 💙",5653,260,No,No,0,https://i.redd.it/80fcqouac4zd1.jpeg,/r/democrats/comments/1gkc9ko/straight_white_18_year_old_from_wyoming_voting/
Trump,democrats,Ideological Politics,480989,White guys for Harris!,3654,154,No,No,0,https://i.redd.it/tqpb58t614zd1.jpeg,/r/democrats/comments/1gkarkt/white_guys_for_harris/
Trump,democrats,Ideological Politics,480989,"I’m a Canadian, and I suspect I’ve been duped by social media and Reddit into thinking that Harris was going to resoundingly win this election. Where do all these votes for Trump come from?",261,348,No,No,0,https://i.redd.it/6xjbqcsqt7zd1.jpeg,/r/democrats/comments/1gkqyza/im_a_canadian_and_i_suspect_ive_been_duped_by/
Trump,democrats,Ideological Politics,480989,I want to strongly encourage everyone to not lose hope at this time.,403,276,No,No,0,https://i.redd.it/aieyeche27zd1.jpeg,/r/democrats/comments/1gkoebr/i_want_to_strongly_encourage_everyone_to_not_lose/
white,democrats,Ideological Politics,480989,Hopium Election Night Update #2 - Statement From Harris-Walz Chair Jen O'Malley Dillon,258,61,No,No,0,https://i.redd.it/ao6lfv18q7zd1.jpeg,/r/democrats/comments/1gkqne8/hopium_election_night_update_2_statement_from/
Trump,Republican,Ideological Politics,202592,Donald Trump has won the election!,7,85,Yes,No,0,https://www.reddit.com/r/Republican/comments/1gks6zr/donald_trump_has_won_the_election/,/r/Republican/comments/1gks6zr/donald_trump_has_won_the_election/
Trump,Republican,Ideological Politics,202592,"White, college educated, women for Trump (because there are so few of us, according to the left)",1577,279,No,No,0,https://i.redd.it/avpbs4a7q4zd1.jpeg,/r/Republican/comments/1gke537/white_college_educated_women_for_trump_because/
Trump,Republican,Ideological Politics,202592,My liberal dad,485,45,No,No,0,https://i.redd.it/dn61obvuh6zd1.jpeg,/r/Republican/comments/1gkm92n/my_liberal_dad/
Trump,Republican,Ideological Politics,202592,Latinos for Trump! 🇺🇸🇵🇷🇩🇴,854,40,No,No,0,https://www.reddit.com/gallery/1gkh4c5,/r/Republican/comments/1gkh4c5/latinos_for_trump/
Trump,Republican,Ideological Politics,202592,3rd time able to vote and 3rd time voting for him! Trump! ♥️,877,50,No,No,0,https://i.redd.it/iknsjihex4zd1.jpeg,/r/Republican/comments/1gkf44y/3rd_time_able_to_vote_and_3rd_time_voting_for_him/
Trump,Republican,Ideological Politics,202592,I voted Republican for the first time in my life! ,453,46,No,No,0,https://www.reddit.com/r/Republican/comments/1gkhd2p/i_voted_republican_for_the_first_time_in_my_life/,/r/Republican/comments/1gkhd2p/i_voted_republican_for_the_first_time_in_my_life/
Trump,Republican,Ideological Politics,202592,Blacks for Trump!,1178,136,No,No,0,https://www.reddit.com/gallery/1gk7mji,/r/Republican/comments/1gk7mji/blacks_for_trump/
Trump,Republican,Ideological Politics,202592,Trump 2024! 🇺🇸,624,26,No,No,0,https://i.redd.it/gzawhqdeb4zd1.jpeg,/r/Republican/comments/1gkc56k/trump_2024/
Trump,Republican,Ideological Politics,202592,My parents are first time voters and…,167,23,No,No,0,https://www.reddit.com/r/Republican/comments/1gklgr0/my_parents_are_first_time_voters_and/,/r/Republican/comments/1gklgr0/my_parents_are_first_time_voters_and/
Trump,Republican,Ideological Politics,202592,Tim Stanley: It's beginning to look like Donald Trump is going to win,111,31,No,No,0,https://www.telegraph.co.uk/us/comment/2024/11/06/its-beginning-to-look-like-donald-trump-is-going-to-win/,/r/Republican/comments/1gknt9y/tim_stanley_its_beginning_to_look_like_donald/
Trump,Republican,Ideological Politics,202592,Voting FOR My Interests,916,86,No,No,0,https://www.reddit.com/gallery/1gk7my0,/r/Republican/comments/1gk7my0/voting_for_my_interests/
Trump,Conservative,Ideological Politics,1137719,BREAKING: Donald J. Trump will be the 47th president of the United States after winning Pennsylvania,492,583,Yes,No,0,https://x.com/ericldaugh/status/1854046247448904062?s=46&t=AwX37EOWy1lQm64wqhPcWw,/r/Conservative/comments/1gkrzai/breaking_donald_j_trump_will_be_the_47th/
Trump,Conservative,Ideological Politics,1137719,Vice President Harris will not talk tonight,778,318,No,No,0,https://www.reddit.com/r/Conservative/comments/1gkrfb1/vice_president_harris_will_not_talk_tonight/,/r/Conservative/comments/1gkrfb1/vice_president_harris_will_not_talk_tonight/
Trump,Conservative,Ideological Politics,1137719,BREAKING: Donald Trump Wins North Carolina,1033,120,No,No,0,https://redstate.com/sister-toldjah/2024/11/05/donald-trump-wins-north-carolina-n2181560,/r/Conservative/comments/1gkomd6/breaking_donald_trump_wins_north_carolina/
Trump,Conservative,Ideological Politics,1137719,Miami-Dade is RED!!!!,1017,50,No,No,0,https://www.reddit.com/r/Conservative/comments/1gkmz7c/miamidade_is_red/,/r/Conservative/comments/1gkmz7c/miamidade_is_red/
Trump,Conservative,Ideological Politics,1137719,NYT: Trump Projected to Win the Electoral College AND the Popular Vote,313,98,No,No,0,https://townhall.com/tipsheet/mattvespa/2024/11/05/nyt-gives-trump-a-73-percent-chance-of-winning-the-2024-election-n2647336,/r/Conservative/comments/1gkrq8n/nyt_trump_projected_to_win_the_electoral_college/
Trump,Conservative,Ideological Politics,1137719,Trump is going to win the election and the far-left lunatics on this site are going to have a complete meltdown ,2670,666,No,No,0,https://v.redd.it/8hb7z6h5n4zd1,/r/Conservative/comments/1gkdq79/trump_is_going_to_win_the_election_and_the/
God,Conservative,Ideological Politics,1137719,"Meanwhile,  in PA...",3067,412,No,No,0,https://i.redd.it/0va4q4s5n4zd1.jpeg,/r/Conservative/comments/1gkdqa1/meanwhile_in_pa/
Trump,Conservative,Ideological Politics,1137719,Trump is currently leading the popular vote!,283,52,No,No,0,https://www.reddit.com/r/Conservative/comments/1gkr4ki/trump_is_currently_leading_the_popular_vote/,/r/Conservative/comments/1gkr4ki/trump_is_currently_leading_the_popular_vote/
Trump,Libertarian,Ideological Politics,503563,"Read about the Libertarian Party Chair’s dinner with Trump and what they talked about, they even made the case for libertarianism to him",22,18,Yes,No,0,https://www.reddit.com/gallery/1gh8us8,/r/Libertarian/comments/1ghkmue/read_about_the_libertarian_party_chairs_dinner/
cop,Anarchism,Ideological Politics,270405,"With the future uncertain, it's a good time to explain what we're fighting for and invite people to act alongside us. To aid in your outreach efforts, you can order copies of To Change Everything, our introduction to anarchism, for the costs of printing and postage alone.",82,4,Yes,No,0,https://www.reddit.com/gallery/1gfcuth,/r/Anarchism/comments/1gfcygw/with_the_future_uncertain_its_a_good_time_to/
black,Anarchism,Ideological Politics,270405,The Lure of Elections,4,0,No,No,0,https://www.reddit.com/r/Anarchism/comments/1gklial/the_lure_of_elections/,/r/Anarchism/comments/1gklial/the_lure_of_elections/
Trump,Anarchism,Ideological Politics,270405,Update on the “I want to make a difference post but don’t know how”:,153,19,No,No,0,https://www.reddit.com/gallery/1gjxc7z,/r/Anarchism/comments/1gjxc7z/update_on_the_i_want_to_make_a_difference_post/
rally,Anarchism,Ideological Politics,270405,"What's more annoying, the people or the politicians?",31,21,No,No,0,https://www.reddit.com/r/Anarchism/comments/1gk458e/whats_more_annoying_the_people_or_the_politicians/,/r/Anarchism/comments/1gk458e/whats_more_annoying_the_people_or_the_politicians/
rally,Anarchism,Ideological Politics,270405,My thoughts today,2,1,No,No,0,https://i.redd.it/17kqn8l6j5zd1.jpeg,/r/Anarchism/comments/1gkhzs1/my_thoughts_today/
rally,Anarchism,Ideological Politics,270405,"What are the small, but constructive things we do everyday that align with anarchistic morals/values ?",74,50,No,No,0,https://www.reddit.com/r/Anarchism/comments/1gjkb05/what_are_the_small_but_constructive_things_we_do/,/r/Anarchism/comments/1gjkb05/what_are_the_small_but_constructive_things_we_do/
israel,Socialism,Ideological Politics,460346,NYC: INTERNATIONAL DAY OF SOLIDARITY WITH THE PALESTINIAN PEOPLE,78,2,No,No,0,https://i.redd.it/lbcik3bwm6zd1.jpeg,/r/socialism/comments/1gkmsyj/nyc_international_day_of_solidarity_with_the/
gaza,Socialism,Ideological Politics,460346,Look at our story with humanity and mercy.,103,3,No,No,0,https://i.redd.it/jru5os3al5zd1.jpeg,/r/socialism/comments/1gki9jl/look_at_our_story_with_humanity_and_mercy/
God,Socialism,Ideological Politics,460346,How do we talk to liberals?,186,87,No,No,0,https://www.reddit.com/r/socialism/comments/1gkac1k/how_do_we_talk_to_liberals/,/r/socialism/comments/1gkac1k/how_do_we_talk_to_liberals/
Puerto Rico,Socialism,Ideological Politics,460346,US controll over Puerto Rico ,81,3,No,No,0,https://v.redd.it/6p3ix3lx64zd1,/r/socialism/comments/1gkbjyv/us_controll_over_puerto_rico/
black,Socialism,Ideological Politics,460346,Hpw did the black panther party make money and survive with a daily job of activism and community service?,32,6,No,No,0,https://www.reddit.com/r/socialism/comments/1gkig4a/hpw_did_the_black_panther_party_make_money_and/,/r/socialism/comments/1gkig4a/hpw_did_the_black_panther_party_make_money_and/
palestine,Socialism,Ideological Politics,460346,"Join us for a powerful Children’s Art Build in Chicago on Nov. 9th from 1-3 pm at 4613 N Kedzie Ave, as we honor the resilience and voices of Palestine’s children. ",9,2,No,No,0,https://www.reddit.com/gallery/1gko6fq,/r/socialism/comments/1gko6fq/join_us_for_a_powerful_childrens_art_build_in/
israel,Socialism,Ideological Politics,460346,"Morning Joe: Dems’ Favorite Show, Blatant Pro-Israel Propaganda",29,1,No,No,0,https://jacobin.com/2024/11/morning-joe-biden-gaza-israel/,/r/socialism/comments/1gk9fwm/morning_joe_dems_favorite_show_blatant_proisrael/
Trump,Progressive,Ideological Politics,78007,Michael Moore predicts 'Trump is toast' in 2024,133,12,No,No,0,https://www.youtube.com/watch?v=fNLUccZ25Io,/r/progressive/comments/1gjipdk/michael_moore_predicts_trump_is_toast_in_2024/
abortion,Progressive,Ideological Politics,78007,Will Abortion Rights Decide 2024 Election?,65,6,No,No,0,https://www.democracynow.org/2024/11/1/amy_littlefield_abortion_2024_election,/r/progressive/comments/1gigwsj/will_abortion_rights_decide_2024_election/
Puerto Rico,Progressive,Ideological Politics,78007,Americans in Puerto Rico can't vote for US president. Their anger at Trump is shaping the race.,341,29,No,No,0,https://apnews.com/article/puerto-rico-trump-joke-garbage-a91e2aafd93a06d32365efa013581b85,/r/progressive/comments/1gh2ab4/americans_in_puerto_rico_cant_vote_for_us/
rally,Progressive,Ideological Politics,78007,20k+ attend Michigan Rally,137,2,No,No,0,https://i.redd.it/ywmuqgzbhlxd1.jpeg,/r/progressive/comments/1gelsyg/20k_attend_michigan_rally/
Trump,Progressive,Ideological Politics,78007,"Trump loyalists spew racist, vulgar attacks at Harris and Democrats at New York City rally",257,6,No,No,0,https://www.cnn.com/2024/10/27/politics/trump-rally-madison-square-garden-vulgar-attacks/index.html,/r/progressive/comments/1gdskia/trump_loyalists_spew_racist_vulgar_attacks_at/
abortion,Progressive,Ideological Politics,78007,Why Catholic bishops are donating less to oppose abortion rights measures this year,47,2,No,No,0,https://www.npr.org/2024/10/20/nx-s1-5144660/catholic-bishops-are-donating-millions-less-to-defeat-abortion-this-year-heres-why,/r/progressive/comments/1g8lhj0/why_catholic_bishops_are_donating_less_to_oppose/
abortion,Progressive,Ideological Politics,78007,"Ron DeSantis, using the levers of state government, ramps up efforts to defeat Florida abortion-rights ballot measure",178,4,No,No,0,https://www.nbcnews.com/politics/2024-election/ron-desantis-florida-abortion-ballot-measure-rcna175337,/r/progressive/comments/1g6fyiv/ron_desantis_using_the_levers_of_state_government/
christian,Republicanism,Ideological Politics,915,Pro-British monarchy Indian Christian saying mocking the name-reverting done by our governments (especially the renaming of Bombay to Mumbai) and openly doing sedition by saying that Charles III should be the Emperor of India and 'God Save the King' should be the Indian anthem.,2,0,No,No,0,https://www.reddit.com/gallery/1b2xwq8,/r/republicanism/comments/1b2xwq8/probritish_monarchy_indian_christian_saying/
God,Republicanism,Ideological Politics,915,"Lone protester booes ""God Save the King"" in Scotland",12,0,No,No,0,https://youtu.be/dtB_C5xOpOI,/r/republicanism/comments/xcbw3j/lone_protester_booes_god_save_the_king_in_scotland/
Trump,Conservatives,Ideological Politics,108141,GO VOTE!,47,0,Yes,Yes,0,https://www.reddit.com/r/conservatives/comments/1gk764p/go_vote/,/r/conservatives/comments/1gk764p/go_vote/
Trump,Conservatives,Ideological Politics,108141,Exit Polls: 25% of Black Men in Georgia Voted for Donald Trump this Election,193,10,No,No,0,https://www.breitbart.com/politics/2024/11/05/exit-polls-25-of-black-men-in-georgia-voted-for-donald-trump-this-election/,/r/conservatives/comments/1gkn72a/exit_polls_25_of_black_men_in_georgia_voted_for/
Trump,Conservatives,Ideological Politics,108141,Trump Wants the Presidential Winner to Be Declared on Election Night,420,93,No,No,0,https://medium.com/@sdiraguide/trump-wants-the-presidential-winner-to-be-declared-on-election-night-caeb180d9f97,/r/conservatives/comments/1gkab8f/trump_wants_the_presidential_winner_to_be/
Trump,Conservatives,Ideological Politics,108141,Exit Polls: Most Voters Prefer Donald Trump on Top Issue of Immigration,66,0,No,No,0,https://www.breitbart.com/politics/2024/11/05/exit-polls-most-voters-prefer-donald-trump-on-top-issue-of-immigration/,/r/conservatives/comments/1gkn7ro/exit_polls_most_voters_prefer_donald_trump_on_top/
