Keyword,Subreddit,Category,Members,Title,Upvotes,Comments,Moderator Interaction,Fact-Checking Mention,Total Awards,URL,Original Post URL
mexico,News,General Politics,28912729,"At least 10 dead after bar shooting in Queretaro, Mexico",1670,72,No,No,0,https://news.sky.com/story/at-least-10-dead-after-bar-shooting-in-queretaro-mexico-13251830,/r/news/comments/1go37cv/at_least_10_dead_after_bar_shooting_in_queretaro/
treaties,PoliticalDiscussion,General Politics,2184588,How does the world deal with the schizophrenic foreign policy that America has? ,353,328,No,No,0,https://www.reddit.com/r/PoliticalDiscussion/comments/1go363q/how_does_the_world_deal_with_the_schizophrenic/,/r/PoliticalDiscussion/comments/1go363q/how_does_the_world_deal_with_the_schizophrenic/
border,PoliticalDiscussion,General Politics,2184588,"Was Trump's win driven by an anti-incumbency sentiment? or was it a successful campaign strategy? had it been the former, would picking a candidate of the same party but not in the incumbent administration have levelled the playing field?",0,35,No,No,0,https://www.reddit.com/r/PoliticalDiscussion/comments/1goqx1f/was_trumps_win_driven_by_an_antiincumbency/,/r/PoliticalDiscussion/comments/1goqx1f/was_trumps_win_driven_by_an_antiincumbency/
immigration,NeutralPolitics,General Politics,610485,Trump won the presidency and popular vote running on the mass deportation of illegal aliens. Who saw this coming and what lessons can be learned?,167,297,No,No,0,https://www.reddit.com/r/NeutralPolitics/comments/1gnk7ih/trump_won_the_presidency_and_popular_vote_running/,/r/NeutralPolitics/comments/1gnk7ih/trump_won_the_presidency_and_popular_vote_running/
border,moderatepolitics,General Politics,296039,Trump says former Ice director Tom Homan will be in charge of borders and deportations,126,260,No,No,0,https://amp.theguardian.com/us-news/2024/nov/11/tom-homan-donald-trump-border-czar-immigration,/r/moderatepolitics/comments/1gop6wi/trump_says_former_ice_director_tom_homan_will_be/
immigration,moderatepolitics,General Politics,296039,Massachusetts Governor Maura Healy’s stance on Donald Trump’s mass deportation of illegal immigrants order,139,279,No,No,0,https://www.dailymail.co.uk/news/article-14059841/amp/massachusetts-governor-maura-healey-donald-trump-deportation-illegal-migrants.html,/r/moderatepolitics/comments/1gncm7t/massachusetts_governor_maura_healys_stance_on/
illegal,technology,General Politics,17383368,"Apple illegally threatened workers over their talk about pay and remote work, feds charge",5290,127,No,No,0,https://www.spokesman.com/stories/2024/nov/06/apple-illegally-threatened-workers-over-their-talk/,/r/technology/comments/1gogo9r/apple_illegally_threatened_workers_over_their/
immigration,Republican,Ideological Politics,205035,Trump appoints UN ambassador Elise Stefanik and border tsar Tom Homan,36,8,No,No,0,https://www.bbc.com/news/articles/c079m9mxx1no,/r/Republican/comments/1goqnt1/trump_appoints_un_ambassador_elise_stefanik_and/
border,Republican,Ideological Politics,205035,Donald Trump names Tom Homan ‘border czar’,88,13,No,No,0,https://www.newsnationnow.com/politics/donald-trump-names-tom-homan-border-czar/,/r/Republican/comments/1goku77/donald_trump_names_tom_homan_border_czar/
border,Conservative,Ideological Politics,1144662,Trump announces Tom Homan to be his Border Czar ,2237,511,No,No,0,https://i.redd.it/9iotu0otc70e1.jpeg,/r/Conservative/comments/1gok7lq/trump_announces_tom_homan_to_be_his_border_czar/
border,Conservative,Ideological Politics,1144662,"'If I Offend Anyone, I Don't Give a S**T': America's New Border Czar is Tom Homan and LET'S Effing GOOO (Watch)",122,8,No,No,0,https://twitchy.com/samj/2024/11/11/meet-our-new-border-czar-tom-homan-n2403614,/r/Conservative/comments/1gosvp8/if_i_offend_anyone_i_dont_give_a_st_americas_new/
illegal,Conservative,Ideological Politics,1144662,Senator-elect Jim Banks to CNN’s Dana Bash: “GOP Must Deport Every Illegal Immigrant” ,120,13,No,No,0,https://banks.house.gov/news/documentsingle.aspx?DocumentID=2339,/r/Conservative/comments/1goqu0x/senatorelect_jim_banks_to_cnns_dana_bash_gop_must/
immigration,Anarchism,Ideological Politics,270966,So should we prepare for a massive civil war under the Trump administration? What do you think is going to look like? I'm imagining some return of the occupy movement with far more intensity,49,73,No,No,0,https://www.reddit.com/r/Anarchism/comments/1gnjmy2/so_should_we_prepare_for_a_massive_civil_war/,/r/Anarchism/comments/1gnjmy2/so_should_we_prepare_for_a_massive_civil_war/
texas,Progressive,Ideological Politics,78027,A Texas Woman Died After Waiting 40 Hours for Miscarriage Care,296,5,No,No,0,https://www.propublica.org/article/josseli-barnica-death-miscarriage-texas-abortion-ban,/r/progressive/comments/1gfmamd/a_texas_woman_died_after_waiting_40_hours_for/
illegal,Conservatives,Ideological Politics,108224,Pelosi: ‘Fewer’ Illegal Aliens Came In Under Biden Than Trump,92,39,No,No,0,https://www.dailywire.com/news/pelosi-fewer-illegal-aliens-came-in-under-biden-than-trump,/r/conservatives/comments/1gok15c/pelosi_fewer_illegal_aliens_came_in_under_biden/
immigration,Liberal,Ideological Politics,119729,Glad to see we have visitors.,4,4,No,Yes,0,https://www.reddit.com/r/Liberal/comments/1gon2jn/glad_to_see_we_have_visitors/,/r/Liberal/comments/1gon2jn/glad_to_see_we_have_visitors/
border,Liberal,Ideological Politics,119729,"Liberals need to stop blaming themselves, and stop blaming Trump voters",152,106,No,Yes,0,https://www.reddit.com/r/Liberal/comments/1gnk7ug/liberals_need_to_stop_blaming_themselves_and_stop/,/r/Liberal/comments/1gnk7ug/liberals_need_to_stop_blaming_themselves_and_stop/
