Keyword,Subreddit,Category,Members,Title,Upvotes,Comments,Moderator Interaction,Fact-Checking Mention,Total Awards,URL,Original Post URL
house,Republicanism,Ideological Politics,917,Meet Susanna Gibson: Virginia Democrat in key state House race calls sharing of pornographic videos ‘the worst gutter politics’,2,0,No,No,0,https://www.celebsweek.com/susanna-gibson/,/r/republicanism/comments/16hfi9k/meet_susanna_gibson_virginia_democrat_in_key/
president,Republicanism,Ideological Politics,917,About the Lopez,4,2,No,No,0,https://www.reddit.com/r/republicanism/comments/1094bh5/about_the_lopez/,/r/republicanism/comments/1094bh5/about_the_lopez/
trump,Conservatives,Ideological Politics,108221,Donald Trump wins most popular votes by a Republican ever,219,3,No,No,0,https://nypost.com/2024/11/10/us-news/donald-trump-wins-most-popular-votes-by-a-republican-ever/,/r/conservatives/comments/1gog5qs/donald_trump_wins_most_popular_votes_by_a/
harris,Conservatives,Ideological Politics,108221,Exit Polling: 40 Percent of Women Under 30 Dumped Harris for Trump,156,0,No,No,0,https://www.breitbart.com/2024-election/2024/11/10/exit-polling-40-percent-of-women-under-30-dumped-harris-for-trump/,/r/conservatives/comments/1goeg7p/exit_polling_40_percent_of_women_under_30_dumped/
trump,Conservatives,Ideological Politics,108221,Senator Hagerty Signals Trump Will Once Again Put The Clamps On Iran,30,2,No,No,0,https://www.dailywire.com/news/senator-hagerty-signals-trump-will-once-again-put-the-clamps-on-iran,/r/conservatives/comments/1goijj4/senator_hagerty_signals_trump_will_once_again_put/
trump,Conservatives,Ideological Politics,108221,"BREAKING: Chaos As Thousands of Immigrants, Protesters March in New York Against Trump's Election",86,30,No,No,0,https://redstate.com/margaret-clark/2024/11/09/breaking-chaos-as-of-thousands-immigrants-and-protestors-march-in-new-york-to-protest-trumps-election-n2181781,/r/conservatives/comments/1gob2qt/breaking_chaos_as_thousands_of_immigrants/
trump,Conservatives,Ideological Politics,108221,"CNN’s Zakaria Slams Dems ‘Lawfare’ Against Trump, ‘Deeply Illiberal’ Culture War",45,0,No,No,0,https://www.breitbart.com/clips/2024/11/10/cnns-zakaria-slams-dems-lawfare-against-trump-deeply-illiberal-culture-war/,/r/conservatives/comments/1gof9s0/cnns_zakaria_slams_dems_lawfare_against_trump/
harris,Conservatives,Ideological Politics,108221,"So, Donald Trump got 150,000 more votes than Trump-backed candidate 
@KariLake
. Lake got nearly 40,000 more votes than Kamala Harris.

BUT Dem. senate candidate Ruben Gallego got 45,000 more than Lake? And he got 80,000 more than Harris?

Somebody make it make sense. 🤔",257,38,No,No,0,https://x.com/kylenabecker/status/1855511157571735825,/r/conservatives/comments/1go2h5p/so_donald_trump_got_150000_more_votes_than/
trump,Conservatives,Ideological Politics,108221,CNN's Official Climate Scold: Trump Will Let Earth Literally Burn Up,60,23,No,No,0,https://redstate.com/wardclark/2024/11/09/cnns-official-climate-scold-trump-will-let-earth-literally-burn-up-n2181774,/r/conservatives/comments/1gocqzg/cnns_official_climate_scold_trump_will_let_earth/
trump,Conservatives,Ideological Politics,108221,FLASHBACK: Was FEMA Punishing Trump Supporters in North Carolina?,146,9,No,No,0,https://redstate.com/streiff/2024/11/10/flashback-was-fema-punishing-trump-supporters-in-north-carolina-n2181798,/r/conservatives/comments/1go5cem/flashback_was_fema_punishing_trump_supporters_in/
senate,Conservatives,Ideological Politics,108221,Schumer Blasted by Republicans for Not Allowing Dave McCormick to Attend Senate Orientation,35,0,No,No,0,https://www.breitbart.com/politics/2024/11/10/schumer-blasted-by-republicans-for-not-allowing-dave-mccormick-attend-senate-orientation/,/r/conservatives/comments/1gofwrq/schumer_blasted_by_republicans_for_not_allowing/
house,Conservatives,Ideological Politics,108221,"Byron Donalds Says FEMA Should Be Ripped Out Of DHS, Report Directly To White House",18,0,No,No,0,https://www.dailywire.com/news/byron-donalds-says-fema-should-be-ripped-out-of-dhs-report-directly-to-white-house,/r/conservatives/comments/1gojd47/byron_donalds_says_fema_should_be_ripped_out_of/
trump,Conservatives,Ideological Politics,108221,"Jim Jordan: Trump, Musk, RFK, Gabbard Came Together Because Of Free Speech Issue",16,0,No,No,0,https://www.dailywire.com/news/jim-jordan-trump-musk-rfk-gabbard-came-together-because-of-free-speech-issue,/r/conservatives/comments/1goiy7y/jim_jordan_trump_musk_rfk_gabbard_came_together/
trump,Conservatives,Ideological Politics,108221,Report: Trump Seeking to Use Military Assets to Enact His Illegals Mass Deportation Plan,107,25,No,No,0,https://redstate.com/rusty-weiss/2024/11/09/report-trump-seeking-to-use-military-assets-to-enact-his-mass-deportation-plan-n2181791,/r/conservatives/comments/1go5hds/report_trump_seeking_to_use_military_assets_to/
trump,dailywire,Ideological Politics,24172,Wall of Hate - Help Document Hatred Against Trump on July13th.com,80,15,Yes,No,0,https://july13th.com/hate/,/r/dailywire/comments/1e3cqx8/wall_of_hate_help_document_hatred_against_trump/
trump,dailywire,Ideological Politics,24172,19 year old here. So I'm Gen Z. I am a female!,30,3,No,No,0,https://www.youtube.com/watch?v=ybgV3jSNKEE,/r/dailywire/comments/1gokaic/19_year_old_here_so_im_gen_z_i_am_a_female/
results,dailywire,Ideological Politics,24172,Is it possible? ,108,31,No,No,0,https://i.redd.it/exs4rfyenrzd1.jpeg,/r/dailywire/comments/1gmwwh1/is_it_possible/
house,dailywire,Ideological Politics,24172,We are about to take the house ,545,52,No,No,0,https://i.redd.it/t02w7wjexjzd1.jpeg,/r/dailywire/comments/1gm2dd6/we_are_about_to_take_the_house/
harris,Liberal,Ideological Politics,119721,Why were the polls so wrong?,84,120,No,No,0,https://www.reddit.com/r/Liberal/comments/1go7sv1/why_were_the_polls_so_wrong/,/r/Liberal/comments/1go7sv1/why_were_the_polls_so_wrong/
biden,Liberal,Ideological Politics,119721,Purely Symbolic I know....,19,1,No,No,0,https://www.reddit.com/r/Liberal/comments/1gody1k/purely_symbolic_i_know/,/r/Liberal/comments/1gody1k/purely_symbolic_i_know/
harris,Liberal,Ideological Politics,119721,I keep hearing theories about how 15m people staying home didn't actually stay home and I'm not buying it.,294,291,No,No,0,https://www.reddit.com/r/Liberal/comments/1gnrlns/i_keep_hearing_theories_about_how_15m_people/,/r/Liberal/comments/1gnrlns/i_keep_hearing_theories_about_how_15m_people/
harris,Liberal,Ideological Politics,119721,America will NOT elect a woman President.,267,394,No,No,0,https://www.reddit.com/r/Liberal/comments/1gnhckm/america_will_not_elect_a_woman_president/,/r/Liberal/comments/1gnhckm/america_will_not_elect_a_woman_president/
harris,Liberal,Ideological Politics,119721,"Liberals need to stop blaming themselves, and stop blaming Trump voters",144,101,No,Yes,0,https://www.reddit.com/r/Liberal/comments/1gnk7ug/liberals_need_to_stop_blaming_themselves_and_stop/,/r/Liberal/comments/1gnk7ug/liberals_need_to_stop_blaming_themselves_and_stop/
house,Liberal,Ideological Politics,119721,We're all in this together,56,48,No,No,0,https://www.reddit.com/r/Liberal/comments/1gnpdn0/were_all_in_this_together/,/r/Liberal/comments/1gnpdn0/were_all_in_this_together/
supreme court,Liberal,Ideological Politics,119721,Thinking about these big blue cities where the majority of red states money comes from.  These blue cities could bring their red states to there knees. ,123,122,No,No,0,https://www.reddit.com/r/Liberal/comments/1gne8ji/thinking_about_these_big_blue_cities_where_the/,/r/Liberal/comments/1gne8ji/thinking_about_these_big_blue_cities_where_the/
house,Liberal,Ideological Politics,119721,The House is still in play and you can help by curing votes!,27,0,No,No,0,https://votesaveamerica.com/,/r/Liberal/comments/1gnlz7c/the_house_is_still_in_play_and_you_can_help_by/
trump,Liberal,Ideological Politics,119721,How do you feel about all the conspiracy theories? ,12,58,No,No,0,https://www.reddit.com/r/Liberal/comments/1gnnnam/how_do_you_feel_about_all_the_conspiracy_theories/,/r/Liberal/comments/1gnnnam/how_do_you_feel_about_all_the_conspiracy_theories/
trump,Liberal,Ideological Politics,119721,89 Things Trump has said about Women.,47,72,No,No,0,https://www.reddit.com/r/Liberal/comments/1gncaue/89_things_trump_has_said_about_women/,/r/Liberal/comments/1gncaue/89_things_trump_has_said_about_women/
house,Liberal,Ideological Politics,119721,"Janelle Bynum wins race for Congress, flipping U.S. House seat from GOP to Democratic control; Bynum will be Oregon’s first Black representative",288,5,No,No,0,https://www.oregonlive.com/politics/2024/11/janelle-bynum-wins-race-for-congress-flipping-us-house-seat-from-gop-to-democratic-control.html,/r/Liberal/comments/1gmqmq8/janelle_bynum_wins_race_for_congress_flipping_us/
president,KamalaHarris,Ideological Politics,76220,"Watching this is so heartbreakingly sad. She would’ve been a great president. She wants to empower us, he wants to control us. ",935,117,No,No,0,https://v.redd.it/iklqyeyl970e1,/r/KamalaHarris/comments/1gojwnq/watching_this_is_so_heartbreakingly_sad_she/
results,KamalaHarris,Ideological Politics,76220,I'm heartbroken over the results of this election - and here's why,91,3,No,No,0,https://youtu.be/7n7SoOTIlZY?si=b5q0Jb-sJSzoULRx,/r/KamalaHarris/comments/1golbbu/im_heartbroken_over_the_results_of_this_election/
loss,KamalaHarris,Ideological Politics,76220,LGBTQ Women of Color Reflect on Kamala Harris' Loss and Donald Trump's Win,265,16,No,No,0,https://www.unclosetedmedia.com/p/lgbtq-women-of-color-reflect-on-kamala,/r/KamalaHarris/comments/1go1m95/lgbtq_women_of_color_reflect_on_kamala_harris/
fraud,KamalaHarris,Ideological Politics,76220,Pennsylvania looking in to fraudulent votes,1573,241,No,No,0,https://cbs6albany.com/news/nation-world/pennsylvania-da-finds-fraud-in-hundreds-of-voter-registrations-amid-ongoing-investigations-lancaster-county-district-attorneys-office-heather-adams,/r/KamalaHarris/comments/1gnmynj/pennsylvania_looking_in_to_fraudulent_votes/
biden,KamalaHarris,Ideological Politics,76220,Biden resign? Harris would be the 1st woman 🇺🇸President & #47❣️,1099,247,No,No,0,https://www.theguardian.com/us-news/2024/nov/08/resign-joe-biden-and-let-kamala-harris-be-the-first-female-us-president,/r/KamalaHarris/comments/1gnoiiu/biden_resign_harris_would_be_the_1st_woman/
house,KamalaHarris,Ideological Politics,76220,Democrats retain one-seat majority control of the Pennsylvania House,1150,37,No,No,0,https://apnews.com/article/pennsylvania-house-2024-election-frank-burns-johnstown-1fb3477611874bb4e4409c6452681e5f?campaign_id=9&emc=edit_nn_20241109&instance_id=139211&nl=the-morning&regi_id=53831380&segment_id=182739&user_id=fe5d662adf685ae9dedd7464c832fcdf,/r/KamalaHarris/comments/1gnlq5r/democrats_retain_oneseat_majority_control_of_the/
results,KamalaHarris,Ideological Politics,76220,Hypothetical Question..🙋🏻‍♀️ What if the results “change”..ballots are still being counted. Irregularities are being reported. ,797,422,No,No,0,https://youtu.be/OKhiCxzpM7E?si=Yr_VPNV336v5i03c,/r/KamalaHarris/comments/1gni0hx/hypothetical_question_what_if_the_results/
trump,Impeach_Trump,Ideological Politics,60570,"Far-right extremists celebrate Trump’s win — In a burst of hate and misogyny, MAGA militants cheered the return of a president they consider an ally",122,1,No,No,0,https://www.washingtonpost.com/politics/2024/11/07/right-wing-extremists-celebrate-trump-victory/,/r/Impeach_Trump/comments/1gmvba5/farright_extremists_celebrate_trumps_win_in_a/
trump,Impeach_Trump,Ideological Politics,60570,Trump feigned ignorance of Project 2025,213,10,No,No,0,https://imghoster.co/en/FhQ7EhPjtSXOF4R,/r/Impeach_Trump/comments/1glm47g/trump_feigned_ignorance_of_project_2025/
trump,Impeach_Trump,Ideological Politics,60570,The Deep Roots of 4 of Donald Trump’s Highly Xenophobic Remarks,31,1,No,No,0,https://www.nytimes.com/2024/11/01/us/politics/trump-immigration-rhetoric-history.html,/r/Impeach_Trump/comments/1glhq62/the_deep_roots_of_4_of_donald_trumps_highly/
trump,Impeach_Trump,Ideological Politics,60570,Literal Neo-Nazi Leader Endorses Trump,214,1,No,No,0,https://www.rollingstone.com/politics/politics-news/trump-endorsement-neo-nazi-leader-nsc-131-1235154089/,/r/Impeach_Trump/comments/1gkmq6t/literal_neonazi_leader_endorses_trump/
trump,Impeach_Trump,Ideological Politics,60570,Trump's crowds are dwindling as his campaign winds down — Empty seats and early exits have grown more common,429,18,No,No,0,https://www.nytimes.com/2024/11/04/us/politics/trump-rally-crowds.html,/r/Impeach_Trump/comments/1gjn8sb/trumps_crowds_are_dwindling_as_his_campaign_winds/
trump,Impeach_Trump,Ideological Politics,60570,"Donald Trump talks about women at his rallies like they are objects, he doesn't see them as equals",304,3,No,No,0,https://imghoster.co/v3YtmBuQO5WqVHF,/r/Impeach_Trump/comments/1ggdie6/donald_trump_talks_about_women_at_his_rallies/
trump,Impeach_Trump,Ideological Politics,60570,"Donald Trump called half of America ""human scum""",193,5,No,No,0,https://imghoster.co/VN2ORQf6SinlHXJ?utm_source=reddit&utm_medium=impeach_trump,/r/Impeach_Trump/comments/1gg9nmz/donald_trump_called_half_of_america_human_scum/
trump,Impeach_Trump,Ideological Politics,60570,This is an amazing article written by user u/SilkyFluffs in r/democrats which is an amazing resource for combating GOP and Trump misinformation and possibly even converting family members or undecided voters,45,0,No,Yes,0,https://pdflink.to/d6e0bc9d/,/r/Impeach_Trump/comments/1ggd0pc/this_is_an_amazing_article_written_by_user/
trump,Impeach_Trump,Ideological Politics,60570,"Elon Musk predicts ‘hardship,’ economic turmoil and a stock-market crash if Trump wins",62,4,No,No,0,https://www.marketwatch.com/story/kaboom-elon-musk-predicts-hardship-economic-turmoil-and-a-stock-market-crash-if-trump-wins-20483008,/r/Impeach_Trump/comments/1gfwy5u/elon_musk_predicts_hardship_economic_turmoil_and/
trump,Impeach_Trump,Ideological Politics,60570,Kamala's rally in DC vs. Trump's rally in DC,132,0,No,No,0,https://imghoster.co/en/D370Y9JxmPOx6x3,/r/Impeach_Trump/comments/1gfnege/kamalas_rally_in_dc_vs_trumps_rally_in_dc/
trump,Impeach_Trump,Ideological Politics,60570,Trump is 10x more corrupt than all the rest put together,318,3,No,No,0,https://imghoster.co/en/R3aE5Zdu1UQvWSj,/r/Impeach_Trump/comments/1getadg/trump_is_10x_more_corrupt_than_all_the_rest_put/
