Keyword,Subreddit,Category,Members,Title,Upvotes,Comments,Moderator Interaction,Fact-Checking Mention,Total Awards,URL,Original Post URL
results,Wikileaks,General Politics,177618,Censored Wikileaks content?,13,7,No,No,0,https://www.reddit.com/r/WikiLeaks/comments/1frr2wq/censored_wikileaks_content/,/r/WikiLeaks/comments/1frr2wq/censored_wikileaks_content/
biden,PoliticalDiscussion,General Politics,2184606,How does the world deal with the schizophrenic foreign policy that America has? ,307,302,No,No,0,https://www.reddit.com/r/PoliticalDiscussion/comments/1go363q/how_does_the_world_deal_with_the_schizophrenic/,/r/PoliticalDiscussion/comments/1go363q/how_does_the_world_deal_with_the_schizophrenic/
trump,PoliticalDiscussion,General Politics,2184606,"Some say: ""The Resistance is about to Ignite."" Referencing State Actors, such as Governors and AGs, Federal Courts, the Press and the Educators and Civil Society [the People.] Are those guardrails still there to thwart attempts by Trump to usurp the Constitution?",286,361,No,No,0,https://www.reddit.com/r/PoliticalDiscussion/comments/1gnmmyw/some_say_the_resistance_is_about_to_ignite/,/r/PoliticalDiscussion/comments/1gnmmyw/some_say_the_resistance_is_about_to_ignite/
biden,PoliticalDiscussion,General Politics,2184606,What are your thoughts on a purge of senior military by the incoming Trump administration?,543,498,No,Yes,0,https://www.reddit.com/r/PoliticalDiscussion/comments/1gnesig/what_are_your_thoughts_on_a_purge_of_senior/,/r/PoliticalDiscussion/comments/1gnesig/what_are_your_thoughts_on_a_purge_of_senior/
trump,PoliticalDiscussion,General Politics,2184606,What can Democrats do to not get annihilated in another election? ,444,1881,No,No,0,https://www.reddit.com/r/PoliticalDiscussion/comments/1gn9x6c/what_can_democrats_do_to_not_get_annihilated_in/,/r/PoliticalDiscussion/comments/1gn9x6c/what_can_democrats_do_to_not_get_annihilated_in/
biden,PoliticalDiscussion,General Politics,2184606,why did harris struggle to win traditionally blue states like IL and NJ by larger margins ?,148,269,No,No,0,https://www.reddit.com/r/PoliticalDiscussion/comments/1gnd17f/why_did_harris_struggle_to_win_traditionally_blue/,/r/PoliticalDiscussion/comments/1gnd17f/why_did_harris_struggle_to_win_traditionally_blue/
victory,PoliticalDiscussion,General Politics,2184606,"What will be the economic, social and political impacts of Trump's mass deportation policy? Will it even go as far as advertised?",71,178,No,No,0,https://www.reddit.com/r/PoliticalDiscussion/comments/1gng8fd/what_will_be_the_economic_social_and_political/,/r/PoliticalDiscussion/comments/1gng8fd/what_will_be_the_economic_social_and_political/
trump,PoliticalDiscussion,General Politics,2184606,What will be the impacts of Trump's tariff policy during his second term?,169,311,No,No,0,https://www.reddit.com/r/PoliticalDiscussion/comments/1gmw1a4/what_will_be_the_impacts_of_trumps_tariff_policy/,/r/PoliticalDiscussion/comments/1gmw1a4/what_will_be_the_impacts_of_trumps_tariff_policy/
electoral,PoliticalDiscussion,General Politics,2184606,Should all states adopt the Nebraska-Maine electoral model?,62,74,No,No,0,https://www.reddit.com/r/PoliticalDiscussion/comments/1gn1h28/should_all_states_adopt_the_nebraskamaine/,/r/PoliticalDiscussion/comments/1gn1h28/should_all_states_adopt_the_nebraskamaine/
trump,PoliticalDiscussion,General Politics,2184606,"What happens if President Trump and the republicans pass federal laws that force states to do/behave certain way, and Democratic states refuse to follow federal laws? ",510,839,No,No,0,https://www.reddit.com/r/PoliticalDiscussion/comments/1gmlex2/what_happens_if_president_trump_and_the/,/r/PoliticalDiscussion/comments/1gmlex2/what_happens_if_president_trump_and_the/
results,PoliticalDiscussion,General Politics,2184606,Are 'the fall of the Berlin Wall moments' still possible in today's global landscape under isolationism?,4,27,No,No,0,https://www.reddit.com/r/PoliticalDiscussion/comments/1gnec8k/are_the_fall_of_the_berlin_wall_moments_still/,/r/PoliticalDiscussion/comments/1gnec8k/are_the_fall_of_the_berlin_wall_moments_still/
trump,PoliticalDiscussion,General Politics,2184606,Did the rise of inflation kill any political momentum for aggressive climate change initiatives?,68,113,No,Yes,0,https://www.reddit.com/r/PoliticalDiscussion/comments/1gmxz8p/did_the_rise_of_inflation_kill_any_political/,/r/PoliticalDiscussion/comments/1gmxz8p/did_the_rise_of_inflation_kill_any_political/
trump,PoliticalDiscussion,General Politics,2184606,What will be the path the Republican Party takes moving forward?,74,246,No,No,0,https://www.reddit.com/r/PoliticalDiscussion/comments/1gmse7c/what_will_be_the_path_the_republican_party_takes/,/r/PoliticalDiscussion/comments/1gmse7c/what_will_be_the_path_the_republican_party_takes/
results,NeutralPolitics,General Politics,610483,What to expect after the U.S. election,281,26,Yes,Yes,0,https://www.reddit.com/r/NeutralPolitics/comments/1gflxpk/what_to_expect_after_the_us_election/,/r/NeutralPolitics/comments/1gflxpk/what_to_expect_after_the_us_election/
results,NeutralPolitics,General Politics,610483,Trump won the presidency and popular vote running on the mass deportation of illegal aliens. Who saw this coming and what lessons can be learned?,142,281,No,No,0,https://www.reddit.com/r/NeutralPolitics/comments/1gnk7ih/trump_won_the_presidency_and_popular_vote_running/,/r/NeutralPolitics/comments/1gnk7ih/trump_won_the_presidency_and_popular_vote_running/
results,NeutralPolitics,General Politics,610483,Is now the time for a NEW moderate third party in U.S. politics?,0,66,No,No,0,https://www.reddit.com/r/NeutralPolitics/comments/1gms9so/is_now_the_time_for_a_new_moderate_third_party_in/,/r/NeutralPolitics/comments/1gms9so/is_now_the_time_for_a_new_moderate_third_party_in/
harris,NeutralPolitics,General Politics,610483,Why Are So Many Men Leaving The Democratic Party Over The Last Few Years?,378,156,No,No,0,https://www.reddit.com/r/NeutralPolitics/comments/1gklb9t/why_are_so_many_men_leaving_the_democratic_party/,/r/NeutralPolitics/comments/1gklb9t/why_are_so_many_men_leaving_the_democratic_party/
trump,NeutralPolitics,General Politics,610483,What plans about trump and kamala have on section 8 housing and dept of edu.,1,11,No,No,0,https://www.reddit.com/r/NeutralPolitics/comments/1gk1emp/what_plans_about_trump_and_kamala_have_on_section/,/r/NeutralPolitics/comments/1gk1emp/what_plans_about_trump_and_kamala_have_on_section/
outcome,NeutralPolitics,General Politics,610483,"What are the pros and cons of predictive election models, like 538, for our discourse around elections?",40,94,No,No,0,https://www.reddit.com/r/NeutralPolitics/comments/1giqib5/what_are_the_pros_and_cons_of_predictive_election/,/r/NeutralPolitics/comments/1giqib5/what_are_the_pros_and_cons_of_predictive_election/
harris,NeutralPolitics,General Politics,610483,How do the Trump and Harris plans for workforce pay and taxes compare?,6,6,No,No,0,https://www.reddit.com/r/NeutralPolitics/comments/1ggxh8w/how_do_the_trump_and_harris_plans_for_workforce/,/r/NeutralPolitics/comments/1ggxh8w/how_do_the_trump_and_harris_plans_for_workforce/
fraud,NeutralPolitics,General Politics,610483,Has there been any investigative journalism or public legal discovery to examine process irregularities regarding the 2020 election?,11,15,No,No,0,https://www.reddit.com/r/NeutralPolitics/comments/1ggkpzr/has_there_been_any_investigative_journalism_or/,/r/NeutralPolitics/comments/1ggkpzr/has_there_been_any_investigative_journalism_or/
outcome,NeutralPolitics,General Politics,610483,"War involving Israel, Lebanon, and Iran--Motivations? Scale of Conflict?",15,6,No,No,0,https://www.reddit.com/r/NeutralPolitics/comments/1ge5sct/war_involving_israel_lebanon_and_iranmotivations/,/r/NeutralPolitics/comments/1ge5sct/war_involving_israel_lebanon_and_iranmotivations/
results,NeutralPolitics,General Politics,610483,Military coup in Niger (2023-2024) and relationships with western countries/companies ,45,5,No,No,0,https://www.reddit.com/r/NeutralPolitics/comments/1gdv0aw/military_coup_in_niger_20232024_and_relationships/,/r/NeutralPolitics/comments/1gdv0aw/military_coup_in_niger_20232024_and_relationships/
trump,moderatepolitics,General Politics,296023,Trump Told Putin Not to Escalate Ukraine War in Post-Election Call – Washington Post - The Moscow Times,182,318,No,No,0,https://www.themoscowtimes.com/2024/11/10/trump-told-putin-not-to-escalate-ukraine-war-in-post-election-call-washington-post-a86973,/r/moderatepolitics/comments/1goakc0/trump_told_putin_not_to_escalate_ukraine_war_in/
harris,moderatepolitics,General Politics,296023,Harris campaign reportedly spent 6 figures on ‘Call Her Daddy’ podcast with fewer than 1 million YouTube views,504,498,No,No,0,https://www.msn.com/en-us/news/politics/harris-campaign-reportedly-spent-6-figures-on-call-her-daddy-podcast-with-fewer-than-1-million-youtube-views/ar-AA1tLAPk,/r/moderatepolitics/comments/1go1lnt/harris_campaign_reportedly_spent_6_figures_on/
harris,moderatepolitics,General Politics,296023,Harris Raised $1 Billion. Where Did it All Go?,409,467,No,No,0,https://newrepublic.com/post/188216/kamala-harris-campaign-billion-fundraising,/r/moderatepolitics/comments/1go1apl/harris_raised_1_billion_where_did_it_all_go/
loss,moderatepolitics,General Politics,296023,Pelosi blames Harris' loss on Biden's late exit and no open Democratic primary,233,304,No,No,0,https://abcnews.go.com/Politics/pelosi-blames-harris-loss-bidens-late-exit-open/story?id=115652125,/r/moderatepolitics/comments/1gnuzdu/pelosi_blames_harris_loss_on_bidens_late_exit_and/
bernie,moderatepolitics,General Politics,296023,Nancy Pelosi slams Bernie Sanders for comments about Democrats abandoning working class amid party blame game,237,409,No,No,0,https://www.the-independent.com/news/world/americas/us-politics/nancy-pelosi-bernie-sanders-democrats-election-biden-b2644295.html,/r/moderatepolitics/comments/1gnumsr/nancy_pelosi_slams_bernie_sanders_for_comments/
trump,moderatepolitics,General Politics,296023,"Trump announces former WH officials Nikki Haley, Mike Pompeo will not be in his next administration",411,284,No,No,0,https://nypost.com/2024/11/09/us-news/trump-announces-former-wh-officials-nikki-haley-mike-pompeo-will-not-be-in-his-next-administration/,/r/moderatepolitics/comments/1gnnpqq/trump_announces_former_wh_officials_nikki_haley/
trump,moderatepolitics,General Politics,296023,FEMA Employee Fired For Directing Relief Workers Away From Trump Supporters,286,162,No,No,0,https://evrimagaci.org/tpg/fema-employee-fired-for-directing-relief-workers-away-from-trump-supporters-52779,/r/moderatepolitics/comments/1gnn3nt/fema_employee_fired_for_directing_relief_workers/
vance,moderatepolitics,General Politics,296023,JD Vance says US could drop support for NATO if Europe tries to regulate Elon Musk’s platforms,229,365,No,No,0,https://www.independent.co.uk/news/world/americas/us-politics/jd-vance-elon-musk-x-twitter-donald-trump-b2614525.html,/r/moderatepolitics/comments/1gnhb1q/jd_vance_says_us_could_drop_support_for_nato_if/
trump,moderatepolitics,General Politics,296023,"The Dow Jones soars over 1,500 points to record high after Trump wins the election",223,144,No,No,0,https://www.npr.org/2024/11/06/nx-s1-5181315/stocks-bitcoin-crypto-truth-social-trump-election,/r/moderatepolitics/comments/1gnbpkw/the_dow_jones_soars_over_1500_points_to_record/
loss,moderatepolitics,General Politics,296023,Overlooking the key reason Democrat's lost so badly,134,229,No,No,0,https://www.ft.com/content/e8ac09ea-c300-4249-af7d-109003afb893,/r/moderatepolitics/comments/1gncyo2/overlooking_the_key_reason_democrats_lost_so_badly/
trump,moderatepolitics,General Politics,296023,Massachusetts Governor Maura Healy’s stance on Donald Trump’s mass deportation of illegal immigrants order,139,276,No,No,0,https://www.dailymail.co.uk/news/article-14059841/amp/massachusetts-governor-maura-healey-donald-trump-deportation-illegal-migrants.html,/r/moderatepolitics/comments/1gncm7t/massachusetts_governor_maura_healys_stance_on/
harris,moderatepolitics,General Politics,296023,"Kamala Harris campaign’s election-eve concerts said to cost up to $20M — as staff, vendors fear they won’t be paid",429,373,No,No,0,https://nypost.com/2024/11/08/us-news/kamala-harris-campaigns-election-eve-concerts-said-to-cost-up-to-20m-as-rank-and-file-staff-vendors-fear-they-wont-be-paid/,/r/moderatepolitics/comments/1gmy71l/kamala_harris_campaigns_electioneve_concerts_said/
biden,democrats,Ideological Politics,480450,Former Kamala Harris aide suggests Biden should resign so she can be the 47th president …,661,270,No,No,0,https://www.usatoday.com/story/news/politics/elections/2024/11/10/jamal-simmons-joe-biden-kamala-harris/76182658007/,/r/democrats/comments/1goe6qf/former_kamala_harris_aide_suggests_biden_should/
trump,democrats,Ideological Politics,480450,"What are the chances the U.S. could turn into a Christian theocracy, especially with Trump likely getting to appoint two more federal judges?",659,290,No,No,0,https://i.redd.it/hmz1wv0p250e1.jpeg,/r/democrats/comments/1goax7z/what_are_the_chances_the_us_could_turn_into_a/
results,democrats,Ideological Politics,480450,Was it stolen…?,1575,1121,No,No,0,https://i.redd.it/o9wpdezwb30e1.jpeg,/r/democrats/comments/1go2sdb/was_it_stolen/
fraud,democrats,Ideological Politics,480450,"What happened to election fraud? Trump, GOP go quiet on claims after win",590,78,No,No,0,https://www.usatoday.com/story/news/politics/elections/2024/11/09/donald-trump-gop-election-fraud-claims/76113170007/,/r/democrats/comments/1go9bk6/what_happened_to_election_fraud_trump_gop_go/
recount,democrats,Ideological Politics,480450,Is a recount happening??,109,44,No,No,0,https://i.redd.it/hho61t0eh70e1.jpeg,/r/democrats/comments/1goknyq/is_a_recount_happening/
trump,democrats,Ideological Politics,480450,Billionaire Mark Cuban Warns Trump's Tariff Plan Already Hurting American Businesses,1419,125,No,No,0,https://www.ibtimes.com/billionaire-mark-cuban-says-trumps-tariff-plan-already-hurting-american-businesses-3750316,/r/democrats/comments/1go22sx/billionaire_mark_cuban_warns_trumps_tariff_plan/
harris,democrats,Ideological Politics,480450,Why this Latino Harris voter says he's 'happy' Trump won,97,63,No,No,0,https://www.msnbc.com/top-stories/latest/latino-voters-trump-harris-win-rcna179359,/r/democrats/comments/1goiru5/why_this_latino_harris_voter_says_hes_happy_trump/
president,Republican,Ideological Politics,204996,I love this! We definitely picked right person as president!,402,69,No,No,0,https://x.com/RobertKennedyJr/status/1855346782433398956,/r/Republican/comments/1god3oy/i_love_this_we_definitely_picked_right_person_as/
harris,Republican,Ideological Politics,204996,2024 The Ultimate Uno Reverse Card,95,39,No,No,0,https://www.reddit.com/gallery/1goj69a,/r/Republican/comments/1goj69a/2024_the_ultimate_uno_reverse_card/
senate,Republican,Ideological Politics,204996,@VaughnHillyard - Kari Lake calls for @AZGOP Chair Jeff DeWit to resign after release of audio in which he can be heard bribing Lake to not run for the U.S. Senate in exchange for a potential job (and its salary): Video,59,8,No,No,0,https://x.com/VaughnHillyard/status/1749976071611580646,/r/Republican/comments/1goihst/vaughnhillyard_kari_lake_calls_for_azgop_chair/
electoral,Republican,Ideological Politics,204996,This Election Shows Why The Electoral College Is A Genius Idea,35,7,No,No,0,https://issuesinsights.com/2024/11/11/this-election-shows-why-the-electoral-college-is-a-genius-idea/,/r/Republican/comments/1gol4j3/this_election_shows_why_the_electoral_college_is/
fraud,Republican,Ideological Politics,204996,They’re all so convinced fraud happened they fail to realize 2020 was the anomaly,239,88,No,No,0,https://www.reddit.com/gallery/1go7rcz,/r/Republican/comments/1go7rcz/theyre_all_so_convinced_fraud_happened_they_fail/
harris,Republican,Ideological Politics,204996,Something fishy in Arizona. Kari Lake with more votes than Kamala Harris but not leading her race for Senate?,331,164,No,No,0,https://www.reddit.com/gallery/1go55rx,/r/Republican/comments/1go55rx/something_fishy_in_arizona_kari_lake_with_more/
senate,Republican,Ideological Politics,204996,"@AmyKremer - Number of years in DC: Senator Thune - 27 yrs, Senator Cornyn - 22 yrs, Senator Scott - 6 yrs. MAGA! Call Your Republican Senators & tell them Rick Scott as Majority Leader. Call your U.S. Representatives & urge Them to communicate to their senate GOP colleagues you want Senator Scott",55,9,No,No,0,https://x.com/AmyKremer/status/1855775082301321487,/r/Republican/comments/1gohjea/amykremer_number_of_years_in_dc_senator_thune_27/
electoral,Republican,Ideological Politics,204996,AP Calls Arizona For Donald Trump - Most Electoral Votes For A Republican Since 1988,514,55,No,No,0,https://www.theguardian.com/us-news/live/2024/nov/10/donald-trump-arizona-swing-states-house-representatives-republicans-us-politics-latest-updates,/r/Republican/comments/1go0eew/ap_calls_arizona_for_donald_trump_most_electoral/
trump,Republican,Ideological Politics,204996,Donald Trump names Tom Homan ‘border czar’,24,7,No,No,0,https://www.newsnationnow.com/politics/donald-trump-names-tom-homan-border-czar/,/r/Republican/comments/1goku77/donald_trump_names_tom_homan_border_czar/
trump,Republican,Ideological Politics,204996,"Welcome to Nominees for the People!
President Trump and Robert F Kennedy Jr want your help nominating people of integrity and courage for over 4,000 appointments across the future Trump Administration.",20,1,No,No,0,https://nominees.mahanow.org/,/r/Republican/comments/1goj2ql/welcome_to_nominees_for_the_people_president/
trump,Republican,Ideological Politics,204996,Tucker is warning us the Swamp is still hates Trump,199,33,No,No,0,https://x.com/TuckerCarlson/status/1855344652422951054,/r/Republican/comments/1go0opy/tucker_is_warning_us_the_swamp_is_still_hates/
trump,Republican,Ideological Politics,204996,"Nikki Haley Responds to Trump’s Decision Not to Include Her in Cabinet, Wishes Him ‘Great Success’",129,41,No,No,0,https://m10news.com/nikki-haley-responds-to-trumps-decision-not-to-include-her-in-cabinet-wishes-him-great-success/,/r/Republican/comments/1gnyu1o/nikki_haley_responds_to_trumps_decision_not_to/
trump,Conservative,Ideological Politics,1144528,Trump announces Tom Homan to be his Border Czar ,1013,187,No,No,0,https://i.redd.it/9iotu0otc70e1.jpeg,/r/Conservative/comments/1gok7lq/trump_announces_tom_homan_to_be_his_border_czar/
trump,Conservative,Ideological Politics,1144528,Donald Trump wins most popular votes by a Republican ever,1539,129,No,No,0,https://nypost.com/2024/11/10/us-news/donald-trump-wins-most-popular-votes-by-a-republican-ever/,/r/Conservative/comments/1gog5uk/donald_trump_wins_most_popular_votes_by_a/
harris,Conservative,Ideological Politics,1144528,"Harris. Kamala, Harris. 007",1309,20,No,No,0,https://i.redd.it/6r3rvbuga60e1.jpeg,/r/Conservative/comments/1gog91w/harris_kamala_harris_007/
vance,Conservative,Ideological Politics,1144528,"JD Vance, First Marine to Become Vice President, Wishes Fellow Marines Happy Birthday",1493,34,No,No,0,https://www.breitbart.com/politics/2024/11/10/jd-vance-first-marine-to-become-vice-president-wishes-fellow-marines-happy-birthday/,/r/Conservative/comments/1gof96i/jd_vance_first_marine_to_become_vice_president/
harris,Conservative,Ideological Politics,1144528,Exit Polling: 40 Percent of Women Under 30 Dumped Harris for Trump,1582,244,No,No,0,https://www.breitbart.com/2024-election/2024/11/10/exit-polling-40-percent-of-women-under-30-dumped-harris-for-trump/,/r/Conservative/comments/1goegkm/exit_polling_40_percent_of_women_under_30_dumped/
trump,Conservative,Ideological Politics,1144528,NYT has yet to issue correction for wrongly claiming Trump 'falsely' accused FEMA of avoiding supporters' homes,1132,31,No,Yes,0,https://nypost.com/2024/11/10/us-news/nyt-has-yet-to-issue-correction-for-wrongly-claiming-trump-falsely-accused-fema-of-avoiding-supporters-homes/?utm_source=smartnews&utm_campaign=nypost&utm_medium=referral,/r/Conservative/comments/1gobrma/nyt_has_yet_to_issue_correction_for_wrongly/
harris,Conservative,Ideological Politics,1144528,Harris/Walz campaign tried to astroturf Reddit ,1752,276,No,No,0,https://www.reddit.com/r/Conservative/comments/1go6dv9/harriswalz_campaign_tried_to_astroturf_reddit/,/r/Conservative/comments/1go6dv9/harriswalz_campaign_tried_to_astroturf_reddit/
biden,Conservative,Ideological Politics,1144528,CNN political commentator says Joe Biden has been a phenomenal president and thinks he should step down to allow Kamala to become the first female president before Trump takes over.,1466,536,No,No,0,https://v.redd.it/aucyud89840e1,/r/Conservative/comments/1go71nt/cnn_political_commentator_says_joe_biden_has_been/
biden,Conservative,Ideological Politics,1144528,The left needs to move on,1664,549,No,No,0,https://www.reddit.com/r/Conservative/comments/1go5yna/the_left_needs_to_move_on/,/r/Conservative/comments/1go5yna/the_left_needs_to_move_on/
trump,Conservative,Ideological Politics,1144528,Trump: Any Republican seeking leadership position in Senate must agree to Recess Appointments ,1120,73,No,No,0,https://i.redd.it/tvdrekyjk40e1.jpeg,/r/Conservative/comments/1go8jmh/trump_any_republican_seeking_leadership_position/
harris,Conservative,Ideological Politics,1144528,Harris paid Oprah $1 million in failed bid to help campaign: report,455,34,No,No,0,https://www.foxnews.com/politics/harris-paid-oprah-1-million-failed-bid-help-campaign-report,/r/Conservative/comments/1goeezi/harris_paid_oprah_1_million_in_failed_bid_to_help/
bernie,Conservative,Ideological Politics,1144528,Bernie Sanders: Democrats ‘Absolutely’ Abandoned The Working Class,192,18,No,No,0,https://www.dailywire.com/news/bernie-sanders-democrats-absolutely-abandoned-the-working-class,/r/Conservative/comments/1gojckw/bernie_sanders_democrats_absolutely_abandoned_the/
biden,Libertarian,Ideological Politics,503600,This can't be real..,298,50,No,Yes,0,https://youtu.be/c4jxUSq-MV8?si=MR5vdh93PChAyrQK,/r/Libertarian/comments/1gnsyb2/this_cant_be_real/
house,Libertarian,Ideological Politics,503600,How to use capitalism to trade a Red Paperclip for a House (John Stossel),179,17,No,No,0,https://v.redd.it/7z5al6u1cxzd1,/r/Libertarian/comments/1gnhb28/how_to_use_capitalism_to_trade_a_red_paperclip/
trump,Libertarian,Ideological Politics,503600,Why Isn’t Bush Hated as Much as Trump?,399,296,No,No,0,https://www.reddit.com/r/Libertarian/comments/1gn9ie0/why_isnt_bush_hated_as_much_as_trump/,/r/Libertarian/comments/1gn9ie0/why_isnt_bush_hated_as_much_as_trump/
loss,Anarchism,Ideological Politics,270952,So should we prepare for a massive civil war under the Trump administration? What do you think is going to look like? I'm imagining some return of the occupy movement with far more intensity,49,73,No,No,0,https://www.reddit.com/r/Anarchism/comments/1gnjmy2/so_should_we_prepare_for_a_massive_civil_war/,/r/Anarchism/comments/1gnjmy2/so_should_we_prepare_for_a_massive_civil_war/
trump,Anarchism,Ideological Politics,270952,"Laid out four articles published this week for print distribution - ""The sky is falling; We’ve got this - Four articles and essays on the impending Trump presidency and what we can do about it""",6,0,No,No,0,https://drive.proton.me/urls/66AAS7XWM8#1Z4tGdA9Dpmx,/r/Anarchism/comments/1gnt6qq/laid_out_four_articles_published_this_week_for/
presidency,Socialism,Ideological Politics,460694,What are US based folks doing to prepare for a second T presidency,13,8,No,No,0,https://www.reddit.com/r/socialism/comments/1gojec3/what_are_us_based_folks_doing_to_prepare_for_a/,/r/socialism/comments/1gojec3/what_are_us_based_folks_doing_to_prepare_for_a/
results,Socialism,Ideological Politics,460694,Do you think we are on the verge of an era?,105,49,No,No,0,https://www.reddit.com/r/socialism/comments/1go065x/do_you_think_we_are_on_the_verge_of_an_era/,/r/socialism/comments/1go065x/do_you_think_we_are_on_the_verge_of_an_era/
trump,Progressive,Ideological Politics,78021,Behind the Curtain: Trump's business bonanza,15,1,No,No,0,https://www.axios.com/2024/11/07/trump-elon-musk-business-tax-cuts,/r/progressive/comments/1gm4w17/behind_the_curtain_trumps_business_bonanza/
victory,Progressive,Ideological Politics,78021,Far-Right Donald Trump Supporters Celebrate His Victory with Violent Memes and Calls for Executions,248,13,No,No,0,https://www.wired.com/story/donald-trump-far-right-supporters-violent-memes/,/r/progressive/comments/1glfnyf/farright_donald_trump_supporters_celebrate_his/
trump,Progressive,Ideological Politics,78021,What Trump's first 100 days in office could look like,25,4,No,No,0,https://www.npr.org/2024/11/06/nx-s1-5181800/2024-election-trump-first-100-days-agenda,/r/progressive/comments/1glo04a/what_trumps_first_100_days_in_office_could_look/
trump,Progressive,Ideological Politics,78021,Americans in Puerto Rico can't vote for US president. Their anger at Trump is shaping the race.,342,31,No,No,0,https://apnews.com/article/puerto-rico-trump-joke-garbage-a91e2aafd93a06d32365efa013581b85,/r/progressive/comments/1gh2ab4/americans_in_puerto_rico_cant_vote_for_us/
harris,Progressive,Ideological Politics,78021,"Trump loyalists spew racist, vulgar attacks at Harris and Democrats at New York City rally",260,6,No,No,0,https://www.cnn.com/2024/10/27/politics/trump-rally-madison-square-garden-vulgar-attacks/index.html,/r/progressive/comments/1gdskia/trump_loyalists_spew_racist_vulgar_attacks_at/
results,Republicanism,Ideological Politics,917,Survey about your political worldview (18+; 12-14 mins to complete),3,0,No,No,0,https://www.reddit.com/r/republicanism/comments/1aq418a/survey_about_your_political_worldview_18_1214/,/r/republicanism/comments/1aq418a/survey_about_your_political_worldview_18_1214/
