Keyword,Subreddit,Category,Members,Title,Upvotes,Comments,Moderator Interaction,Fact-Checking Mention,Total Awards,URL,Original Post URL
ai,Wikileaks,General Politics,177625,Parliamentary Assembly recognises Julian Assange as a ‘political prisoner’ and warns against the chilling effect of his harsh treatment,43,0,No,No,0,https://www.coe.int/en/web/portal/-/pace-recognises-julian-assange-as-a-political-prisoner-and-warns-against-the-chilling-effect-of-his-harsh-treatment,/r/WikiLeaks/comments/1fx0tn0/parliamentary_assembly_recognises_julian_assange/
ai,Wikileaks,General Politics,177625,"Julian Assange speaks out against deep state, ‘wolves in MAGA hats’: Interview",47,5,No,No,0,https://thehill.com/video/julian-assange-speaks-out-against-deep-state-%e2%80%98wolves-in-maga-hats%e2%80%99-interview/10098442/,/r/WikiLeaks/comments/1fvetjh/julian_assange_speaks_out_against_deep_state/
ai,Wikileaks,General Politics,177625,Julian to speak at a parliamentary hearing in Strasbourg on the chilling effect on human rights his treatment has had.,23,0,No,No,0,https://www.reddit.com/r/WikiLeaks/comments/1ftadxc/julian_to_speak_at_a_parliamentary_hearing_in/,/r/WikiLeaks/comments/1ftadxc/julian_to_speak_at_a_parliamentary_hearing_in/
ai,Wikileaks,General Politics,177625,Why does the US still control every penny of Iraqi oil revenues?,39,6,No,No,0,https://www.reddit.com/r/WikiLeaks/comments/1fso9v7/why_does_the_us_still_control_every_penny_of/,/r/WikiLeaks/comments/1fso9v7/why_does_the_us_still_control_every_penny_of/
ai,Wikileaks,General Politics,177625,Censored Wikileaks content?,14,7,No,No,0,https://www.reddit.com/r/WikiLeaks/comments/1frr2wq/censored_wikileaks_content/,/r/WikiLeaks/comments/1frr2wq/censored_wikileaks_content/
ai,News,General Politics,28912734,"Bleeding and in pain, a woman endured a harrowing wait for miscarriage care due to Georgia’s restrictive abortion law",9971,836,No,No,0,https://www.cnn.com/2024/11/11/health/miscarriage-georgia-abortion-law/index.html,/r/news/comments/1goqdes/bleeding_and_in_pain_a_woman_endured_a_harrowing/
ai,News,General Politics,28912734,"25 escaped monkeys captured in South Carolina, 18 remain on the loose",2822,232,No,No,0,https://abcnews.go.com/US/1-escaped-monkey-captured-south-carolina-located-property/story?id=115700921,/r/news/comments/1gohygg/25_escaped_monkeys_captured_in_south_carolina_18/
ai,News,General Politics,28912734,400 Kilos of Cocaine Seized from vessel in UK Coast Operation,327,45,No,No,0,https://smugglewire.com/400-kilos-of-cocaine-seized-in-uk-coast/,/r/news/comments/1goo4f8/400_kilos_of_cocaine_seized_from_vessel_in_uk/
ai,PoliticalDiscussion,General Politics,2184588,A reminder - Please read our rules and participate civilly,51,18,Yes,No,0,https://www.reddit.com/r/PoliticalDiscussion/comments/1gl71w2/a_reminder_please_read_our_rules_and_participate/,/r/PoliticalDiscussion/comments/1gl71w2/a_reminder_please_read_our_rules_and_participate/
ai,PoliticalDiscussion,General Politics,2184588,Casual Questions Thread,42,4709,Yes,No,0,https://www.reddit.com/r/PoliticalDiscussion/comments/1bwbuka/casual_questions_thread/,/r/PoliticalDiscussion/comments/1bwbuka/casual_questions_thread/
ai,PoliticalDiscussion,General Politics,2184588,How does the world deal with the schizophrenic foreign policy that America has? ,353,328,No,No,0,https://www.reddit.com/r/PoliticalDiscussion/comments/1go363q/how_does_the_world_deal_with_the_schizophrenic/,/r/PoliticalDiscussion/comments/1go363q/how_does_the_world_deal_with_the_schizophrenic/
ai,PoliticalDiscussion,General Politics,2184588,"Was Trump's win driven by an anti-incumbency sentiment? or was it a successful campaign strategy? had it been the former, would picking a candidate of the same party but not in the incumbent administration have levelled the playing field?",0,35,No,No,0,https://www.reddit.com/r/PoliticalDiscussion/comments/1goqx1f/was_trumps_win_driven_by_an_antiincumbency/,/r/PoliticalDiscussion/comments/1goqx1f/was_trumps_win_driven_by_an_antiincumbency/
ai,PoliticalDiscussion,General Politics,2184588,"Some say: ""The Resistance is about to Ignite."" Referencing State Actors, such as Governors and AGs, Federal Courts, the Press and the Educators and Civil Society [the People.] Are those guardrails still there to thwart attempts by Trump to usurp the Constitution?",291,372,No,No,0,https://www.reddit.com/r/PoliticalDiscussion/comments/1gnmmyw/some_say_the_resistance_is_about_to_ignite/,/r/PoliticalDiscussion/comments/1gnmmyw/some_say_the_resistance_is_about_to_ignite/
ai,PoliticalDiscussion,General Politics,2184588,What are your thoughts on a purge of senior military by the incoming Trump administration?,552,507,No,Yes,0,https://www.reddit.com/r/PoliticalDiscussion/comments/1gnesig/what_are_your_thoughts_on_a_purge_of_senior/,/r/PoliticalDiscussion/comments/1gnesig/what_are_your_thoughts_on_a_purge_of_senior/
ai,PoliticalDiscussion,General Politics,2184588,What happened to landslide victories?,1,2,No,No,0,https://www.reddit.com/r/PoliticalDiscussion/comments/1goeeuk/what_happened_to_landslide_victories/,/r/PoliticalDiscussion/comments/1goeeuk/what_happened_to_landslide_victories/
ai,PoliticalDiscussion,General Politics,2184588,How much more loyal are Congress Republicans compared to Trump's first term?,3,6,No,Yes,0,https://www.reddit.com/r/PoliticalDiscussion/comments/1go0b6f/how_much_more_loyal_are_congress_republicans/,/r/PoliticalDiscussion/comments/1go0b6f/how_much_more_loyal_are_congress_republicans/
ai,NeutralPolitics,General Politics,610485,What to expect after the U.S. election,281,26,Yes,Yes,0,https://www.reddit.com/r/NeutralPolitics/comments/1gflxpk/what_to_expect_after_the_us_election/,/r/NeutralPolitics/comments/1gflxpk/what_to_expect_after_the_us_election/
ai,NeutralPolitics,General Politics,610485,Are neocons just hawkish cons?,9,22,No,No,0,https://www.reddit.com/r/NeutralPolitics/comments/1gm80f7/are_neocons_just_hawkish_cons/,/r/NeutralPolitics/comments/1gm80f7/are_neocons_just_hawkish_cons/
ai,NeutralPolitics,General Politics,610485,Is now the time for a NEW moderate third party in U.S. politics?,0,66,No,No,0,https://www.reddit.com/r/NeutralPolitics/comments/1gms9so/is_now_the_time_for_a_new_moderate_third_party_in/,/r/NeutralPolitics/comments/1gms9so/is_now_the_time_for_a_new_moderate_third_party_in/
ai,NeutralPolitics,General Politics,610485,Where is the Western world’s paradigm shift coming from?,107,128,No,Yes,0,https://www.reddit.com/r/NeutralPolitics/comments/1glkk8q/where_is_the_western_worlds_paradigm_shift_coming/,/r/NeutralPolitics/comments/1glkk8q/where_is_the_western_worlds_paradigm_shift_coming/
ai,NeutralPolitics,General Politics,610485,Why Are So Many Men Leaving The Democratic Party Over The Last Few Years?,384,156,No,No,0,https://www.reddit.com/r/NeutralPolitics/comments/1gklb9t/why_are_so_many_men_leaving_the_democratic_party/,/r/NeutralPolitics/comments/1gklb9t/why_are_so_many_men_leaving_the_democratic_party/
elon musk,NeutralPolitics,General Politics,610485,What is the impact of Elon Musk's political engagement on the current U.S. election?,60,38,No,No,0,https://www.reddit.com/r/NeutralPolitics/comments/1gki55b/what_is_the_impact_of_elon_musks_political/,/r/NeutralPolitics/comments/1gki55b/what_is_the_impact_of_elon_musks_political/
ai,NeutralPolitics,General Politics,610485,"What are the pros and cons of predictive election models, like 538, for our discourse around elections?",44,94,No,No,0,https://www.reddit.com/r/NeutralPolitics/comments/1giqib5/what_are_the_pros_and_cons_of_predictive_election/,/r/NeutralPolitics/comments/1giqib5/what_are_the_pros_and_cons_of_predictive_election/
ai,NeutralPolitics,General Politics,610485,Why are there organizations whose only goal is to make sure people vote? ,46,36,No,No,0,https://www.reddit.com/r/NeutralPolitics/comments/1ggtk67/why_are_there_organizations_whose_only_goal_is_to/,/r/NeutralPolitics/comments/1ggtk67/why_are_there_organizations_whose_only_goal_is_to/
ai,NeutralPolitics,General Politics,610485,How do the Trump and Harris plans for workforce pay and taxes compare?,2,6,No,No,0,https://www.reddit.com/r/NeutralPolitics/comments/1ggxh8w/how_do_the_trump_and_harris_plans_for_workforce/,/r/NeutralPolitics/comments/1ggxh8w/how_do_the_trump_and_harris_plans_for_workforce/
ai,NeutralPolitics,General Politics,610485,Has there been any investigative journalism or public legal discovery to examine process irregularities regarding the 2020 election?,12,15,No,No,0,https://www.reddit.com/r/NeutralPolitics/comments/1ggkpzr/has_there_been_any_investigative_journalism_or/,/r/NeutralPolitics/comments/1ggkpzr/has_there_been_any_investigative_journalism_or/
ai,NeutralPolitics,General Politics,610485,"Why does Israel, a nation with a modern first world economy, need ""aid"" from the US as a part of its conflict?",267,77,No,No,0,https://www.reddit.com/r/NeutralPolitics/comments/1gewboa/why_does_israel_a_nation_with_a_modern_first/,/r/NeutralPolitics/comments/1gewboa/why_does_israel_a_nation_with_a_modern_first/
ai,NeutralPolitics,General Politics,610485,"War involving Israel, Lebanon, and Iran--Motivations? Scale of Conflict?",15,6,No,No,0,https://www.reddit.com/r/NeutralPolitics/comments/1ge5sct/war_involving_israel_lebanon_and_iranmotivations/,/r/NeutralPolitics/comments/1ge5sct/war_involving_israel_lebanon_and_iranmotivations/
ai,NeutralPolitics,General Politics,610485,Military coup in Niger (2023-2024) and relationships with western countries/companies ,44,5,No,No,0,https://www.reddit.com/r/NeutralPolitics/comments/1gdv0aw/military_coup_in_niger_20232024_and_relationships/,/r/NeutralPolitics/comments/1gdv0aw/military_coup_in_niger_20232024_and_relationships/
ai,moderatepolitics,General Politics,296039,Trump Told Putin Not to Escalate Ukraine War in Post-Election Call – Washington Post - The Moscow Times,207,361,No,No,0,https://www.themoscowtimes.com/2024/11/10/trump-told-putin-not-to-escalate-ukraine-war-in-post-election-call-washington-post-a86973,/r/moderatepolitics/comments/1goakc0/trump_told_putin_not_to_escalate_ukraine_war_in/
ai,moderatepolitics,General Politics,296039,Harris campaign reportedly spent 6 figures on ‘Call Her Daddy’ podcast with fewer than 1 million YouTube views,535,532,No,No,0,https://www.msn.com/en-us/news/politics/harris-campaign-reportedly-spent-6-figures-on-call-her-daddy-podcast-with-fewer-than-1-million-youtube-views/ar-AA1tLAPk,/r/moderatepolitics/comments/1go1lnt/harris_campaign_reportedly_spent_6_figures_on/
ai,moderatepolitics,General Politics,296039,Harris Raised $1 Billion. Where Did it All Go?,446,501,No,No,0,https://newrepublic.com/post/188216/kamala-harris-campaign-billion-fundraising,/r/moderatepolitics/comments/1go1apl/harris_raised_1_billion_where_did_it_all_go/
elon musk,moderatepolitics,General Politics,296039,JD Vance says US could drop support for NATO if Europe tries to regulate Elon Musk’s platforms,232,379,No,No,0,https://www.independent.co.uk/news/world/americas/us-politics/jd-vance-elon-musk-x-twitter-donald-trump-b2614525.html,/r/moderatepolitics/comments/1gnhb1q/jd_vance_says_us_could_drop_support_for_nato_if/
ai,moderatepolitics,General Politics,296039,Overlooking the key reason Democrat's lost so badly,134,228,No,No,0,https://www.ft.com/content/e8ac09ea-c300-4249-af7d-109003afb893,/r/moderatepolitics/comments/1gncyo2/overlooking_the_key_reason_democrats_lost_so_badly/
ai,moderatepolitics,General Politics,296039,Massachusetts Governor Maura Healy’s stance on Donald Trump’s mass deportation of illegal immigrants order,139,279,No,No,0,https://www.dailymail.co.uk/news/article-14059841/amp/massachusetts-governor-maura-healey-donald-trump-deportation-illegal-migrants.html,/r/moderatepolitics/comments/1gncm7t/massachusetts_governor_maura_healys_stance_on/
ai,technology,General Politics,17383368,Hi! We're the hosts of WIRED's new tech culture podcast Uncanny Valley. AM(us)A!,41,48,Yes,No,0,https://www.reddit.com/r/technology/comments/1gftoz0/hi_were_the_hosts_of_wireds_new_tech_culture/,/r/technology/comments/1gftoz0/hi_were_the_hosts_of_wireds_new_tech_culture/
ai,technology,General Politics,17383368,I Hacked NASA and they thanked me for it - Ask Me Anything! ,0,177,Yes,No,0,https://www.reddit.com/r/technology/comments/1gmcrja/i_hacked_nasa_and_they_thanked_me_for_it_ask_me/,/r/technology/comments/1gmcrja/i_hacked_nasa_and_they_thanked_me_for_it_ask_me/
ai,technology,General Politics,17383368,US ordered TSMC to halt shipments to China of chips used in AI: Source,149,18,No,No,0,https://www.cnbc.com/2024/11/10/us-ordered-tsmc-to-halt-shipments-to-china-of-chips-used-in-ai-applications-source-says.html,/r/technology/comments/1goo9dd/us_ordered_tsmc_to_halt_shipments_to_china_of/
ai,technology,General Politics,17383368,Google Chrome extensions remain a security risk as Manifest V3 fails to prevent data theft and malware exploitation,65,16,No,No,0,https://www.techradar.com/pro/google-chrome-extensions-remain-a-security-risk-as-manifest-v3-fails-to-prevent-data-theft-and-malware-exploitation,/r/technology/comments/1goqs3y/google_chrome_extensions_remain_a_security_risk/
ai,technology,General Politics,17383368,"AI-generated images creating unrealistic expectations, hairdressers say",248,33,No,No,0,https://www.cbc.ca/news/canada/edmonton/ai-generated-images-creating-unrealistic-expectations-hairdressers-say-1.7378463#amp_tf=From%20%251%24s&aoh=17313003497581&csi=0&referrer=https%3A%2F%2Fwww.google.com&ampshare=https%3A%2F%2Fwww.cbc.ca%2Fnews%2Fcanada%2Fedmonton%2Fai-generated-images-creating-unrealistic-expectations-hairdressers-say-1.7378463,/r/technology/comments/1gok875/aigenerated_images_creating_unrealistic/
ai,democrats,Ideological Politics,480420,You were cheated out of a free and fair democratic election. Everyday up until election day.,254,18,No,Yes,0,https://i.redd.it/da3t9ximz90e1.jpeg,/r/democrats/comments/1goscrp/you_were_cheated_out_of_a_free_and_fair/
ai,democrats,Ideological Politics,480420,Former Kamala Harris aide suggests Biden should resign so she can be the 47th president …,754,305,No,No,0,https://www.usatoday.com/story/news/politics/elections/2024/11/10/jamal-simmons-joe-biden-kamala-harris/76182658007/,/r/democrats/comments/1goe6qf/former_kamala_harris_aide_suggests_biden_should/
ai,democrats,Ideological Politics,480420,Was it stolen…?,1677,1173,No,No,0,https://i.redd.it/o9wpdezwb30e1.jpeg,/r/democrats/comments/1go2sdb/was_it_stolen/
ai,democrats,Ideological Politics,480420,"What happened to election fraud? Trump, GOP go quiet on claims after win",634,84,No,No,0,https://www.usatoday.com/story/news/politics/elections/2024/11/09/donald-trump-gop-election-fraud-claims/76113170007/,/r/democrats/comments/1go9bk6/what_happened_to_election_fraud_trump_gop_go/
ai,democrats,Ideological Politics,480420,Billionaire Mark Cuban Warns Trump's Tariff Plan Already Hurting American Businesses,1467,126,No,No,0,https://www.ibtimes.com/billionaire-mark-cuban-says-trumps-tariff-plan-already-hurting-american-businesses-3750316,/r/democrats/comments/1go22sx/billionaire_mark_cuban_warns_trumps_tariff_plan/
ai,Republican,Ideological Politics,205035,"Just got booted from r/dating, but was I wrong?",276,85,No,No,0,https://www.reddit.com/gallery/1gol3id,/r/Republican/comments/1gol3id/just_got_booted_from_rdating_but_was_i_wrong/
ai,Republican,Ideological Politics,205035,Lying Corporate Media Are Responsible For Kamala Voters’ Delusional Despair,11,2,No,No,0,https://thefederalist.com/2024/11/11/lying-corporate-media-is-responsible-for-kamala-voters-delusional-despair/,/r/Republican/comments/1gotx0n/lying_corporate_media_are_responsible_for_kamala/
ai,Republican,Ideological Politics,205035,@VaughnHillyard - Kari Lake calls for @AZGOP Chair Jeff DeWit to resign after release of audio in which he can be heard bribing Lake to not run for the U.S. Senate in exchange for a potential job (and its salary): Video,85,9,No,No,0,https://x.com/VaughnHillyard/status/1749976071611580646,/r/Republican/comments/1goihst/vaughnhillyard_kari_lake_calls_for_azgop_chair/
ai,Republican,Ideological Politics,205035,They’re all so convinced fraud happened they fail to realize 2020 was the anomaly,256,91,No,No,0,https://www.reddit.com/gallery/1go7rcz,/r/Republican/comments/1go7rcz/theyre_all_so_convinced_fraud_happened_they_fail/
ai,Conservative,Ideological Politics,1144662,What do you think is the biggest reasons that the Democrats lost the election?,205,300,No,No,0,https://www.reddit.com/r/Conservative/comments/1goqtr8/what_do_you_think_is_the_biggest_reasons_that_the/,/r/Conservative/comments/1goqtr8/what_do_you_think_is_the_biggest_reasons_that_the/
ai,Conservative,Ideological Politics,1144662,"I like how the Trump campaign is still engaging with us, even after the election.",522,46,No,No,0,https://www.reddit.com/r/Conservative/comments/1gol1x3/i_like_how_the_trump_campaign_is_still_engaging/,/r/Conservative/comments/1gol1x3/i_like_how_the_trump_campaign_is_still_engaging/
ai,Conservative,Ideological Politics,1144662,NYT has yet to issue correction for wrongly claiming Trump 'falsely' accused FEMA of avoiding supporters' homes,1341,36,No,Yes,0,https://nypost.com/2024/11/10/us-news/nyt-has-yet-to-issue-correction-for-wrongly-claiming-trump-falsely-accused-fema-of-avoiding-supporters-homes/?utm_source=smartnews&utm_campaign=nypost&utm_medium=referral,/r/Conservative/comments/1gobrma/nyt_has_yet_to_issue_correction_for_wrongly/
ai,Libertarian,Ideological Politics,503607,The Salt Mines: Post-Election Meltdowns from around the Internet. These Sodium levels are off the chart! Link some election Schadenfreude you found.,64,136,Yes,No,0,https://www.reddit.com/r/Libertarian/comments/1glfw5m/the_salt_mines_postelection_meltdowns_from_around/,/r/Libertarian/comments/1glfw5m/the_salt_mines_postelection_meltdowns_from_around/
ai,Libertarian,Ideological Politics,503607,Today is a Dark Day for Liberty,42,52,Yes,Yes,0,https://www.reddit.com/r/Libertarian/comments/1gkk9pv/today_is_a_dark_day_for_liberty/,/r/Libertarian/comments/1gkk9pv/today_is_a_dark_day_for_liberty/
ai,Libertarian,Ideological Politics,503607,Cuba is undergoing total societal collapse after 65 years of communism,579,150,No,No,0,https://www.reddit.com/r/Libertarian/comments/1godah0/cuba_is_undergoing_total_societal_collapse_after/,/r/Libertarian/comments/1godah0/cuba_is_undergoing_total_societal_collapse_after/
ai,Libertarian,Ideological Politics,503607,Can someone explain how Tariffs will be good for the economy?,1,3,No,No,0,https://www.reddit.com/r/Libertarian/comments/1gorx9d/can_someone_explain_how_tariffs_will_be_good_for/,/r/Libertarian/comments/1gorx9d/can_someone_explain_how_tariffs_will_be_good_for/
ai,Libertarian,Ideological Politics,503607,"Socialists said that Bolivia's socialism was ""democratic"" so it would be fine...",280,21,No,No,0,https://i.redd.it/zpv69jaza00e1.png,/r/Libertarian/comments/1gnt61f/socialists_said_that_bolivias_socialism_was/
ai,Libertarian,Ideological Politics,503607,Liberalism vs Libertarianism,35,18,No,No,0,https://www.reddit.com/r/Libertarian/comments/1gnu9hb/liberalism_vs_libertarianism/,/r/Libertarian/comments/1gnu9hb/liberalism_vs_libertarianism/
ai,Anarchism,Ideological Politics,270966,Mutual Aid Monday,9,1,Yes,No,0,https://www.reddit.com/r/Anarchism/comments/1golhbl/mutual_aid_monday/,/r/Anarchism/comments/1golhbl/mutual_aid_monday/
ai,Anarchism,Ideological Politics,270966,"Im a disabled person, and im begging you to get informed about covid.",51,17,No,No,0,https://www.reddit.com/r/Anarchism/comments/1goj9ja/im_a_disabled_person_and_im_begging_you_to_get/,/r/Anarchism/comments/1goj9ja/im_a_disabled_person_and_im_begging_you_to_get/
ai,Anarchism,Ideological Politics,270966,DIY Digital Community Library--Advice Needed,7,1,No,No,0,https://www.reddit.com/r/Anarchism/comments/1gor9da/diy_digital_community_libraryadvice_needed/,/r/Anarchism/comments/1gor9da/diy_digital_community_libraryadvice_needed/
ai,Anarchism,Ideological Politics,270966,So should we prepare for a massive civil war under the Trump administration? What do you think is going to look like? I'm imagining some return of the occupy movement with far more intensity,44,73,No,No,0,https://www.reddit.com/r/Anarchism/comments/1gnjmy2/so_should_we_prepare_for_a_massive_civil_war/,/r/Anarchism/comments/1gnjmy2/so_should_we_prepare_for_a_massive_civil_war/
ai,Anarchism,Ideological Politics,270966,"Laid out four articles published this week for print distribution - ""The sky is falling; We’ve got this - Four articles and essays on the impending Trump presidency and what we can do about it""",8,0,No,No,0,https://drive.proton.me/urls/66AAS7XWM8#1Z4tGdA9Dpmx,/r/Anarchism/comments/1gnt6qq/laid_out_four_articles_published_this_week_for/
ai,Anarchism,Ideological Politics,270966,Can you recommend any thing in seattle?,12,4,No,No,0,https://www.reddit.com/r/Anarchism/comments/1gnnoip/can_you_recommend_any_thing_in_seattle/,/r/Anarchism/comments/1gnnoip/can_you_recommend_any_thing_in_seattle/
ai,Socialism,Ideological Politics,460718,Why aren't capitalists motivated to stop climate change? ,116,60,No,No,0,https://www.reddit.com/r/socialism/comments/1go9ybz/why_arent_capitalists_motivated_to_stop_climate/,/r/socialism/comments/1go9ybz/why_arent_capitalists_motivated_to_stop_climate/
ai,Socialism,Ideological Politics,460718,"Very Good interview with a DNC insider about ""Consultant Brain"" problem",22,1,No,No,0,https://www.rollingstone.com/politics/politics-features/why-harris-lose-trump-zogby-dnc-interview-1235159061/,/r/socialism/comments/1gojp5s/very_good_interview_with_a_dnc_insider_about/
ai,Socialism,Ideological Politics,460718,"The Stalin Eras - ""We Remember"" - Official Trailer",7,1,No,No,0,https://www.youtube.com/watch?v=ysyz3XC9i6A,/r/socialism/comments/1gonh0o/the_stalin_eras_we_remember_official_trailer/
ai,Progressive,Ideological Politics,78027,Behind the Curtain: Trump's business bonanza,12,1,No,No,0,https://www.axios.com/2024/11/07/trump-elon-musk-business-tax-cuts,/r/progressive/comments/1gm4w17/behind_the_curtain_trumps_business_bonanza/
ai,Progressive,Ideological Politics,78027,Billionaires vs Democracy - The rich are trying to buy elections all over the world and consign democracy to the trash bin of history.,287,12,No,No,0,https://inequality.org/research/billionaires-vs-democracy/,/r/progressive/comments/1ggh1hg/billionaires_vs_democracy_the_rich_are_trying_to/
ai,Progressive,Ideological Politics,78027,A Texas Woman Died After Waiting 40 Hours for Miscarriage Care,297,5,No,No,0,https://www.propublica.org/article/josseli-barnica-death-miscarriage-texas-abortion-ban,/r/progressive/comments/1gfmamd/a_texas_woman_died_after_waiting_40_hours_for/
ai,Progressive,Ideological Politics,78027,These teachers often live in poverty. A pay raise could help — but there’s a cost,70,3,No,No,0,https://www.npr.org/2024/10/22/nx-s1-5144162/biden-preschool-head-start-teacher-poverty,/r/progressive/comments/1ga8u8y/these_teachers_often_live_in_poverty_a_pay_raise/
ai,Republicanism,Ideological Politics,917,Why are monarchists cherry-pickers?,8,0,No,No,0,https://www.reddit.com/r/republicanism/comments/1c22ytx/why_are_monarchists_cherrypickers/,/r/republicanism/comments/1c22ytx/why_are_monarchists_cherrypickers/
ai,Republicanism,Ideological Politics,917,Pro-British monarchy Indian Christian saying mocking the name-reverting done by our governments (especially the renaming of Bombay to Mumbai) and openly doing sedition by saying that Charles III should be the Emperor of India and 'God Save the King' should be the Indian anthem.,3,0,No,No,0,https://www.reddit.com/gallery/1b2xwq8,/r/republicanism/comments/1b2xwq8/probritish_monarchy_indian_christian_saying/
ai,Republicanism,Ideological Politics,917,“Away with college gen ed”,0,4,No,Yes,0,https://www.reddit.com/r/republicanism/comments/19asm4l/away_with_college_gen_ed/,/r/republicanism/comments/19asm4l/away_with_college_gen_ed/
ai,Republicanism,Ideological Politics,917,Question from a Monarchist,8,20,No,No,0,https://www.reddit.com/r/republicanism/comments/z0zqv0/question_from_a_monarchist/,/r/republicanism/comments/z0zqv0/question_from_a_monarchist/
ai,Conservatives,Ideological Politics,108224,UPDATED: Arizona Supreme Court Rejects ACLU's 'Hail Mary' Suit to Draw Out Curing Deadline,15,0,No,No,0,https://redstate.com/beccalower/2024/11/10/rnc-and-az-gop-files-in-arizona-supreme-court-to-stop-aclu-from-getting-ballot-curing-extended-n2181816,/r/conservatives/comments/1gorcol/updated_arizona_supreme_court_rejects_aclus_hail/
ai,Conservatives,Ideological Politics,108224,DNC Leader Officially Deems Kamala Harris’ Campaign A ‘$1 Billion Disaster’,6,3,No,No,0,https://dallasexpress.com/national/dnc-leader-officially-deems-kamala-harris-campaign-a-1-billion-disaster/?utm_source=ActiveCampaign&utm_medium=email&utm_content=Kamala%20Harris%20Deemed%20%20%241%20billion%20%20disaster%20by%20Dem%20Officials&utm_campaign=11%2011%2024%20Newsletter,/r/conservatives/comments/1gotj7m/dnc_leader_officially_deems_kamala_harris/
ai,Conservatives,Ideological Politics,108224,That boxer in the Olympics that claimed to be a woman....is a man.,548,65,No,No,0,https://sports.ndtv.com/boxing/boxer-imane-khelif-confirmed-as-man-in-leaked-medical-repot-harbhajan-singh-reacts-6946642,/r/conservatives/comments/1go0dln/that_boxer_in_the_olympics_that_claimed_to_be_a/
ai,Conservatives,Ideological Politics,108224,Senator Hagerty Signals Trump Will Once Again Put The Clamps On Iran,39,2,No,No,0,https://www.dailywire.com/news/senator-hagerty-signals-trump-will-once-again-put-the-clamps-on-iran,/r/conservatives/comments/1goijj4/senator_hagerty_signals_trump_will_once_again_put/
