Keyword,Subreddit,Category,Members,Title,Upvotes,Comments,Moderator Interaction,Fact-Checking Mention,Total Awards,URL,Original Post URL
ai,Conservatives,Ideological Politics,108224,"CNN’s Zakaria Slams Dems ‘Lawfare’ Against Trump, ‘Deeply Illiberal’ Culture War",68,0,No,No,0,https://www.breitbart.com/clips/2024/11/10/cnns-zakaria-slams-dems-lawfare-against-trump-deeply-illiberal-culture-war/,/r/conservatives/comments/1gof9s0/cnns_zakaria_slams_dems_lawfare_against_trump/
ai,dailywire,Ideological Politics,24174,Wall of Hate - Help Document Hatred Against Trump on July13th.com,80,15,Yes,No,0,https://july13th.com/hate/,/r/dailywire/comments/1e3cqx8/wall_of_hate_help_document_hatred_against_trump/
ai,dailywire,Ideological Politics,24174,19 year old here. So I'm Gen Z. I am a female!,51,4,No,No,0,https://www.youtube.com/watch?v=ybgV3jSNKEE,/r/dailywire/comments/1gokaic/19_year_old_here_so_im_gen_z_i_am_a_female/
ai,dailywire,Ideological Politics,24174,Time for daily wire toy company,104,9,No,No,0,https://i.redd.it/vtxgdvzzr40e1.jpeg,/r/dailywire/comments/1go9iaw/time_for_daily_wire_toy_company/
ai,dailywire,Ideological Politics,24174,Subtitles on the DW App not working ,6,0,No,No,0,http://Dailywire.com,/r/dailywire/comments/1gocl5q/subtitles_on_the_dw_app_not_working/
ai,Liberal,Ideological Politics,119729,Arizona AG says she won't drop state's fake electors case against Trump allies,96,4,No,No,0,https://www.upi.com/Top_News/US/2024/11/10/Arizona-fake-electors-case/4001731292312/,/r/Liberal/comments/1gosjeh/arizona_ag_says_she_wont_drop_states_fake/
ai,Liberal,Ideological Politics,119729,Why were the polls so wrong?,116,140,No,No,0,https://www.reddit.com/r/Liberal/comments/1go7sv1/why_were_the_polls_so_wrong/,/r/Liberal/comments/1go7sv1/why_were_the_polls_so_wrong/
ai,Liberal,Ideological Politics,119729,Glad to see we have visitors.,5,4,No,Yes,0,https://www.reddit.com/r/Liberal/comments/1gon2jn/glad_to_see_we_have_visitors/,/r/Liberal/comments/1gon2jn/glad_to_see_we_have_visitors/
ai,Liberal,Ideological Politics,119729,I keep hearing theories about how 15m people staying home didn't actually stay home and I'm not buying it.,310,305,No,No,0,https://www.reddit.com/r/Liberal/comments/1gnrlns/i_keep_hearing_theories_about_how_15m_people/,/r/Liberal/comments/1gnrlns/i_keep_hearing_theories_about_how_15m_people/
ai,Liberal,Ideological Politics,119729,"My liberal parents say they will no longer watch any political news on TV, nor will they ever vote in another election.",479,238,No,No,0,https://www.reddit.com/r/Liberal/comments/1gnof4d/my_liberal_parents_say_they_will_no_longer_watch/,/r/Liberal/comments/1gnof4d/my_liberal_parents_say_they_will_no_longer_watch/
ai,Liberal,Ideological Politics,119729,"Liberals need to stop blaming themselves, and stop blaming Trump voters",153,106,No,Yes,0,https://www.reddit.com/r/Liberal/comments/1gnk7ug/liberals_need_to_stop_blaming_themselves_and_stop/,/r/Liberal/comments/1gnk7ug/liberals_need_to_stop_blaming_themselves_and_stop/
ai,Liberal,Ideological Politics,119729,Thinking about these big blue cities where the majority of red states money comes from.  These blue cities could bring their red states to there knees. ,124,125,No,No,0,https://www.reddit.com/r/Liberal/comments/1gne8ji/thinking_about_these_big_blue_cities_where_the/,/r/Liberal/comments/1gne8ji/thinking_about_these_big_blue_cities_where_the/
elon musk,KamalaHarris,Ideological Politics,76161,Dump Twitter and f*** Elon Musk,2132,314,No,No,0,https://newrepublic.com/article/188156/liberals-dump-musk-leave-twitter,/r/KamalaHarris/comments/1gnkjnn/dump_twitter_and_f_elon_musk/
ai,KamalaHarris,Ideological Politics,76161,Democrats retain one-seat majority control of the Pennsylvania House,1167,37,No,No,0,https://apnews.com/article/pennsylvania-house-2024-election-frank-burns-johnstown-1fb3477611874bb4e4409c6452681e5f?campaign_id=9&emc=edit_nn_20241109&instance_id=139211&nl=the-morning&regi_id=53831380&segment_id=182739&user_id=fe5d662adf685ae9dedd7464c832fcdf,/r/KamalaHarris/comments/1gnlq5r/democrats_retain_oneseat_majority_control_of_the/
ai,Impeach_Trump,Ideological Politics,60568,Trump's crowds are dwindling as his campaign winds down — Empty seats and early exits have grown more common,430,18,No,No,0,https://www.nytimes.com/2024/11/04/us/politics/trump-rally-crowds.html,/r/Impeach_Trump/comments/1gjn8sb/trumps_crowds_are_dwindling_as_his_campaign_winds/
ai,Impeach_Trump,Ideological Politics,60568,Let's make him lose again,133,1,No,No,0,https://imghoster.co/5ysKrAQZLXV2ObZ,/r/Impeach_Trump/comments/1gj9krk/lets_make_him_lose_again/
elon musk,Impeach_Trump,Ideological Politics,60568,"Elon Musk predicts ‘hardship,’ economic turmoil and a stock-market crash if Trump wins",58,4,No,No,0,https://www.marketwatch.com/story/kaboom-elon-musk-predicts-hardship-economic-turmoil-and-a-stock-market-crash-if-trump-wins-20483008,/r/Impeach_Trump/comments/1gfwy5u/elon_musk_predicts_hardship_economic_turmoil_and/
