Keyword,Subreddit,Category,Members,Title,Upvotes,Comments,Moderator Interaction,Fact-Checking Mention,Total Awards,URL,Original Post URL
treasury,Wikileaks,General Politics,177613,Why does the US still control every penny of Iraqi oil revenues?,39,6,No,No,0,https://www.reddit.com/r/WikiLeaks/comments/1fso9v7/why_does_the_us_still_control_every_penny_of/,/r/WikiLeaks/comments/1fso9v7/why_does_the_us_still_control_every_penny_of/
prices,News,General Politics,28965267,"'If I don't speak up, I'll die': woman on welfare in Japan shares hardship as prices soar",6184,244,No,No,0,https://mainichi.jp/english/articles/20241121/p2a/00m/0na/016000c,/r/news/comments/1gwemf9/if_i_dont_speak_up_ill_die_woman_on_welfare_in/
money,PoliticalDiscussion,General Politics,2184541,What validity does Kennedy have for removing water fluoridation?,354,676,No,No,0,https://www.reddit.com/r/PoliticalDiscussion/comments/1gucz83/what_validity_does_kennedy_have_for_removing/,/r/PoliticalDiscussion/comments/1gucz83/what_validity_does_kennedy_have_for_removing/
inflation,NeutralPolitics,General Politics,610822,Do any countries have laws to combat politically-driven misinformation?,38,42,No,Yes,0,https://www.reddit.com/r/NeutralPolitics/comments/1gq4agt/do_any_countries_have_laws_to_combat/,/r/NeutralPolitics/comments/1gq4agt/do_any_countries_have_laws_to_combat/
economy,NeutralPolitics,General Politics,610822,Trump won the presidency and popular vote running on the mass deportation of illegal aliens. Who saw this coming and what lessons can be learned?,227,326,No,No,0,https://www.reddit.com/r/NeutralPolitics/comments/1gnk7ih/trump_won_the_presidency_and_popular_vote_running/,/r/NeutralPolitics/comments/1gnk7ih/trump_won_the_presidency_and_popular_vote_running/
money,democrats,Ideological Politics,481224,This man is now jobless… will you donate some money for his next Botox treatment? Anything helps Godbless!!!,381,114,No,No,0,https://i.redd.it/i1bzk7s6ed2e1.jpeg,/r/democrats/comments/1gwy6kl/this_man_is_now_jobless_will_you_donate_some/
money,Republican,Ideological Politics,206028,Bob Casey Finally Concedes to Dave McCormick... Weeks After Wasting Everyone's Time And Money 😁👍,168,9,No,No,0,https://townhall.com/tipsheet/saraharnold/2024/11/21/bob-casey-finally-conceded-to-dave-mccormick-n2648117,/r/Republican/comments/1gwvye9/bob_casey_finally_concedes_to_dave_mccormick/
money,Republican,Ideological Politics,206028,What Will Kamala Harris Do With Recount Money? Does Biden Get 10 Percent? Does Anyone Really Care? | So Many Questions 😁,57,25,No,No,0,https://www.dailysignal.com/2024/11/21/harris-raises-money-for-recount-as-deadlines-pass-to-seek-one/,/r/Republican/comments/1gwx85l/what_will_kamala_harris_do_with_recount_money/
money,Libertarian,Ideological Politics,503608,Why some Libertarian like this ruling?,396,78,No,No,0,https://i.redd.it/mhn1m4vhs42e1.png,/r/Libertarian/comments/1gw0v6s/why_some_libertarian_like_this_ruling/
prices,Anarchism,Ideological Politics,271406,"If your work-from-home job is returning to office, they WANT you to quit because it has better optics for the company than layoffs.",125,10,No,No,0,https://www.reddit.com/r/Anarchism/comments/1gwho3l/if_your_workfromhome_job_is_returning_to_office/,/r/Anarchism/comments/1gwho3l/if_your_workfromhome_job_is_returning_to_office/
prices,Socialism,Ideological Politics,461408,Over 50% of the higher prices are due to increases in corporate profits,728,11,No,No,0,https://v.redd.it/ja178ze5692e1,/r/socialism/comments/1gwfpoa/over_50_of_the_higher_prices_are_due_to_increases/
prices,Republicanism,Ideological Politics,916,“Away with college gen ed”,0,4,No,Yes,0,https://www.reddit.com/r/republicanism/comments/19asm4l/away_with_college_gen_ed/,/r/republicanism/comments/19asm4l/away_with_college_gen_ed/
economy,Conservatives,Ideological Politics,108286,SPITS OUT COFFEE: TIME Tells Readers ‘Don’t Give Trump Credit’ for ‘Success of the Biden Economy’,146,38,No,No,0,https://www.newsbusters.org/blogs/business/joseph-vazquez/2024/11/21/spits-out-coffee-time-tells-readers-dont-give-trump-credit,/r/conservatives/comments/1gwlwjh/spits_out_coffee_time_tells_readers_dont_give/
prices,Liberal,Ideological Politics,120009,Follow up: what were democrats like prior to Roe v Wade,6,12,No,No,0,https://www.reddit.com/r/Liberal/comments/1gw9390/follow_up_what_were_democrats_like_prior_to_roe_v/,/r/Liberal/comments/1gw9390/follow_up_what_were_democrats_like_prior_to_roe_v/
money,Liberal,Ideological Politics,120009,Trump calls for hush money dismissal; bids to run out clock on case,43,11,No,No,0,https://thehill.com/regulation/court-battles/4999903-trump-conviction-dismissal-inauguration/,/r/Liberal/comments/1gvvokn/trump_calls_for_hush_money_dismissal_bids_to_run/
money,Liberal,Ideological Politics,120009,Was the Democratic Party this Quiet in 2016 after Trump Won?,219,199,No,No,0,https://www.reddit.com/r/Liberal/comments/1guxn5s/was_the_democratic_party_this_quiet_in_2016_after/,/r/Liberal/comments/1guxn5s/was_the_democratic_party_this_quiet_in_2016_after/
tariffs,KamalaHarris,Ideological Politics,74548,More Productive Question.  How Can We Combat the Impacts of Rising Tariffs?,390,100,No,No,0,https://media3.giphy.com/media/20PxEtqmgkrde8uRw1/giphy.gif?cid=9b38fe912yum4qto69jng1j0we2qcxqmi59nb51lrcrdqxen&ep=v1_gifs_search&rid=giphy.gif&ct=g,/r/KamalaHarris/comments/1gu6jpl/more_productive_question_how_can_we_combat_the/
