Keyword,Subreddit,Category,Members,Title,Upvotes,Comments,Moderator Interaction,Fact-Checking Mention,Total Awards,URL,Original Post URL
immigration,PoliticalDiscussion,General Politics,2184515,How Can the Left Redefine Itself?,0,91,No,No,0,https://www.reddit.com/r/PoliticalDiscussion/comments/1gvo61u/how_can_the_left_redefine_itself/,/r/PoliticalDiscussion/comments/1gvo61u/how_can_the_left_redefine_itself/
immigration,NeutralPolitics,General Politics,610814,Do any countries have laws to combat politically-driven misinformation?,39,42,No,Yes,0,https://www.reddit.com/r/NeutralPolitics/comments/1gq4agt/do_any_countries_have_laws_to_combat/,/r/NeutralPolitics/comments/1gq4agt/do_any_countries_have_laws_to_combat/
immigration,NeutralPolitics,General Politics,610814,Trump won the presidency and popular vote running on the mass deportation of illegal aliens. Who saw this coming and what lessons can be learned?,234,326,No,No,0,https://www.reddit.com/r/NeutralPolitics/comments/1gnk7ih/trump_won_the_presidency_and_popular_vote_running/,/r/NeutralPolitics/comments/1gnk7ih/trump_won_the_presidency_and_popular_vote_running/
immigration,moderatepolitics,General Politics,296873,Biden admin quietly loosening immigration policies before Trump takes office — including letting migrants skip ICE check-ins in NYC,223,145,No,No,0,https://nypost.com/2024/11/21/us-news/biden-admin-to-let-illegal-migrants-skip-nyc-ice-appointments/,/r/moderatepolitics/comments/1gx12jx/biden_admin_quietly_loosening_immigration/
immigration,moderatepolitics,General Politics,296873,Trudeau admits open immigration system was exploited by ‘bad actors’,327,161,No,No,0,https://www.washingtonexaminer.com/news/world/3233030/justin-trudeau-admits-immigration-system-exploited/,/r/moderatepolitics/comments/1gw87em/trudeau_admits_open_immigration_system_was/
illegal,Republican,Ideological Politics,206026,Biden Administration Attempts Rigging System to Protect Illegals ,65,27,No,No,0,https://pjmedia.com/catherinesalgado/2024/11/21/biden-admin-rigging-system-to-protect-illegals-from-trump-n4934512,/r/Republican/comments/1gwm4un/biden_administration_attempts_rigging_system_to/
illegal,Conservatives,Ideological Politics,108283,Illegal Alien Charged With Raping 14-Year-Old Girl In Denver As Mayor Opposes Deportation Effort,145,7,No,No,0,https://www.dailywire.com/news/illegal-alien-charged-with-raping-14-year-old-girl-in-denver-as-mayor-opposes-deportation-effort,/r/conservatives/comments/1gwxbj6/illegal_alien_charged_with_raping_14yearold_girl/
