Keyword,Subreddit,Category,Members,Title,Upvotes,Comments,Moderator Interaction,Fact-Checking Mention,Total Awards,URL,Original Post URL
immigration,PoliticalDiscussion,General Politics,2184536,How Can the Left Redefine Itself?,0,93,No,No,0,https://www.reddit.com/r/PoliticalDiscussion/comments/1gvo61u/how_can_the_left_redefine_itself/,/r/PoliticalDiscussion/comments/1gvo61u/how_can_the_left_redefine_itself/
immigration,NeutralPolitics,General Politics,610815,Do any countries have laws to combat politically-driven misinformation?,38,42,No,Yes,0,https://www.reddit.com/r/NeutralPolitics/comments/1gq4agt/do_any_countries_have_laws_to_combat/,/r/NeutralPolitics/comments/1gq4agt/do_any_countries_have_laws_to_combat/
immigration,NeutralPolitics,General Politics,610815,Trump won the presidency and popular vote running on the mass deportation of illegal aliens. Who saw this coming and what lessons can be learned?,234,326,No,No,0,https://www.reddit.com/r/NeutralPolitics/comments/1gnk7ih/trump_won_the_presidency_and_popular_vote_running/,/r/NeutralPolitics/comments/1gnk7ih/trump_won_the_presidency_and_popular_vote_running/
immigration,moderatepolitics,General Politics,296977,Biden admin quietly loosening immigration policies before Trump takes office — including letting migrants skip ICE check-ins in NYC,350,409,No,No,0,https://nypost.com/2024/11/21/us-news/biden-admin-to-let-illegal-migrants-skip-nyc-ice-appointments/,/r/moderatepolitics/comments/1gx12jx/biden_admin_quietly_loosening_immigration/
immigration,moderatepolitics,General Politics,296977,Trudeau admits open immigration system was exploited by ‘bad actors’,339,165,No,No,0,https://www.washingtonexaminer.com/news/world/3233030/justin-trudeau-admits-immigration-system-exploited/,/r/moderatepolitics/comments/1gw87em/trudeau_admits_open_immigration_system_was/
illegal,Conservative,Ideological Politics,1150506,Denver Mayor Warns Trump Of ‘Tiananmen Square Moment’ If He Rounds Up Illegal Immigrants,218,82,No,No,0,https://www.dailywire.com/news/denver-mayor-warns-trump-of-tiananmen-square-moment-if-he-rounds-up-illegal-immigrants,/r/Conservative/comments/1gx86py/denver_mayor_warns_trump_of_tiananmen_square/
illegal,Conservative,Ideological Politics,1150506,Illegal Smiles As He's Arrested for 'Sexually Motivated Robbery' of Manhattan DA Bragg's Assistant Atty,86,12,No,No,0,https://redstate.com/rusty-weiss/2024/11/21/illegal-smiles-as-hes-arrested-for-sexually-motivated-robbery-of-assistant-to-manhattan-da-alvin-bragg-n2182288,/r/Conservative/comments/1gxccn6/illegal_smiles_as_hes_arrested_for_sexually/
illegal,Conservatives,Ideological Politics,108287,Illegal Alien Charged With Raping 14-Year-Old Girl In Denver As Mayor Opposes Deportation Effort,201,8,No,No,0,https://www.dailywire.com/news/illegal-alien-charged-with-raping-14-year-old-girl-in-denver-as-mayor-opposes-deportation-effort,/r/conservatives/comments/1gwxbj6/illegal_alien_charged_with_raping_14yearold_girl/
