Keyword,Subreddit,Category,Members,Title,Upvotes,Comments,Moderator Interaction,Fact-Checking Mention,Total Awards,URL,Original Post URL
texas,News,General Politics,28951278,'The Voice' winner Sundance Head recovers at home after being accidentally shot on his Texas ranch,1507,207,No,No,0,https://abcnews.go.com/US/wireStory/voice-winner-sundance-head-recovers-home-after-accidentally-115946662,/r/news/comments/1gu5rr6/the_voice_winner_sundance_head_recovers_at_home/
immigration,PoliticalDiscussion,General Politics,2184529,"For what reason do you believe it is that the public doesn't broadly acknowledge that immigrants are statistically less likely to commit crimes than native born Americans, and instead believe that immigrants are more prone to violence?",433,581,No,Yes,0,https://www.reddit.com/r/PoliticalDiscussion/comments/1gu5dba/for_what_reason_do_you_believe_it_is_that_the/,/r/PoliticalDiscussion/comments/1gu5dba/for_what_reason_do_you_believe_it_is_that_the/
illegal,PoliticalDiscussion,General Politics,2184529,"The Pennsylvania Senate race is extremely close and heading for a recount.  What's exactly going on there?  Finally, what is the use for provisional ballots in the first place?",40,28,No,No,0,https://www.reddit.com/r/PoliticalDiscussion/comments/1gu73uj/the_pennsylvania_senate_race_is_extremely_close/,/r/PoliticalDiscussion/comments/1gu73uj/the_pennsylvania_senate_race_is_extremely_close/
border,PoliticalDiscussion,General Politics,2184529,What are the chances of WW3 and Nuclear Warfare since US allowed missile strikes in Russia?,0,26,No,No,0,https://www.reddit.com/r/PoliticalDiscussion/comments/1gueb8c/what_are_the_chances_of_ww3_and_nuclear_warfare/,/r/PoliticalDiscussion/comments/1gueb8c/what_are_the_chances_of_ww3_and_nuclear_warfare/
immigration,NeutralPolitics,General Politics,610726,Do any countries have laws to combat politically-driven misinformation?,38,37,No,Yes,0,https://www.reddit.com/r/NeutralPolitics/comments/1gq4agt/do_any_countries_have_laws_to_combat/,/r/NeutralPolitics/comments/1gq4agt/do_any_countries_have_laws_to_combat/
immigration,NeutralPolitics,General Politics,610726,Trump won the presidency and popular vote running on the mass deportation of illegal aliens. Who saw this coming and what lessons can be learned?,225,326,No,No,0,https://www.reddit.com/r/NeutralPolitics/comments/1gnk7ih/trump_won_the_presidency_and_popular_vote_running/,/r/NeutralPolitics/comments/1gnk7ih/trump_won_the_presidency_and_popular_vote_running/
texas,democrats,Ideological Politics,480979,Texas Democrats at a crossroads after devastating election,136,48,No,No,0,https://thehill.com/homenews/state-watch/4996197-texas-democrats-loss-strategy/,/r/democrats/comments/1gufxaa/texas_democrats_at_a_crossroads_after_devastating/
immigration,Republican,Ideological Politics,205837,Trump's War on the D.C. Establishment Requires This Exact Cabinet to Fight | Opinion,51,13,No,Yes,0,https://www.newsweek.com/trumps-war-dc-establishment-requires-this-exact-cabinet-fight-opinion-1986309,/r/Republican/comments/1gua2me/trumps_war_on_the_dc_establishment_requires_this/
texas,Progressive,Ideological Politics,78102,A Texas Woman Died After Waiting 40 Hours for Miscarriage Care,298,6,No,No,0,https://www.propublica.org/article/josseli-barnica-death-miscarriage-texas-abortion-ban,/r/progressive/comments/1gfmamd/a_texas_woman_died_after_waiting_40_hours_for/
border,dailywire,Ideological Politics,24272,New border czar owned AOC,141,12,No,No,0,https://www.instagram.com/reel/DCP4TAnyNoZ/?igsh=MmI5ZmppaWlpYWs2,/r/dailywire/comments/1gr2vm4/new_border_czar_owned_aoc/
