Keyword,Subreddit,Category,Members,Title,Upvotes,Comments,Moderator Interaction,Fact-Checking Mention,Total Awards,URL,Original Post URL
mexico,PoliticalDiscussion,General Politics,2184591,What is the likely outcome of the 2026 US Senate elections?,83,204,No,No,0,https://www.reddit.com/r/PoliticalDiscussion/comments/1gs628t/what_is_the_likely_outcome_of_the_2026_us_senate/,/r/PoliticalDiscussion/comments/1gs628t/what_is_the_likely_outcome_of_the_2026_us_senate/
immigration,NeutralPolitics,General Politics,610732,Do any countries have laws to combat politically-driven misinformation?,37,37,No,Yes,0,https://www.reddit.com/r/NeutralPolitics/comments/1gq4agt/do_any_countries_have_laws_to_combat/,/r/NeutralPolitics/comments/1gq4agt/do_any_countries_have_laws_to_combat/
immigration,NeutralPolitics,General Politics,610732,Trump won the presidency and popular vote running on the mass deportation of illegal aliens. Who saw this coming and what lessons can be learned?,223,326,No,No,0,https://www.reddit.com/r/NeutralPolitics/comments/1gnk7ih/trump_won_the_presidency_and_popular_vote_running/,/r/NeutralPolitics/comments/1gnk7ih/trump_won_the_presidency_and_popular_vote_running/
border,Socialism,Ideological Politics,461153,"In Southern Arizona, since 2014, Israeli weapons giant Elbit Systems has installed a network of 53 surveillance towers up to 160 feet tall, employing a 7.5-mile camera range and 13-mile radius of ground-sweeping radar. ",31,2,No,No,0,https://i.redd.it/apqv6rbr6k1e1.jpeg,/r/socialism/comments/1gtspai/in_southern_arizona_since_2014_israeli_weapons/
texas,Socialism,Ideological Politics,461153,"🚘 PSL’s 2nd Liberation Rides to Prison Program 🚘‼️ This holiday season, help reunite Texas families separated by the racist mass incarceration system. ",27,1,No,No,0,https://www.reddit.com/gallery/1gtphuh,/r/socialism/comments/1gtphuh/psls_2nd_liberation_rides_to_prison_program_this/
texas,Progressive,Ideological Politics,78098,A Texas Woman Died After Waiting 40 Hours for Miscarriage Care,299,6,No,No,0,https://www.propublica.org/article/josseli-barnica-death-miscarriage-texas-abortion-ban,/r/progressive/comments/1gfmamd/a_texas_woman_died_after_waiting_40_hours_for/
border,dailywire,Ideological Politics,24265,New border czar owned AOC,142,12,No,No,0,https://www.instagram.com/reel/DCP4TAnyNoZ/?igsh=MmI5ZmppaWlpYWs2,/r/dailywire/comments/1gr2vm4/new_border_czar_owned_aoc/
