Keyword,Subreddit,Category,Members,Title,Upvotes,Comments,Moderator Interaction,Fact-Checking Mention,Total Awards,URL,Original Post URL
europe,Wikileaks,General Politics,177621,"Finally Free, Assange Receives a Measure of Justice From the Council of Europe",43,1,No,No,0,https://truthout.org/articles/finally-free-assange-receives-a-measure-of-justice-from-the-council-of-europe/,/r/WikiLeaks/comments/1fxlpkt/finally_free_assange_receives_a_measure_of/
War,Wikileaks,General Politics,177621,Parliamentary Assembly recognises Julian Assange as a ‘political prisoner’ and warns against the chilling effect of his harsh treatment,42,0,No,No,0,https://www.coe.int/en/web/portal/-/pace-recognises-julian-assange-as-a-political-prisoner-and-warns-against-the-chilling-effect-of-his-harsh-treatment,/r/WikiLeaks/comments/1fx0tn0/parliamentary_assembly_recognises_julian_assange/
europe,Wikileaks,General Politics,177621,Julian Assange attends hearing on his detention and conviction at the Council of Europe,20,1,No,No,0,https://www.youtube.com/watch?v=hzHktIKyt-w,/r/WikiLeaks/comments/1fu7cca/julian_assange_attends_hearing_on_his_detention/
europe,Wikileaks,General Politics,177621,Julian to speak at a parliamentary hearing in Strasbourg on the chilling effect on human rights his treatment has had.,22,0,No,No,0,https://www.reddit.com/r/WikiLeaks/comments/1ftadxc/julian_to_speak_at_a_parliamentary_hearing_in/,/r/WikiLeaks/comments/1ftadxc/julian_to_speak_at_a_parliamentary_hearing_in/
israel,Wikileaks,General Politics,177621,The Hezbollah leader killed by Israel professed to want peace,0,20,No,No,0,https://youtu.be/3M1fHfKenTM?si=5By4wuDaS7IRM2hb&t=185s,/r/WikiLeaks/comments/1fryvhy/the_hezbollah_leader_killed_by_israel_professed/
War,News,General Politics,28956771,NYC issues first drought warning in over 20 years after record rainless streak,3486,158,No,No,0,https://www.nbcnews.com/news/us-news/nyc-issues-first-drought-warning-20-years-record-rainless-streak-rcna180759,/r/news/comments/1guxx4e/nyc_issues_first_drought_warning_in_over_20_years/
british,News,General Politics,28956771,Thousands of British farmers protest against 'tractor tax' on inheritance,448,103,No,No,0,https://www.reuters.com/world/uk/british-farmers-protest-against-tractor-tax-london-2024-11-19/,/r/news/comments/1gv2e0k/thousands_of_british_farmers_protest_against/
War,PoliticalDiscussion,General Politics,2184538,How does a campaign to expand rights differ from a campaign to prevent rights from backsliding?,1,2,No,Yes,0,https://www.reddit.com/r/PoliticalDiscussion/comments/1gv4yrs/how_does_a_campaign_to_expand_rights_differ_from/,/r/PoliticalDiscussion/comments/1gv4yrs/how_does_a_campaign_to_expand_rights_differ_from/
War,PoliticalDiscussion,General Politics,2184538,What is the tying social identity for white folks in the Democratic Party (current/historically) (read body)? ,0,75,No,No,0,https://www.reddit.com/r/PoliticalDiscussion/comments/1gv6ovz/what_is_the_tying_social_identity_for_white_folks/,/r/PoliticalDiscussion/comments/1gv6ovz/what_is_the_tying_social_identity_for_white_folks/
ukraine,PoliticalDiscussion,General Politics,2184538,Will kidnapped ukrainian children ever be brought back home?,41,93,No,No,0,https://www.reddit.com/r/PoliticalDiscussion/comments/1gtqoi5/will_kidnapped_ukrainian_children_ever_be_brought/,/r/PoliticalDiscussion/comments/1gtqoi5/will_kidnapped_ukrainian_children_ever_be_brought/
War,PoliticalDiscussion,General Politics,2184538,Would Biden have won the Presidency?,81,556,No,No,0,https://www.reddit.com/r/PoliticalDiscussion/comments/1gteztp/would_biden_have_won_the_presidency/,/r/PoliticalDiscussion/comments/1gteztp/would_biden_have_won_the_presidency/
War,PoliticalDiscussion,General Politics,2184538,How Much of America’s Polarization Is Engineered by Foreign Influence?,268,149,No,Yes,0,https://www.reddit.com/r/PoliticalDiscussion/comments/1gt1v4x/how_much_of_americas_polarization_is_engineered/,/r/PoliticalDiscussion/comments/1gt1v4x/how_much_of_americas_polarization_is_engineered/
War,NeutralPolitics,General Politics,610769,What to expect after the U.S. election,283,26,Yes,Yes,0,https://www.reddit.com/r/NeutralPolitics/comments/1gflxpk/what_to_expect_after_the_us_election/,/r/NeutralPolitics/comments/1gflxpk/what_to_expect_after_the_us_election/
ukraine,NeutralPolitics,General Politics,610769,Is NATO still a credible deterrent? What are the arguments for and against?,14,59,No,No,0,https://www.reddit.com/r/NeutralPolitics/comments/1guw3ls/is_nato_still_a_credible_deterrent_what_are_the/,/r/NeutralPolitics/comments/1guw3ls/is_nato_still_a_credible_deterrent_what_are_the/
War,NeutralPolitics,General Politics,610769,"Realistically, what things can RFK Jr. do right away with his HHS appointment?",166,131,No,Yes,0,https://www.reddit.com/r/NeutralPolitics/comments/1gs44iq/realistically_what_things_can_rfk_jr_do_right/,/r/NeutralPolitics/comments/1gs44iq/realistically_what_things_can_rfk_jr_do_right/
War,NeutralPolitics,General Politics,610769,Tracking what bills/decisions are coming to contact reps/senators in a timely manner,35,12,No,No,0,https://www.reddit.com/r/NeutralPolitics/comments/1gqkpdp/tracking_what_billsdecisions_are_coming_to/,/r/NeutralPolitics/comments/1gqkpdp/tracking_what_billsdecisions_are_coming_to/
War,NeutralPolitics,General Politics,610769,Is now the time for a NEW moderate third party in U.S. politics?,2,83,No,No,0,https://www.reddit.com/r/NeutralPolitics/comments/1gms9so/is_now_the_time_for_a_new_moderate_third_party_in/,/r/NeutralPolitics/comments/1gms9so/is_now_the_time_for_a_new_moderate_third_party_in/
War,NeutralPolitics,General Politics,610769,Where is the Western world’s paradigm shift coming from?,116,128,No,Yes,0,https://www.reddit.com/r/NeutralPolitics/comments/1glkk8q/where_is_the_western_worlds_paradigm_shift_coming/,/r/NeutralPolitics/comments/1glkk8q/where_is_the_western_worlds_paradigm_shift_coming/
War,NeutralPolitics,General Politics,610769,Why Are So Many Men Leaving The Democratic Party Over The Last Few Years?,393,156,No,No,0,https://www.reddit.com/r/NeutralPolitics/comments/1gklb9t/why_are_so_many_men_leaving_the_democratic_party/,/r/NeutralPolitics/comments/1gklb9t/why_are_so_many_men_leaving_the_democratic_party/
ukraine,moderatepolitics,General Politics,296736,"Biden approves antipersonnel mines for Ukraine, undoing his own policy",60,52,No,No,0,https://www.washingtonpost.com/national-security/2024/11/19/biden-landmines-ukraine-russia,/r/moderatepolitics/comments/1gvgo0a/biden_approves_antipersonnel_mines_for_ukraine/
War,moderatepolitics,General Politics,296736,Trump expected to nominate Howard Lutnick for Commerce secretary,113,74,No,No,0,https://www.cnn.com/2024/11/19/politics/howard-lutnick-commerce-secretary/index.html,/r/moderatepolitics/comments/1gv14i2/trump_expected_to_nominate_howard_lutnick_for/
War,moderatepolitics,General Politics,296736,Case Preview: United States v. Skrmetti,64,260,No,No,0,https://www.reddit.com/r/moderatepolitics/comments/1gv0jsz/case_preview_united_states_v_skrmetti/,/r/moderatepolitics/comments/1gv0jsz/case_preview_united_states_v_skrmetti/
uk,technology,General Politics,17423605,Bluesky Sees Greatest Sustained Growth So Far in the US and UK,1163,39,No,No,0,https://www.similarweb.com/blog/insights/social-media-news/bluesky-sustained-growth/,/r/technology/comments/1gvbpxy/bluesky_sees_greatest_sustained_growth_so_far_in/
china,technology,General Politics,17423605,Novo Nordisk sells hit weight-loss drug in China—at fraction of US price,676,103,No,No,0,https://arstechnica.com/health/2024/11/novo-nordisk-sells-hit-weight-loss-drug-in-china-at-fraction-of-us-price/,/r/technology/comments/1gvars9/novo_nordisk_sells_hit_weightloss_drug_in_chinaat/
War,democrats,Ideological Politics,481054,Walmart warns it will have to raise prices if Trump’s tariffs are enacted,1011,110,No,No,0,https://www.independent.co.uk/news/world/americas/walmart-trump-tariffs-cost-of-living-b2650051.html,/r/democrats/comments/1gvav1d/walmart_warns_it_will_have_to_raise_prices_if/
russia,democrats,Ideological Politics,481054,"""Keep your loud, your boastful, Your ego driven yearning to rule me, The spray-tanned refuse of reality TV. Send these, the tantrum-tossed, away to Russia's shore. I lift my boot to their backdoor, I am woman, hear me ROAR!""",76,4,No,No,0,https://i.redd.it/d9qm2p73ly1e1.jpeg,/r/democrats/comments/1gvds6x/keep_your_loud_your_boastful_your_ego_driven/
War,democrats,Ideological Politics,481054,When Does Power Concede? Thwarting MAGA Will Take More Than Protest and Symbolic Resistance.,184,41,No,No,0,https://www.thenation.com/article/politics/resistance-trump-agenda-states-rights/,/r/democrats/comments/1gv60lr/when_does_power_concede_thwarting_maga_will_take/
ukraine,democrats,Ideological Politics,481054,Putin Lowers Nuclear Weapons Threshold After U.S. Allows Ukraine to Use Missiles Against Russia (Gift Article),412,91,No,No,0,https://www.nytimes.com/2024/11/19/world/europe/putin-russia-nuclear-weapons-missiles.html?unlocked_article_code=1.bE4._J3g.t8_HMFXmSY8L&smid=nytcore-ios-share&referringSource=articleShare,/r/democrats/comments/1guxels/putin_lowers_nuclear_weapons_threshold_after_us/
War,Republican,Ideological Politics,205892,"Trump transition adviser warned DOJ career attorneys that subverting, undermining, or sabotaging Trump’s incoming agenda will be cause for termination 😁👍",240,22,No,No,0,https://www.breitbart.com/politics/2024/11/19/report-multiple-doj-fbi-officials-weigh-lawyering-up-fear-being-criminally-investigated/,/r/Republican/comments/1gv1eae/trump_transition_adviser_warned_doj_career/
russia,Republican,Ideological Politics,205892,Missiles just struck deep inside Russia. The Kremlin's response was to authorize the use of nukes. | Our Greatest Threat Appears To Be Biden 🤔,74,47,No,No,0,https://notthebee.com/article/american-missiles-just-struck-inside-russia-which-is-now-threatening-nuclear-war,/r/Republican/comments/1gv8oc7/missiles_just_struck_deep_inside_russia_the/
ukraine,Libertarian,Ideological Politics,503634,"Biden approves antipersonnel mines for Ukraine, undoing his own policy",61,21,No,No,0,https://www.washingtonpost.com/national-security/2024/11/19/biden-landmines-ukraine-russia/,/r/Libertarian/comments/1gvevfw/biden_approves_antipersonnel_mines_for_ukraine/
ukraine,Libertarian,Ideological Politics,503634,Biden allows Ukraine to strike inside Russia with long-range missiles,40,39,No,No,0,https://www.bbc.com/news/articles/c789x0y91vvo,/r/Libertarian/comments/1gv0w0q/biden_allows_ukraine_to_strike_inside_russia_with/
War,Anarchism,Ideological Politics,271327,Testimonies from kaiāwhina (mutual aid volunteers) about cops at the recent nationwide Toitū Te Tiriti hīkoi/protest in Aotearoa New Zealand,48,5,No,No,0,https://www.reddit.com/r/Anarchism/comments/1gujawr/testimonies_from_kaiāwhina_mutual_aid_volunteers/,/r/Anarchism/comments/1gujawr/testimonies_from_kaiāwhina_mutual_aid_volunteers/
china,Anarchism,Ideological Politics,271327,Uncovering Chinese Anarchy Part 2: Mohist Activism and Yangzi's Individualism,15,0,No,No,0,https://medium.com/@1over0equalsundefined/uncovering-chinese-anarchy-part-2-mohist-activism-and-yangzis-individualism-d55867a64bf2,/r/Anarchism/comments/1guo9om/uncovering_chinese_anarchy_part_2_mohist_activism/
uk,Socialism,Ideological Politics,461300,Farmers protesting in UK,657,43,No,No,0,https://v.redd.it/swvmm3zjyw1e1,/r/socialism/comments/1gv6ap7/farmers_protesting_in_uk/
china,Socialism,Ideological Politics,461300,Thoughts on China's road to Communism? ,118,34,No,No,0,https://i.redd.it/2qalqzfhpv1e1.jpeg,/r/socialism/comments/1gv05hj/thoughts_on_chinas_road_to_communism/
gaza,Socialism,Ideological Politics,461300,PACK THE CITY COUNCIL MEETING 🇵🇸🇵🇸,4,2,No,No,0,https://i.redd.it/zsq1deootz1e1.jpeg,/r/socialism/comments/1gvihgj/pack_the_city_council_meeting/
War,Socialism,Ideological Politics,461300,How do you explore the feeling of guilt? ,33,14,No,No,0,https://www.reddit.com/r/socialism/comments/1gv291o/how_do_you_explore_the_feeling_of_guilt/,/r/socialism/comments/1gv291o/how_do_you_explore_the_feeling_of_guilt/
palestinian,Socialism,Ideological Politics,461300,Manaus welcomes Biden with demonstration against the Palestinian genocide,85,3,No,No,0,https://emdefesadocomunismo.com.br/manaus-recebe-biden-com-manifestacao-contra-o-genocidio-palestino/,/r/socialism/comments/1guulgi/manaus_welcomes_biden_with_demonstration_against/
War,Progressive,Ideological Politics,78114,What's behind defense secretary pick Hegseth's war on 'woke',62,9,No,No,0,https://www.npr.org/2024/11/14/nx-s1-5191941/pete-hegseth-defense-department-dei,/r/progressive/comments/1grv35s/whats_behind_defense_secretary_pick_hegseths_war/
War,Progressive,Ideological Politics,78114,"The Onion wins Alex Jones' Infowars in bankruptcy auction; The satirical news company plans to shutter Jones’ Infowars and rebuild the website featuring well-known internet humor writers and content creators, according to a person with knowledge of the sale.",82,3,No,No,0,https://www.nbcnews.com/news/us-news/onion-wins-alex-jones-infowars-bankruptcy-auction-rcna179936,/r/progressive/comments/1grhsxm/the_onion_wins_alex_jones_infowars_in_bankruptcy/
british,Republicanism,Ideological Politics,917,WANTED: Submissions from around the globe.,6,1,Yes,No,0,https://www.reddit.com/r/republicanism/comments/361f2w/wanted_submissions_from_around_the_globe/,/r/republicanism/comments/361f2w/wanted_submissions_from_around_the_globe/
War,Republicanism,Ideological Politics,917,Why are monarchists cherry-pickers?,7,0,No,No,0,https://www.reddit.com/r/republicanism/comments/1c22ytx/why_are_monarchists_cherrypickers/,/r/republicanism/comments/1c22ytx/why_are_monarchists_cherrypickers/
british,Republicanism,Ideological Politics,917,Pro-British monarchy Indian Christian saying mocking the name-reverting done by our governments (especially the renaming of Bombay to Mumbai) and openly doing sedition by saying that Charles III should be the Emperor of India and 'God Save the King' should be the Indian anthem.,3,0,No,No,0,https://www.reddit.com/gallery/1b2xwq8,/r/republicanism/comments/1b2xwq8/probritish_monarchy_indian_christian_saying/
uk,Republicanism,Ideological Politics,917,Survey about your political worldview (18+; 12-14 mins to complete),3,0,No,No,0,https://www.reddit.com/r/republicanism/comments/1aq418a/survey_about_your_political_worldview_18_1214/,/r/republicanism/comments/1aq418a/survey_about_your_political_worldview_18_1214/
War,Conservatives,Ideological Politics,108288,‘Don’t Cross That Line’: Trump Border Czar Warns Mayors Against Harboring Illegal Immigrants,8,0,No,No,0,https://www.dailywire.com/news/dont-cross-that-line-trump-border-czar-warns-mayors-against-harboring-illegal-immigrants,/r/conservatives/comments/1gvhtak/dont_cross_that_line_trump_border_czar_warns/
gaza,dailywire,Ideological Politics,24270,Israel Eliminates Hamas Leader Yahya Sinwar In Gaza: Reports,140,6,Yes,No,0,https://www.dailywire.com/news/israel-eliminates-hamas-leader-yahya-sinwar-in-gaza-reports?topStoryPosition=1,/r/dailywire/comments/1g5wl85/israel_eliminates_hamas_leader_yahya_sinwar_in/
War,dailywire,Ideological Politics,24270,World War III?!,81,9,No,No,0,https://youtu.be/aJ6hUz_9TqQ?si=5ZlR3TAA75BD4IaI,/r/dailywire/comments/1gv05lb/world_war_iii/
War,dailywire,Ideological Politics,24270,I hope they do levy a challenge.,53,18,No,Yes,0,https://youtu.be/-m5cmNt5x9U?si=e7iPDu3dEWHnhQyB,/r/dailywire/comments/1gs0n9f/i_hope_they_do_levy_a_challenge/
ukraine,Liberal,Ideological Politics,119944,"I'm worried Putin will ""test"" Trump in January.",155,77,No,No,0,https://www.reddit.com/r/Liberal/comments/1gv3wxs/im_worried_putin_will_test_trump_in_january/,/r/Liberal/comments/1gv3wxs/im_worried_putin_will_test_trump_in_january/
british,Liberal,Ideological Politics,119944,Democrats Need Haka,104,40,No,No,0,https://www.reddit.com/r/Liberal/comments/1guy3sr/democrats_need_haka/,/r/Liberal/comments/1guy3sr/democrats_need_haka/
War,Liberal,Ideological Politics,119944,Social Darwinist Oligarchs are a bigger threat than Christian Nationalists right now,67,26,No,No,0,https://www.reddit.com/r/Liberal/comments/1guzzlj/social_darwinist_oligarchs_are_a_bigger_threat/,/r/Liberal/comments/1guzzlj/social_darwinist_oligarchs_are_a_bigger_threat/
War,Liberal,Ideological Politics,119944,Trump vote count drops below majority,589,90,No,No,0,https://www.cookpolitical.com/vote-tracker/2024/electoral-college,/r/Liberal/comments/1gu85x0/trump_vote_count_drops_below_majority/
