Keyword,Subreddit,Category,Members,Title,Upvotes,Comments,Moderator Interaction,Fact-Checking Mention,Total Awards,URL,Original Post URL
europe,Wikileaks,General Politics,177639,"Finally Free, Assange Receives a Measure of Justice From the Council of Europe",42,1,No,No,0,https://truthout.org/articles/finally-free-assange-receives-a-measure-of-justice-from-the-council-of-europe/,/r/WikiLeaks/comments/1fxlpkt/finally_free_assange_receives_a_measure_of/
War,Wikileaks,General Politics,177639,Parliamentary Assembly recognises Julian Assange as a ‘political prisoner’ and warns against the chilling effect of his harsh treatment,43,0,No,No,0,https://www.coe.int/en/web/portal/-/pace-recognises-julian-assange-as-a-political-prisoner-and-warns-against-the-chilling-effect-of-his-harsh-treatment,/r/WikiLeaks/comments/1fx0tn0/parliamentary_assembly_recognises_julian_assange/
europe,Wikileaks,General Politics,177639,Julian Assange attends hearing on his detention and conviction at the Council of Europe,19,1,No,No,0,https://www.youtube.com/watch?v=hzHktIKyt-w,/r/WikiLeaks/comments/1fu7cca/julian_assange_attends_hearing_on_his_detention/
europe,Wikileaks,General Politics,177639,Julian to speak at a parliamentary hearing in Strasbourg on the chilling effect on human rights his treatment has had.,23,0,No,No,0,https://www.reddit.com/r/WikiLeaks/comments/1ftadxc/julian_to_speak_at_a_parliamentary_hearing_in/,/r/WikiLeaks/comments/1ftadxc/julian_to_speak_at_a_parliamentary_hearing_in/
israel,Wikileaks,General Politics,177639,The Hezbollah leader killed by Israel professed to want peace,0,20,No,No,0,https://youtu.be/3M1fHfKenTM?si=5By4wuDaS7IRM2hb&t=185s,/r/WikiLeaks/comments/1fryvhy/the_hezbollah_leader_killed_by_israel_professed/
ukraine,News,General Politics,28947764,"In a first, Biden allows Ukraine to strike Russia with U.S. long-range weapons",6427,731,No,No,0,https://www.npr.org/2024/11/17/nx-s1-5194432/biden-long-range-missiles-russia-ukraine-war,/r/news/comments/1gtpsz3/in_a_first_biden_allows_ukraine_to_strike_russia/
ukraine,News,General Politics,28947764,Russia launches massive nationwide missile attack targeting Ukraine's energy grid,1867,72,No,No,0,https://abcnews.go.com/International/russia-launches-massive-nationwide-missile-attack-targeting-ukraines/story?id=115940701,/r/news/comments/1gtb40h/russia_launches_massive_nationwide_missile_attack/
War,News,General Politics,28947764,"
Elon Musk's X Corp. files notice in Alex Jones' Infowars bankruptcy case",21379,2220,No,No,0,https://www.nbcnews.com/business/business-news/elon-musk-x-corp-alex-jones-infowars-rcna180487,/r/news/comments/1gsybtl/elon_musks_x_corp_files_notice_in_alex_jones/
ukraine,PoliticalDiscussion,General Politics,2184588,Will kidnapped ukrainian children ever be brought back home?,29,58,No,No,0,https://www.reddit.com/r/PoliticalDiscussion/comments/1gtqoi5/will_kidnapped_ukrainian_children_ever_be_brought/,/r/PoliticalDiscussion/comments/1gtqoi5/will_kidnapped_ukrainian_children_ever_be_brought/
War,PoliticalDiscussion,General Politics,2184588,Would Biden have won the Presidency?,48,383,No,No,0,https://www.reddit.com/r/PoliticalDiscussion/comments/1gteztp/would_biden_have_won_the_presidency/,/r/PoliticalDiscussion/comments/1gteztp/would_biden_have_won_the_presidency/
War,PoliticalDiscussion,General Politics,2184588,How Much of America’s Polarization Is Engineered by Foreign Influence?,227,133,No,Yes,0,https://www.reddit.com/r/PoliticalDiscussion/comments/1gt1v4x/how_much_of_americas_polarization_is_engineered/,/r/PoliticalDiscussion/comments/1gt1v4x/how_much_of_americas_polarization_is_engineered/
War,PoliticalDiscussion,General Politics,2184588,"Is the fear and pearl clutching about the second Trump administration warranted, or are those fears overblown? ",347,1037,No,No,0,https://www.reddit.com/r/PoliticalDiscussion/comments/1gstbge/is_the_fear_and_pearl_clutching_about_the_second/,/r/PoliticalDiscussion/comments/1gstbge/is_the_fear_and_pearl_clutching_about_the_second/
War,PoliticalDiscussion,General Politics,2184588,Do you think that nuking of Hiroshima and Nagasaki was a war crime?,0,104,No,No,0,https://www.reddit.com/r/PoliticalDiscussion/comments/1gtq2t8/do_you_think_that_nuking_of_hiroshima_and/,/r/PoliticalDiscussion/comments/1gtq2t8/do_you_think_that_nuking_of_hiroshima_and/
War,PoliticalDiscussion,General Politics,2184588,What is the likely outcome of the 2026 US Senate elections?,85,204,No,No,0,https://www.reddit.com/r/PoliticalDiscussion/comments/1gs628t/what_is_the_likely_outcome_of_the_2026_us_senate/,/r/PoliticalDiscussion/comments/1gs628t/what_is_the_likely_outcome_of_the_2026_us_senate/
War,NeutralPolitics,General Politics,610731,What to expect after the U.S. election,282,26,Yes,Yes,0,https://www.reddit.com/r/NeutralPolitics/comments/1gflxpk/what_to_expect_after_the_us_election/,/r/NeutralPolitics/comments/1gflxpk/what_to_expect_after_the_us_election/
War,NeutralPolitics,General Politics,610731,"Realistically, what things can RFK Jr. do right away with his HHS appointment?",135,122,No,Yes,0,https://www.reddit.com/r/NeutralPolitics/comments/1gs44iq/realistically_what_things_can_rfk_jr_do_right/,/r/NeutralPolitics/comments/1gs44iq/realistically_what_things_can_rfk_jr_do_right/
War,NeutralPolitics,General Politics,610731,Tracking what bills/decisions are coming to contact reps/senators in a timely manner,37,12,No,No,0,https://www.reddit.com/r/NeutralPolitics/comments/1gqkpdp/tracking_what_billsdecisions_are_coming_to/,/r/NeutralPolitics/comments/1gqkpdp/tracking_what_billsdecisions_are_coming_to/
War,NeutralPolitics,General Politics,610731,Is now the time for a NEW moderate third party in U.S. politics?,0,80,No,No,0,https://www.reddit.com/r/NeutralPolitics/comments/1gms9so/is_now_the_time_for_a_new_moderate_third_party_in/,/r/NeutralPolitics/comments/1gms9so/is_now_the_time_for_a_new_moderate_third_party_in/
War,NeutralPolitics,General Politics,610731,Where is the Western world’s paradigm shift coming from?,119,128,No,Yes,0,https://www.reddit.com/r/NeutralPolitics/comments/1glkk8q/where_is_the_western_worlds_paradigm_shift_coming/,/r/NeutralPolitics/comments/1glkk8q/where_is_the_western_worlds_paradigm_shift_coming/
War,NeutralPolitics,General Politics,610731,Why Are So Many Men Leaving The Democratic Party Over The Last Few Years?,385,156,No,No,0,https://www.reddit.com/r/NeutralPolitics/comments/1gklb9t/why_are_so_many_men_leaving_the_democratic_party/,/r/NeutralPolitics/comments/1gklb9t/why_are_so_many_men_leaving_the_democratic_party/
War,NeutralPolitics,General Politics,610731,How do the Trump and Harris plans for workforce pay and taxes compare?,6,6,No,No,0,https://www.reddit.com/r/NeutralPolitics/comments/1ggxh8w/how_do_the_trump_and_harris_plans_for_workforce/,/r/NeutralPolitics/comments/1ggxh8w/how_do_the_trump_and_harris_plans_for_workforce/
ukraine,moderatepolitics,General Politics,296661,"Biden approves Ukraine’s use of long-range U.S. weapons inside Russia, reversing policy",278,224,No,No,0,https://www.washingtonpost.com/national-security/2024/11/17/ukraine-russia-north-korea-atacms/,/r/moderatepolitics/comments/1gtkw36/biden_approves_ukraines_use_of_longrange_us/
israel,moderatepolitics,General Politics,296661,Democrats in Congress urge Biden to sanction Israelis over West Bank violence,71,164,No,No,0,https://www.reuters.com/world/us/democrats-congress-urge-biden-sanction-israelis-over-west-bank-violence-2024-11-14/,/r/moderatepolitics/comments/1gsvqjf/democrats_in_congress_urge_biden_to_sanction/
europe,technology,General Politics,17415318,"European SpaceX rival raises $160 million for reusable capsule to carry astronauts, cargo to space",475,15,No,No,0,https://www.cnbc.com/2024/11/17/the-exploration-company-european-spacex-rival-raises-160-million-for-reusable-sapce-capsule.html,/r/technology/comments/1gtsw7s/european_spacex_rival_raises_160_million_for/
china,technology,General Politics,17415318,"US, China, agree machines must not control nuclear weapons",399,38,No,No,0,https://www.theregister.com/2024/11/17/asia_tech_news_roundup/,/r/technology/comments/1gtqu6k/us_china_agree_machines_must_not_control_nuclear/
china,technology,General Politics,17415318,China’s ‘mind-blowingly’ cheap shopping app Temu hits roadblocks in south-east Asia,47,17,No,No,0,https://www.theguardian.com/technology/2024/nov/18/temu-shopping-app-china-indonesia-vietnam-takedown?CMP=Share_AndroidApp_Other,/r/technology/comments/1gtyblp/chinas_mindblowingly_cheap_shopping_app_temu_hits/
ukraine,democrats,Ideological Politics,480947,Biden Allows Critical Aid to Ukraine Ahead of Incoming Trump Administration,1847,187,No,No,0,https://i.redd.it/1bwja099ii1e1.jpeg,/r/democrats/comments/1gtl9e0/biden_allows_critical_aid_to_ukraine_ahead_of/
ukraine,Republican,Ideological Politics,205787,Biden Allows Ukraine to Strike Russia With Long-Range U.S. Missiles,224,120,No,No,0,https://www.nytimes.com/2024/11/17/us/politics/biden-ukraine-russia-atacms-missiles.html,/r/Republican/comments/1gtmuiy/biden_allows_ukraine_to_strike_russia_with/
War,Republican,Ideological Politics,205787,"The New York Times: Trump’s Cabinet Picks, Panned in Washington, Thrill Many of His Voters",43,1,No,No,0,https://www.nytimes.com/2024/11/16/us/trump-cabinet-picks-voter-reactions.html,/r/Republican/comments/1gt8jsw/the_new_york_times_trumps_cabinet_picks_panned_in/
War,Conservative,Ideological Politics,1148539,Illinois Gov. JB Pritzker Vows to Boost Sex Changes to Thwart Trump Agenda,336,84,No,No,0,https://www.breitbart.com/health/2024/11/17/illinois-gov-jb-pritzker-vows-boost-sex-changes-thwart-trump-agenda/,/r/Conservative/comments/1gtsso7/illinois_gov_jb_pritzker_vows_to_boost_sex/
ukraine,Conservative,Ideological Politics,1148539,Biden authorizes Ukraine to use US long-range missiles to strike inside Russia: report ,742,300,No,No,0,https://www.reddit.com/r/Conservative/comments/1gtkkbh/biden_authorizes_ukraine_to_use_us_longrange/,/r/Conservative/comments/1gtkkbh/biden_authorizes_ukraine_to_use_us_longrange/
russia,Libertarian,Ideological Politics,503659,What are your thoughts on Tulsi Gabbard possibly becoming Director of National Intelligence if she doesn’t get blocked by the Senate?,143,81,No,No,0,https://www.reddit.com/r/Libertarian/comments/1gto80x/what_are_your_thoughts_on_tulsi_gabbard_possibly/,/r/Libertarian/comments/1gto80x/what_are_your_thoughts_on_tulsi_gabbard_possibly/
gaza,Anarchism,Ideological Politics,271266,"Ethnic cleansing in north Gaza worsens: Israel expels 100,000 Palestinians in 24 hours",250,24,No,No,0,https://thecradle.co/articles/ethnic-cleansing-in-north-gaza-worsens-israel-expels-100000-palestinians-in-24-hours,/r/Anarchism/comments/1gt2wyk/ethnic_cleansing_in_north_gaza_worsens_israel/
uk,Anarchism,Ideological Politics,271266,Durruti: Shadow of the People #3's Cover Leak!,2,1,No,No,0,https://www.reddit.com/r/Anarchism/comments/1gttzz4/durruti_shadow_of_the_people_3s_cover_leak/,/r/Anarchism/comments/1gttzz4/durruti_shadow_of_the_people_3s_cover_leak/
War,Anarchism,Ideological Politics,271266,"Towards a Revolutionary Union Movement, Part 10: Antifascist",3,0,No,No,0,https://www.angryeducationworkers.com/towards-a-revolutionary-union-movement-part-9-antifascist/,/r/Anarchism/comments/1gtby9i/towards_a_revolutionary_union_movement_part_10/
israel,Socialism,Ideological Politics,461148,“Does Israel have the right to exist?” - Francesca Albanese (UN Special Rapporteur on the Occupied Palestinian Territories) deconstructs this bad faith question,1088,36,No,No,0,https://v.redd.it/ix0y7a5bth1e1,/r/socialism/comments/1gti17t/does_israel_have_the_right_to_exist_francesca/
putin,Socialism,Ideological Politics,461148,Can anyone Identify this Anti-Putin Russian communist group in Germany?,200,47,No,No,0,https://i.redd.it/bnr35tfscj1e1.jpeg,/r/socialism/comments/1gtp5ta/can_anyone_identify_this_antiputin_russian/
ukraine,Socialism,Ideological Politics,461148,The most confusing thing I saw today: German anarchists calling for more weapons for Ukraine.,519,273,No,No,0,https://i.redd.it/r9wbjrl9ph1e1.png,/r/socialism/comments/1gthibw/the_most_confusing_thing_i_saw_today_german/
israel,Socialism,Ideological Politics,461148,"In Southern Arizona, since 2014, Israeli weapons giant Elbit Systems has installed a network of 53 surveillance towers up to 160 feet tall, employing a 7.5-mile camera range and 13-mile radius of ground-sweeping radar. ",28,2,No,No,0,https://i.redd.it/apqv6rbr6k1e1.jpeg,/r/socialism/comments/1gtspai/in_southern_arizona_since_2014_israeli_weapons/
ukraine,Socialism,Ideological Politics,461148,"Thessaloniki, Greece: NATO flag burned by protestors in anti-imperialist demonstration against the involvement of Greece in the Middle East and Ukraine",55,2,No,No,0,https://www.youtube.com/watch?v=h1BRuM9JY_M,/r/socialism/comments/1gtmlzc/thessaloniki_greece_nato_flag_burned_by/
War,Socialism,Ideological Politics,461148,"🚘 PSL’s 2nd Liberation Rides to Prison Program 🚘‼️ This holiday season, help reunite Texas families separated by the racist mass incarceration system. ",25,1,No,No,0,https://www.reddit.com/gallery/1gtphuh,/r/socialism/comments/1gtphuh/psls_2nd_liberation_rides_to_prison_program_this/
War,Progressive,Ideological Politics,78098,What's behind defense secretary pick Hegseth's war on 'woke',58,9,No,No,0,https://www.npr.org/2024/11/14/nx-s1-5191941/pete-hegseth-defense-department-dei,/r/progressive/comments/1grv35s/whats_behind_defense_secretary_pick_hegseths_war/
War,Progressive,Ideological Politics,78098,"The Onion wins Alex Jones' Infowars in bankruptcy auction; The satirical news company plans to shutter Jones’ Infowars and rebuild the website featuring well-known internet humor writers and content creators, according to a person with knowledge of the sale.",76,3,No,No,0,https://www.nbcnews.com/news/us-news/onion-wins-alex-jones-infowars-bankruptcy-auction-rcna179936,/r/progressive/comments/1grhsxm/the_onion_wins_alex_jones_infowars_in_bankruptcy/
british,Republicanism,Ideological Politics,917,WANTED: Submissions from around the globe.,6,1,Yes,No,0,https://www.reddit.com/r/republicanism/comments/361f2w/wanted_submissions_from_around_the_globe/,/r/republicanism/comments/361f2w/wanted_submissions_from_around_the_globe/
War,Republicanism,Ideological Politics,917,Why are monarchists cherry-pickers?,6,0,No,No,0,https://www.reddit.com/r/republicanism/comments/1c22ytx/why_are_monarchists_cherrypickers/,/r/republicanism/comments/1c22ytx/why_are_monarchists_cherrypickers/
british,Republicanism,Ideological Politics,917,Pro-British monarchy Indian Christian saying mocking the name-reverting done by our governments (especially the renaming of Bombay to Mumbai) and openly doing sedition by saying that Charles III should be the Emperor of India and 'God Save the King' should be the Indian anthem.,3,0,No,No,0,https://www.reddit.com/gallery/1b2xwq8,/r/republicanism/comments/1b2xwq8/probritish_monarchy_indian_christian_saying/
uk,Republicanism,Ideological Politics,917,Survey about your political worldview (18+; 12-14 mins to complete),3,0,No,No,0,https://www.reddit.com/r/republicanism/comments/1aq418a/survey_about_your_political_worldview_18_1214/,/r/republicanism/comments/1aq418a/survey_about_your_political_worldview_18_1214/
russia,Conservatives,Ideological Politics,108280,Adam Schiff insists his Russian collusion claim 'wasn't an overstatement',81,10,No,No,0,https://www.foxnews.com/media/adam-schiff-insists-his-russia-collusion-claim-wasnt-overstatement,/r/conservatives/comments/1gtuuub/adam_schiff_insists_his_russian_collusion_claim/
putin,Conservatives,Ideological Politics,108280,"
Alex Jones @RealAlexJones - BREAKING: Vladimir Putin Says Russia Now 'At War' With NATO After Biden Confirms Long Range Missile Restrictions Have Been Lifted. 

Watch LIVE WWIII Alert",22,14,No,No,0,https://x.com/RealAlexJones/status/1858281785257345176,/r/conservatives/comments/1gtufjj/alex_jones_realalexjones_breaking_vladimir_putin/
ukraine,Conservatives,Ideological Politics,108280,Biden Allows Ukraine to Strike Russia With Long-Range U.S. Missiles,44,17,No,No,0,https://www.nytimes.com/2024/11/17/us/politics/biden-ukraine-russia-atacms-missiles.html,/r/conservatives/comments/1gtmv65/biden_allows_ukraine_to_strike_russia_with/
gaza,dailywire,Ideological Politics,24264,Israel Eliminates Hamas Leader Yahya Sinwar In Gaza: Reports,137,6,Yes,No,0,https://www.dailywire.com/news/israel-eliminates-hamas-leader-yahya-sinwar-in-gaza-reports?topStoryPosition=1,/r/dailywire/comments/1g5wl85/israel_eliminates_hamas_leader_yahya_sinwar_in/
War,dailywire,Ideological Politics,24264,I hope they do levy a challenge.,50,18,No,Yes,0,https://youtu.be/-m5cmNt5x9U?si=e7iPDu3dEWHnhQyB,/r/dailywire/comments/1gs0n9f/i_hope_they_do_levy_a_challenge/
War,Liberal,Ideological Politics,119943,I'm disturbed by the silence.,91,70,No,No,0,https://www.reddit.com/r/Liberal/comments/1gtuiun/im_disturbed_by_the_silence/,/r/Liberal/comments/1gtuiun/im_disturbed_by_the_silence/
putin,Liberal,Ideological Politics,119943,Gabbard's sympathetic views toward Russia cause alarm as Trump's pick to lead intelligence services,59,7,No,No,0,https://apnews.com/article/gabbard-trump-putin-intelligence-russia-syria-a798adaf9cd531a5d0c9329f7597f0f6,/r/Liberal/comments/1gteen5/gabbards_sympathetic_views_toward_russia_cause/
War,Liberal,Ideological Politics,119943,"Yes, There is a Difference between Liberal and Conservative Brains (It's the Amygdala)",44,20,No,Yes,0,https://www.reddit.com/r/Liberal/comments/1gssfap/yes_there_is_a_difference_between_liberal_and/,/r/Liberal/comments/1gssfap/yes_there_is_a_difference_between_liberal_and/
War,Liberal,Ideological Politics,119943,Elon Musk's Experiment in Chaos,51,38,No,No,0,https://www.reddit.com/r/Liberal/comments/1gsoomx/elon_musks_experiment_in_chaos/,/r/Liberal/comments/1gsoomx/elon_musks_experiment_in_chaos/
israel,KamalaHarris,Ideological Politics,74933,Trump pro-Israel picks mock anti-Harris pro-Palestinian protest vote,527,56,No,No,0,https://forward.com/opinion/674533/trump-rubio-huckabee-stefanik-israel,/r/KamalaHarris/comments/1gsrmxw/trump_proisrael_picks_mock_antiharris/
israel,KamalaHarris,Ideological Politics,74933,Muslims who voted for Trump upset by his pro-Israel cabinet picks,1407,378,No,No,0,https://www.reuters.com/world/us/muslims-who-voted-trump-upset-by-his-pro-israel-cabinet-picks-2024-11-15/,/r/KamalaHarris/comments/1gsbxyc/muslims_who_voted_for_trump_upset_by_his/
