Keyword,Subreddit,Category,Members,Title,Upvotes,Comments,Moderator Interaction,Fact-Checking Mention,Total Awards,URL,Original Post URL
results,Wikileaks,General Politics,177611,Censored Wikileaks content?,14,7,No,No,0,https://www.reddit.com/r/WikiLeaks/comments/1frr2wq/censored_wikileaks_content/,/r/WikiLeaks/comments/1frr2wq/censored_wikileaks_content/
trump,News,General Politics,28967295,Trump hush money sentencing delayed indefinitely,14184,2513,No,No,0,https://www.cnbc.com/2024/11/22/trump-hush-money-sentencing-delayed-indefinitely.html,/r/news/comments/1gxb51a/trump_hush_money_sentencing_delayed_indefinitely/
trump,PoliticalDiscussion,General Politics,2184536,What is next for Matt Gaetz? ,531,477,No,No,0,https://www.reddit.com/r/PoliticalDiscussion/comments/1gwlvng/what_is_next_for_matt_gaetz/,/r/PoliticalDiscussion/comments/1gwlvng/what_is_next_for_matt_gaetz/
electoral,PoliticalDiscussion,General Politics,2184536,Would a Nationwide Ballot Initiative System Be a Good Idea for the U.S.?,49,85,No,No,0,https://www.reddit.com/r/PoliticalDiscussion/comments/1gwtuzb/would_a_nationwide_ballot_initiative_system_be_a/,/r/PoliticalDiscussion/comments/1gwtuzb/would_a_nationwide_ballot_initiative_system_be_a/
trump,PoliticalDiscussion,General Politics,2184536,"ICC issued arrest warrants against Netanyahu, Gallant and a former Hamas leader, Marsi [said to have been killed by Israel] World leaders' response is mixed. Are there one or more countries that will actually dare to enforce the warrant if they show up in one of these countries?",155,332,No,No,0,https://www.reddit.com/r/PoliticalDiscussion/comments/1gwk1ew/icc_issued_arrest_warrants_against_netanyahu/,/r/PoliticalDiscussion/comments/1gwk1ew/icc_issued_arrest_warrants_against_netanyahu/
biden,PoliticalDiscussion,General Politics,2184536,What would it take for participatory politics to survive in the Age of Trump?,24,46,No,No,0,https://www.reddit.com/r/PoliticalDiscussion/comments/1gwqe2x/what_would_it_take_for_participatory_politics_to/,/r/PoliticalDiscussion/comments/1gwqe2x/what_would_it_take_for_participatory_politics_to/
outcome,PoliticalDiscussion,General Politics,2184536,How will the fallout be if Donald Trump and Elon Musk clash during the presidency?,157,213,No,No,0,https://www.reddit.com/r/PoliticalDiscussion/comments/1gvz3hx/how_will_the_fallout_be_if_donald_trump_and_elon/,/r/PoliticalDiscussion/comments/1gvz3hx/how_will_the_fallout_be_if_donald_trump_and_elon/
electoral,PoliticalDiscussion,General Politics,2184536,To what degree do you think the system of recall should be used?,55,52,No,No,0,https://www.reddit.com/r/PoliticalDiscussion/comments/1gvp5ay/to_what_degree_do_you_think_the_system_of_recall/,/r/PoliticalDiscussion/comments/1gvp5ay/to_what_degree_do_you_think_the_system_of_recall/
biden,PoliticalDiscussion,General Politics,2184536,Can RFK Jr. be a voice for Democrats in the Trump administration?,0,41,No,No,0,https://www.reddit.com/r/PoliticalDiscussion/comments/1gwsqc7/can_rfk_jr_be_a_voice_for_democrats_in_the_trump/,/r/PoliticalDiscussion/comments/1gwsqc7/can_rfk_jr_be_a_voice_for_democrats_in_the_trump/
trump,PoliticalDiscussion,General Politics,2184536,"Almost 8 years later, did Trumps travel ban effectively end Islamic terror in the US?",0,26,No,No,0,https://www.reddit.com/r/PoliticalDiscussion/comments/1gwp00e/almost_8_years_later_did_trumps_travel_ban/,/r/PoliticalDiscussion/comments/1gwp00e/almost_8_years_later_did_trumps_travel_ban/
loss,PoliticalDiscussion,General Politics,2184536,What can democrats do to be more effective in today’s media environment?,259,987,No,No,0,https://www.reddit.com/r/PoliticalDiscussion/comments/1gv340b/what_can_democrats_do_to_be_more_effective_in/,/r/PoliticalDiscussion/comments/1gv340b/what_can_democrats_do_to_be_more_effective_in/
biden,PoliticalDiscussion,General Politics,2184536,Were Obama and Biden just extraordinary candidates?  (For their time at least),0,128,No,No,0,https://www.reddit.com/r/PoliticalDiscussion/comments/1gvwhem/were_obama_and_biden_just_extraordinary/,/r/PoliticalDiscussion/comments/1gvwhem/were_obama_and_biden_just_extraordinary/
loss,PoliticalDiscussion,General Politics,2184536,How does a campaign to expand rights differ from a campaign to prevent rights from backsliding?,11,36,No,Yes,0,https://www.reddit.com/r/PoliticalDiscussion/comments/1gv4yrs/how_does_a_campaign_to_expand_rights_differ_from/,/r/PoliticalDiscussion/comments/1gv4yrs/how_does_a_campaign_to_expand_rights_differ_from/
trump,NeutralPolitics,General Politics,610815,Is NATO still a credible deterrent? What are the arguments for and against?,27,68,No,No,0,https://www.reddit.com/r/NeutralPolitics/comments/1guw3ls/is_nato_still_a_credible_deterrent_what_are_the/,/r/NeutralPolitics/comments/1guw3ls/is_nato_still_a_credible_deterrent_what_are_the/
house,NeutralPolitics,General Politics,610815,Tracking what bills/decisions are coming to contact reps/senators in a timely manner,40,12,No,No,0,https://www.reddit.com/r/NeutralPolitics/comments/1gqkpdp/tracking_what_billsdecisions_are_coming_to/,/r/NeutralPolitics/comments/1gqkpdp/tracking_what_billsdecisions_are_coming_to/
loss,NeutralPolitics,General Politics,610815,Do any countries have laws to combat politically-driven misinformation?,36,42,No,Yes,0,https://www.reddit.com/r/NeutralPolitics/comments/1gq4agt/do_any_countries_have_laws_to_combat/,/r/NeutralPolitics/comments/1gq4agt/do_any_countries_have_laws_to_combat/
results,NeutralPolitics,General Politics,610815,Trump won the presidency and popular vote running on the mass deportation of illegal aliens. Who saw this coming and what lessons can be learned?,226,326,No,No,0,https://www.reddit.com/r/NeutralPolitics/comments/1gnk7ih/trump_won_the_presidency_and_popular_vote_running/,/r/NeutralPolitics/comments/1gnk7ih/trump_won_the_presidency_and_popular_vote_running/
results,NeutralPolitics,General Politics,610815,Is now the time for a NEW moderate third party in U.S. politics?,4,83,No,No,0,https://www.reddit.com/r/NeutralPolitics/comments/1gms9so/is_now_the_time_for_a_new_moderate_third_party_in/,/r/NeutralPolitics/comments/1gms9so/is_now_the_time_for_a_new_moderate_third_party_in/
harris,NeutralPolitics,General Politics,610815,Why Are So Many Men Leaving The Democratic Party Over The Last Few Years?,384,156,No,No,0,https://www.reddit.com/r/NeutralPolitics/comments/1gklb9t/why_are_so_many_men_leaving_the_democratic_party/,/r/NeutralPolitics/comments/1gklb9t/why_are_so_many_men_leaving_the_democratic_party/
trump,NeutralPolitics,General Politics,610815,What plans about trump and kamala have on section 8 housing and dept of edu.,0,11,No,No,0,https://www.reddit.com/r/NeutralPolitics/comments/1gk1emp/what_plans_about_trump_and_kamala_have_on_section/,/r/NeutralPolitics/comments/1gk1emp/what_plans_about_trump_and_kamala_have_on_section/
outcome,NeutralPolitics,General Politics,610815,"What are the pros and cons of predictive election models, like 538, for our discourse around elections?",41,94,No,No,0,https://www.reddit.com/r/NeutralPolitics/comments/1giqib5/what_are_the_pros_and_cons_of_predictive_election/,/r/NeutralPolitics/comments/1giqib5/what_are_the_pros_and_cons_of_predictive_election/
trump,moderatepolitics,General Politics,297144,"‘Like Tiananmen Square’: Denver Mayor Vows City Police, Population Will Forcibly Resist Trump Deportation Measures",145,335,No,No,0,https://www.msn.com/en-us/news/opinion/like-tiananmen-square-denver-mayor-vows-city-police-population-will-forcibly-resist-trump-deportation-measures/ar-AA1uwyEu?apiversion=v2&noservercache=1&domshim=1&renderwebcomponents=1&wcseo=1&batchservertelemetry=1&noservertelemetry=1,/r/moderatepolitics/comments/1gxbukv/like_tiananmen_square_denver_mayor_vows_city/
biden,moderatepolitics,General Politics,297144,Biden admin quietly loosening immigration policies before Trump takes office — including letting migrants skip ICE check-ins in NYC,375,476,No,No,0,https://nypost.com/2024/11/21/us-news/biden-admin-to-let-illegal-migrants-skip-nyc-ice-appointments/,/r/moderatepolitics/comments/1gx12jx/biden_admin_quietly_loosening_immigration/
trump,moderatepolitics,General Politics,297144,Trump chooses loyalist Pam Bondi for attorney general pick after Matt Gaetz withdraws,138,145,No,No,0,https://apnews.com/article/gaetz-trump-fbi-justice-department-248b46ba0c882dd46d661568e8bd3bd7,/r/moderatepolitics/comments/1gwy0ju/trump_chooses_loyalist_pam_bondi_for_attorney/
trump,moderatepolitics,General Politics,297144,Trump cabinet pick Gaetz withdraws from attorney general nomination,463,230,No,No,0,https://www.bbc.com/news/live/cm20pye11j3t,/r/moderatepolitics/comments/1gwmg5c/trump_cabinet_pick_gaetz_withdraws_from_attorney/
trump,moderatepolitics,General Politics,297144,Los Angeles Passes ‘Sanctuary City’ Ordinance In Wake Of Trump’s Deportation Plan,175,458,No,No,0,https://dailycaller.com/2024/11/19/los-angeles-sanctuary-city-ordinance-trumps-deportation-plan/,/r/moderatepolitics/comments/1gwsclq/los_angeles_passes_sanctuary_city_ordinance_in/
trump,moderatepolitics,General Politics,297144,Trump Defense Secretary Pick Pete Hegseth Breaks Silence on Alleged Sex Assault,169,213,No,No,0,https://m10news.com/trump-defense-secretary-pick-pete-hegseth-breaks-silence-on-alleged-sex-assault/,/r/moderatepolitics/comments/1gwmnmf/trump_defense_secretary_pick_pete_hegseth_breaks/
senate,democrats,Ideological Politics,481233,"Senate leader Schumer will ‘continue to push’ for marijuana banking bill passage this year, despite ‘Republican opposition,’ staffer says",139,14,No,No,0,https://www.marijuanamoment.net/senate-leader-schumer-will-continue-to-push-for-marijuana-banking-bill-passage-this-year-despite-republican-opposition-staffer-says/,/r/democrats/comments/1gx9xww/senate_leader_schumer_will_continue_to_push_for/
trump,democrats,Ideological Politics,481233,Matt Gaetz withdraws as Trump's AG nominee,3877,482,No,No,0,https://www.axios.com/2024/11/21/matt-gaetz-ag-trump-withdraws,/r/democrats/comments/1gwle6c/matt_gaetz_withdraws_as_trumps_ag_nominee/
trump,democrats,Ideological Politics,481233,‘Not surprised’: Byron Donalds reacts to snub from Trump’s nearly-all white administration,1337,157,No,No,0,https://www.rawstory.com/byron-donalds-not-surprised-at-snub-from-trumps-nearly-all-white-administration/,/r/democrats/comments/1gwtdqn/not_surprised_byron_donalds_reacts_to_snub_from/
trump,democrats,Ideological Politics,481233,"Even As Billionaire Wealth Surges After Trump’s Election, New GOP Leader Aims To Give Them $2.7 Trillion Tax Break - Americans For Tax Fairness",31,0,No,No,0,https://americansfortaxfairness.org/even-billionaire-wealth-surges-trumps-election-new-gop-leader-aims-give-2-7-trillion-tax-break/,/r/democrats/comments/1gxea1g/even_as_billionaire_wealth_surges_after_trumps/
trump,democrats,Ideological Politics,481233,2016 trump supporting trans rights,38,23,No,No,0,https://v.redd.it/kwewhuhpch2e1,/r/democrats/comments/1gxbw0q/2016_trump_supporting_trans_rights/
biden,democrats,Ideological Politics,481233,"As Republican Senators excuse the incompetence, immorality and dangerous ideas of Trump's nominees, everyone should remember that Joe Biden's OMB nominee had to withdraw her nomination because she... sent mean tweets.",537,20,No,No,0,https://www.cnn.com/2021/02/22/politics/neera-tanden-biden-omb-twitter/index.html,/r/democrats/comments/1gwwykh/as_republican_senators_excuse_the_incompetence/
trump,Republican,Ideological Politics,206041,"Trump Scores Major Win in Business Records Case, Judge Grants Request to File Motion to Dismiss",29,6,No,No,0,https://www.breitbart.com/2024-election/2024/11/22/judge-grants-request-to-file-motion-to-dismiss-in-trumps-new-york-case/,/r/Republican/comments/1gxesc7/trump_scores_major_win_in_business_records_case/
trump,Republican,Ideological Politics,206041,California Can't Afford Newsom's '$100 Million' Trump Resistance Lawsuits | He Better Start Cleaning The Crap Off The Sidewalks 😁👍,141,12,No,No,0,https://freebeacon.com/california/california-cant-afford-newsoms-trump-resistance-plans-budget-watchdog-warns/,/r/Republican/comments/1gx1n2k/california_cant_afford_newsoms_100_million_trump/
trump,Republican,Ideological Politics,206041,Trump Names Pam Bondi as Attorney General: A New Chapter Amid Gaetz’s Withdrawal,193,75,No,No,0,https://talkshubhusa.com/politics/trump-names-pam-bondi-as-attorney-general-a-new-chapter-amid-gaetzs-withdrawal/,/r/Republican/comments/1gwu5hr/trump_names_pam_bondi_as_attorney_general_a_new/
trump,Republican,Ideological Politics,206041,Ellen has fled the country after Trump's election | America Is Getting Greater Already 👍,669,67,No,No,0,https://notthebee.com/article/ellen-has-fled-the-country-after-trumps-election,/r/Republican/comments/1gwjgdv/ellen_has_fled_the_country_after_trumps_election/
recount,Republican,Ideological Politics,206041,What Will Kamala Harris Do With Recount Money? Does Biden Get 10 Percent? Does Anyone Really Care? | So Many Questions 😁,74,37,No,No,0,https://www.dailysignal.com/2024/11/21/harris-raises-money-for-recount-as-deadlines-pass-to-seek-one/,/r/Republican/comments/1gwx85l/what_will_kamala_harris_do_with_recount_money/
trump,Republican,Ideological Politics,206041,Trump AG pick Matt Gaetz says he's withdrawing,190,147,No,No,0,https://www.cnbc.com/2024/11/21/trump-ag-pick-matt-gaetz-says-hes-withdrawing.html,/r/Republican/comments/1gwlctr/trump_ag_pick_matt_gaetz_says_hes_withdrawing/
house,Conservative,Ideological Politics,1150545,House Democrat erupts during DEI hearing: 'There has been no oppression for the white man',479,117,No,No,0,https://thenationaldesk.com/news/americas-news-now/house-democrat-erupts-during-dei-hearing-there-has-been-no-oppression-for-the-white-man-jasmine-crockett-texas-dismantle-dei-act-oversight-committee-racism-slavery-,/r/Conservative/comments/1gxbb5x/house_democrat_erupts_during_dei_hearing_there/
trump,Conservative,Ideological Politics,1150545,Denver Mayor Warns Trump Of ‘Tiananmen Square Moment’ If He Rounds Up Illegal Immigrants,286,93,No,No,0,https://www.dailywire.com/news/denver-mayor-warns-trump-of-tiananmen-square-moment-if-he-rounds-up-illegal-immigrants,/r/Conservative/comments/1gx86py/denver_mayor_warns_trump_of_tiananmen_square/
trump,Conservative,Ideological Politics,1150545,"Judge indefinitely postpones Trump New York sentencing
",186,26,No,No,0,https://www.washingtonexaminer.com/news/justice/3238866/judge-indefinitely-postpones-trump-new-york-sentencing/,/r/Conservative/comments/1gxb6jn/judge_indefinitely_postpones_trump_new_york/
trump,Conservative,Ideological Politics,1150545,MSNBC Contributor Panics Over Trump Nominating Bondi For AG: ‘Dangerous’ Because She’s ‘Competent’,134,12,No,No,0,https://www.dailywire.com/news/msnbc-contributor-panics-over-trump-nominating-bondi-for-ag-dangerous-because-shes-competent,/r/Conservative/comments/1gxaj68/msnbc_contributor_panics_over_trump_nominating/
biden,Conservative,Ideological Politics,1150545,Biden awards highest civilian honor to 'merchant of death' who oversaw nearly 4 million abortions,268,47,No,No,0,https://www.theblaze.com/news/biden-awards-merchant-of-death-who-helped-exterminate-nearly-4-million-human-beings,/r/Conservative/comments/1gx5x64/biden_awards_highest_civilian_honor_to_merchant/
president,Libertarian,Ideological Politics,503598,Lex Friedman interviews Javier Milei: President of Argentina,111,15,Yes,No,0,https://youtu.be/8NLzc9kobDk?si=Clw18RIyD4X04IHP,/r/Libertarian/comments/1gv927s/lex_friedman_interviews_javier_milei_president_of/
biden,Libertarian,Ideological Politics,503598,“Biden should be impeached for this.” —Glenn Greenwald.,130,147,No,No,0,https://v.redd.it/w42j3my17d2e1,/r/Libertarian/comments/1gwxeqn/biden_should_be_impeached_for_this_glenn_greenwald/
senate,Libertarian,Ideological Politics,503598,US Congressional Leadership Remains United in Devotion to Israel After Selection of New Senate Republican Leader,3,0,No,No,0,https://original.antiwar.com/adam_dick/2024/11/19/us-congressional-leadership-remains-united-in-devotion-to-israel-after-selection-of-new-senate-republican-leader/,/r/Libertarian/comments/1gxb2uu/us_congressional_leadership_remains_united_in/
house,Anarchism,Ideological Politics,271412,"Drunken self portrait, Port Blair (Andaman Islands), Lighthouse bar, 10 PM. Two beers down.",25,7,No,No,0,https://i.redd.it/esa58a7a3b2e1.jpeg,/r/Anarchism/comments/1gwyv66/drunken_self_portrait_port_blair_andaman_islands/
outcome,Anarchism,Ideological Politics,271412,"If your work-from-home job is returning to office, they WANT you to quit because it has better optics for the company than layoffs.",131,11,No,No,0,https://www.reddit.com/r/Anarchism/comments/1gwho3l/if_your_workfromhome_job_is_returning_to_office/,/r/Anarchism/comments/1gwho3l/if_your_workfromhome_job_is_returning_to_office/
supreme court,Anarchism,Ideological Politics,271412,Rally at the Supreme Court for Trans Rights,18,0,No,No,0,https://www.classy.org/event/2024-registration-page-scotus-rally-12-4/e632578,/r/Anarchism/comments/1gwveh3/rally_at_the_supreme_court_for_trans_rights/
trump,Anarchism,Ideological Politics,271412,A chronology of resistance and direct action under the first Trump administration.,62,1,No,No,0,/r/CrimethInc/comments/1gw666z/a_chronology_of_resistance_and_direct_action/,/r/Anarchism/comments/1gw66g6/a_chronology_of_resistance_and_direct_action/
trump,Socialism,Ideological Politics,461422,"🚨NEW LOCATION! 🚨 The Democrats failed, Trump won— what is to be done?  We had to change locations but we’re still building the movement! Join us for discussion and community building in the aftermath of the presidential election — how can we continue the fight back?",11,1,No,No,0,https://i.redd.it/4k10pr9qzh2e1.jpeg,/r/socialism/comments/1gxez1g/new_location_the_democrats_failed_trump_won_what/
house,Socialism,Ideological Politics,461422,"(Liberal) White House says that it rejects the ICC's warrents against Netanyahu and Gallant, says it was rushed and there's no evidence, and they're working with 'Israel.' How is this different from what Tim Cotton is saying? ",177,16,No,No,0,https://v.redd.it/lbtq2i9n6c2e1,/r/socialism/comments/1gwxbj7/liberal_white_house_says_that_it_rejects_the_iccs/
trump,Progressive,Ideological Politics,78139,Anti-abortion groups have a to-do list for Trump,54,1,No,No,0,https://www.npr.org/2024/11/20/nx-s1-5191851/anti-abortion-activists-trump-second-term-abortion-pills-comstock-rfk,/r/progressive/comments/1gwd7f2/antiabortion_groups_have_a_todo_list_for_trump/
trump,Progressive,Ideological Politics,78139,"Despite Trump’s Win, School Vouchers Were Again Rejected by Majorities of Voters",19,1,No,No,0,https://www.propublica.org/article/school-vouchers-2024-election-trump,/r/progressive/comments/1guls4r/despite_trumps_win_school_vouchers_were_again/
vance,Progressive,Ideological Politics,78139,Brown not ruling out run for remainder of Vance’s Senate term,3,0,No,No,0,https://thehill.com/homenews/campaign/4992997-brown-vance-senate-term-ohio/amp/,/r/progressive/comments/1gtbps2/brown_not_ruling_out_run_for_remainder_of_vances/
trump,Progressive,Ideological Politics,78139,Behind the Curtain: Trump's business bonanza,16,2,No,No,0,https://www.axios.com/2024/11/07/trump-elon-musk-business-tax-cuts,/r/progressive/comments/1gm4w17/behind_the_curtain_trumps_business_bonanza/
victory,Progressive,Ideological Politics,78139,Far-Right Donald Trump Supporters Celebrate His Victory with Violent Memes and Calls for Executions,251,14,No,No,0,https://www.wired.com/story/donald-trump-far-right-supporters-violent-memes/,/r/progressive/comments/1glfnyf/farright_donald_trump_supporters_celebrate_his/
trump,Progressive,Ideological Politics,78139,What Trump's first 100 days in office could look like,23,6,No,No,0,https://www.npr.org/2024/11/06/nx-s1-5181800/2024-election-trump-first-100-days-agenda,/r/progressive/comments/1glo04a/what_trumps_first_100_days_in_office_could_look/
trump,Progressive,Ideological Politics,78139,Americans in Puerto Rico can't vote for US president. Their anger at Trump is shaping the race.,347,33,No,No,0,https://apnews.com/article/puerto-rico-trump-joke-garbage-a91e2aafd93a06d32365efa013581b85,/r/progressive/comments/1gh2ab4/americans_in_puerto_rico_cant_vote_for_us/
results,Republicanism,Ideological Politics,916,Survey about your political worldview (18+; 12-14 mins to complete),3,0,No,No,0,https://www.reddit.com/r/republicanism/comments/1aq418a/survey_about_your_political_worldview_18_1214/,/r/republicanism/comments/1aq418a/survey_about_your_political_worldview_18_1214/
house,Republicanism,Ideological Politics,916,Meet Susanna Gibson: Virginia Democrat in key state House race calls sharing of pornographic videos ‘the worst gutter politics’,2,0,No,No,0,https://www.celebsweek.com/susanna-gibson/,/r/republicanism/comments/16hfi9k/meet_susanna_gibson_virginia_democrat_in_key/
president,Republicanism,Ideological Politics,916,About the Lopez,4,2,No,No,0,https://www.reddit.com/r/republicanism/comments/1094bh5/about_the_lopez/,/r/republicanism/comments/1094bh5/about_the_lopez/
trump,Conservatives,Ideological Politics,108290,Liz Cheney personally heard testimony that Trump offered guard support for Jan 6 and suppressed it. ,265,26,No,No,0,https://cha.house.gov/2024/3/chairman-loudermilk-publishes-never-before-released-anthony-ornato-transcribed-interview,/r/conservatives/comments/1gx95e6/liz_cheney_personally_heard_testimony_that_trump/
trump,Conservatives,Ideological Politics,108290,Elon Musk and Vivek Ramaswamy signal move to defund Planned Parenthood under Trump,101,7,No,No,0,https://www.liveaction.org/news/musk-ramaswamy-defunding-planned-parenthood-trump/,/r/conservatives/comments/1gx6zyy/elon_musk_and_vivek_ramaswamy_signal_move_to/
biden,Conservatives,Ideological Politics,108290,"The Biden administration is doing nothing about these professors who are teaching kids that math promotes ""masculinity"" ""white supremacy""",35,2,No,No,0,https://libertyaffair.com/2024/11/20/professors-claim-honors-math-classes-promote-white-supremacy/,/r/conservatives/comments/1gxc4b2/the_biden_administration_is_doing_nothing_about/
trump,Conservatives,Ideological Politics,108290,GOP Establishment Is The Greatest Threat To Trump’s Agenda,20,3,No,No,0,https://thefederalist.com/2024/11/22/the-gop-establishment-is-a-greater-threat-to-trumps-agenda-than-democrats/,/r/conservatives/comments/1gxd08c/gop_establishment_is_the_greatest_threat_to/
victory,Conservatives,Ideological Politics,108290,15 Times Liberals Became Dangerous and Unhinged After Donald Trump’s Landslide Victory,12,2,No,No,0,https://www.breitbart.com/2024-election/2024/11/21/15-times-liberals-dangerous-unhinged-donald-trumps-landslide-victory/,/r/conservatives/comments/1gxcxcg/15_times_liberals_became_dangerous_and_unhinged/
house,Conservatives,Ideological Politics,108290,House Subcommittee Pokes Grand Canyon-Sized Holes in Defense Department's Claims About Jan. 6,21,1,No,No,0,https://redstate.com/jeffc/2024/11/21/house-subcommittee-pokes-grand-canyon-sized-holes-in-defense-departments-claims-about-jan-6-n2182300,/r/conservatives/comments/1gx7wvp/house_subcommittee_pokes_grand_canyonsized_holes/
trump,Conservatives,Ideological Politics,108290,To Restore Democracy Trump Will Have To Overcome Deep State,8,1,No,No,0,https://thefederalist.com/2024/11/22/to-restore-democracy-trump-will-have-to-overcome-administrative-state-tyranny/,/r/conservatives/comments/1gxd15k/to_restore_democracy_trump_will_have_to_overcome/
trump,Conservatives,Ideological Politics,108290,The Left Copes With Trump's Triumph As A Cultural Icon,5,0,No,No,0,https://thefederalist.com/2024/11/22/the-left-seethes-at-trumps-triumph-as-a-cultural-icon/,/r/conservatives/comments/1gxg1l7/the_left_copes_with_trumps_triumph_as_a_cultural/
trump,dailywire,Ideological Politics,24288,Wall of Hate - Help Document Hatred Against Trump on July13th.com,78,16,Yes,No,0,https://july13th.com/hate/,/r/dailywire/comments/1e3cqx8/wall_of_hate_help_document_hatred_against_trump/
trump,dailywire,Ideological Politics,24288,"Guy runs over Trump signs, gets a little surprise.",43,13,No,No,0,https://youtube.com/shorts/YSet8ukvG7M?si=nI1hlTUBJ-rxnGkl,/r/dailywire/comments/1gx9b5h/guy_runs_over_trump_signs_gets_a_little_surprise/
trump,dailywire,Ideological Politics,24288,"Sebastian Stan blames Trump because he can't find another actor to interview him for Variety's ""Actors on Actors""",73,9,No,No,0,https://deadline.com/2024/11/donald-trump-hollywood-afraid-sebastian-stan-1236182903/#recipient_hashed=aa34af3e6cb6e5e01eb8a64678d0be9a8090cf8b4923d191dd938adceea81629&recipient_salt=3e462f7cf795e1dc5efb088f073ddb1eb748f554379a3a315fc1f6781b51e9de&utm_medium=email&utm_source=exacttarget&utm_campaign=Deadline_BreakingNews&utm_content=567796_11-20-2024&utm_term=1676431,/r/dailywire/comments/1gw3t7g/sebastian_stan_blames_trump_because_he_cant_find/
trump,Liberal,Ideological Politics,120010,"‘Unaffordable and inaccessible’: Trump allegedly wants to cut food stamps, Medicaid funding",265,62,No,No,0,https://www.themarysue.com/unaffordable-and-inaccessible-trump-allegedly-wants-to-cut-food-stamps-medicaid-funding/?utm_source=tms_smartnews_redirect,/r/Liberal/comments/1gx78sc/unaffordable_and_inaccessible_trump_allegedly/
recount,Liberal,Ideological Politics,120010,Interesting article suggests a recount should be done in the swing states due to suspicious ratio of the bullet voting in only a few counties ,179,35,No,No,0,https://www.planetcritical.com/p/cyber-security-experts-warn-election-hacked,/r/Liberal/comments/1gx7yr7/interesting_article_suggests_a_recount_should_be/
trump,Liberal,Ideological Politics,120010,United by Conservative hate,69,35,No,No,0,https://www.reddit.com/r/Liberal/comments/1gxdeh1/united_by_conservative_hate/,/r/Liberal/comments/1gxdeh1/united_by_conservative_hate/
