Keyword,Subreddit,Category,Members,Title,Upvotes,Comments,Moderator Interaction,Fact-Checking Mention,Total Awards,URL,Original Post URL
results,Wikileaks,General Politics,177631,Censored Wikileaks content?,13,7,No,No,0,https://www.reddit.com/r/WikiLeaks/comments/1frr2wq/censored_wikileaks_content/,/r/WikiLeaks/comments/1frr2wq/censored_wikileaks_content/
house,News,General Politics,28950948,"Car fleeing police slams into Culver City house, dragging 300 feet of guardrail",568,43,No,No,0,https://www.latimes.com/california/story/2024-11-17/car-slams-into-culver-city-house-after-high-speed-chase-one-arrest-and-fire-arm-recovered,/r/news/comments/1gu8q11/car_fleeing_police_slams_into_culver_city_house/
harris,PoliticalDiscussion,General Politics,2184527,"For what reason do you believe it is that the public doesn't broadly acknowledge that immigrants are statistically less likely to commit crimes than native born Americans, and instead believe that immigrants are more prone to violence?",435,574,No,Yes,0,https://www.reddit.com/r/PoliticalDiscussion/comments/1gu5dba/for_what_reason_do_you_believe_it_is_that_the/,/r/PoliticalDiscussion/comments/1gu5dba/for_what_reason_do_you_believe_it_is_that_the/
biden,PoliticalDiscussion,General Politics,2184527,Will Biden be able to fill the last remaining judicial nominations? ,128,53,No,No,0,https://www.reddit.com/r/PoliticalDiscussion/comments/1gtxjwv/will_biden_be_able_to_fill_the_last_remaining/,/r/PoliticalDiscussion/comments/1gtxjwv/will_biden_be_able_to_fill_the_last_remaining/
results,PoliticalDiscussion,General Politics,2184527,"Ecuador has a presidential republic, but also has an interesting mechanism of Simultaneous Death. What do you think are the benefits and adverse effects of such a thing?",37,13,No,No,0,https://www.reddit.com/r/PoliticalDiscussion/comments/1gu2y8x/ecuador_has_a_presidential_republic_but_also_has/,/r/PoliticalDiscussion/comments/1gu2y8x/ecuador_has_a_presidential_republic_but_also_has/
results,PoliticalDiscussion,General Politics,2184527,"The Pennsylvania Senate race is extremely close and heading for a recount.  What's exactly going on there?  Finally, what is the use for provisional ballots in the first place?",11,9,No,No,0,https://www.reddit.com/r/PoliticalDiscussion/comments/1gu73uj/the_pennsylvania_senate_race_is_extremely_close/,/r/PoliticalDiscussion/comments/1gu73uj/the_pennsylvania_senate_race_is_extremely_close/
trump,PoliticalDiscussion,General Politics,2184527,Will kidnapped ukrainian children ever be brought back home?,39,83,No,No,0,https://www.reddit.com/r/PoliticalDiscussion/comments/1gtqoi5/will_kidnapped_ukrainian_children_ever_be_brought/,/r/PoliticalDiscussion/comments/1gtqoi5/will_kidnapped_ukrainian_children_ever_be_brought/
senate,PoliticalDiscussion,General Politics,2184527,Should more Independents run for senate in solid red states?,50,29,No,No,0,https://www.reddit.com/r/PoliticalDiscussion/comments/1gtkt5i/should_more_independents_run_for_senate_in_solid/,/r/PoliticalDiscussion/comments/1gtkt5i/should_more_independents_run_for_senate_in_solid/
biden,PoliticalDiscussion,General Politics,2184527,Would Biden have won the Presidency?,67,492,No,No,0,https://www.reddit.com/r/PoliticalDiscussion/comments/1gteztp/would_biden_have_won_the_presidency/,/r/PoliticalDiscussion/comments/1gteztp/would_biden_have_won_the_presidency/
biden,PoliticalDiscussion,General Politics,2184527,What are the chances of WW3 and Nuclear Warfare since US allowed missile strikes in Russia?,0,25,No,No,0,https://www.reddit.com/r/PoliticalDiscussion/comments/1gueb8c/what_are_the_chances_of_ww3_and_nuclear_warfare/,/r/PoliticalDiscussion/comments/1gueb8c/what_are_the_chances_of_ww3_and_nuclear_warfare/
biden,PoliticalDiscussion,General Politics,2184527,"Is the fear and pearl clutching about the second Trump administration warranted, or are those fears overblown? ",355,1088,No,No,0,https://www.reddit.com/r/PoliticalDiscussion/comments/1gstbge/is_the_fear_and_pearl_clutching_about_the_second/,/r/PoliticalDiscussion/comments/1gstbge/is_the_fear_and_pearl_clutching_about_the_second/
house,PoliticalDiscussion,General Politics,2184527,"Do democrats stand a chance to win back the house and or senate in the midterms in 2026? Currently, republicans have all 3 just like they did in 2016 . ",11,50,No,No,0,https://www.reddit.com/r/PoliticalDiscussion/comments/1gtbji9/do_democrats_stand_a_chance_to_win_back_the_house/,/r/PoliticalDiscussion/comments/1gtbji9/do_democrats_stand_a_chance_to_win_back_the_house/
loss,PoliticalDiscussion,General Politics,2184527,What kind of “energy” would a female politician have to possess to have a shot at the White House?,173,615,No,No,0,https://www.reddit.com/r/PoliticalDiscussion/comments/1gsvz2j/what_kind_of_energy_would_a_female_politician/,/r/PoliticalDiscussion/comments/1gsvz2j/what_kind_of_energy_would_a_female_politician/
results,NeutralPolitics,General Politics,610723,What to expect after the U.S. election,282,26,Yes,Yes,0,https://www.reddit.com/r/NeutralPolitics/comments/1gflxpk/what_to_expect_after_the_us_election/,/r/NeutralPolitics/comments/1gflxpk/what_to_expect_after_the_us_election/
house,NeutralPolitics,General Politics,610723,Tracking what bills/decisions are coming to contact reps/senators in a timely manner,37,12,No,No,0,https://www.reddit.com/r/NeutralPolitics/comments/1gqkpdp/tracking_what_billsdecisions_are_coming_to/,/r/NeutralPolitics/comments/1gqkpdp/tracking_what_billsdecisions_are_coming_to/
loss,NeutralPolitics,General Politics,610723,Do any countries have laws to combat politically-driven misinformation?,35,37,No,Yes,0,https://www.reddit.com/r/NeutralPolitics/comments/1gq4agt/do_any_countries_have_laws_to_combat/,/r/NeutralPolitics/comments/1gq4agt/do_any_countries_have_laws_to_combat/
results,NeutralPolitics,General Politics,610723,Trump won the presidency and popular vote running on the mass deportation of illegal aliens. Who saw this coming and what lessons can be learned?,229,326,No,No,0,https://www.reddit.com/r/NeutralPolitics/comments/1gnk7ih/trump_won_the_presidency_and_popular_vote_running/,/r/NeutralPolitics/comments/1gnk7ih/trump_won_the_presidency_and_popular_vote_running/
results,NeutralPolitics,General Politics,610723,Is now the time for a NEW moderate third party in U.S. politics?,1,83,No,No,0,https://www.reddit.com/r/NeutralPolitics/comments/1gms9so/is_now_the_time_for_a_new_moderate_third_party_in/,/r/NeutralPolitics/comments/1gms9so/is_now_the_time_for_a_new_moderate_third_party_in/
harris,NeutralPolitics,General Politics,610723,Why Are So Many Men Leaving The Democratic Party Over The Last Few Years?,385,156,No,No,0,https://www.reddit.com/r/NeutralPolitics/comments/1gklb9t/why_are_so_many_men_leaving_the_democratic_party/,/r/NeutralPolitics/comments/1gklb9t/why_are_so_many_men_leaving_the_democratic_party/
trump,NeutralPolitics,General Politics,610723,What plans about trump and kamala have on section 8 housing and dept of edu.,1,11,No,No,0,https://www.reddit.com/r/NeutralPolitics/comments/1gk1emp/what_plans_about_trump_and_kamala_have_on_section/,/r/NeutralPolitics/comments/1gk1emp/what_plans_about_trump_and_kamala_have_on_section/
outcome,NeutralPolitics,General Politics,610723,"What are the pros and cons of predictive election models, like 538, for our discourse around elections?",38,94,No,No,0,https://www.reddit.com/r/NeutralPolitics/comments/1giqib5/what_are_the_pros_and_cons_of_predictive_election/,/r/NeutralPolitics/comments/1giqib5/what_are_the_pros_and_cons_of_predictive_election/
harris,NeutralPolitics,General Politics,610723,How do the Trump and Harris plans for workforce pay and taxes compare?,6,6,No,No,0,https://www.reddit.com/r/NeutralPolitics/comments/1ggxh8w/how_do_the_trump_and_harris_plans_for_workforce/,/r/NeutralPolitics/comments/1ggxh8w/how_do_the_trump_and_harris_plans_for_workforce/
trump,moderatepolitics,General Politics,296668,Oklahoma superintendent can't force schools to show Trump prayer video: AG,174,36,No,No,0,https://www.newsweek.com/ryan-walters-donald-trump-prayer-gentner-drummond-1986729,/r/moderatepolitics/comments/1guitrp/oklahoma_superintendent_cant_force_schools_to/
trump,moderatepolitics,General Politics,296668,Trump confirms plans to declare national emergency to implement mass deportation program,544,982,No,No,0,https://www.washingtonexaminer.com/news/3232941/trump-national-emergency-mass-deportation-program/,/r/moderatepolitics/comments/1gu4tjt/trump_confirms_plans_to_declare_national/
senate,moderatepolitics,General Politics,296668,Pennsylvania Supreme Court orders counties not to count disputed ballots in US Senate race,37,30,No,No,0,https://www.cbsnews.com/pittsburgh/news/pennsylvania-supreme-court-ballots-casey-mccormick/,/r/moderatepolitics/comments/1guljhc/pennsylvania_supreme_court_orders_counties_not_to/
trump,moderatepolitics,General Politics,296668,"Musk, top Trump adviser clash over Cabinet picks",128,187,No,No,0,https://www.axios.com/2024/11/18/trump-cabinet-musk-adviser-clash,/r/moderatepolitics/comments/1gu604k/musk_top_trump_adviser_clash_over_cabinet_picks/
results,moderatepolitics,General Politics,296668,How do Democrats rebuild their coalition?,99,437,No,No,0,https://www.cnn.com/election/2024/exit-polls/national-results/general/president/0,/r/moderatepolitics/comments/1gu3t04/how_do_democrats_rebuild_their_coalition/
biden,moderatepolitics,General Politics,296668,"Biden approves Ukraine’s use of long-range U.S. weapons inside Russia, reversing policy",334,298,No,No,0,https://www.washingtonpost.com/national-security/2024/11/17/ukraine-russia-north-korea-atacms/,/r/moderatepolitics/comments/1gtkw36/biden_approves_ukraines_use_of_longrange_us/
harris,moderatepolitics,General Politics,296668,How Kamala Harris Burned Through $1.5 Billion in 15 Weeks,318,363,No,No,0,https://www.nytimes.com/2024/11/17/us/politics/harris-campaign-finances.html?smid=nytcore-ios-share&referringSource=articleShare,/r/moderatepolitics/comments/1gthj97/how_kamala_harris_burned_through_15_billion_in_15/
trump,moderatepolitics,General Politics,296668,Trump sues for billions from media he says is biased against him | Donald Trump,121,82,No,No,0,https://www.theguardian.com/us-news/2024/nov/15/trump-sues-media-outlets-bias,/r/moderatepolitics/comments/1gtkvcd/trump_sues_for_billions_from_media_he_says_is/
trump,moderatepolitics,General Politics,296668,"Opinion - I Hate Trump, but I'm Glad He Won",93,529,No,No,0,https://thehill.com/opinion/campaign/4991749-i-hate-trump-but-im-glad-he-won/,/r/moderatepolitics/comments/1gthvpz/opinion_i_hate_trump_but_im_glad_he_won/
trump,moderatepolitics,General Politics,296668,The Trump administration’s next target: naturalized US citizens ,0,103,No,No,0,https://thehill.com/opinion/immigration/4992787-trump-deportation-plan-immigration/,/r/moderatepolitics/comments/1gudlyn/the_trump_administrations_next_target_naturalized/
trump,technology,General Politics,17418357,"Trump’s FCC chair is Brendan Carr, who wants to regulate everyone except ISPs",7938,433,No,No,0,https://arstechnica.com/tech-policy/2024/11/trumps-fcc-chair-is-brendan-carr-who-wants-to-regulate-everyone-except-isps/,/r/technology/comments/1gubnq3/trumps_fcc_chair_is_brendan_carr_who_wants_to/
biden,technology,General Politics,17418357,Did President Biden Just Save the CHIPS Act From Trump?,1212,129,No,No,0,https://newrepublic.com/post/188574/biden-saves-chips-act-trump-arizona-tsmc-factories-semiconductors,/r/technology/comments/1gujv0j/did_president_biden_just_save_the_chips_act_from/
loss,technology,General Politics,17418357,"Apple TV+ will license its movies to other services to reduce losses, per report ",1156,215,No,No,0,https://9to5mac.com/2024/11/18/apple-tv-will-license-its-movies-to-other-services-to-reduce-losses-per-report/,/r/technology/comments/1gu9cns/apple_tv_will_license_its_movies_to_other/
trump,technology,General Politics,17418357,"Trump Appoints Brendan Carr, Net Neutrality Opponent, as FCC Chairman",21305,1780,No,No,0,https://www.nytimes.com/2024/11/17/technology/fcc-nominee-brendan-carr-trump.html,/r/technology/comments/1gtuhdb/trump_appoints_brendan_carr_net_neutrality/
vance,technology,General Politics,17418357,"1,900 times Earth’s gravity: China activates world’s most advanced hypergravity facility",839,245,No,No,0,https://interestingengineering.com/innovation/china-worlds-most-advanced-hypergravity-facility,/r/technology/comments/1gu96ox/1900_times_earths_gravity_china_activates_worlds/
trump,technology,General Politics,17418357,Trump Team Is Seeking to Ease US Rules for Self-Driving Cars,2188,499,No,No,0,https://www.bloomberg.com/news/articles/2024-11-17/trump-team-said-to-want-to-ease-us-rules-for-self-driving-cars,/r/technology/comments/1gtzr3o/trump_team_is_seeking_to_ease_us_rules_for/
trump,democrats,Ideological Politics,480968,Trump confirms he will declare national emergency to carry out mass deportations,3117,706,No,No,0,https://www.axios.com/2024/11/18/trump-mass-deportations-military-national-emergency,/r/democrats/comments/1gu5hjp/trump_confirms_he_will_declare_national_emergency/
trump,democrats,Ideological Politics,480968,Trump has no mandate for anything,1239,145,No,No,0,https://i.redd.it/v5z5v8fiip1e1.png,/r/democrats/comments/1guccjn/trump_has_no_mandate_for_anything/
electoral,democrats,Ideological Politics,480968,Trump vote count drops below majority,902,203,No,No,0,https://i.redd.it/fwbvmqa4zo1e1.jpeg,/r/democrats/comments/1gu9mp8/trump_vote_count_drops_below_majority/
trump,democrats,Ideological Politics,480968,MAGA anger over Mitch McConnell's alleged Trump recess comment,853,75,No,No,0,https://www.newsweek.com/maga-anger-mitch-mcconnell-alleged-trump-recess-1987327,/r/democrats/comments/1gu6oyn/maga_anger_over_mitch_mcconnells_alleged_trump/
trump,democrats,Ideological Politics,480968,Oklahoma’s top educator requires schools to play video of him praying for Trump ,185,63,No,No,0,https://www.cnn.com/2024/11/18/politics/video/oklahoma-superintendent-ryan-walters-prayer-video-trump-endorsed-bibles-intv-nr-digvid?cid=ios_app,/r/democrats/comments/1gui2mk/oklahomas_top_educator_requires_schools_to_play/
biden,democrats,Ideological Politics,480968,Blaming Obama and Harris for the price of fries.,194,54,No,No,0,https://i.redd.it/r8p1uqzkvp1e1.jpeg,/r/democrats/comments/1gue4ve/blaming_obama_and_harris_for_the_price_of_fries/
trump,democrats,Ideological Politics,480968,Trump's Joke Picks,129,18,No,No,0,https://i.redd.it/rm2xrw5k9q1e1.png,/r/democrats/comments/1gug0x3/trumps_joke_picks/
trump,democrats,Ideological Politics,480968,(Anti) Thanks Trump Posters,94,10,No,No,0,https://www.reddit.com/gallery/1gufxyb,/r/democrats/comments/1gufxyb/anti_thanks_trump_posters/
victory,Republican,Ideological Politics,205831,Victory: PA Supreme Court Shuts Down Dems' Attempt to Steal Senate Race,274,23,No,No,0,https://townhall.com/tipsheet/mattvespa/2024/11/18/victory-pa-supreme-court-shuts-down-dems-illegal-ballot-counting-scheme-n2647939,/r/Republican/comments/1gufjhm/victory_pa_supreme_court_shuts_down_dems_attempt/
victory,Republican,Ideological Politics,205831,"Jon 'Bones' Jones performs Donald Trump's famous dance, gives title belt to president-elect after TKO victory",92,19,No,No,0,https://www.foxnews.com/sports/jon-bones-jones-performs-donald-trumps-famous-dance-gives-title-belt-president-elect-after-tko-victory,/r/Republican/comments/1guh6id/jon_bones_jones_performs_donald_trumps_famous/
senate,Republican,Ideological Politics,205831,PA Dems Attempting to Steal Senate Election May End Up in Some Serious Legal Trouble,240,31,No,No,0,https://townhall.com/tipsheet/guybenson/2024/11/18/pennsylvania-democrats-may-face-legal-trouble-for-attempting-to-steal-senate-election-n2647894,/r/Republican/comments/1gu8pso/pa_dems_attempting_to_steal_senate_election_may/
trump,Republican,Ideological Politics,205831,"Oh L👀k... As It Turns Out, Childless Cat Ladies Kind of Like Trump ",24,3,No,No,0,https://pjmedia.com/sarah-anderson/2024/11/18/as-it-turns-out-childless-cat-ladies-kind-of-like-trump-n4934391,/r/Republican/comments/1gulof2/oh_lk_as_it_turns_out_childless_cat_ladies_kind/
harris,Republican,Ideological Politics,205831,Horrible Harris Wasted Even More Money on Oprah Than We Originally Heard ,115,36,No,No,0,https://pjmedia.com/matt-margolis/2024/11/18/we-were-wrong-about-kamala-paying-oprah-its-actually-much-worse-n4934397,/r/Republican/comments/1gu8egh/horrible_harris_wasted_even_more_money_on_oprah/
trump,Republican,Ideological Politics,205831,Trump's War on the D.C. Establishment Requires This Exact Cabinet to Fight | Opinion,51,12,No,Yes,0,https://www.newsweek.com/trumps-war-dc-establishment-requires-this-exact-cabinet-fight-opinion-1986309,/r/Republican/comments/1gua2me/trumps_war_on_the_dc_establishment_requires_this/
senate,Republican,Ideological Politics,205831,WaPo Calls Out Hypocritical Democrat Bob Casey for Trying to Overturn PA Senate Race,186,5,No,No,0,https://townhall.com/tipsheet/saraharnold/2024/11/17/the-wapo-throws-democrats-under-the-bus-n2647888,/r/Republican/comments/1gtupgj/wapo_calls_out_hypocritical_democrat_bob_casey/
biden,Republican,Ideological Politics,205831,Biden Allows Ukraine to Strike Russia With Long-Range U.S. Missiles,255,178,No,No,0,https://www.nytimes.com/2024/11/17/us/politics/biden-ukraine-russia-atacms-missiles.html,/r/Republican/comments/1gtmuiy/biden_allows_ukraine_to_strike_russia_with/
supreme court,Conservative,Ideological Politics,1148726,BREAKING: Pennsylvania Supreme Court Orders Blue Counties to Halt Counting of Disqualified Mail-In Ballots - Here Are The Details,888,96,No,No,0,https://www.rightjournalism.com/breaking-pennsylvania-supreme-court-orders-blue-counties-to-halt-counting-of-disqualified-mail-in-ballots-here-are-the-details/,/r/Conservative/comments/1gufl1o/breaking_pennsylvania_supreme_court_orders_blue/
senate,Conservative,Ideological Politics,1148726,Pa. Supreme Court again rules against counting undated mail ballots as U.S. Senate race limbo continues,720,40,No,No,0,https://www.inquirer.com/politics/philadelphia/pennsylvania-supreme-court-undated-mail-ballots-senate-recount-20241118.html,/r/Conservative/comments/1gugq82/pa_supreme_court_again_rules_against_counting/
harris,Conservative,Ideological Politics,1148726,Reports that Kamala Harris paid $1 million for Oprah town hall are false: Turns out she spent $2.5 million.,1372,121,No,Yes,0,https://notthebee.com/article/reports-that-kamala-harris-paid-1-million-for-oprah-appearance-are-false-turns-out-she-spent-25-million-for-it,/r/Conservative/comments/1guaryd/reports_that_kamala_harris_paid_1_million_for/
trump,Conservative,Ideological Politics,1148726,Trump confirms plans to use military to deport migrants after declaring national emergency,993,118,No,No,0,https://nypost.com/2024/11/18/us-news/trump-confirms-plans-to-use-military-force-to-deport-migrants-after-declaring-national-emergency/,/r/Conservative/comments/1guddwr/trump_confirms_plans_to_use_military_to_deport/
harris,Conservative,Ideological Politics,1148726,"To Pay Back $20 Million Campaign Debt, Kamala Harris Agrees To Fight Jake Paul",394,10,No,No,0,https://babylonbee.com/news/to-pay-back-20-million-campaign-debt-kamala-harris-agrees-to-fight-jake-paul,/r/Conservative/comments/1guiarl/to_pay_back_20_million_campaign_debt_kamala/
trump,Conservative,Ideological Politics,1148726,Comer Has Evidence Other FEMA Workers Were Told To Skip Trump Homes: ‘This Is A Pattern’,456,32,No,No,0,https://www.dailywire.com/news/comer-has-evidence-other-fema-workers-were-told-to-skip-trump-homes-this-is-a-pattern,/r/Conservative/comments/1gud562/comer_has_evidence_other_fema_workers_were_told/
trump,Conservative,Ideological Politics,1148726,REPORT: Trump Team Targeting Military Officers Involved in Afghanistan Withdrawal,1189,124,No,No,0,https://redstate.com/jeffc/2024/11/17/report-trump-team-targeting-military-officers-involved-in-afghanistan-withdrawal-for-court-martial-n2182105,/r/Conservative/comments/1gu4uwe/report_trump_team_targeting_military_officers/
harris,Conservative,Ideological Politics,1148726,BUSTED: The Inside Story Of How The Kamala Harris Campaign Manipulates Reddit (And Breaks The Rules) To Control The Platform,814,66,No,No,0,https://thefederalist.com/2024/10/29/busted-the-inside-story-of-how-the-kamala-harris-campaign-manipulates-reddit-and-breaks-the-rules-to-control-the-platform/,/r/Conservative/comments/1gu6hug/busted_the_inside_story_of_how_the_kamala_harris/
trump,Conservative,Ideological Politics,1148726,Trump admin prepared to declare national emergency and use military assets to carry out mass deportations,1869,575,No,No,0,https://truthsocial.com/@realDonaldTrump/113503150672865350,/r/Conservative/comments/1gu1t17/trump_admin_prepared_to_declare_national/
electoral,Conservative,Ideological Politics,1148726,Nancy Pelosi is finished -- no one deserves more blame for Dems $1B electoral collapse,614,55,No,No,0,https://nypost.com/2024/11/17/opinion/nancy-pelosi-is-finished-no-one-deserves-more-blame-for-dems-1b-electoral-collapse/,/r/Conservative/comments/1gu8d7e/nancy_pelosi_is_finished_no_one_deserves_more/
trump,Libertarian,Ideological Politics,503639,Silk Road Founder Trusts Trump To 'Honor His Pledge' For Commutation,58,8,No,No,0,https://i.redd.it/1komfpqump1e1.jpeg,/r/Libertarian/comments/1gucy40/silk_road_founder_trusts_trump_to_honor_his/
trump,Anarchism,Ideological Politics,271285,"If we let Donald Trump and Stephen Miller expand the infrastructure of state violence, involving the military and building ""vast holding facilities,"" they will not stop at deporting undocumented immigrants.",149,10,No,No,0,/r/CrimethInc/comments/1gudw7r/if_we_let_donald_trump_and_stephen_miller_expand/,/r/Anarchism/comments/1gudwk4/if_we_let_donald_trump_and_stephen_miller_expand/
trump,Socialism,Ideological Politics,461175,"Trump and the far-right want to take us back to the days prior to environmental regulations and maximize the profits of oil and gas corporations while climate change destroys the planet. That’s why he’s appointed Doug Burgum, Lee Zeldin, and Chris Wright to lead his war on the environment ➡️",57,3,No,No,0,https://www.reddit.com/gallery/1guh90p,/r/socialism/comments/1guh90p/trump_and_the_farright_want_to_take_us_back_to/
trump,Socialism,Ideological Politics,461175,Democrats in Congress are about to give Trump dictatorial powers to crush his opposition. Here’s what you need to know,18,1,No,No,0,https://v.redd.it/azhg8tkrir1e1,/r/socialism/comments/1gulq41/democrats_in_congress_are_about_to_give_trump/
house,Socialism,Ideological Politics,461175,"THE PEOPLE OF THE WORLD STAND WITH PALESTINE! This November 29, we call on people all over the world to join us in demonstrating unwavering support for the Palestinian people in the struggle against US-Israeli genocide and occupation.",23,2,No,No,0,https://i.redd.it/r8gcafq9xq1e1.jpeg,/r/socialism/comments/1guj4w0/the_people_of_the_world_stand_with_palestine_this/
trump,Socialism,Ideological Politics,461175,The Civil Rights Law Shutting Down Pro-Palestine Speech: Pro-Israel groups have remade Title VI into a tool of repression—and a second Trump term will supercharge their crusade.,32,0,No,No,0,https://jewishcurrents.org/civil-rights-law-pro-palestine-speech-israel-trump,/r/socialism/comments/1gua9dn/the_civil_rights_law_shutting_down_propalestine/
trump,Progressive,Ideological Politics,78103,Behind the Curtain: Trump's business bonanza,12,2,No,No,0,https://www.axios.com/2024/11/07/trump-elon-musk-business-tax-cuts,/r/progressive/comments/1gm4w17/behind_the_curtain_trumps_business_bonanza/
victory,Progressive,Ideological Politics,78103,Far-Right Donald Trump Supporters Celebrate His Victory with Violent Memes and Calls for Executions,252,14,No,No,0,https://www.wired.com/story/donald-trump-far-right-supporters-violent-memes/,/r/progressive/comments/1glfnyf/farright_donald_trump_supporters_celebrate_his/
trump,Progressive,Ideological Politics,78103,What Trump's first 100 days in office could look like,26,6,No,No,0,https://www.npr.org/2024/11/06/nx-s1-5181800/2024-election-trump-first-100-days-agenda,/r/progressive/comments/1glo04a/what_trumps_first_100_days_in_office_could_look/
trump,Progressive,Ideological Politics,78103,Americans in Puerto Rico can't vote for US president. Their anger at Trump is shaping the race.,343,33,No,No,0,https://apnews.com/article/puerto-rico-trump-joke-garbage-a91e2aafd93a06d32365efa013581b85,/r/progressive/comments/1gh2ab4/americans_in_puerto_rico_cant_vote_for_us/
results,Republicanism,Ideological Politics,917,Survey about your political worldview (18+; 12-14 mins to complete),3,0,No,No,0,https://www.reddit.com/r/republicanism/comments/1aq418a/survey_about_your_political_worldview_18_1214/,/r/republicanism/comments/1aq418a/survey_about_your_political_worldview_18_1214/
house,Republicanism,Ideological Politics,917,Meet Susanna Gibson: Virginia Democrat in key state House race calls sharing of pornographic videos ‘the worst gutter politics’,2,0,No,No,0,https://www.celebsweek.com/susanna-gibson/,/r/republicanism/comments/16hfi9k/meet_susanna_gibson_virginia_democrat_in_key/
president,Republicanism,Ideological Politics,917,About the Lopez,4,2,No,No,0,https://www.reddit.com/r/republicanism/comments/1094bh5/about_the_lopez/,/r/republicanism/comments/1094bh5/about_the_lopez/
trump,Conservatives,Ideological Politics,108283,"Brendan Carr, Trump's choice for FCC chairman says agency 'will end its promotion of DEI' next year.",78,2,No,No,0,https://www.foxnews.com/politics/trumps-choice-fcc-chairman-agency-will-end-its-promotion-dei-next-year,/r/conservatives/comments/1gueepj/brendan_carr_trumps_choice_for_fcc_chairman_says/
