Keyword,Subreddit,Category,Members,Title,Upvotes,Comments,Moderator Interaction,Fact-Checking Mention,Total Awards,URL,Original Post URL
results,Wikileaks,General Politics,177628,Censored Wikileaks content?,14,7,No,No,0,https://www.reddit.com/r/WikiLeaks/comments/1frr2wq/censored_wikileaks_content/,/r/WikiLeaks/comments/1frr2wq/censored_wikileaks_content/
loss,PoliticalDiscussion,General Politics,2184528,What can democrats do to be more effective in today’s media environment?,13,30,No,No,0,https://www.reddit.com/r/PoliticalDiscussion/comments/1gv340b/what_can_democrats_do_to_be_more_effective_in/,/r/PoliticalDiscussion/comments/1gv340b/what_can_democrats_do_to_be_more_effective_in/
harris,PoliticalDiscussion,General Politics,2184528,"For what reason do you believe it is that the public doesn't broadly acknowledge that immigrants are statistically less likely to commit crimes than native born Americans, and instead believe that immigrants are more prone to violence?",497,666,No,Yes,0,https://www.reddit.com/r/PoliticalDiscussion/comments/1gu5dba/for_what_reason_do_you_believe_it_is_that_the/,/r/PoliticalDiscussion/comments/1gu5dba/for_what_reason_do_you_believe_it_is_that_the/
results,PoliticalDiscussion,General Politics,2184528,"The Pennsylvania Senate race is extremely close and heading for a recount.  What's exactly going on there?  Finally, what is the use for provisional ballots in the first place?",184,82,No,No,0,https://www.reddit.com/r/PoliticalDiscussion/comments/1gu73uj/the_pennsylvania_senate_race_is_extremely_close/,/r/PoliticalDiscussion/comments/1gu73uj/the_pennsylvania_senate_race_is_extremely_close/
supreme court,PoliticalDiscussion,General Politics,2184528,"Would you want courts to normally be issuing rulings unanimously or closely so, or do you want to see a court more typically having multiple blocs?",1,11,No,No,0,https://www.reddit.com/r/PoliticalDiscussion/comments/1guzf9s/would_you_want_courts_to_normally_be_issuing/,/r/PoliticalDiscussion/comments/1guzf9s/would_you_want_courts_to_normally_be_issuing/
biden,PoliticalDiscussion,General Politics,2184528,Will Biden be able to fill the last remaining judicial nominations? ,162,72,No,No,0,https://www.reddit.com/r/PoliticalDiscussion/comments/1gtxjwv/will_biden_be_able_to_fill_the_last_remaining/,/r/PoliticalDiscussion/comments/1gtxjwv/will_biden_be_able_to_fill_the_last_remaining/
results,PoliticalDiscussion,General Politics,2184528,"Ecuador has a presidential republic, but also has an interesting mechanism of Simultaneous Death. What do you think are the benefits and adverse effects of such a thing?",44,14,No,No,0,https://www.reddit.com/r/PoliticalDiscussion/comments/1gu2y8x/ecuador_has_a_presidential_republic_but_also_has/,/r/PoliticalDiscussion/comments/1gu2y8x/ecuador_has_a_presidential_republic_but_also_has/
trump,PoliticalDiscussion,General Politics,2184528,Will kidnapped ukrainian children ever be brought back home?,40,90,No,No,0,https://www.reddit.com/r/PoliticalDiscussion/comments/1gtqoi5/will_kidnapped_ukrainian_children_ever_be_brought/,/r/PoliticalDiscussion/comments/1gtqoi5/will_kidnapped_ukrainian_children_ever_be_brought/
senate,PoliticalDiscussion,General Politics,2184528,Should more Independents run for senate in solid red states?,58,30,No,No,0,https://www.reddit.com/r/PoliticalDiscussion/comments/1gtkt5i/should_more_independents_run_for_senate_in_solid/,/r/PoliticalDiscussion/comments/1gtkt5i/should_more_independents_run_for_senate_in_solid/
biden,PoliticalDiscussion,General Politics,2184528,Would Biden have won the Presidency?,72,530,No,No,0,https://www.reddit.com/r/PoliticalDiscussion/comments/1gteztp/would_biden_have_won_the_presidency/,/r/PoliticalDiscussion/comments/1gteztp/would_biden_have_won_the_presidency/
house,PoliticalDiscussion,General Politics,2184528,"Do democrats stand a chance to win back the house and or senate in the midterms in 2026? Currently, republicans have all 3 just like they did in 2016 . ",24,81,No,No,0,https://www.reddit.com/r/PoliticalDiscussion/comments/1gtbji9/do_democrats_stand_a_chance_to_win_back_the_house/,/r/PoliticalDiscussion/comments/1gtbji9/do_democrats_stand_a_chance_to_win_back_the_house/
biden,PoliticalDiscussion,General Politics,2184528,"Is the fear and pearl clutching about the second Trump administration warranted, or are those fears overblown? ",367,1115,No,No,0,https://www.reddit.com/r/PoliticalDiscussion/comments/1gstbge/is_the_fear_and_pearl_clutching_about_the_second/,/r/PoliticalDiscussion/comments/1gstbge/is_the_fear_and_pearl_clutching_about_the_second/
results,NeutralPolitics,General Politics,610746,What to expect after the U.S. election,286,26,Yes,Yes,0,https://www.reddit.com/r/NeutralPolitics/comments/1gflxpk/what_to_expect_after_the_us_election/,/r/NeutralPolitics/comments/1gflxpk/what_to_expect_after_the_us_election/
trump,NeutralPolitics,General Politics,610746,Is NATO still a credible deterrent? What are the arguments for and against?,0,29,No,No,0,https://www.reddit.com/r/NeutralPolitics/comments/1guw3ls/is_nato_still_a_credible_deterrent_what_are_the/,/r/NeutralPolitics/comments/1guw3ls/is_nato_still_a_credible_deterrent_what_are_the/
house,NeutralPolitics,General Politics,610746,Tracking what bills/decisions are coming to contact reps/senators in a timely manner,38,12,No,No,0,https://www.reddit.com/r/NeutralPolitics/comments/1gqkpdp/tracking_what_billsdecisions_are_coming_to/,/r/NeutralPolitics/comments/1gqkpdp/tracking_what_billsdecisions_are_coming_to/
loss,NeutralPolitics,General Politics,610746,Do any countries have laws to combat politically-driven misinformation?,35,39,No,Yes,0,https://www.reddit.com/r/NeutralPolitics/comments/1gq4agt/do_any_countries_have_laws_to_combat/,/r/NeutralPolitics/comments/1gq4agt/do_any_countries_have_laws_to_combat/
results,NeutralPolitics,General Politics,610746,Trump won the presidency and popular vote running on the mass deportation of illegal aliens. Who saw this coming and what lessons can be learned?,223,326,No,No,0,https://www.reddit.com/r/NeutralPolitics/comments/1gnk7ih/trump_won_the_presidency_and_popular_vote_running/,/r/NeutralPolitics/comments/1gnk7ih/trump_won_the_presidency_and_popular_vote_running/
results,NeutralPolitics,General Politics,610746,Is now the time for a NEW moderate third party in U.S. politics?,0,83,No,No,0,https://www.reddit.com/r/NeutralPolitics/comments/1gms9so/is_now_the_time_for_a_new_moderate_third_party_in/,/r/NeutralPolitics/comments/1gms9so/is_now_the_time_for_a_new_moderate_third_party_in/
harris,NeutralPolitics,General Politics,610746,Why Are So Many Men Leaving The Democratic Party Over The Last Few Years?,388,156,No,No,0,https://www.reddit.com/r/NeutralPolitics/comments/1gklb9t/why_are_so_many_men_leaving_the_democratic_party/,/r/NeutralPolitics/comments/1gklb9t/why_are_so_many_men_leaving_the_democratic_party/
trump,NeutralPolitics,General Politics,610746,What plans about trump and kamala have on section 8 housing and dept of edu.,0,11,No,No,0,https://www.reddit.com/r/NeutralPolitics/comments/1gk1emp/what_plans_about_trump_and_kamala_have_on_section/,/r/NeutralPolitics/comments/1gk1emp/what_plans_about_trump_and_kamala_have_on_section/
outcome,NeutralPolitics,General Politics,610746,"What are the pros and cons of predictive election models, like 538, for our discourse around elections?",41,94,No,No,0,https://www.reddit.com/r/NeutralPolitics/comments/1giqib5/what_are_the_pros_and_cons_of_predictive_election/,/r/NeutralPolitics/comments/1giqib5/what_are_the_pros_and_cons_of_predictive_election/
trump,moderatepolitics,General Politics,296706,Will Conservative Judges Abide Trump’s Ending Birthright Citizenship?,53,200,No,No,0,https://washingtonmonthly.com/2024/11/19/will-conservative-judges-abide-trumps-ending-birthright-citizenship/,/r/moderatepolitics/comments/1gv0pek/will_conservative_judges_abide_trumps_ending/
trump,moderatepolitics,General Politics,296706,Trump expected to nominate Howard Lutnick for Commerce secretary,43,29,No,No,0,https://www.cnn.com/2024/11/19/politics/howard-lutnick-commerce-secretary/index.html,/r/moderatepolitics/comments/1gv14i2/trump_expected_to_nominate_howard_lutnick_for/
senate,moderatepolitics,General Politics,296706,Case Preview: United States v. Skrmetti,40,55,No,No,0,https://www.reddit.com/r/moderatepolitics/comments/1gv0jsz/case_preview_united_states_v_skrmetti/,/r/moderatepolitics/comments/1gv0jsz/case_preview_united_states_v_skrmetti/
trump,moderatepolitics,General Politics,296706,Key Intelligence Watchdogs Resign in Wake of Trump’s Win,34,65,No,No,0,https://www.pogo.org/investigations/ic-and-cia-ig-investigation,/r/moderatepolitics/comments/1guyzxp/key_intelligence_watchdogs_resign_in_wake_of/
senate,moderatepolitics,General Politics,296706,Pennsylvania Supreme Court orders counties not to count disputed ballots in US Senate race,261,249,No,No,0,https://www.cbsnews.com/pittsburgh/news/pennsylvania-supreme-court-ballots-casey-mccormick/,/r/moderatepolitics/comments/1guljhc/pennsylvania_supreme_court_orders_counties_not_to/
trump,moderatepolitics,General Politics,296706,Oklahoma superintendent can't force schools to show Trump prayer video: AG,303,65,No,No,0,https://www.newsweek.com/ryan-walters-donald-trump-prayer-gentner-drummond-1986729,/r/moderatepolitics/comments/1guitrp/oklahoma_superintendent_cant_force_schools_to/
trump,moderatepolitics,General Politics,296706,Trump confirms plans to declare national emergency to implement mass deportation program,613,1088,No,No,0,https://www.washingtonexaminer.com/news/3232941/trump-national-emergency-mass-deportation-program/,/r/moderatepolitics/comments/1gu4tjt/trump_confirms_plans_to_declare_national/
trump,moderatepolitics,General Politics,296706,"Musk, top Trump adviser clash over Cabinet picks",164,217,No,No,0,https://www.axios.com/2024/11/18/trump-cabinet-musk-adviser-clash,/r/moderatepolitics/comments/1gu604k/musk_top_trump_adviser_clash_over_cabinet_picks/
results,moderatepolitics,General Politics,296706,How do Democrats rebuild their coalition?,123,482,No,No,0,https://www.cnn.com/election/2024/exit-polls/national-results/general/president/0,/r/moderatepolitics/comments/1gu3t04/how_do_democrats_rebuild_their_coalition/
biden,moderatepolitics,General Politics,296706,"Biden approves Ukraine’s use of long-range U.S. weapons inside Russia, reversing policy",335,314,No,No,0,https://www.washingtonpost.com/national-security/2024/11/17/ukraine-russia-north-korea-atacms/,/r/moderatepolitics/comments/1gtkw36/biden_approves_ukraines_use_of_longrange_us/
harris,moderatepolitics,General Politics,296706,How Kamala Harris Burned Through $1.5 Billion in 15 Weeks,344,379,No,No,0,https://www.nytimes.com/2024/11/17/us/politics/harris-campaign-finances.html?smid=nytcore-ios-share&referringSource=articleShare,/r/moderatepolitics/comments/1gthj97/how_kamala_harris_burned_through_15_billion_in_15/
trump,technology,General Politics,17421821,Donald Trump’s pick for energy secretary says ‘there is no climate crisis’ | President-elect Donald Trump tapped a fossil fuel and nuclear energy enthusiast to lead the Department of Energy.,18502,2619,No,No,0,https://www.theverge.com/2024/11/18/24299573/donald-trump-energy-secretary-chris-wright-oil-gas-nuclear-ai,/r/technology/comments/1guuows/donald_trumps_pick_for_energy_secretary_says/
trump,technology,General Politics,17421821,"Trump's pick to run the FCC has told us what he plans: TikTok ban, space broadband, and Section 230 reform",1198,316,No,No,0,https://www.theregister.com/2024/11/19/brendan_carr_fcc/,/r/technology/comments/1guy3ve/trumps_pick_to_run_the_fcc_has_told_us_what_he/
trump,technology,General Politics,17421821,Trump’s pick for FCC chair wants to eliminate the law that protects social media companies from legal consequences for posts on their platforms,2313,318,No,No,0,https://fortune.com/2024/11/19/trump-fcc-pick-repeal-section-230-meta-facebook-instagram-tiktok-x-youtube/,/r/technology/comments/1guu2af/trumps_pick_for_fcc_chair_wants_to_eliminate_the/
trump,technology,General Politics,17421821,"Trump Admin Reportedly Wants to Unleash Driverless Cars on America | The new Trump administration wants to clear the way for autonomous travel, safety standards be damned.",1519,608,No,No,0,https://gizmodo.com/trump-reportedly-wants-to-unleash-driverless-cars-on-america-2000525955,/r/technology/comments/1guvkny/trump_admin_reportedly_wants_to_unleash/
trump,technology,General Politics,17421821,"Almost 40% of Americans Under 30 Get News from Social Media Influencers | The most popular influencers are men, who are increasingly becoming radicalized in the age of Trump.",1140,335,No,No,0,https://gizmodo.com/almost-40-of-americans-under-30-get-news-from-social-media-influencers-2000525911,/r/technology/comments/1guvlny/almost_40_of_americans_under_30_get_news_from/
biden,technology,General Politics,17421821,Did President Biden Just Save the CHIPS Act From Trump?,6397,432,No,No,0,https://newrepublic.com/post/188574/biden-saves-chips-act-trump-arizona-tsmc-factories-semiconductors,/r/technology/comments/1gujv0j/did_president_biden_just_save_the_chips_act_from/
trump,technology,General Politics,17421821,"Trump’s FCC chair is Brendan Carr, who wants to regulate everyone except ISPs",12039,578,No,No,0,https://arstechnica.com/tech-policy/2024/11/trumps-fcc-chair-is-brendan-carr-who-wants-to-regulate-everyone-except-isps/,/r/technology/comments/1gubnq3/trumps_fcc_chair_is_brendan_carr_who_wants_to/
harris,democrats,Ideological Politics,480988,Appreciation post for Vice President Harris and her hard work,1164,145,No,No,0,https://i.redd.it/t1nq2i3npv1e1.jpeg,/r/democrats/comments/1gv0502/appreciation_post_for_vice_president_harris_and/
trump,democrats,Ideological Politics,480988,Didn’t Trump do the same thing? ,141,33,No,No,0,https://i.redd.it/b04ko0yq8w1e1.jpeg,/r/democrats/comments/1gv2rco/didnt_trump_do_the_same_thing/
harris,democrats,Ideological Politics,480988,Trump supporters will come after democrats too,387,186,No,No,0,https://www.nbcnews.com/politics/donald-trump/trump-floats-imprisoning-political-opponents-rcna155543,/r/democrats/comments/1gupuav/trump_supporters_will_come_after_democrats_too/
victory,democrats,Ideological Politics,480988,Judge strikes down Wyoming’s anti-abortion laws in victory for rights advocates,72,2,No,No,0,https://www.theguardian.com/us-news/2024/nov/19/wyoming-anti-abortion-laws-struck-down-pills,/r/democrats/comments/1guxo23/judge_strikes_down_wyomings_antiabortion_laws_in/
trump,democrats,Ideological Politics,480988,Trump has no mandate for anything,1678,182,No,No,0,https://i.redd.it/v5z5v8fiip1e1.png,/r/democrats/comments/1guccjn/trump_has_no_mandate_for_anything/
trump,democrats,Ideological Politics,480988,Trump confirms he will declare national emergency to carry out mass deportations,3686,800,No,No,0,https://www.axios.com/2024/11/18/trump-mass-deportations-military-national-emergency,/r/democrats/comments/1gu5hjp/trump_confirms_he_will_declare_national_emergency/
electoral,democrats,Ideological Politics,480988,Trump vote count drops below majority,1193,283,No,No,0,https://i.redd.it/fwbvmqa4zo1e1.jpeg,/r/democrats/comments/1gu9mp8/trump_vote_count_drops_below_majority/
trump,Republican,Ideological Politics,205859,"Trump transition adviser warned DOJ career attorneys that subverting, undermining, or sabotaging Trump’s incoming agenda will be cause for termination 😁👍",77,9,No,No,0,https://www.breitbart.com/politics/2024/11/19/report-multiple-doj-fbi-officials-weigh-lawyering-up-fear-being-criminally-investigated/,/r/Republican/comments/1gv1eae/trump_transition_adviser_warned_doj_career/
biden,Republican,Ideological Politics,205859,Missiles just struck deep inside Russia. The Kremlin's response was to authorize the use of nukes. | Our Greatest Threat Appears To Be Biden 🤔,74,52,No,No,0,https://notthebee.com/article/american-missiles-just-struck-inside-russia-which-is-now-threatening-nuclear-war,/r/Republican/comments/1gv0pal/missiles_just_struck_deep_inside_russia_the/
trump,Republican,Ideological Politics,205859,That's MY President. Trump is a Godsend to the world.,180,34,No,No,0,https://x.com/RealAlexJones/status/1858569872835240426?t=G3NxgB29MNYyVUpTm3xGAA&s=09,/r/Republican/comments/1guqjbt/thats_my_president_trump_is_a_godsend_to_the_world/
biden,Republican,Ideological Politics,205859,Putin lowers the threshold for using his nuclear arsenal after Biden's arms decision for Ukraine,18,22,No,No,0,https://apnews.com/article/russia-nuclear-doctrine-putin-91f20e0c9b0f9e5eaa3ed97c35789898,/r/Republican/comments/1guzs37/putin_lowers_the_threshold_for_using_his_nuclear/
victory,Republican,Ideological Politics,205859,Victory: PA Supreme Court Shuts Down Dems' Attempt to Steal Senate Race,433,32,No,No,0,https://townhall.com/tipsheet/mattvespa/2024/11/18/victory-pa-supreme-court-shuts-down-dems-illegal-ballot-counting-scheme-n2647939,/r/Republican/comments/1gufjhm/victory_pa_supreme_court_shuts_down_dems_attempt/
trump,Republican,Ideological Politics,205859,"Oh L👀k... As It Turns Out, Childless Cat Ladies Kind of Like Trump ",111,11,No,No,0,https://pjmedia.com/sarah-anderson/2024/11/18/as-it-turns-out-childless-cat-ladies-kind-of-like-trump-n4934391,/r/Republican/comments/1gulof2/oh_lk_as_it_turns_out_childless_cat_ladies_kind/
victory,Republican,Ideological Politics,205859,"Jon 'Bones' Jones performs Donald Trump's famous dance, gives title belt to president-elect after TKO victory",156,27,No,No,0,https://www.foxnews.com/sports/jon-bones-jones-performs-donald-trumps-famous-dance-gives-title-belt-president-elect-after-tko-victory,/r/Republican/comments/1guh6id/jon_bones_jones_performs_donald_trumps_famous/
senate,Republican,Ideological Politics,205859,PA Dems Attempting to Steal Senate Election May End Up in Some Serious Legal Trouble,291,32,No,No,0,https://townhall.com/tipsheet/guybenson/2024/11/18/pennsylvania-democrats-may-face-legal-trouble-for-attempting-to-steal-senate-election-n2647894,/r/Republican/comments/1gu8pso/pa_dems_attempting_to_steal_senate_election_may/
harris,Republican,Ideological Politics,205859,Horrible Harris Wasted Even More Money on Oprah Than We Originally Heard ,138,39,No,No,0,https://pjmedia.com/matt-margolis/2024/11/18/we-were-wrong-about-kamala-paying-oprah-its-actually-much-worse-n4934397,/r/Republican/comments/1gu8egh/horrible_harris_wasted_even_more_money_on_oprah/
trump,Republican,Ideological Politics,205859,Trump's War on the D.C. Establishment Requires This Exact Cabinet to Fight | Opinion,71,15,No,Yes,0,https://www.newsweek.com/trumps-war-dc-establishment-requires-this-exact-cabinet-fight-opinion-1986309,/r/Republican/comments/1gua2me/trumps_war_on_the_dc_establishment_requires_this/
house,Conservative,Ideological Politics,1148845,Transgender women to be banned from Capitol Hill female bathrooms under new House GOP proposal,1131,242,No,No,0,https://www.foxnews.com/politics/transgender-women-banned-from-capitol-hill-female-bathrooms-under-new-house-gop-proposal,/r/Conservative/comments/1guwmgh/transgender_women_to_be_banned_from_capitol_hill/
biden,Conservative,Ideological Politics,1148845,Illegal migrant accused of killing Laken Riley took free Biden admin flight to Georgia — where he ‘hunted her down’,905,54,No,No,0,https://nypost.com/2024/11/18/us-news/laken-riley-suspect-jose-ibarra-may-have-taken-humanitarian-flight-from-nyc-to-georgia-before-murder-ex-roommate/?utm_campaign=iphone_nyp&utm_source=pasteboard_app,/r/Conservative/comments/1guxger/illegal_migrant_accused_of_killing_laken_riley/
supreme court,Conservative,Ideological Politics,1148845,Pennsylvania Dem Gov. Josh Shapiro sides with state supreme court ruling not to count certain mail-in ballots,467,50,No,No,0,https://www.foxnews.com/politics/pennsylvania-dem-gov-josh-shapiro-sides-state-supreme-court-ruling-not-count-certain-mail-in-ballots,/r/Conservative/comments/1guulb7/pennsylvania_dem_gov_josh_shapiro_sides_with/
trump,Conservative,Ideological Politics,1148845,Donald Trump's hush money sentencing is called off,167,29,No,No,0,https://www.dailymail.co.uk/news/article-14101607/donald-trump-hush-money-sentencing-called-off.html,/r/Conservative/comments/1gv06m8/donald_trumps_hush_money_sentencing_is_called_off/
trump,Conservative,Ideological Politics,1148845,"CRINGE CNN: If Trump Deports Illegals, Who Will ‘Pick the Crops’",85,25,No,No,0,https://mrcfreespeechamerica.org/blogs/business/tom-olohan/2024/11/19/cringe-cnn-if-trump-deports-illegals-who-will-pick-crops,/r/Conservative/comments/1gv2p2f/cringe_cnn_if_trump_deports_illegals_who_will/
trump,Conservative,Ideological Politics,1148845,"After confidently predicting Trump was ‘toast,’ Michael Moore lashes out at Americans: ‘Not a good people’",563,89,No,No,0,https://www.foxnews.com/media/after-confidently-predicting-trump-toast-michael-moore-lashes-out-americans-not-good-people,/r/Conservative/comments/1guq34l/after_confidently_predicting_trump_was_toast/
senate,Conservative,Ideological Politics,1148845,Senate Democrats Are About to Cram Through Judicial Nominee Who Let Child Sexual Predators Walk Free,115,13,No,No,0,https://redstate.com/terichristoph/2024/11/18/senate-dems-are-trying-to-cram-through-another-radical-judicial-nominee-n2182151,/r/Conservative/comments/1guxcuw/senate_democrats_are_about_to_cram_through/
trump,Anarchism,Ideological Politics,271302,"If we let Donald Trump and Stephen Miller expand the infrastructure of state violence, involving the military and building ""vast holding facilities,"" they will not stop at deporting undocumented immigrants.",266,16,No,No,0,/r/CrimethInc/comments/1gudw7r/if_we_let_donald_trump_and_stephen_miller_expand/,/r/Anarchism/comments/1gudwk4/if_we_let_donald_trump_and_stephen_miller_expand/
biden,Socialism,Ideological Politics,461269,Manaus welcomes Biden with demonstration against the Palestinian genocide,45,2,No,No,0,https://emdefesadocomunismo.com.br/manaus-recebe-biden-com-manifestacao-contra-o-genocidio-palestino/,/r/socialism/comments/1guulgi/manaus_welcomes_biden_with_demonstration_against/
trump,Socialism,Ideological Politics,461269,Democrats in Congress are about to give Trump dictatorial powers to crush his opposition. Here’s what you need to know,148,4,No,No,0,https://v.redd.it/azhg8tkrir1e1,/r/socialism/comments/1gulq41/democrats_in_congress_are_about_to_give_trump/
trump,Socialism,Ideological Politics,461269,Trumps war on the environment ,6,1,No,No,0,https://www.reddit.com/gallery/1gv2cih,/r/socialism/comments/1gv2cvp/trumps_war_on_the_environment/
fraud,Socialism,Ideological Politics,461269,How do you explore the feeling of guilt? ,5,7,No,No,0,https://www.reddit.com/r/socialism/comments/1gv291o/how_do_you_explore_the_feeling_of_guilt/,/r/socialism/comments/1gv291o/how_do_you_explore_the_feeling_of_guilt/
house,Socialism,Ideological Politics,461269,"THE PEOPLE OF THE WORLD STAND WITH PALESTINE! This November 29, we call on people all over the world to join us in demonstrating unwavering support for the Palestinian people in the struggle against US-Israeli genocide and occupation.",118,2,No,No,0,https://i.redd.it/r8gcafq9xq1e1.jpeg,/r/socialism/comments/1guj4w0/the_people_of_the_world_stand_with_palestine_this/
trump,Socialism,Ideological Politics,461269,"Trump and the far-right want to take us back to the days prior to environmental regulations and maximize the profits of oil and gas corporations while climate change destroys the planet. That’s why he’s appointed Doug Burgum, Lee Zeldin, and Chris Wright to lead his war on the environment ➡️",94,3,No,No,0,https://www.reddit.com/gallery/1guh90p,/r/socialism/comments/1guh90p/trump_and_the_farright_want_to_take_us_back_to/
trump,Progressive,Ideological Politics,78106,Behind the Curtain: Trump's business bonanza,12,2,No,No,0,https://www.axios.com/2024/11/07/trump-elon-musk-business-tax-cuts,/r/progressive/comments/1gm4w17/behind_the_curtain_trumps_business_bonanza/
victory,Progressive,Ideological Politics,78106,Far-Right Donald Trump Supporters Celebrate His Victory with Violent Memes and Calls for Executions,252,14,No,No,0,https://www.wired.com/story/donald-trump-far-right-supporters-violent-memes/,/r/progressive/comments/1glfnyf/farright_donald_trump_supporters_celebrate_his/
trump,Progressive,Ideological Politics,78106,What Trump's first 100 days in office could look like,23,6,No,No,0,https://www.npr.org/2024/11/06/nx-s1-5181800/2024-election-trump-first-100-days-agenda,/r/progressive/comments/1glo04a/what_trumps_first_100_days_in_office_could_look/
trump,Progressive,Ideological Politics,78106,Americans in Puerto Rico can't vote for US president. Their anger at Trump is shaping the race.,352,33,No,No,0,https://apnews.com/article/puerto-rico-trump-joke-garbage-a91e2aafd93a06d32365efa013581b85,/r/progressive/comments/1gh2ab4/americans_in_puerto_rico_cant_vote_for_us/
results,Republicanism,Ideological Politics,917,Survey about your political worldview (18+; 12-14 mins to complete),3,0,No,No,0,https://www.reddit.com/r/republicanism/comments/1aq418a/survey_about_your_political_worldview_18_1214/,/r/republicanism/comments/1aq418a/survey_about_your_political_worldview_18_1214/
house,Republicanism,Ideological Politics,917,Meet Susanna Gibson: Virginia Democrat in key state House race calls sharing of pornographic videos ‘the worst gutter politics’,2,0,No,No,0,https://www.celebsweek.com/susanna-gibson/,/r/republicanism/comments/16hfi9k/meet_susanna_gibson_virginia_democrat_in_key/
president,Republicanism,Ideological Politics,917,About the Lopez,3,2,No,No,0,https://www.reddit.com/r/republicanism/comments/1094bh5/about_the_lopez/,/r/republicanism/comments/1094bh5/about_the_lopez/
