Keyword,Subreddit,Category,Members,Title,Upvotes,Comments,Moderator Interaction,Fact-Checking Mention,Total Awards,URL,Original Post URL
trump,Conservatives,Ideological Politics,108287,Smug CBS '60 Minutes' Host Scott Pelley Smears Trump's Historic Win Because of Course He Does,18,2,No,No,0,https://redstate.com/mike_miller/2024/11/18/smug-cbs-60-minutes-host-scott-pelley-smears-trumps-historic-win-because-of-course-he-does-n2182150,/r/conservatives/comments/1guxbz1/smug_cbs_60_minutes_host_scott_pelley_smears/
biden,Conservatives,Ideological Politics,108287,"Remember: Hamas is still holding US hostages, and the Biden administration is still trying to prevent them from being rescued",11,0,No,No,0,https://x.com/SenTedCruz/status/1858673882405704144,/r/conservatives/comments/1guzugr/remember_hamas_is_still_holding_us_hostages_and/
biden,Conservatives,Ideological Politics,108287,Putin lowers the threshold for using his nuclear arsenal after Biden's arms decision for Ukraine,8,6,No,No,0,https://apnews.com/article/russia-nuclear-doctrine-putin-91f20e0c9b0f9e5eaa3ed97c35789898,/r/conservatives/comments/1guzsgj/putin_lowers_the_threshold_for_using_his_nuclear/
supreme court,Conservatives,Ideological Politics,108287,"Pennsylvania Supreme Court Rules Against Dems Who Defied Law, Won’t Allow Undated Ballots",86,2,No,No,0,https://www.dailywire.com/news/pennsylvania-supreme-court-reiterates-that-undated-ballots-cannot-be-counted-after-dems-defy-order,/r/conservatives/comments/1gum9jp/pennsylvania_supreme_court_rules_against_dems_who/
house,Conservatives,Ideological Politics,108287,House Gaetz Probe Relies On Witnesses DOJ Found Not Credible,10,1,No,No,0,https://thefederalist.com/2024/11/17/house-probe-into-matt-gaetz-relies-on-witnesses-doj-found-lacked-credibility/,/r/conservatives/comments/1gux4uj/house_gaetz_probe_relies_on_witnesses_doj_found/
trump,Conservatives,Ideological Politics,108287,"Brendan Carr, Trump's choice for FCC chairman says agency 'will end its promotion of DEI' next year.",166,3,No,No,0,https://www.foxnews.com/politics/trumps-choice-fcc-chairman-agency-will-end-its-promotion-dei-next-year,/r/conservatives/comments/1gueepj/brendan_carr_trumps_choice_for_fcc_chairman_says/
trump,dailywire,Ideological Politics,24270,Wall of Hate - Help Document Hatred Against Trump on July13th.com,80,16,Yes,No,0,https://july13th.com/hate/,/r/dailywire/comments/1e3cqx8/wall_of_hate_help_document_hatred_against_trump/
results,dailywire,Ideological Politics,24270,I hope they do levy a challenge.,51,18,No,Yes,0,https://youtu.be/-m5cmNt5x9U?si=e7iPDu3dEWHnhQyB,/r/dailywire/comments/1gs0n9f/i_hope_they_do_levy_a_challenge/
trump,dailywire,Ideological Politics,24270,A murder-suicide because Trump won,169,39,No,No,0,https://nypost.com/2024/11/10/us-news/minn-dad-anthony-nephew-ranted-against-trump-killed-family-in-murder-suicide/,/r/dailywire/comments/1grkks1/a_murdersuicide_because_trump_won/
biden,Liberal,Ideological Politics,119944,Was the Democratic Party this Quiet in 2016 after Trump Won?,90,110,No,No,0,https://www.reddit.com/r/Liberal/comments/1guxn5s/was_the_democratic_party_this_quiet_in_2016_after/,/r/Liberal/comments/1guxn5s/was_the_democratic_party_this_quiet_in_2016_after/
trump,Liberal,Ideological Politics,119944,Social Darwinist Oligarchs are a bigger threat than Christian Nationalists right now,32,14,No,No,0,https://www.reddit.com/r/Liberal/comments/1guzzlj/social_darwinist_oligarchs_are_a_bigger_threat/,/r/Liberal/comments/1guzzlj/social_darwinist_oligarchs_are_a_bigger_threat/
harris,Liberal,Ideological Politics,119944,ELI5 why is labor explotation suddenly okay,34,50,No,No,0,https://www.reddit.com/r/Liberal/comments/1guwjsg/eli5_why_is_labor_explotation_suddenly_okay/,/r/Liberal/comments/1guwjsg/eli5_why_is_labor_explotation_suddenly_okay/
trump,Liberal,Ideological Politics,119944,What are your thoughts on Trump confirming he will declare a national emergency on day 1 to deport more humans than were deported in the Holocaust?,80,95,No,No,0,https://www.reddit.com/r/Liberal/comments/1gusjpr/what_are_your_thoughts_on_trump_confirming_he/,/r/Liberal/comments/1gusjpr/what_are_your_thoughts_on_trump_confirming_he/
trump,Liberal,Ideological Politics,119944,The Trump administration’s next target: naturalized US citizens,112,49,No,No,0,https://www.reddit.com/r/Liberal/comments/1guo7kf/the_trump_administrations_next_target_naturalized/,/r/Liberal/comments/1guo7kf/the_trump_administrations_next_target_naturalized/
biden,Liberal,Ideological Politics,119944,Trump vote count drops below majority,567,87,No,No,0,https://www.cookpolitical.com/vote-tracker/2024/electoral-college,/r/Liberal/comments/1gu85x0/trump_vote_count_drops_below_majority/
trump,Liberal,Ideological Politics,119944,It's official: Donald Trump will use the military to deport Immigrants ,336,156,No,No,0,https://abcnews.go.com/Politics/trump-confirms-plan-declare-national-emergency-military-mass/story?id=115963448,/r/Liberal/comments/1gu8b7s/its_official_donald_trump_will_use_the_military/
loss,Liberal,Ideological Politics,119944,AI's Solution to the 2024/2028 Election,48,16,No,Yes,0,https://www.reddit.com/r/Liberal/comments/1gujrx2/ais_solution_to_the_20242028_election/,/r/Liberal/comments/1gujrx2/ais_solution_to_the_20242028_election/
loss,Liberal,Ideological Politics,119944,What were republicans like before Trump? TLDR at the bottom,1,0,No,Yes,0,https://www.reddit.com/r/Liberal/comments/1gv3l0j/what_were_republicans_like_before_trump_tldr_at/,/r/Liberal/comments/1gv3l0j/what_were_republicans_like_before_trump_tldr_at/
trump,Liberal,Ideological Politics,119944,I'm disturbed by the silence.,241,239,No,No,0,https://www.reddit.com/r/Liberal/comments/1gtuiun/im_disturbed_by_the_silence/,/r/Liberal/comments/1gtuiun/im_disturbed_by_the_silence/
trump,Liberal,Ideological Politics,119944,Democrats should let Trump run wild if they want to save country and party,223,155,No,No,0,https://www.reddit.com/r/Liberal/comments/1gtteom/democrats_should_let_trump_run_wild_if_they_want/,/r/Liberal/comments/1gtteom/democrats_should_let_trump_run_wild_if_they_want/
victory,KamalaHarris,Ideological Politics,74687,Republican Victory and the Ambience of Information | The New Yorker,97,16,No,No,0,https://www.newyorker.com/news/the-lede/republican-victory-and-the-ambience-of-information,/r/KamalaHarris/comments/1guof8s/republican_victory_and_the_ambience_of/
trump,KamalaHarris,Ideological Politics,74687,Donald Trump is Already Starting to Fail,1061,257,No,No,0,https://www.nytimes.com/2024/11/17/opinion/trump-kennedy-gaetz-hegseth.html?smid=nytcore-ios-share&referringSource=articleShare,/r/KamalaHarris/comments/1gu4nfk/donald_trump_is_already_starting_to_fail/
trump,KamalaHarris,Ideological Politics,74687,"'We can't come together': Trump voters win election, lose family and friends as values clash",1105,145,No,No,0,https://v.redd.it/9fqmgoq0ii1e1,/r/KamalaHarris/comments/1gtl9cc/we_cant_come_together_trump_voters_win_election/
trump,KamalaHarris,Ideological Politics,74687,Trump’s Anti-Trans Ads Were Expensive and Unpopular. So Why Were They His Key Strategy?,471,107,No,No,0,https://www.unclosetedmedia.com/p/trumps-anti-trans-ads-were-expensive,/r/KamalaHarris/comments/1gtes3q/trumps_antitrans_ads_were_expensive_and_unpopular/
trump,KamalaHarris,Ideological Politics,74687,Election denialism emerges on the left after Trump’s win ,650,256,No,No,0,https://www.nbcnews.com/tech/tech-news/election-denialism-emerges-left-trumps-win-rcna179797,/r/KamalaHarris/comments/1gt8480/election_denialism_emerges_on_the_left_after/
president,Impeach_Trump,Ideological Politics,60496,"“He’s behaving as if he’s a co-president and making sure everyone knows it,” one of the two people told NBC.",237,18,No,No,0,https://imghoster.co/en/vInxmlzM9vsmI3q?utm_source=reddit&utm_medium=impeach_trump,/r/Impeach_Trump/comments/1gu39be/hes_behaving_as_if_hes_a_copresident_and_making/
trump,Impeach_Trump,Ideological Politics,60496,"Jack Smith Soon to Drop 'Eye-Opening' Trump Report, Ex-Prosecutor Predicts ",400,45,No,No,0,https://www.newsweek.com/glenn-kirschner-predicts-jack-smith-soon-drop-eye-opening-trump-report-1987058,/r/Impeach_Trump/comments/1gtixfh/jack_smith_soon_to_drop_eyeopening_trump_report/
trump,Impeach_Trump,Ideological Politics,60496,Trump also appoints Matt Gaetz to serve as attorney general… the insanity of all of this is so outrageous and other worldly. ,212,7,No,No,0,https://www.cnbc.com/amp/2024/11/13/trump-taps-rep-matt-gaetz-as-attorney-general.html,/r/Impeach_Trump/comments/1gqnbam/trump_also_appoints_matt_gaetz_to_serve_as/
trump,Impeach_Trump,Ideological Politics,60496,Trump's defense choice stuns the Pentagon | apnews.com,107,1,No,No,0,https://apnews.com/article/trump-hegseth-defense-secretary-pentagon-2d8030921ecef933778cf92afd40ec72,/r/Impeach_Trump/comments/1gqakjc/trumps_defense_choice_stuns_the_pentagon_apnewscom/
trump,Impeach_Trump,Ideological Politics,60496,"Far-right extremists celebrate Trump’s win — In a burst of hate and misogyny, MAGA militants cheered the return of a president they consider an ally",161,1,No,No,0,https://www.washingtonpost.com/politics/2024/11/07/right-wing-extremists-celebrate-trump-victory/,/r/Impeach_Trump/comments/1gmvba5/farright_extremists_celebrate_trumps_win_in_a/
trump,Impeach_Trump,Ideological Politics,60496,Trump feigned ignorance of Project 2025,218,10,No,No,0,https://imghoster.co/en/FhQ7EhPjtSXOF4R,/r/Impeach_Trump/comments/1glm47g/trump_feigned_ignorance_of_project_2025/
trump,Impeach_Trump,Ideological Politics,60496,The Deep Roots of 4 of Donald Trump’s Highly Xenophobic Remarks,34,2,No,No,0,https://www.nytimes.com/2024/11/01/us/politics/trump-immigration-rhetoric-history.html,/r/Impeach_Trump/comments/1glhq62/the_deep_roots_of_4_of_donald_trumps_highly/
trump,Impeach_Trump,Ideological Politics,60496,Literal Neo-Nazi Leader Endorses Trump,218,1,No,No,0,https://www.rollingstone.com/politics/politics-news/trump-endorsement-neo-nazi-leader-nsc-131-1235154089/,/r/Impeach_Trump/comments/1gkmq6t/literal_neonazi_leader_endorses_trump/
trump,Impeach_Trump,Ideological Politics,60496,Trump's crowds are dwindling as his campaign winds down — Empty seats and early exits have grown more common,428,18,No,No,0,https://www.nytimes.com/2024/11/04/us/politics/trump-rally-crowds.html,/r/Impeach_Trump/comments/1gjn8sb/trumps_crowds_are_dwindling_as_his_campaign_winds/
trump,Impeach_Trump,Ideological Politics,60496,"Donald Trump talks about women at his rallies like they are objects, he doesn't see them as equals",300,3,No,No,0,https://imghoster.co/v3YtmBuQO5WqVHF,/r/Impeach_Trump/comments/1ggdie6/donald_trump_talks_about_women_at_his_rallies/
trump,Impeach_Trump,Ideological Politics,60496,"Donald Trump called half of America ""human scum""",196,5,No,No,0,https://imghoster.co/VN2ORQf6SinlHXJ?utm_source=reddit&utm_medium=impeach_trump,/r/Impeach_Trump/comments/1gg9nmz/donald_trump_called_half_of_america_human_scum/
trump,Impeach_Trump,Ideological Politics,60496,This is an amazing article written by user u/SilkyFluffs in r/democrats which is an amazing resource for combating GOP and Trump misinformation and possibly even converting family members or undecided voters,44,0,No,Yes,0,https://pdflink.to/d6e0bc9d/,/r/Impeach_Trump/comments/1ggd0pc/this_is_an_amazing_article_written_by_user/
