Keyword,Subreddit,Category,Members,Title,Upvotes,Comments,Moderator Interaction,Fact-Checking Mention,Total Awards,URL,Original Post URL
senate,Conservatives,Ideological Politics,108284,"Wait, Huh? After Pledging to Ramrod Left-Wing Agenda Through Senate, Schumer Pleads for Bi-Partisanship",191,37,No,No,0,https://redstate.com/mike_miller/2024/11/17/wait-huh-after-pledging-to-ramrod-left-wing-agenda-through-senate-schumer-pleads-for-bi-partisanship-n2182100,/r/conservatives/comments/1gu4vwz/wait_huh_after_pledging_to_ramrod_leftwing_agenda/
trump,Conservatives,Ideological Politics,108284,REPORT: Trump Team Targeting Military Officers Involved in Afghanistan Withdrawal,175,12,No,No,0,https://redstate.com/jeffc/2024/11/17/report-trump-team-targeting-military-officers-involved-in-afghanistan-withdrawal-for-court-martial-n2182105,/r/conservatives/comments/1gu4unb/report_trump_team_targeting_military_officers/
trump,Conservatives,Ideological Politics,108284,Trump’s Historic Win: First Republican President to Cross 76 Million Votes,87,5,No,No,0,https://medium.com/@sdiraguide/trumps-historic-win-first-republican-president-to-cross-76-million-votes-6fa1a03a2236,/r/conservatives/comments/1gu8ezn/trumps_historic_win_first_republican_president_to/
trump,Conservatives,Ideological Politics,108284,"BREAKING: According to Steve Bannon, President Trump will name Kash Patel as his FBI Director

Kash Patel is a total savage. His plans for the FBI are magnificent.

""I'd shut down the FBI Hoover Building on day one and reopen the next day as a museum of the deep state. ",51,0,No,No,0,https://x.com/BehizyTweets/status/1858555559248572582,/r/conservatives/comments/1gu9xp0/breaking_according_to_steve_bannon_president/
senate,Conservatives,Ideological Politics,108284,Pa. Supreme Court again rules against counting undated mail ballots as U.S. Senate race limbo continues,18,0,No,No,0,https://www.inquirer.com/politics/philadelphia/pennsylvania-supreme-court-undated-mail-ballots-senate-recount-20241118.html,/r/conservatives/comments/1gugpx7/pa_supreme_court_again_rules_against_counting/
electoral,Conservatives,Ideological Politics,108284,Nancy Pelosi is finished — no one deserves more blame for Dems $1B electoral collapse,256,25,No,No,0,https://nypost.com/2024/11/17/opinion/nancy-pelosi-is-finished-no-one-deserves-more-blame-for-dems-1b-electoral-collapse/,/r/conservatives/comments/1gtzcqw/nancy_pelosi_is_finished_no_one_deserves_more/
trump,dailywire,Ideological Politics,24272,Wall of Hate - Help Document Hatred Against Trump on July13th.com,79,16,Yes,No,0,https://july13th.com/hate/,/r/dailywire/comments/1e3cqx8/wall_of_hate_help_document_hatred_against_trump/
results,dailywire,Ideological Politics,24272,I hope they do levy a challenge.,51,18,No,Yes,0,https://youtu.be/-m5cmNt5x9U?si=e7iPDu3dEWHnhQyB,/r/dailywire/comments/1gs0n9f/i_hope_they_do_levy_a_challenge/
trump,dailywire,Ideological Politics,24272,A murder-suicide because Trump won,167,39,No,No,0,https://nypost.com/2024/11/10/us-news/minn-dad-anthony-nephew-ranted-against-trump-killed-family-in-murder-suicide/,/r/dailywire/comments/1grkks1/a_murdersuicide_because_trump_won/
biden,Liberal,Ideological Politics,119942,Trump vote count drops below majority,440,74,No,No,0,https://www.cookpolitical.com/vote-tracker/2024/electoral-college,/r/Liberal/comments/1gu85x0/trump_vote_count_drops_below_majority/
trump,Liberal,Ideological Politics,119942,It's official: Donald Trump will use the military to deport Immigrants ,260,147,No,No,0,https://abcnews.go.com/Politics/trump-confirms-plan-declare-national-emergency-military-mass/story?id=115963448,/r/Liberal/comments/1gu8b7s/its_official_donald_trump_will_use_the_military/
loss,Liberal,Ideological Politics,119942,AI's Solution to the 2024/2028 Election,27,10,No,Yes,0,https://www.reddit.com/r/Liberal/comments/1gujrx2/ais_solution_to_the_20242028_election/,/r/Liberal/comments/1gujrx2/ais_solution_to_the_20242028_election/
trump,Liberal,Ideological Politics,119942,I'm disturbed by the silence.,217,222,No,No,0,https://www.reddit.com/r/Liberal/comments/1gtuiun/im_disturbed_by_the_silence/,/r/Liberal/comments/1gtuiun/im_disturbed_by_the_silence/
trump,Liberal,Ideological Politics,119942,Democrats should let Trump run wild if they want to save country and party,217,145,No,No,0,https://www.reddit.com/r/Liberal/comments/1gtteom/democrats_should_let_trump_run_wild_if_they_want/,/r/Liberal/comments/1gtteom/democrats_should_let_trump_run_wild_if_they_want/
trump,Liberal,Ideological Politics,119942,"If the Mar-a-Lago documents case is dismissed, Trump could get everything back - and keep it with immunity",174,38,No,No,0,https://www.businessinsider.com/trump-boxes-seized-mar-a-lago-immunity-2024-11,/r/Liberal/comments/1gtdetj/if_the_maralago_documents_case_is_dismissed_trump/
vance,Liberal,Ideological Politics,119942,Invite To An Informal Gathering,0,0,No,No,0,https://www.reddit.com/r/Liberal/comments/1guiz04/invite_to_an_informal_gathering/,/r/Liberal/comments/1guiz04/invite_to_an_informal_gathering/
trump,Liberal,Ideological Politics,119942,Gabbard's sympathetic views toward Russia cause alarm as Trump's pick to lead intelligence services,72,10,No,No,0,https://apnews.com/article/gabbard-trump-putin-intelligence-russia-syria-a798adaf9cd531a5d0c9329f7597f0f6,/r/Liberal/comments/1gteen5/gabbards_sympathetic_views_toward_russia_cause/
vance,Liberal,Ideological Politics,119942,Brown not ruling out run for remainder of Vance’s Senate term,39,1,No,No,0,https://thehill.com/homenews/campaign/4992997-brown-vance-senate-term-ohio/amp/,/r/Liberal/comments/1gtbplc/brown_not_ruling_out_run_for_remainder_of_vances/
trump,Liberal,Ideological Politics,119942,I don't ever want to hear conservatives complain about DEI like they actually cared again.,209,32,No,Yes,0,https://www.reddit.com/r/Liberal/comments/1gt2sr8/i_dont_ever_want_to_hear_conservatives_complain/,/r/Liberal/comments/1gt2sr8/i_dont_ever_want_to_hear_conservatives_complain/
trump,Liberal,Ideological Politics,119942,My main reason for optimism: Now they have to put up or shut up,174,71,No,No,0,https://www.reddit.com/r/Liberal/comments/1gszxrw/my_main_reason_for_optimism_now_they_have_to_put/,/r/Liberal/comments/1gszxrw/my_main_reason_for_optimism_now_they_have_to_put/
trump,Liberal,Ideological Politics,119942,FAFO STORY TIME!,18,18,No,No,0,https://www.reddit.com/r/Liberal/comments/1gtbqeq/fafo_story_time/,/r/Liberal/comments/1gtbqeq/fafo_story_time/
trump,KamalaHarris,Ideological Politics,74774,Donald Trump is Already Starting to Fail,913,210,No,No,0,https://www.nytimes.com/2024/11/17/opinion/trump-kennedy-gaetz-hegseth.html?smid=nytcore-ios-share&referringSource=articleShare,/r/KamalaHarris/comments/1gu4nfk/donald_trump_is_already_starting_to_fail/
trump,KamalaHarris,Ideological Politics,74774,"'We can't come together': Trump voters win election, lose family and friends as values clash",994,140,No,No,0,https://v.redd.it/9fqmgoq0ii1e1,/r/KamalaHarris/comments/1gtl9cc/we_cant_come_together_trump_voters_win_election/
trump,KamalaHarris,Ideological Politics,74774,Trump’s Anti-Trans Ads Were Expensive and Unpopular. So Why Were They His Key Strategy?,454,102,No,No,0,https://www.unclosetedmedia.com/p/trumps-anti-trans-ads-were-expensive,/r/KamalaHarris/comments/1gtes3q/trumps_antitrans_ads_were_expensive_and_unpopular/
trump,KamalaHarris,Ideological Politics,74774,Election denialism emerges on the left after Trump’s win ,637,253,No,No,0,https://www.nbcnews.com/tech/tech-news/election-denialism-emerges-left-trumps-win-rcna179797,/r/KamalaHarris/comments/1gt8480/election_denialism_emerges_on_the_left_after/
harris,KamalaHarris,Ideological Politics,74774,"Dear VP Kamala Harris — On behalf of the 69,074,145+ Americans who voted for you, we thank you for your leadership. Thank you for a future-focused, reimagined, unifying and aspirational vision for our country.",2718,155,No,No,0,https://www.deseret.com/opinion/2024/11/15/thank-you-vice-president-kamala-harris/,/r/KamalaHarris/comments/1gszdtt/dear_vp_kamala_harris_on_behalf_of_the_69074145/
trump,KamalaHarris,Ideological Politics,74774,AOC Directly Addresses People Who Voted For Both Her And Trump,853,111,No,No,0,https://www.huffpost.com/entry/aoc-trump-voters_n_67320370e4b052f25adcff55,/r/KamalaHarris/comments/1gsyo0m/aoc_directly_addresses_people_who_voted_for_both/
harris,KamalaHarris,Ideological Politics,74774,Trump pro-Israel picks mock anti-Harris pro-Palestinian protest vote,539,58,No,No,0,https://forward.com/opinion/674533/trump-rubio-huckabee-stefanik-israel,/r/KamalaHarris/comments/1gsrmxw/trump_proisrael_picks_mock_antiharris/
president,Impeach_Trump,Ideological Politics,60501,"“He’s behaving as if he’s a co-president and making sure everyone knows it,” one of the two people told NBC.",154,17,No,No,0,https://imghoster.co/en/vInxmlzM9vsmI3q?utm_source=reddit&utm_medium=impeach_trump,/r/Impeach_Trump/comments/1gu39be/hes_behaving_as_if_hes_a_copresident_and_making/
trump,Impeach_Trump,Ideological Politics,60501,"Jack Smith Soon to Drop 'Eye-Opening' Trump Report, Ex-Prosecutor Predicts ",375,45,No,No,0,https://www.newsweek.com/glenn-kirschner-predicts-jack-smith-soon-drop-eye-opening-trump-report-1987058,/r/Impeach_Trump/comments/1gtixfh/jack_smith_soon_to_drop_eyeopening_trump_report/
trump,Impeach_Trump,Ideological Politics,60501,Trump also appoints Matt Gaetz to serve as attorney general… the insanity of all of this is so outrageous and other worldly. ,208,7,No,No,0,https://www.cnbc.com/amp/2024/11/13/trump-taps-rep-matt-gaetz-as-attorney-general.html,/r/Impeach_Trump/comments/1gqnbam/trump_also_appoints_matt_gaetz_to_serve_as/
trump,Impeach_Trump,Ideological Politics,60501,Trump's defense choice stuns the Pentagon | apnews.com,109,1,No,No,0,https://apnews.com/article/trump-hegseth-defense-secretary-pentagon-2d8030921ecef933778cf92afd40ec72,/r/Impeach_Trump/comments/1gqakjc/trumps_defense_choice_stuns_the_pentagon_apnewscom/
trump,Impeach_Trump,Ideological Politics,60501,"Far-right extremists celebrate Trump’s win — In a burst of hate and misogyny, MAGA militants cheered the return of a president they consider an ally",156,1,No,No,0,https://www.washingtonpost.com/politics/2024/11/07/right-wing-extremists-celebrate-trump-victory/,/r/Impeach_Trump/comments/1gmvba5/farright_extremists_celebrate_trumps_win_in_a/
trump,Impeach_Trump,Ideological Politics,60501,Trump feigned ignorance of Project 2025,218,10,No,No,0,https://imghoster.co/en/FhQ7EhPjtSXOF4R,/r/Impeach_Trump/comments/1glm47g/trump_feigned_ignorance_of_project_2025/
trump,Impeach_Trump,Ideological Politics,60501,The Deep Roots of 4 of Donald Trump’s Highly Xenophobic Remarks,33,2,No,No,0,https://www.nytimes.com/2024/11/01/us/politics/trump-immigration-rhetoric-history.html,/r/Impeach_Trump/comments/1glhq62/the_deep_roots_of_4_of_donald_trumps_highly/
trump,Impeach_Trump,Ideological Politics,60501,Literal Neo-Nazi Leader Endorses Trump,223,1,No,No,0,https://www.rollingstone.com/politics/politics-news/trump-endorsement-neo-nazi-leader-nsc-131-1235154089/,/r/Impeach_Trump/comments/1gkmq6t/literal_neonazi_leader_endorses_trump/
trump,Impeach_Trump,Ideological Politics,60501,Trump's crowds are dwindling as his campaign winds down — Empty seats and early exits have grown more common,423,18,No,No,0,https://www.nytimes.com/2024/11/04/us/politics/trump-rally-crowds.html,/r/Impeach_Trump/comments/1gjn8sb/trumps_crowds_are_dwindling_as_his_campaign_winds/
trump,Impeach_Trump,Ideological Politics,60501,"Donald Trump talks about women at his rallies like they are objects, he doesn't see them as equals",302,3,No,No,0,https://imghoster.co/v3YtmBuQO5WqVHF,/r/Impeach_Trump/comments/1ggdie6/donald_trump_talks_about_women_at_his_rallies/
trump,Impeach_Trump,Ideological Politics,60501,"Donald Trump called half of America ""human scum""",194,5,No,No,0,https://imghoster.co/VN2ORQf6SinlHXJ?utm_source=reddit&utm_medium=impeach_trump,/r/Impeach_Trump/comments/1gg9nmz/donald_trump_called_half_of_america_human_scum/
trump,Impeach_Trump,Ideological Politics,60501,This is an amazing article written by user u/SilkyFluffs in r/democrats which is an amazing resource for combating GOP and Trump misinformation and possibly even converting family members or undecided voters,47,0,No,Yes,0,https://pdflink.to/d6e0bc9d/,/r/Impeach_Trump/comments/1ggd0pc/this_is_an_amazing_article_written_by_user/
