Keyword,Subreddit,Category,Members,Title,Upvotes,Comments,Moderator Interaction,Fact-Checking Mention,Total Awards,URL,Original Post URL
results,Liberal,Ideological Politics,119977,Is 2024 the new 1933? ,151,50,No,No,0,https://www.reddit.com/r/Liberal/comments/1gvbaxm/is_2024_the_new_1933/,/r/Liberal/comments/1gvbaxm/is_2024_the_new_1933/
president,Liberal,Ideological Politics,119977,President Musk,55,31,No,No,0,https://www.reddit.com/r/Liberal/comments/1gvgeg2/president_musk/,/r/Liberal/comments/1gvgeg2/president_musk/
biden,Liberal,Ideological Politics,119977,"I'm worried Putin will ""test"" Trump in January.",206,104,No,No,0,https://www.reddit.com/r/Liberal/comments/1gv3wxs/im_worried_putin_will_test_trump_in_january/,/r/Liberal/comments/1gv3wxs/im_worried_putin_will_test_trump_in_january/
biden,Liberal,Ideological Politics,119977,Was the Democratic Party this Quiet in 2016 after Trump Won?,218,194,No,No,0,https://www.reddit.com/r/Liberal/comments/1guxn5s/was_the_democratic_party_this_quiet_in_2016_after/,/r/Liberal/comments/1guxn5s/was_the_democratic_party_this_quiet_in_2016_after/
recount,KamalaHarris,Ideological Politics,74558,Urgent call for recounts is heating up,387,39,No,No,0,https://youtu.be/H8tQ_OQoVbs?si=5xrYLxXaepBc8TVq,/r/KamalaHarris/comments/1gwhtma/urgent_call_for_recounts_is_heating_up/
trump,KamalaHarris,Ideological Politics,74558,"Part of Me Wants to Throw in the Towel, However I Would Be No Better Than the 70+ Million Americans Who Flipped off Marginalized Groups in the Pursuit of Immediate Comfort.  I Opine That One Significant Leg up Is to Find a Way to Shift Mainstream Media’s Narrative on Trump and His Fuckery.",255,70,No,No,0,https://media1.giphy.com/media/xT0xeom1wgg8LCyqWs/giphy.gif?cid=9b38fe91v1lilimzy4nx5ymwjkgsyu1ab4ikifn4bh4yvpzv&ep=v1_gifs_search&rid=giphy.gif&ct=g,/r/KamalaHarris/comments/1gw6q08/part_of_me_wants_to_throw_in_the_towel_however_i/
harris,KamalaHarris,Ideological Politics,74558,Weak turnout in key cities hurt Harris in the 'blue wall' states,778,117,No,No,0,https://www.nbcnews.com/politics/2024-election/weak-turnout-key-cities-hurt-harris-blue-wall-states-rcna180669,/r/KamalaHarris/comments/1gvax2s/weak_turnout_in_key_cities_hurt_harris_in_the/
victory,KamalaHarris,Ideological Politics,74558,Republican Victory and the Ambience of Information | The New Yorker,134,21,No,No,0,https://www.newyorker.com/news/the-lede/republican-victory-and-the-ambience-of-information,/r/KamalaHarris/comments/1guof8s/republican_victory_and_the_ambience_of/
trump,KamalaHarris,Ideological Politics,74558,Donald Trump is Already Starting to Fail,1153,275,No,No,0,https://www.nytimes.com/2024/11/17/opinion/trump-kennedy-gaetz-hegseth.html?smid=nytcore-ios-share&referringSource=articleShare,/r/KamalaHarris/comments/1gu4nfk/donald_trump_is_already_starting_to_fail/
trump,KamalaHarris,Ideological Politics,74558,"'We can't come together': Trump voters win election, lose family and friends as values clash",1144,162,No,No,0,https://v.redd.it/9fqmgoq0ii1e1,/r/KamalaHarris/comments/1gtl9cc/we_cant_come_together_trump_voters_win_election/
president,Impeach_Trump,Ideological Politics,60491,"“He’s behaving as if he’s a co-president and making sure everyone knows it,” one of the two people told NBC.",346,21,No,No,0,https://imghoster.co/en/vInxmlzM9vsmI3q?utm_source=reddit&utm_medium=impeach_trump,/r/Impeach_Trump/comments/1gu39be/hes_behaving_as_if_hes_a_copresident_and_making/
trump,Impeach_Trump,Ideological Politics,60491,"Jack Smith Soon to Drop 'Eye-Opening' Trump Report, Ex-Prosecutor Predicts ",461,49,No,No,0,https://www.newsweek.com/glenn-kirschner-predicts-jack-smith-soon-drop-eye-opening-trump-report-1987058,/r/Impeach_Trump/comments/1gtixfh/jack_smith_soon_to_drop_eyeopening_trump_report/
trump,Impeach_Trump,Ideological Politics,60491,Trump also appoints Matt Gaetz to serve as attorney general… the insanity of all of this is so outrageous and other worldly. ,210,7,No,No,0,https://www.cnbc.com/amp/2024/11/13/trump-taps-rep-matt-gaetz-as-attorney-general.html,/r/Impeach_Trump/comments/1gqnbam/trump_also_appoints_matt_gaetz_to_serve_as/
trump,Impeach_Trump,Ideological Politics,60491,Trump's defense choice stuns the Pentagon | apnews.com,106,1,No,No,0,https://apnews.com/article/trump-hegseth-defense-secretary-pentagon-2d8030921ecef933778cf92afd40ec72,/r/Impeach_Trump/comments/1gqakjc/trumps_defense_choice_stuns_the_pentagon_apnewscom/
trump,Impeach_Trump,Ideological Politics,60491,"Far-right extremists celebrate Trump’s win — In a burst of hate and misogyny, MAGA militants cheered the return of a president they consider an ally",159,1,No,No,0,https://www.washingtonpost.com/politics/2024/11/07/right-wing-extremists-celebrate-trump-victory/,/r/Impeach_Trump/comments/1gmvba5/farright_extremists_celebrate_trumps_win_in_a/
trump,Impeach_Trump,Ideological Politics,60491,Trump feigned ignorance of Project 2025,218,10,No,No,0,https://imghoster.co/en/FhQ7EhPjtSXOF4R,/r/Impeach_Trump/comments/1glm47g/trump_feigned_ignorance_of_project_2025/
trump,Impeach_Trump,Ideological Politics,60491,The Deep Roots of 4 of Donald Trump’s Highly Xenophobic Remarks,32,3,No,No,0,https://www.nytimes.com/2024/11/01/us/politics/trump-immigration-rhetoric-history.html,/r/Impeach_Trump/comments/1glhq62/the_deep_roots_of_4_of_donald_trumps_highly/
trump,Impeach_Trump,Ideological Politics,60491,Literal Neo-Nazi Leader Endorses Trump,216,1,No,No,0,https://www.rollingstone.com/politics/politics-news/trump-endorsement-neo-nazi-leader-nsc-131-1235154089/,/r/Impeach_Trump/comments/1gkmq6t/literal_neonazi_leader_endorses_trump/
trump,Impeach_Trump,Ideological Politics,60491,Trump's crowds are dwindling as his campaign winds down — Empty seats and early exits have grown more common,432,18,No,No,0,https://www.nytimes.com/2024/11/04/us/politics/trump-rally-crowds.html,/r/Impeach_Trump/comments/1gjn8sb/trumps_crowds_are_dwindling_as_his_campaign_winds/
trump,Impeach_Trump,Ideological Politics,60491,"Donald Trump talks about women at his rallies like they are objects, he doesn't see them as equals",298,3,No,No,0,https://imghoster.co/v3YtmBuQO5WqVHF,/r/Impeach_Trump/comments/1ggdie6/donald_trump_talks_about_women_at_his_rallies/
trump,Impeach_Trump,Ideological Politics,60491,"Donald Trump called half of America ""human scum""",194,5,No,No,0,https://imghoster.co/VN2ORQf6SinlHXJ?utm_source=reddit&utm_medium=impeach_trump,/r/Impeach_Trump/comments/1gg9nmz/donald_trump_called_half_of_america_human_scum/
trump,Impeach_Trump,Ideological Politics,60491,This is an amazing article written by user u/SilkyFluffs in r/democrats which is an amazing resource for combating GOP and Trump misinformation and possibly even converting family members or undecided voters,45,0,No,Yes,0,https://pdflink.to/d6e0bc9d/,/r/Impeach_Trump/comments/1ggd0pc/this_is_an_amazing_article_written_by_user/
