Keyword,Subreddit,Category,Members,Title,Upvotes,Comments,Moderator Interaction,Fact-Checking Mention,Total Awards,URL,Original Post URL
results,Wikileaks,General Politics,177619,Censored Wikileaks content?,12,7,No,No,0,https://www.reddit.com/r/WikiLeaks/comments/1frr2wq/censored_wikileaks_content/,/r/WikiLeaks/comments/1frr2wq/censored_wikileaks_content/
trump,News,General Politics,28959201,LA enacts sanctuary city ordinance to prepare for potential mass deportations under Trump,10940,972,No,No,0,https://apnews.com/article/sanctuary-city-trump-deportations-immigrants-los-angeles-836cf68a756c64800bbeb0270e8a965c,/r/news/comments/1gvbnt1/la_enacts_sanctuary_city_ordinance_to_prepare_for/
trump,News,General Politics,28959201,New York prosecutors say they will oppose dismissing Trump’s hush money conviction,22443,877,No,No,0,https://apnews.com/article/trump-hush-money-case-stormy-daniels-8793ae086092c64325d38a380851e23a,/r/news/comments/1gv42jr/new_york_prosecutors_say_they_will_oppose/
electoral,PoliticalDiscussion,General Politics,2184562,To what degree do you think the system of recall should be used?,37,34,No,No,0,https://www.reddit.com/r/PoliticalDiscussion/comments/1gvp5ay/to_what_degree_do_you_think_the_system_of_recall/,/r/PoliticalDiscussion/comments/1gvp5ay/to_what_degree_do_you_think_the_system_of_recall/
loss,PoliticalDiscussion,General Politics,2184562,What can democrats do to be more effective in today’s media environment?,224,894,No,No,0,https://www.reddit.com/r/PoliticalDiscussion/comments/1gv340b/what_can_democrats_do_to_be_more_effective_in/,/r/PoliticalDiscussion/comments/1gv340b/what_can_democrats_do_to_be_more_effective_in/
biden,PoliticalDiscussion,General Politics,2184562,Were Obama and Biden just extraordinary candidates?  (For their time at least),0,15,No,No,0,https://www.reddit.com/r/PoliticalDiscussion/comments/1gvwhem/were_obama_and_biden_just_extraordinary/,/r/PoliticalDiscussion/comments/1gvwhem/were_obama_and_biden_just_extraordinary/
loss,PoliticalDiscussion,General Politics,2184562,How does a campaign to expand rights differ from a campaign to prevent rights from backsliding?,5,25,No,Yes,0,https://www.reddit.com/r/PoliticalDiscussion/comments/1gv4yrs/how_does_a_campaign_to_expand_rights_differ_from/,/r/PoliticalDiscussion/comments/1gv4yrs/how_does_a_campaign_to_expand_rights_differ_from/
harris,PoliticalDiscussion,General Politics,2184562,"For what reason do you believe it is that the public doesn't broadly acknowledge that immigrants are statistically less likely to commit crimes than native born Americans, and instead believe that immigrants are more prone to violence?",538,714,No,Yes,0,https://www.reddit.com/r/PoliticalDiscussion/comments/1gu5dba/for_what_reason_do_you_believe_it_is_that_the/,/r/PoliticalDiscussion/comments/1gu5dba/for_what_reason_do_you_believe_it_is_that_the/
results,PoliticalDiscussion,General Politics,2184562,"The Pennsylvania Senate race is extremely close and heading for a recount.  What's exactly going on there?  Finally, what is the use for provisional ballots in the first place?",248,109,No,No,0,https://www.reddit.com/r/PoliticalDiscussion/comments/1gu73uj/the_pennsylvania_senate_race_is_extremely_close/,/r/PoliticalDiscussion/comments/1gu73uj/the_pennsylvania_senate_race_is_extremely_close/
supreme court,PoliticalDiscussion,General Politics,2184562,"Would you want courts to normally be issuing rulings unanimously or closely so, or do you want to see a court more typically having multiple blocs?",3,16,No,No,0,https://www.reddit.com/r/PoliticalDiscussion/comments/1guzf9s/would_you_want_courts_to_normally_be_issuing/,/r/PoliticalDiscussion/comments/1guzf9s/would_you_want_courts_to_normally_be_issuing/
biden,PoliticalDiscussion,General Politics,2184562,Will Biden be able to fill the last remaining judicial nominations? ,173,87,No,No,0,https://www.reddit.com/r/PoliticalDiscussion/comments/1gtxjwv/will_biden_be_able_to_fill_the_last_remaining/,/r/PoliticalDiscussion/comments/1gtxjwv/will_biden_be_able_to_fill_the_last_remaining/
results,PoliticalDiscussion,General Politics,2184562,"Ecuador has a presidential republic, but also has an interesting mechanism of Simultaneous Death. What do you think are the benefits and adverse effects of such a thing?",52,14,No,No,0,https://www.reddit.com/r/PoliticalDiscussion/comments/1gu2y8x/ecuador_has_a_presidential_republic_but_also_has/,/r/PoliticalDiscussion/comments/1gu2y8x/ecuador_has_a_presidential_republic_but_also_has/
results,NeutralPolitics,General Politics,610788,What to expect after the U.S. election,286,26,Yes,Yes,0,https://www.reddit.com/r/NeutralPolitics/comments/1gflxpk/what_to_expect_after_the_us_election/,/r/NeutralPolitics/comments/1gflxpk/what_to_expect_after_the_us_election/
trump,NeutralPolitics,General Politics,610788,Is NATO still a credible deterrent? What are the arguments for and against?,20,62,No,No,0,https://www.reddit.com/r/NeutralPolitics/comments/1guw3ls/is_nato_still_a_credible_deterrent_what_are_the/,/r/NeutralPolitics/comments/1guw3ls/is_nato_still_a_credible_deterrent_what_are_the/
house,NeutralPolitics,General Politics,610788,Tracking what bills/decisions are coming to contact reps/senators in a timely manner,40,12,No,No,0,https://www.reddit.com/r/NeutralPolitics/comments/1gqkpdp/tracking_what_billsdecisions_are_coming_to/,/r/NeutralPolitics/comments/1gqkpdp/tracking_what_billsdecisions_are_coming_to/
loss,NeutralPolitics,General Politics,610788,Do any countries have laws to combat politically-driven misinformation?,36,42,No,Yes,0,https://www.reddit.com/r/NeutralPolitics/comments/1gq4agt/do_any_countries_have_laws_to_combat/,/r/NeutralPolitics/comments/1gq4agt/do_any_countries_have_laws_to_combat/
results,NeutralPolitics,General Politics,610788,Trump won the presidency and popular vote running on the mass deportation of illegal aliens. Who saw this coming and what lessons can be learned?,224,326,No,No,0,https://www.reddit.com/r/NeutralPolitics/comments/1gnk7ih/trump_won_the_presidency_and_popular_vote_running/,/r/NeutralPolitics/comments/1gnk7ih/trump_won_the_presidency_and_popular_vote_running/
results,NeutralPolitics,General Politics,610788,Is now the time for a NEW moderate third party in U.S. politics?,5,83,No,No,0,https://www.reddit.com/r/NeutralPolitics/comments/1gms9so/is_now_the_time_for_a_new_moderate_third_party_in/,/r/NeutralPolitics/comments/1gms9so/is_now_the_time_for_a_new_moderate_third_party_in/
harris,NeutralPolitics,General Politics,610788,Why Are So Many Men Leaving The Democratic Party Over The Last Few Years?,385,156,No,No,0,https://www.reddit.com/r/NeutralPolitics/comments/1gklb9t/why_are_so_many_men_leaving_the_democratic_party/,/r/NeutralPolitics/comments/1gklb9t/why_are_so_many_men_leaving_the_democratic_party/
trump,NeutralPolitics,General Politics,610788,What plans about trump and kamala have on section 8 housing and dept of edu.,1,11,No,No,0,https://www.reddit.com/r/NeutralPolitics/comments/1gk1emp/what_plans_about_trump_and_kamala_have_on_section/,/r/NeutralPolitics/comments/1gk1emp/what_plans_about_trump_and_kamala_have_on_section/
outcome,NeutralPolitics,General Politics,610788,"What are the pros and cons of predictive election models, like 538, for our discourse around elections?",37,94,No,No,0,https://www.reddit.com/r/NeutralPolitics/comments/1giqib5/what_are_the_pros_and_cons_of_predictive_election/,/r/NeutralPolitics/comments/1giqib5/what_are_the_pros_and_cons_of_predictive_election/
trump,moderatepolitics,General Politics,296787,Trump Wants to ease rules for Self-Driving cars,73,151,No,No,0,https://reason.com/2024/11/20/trump-wants-to-ease-rules-for-self-driving-cars/,/r/moderatepolitics/comments/1gvxmmx/trump_wants_to_ease_rules_for_selfdriving_cars/
biden,moderatepolitics,General Politics,296787,"Biden approves antipersonnel mines for Ukraine, undoing his own policy",179,206,No,No,0,https://www.washingtonpost.com/national-security/2024/11/19/biden-landmines-ukraine-russia,/r/moderatepolitics/comments/1gvgo0a/biden_approves_antipersonnel_mines_for_ukraine/
trump,moderatepolitics,General Politics,296787,Trump picks TV's Dr. Oz to run Medicare and Medicaid,495,659,No,No,0,https://www.reuters.com/world/us/trump-picks-dr-oz-serve-cms-administrator-2024-11-19/,/r/moderatepolitics/comments/1gv93g1/trump_picks_tvs_dr_oz_to_run_medicare_and_medicaid/
results,moderatepolitics,General Politics,296787,"1% Swing in Vote Would Have Changed Presidential, House Results",170,228,No,No,0,https://reason.com/volokh/2024/11/18/1-swing-in-vote-would-have-changed-presidential-house-results/,/r/moderatepolitics/comments/1gv4or5/1_swing_in_vote_would_have_changed_presidential/
trump,moderatepolitics,General Politics,296787,Will Conservative Judges Abide Trump’s Ending Birthright Citizenship?,171,405,No,No,0,https://washingtonmonthly.com/2024/11/19/will-conservative-judges-abide-trumps-ending-birthright-citizenship/,/r/moderatepolitics/comments/1gv0pek/will_conservative_judges_abide_trumps_ending/
trump,moderatepolitics,General Politics,296787,Trump expected to nominate Howard Lutnick for Commerce secretary,125,85,No,No,0,https://www.cnn.com/2024/11/19/politics/howard-lutnick-commerce-secretary/index.html,/r/moderatepolitics/comments/1gv14i2/trump_expected_to_nominate_howard_lutnick_for/
senate,moderatepolitics,General Politics,296787,Case Preview: United States v. Skrmetti,77,293,No,No,0,https://www.reddit.com/r/moderatepolitics/comments/1gv0jsz/case_preview_united_states_v_skrmetti/,/r/moderatepolitics/comments/1gv0jsz/case_preview_united_states_v_skrmetti/
biden,technology,General Politics,17426250,Joe Biden Just Trump-Proofed His Hallmark CHIPS Act,1352,84,No,No,0,https://www.newsweek.com/biden-chips-act-taiwan-tsmc-trump-1988924,/r/technology/comments/1gvzhtn/joe_biden_just_trumpproofed_his_hallmark_chips_act/
trump,technology,General Politics,17426250,"Cable companies and Trump’s FCC chair agree: Data caps are good for you | Data caps reflect ""highly competitive environment,"" cable lobby tells FCC.",4683,719,No,No,0,https://arstechnica.com/tech-policy/2024/11/cable-companies-and-trumps-fcc-chair-agree-data-caps-are-good-for-you/,/r/technology/comments/1gvn11s/cable_companies_and_trumps_fcc_chair_agree_data/
trump,technology,General Politics,17426250,Trump Accidentally Helps Dems Get Key Judicial Nominees Approved By Taking Republicans To SpaceX Launch,463,17,No,No,0,https://www.ibtimes.com/trump-accidentally-helps-dems-get-key-judicial-nominees-approved-taking-republicans-watch-spacex-3751915,/r/technology/comments/1gw1fpn/trump_accidentally_helps_dems_get_key_judicial/
biden,democrats,Ideological Politics,481054,Republicans Are Mad That Democrats Are Confirming Lots Of Biden's Judges,915,73,No,No,0,https://www.huffpost.com/entry/republicans-mad-democrats-confirm-biden-judges_n_673d1b98e4b0c3322e8f9191,/r/democrats/comments/1gvq530/republicans_are_mad_that_democrats_are_confirming/
president,democrats,Ideological Politics,481054,Forensic audit of the US presidential election is now needed,368,46,No,No,0,https://www.thecanary.co/global/world-analysis/2024/11/19/forensic-audit-us-presidential-election/,/r/democrats/comments/1gvvz4p/forensic_audit_of_the_us_presidential_election_is/
house,democrats,Ideological Politics,481054,California Democrats are on the verge of flipping another GOP House district,113,3,No,No,0,https://www.sfgate.com/politics/article/calif-democrats-could-flip-orange-county-seat-19926051.php,/r/democrats/comments/1gw0xc7/california_democrats_are_on_the_verge_of_flipping/
trump,democrats,Ideological Politics,481054,Interesting Read About a Trojan Horse ,169,51,No,No,0,https://i.redd.it/ngpkk9a4q32e1.jpeg,/r/democrats/comments/1gvwqdg/interesting_read_about_a_trojan_horse/
senate,democrats,Ideological Politics,481054,"Do you predict democrats to regain the senate in 2026 and if so, how?",274,361,No,No,0,https://i.redd.it/lctqcuaru22e1.png,/r/democrats/comments/1gvsgm2/do_you_predict_democrats_to_regain_the_senate_in/
trump,democrats,Ideological Politics,481054,"Trump Picks Linda McMahon, Named in WWE Abuse Case, to Run Education Dept.",237,88,No,No,0,https://www.rollingstone.com/politics/politics-news/trump-linda-mcmahon-education-secretary-wwe-lawsuit-1235173119/,/r/democrats/comments/1gvpo0b/trump_picks_linda_mcmahon_named_in_wwe_abuse_case/
trump,democrats,Ideological Politics,481054,Trump Accidentally Helps Dems Get Key Judicial Nominees Approved by Taking Republicans to Watch SpaceX Launch,62,8,No,No,0,https://www.ibtimes.com/trump-accidentally-helps-dems-get-key-judicial-nominees-approved-taking-republicans-watch-spacex-3751915,/r/democrats/comments/1gvzbt6/trump_accidentally_helps_dems_get_key_judicial/
house,democrats,Ideological Politics,481054,"Just 314 votes separate candidates in one of nation’s closest House races, with more ballots to go — Democrat Derek Tran is leading Republican Rep. Michelle Steel [45th District, Orange County]",89,6,No,No,0,https://www.latimes.com/politics/story/2024-11-19/michelle-steel-derek-tran-ca45-congressional-race-votes-close,/r/democrats/comments/1gvvrkw/just_314_votes_separate_candidates_in_one_of/
trump,democrats,Ideological Politics,481054,Trump will damage this country beyond repair ,526,129,No,No,0,https://i.redd.it/ppci04bvtz1e1.png,/r/democrats/comments/1gvii3s/trump_will_damage_this_country_beyond_repair/
house,Republican,Ideological Politics,205954,House Speaker Mike Johnson declared Wednesday that women’s facilities in the Capitol complex are reserved for biological females ✅,208,45,No,No,0,https://nypost.com/2024/11/20/us-news/transgender-people-banned-from-capitol-bathrooms-that-match-their-gender-identity-house-speaker-johnson-declares/,/r/Republican/comments/1gvweb8/house_speaker_mike_johnson_declared_wednesday/
trump,Republican,Ideological Politics,205954,FEMA Chief on the Congressional Hotseat Trying to Explain Why the Agency Bypassed Trump Supporters ,75,18,No,No,0,https://pjmedia.com/rick-moran/2024/11/20/fema-chief-on-the-congressional-hotseat-trying-to-explain-why-trump-supporting-homes-were-bypassed-n4934463#google_vignette,/r/Republican/comments/1gvsfug/fema_chief_on_the_congressional_hotseat_trying_to/
trump,Republican,Ideological Politics,205954,These women really think that r*pe will escalate under Trump. What a sad way to live.,563,339,No,No,0,https://www.reddit.com/gallery/1gvgz6w,/r/Republican/comments/1gvgz6w/these_women_really_think_that_rpe_will_escalate/
biden,Republican,Ideological Politics,205954,"Democrats Push Through Biden's Leftist Judicial Nominees After Multiple Republican Senators Fail to Show Up | Do Better People, Step Up Or Step Aside 😡",38,1,No,No,0,https://www.westernjournal.com/democrats-push-bidens-leftist-judicial-nominees-multiple-republican-senators-fail-show/,/r/Republican/comments/1gvx8tm/democrats_push_through_bidens_leftist_judicial/
trump,Republican,Ideological Politics,205954,Ellen DeGenres is moving to the UK following Trumps election win.,10,5,No,No,0,https://www.dailymail.co.uk/tvshowbiz/article-14107471/amp/Ellen-DeGeneres-Portia-Rossi-moving-ENGLAND-Trump-win-latest-stars-flee-US.html,/r/Republican/comments/1gw2ed4/ellen_degenres_is_moving_to_the_uk_following/
trump,Republican,Ideological Politics,205954,He used to work for Clinton. Here's why he votes for Trump now. ,11,1,No,No,0,https://libertyaffair.com/2024/11/13/how-a-former-clinton-motorcade-driver-ended-up-voting-for-trump-in-2024/,/r/Republican/comments/1gw0sky/he_used_to_work_for_clinton_heres_why_he_votes/
trump,Republican,Ideological Politics,205954,BREAKING: JD Vance Confirms Trump Is Interviewing Candidates to Replace Christopher Wray as FBI Director,487,39,No,No,0,https://conservativeroof.com/jd-vance-confirms-trump-is-interviewing-candidates-to-replace-christopher-wray-as-fbi-director/,/r/Republican/comments/1gvbyrx/breaking_jd_vance_confirms_trump_is_interviewing/
trump,Conservative,Ideological Politics,1149792,'Donald Trump’s mass deportation plans will save America billions',648,104,No,No,0,https://www.telegraph.co.uk/us/comment/2024/11/20/donald-trumps-mass-deportation-plans-will-save-america-bill/,/r/Conservative/comments/1gvuaii/donald_trumps_mass_deportation_plans_will_save/
trump,Conservative,Ideological Politics,1149792,"Texas offers Trump 1,400 acres for 'largest deportation of violent criminals' in U.S. history",443,53,No,No,0,https://justthenews.com/government/white-house/texas-offers-trump-1400-acres-largest-deportation-violent-criminals-us,/r/Conservative/comments/1gvwy1y/texas_offers_trump_1400_acres_for_largest/
loss,Conservative,Ideological Politics,1149792,Kamala Harris escapes to Hawaii as Democrats reel from 2024 losses - Washington Examiner,660,200,No,No,0,https://www.washingtonexaminer.com/news/white-house/3235554/kamala-harris-escapes-hawaii-democrats-reel-2024-losses/,/r/Conservative/comments/1gvrjsh/kamala_harris_escapes_to_hawaii_as_democrats_reel/
biden,Conservative,Ideological Politics,1149792,Republicans seek to revoke security clearances for ex-intel officials over Hunter Biden laptop case,623,35,No,No,0,https://www.washingtontimes.com/news/2024/nov/13/republicans-seek-revoke-security-clearances-ex-int/,/r/Conservative/comments/1gvnc2a/republicans_seek_to_revoke_security_clearances/
trump,Conservative,Ideological Politics,1149792,More Hilariousness From the Left: 'We Will Not Buy Anything for Four Years' to Tank Trump Economy,393,249,No,No,0,https://redstate.com/beckynoble/2024/11/19/more-hilariousness-from-the-left-we-will-not-buy-anything-for-four-years-to-tank-trump-economy-n2182201,/r/Conservative/comments/1gvpm8g/more_hilariousness_from_the_left_we_will_not_buy/
biden,Conservative,Ideological Politics,1149792,Biden administration tells Ukraine they can keep $4.65B they were supposed to pay back to the U.S. - Congressman Rosendale,141,14,No,No,0,https://x.com/EricLDaugh/status/1859268635425919263,/r/Conservative/comments/1gvwblh/biden_administration_tells_ukraine_they_can_keep/
trump,Conservative,Ideological Politics,1149792,"Trump’s Border Czar to Prioritize Locating 300,000 Unaccounted-For Children",409,35,No,No,0,https://www.theepochtimes.com/us/trumps-border-czar-to-prioritize-locating-300000-unaccounted-for-children-5762418,/r/Conservative/comments/1gvo974/trumps_border_czar_to_prioritize_locating_300000/
president,Libertarian,Ideological Politics,503624,Lex Friedman interviews Javier Milei: President of Argentina,96,14,Yes,No,0,https://youtu.be/8NLzc9kobDk?si=Clw18RIyD4X04IHP,/r/Libertarian/comments/1gv927s/lex_friedman_interviews_javier_milei_president_of/
biden,Libertarian,Ideological Politics,503624,"Biden approves antipersonnel mines for Ukraine, undoing his own policy",141,41,No,No,0,https://www.washingtonpost.com/national-security/2024/11/19/biden-landmines-ukraine-russia/,/r/Libertarian/comments/1gvevfw/biden_approves_antipersonnel_mines_for_ukraine/
president,Libertarian,Ideological Politics,503624,"Javier Milei created a security agency to implement AI-driven ""pre-crime"" to monitor citizens",47,12,No,No,0,https://www.reddit.com/r/Libertarian/comments/1gvg8lc/javier_milei_created_a_security_agency_to/,/r/Libertarian/comments/1gvg8lc/javier_milei_created_a_security_agency_to/
vance,Anarchism,Ideological Politics,271367,linguistic anthropology resources?,3,1,No,No,0,https://www.reddit.com/r/Anarchism/comments/1gv8hmv/linguistic_anthropology_resources/,/r/Anarchism/comments/1gv8hmv/linguistic_anthropology_resources/
trump,Anarchism,Ideological Politics,271367,"If we let Donald Trump and Stephen Miller expand the infrastructure of state violence, involving the military and building ""vast holding facilities,"" they will not stop at deporting undocumented immigrants.",309,18,No,No,0,/r/CrimethInc/comments/1gudw7r/if_we_let_donald_trump_and_stephen_miller_expand/,/r/Anarchism/comments/1gudwk4/if_we_let_donald_trump_and_stephen_miller_expand/
house,Socialism,Ideological Politics,461337,🏳️‍⚧️🗣️ When Trans Youth Are Under Attack: STAND UP & FIGHT BACK! Join the PSL for a rally at the Statehouse to fight back against the Ohio Congress and Gov. DeWine passing a bill that attacks trans rights and trans youth! ,60,2,No,No,0,https://i.redd.it/2ljowaqc632e1.jpeg,/r/socialism/comments/1gvu007/when_trans_youth_are_under_attack_stand_up_fight/
house,Socialism,Ideological Politics,461337,"Black Alliance for Peace: No Matter Who Sits in the White Peoples’ House, the War Being Waged by the U.S. Colonial/Capitalist Class Against the Black Colonized Working Class and All Oppressed Peoples and Nations Will Continue",50,1,No,No,0,https://www.blackagendareport.com/no-matter-who-sits-white-peoples-house-war-being-waged-us-colonialcapitalist-class-against-black,/r/socialism/comments/1gvq007/black_alliance_for_peace_no_matter_who_sits_in/
trump,Socialism,Ideological Politics,461337,Linda McMahon for Secretary...of Education? ➡️ WWE co-founder Linda McMahon is part of a long tradition of ultra-rich individuals with no professional qualifications whatsoever taking up the destruction of public education essentially as a personal hobby. ,6,1,No,No,0,https://www.reddit.com/gallery/1gw0zrs,/r/socialism/comments/1gw0zrs/linda_mcmahon_for_secretaryof_education_wwe/
president,Socialism,Ideological Politics,461337,US recognises Venezuelan opposition leader Gonzalez as president-elect,258,42,No,No,0,https://www.aljazeera.com/news/2024/11/19/us-recognises-venezuelan-opposition-leader-gonzalez-as-president-elect,/r/socialism/comments/1gve0rg/us_recognises_venezuelan_opposition_leader/
trump,Socialism,Ideological Politics,461337,Trump tells us that the reason it’s so hard to find a good job or an affordable home is that immigrant workers have taken them – lies to let the real guilty parties off the hook.,3,0,No,No,0,https://www.reddit.com/gallery/1gw2bp8,/r/socialism/comments/1gw2bp8/trump_tells_us_that_the_reason_its_so_hard_to/
trump,Progressive,Ideological Politics,78121,"Despite Trump’s Win, School Vouchers Were Again Rejected by Majorities of Voters",1,0,No,No,0,https://www.propublica.org/article/school-vouchers-2024-election-trump,/r/progressive/comments/1guls4r/despite_trumps_win_school_vouchers_were_again/
vance,Progressive,Ideological Politics,78121,Brown not ruling out run for remainder of Vance’s Senate term,1,0,No,No,0,https://thehill.com/homenews/campaign/4992997-brown-vance-senate-term-ohio/amp/,/r/progressive/comments/1gtbps2/brown_not_ruling_out_run_for_remainder_of_vances/
trump,Progressive,Ideological Politics,78121,Behind the Curtain: Trump's business bonanza,17,2,No,No,0,https://www.axios.com/2024/11/07/trump-elon-musk-business-tax-cuts,/r/progressive/comments/1gm4w17/behind_the_curtain_trumps_business_bonanza/
victory,Progressive,Ideological Politics,78121,Far-Right Donald Trump Supporters Celebrate His Victory with Violent Memes and Calls for Executions,255,14,No,No,0,https://www.wired.com/story/donald-trump-far-right-supporters-violent-memes/,/r/progressive/comments/1glfnyf/farright_donald_trump_supporters_celebrate_his/
trump,Progressive,Ideological Politics,78121,What Trump's first 100 days in office could look like,23,6,No,No,0,https://www.npr.org/2024/11/06/nx-s1-5181800/2024-election-trump-first-100-days-agenda,/r/progressive/comments/1glo04a/what_trumps_first_100_days_in_office_could_look/
trump,Progressive,Ideological Politics,78121,Americans in Puerto Rico can't vote for US president. Their anger at Trump is shaping the race.,347,33,No,No,0,https://apnews.com/article/puerto-rico-trump-joke-garbage-a91e2aafd93a06d32365efa013581b85,/r/progressive/comments/1gh2ab4/americans_in_puerto_rico_cant_vote_for_us/
results,Republicanism,Ideological Politics,916,Survey about your political worldview (18+; 12-14 mins to complete),3,0,No,No,0,https://www.reddit.com/r/republicanism/comments/1aq418a/survey_about_your_political_worldview_18_1214/,/r/republicanism/comments/1aq418a/survey_about_your_political_worldview_18_1214/
house,Republicanism,Ideological Politics,916,Meet Susanna Gibson: Virginia Democrat in key state House race calls sharing of pornographic videos ‘the worst gutter politics’,2,0,No,No,0,https://www.celebsweek.com/susanna-gibson/,/r/republicanism/comments/16hfi9k/meet_susanna_gibson_virginia_democrat_in_key/
president,Republicanism,Ideological Politics,916,About the Lopez,4,2,No,No,0,https://www.reddit.com/r/republicanism/comments/1094bh5/about_the_lopez/,/r/republicanism/comments/1094bh5/about_the_lopez/
senate,Conservatives,Ideological Politics,108298,Pro-Palestine Protesters Make Insurrection-y Incursion Into Senate Office Building,102,11,No,No,0,https://redstate.com/wardclark/2024/11/19/pro-palestine-protesters-make-insurrection-y-incursion-into-senate-office-building-n2182190,/r/conservatives/comments/1gvs55x/propalestine_protesters_make_insurrectiony/
trump,Conservatives,Ideological Politics,108298,"Trump Reportedly Has a Radical Plan for Accountability on Afghanistan, and the Press Are Seeing Red",170,18,No,No,0,https://redstate.com/bonchie/2024/11/19/trump-reportedly-has-a-radical-plan-for-accountability-on-afghanistan-and-the-press-are-furious-n2182215,/r/conservatives/comments/1gvort6/trump_reportedly_has_a_radical_plan_for/
trump,Conservatives,Ideological Politics,108298,Travesty: Elderly Vet Told to Remove Trump Signs or FEMA Officials Would View Him As ‘Domestic Terrorist’,127,6,No,No,0,https://redstate.com/rusty-weiss/2024/11/19/bombshell-elderly-vet-told-to-remove-trump-signs-concerned-fema-would-view-him-as-domestic-terrorist-n2182216,/r/conservatives/comments/1gvor3v/travesty_elderly_vet_told_to_remove_trump_signs/
