Keyword,Subreddit,Category,Members,Title,Upvotes,Comments,Moderator Interaction,Fact-Checking Mention,Total Awards,URL,Original Post URL
results,Wikileaks,General Politics,177643,Censored Wikileaks content?,13,7,No,No,0,https://www.reddit.com/r/WikiLeaks/comments/1frr2wq/censored_wikileaks_content/,/r/WikiLeaks/comments/1frr2wq/censored_wikileaks_content/
biden,News,General Politics,28946146,"In a first, Biden allows Ukraine to strike Russia with U.S. long-range weapons",425,97,No,No,0,https://www.npr.org/2024/11/17/nx-s1-5194432/biden-long-range-missiles-russia-ukraine-war,/r/news/comments/1gtpsz3/in_a_first_biden_allows_ukraine_to_strike_russia/
trump,PoliticalDiscussion,General Politics,2184614,Will kidnapped ukrainian children ever be brought back home?,3,12,No,No,0,https://www.reddit.com/r/PoliticalDiscussion/comments/1gtqoi5/will_kidnapped_ukrainian_children_ever_be_brought/,/r/PoliticalDiscussion/comments/1gtqoi5/will_kidnapped_ukrainian_children_ever_be_brought/
biden,PoliticalDiscussion,General Politics,2184614,"Is the fear and pearl clutching about the second Trump administration warranted, or are those fears overblown? ",328,986,No,No,0,https://www.reddit.com/r/PoliticalDiscussion/comments/1gstbge/is_the_fear_and_pearl_clutching_about_the_second/,/r/PoliticalDiscussion/comments/1gstbge/is_the_fear_and_pearl_clutching_about_the_second/
loss,PoliticalDiscussion,General Politics,2184614,What kind of “energy” would a female politician have to possess to have a shot at the White House?,123,494,No,No,0,https://www.reddit.com/r/PoliticalDiscussion/comments/1gsvz2j/what_kind_of_energy_would_a_female_politician/,/r/PoliticalDiscussion/comments/1gsvz2j/what_kind_of_energy_would_a_female_politician/
trump,PoliticalDiscussion,General Politics,2184614,"According to the democracy index, the United States counts as a “deficient democracy” as of 2020. Do you think that this is a fixable issue or are we on a permanent path to collapse? ",146,203,No,No,0,https://www.reddit.com/r/PoliticalDiscussion/comments/1gsuqox/according_to_the_democracy_index_the_united/,/r/PoliticalDiscussion/comments/1gsuqox/according_to_the_democracy_index_the_united/
senate,PoliticalDiscussion,General Politics,2184614,Should more Independents run for senate in solid red states?,1,1,No,No,0,https://www.reddit.com/r/PoliticalDiscussion/comments/1gtkt5i/should_more_independents_run_for_senate_in_solid/,/r/PoliticalDiscussion/comments/1gtkt5i/should_more_independents_run_for_senate_in_solid/
biden,PoliticalDiscussion,General Politics,2184614,Would Biden have won the Presidency?,0,67,No,No,0,https://www.reddit.com/r/PoliticalDiscussion/comments/1gteztp/would_biden_have_won_the_presidency/,/r/PoliticalDiscussion/comments/1gteztp/would_biden_have_won_the_presidency/
trump,PoliticalDiscussion,General Politics,2184614,Will the Senate reject Pete Hegseth?,309,429,No,No,0,https://www.reddit.com/r/PoliticalDiscussion/comments/1gs9c73/will_the_senate_reject_pete_hegseth/,/r/PoliticalDiscussion/comments/1gs9c73/will_the_senate_reject_pete_hegseth/
outcome,PoliticalDiscussion,General Politics,2184614,What is the likely outcome of the 2026 US Senate elections?,79,204,No,No,0,https://www.reddit.com/r/PoliticalDiscussion/comments/1gs628t/what_is_the_likely_outcome_of_the_2026_us_senate/,/r/PoliticalDiscussion/comments/1gs628t/what_is_the_likely_outcome_of_the_2026_us_senate/
supreme court,PoliticalDiscussion,General Politics,2184614,Should the both United States Congress and Supreme Courts have term limits?,92,85,No,No,0,https://www.reddit.com/r/PoliticalDiscussion/comments/1gs3gqg/should_the_both_united_states_congress_and/,/r/PoliticalDiscussion/comments/1gs3gqg/should_the_both_united_states_congress_and/
victory,PoliticalDiscussion,General Politics,2184614,Would Americans prioritize democracy over party loyalty in the long term?,52,116,No,No,0,https://www.reddit.com/r/PoliticalDiscussion/comments/1gs3lro/would_americans_prioritize_democracy_over_party/,/r/PoliticalDiscussion/comments/1gs3lro/would_americans_prioritize_democracy_over_party/
results,NeutralPolitics,General Politics,610736,What to expect after the U.S. election,280,26,Yes,Yes,0,https://www.reddit.com/r/NeutralPolitics/comments/1gflxpk/what_to_expect_after_the_us_election/,/r/NeutralPolitics/comments/1gflxpk/what_to_expect_after_the_us_election/
house,NeutralPolitics,General Politics,610736,Tracking what bills/decisions are coming to contact reps/senators in a timely manner,36,12,No,No,0,https://www.reddit.com/r/NeutralPolitics/comments/1gqkpdp/tracking_what_billsdecisions_are_coming_to/,/r/NeutralPolitics/comments/1gqkpdp/tracking_what_billsdecisions_are_coming_to/
loss,NeutralPolitics,General Politics,610736,Do any countries have laws to combat politically-driven misinformation?,34,38,No,Yes,0,https://www.reddit.com/r/NeutralPolitics/comments/1gq4agt/do_any_countries_have_laws_to_combat/,/r/NeutralPolitics/comments/1gq4agt/do_any_countries_have_laws_to_combat/
results,NeutralPolitics,General Politics,610736,Trump won the presidency and popular vote running on the mass deportation of illegal aliens. Who saw this coming and what lessons can be learned?,225,326,No,No,0,https://www.reddit.com/r/NeutralPolitics/comments/1gnk7ih/trump_won_the_presidency_and_popular_vote_running/,/r/NeutralPolitics/comments/1gnk7ih/trump_won_the_presidency_and_popular_vote_running/
results,NeutralPolitics,General Politics,610736,Is now the time for a NEW moderate third party in U.S. politics?,3,80,No,No,0,https://www.reddit.com/r/NeutralPolitics/comments/1gms9so/is_now_the_time_for_a_new_moderate_third_party_in/,/r/NeutralPolitics/comments/1gms9so/is_now_the_time_for_a_new_moderate_third_party_in/
harris,NeutralPolitics,General Politics,610736,Why Are So Many Men Leaving The Democratic Party Over The Last Few Years?,389,156,No,No,0,https://www.reddit.com/r/NeutralPolitics/comments/1gklb9t/why_are_so_many_men_leaving_the_democratic_party/,/r/NeutralPolitics/comments/1gklb9t/why_are_so_many_men_leaving_the_democratic_party/
trump,NeutralPolitics,General Politics,610736,What plans about trump and kamala have on section 8 housing and dept of edu.,1,11,No,No,0,https://www.reddit.com/r/NeutralPolitics/comments/1gk1emp/what_plans_about_trump_and_kamala_have_on_section/,/r/NeutralPolitics/comments/1gk1emp/what_plans_about_trump_and_kamala_have_on_section/
outcome,NeutralPolitics,General Politics,610736,"What are the pros and cons of predictive election models, like 538, for our discourse around elections?",42,94,No,No,0,https://www.reddit.com/r/NeutralPolitics/comments/1giqib5/what_are_the_pros_and_cons_of_predictive_election/,/r/NeutralPolitics/comments/1giqib5/what_are_the_pros_and_cons_of_predictive_election/
harris,NeutralPolitics,General Politics,610736,How do the Trump and Harris plans for workforce pay and taxes compare?,2,6,No,No,0,https://www.reddit.com/r/NeutralPolitics/comments/1ggxh8w/how_do_the_trump_and_harris_plans_for_workforce/,/r/NeutralPolitics/comments/1ggxh8w/how_do_the_trump_and_harris_plans_for_workforce/
biden,moderatepolitics,General Politics,296653,"Biden approves Ukraine’s use of long-range U.S. weapons inside Russia, reversing policy",150,128,No,No,0,https://www.washingtonpost.com/national-security/2024/11/17/ukraine-russia-north-korea-atacms/,/r/moderatepolitics/comments/1gtkw36/biden_approves_ukraines_use_of_longrange_us/
harris,moderatepolitics,General Politics,296653,How Kamala Harris Burned Through $1.5 Billion in 15 Weeks,186,238,No,No,0,https://www.nytimes.com/2024/11/17/us/politics/harris-campaign-finances.html?smid=nytcore-ios-share&referringSource=articleShare,/r/moderatepolitics/comments/1gthj97/how_kamala_harris_burned_through_15_billion_in_15/
trump,moderatepolitics,General Politics,296653,Trump sues for billions from media he says is biased against him | Donald Trump,39,50,No,No,0,https://www.theguardian.com/us-news/2024/nov/15/trump-sues-media-outlets-bias,/r/moderatepolitics/comments/1gtkvcd/trump_sues_for_billions_from_media_he_says_is/
trump,moderatepolitics,General Politics,296653,"Opinion - I Hate Trump, but I'm Glad He Won",56,318,No,No,0,https://thehill.com/opinion/campaign/4991749-i-hate-trump-but-im-glad-he-won/,/r/moderatepolitics/comments/1gthvpz/opinion_i_hate_trump_but_im_glad_he_won/
trump,moderatepolitics,General Politics,296653,John Fetterman says Democrats need to stop 'freaking out' over everything Trump does,970,476,No,No,0,https://www.nbcnews.com/politics/2024-election/john-fetterman-says-democrats-need-stop-freaking-everything-trump-rcna180270,/r/moderatepolitics/comments/1gsih6z/john_fetterman_says_democrats_need_to_stop/
biden,moderatepolitics,General Politics,296653,Democrats in Congress urge Biden to sanction Israelis over West Bank violence,72,163,No,No,0,https://www.reuters.com/world/us/democrats-congress-urge-biden-sanction-israelis-over-west-bank-violence-2024-11-14/,/r/moderatepolitics/comments/1gsvqjf/democrats_in_congress_urge_biden_to_sanction/
biden,technology,General Politics,17413915,"Biden, Xi agree that humans, not AI, should control nuclear arms",10051,416,No,No,0,https://www.reuters.com/world/biden-xi-agreed-that-humans-not-ai-should-control-nuclear-weapons-white-house-2024-11-16/,/r/technology/comments/1gtfad6/biden_xi_agree_that_humans_not_ai_should_control/
trump,technology,General Politics,17413915,Trump picks fracking firm CEO Chris Wright to be energy secretary,25379,2209,No,No,0,https://www.washingtonpost.com/politics/2024/11/16/energy-secretary-trump-chris-wright/,/r/technology/comments/1gt2u3v/trump_picks_fracking_firm_ceo_chris_wright_to_be/
biden,democrats,Ideological Politics,480950,Biden Allows Critical Aid to Ukraine Ahead of Incoming Trump Administration,1102,134,No,No,0,https://i.redd.it/1bwja099ii1e1.jpeg,/r/democrats/comments/1gtl9e0/biden_allows_critical_aid_to_ukraine_ahead_of/
trump,democrats,Ideological Politics,480950,Mandate? Latest vote count shows Trump falling below 50% versus Democrats,1313,154,No,No,0,https://talkingpointsmemo.com/edblog/annals-of-mandates,/r/democrats/comments/1gtdnm2/mandate_latest_vote_count_shows_trump_falling/
trump,democrats,Ideological Politics,480950,"'We can't come together': Trump voters win election, lose family and friends as values clash",316,84,No,No,0,https://v.redd.it/utu4zd1tdi1e1,/r/democrats/comments/1gtkq50/we_cant_come_together_trump_voters_win_election/
house,democrats,Ideological Politics,480950,House election thoughts ,152,134,No,No,0,https://www.reddit.com/gallery/1gtnomz,/r/democrats/comments/1gtnomz/house_election_thoughts/
harris,democrats,Ideological Politics,480950,Misogyny is more deep rooted in US ,533,141,No,Yes,0,https://www.theatlantic.com/magazine/archive/2024/01/trump-sexual-abuse-misogyny-women/676124/,/r/democrats/comments/1gtcwce/misogyny_is_more_deep_rooted_in_us/
electoral,democrats,Ideological Politics,480950,"1984 General election electoral map . 49 states went red . Ronald Reagan defeated Walter Mondale. The only state Mondale won, was his home state of Minnesota. Mondale’s running mate , Geraldine Ferraro, was the 1st ever female running mate in US History ",28,7,No,No,0,https://i.redd.it/8vq58ybgmj1e1.jpeg,/r/democrats/comments/1gtqc5i/1984_general_election_electoral_map_49_states/
trump,democrats,Ideological Politics,480950,Trump transition team compiling list of current and former U.S. military officers for possible courts-martial,86,7,No,No,0,https://www.nbcnews.com/politics/politics-news/trump-transition-team-compiling-list-current-former-us-military-office-rcna180489,/r/democrats/comments/1gtfyyt/trump_transition_team_compiling_list_of_current/
trump,democrats,Ideological Politics,480950,"Maddow on Trump’s cabinet choices: ‘It's meant to shock us, and adjust our sense of what is normal’",732,55,No,No,0,https://v.redd.it/eoxtj6h4wd1e1,/r/democrats/comments/1gt50dx/maddow_on_trumps_cabinet_choices_its_meant_to/
biden,democrats,Ideological Politics,480950,Biden allows Ukraine to use US arms to strike inside Russia,35,4,No,No,0,https://www.reuters.com/world/biden-lifts-ban-ukraine-using-us-arms-strike-inside-russia-2024-11-17/,/r/democrats/comments/1gtldzl/biden_allows_ukraine_to_use_us_arms_to_strike/
trump,democrats,Ideological Politics,480950,Republicans float Lara Trump to fill Rubio’s Senate seat,24,7,No,No,0,https://www.wlrn.org/government-politics/2024-11-15/republicans-float-lara-trump-to-fill-rubios-senate-seat,/r/democrats/comments/1gtn3av/republicans_float_lara_trump_to_fill_rubios/
biden,Republican,Ideological Politics,205766,Biden Allows Ukraine to Strike Russia With Long-Range U.S. Missiles,160,74,No,No,0,https://www.nytimes.com/2024/11/17/us/politics/biden-ukraine-russia-atacms-missiles.html,/r/Republican/comments/1gtmuiy/biden_allows_ukraine_to_strike_russia_with/
vance,Republican,Ideological Politics,205766,This is great news. ,68,40,No,No,0,https://news.mit.edu/2024/mit-engineers-make-converting-co2-into-products-more-practical-1113,/r/Republican/comments/1gte8sp/this_is_great_news/
trump,Republican,Ideological Politics,205766,Maybe this is the reason for Trump creating DOGE and unleashing Elon and Vivek…,47,6,No,No,0,https://www.foxnews.com/politics/pentagon-fails-7th-audit-row-unable-fully-account-824b-budget,/r/Republican/comments/1gtfnh3/maybe_this_is_the_reason_for_trump_creating_doge/
harris,Republican,Ideological Politics,205766,Horrible Harris's Campaign Spent $12 Million on Private Jets | You Can Bet Greta Thunberg Is Not A Happy Camper 😁,223,21,No,No,0,https://www.breitbart.com/2024-election/2024/11/16/https-www-breitbart-com-politics-2024-11-16-trump-selects-energy-executive-chris-wright-to-serve-as-u-s-secretary-of-energy/,/r/Republican/comments/1gt72f7/horrible_harriss_campaign_spent_12_million_on/
trump,Republican,Ideological Politics,205766,Power Lesbian Murders Father in Seattle Over Trump’s Re-Election ,304,95,No,No,0,https://www.hindustantimes.com/world-news/us-news/triggered-by-donald-trumps-victory-seattle-woman-brutally-kills-father-with-ice-axe-on-election-night-101731567554842-amp.html,/r/Republican/comments/1gt4j2w/power_lesbian_murders_father_in_seattle_over/
trump,Republican,Ideological Politics,205766,"Soyboy Murders Wife, Ex-Girlfriend, and his Two Sons, Then Turns Gun on Himself over Trump Winning Re-election",131,31,No,No,0,https://nypost.com/2024/11/10/us-news/minn-dad-anthony-nephew-ranted-against-trump-killed-family-in-murder-suicide/,/r/Republican/comments/1gt4jyd/soyboy_murders_wife_exgirlfriend_and_his_two_sons/
trump,Republican,Ideological Politics,205766,"The New York Times: Trump’s Cabinet Picks, Panned in Washington, Thrill Many of His Voters",33,1,No,No,0,https://www.nytimes.com/2024/11/16/us/trump-cabinet-picks-voter-reactions.html,/r/Republican/comments/1gt8jsw/the_new_york_times_trumps_cabinet_picks_panned_in/
house,Republican,Ideological Politics,205766,NASA Staff Ask Elon to ‘Clean House’ After Cash Lavished on DEI,189,30,No,No,0,https://pjmedia.com/catherinesalgado/2024/11/16/nasa-staff-ask-elon-to-clean-house-after-cash-lavished-on-dei-n4934361,/r/Republican/comments/1gsxrz3/nasa_staff_ask_elon_to_clean_house_after_cash/
victory,Republican,Ideological Politics,205766,Trump whitehouse.gov bio:,54,10,No,No,0,https://www.reddit.com/gallery/1gt59d2,/r/Republican/comments/1gt59d2/trump_whitehousegov_bio/
trump,Conservative,Ideological Politics,1148471,TRUMP LITERALLY WON THE FELON VOTE LMAOOOO,392,39,No,No,0,https://i.redd.it/95e1p43hti1e1.jpeg,/r/Conservative/comments/1gtmoyo/trump_literally_won_the_felon_vote_lmaoooo/
trump,Conservative,Ideological Politics,1148471,Jon Jones doing the Trump dance after knocking out an old Stipe Miocic and ducking Tom Aspinall ,2595,213,No,No,0,https://v.redd.it/u9asr59asf1e1,/r/Conservative/comments/1gtajj0/jon_jones_doing_the_trump_dance_after_knocking/
biden,Conservative,Ideological Politics,1148471,Biden authorizes Ukraine to use US long-range missiles to strike inside Russia: report ,473,175,No,No,0,https://www.reddit.com/r/Conservative/comments/1gtkkbh/biden_authorizes_ukraine_to_use_us_longrange/,/r/Conservative/comments/1gtkkbh/biden_authorizes_ukraine_to_use_us_longrange/
trump,Conservative,Ideological Politics,1148471,Schiff: Trump Wants to Use the Military Against Me,528,236,No,No,0,https://www.breitbart.com/clips/2024/11/17/schiff-trump-wants-to-use-the-military-against-me/,/r/Conservative/comments/1gtjfkh/schiff_trump_wants_to_use_the_military_against_me/
harris,Conservative,Ideological Politics,1148471,"Kamala Harris’s campaign spent $24,000 on Uber Eats and ice creams, filings show, amid questions about how the party blew $1.5 billion on a failed election",676,236,No,No,0,https://www.telegraph.co.uk/us/politics/2024/11/16/harris-campaign-spent-24k-uber-eats-ice-cream/,/r/Conservative/comments/1gteyip/kamala_harriss_campaign_spent_24000_on_uber_eats/
trump,Conservative,Ideological Politics,1148471,Trump gives RFK Jr McDonald’s that the next health secretary prvciosuly described as ‘poison’ to eat on private plane,558,187,No,No,0,https://i.redd.it/jpth1c7mug1e1.jpeg,/r/Conservative/comments/1gtdvig/trump_gives_rfk_jr_mcdonalds_that_the_next_health/
victory,Conservative,Ideological Politics,1148471,‘Family Ties’ Star Justine Bateman Says Trump Victory Removed ‘Suffocating Cloud’ on Free Speech: ‘We Went 1984 on Ourselves’ Under Biden,182,6,No,No,0,https://www.breitbart.com/entertainment/2024/11/17/family-ties-star-justine-bateman-says-trump-victory-removed-suffocating-cloud-on-free-speech-we-went-1984-on-ourselves-under-biden/,/r/Conservative/comments/1gthrkv/family_ties_star_justine_bateman_says_trump/
trump,Conservative,Ideological Politics,1148471,"President-elect Donald Trump receives huge applause during UFC 309 (ft Mike Johnson, Elon Musk, RFK Jr)",2051,379,No,No,0,https://v.redd.it/4kmood8yqd1e1,/r/Conservative/comments/1gt4gvq/presidentelect_donald_trump_receives_huge/
senate,Libertarian,Ideological Politics,503673,What are your thoughts on Tulsi Gabbard possibly becoming Director of National Intelligence if she doesn’t get blocked by the Senate?,50,45,No,No,0,https://www.reddit.com/r/Libertarian/comments/1gto80x/what_are_your_thoughts_on_tulsi_gabbard_possibly/,/r/Libertarian/comments/1gto80x/what_are_your_thoughts_on_tulsi_gabbard_possibly/
president,Socialism,Ideological Politics,461135,CNN doesn’t list Claudia De la Cruz as a 2024 Presidential Candidate ,324,17,No,No,0,https://edition.cnn.com/interactive/2024/politics/presidential-candidates-dg/,/r/socialism/comments/1gtb3dn/cnn_doesnt_list_claudia_de_la_cruz_as_a_2024/
outcome,Socialism,Ideological Politics,461135,"Anyone else pissed off when they hear the term ""political polarization""",19,4,No,Yes,0,https://www.reddit.com/r/socialism/comments/1gtnqp1/anyone_else_pissed_off_when_they_hear_the_term/,/r/socialism/comments/1gtnqp1/anyone_else_pissed_off_when_they_hear_the_term/
trump,Progressive,Ideological Politics,78097,Behind the Curtain: Trump's business bonanza,16,2,No,No,0,https://www.axios.com/2024/11/07/trump-elon-musk-business-tax-cuts,/r/progressive/comments/1gm4w17/behind_the_curtain_trumps_business_bonanza/
victory,Progressive,Ideological Politics,78097,Far-Right Donald Trump Supporters Celebrate His Victory with Violent Memes and Calls for Executions,249,14,No,No,0,https://www.wired.com/story/donald-trump-far-right-supporters-violent-memes/,/r/progressive/comments/1glfnyf/farright_donald_trump_supporters_celebrate_his/
trump,Progressive,Ideological Politics,78097,What Trump's first 100 days in office could look like,23,6,No,No,0,https://www.npr.org/2024/11/06/nx-s1-5181800/2024-election-trump-first-100-days-agenda,/r/progressive/comments/1glo04a/what_trumps_first_100_days_in_office_could_look/
trump,Progressive,Ideological Politics,78097,Americans in Puerto Rico can't vote for US president. Their anger at Trump is shaping the race.,344,32,No,No,0,https://apnews.com/article/puerto-rico-trump-joke-garbage-a91e2aafd93a06d32365efa013581b85,/r/progressive/comments/1gh2ab4/americans_in_puerto_rico_cant_vote_for_us/
results,Republicanism,Ideological Politics,918,Survey about your political worldview (18+; 12-14 mins to complete),3,0,No,No,0,https://www.reddit.com/r/republicanism/comments/1aq418a/survey_about_your_political_worldview_18_1214/,/r/republicanism/comments/1aq418a/survey_about_your_political_worldview_18_1214/
house,Republicanism,Ideological Politics,918,Meet Susanna Gibson: Virginia Democrat in key state House race calls sharing of pornographic videos ‘the worst gutter politics’,2,0,No,No,0,https://www.celebsweek.com/susanna-gibson/,/r/republicanism/comments/16hfi9k/meet_susanna_gibson_virginia_democrat_in_key/
president,Republicanism,Ideological Politics,918,About the Lopez,4,2,No,No,0,https://www.reddit.com/r/republicanism/comments/1094bh5/about_the_lopez/,/r/republicanism/comments/1094bh5/about_the_lopez/
victory,Conservatives,Ideological Politics,108282,‘Family Ties’ Star Justine Bateman Says Trump Victory Removed ‘Suffocating Cloud’ on Free Speech: ‘We Went 1984 on Ourselves’ Under Biden,125,7,No,No,0,https://www.breitbart.com/entertainment/2024/11/17/family-ties-star-justine-bateman-says-trump-victory-removed-suffocating-cloud-on-free-speech-we-went-1984-on-ourselves-under-biden/,/r/conservatives/comments/1gtjeeh/family_ties_star_justine_bateman_says_trump/
trump,Conservatives,Ideological Politics,108282,Schiff: Trump Wants to Use the Military Against Me,97,53,No,No,0,https://www.breitbart.com/clips/2024/11/17/schiff-trump-wants-to-use-the-military-against-me/,/r/conservatives/comments/1gtjfas/schiff_trump_wants_to_use_the_military_against_me/
house,Conservatives,Ideological Politics,108282,'It's a blood bath': Inside the White House blame game as backstabbing staffers and score-settling pundits rock a Democratic Party in crisis,212,27,No,No,0,https://www.dailymail.co.uk/news/article-14085003/white-house-blame-game-blood-bath.html,/r/conservatives/comments/1gtcu5d/its_a_blood_bath_inside_the_white_house_blame/
trump,Conservatives,Ideological Politics,108282,Ramaswamy Expects ‘Mass Reductions’ In Federal Government Under Trump,16,1,No,No,0,https://www.dailywire.com/news/ramaswamy-expects-mass-reductions-in-federal-government-under-trump,/r/conservatives/comments/1gtprdu/ramaswamy_expects_mass_reductions_in_federal/
house,Conservatives,Ideological Politics,108282,House Gaetz Probe Relies On Witnesses DOJ Found Not Credible,44,0,No,No,0,https://thefederalist.com/2024/11/17/house-probe-into-matt-gaetz-relies-on-witnesses-doj-found-lacked-credibility/,/r/conservatives/comments/1gtfikr/house_gaetz_probe_relies_on_witnesses_doj_found/
trump,Conservatives,Ideological Politics,108282,Got a lot of compliments. TRUMP2024!!!,326,21,No,No,0,https://i.redd.it/g3ogucp2wd1e1.png,/r/conservatives/comments/1gt4z1a/got_a_lot_of_compliments_trump2024/
biden,Conservatives,Ideological Politics,108282,Biden Allows Ukraine to Strike Russia With Long-Range U.S. Missiles,14,8,No,No,0,https://www.nytimes.com/2024/11/17/us/politics/biden-ukraine-russia-atacms-missiles.html,/r/conservatives/comments/1gtmv65/biden_allows_ukraine_to_strike_russia_with/
house,Conservatives,Ideological Politics,108282,'It's a blood bath': Inside the White House blame game as backstabbing staffers and score-settling pundits rock a Democratic Party in crisis,31,0,No,No,0,https://www.dailymail.co.uk/news/article-14085003/white-house-blame-game-blood-bath.html,/r/conservatives/comments/1gtctyu/its_a_blood_bath_inside_the_white_house_blame/
trump,Conservatives,Ideological Politics,108282,Markwayne Mullin: Trump’s Nominees Will All Get Same Chance To Be Confirmed,6,1,No,No,0,https://www.dailywire.com/news/markwayne-mullin-trumps-nominees-will-all-get-same-chance-to-be-confirmed,/r/conservatives/comments/1gtps99/markwayne_mullin_trumps_nominees_will_all_get/
trump,dailywire,Ideological Politics,24256,Wall of Hate - Help Document Hatred Against Trump on July13th.com,77,16,Yes,No,0,https://july13th.com/hate/,/r/dailywire/comments/1e3cqx8/wall_of_hate_help_document_hatred_against_trump/
results,dailywire,Ideological Politics,24256,I hope they do levy a challenge.,49,18,No,Yes,0,https://youtu.be/-m5cmNt5x9U?si=e7iPDu3dEWHnhQyB,/r/dailywire/comments/1gs0n9f/i_hope_they_do_levy_a_challenge/
trump,dailywire,Ideological Politics,24256,A murder-suicide because Trump won,164,36,No,No,0,https://nypost.com/2024/11/10/us-news/minn-dad-anthony-nephew-ranted-against-trump-killed-family-in-murder-suicide/,/r/dailywire/comments/1grkks1/a_murdersuicide_because_trump_won/
trump,Liberal,Ideological Politics,119937,"If the Mar-a-Lago documents case is dismissed, Trump could get everything back - and keep it with immunity",120,32,No,No,0,https://www.businessinsider.com/trump-boxes-seized-mar-a-lago-immunity-2024-11,/r/Liberal/comments/1gtdetj/if_the_maralago_documents_case_is_dismissed_trump/
trump,Liberal,Ideological Politics,119937,Gabbard's sympathetic views toward Russia cause alarm as Trump's pick to lead intelligence services,28,4,No,No,0,https://apnews.com/article/gabbard-trump-putin-intelligence-russia-syria-a798adaf9cd531a5d0c9329f7597f0f6,/r/Liberal/comments/1gteen5/gabbards_sympathetic_views_toward_russia_cause/
vance,Liberal,Ideological Politics,119937,Brown not ruling out run for remainder of Vance’s Senate term,28,1,No,No,0,https://thehill.com/homenews/campaign/4992997-brown-vance-senate-term-ohio/amp/,/r/Liberal/comments/1gtbplc/brown_not_ruling_out_run_for_remainder_of_vances/
trump,Liberal,Ideological Politics,119937,I don't ever want to hear conservatives complain about DEI like they actually cared again.,142,21,No,Yes,0,https://www.reddit.com/r/Liberal/comments/1gt2sr8/i_dont_ever_want_to_hear_conservatives_complain/,/r/Liberal/comments/1gt2sr8/i_dont_ever_want_to_hear_conservatives_complain/
