Keyword,Subreddit,Category,Members,Title,Upvotes,Comments,Moderator Interaction,Fact-Checking Mention,Total Awards,URL,Original Post URL
trump,Conservatives,Ideological Politics,108298,More Hilariousness From the Left: 'We Will Not Buy Anything for Four Years' to Tank Trump Economy,106,34,No,No,0,https://redstate.com/beckynoble/2024/11/19/more-hilariousness-from-the-left-we-will-not-buy-anything-for-four-years-to-tank-trump-economy-n2182201,/r/conservatives/comments/1gvplvp/more_hilariousness_from_the_left_we_will_not_buy/
trump,Conservatives,Ideological Politics,108298,"Trump’s Border Czar to Prioritize Locating 300,000 Unaccounted-For Children.",36,1,No,No,0,https://www.theepochtimes.com/us/trumps-border-czar-to-prioritize-locating-300000-unaccounted-for-children-5762418,/r/conservatives/comments/1gvwurh/trumps_border_czar_to_prioritize_locating_300000/
biden,Conservatives,Ideological Politics,108298,NEW: Biden HHS Officials Are Trying to Rig the Game to Stop Trump From Making Changes,78,3,No,No,0,https://redstate.com/bonchie/2024/11/19/new-biden-hhs-officials-are-trying-to-rig-the-game-to-stop-trump-from-making-changes-n2182209,/r/conservatives/comments/1gvphtg/new_biden_hhs_officials_are_trying_to_rig_the/
biden,Conservatives,Ideological Politics,108298,"Parting Shots: Biden Admin Pours American Taxpayer Money Into Gaza, West Bank While Sanctioning Israel",46,2,No,No,0,https://redstate.com/wardclark/2024/11/19/parting-shots-biden-admin-pours-american-taxpayer-money-into-gaza-west-bank-while-sanctioning-israel-n2182185,/r/conservatives/comments/1gvs61b/parting_shots_biden_admin_pours_american_taxpayer/
biden,Conservatives,Ideological Politics,108298,Trump Urges Republican Senators to Block Biden’s Judicial Nominees: ‘Show Up and Hold the Line’,198,28,No,No,0,https://www.breitbart.com/politics/2024/11/19/trump-urges-republican-senators-to-block-bidens-judicial-nominees-show-up-and-hold-the-line/,/r/conservatives/comments/1gveimk/trump_urges_republican_senators_to_block_bidens/
trump,Conservatives,Ideological Politics,108298,‘Don’t Cross That Line’: Trump Border Czar Warns Mayors Against Harboring Illegal Immigrants,93,1,No,No,0,https://www.dailywire.com/news/dont-cross-that-line-trump-border-czar-warns-mayors-against-harboring-illegal-immigrants,/r/conservatives/comments/1gvhtak/dont_cross_that_line_trump_border_czar_warns/
trump,dailywire,Ideological Politics,24273,Wall of Hate - Help Document Hatred Against Trump on July13th.com,79,16,Yes,No,0,https://july13th.com/hate/,/r/dailywire/comments/1e3cqx8/wall_of_hate_help_document_hatred_against_trump/
results,dailywire,Ideological Politics,24273,I hope they do levy a challenge.,50,18,No,Yes,0,https://youtu.be/-m5cmNt5x9U?si=e7iPDu3dEWHnhQyB,/r/dailywire/comments/1gs0n9f/i_hope_they_do_levy_a_challenge/
trump,dailywire,Ideological Politics,24273,A murder-suicide because Trump won,168,39,No,No,0,https://nypost.com/2024/11/10/us-news/minn-dad-anthony-nephew-ranted-against-trump-killed-family-in-murder-suicide/,/r/dailywire/comments/1grkks1/a_murdersuicide_because_trump_won/
house,Liberal,Ideological Politics,119958,"Gaetz sent over $10K in Venmo payments to 2 women who testified in House probe, records suggest",241,13,No,No,0,https://abcnews.go.com/US/gaetz-10k-venmo-payments-2-women-testified-house/story?id=116019367,/r/Liberal/comments/1gvp4r4/gaetz_sent_over_10k_in_venmo_payments_to_2_women/
trump,Liberal,Ideological Politics,119958,JD Vance accidentally confirmed that Trump wants regime change at the FBI,78,3,No,No,0,https://www.salon.com/2024/11/20/jd-vance-accidentally-confirmed-that-wants-regime-change-at-the-fbi/,/r/Liberal/comments/1gvvvn8/jd_vance_accidentally_confirmed_that_trump_wants/
trump,Liberal,Ideological Politics,119958,Trump calls for hush money dismissal; bids to run out clock on case,19,5,No,No,0,https://thehill.com/regulation/court-battles/4999903-trump-conviction-dismissal-inauguration/,/r/Liberal/comments/1gvvokn/trump_calls_for_hush_money_dismissal_bids_to_run/
results,Liberal,Ideological Politics,119958,Is 2024 the new 1933? ,137,45,No,No,0,https://www.reddit.com/r/Liberal/comments/1gvbaxm/is_2024_the_new_1933/,/r/Liberal/comments/1gvbaxm/is_2024_the_new_1933/
president,Liberal,Ideological Politics,119958,President Musk,40,28,No,No,0,https://www.reddit.com/r/Liberal/comments/1gvgeg2/president_musk/,/r/Liberal/comments/1gvgeg2/president_musk/
biden,Liberal,Ideological Politics,119958,"I'm worried Putin will ""test"" Trump in January.",189,95,No,No,0,https://www.reddit.com/r/Liberal/comments/1gv3wxs/im_worried_putin_will_test_trump_in_january/,/r/Liberal/comments/1gv3wxs/im_worried_putin_will_test_trump_in_january/
biden,Liberal,Ideological Politics,119958,Was the Democratic Party this Quiet in 2016 after Trump Won?,208,189,No,No,0,https://www.reddit.com/r/Liberal/comments/1guxn5s/was_the_democratic_party_this_quiet_in_2016_after/,/r/Liberal/comments/1guxn5s/was_the_democratic_party_this_quiet_in_2016_after/
trump,Liberal,Ideological Politics,119958,Social Darwinist Oligarchs are a bigger threat than Christian Nationalists right now,71,26,No,No,0,https://www.reddit.com/r/Liberal/comments/1guzzlj/social_darwinist_oligarchs_are_a_bigger_threat/,/r/Liberal/comments/1guzzlj/social_darwinist_oligarchs_are_a_bigger_threat/
loss,Liberal,Ideological Politics,119958,What were republicans like before Trump? TLDR at the bottom,37,75,No,Yes,0,https://www.reddit.com/r/Liberal/comments/1gv3l0j/what_were_republicans_like_before_trump_tldr_at/,/r/Liberal/comments/1gv3l0j/what_were_republicans_like_before_trump_tldr_at/
trump,Liberal,Ideological Politics,119958,What are your thoughts on Trump confirming he will declare a national emergency on day 1 to deport more humans than were deported in the Holocaust?,147,151,No,No,0,https://www.reddit.com/r/Liberal/comments/1gusjpr/what_are_your_thoughts_on_trump_confirming_he/,/r/Liberal/comments/1gusjpr/what_are_your_thoughts_on_trump_confirming_he/
harris,Liberal,Ideological Politics,119958,ELI5 why is labor explotation suddenly okay,47,69,No,No,0,https://www.reddit.com/r/Liberal/comments/1guwjsg/eli5_why_is_labor_explotation_suddenly_okay/,/r/Liberal/comments/1guwjsg/eli5_why_is_labor_explotation_suddenly_okay/
trump,Liberal,Ideological Politics,119958,How Can Non-Republican Voters Show Support for America?,14,12,No,No,0,https://www.reddit.com/r/Liberal/comments/1gv4wov/how_can_nonrepublican_voters_show_support_for/,/r/Liberal/comments/1gv4wov/how_can_nonrepublican_voters_show_support_for/
harris,KamalaHarris,Ideological Politics,74601,Weak turnout in key cities hurt Harris in the 'blue wall' states,659,102,No,No,0,https://www.nbcnews.com/politics/2024-election/weak-turnout-key-cities-hurt-harris-blue-wall-states-rcna180669,/r/KamalaHarris/comments/1gvax2s/weak_turnout_in_key_cities_hurt_harris_in_the/
victory,KamalaHarris,Ideological Politics,74601,Republican Victory and the Ambience of Information | The New Yorker,129,19,No,No,0,https://www.newyorker.com/news/the-lede/republican-victory-and-the-ambience-of-information,/r/KamalaHarris/comments/1guof8s/republican_victory_and_the_ambience_of/
trump,KamalaHarris,Ideological Politics,74601,Donald Trump is Already Starting to Fail,1145,274,No,No,0,https://www.nytimes.com/2024/11/17/opinion/trump-kennedy-gaetz-hegseth.html?smid=nytcore-ios-share&referringSource=articleShare,/r/KamalaHarris/comments/1gu4nfk/donald_trump_is_already_starting_to_fail/
trump,KamalaHarris,Ideological Politics,74601,"'We can't come together': Trump voters win election, lose family and friends as values clash",1137,155,No,No,0,https://v.redd.it/9fqmgoq0ii1e1,/r/KamalaHarris/comments/1gtl9cc/we_cant_come_together_trump_voters_win_election/
president,Impeach_Trump,Ideological Politics,60493,"“He’s behaving as if he’s a co-president and making sure everyone knows it,” one of the two people told NBC.",318,20,No,No,0,https://imghoster.co/en/vInxmlzM9vsmI3q?utm_source=reddit&utm_medium=impeach_trump,/r/Impeach_Trump/comments/1gu39be/hes_behaving_as_if_hes_a_copresident_and_making/
trump,Impeach_Trump,Ideological Politics,60493,"Jack Smith Soon to Drop 'Eye-Opening' Trump Report, Ex-Prosecutor Predicts ",447,48,No,No,0,https://www.newsweek.com/glenn-kirschner-predicts-jack-smith-soon-drop-eye-opening-trump-report-1987058,/r/Impeach_Trump/comments/1gtixfh/jack_smith_soon_to_drop_eyeopening_trump_report/
trump,Impeach_Trump,Ideological Politics,60493,Trump also appoints Matt Gaetz to serve as attorney general… the insanity of all of this is so outrageous and other worldly. ,209,7,No,No,0,https://www.cnbc.com/amp/2024/11/13/trump-taps-rep-matt-gaetz-as-attorney-general.html,/r/Impeach_Trump/comments/1gqnbam/trump_also_appoints_matt_gaetz_to_serve_as/
trump,Impeach_Trump,Ideological Politics,60493,Trump's defense choice stuns the Pentagon | apnews.com,104,1,No,No,0,https://apnews.com/article/trump-hegseth-defense-secretary-pentagon-2d8030921ecef933778cf92afd40ec72,/r/Impeach_Trump/comments/1gqakjc/trumps_defense_choice_stuns_the_pentagon_apnewscom/
trump,Impeach_Trump,Ideological Politics,60493,"Far-right extremists celebrate Trump’s win — In a burst of hate and misogyny, MAGA militants cheered the return of a president they consider an ally",159,1,No,No,0,https://www.washingtonpost.com/politics/2024/11/07/right-wing-extremists-celebrate-trump-victory/,/r/Impeach_Trump/comments/1gmvba5/farright_extremists_celebrate_trumps_win_in_a/
trump,Impeach_Trump,Ideological Politics,60493,Trump feigned ignorance of Project 2025,220,10,No,No,0,https://imghoster.co/en/FhQ7EhPjtSXOF4R,/r/Impeach_Trump/comments/1glm47g/trump_feigned_ignorance_of_project_2025/
trump,Impeach_Trump,Ideological Politics,60493,The Deep Roots of 4 of Donald Trump’s Highly Xenophobic Remarks,35,3,No,No,0,https://www.nytimes.com/2024/11/01/us/politics/trump-immigration-rhetoric-history.html,/r/Impeach_Trump/comments/1glhq62/the_deep_roots_of_4_of_donald_trumps_highly/
trump,Impeach_Trump,Ideological Politics,60493,Literal Neo-Nazi Leader Endorses Trump,217,1,No,No,0,https://www.rollingstone.com/politics/politics-news/trump-endorsement-neo-nazi-leader-nsc-131-1235154089/,/r/Impeach_Trump/comments/1gkmq6t/literal_neonazi_leader_endorses_trump/
trump,Impeach_Trump,Ideological Politics,60493,Trump's crowds are dwindling as his campaign winds down — Empty seats and early exits have grown more common,428,18,No,No,0,https://www.nytimes.com/2024/11/04/us/politics/trump-rally-crowds.html,/r/Impeach_Trump/comments/1gjn8sb/trumps_crowds_are_dwindling_as_his_campaign_winds/
trump,Impeach_Trump,Ideological Politics,60493,"Donald Trump talks about women at his rallies like they are objects, he doesn't see them as equals",300,3,No,No,0,https://imghoster.co/v3YtmBuQO5WqVHF,/r/Impeach_Trump/comments/1ggdie6/donald_trump_talks_about_women_at_his_rallies/
trump,Impeach_Trump,Ideological Politics,60493,"Donald Trump called half of America ""human scum""",193,5,No,No,0,https://imghoster.co/VN2ORQf6SinlHXJ?utm_source=reddit&utm_medium=impeach_trump,/r/Impeach_Trump/comments/1gg9nmz/donald_trump_called_half_of_america_human_scum/
trump,Impeach_Trump,Ideological Politics,60493,This is an amazing article written by user u/SilkyFluffs in r/democrats which is an amazing resource for combating GOP and Trump misinformation and possibly even converting family members or undecided voters,47,0,No,Yes,0,https://pdflink.to/d6e0bc9d/,/r/Impeach_Trump/comments/1ggd0pc/this_is_an_amazing_article_written_by_user/
