Keyword,Subreddit,Category,Members,Title,Upvotes,Comments,Moderator Interaction,Fact-Checking Mention,Total Awards,URL,Original Post URL
results,Wikileaks,General Politics,177615,Censored Wikileaks content?,12,7,No,No,0,https://www.reddit.com/r/WikiLeaks/comments/1frr2wq/censored_wikileaks_content/,/r/WikiLeaks/comments/1frr2wq/censored_wikileaks_content/
senate,News,General Politics,28961592,The FBI and DHS leaders won't testify publicly about national security threats before the Senate,1652,145,No,No,0,https://apnews.com/article/fbi-senate-homeland-security-wray-majorkas-fef3808a3773d06314ac3b01b845a9fc,/r/news/comments/1gwjkgw/the_fbi_and_dhs_leaders_wont_testify_publicly/
fraud,News,General Politics,28961592,Billionaire Gautam Adani charged by the United States in $250m fraud scheme.,2669,81,No,No,0,https://www.reuters.com/business/energy/indias-adani-green-energy-withdraws-planned-dollar-bond-sale-sources-say-2024-11-21/,/r/news/comments/1gwc40k/billionaire_gautam_adani_charged_by_the_united/
trump,PoliticalDiscussion,General Politics,2184539,"ICC issued arrest warrants against Netanyahu, Gallant and a former Hamas leader, Marsi [said to have been killed by Israel] World leaders' response is mixed. Are there one or more countries that will actually dare to enforce the warrant if they show up in one of these countries?",42,60,No,No,0,https://www.reddit.com/r/PoliticalDiscussion/comments/1gwk1ew/icc_issued_arrest_warrants_against_netanyahu/,/r/PoliticalDiscussion/comments/1gwk1ew/icc_issued_arrest_warrants_against_netanyahu/
outcome,PoliticalDiscussion,General Politics,2184539,How will the fallout be if Donald Trump and Elon Musk clash during the presidency?,71,128,No,No,0,https://www.reddit.com/r/PoliticalDiscussion/comments/1gvz3hx/how_will_the_fallout_be_if_donald_trump_and_elon/,/r/PoliticalDiscussion/comments/1gvz3hx/how_will_the_fallout_be_if_donald_trump_and_elon/
electoral,PoliticalDiscussion,General Politics,2184539,To what degree do you think the system of recall should be used?,51,51,No,No,0,https://www.reddit.com/r/PoliticalDiscussion/comments/1gvp5ay/to_what_degree_do_you_think_the_system_of_recall/,/r/PoliticalDiscussion/comments/1gvp5ay/to_what_degree_do_you_think_the_system_of_recall/
loss,PoliticalDiscussion,General Politics,2184539,What can democrats do to be more effective in today’s media environment?,247,969,No,No,0,https://www.reddit.com/r/PoliticalDiscussion/comments/1gv340b/what_can_democrats_do_to_be_more_effective_in/,/r/PoliticalDiscussion/comments/1gv340b/what_can_democrats_do_to_be_more_effective_in/
biden,PoliticalDiscussion,General Politics,2184539,Were Obama and Biden just extraordinary candidates?  (For their time at least),0,94,No,No,0,https://www.reddit.com/r/PoliticalDiscussion/comments/1gvwhem/were_obama_and_biden_just_extraordinary/,/r/PoliticalDiscussion/comments/1gvwhem/were_obama_and_biden_just_extraordinary/
loss,PoliticalDiscussion,General Politics,2184539,How does a campaign to expand rights differ from a campaign to prevent rights from backsliding?,12,36,No,Yes,0,https://www.reddit.com/r/PoliticalDiscussion/comments/1gv4yrs/how_does_a_campaign_to_expand_rights_differ_from/,/r/PoliticalDiscussion/comments/1gv4yrs/how_does_a_campaign_to_expand_rights_differ_from/
harris,PoliticalDiscussion,General Politics,2184539,"For what reason do you believe it is that the public doesn't broadly acknowledge that immigrants are statistically less likely to commit crimes than native born Americans, and instead believe that immigrants are more prone to violence?",551,731,No,Yes,0,https://www.reddit.com/r/PoliticalDiscussion/comments/1gu5dba/for_what_reason_do_you_believe_it_is_that_the/,/r/PoliticalDiscussion/comments/1gu5dba/for_what_reason_do_you_believe_it_is_that_the/
results,PoliticalDiscussion,General Politics,2184539,"The Pennsylvania Senate race is extremely close and heading for a recount.  What's exactly going on there?  Finally, what is the use for provisional ballots in the first place?",266,113,No,No,0,https://www.reddit.com/r/PoliticalDiscussion/comments/1gu73uj/the_pennsylvania_senate_race_is_extremely_close/,/r/PoliticalDiscussion/comments/1gu73uj/the_pennsylvania_senate_race_is_extremely_close/
supreme court,PoliticalDiscussion,General Politics,2184539,"Would you want courts to normally be issuing rulings unanimously or closely so, or do you want to see a court more typically having multiple blocs?",2,16,No,No,0,https://www.reddit.com/r/PoliticalDiscussion/comments/1guzf9s/would_you_want_courts_to_normally_be_issuing/,/r/PoliticalDiscussion/comments/1guzf9s/would_you_want_courts_to_normally_be_issuing/
biden,PoliticalDiscussion,General Politics,2184539,Will Biden be able to fill the last remaining judicial nominations? ,181,87,No,No,0,https://www.reddit.com/r/PoliticalDiscussion/comments/1gtxjwv/will_biden_be_able_to_fill_the_last_remaining/,/r/PoliticalDiscussion/comments/1gtxjwv/will_biden_be_able_to_fill_the_last_remaining/
results,NeutralPolitics,General Politics,610799,What to expect after the U.S. election,281,26,Yes,Yes,0,https://www.reddit.com/r/NeutralPolitics/comments/1gflxpk/what_to_expect_after_the_us_election/,/r/NeutralPolitics/comments/1gflxpk/what_to_expect_after_the_us_election/
trump,NeutralPolitics,General Politics,610799,Is NATO still a credible deterrent? What are the arguments for and against?,23,63,No,No,0,https://www.reddit.com/r/NeutralPolitics/comments/1guw3ls/is_nato_still_a_credible_deterrent_what_are_the/,/r/NeutralPolitics/comments/1guw3ls/is_nato_still_a_credible_deterrent_what_are_the/
house,NeutralPolitics,General Politics,610799,Tracking what bills/decisions are coming to contact reps/senators in a timely manner,37,12,No,No,0,https://www.reddit.com/r/NeutralPolitics/comments/1gqkpdp/tracking_what_billsdecisions_are_coming_to/,/r/NeutralPolitics/comments/1gqkpdp/tracking_what_billsdecisions_are_coming_to/
loss,NeutralPolitics,General Politics,610799,Do any countries have laws to combat politically-driven misinformation?,37,42,No,Yes,0,https://www.reddit.com/r/NeutralPolitics/comments/1gq4agt/do_any_countries_have_laws_to_combat/,/r/NeutralPolitics/comments/1gq4agt/do_any_countries_have_laws_to_combat/
results,NeutralPolitics,General Politics,610799,Trump won the presidency and popular vote running on the mass deportation of illegal aliens. Who saw this coming and what lessons can be learned?,227,326,No,No,0,https://www.reddit.com/r/NeutralPolitics/comments/1gnk7ih/trump_won_the_presidency_and_popular_vote_running/,/r/NeutralPolitics/comments/1gnk7ih/trump_won_the_presidency_and_popular_vote_running/
results,NeutralPolitics,General Politics,610799,Is now the time for a NEW moderate third party in U.S. politics?,5,83,No,No,0,https://www.reddit.com/r/NeutralPolitics/comments/1gms9so/is_now_the_time_for_a_new_moderate_third_party_in/,/r/NeutralPolitics/comments/1gms9so/is_now_the_time_for_a_new_moderate_third_party_in/
harris,NeutralPolitics,General Politics,610799,Why Are So Many Men Leaving The Democratic Party Over The Last Few Years?,383,156,No,No,0,https://www.reddit.com/r/NeutralPolitics/comments/1gklb9t/why_are_so_many_men_leaving_the_democratic_party/,/r/NeutralPolitics/comments/1gklb9t/why_are_so_many_men_leaving_the_democratic_party/
trump,NeutralPolitics,General Politics,610799,What plans about trump and kamala have on section 8 housing and dept of edu.,1,11,No,No,0,https://www.reddit.com/r/NeutralPolitics/comments/1gk1emp/what_plans_about_trump_and_kamala_have_on_section/,/r/NeutralPolitics/comments/1gk1emp/what_plans_about_trump_and_kamala_have_on_section/
outcome,NeutralPolitics,General Politics,610799,"What are the pros and cons of predictive election models, like 538, for our discourse around elections?",43,94,No,No,0,https://www.reddit.com/r/NeutralPolitics/comments/1giqib5/what_are_the_pros_and_cons_of_predictive_election/,/r/NeutralPolitics/comments/1giqib5/what_are_the_pros_and_cons_of_predictive_election/
trump,moderatepolitics,General Politics,296793,Trump AG pick Matt Gaetz says he's withdrawing,175,178,No,No,0,https://www.cnbc.com/amp/2024/11/21/trump-ag-pick-matt-gaetz-says-hes-withdrawing.html,/r/moderatepolitics/comments/1gwl22c/trump_ag_pick_matt_gaetz_says_hes_withdrawing/
results,moderatepolitics,General Politics,296793,On the Democratic Party’s Cult of Powerlessness,46,32,No,No,0,https://www.thebignewsletter.com/p/on-the-democratic-partys-cult-of?utm_source=post-email-title&publication_id=11524&post_id=151434532&utm_campaign=email-post-title&isFreemail=true&r=156kd&triedRedirect=true&utm_medium=email,/r/moderatepolitics/comments/1gw3eg7/on_the_democratic_partys_cult_of_powerlessness/
trump,moderatepolitics,General Politics,296793,Trump Wants to ease rules for Self-Driving cars,98,203,No,No,0,https://reason.com/2024/11/20/trump-wants-to-ease-rules-for-self-driving-cars/,/r/moderatepolitics/comments/1gvxmmx/trump_wants_to_ease_rules_for_selfdriving_cars/
trump,moderatepolitics,General Politics,296793,Trump AG pick Matt Gaetz says he's withdrawing,1,2,No,No,0,https://www.cnbc.com/2024/11/21/trump-ag-pick-matt-gaetz-says-hes-withdrawing.html,/r/moderatepolitics/comments/1gwlp6c/trump_ag_pick_matt_gaetz_says_hes_withdrawing/
biden,moderatepolitics,General Politics,296793,"Biden approves antipersonnel mines for Ukraine, undoing his own policy",204,232,No,No,0,https://www.washingtonpost.com/national-security/2024/11/19/biden-landmines-ukraine-russia,/r/moderatepolitics/comments/1gvgo0a/biden_approves_antipersonnel_mines_for_ukraine/
trump,moderatepolitics,General Politics,296793,Trump picks TV's Dr. Oz to run Medicare and Medicaid,509,672,No,No,0,https://www.reuters.com/world/us/trump-picks-dr-oz-serve-cms-administrator-2024-11-19/,/r/moderatepolitics/comments/1gv93g1/trump_picks_tvs_dr_oz_to_run_medicare_and_medicaid/
trump,moderatepolitics,General Politics,296793,What's the Endgame Solution for Industries Reliant on Illegal Immigrants?,11,26,No,No,0,https://www.reddit.com/r/moderatepolitics/comments/1gvuib8/whats_the_endgame_solution_for_industries_reliant/,/r/moderatepolitics/comments/1gvuib8/whats_the_endgame_solution_for_industries_reliant/
biden,technology,General Politics,17428139,Joe Biden Just Trump-Proofed His Hallmark CHIPS Act,28291,1079,No,No,0,https://www.newsweek.com/biden-chips-act-taiwan-tsmc-trump-1988924,/r/technology/comments/1gvzhtn/joe_biden_just_trumpproofed_his_hallmark_chips_act/
trump,technology,General Politics,17428139,Amazon and SpaceX aim to defang the federal labor board. Trump may help. ,147,45,No,No,0,https://www.washingtonpost.com/technology/2024/11/21/musk-trump-nlrb-amazon-spacex/,/r/technology/comments/1gwhi1i/amazon_and_spacex_aim_to_defang_the_federal_labor/
trump,democrats,Ideological Politics,481128,Matt Gaetz withdraws as Trump's AG nominee,144,36,No,No,0,https://www.axios.com/2024/11/21/matt-gaetz-ag-trump-withdraws,/r/democrats/comments/1gwle6c/matt_gaetz_withdraws_as_trumps_ag_nominee/
biden,democrats,Ideological Politics,481128,Congressional lawmakers push Biden to build on marijuana pardons with expanded clemency effort before he leaves office,132,4,No,No,0,https://www.marijuanamoment.net/congressional-lawmakers-push-biden-to-build-on-marijuana-pardons-with-expanded-clemency-effort-before-he-leaves-office/,/r/democrats/comments/1gwiuc0/congressional_lawmakers_push_biden_to_build_on/
house,democrats,Ideological Politics,481128,"Mike Johnson institutes transgender bathroom ban for U.S. House. Nov. 20, 2024",615,241,No,No,0,https://www.axios.com/2024/11/20/mike-johnson-trans-women-capitol-bathrooms,/r/democrats/comments/1gw234n/mike_johnson_institutes_transgender_bathroom_ban/
trump,democrats,Ideological Politics,481128,"If one of these 9 Senators is your Senator, please write them to let them know you oppose Trump's cabinet picks--they're the most likely Rs to put up a fight (see comment for draft letter and link)",290,58,No,No,0,https://thehill.com/homenews/senate/4993818-trump-cabinet-potential-obstacles/,/r/democrats/comments/1gw75tx/if_one_of_these_9_senators_is_your_senator_please/
house,democrats,Ideological Politics,481128,California Democrats are on the verge of flipping another GOP House district,472,6,No,No,0,https://www.sfgate.com/politics/article/calif-democrats-could-flip-orange-county-seat-19926051.php,/r/democrats/comments/1gw0xc7/california_democrats_are_on_the_verge_of_flipping/
trump,democrats,Ideological Politics,481128,‘A lot of fear:’ Trump’s deportation proposals are already rattling workers,17,5,No,No,0,https://www.cnn.com/2024/11/21/economy/deportation-labor-market-fear/index.html,/r/democrats/comments/1gwja2z/a_lot_of_fear_trumps_deportation_proposals_are/
president,democrats,Ideological Politics,481128,Forensic audit of the US presidential election is now needed,951,115,No,No,0,https://www.thecanary.co/global/world-analysis/2024/11/19/forensic-audit-us-presidential-election/,/r/democrats/comments/1gvvz4p/forensic_audit_of_the_us_presidential_election_is/
house,democrats,Ideological Politics,481128,The surprising idea from two conservative Democrats that could fix the House,254,48,No,No,0,https://www.msnbc.com/opinion/msnbc-opinion/house-congress-expansion-committee-gluesenkamp-perez-golden-rcna180811,/r/democrats/comments/1gw2hk8/the_surprising_idea_from_two_conservative/
trump,Republican,Ideological Politics,205987,Ellen has fled the country after Trump's election | America Is Getting Greater Already 👍,175,31,No,No,0,https://notthebee.com/article/ellen-has-fled-the-country-after-trumps-election,/r/Republican/comments/1gwjgdv/ellen_has_fled_the_country_after_trumps_election/
trump,Republican,Ideological Politics,205987,Trump AG pick Matt Gaetz says he's withdrawing,17,14,No,No,0,https://www.cnbc.com/2024/11/21/trump-ag-pick-matt-gaetz-says-hes-withdrawing.html,/r/Republican/comments/1gwlctr/trump_ag_pick_matt_gaetz_says_hes_withdrawing/
trump,Republican,Ideological Politics,205987,"Trump 2.0 Should Focus on Family Policy — An Interview with Heritage’s Jay W Richards
",17,5,No,No,0,https://www.hungarianconservative.com/articles/interview/family-policy-donald-trump-hungary-jay-w-richards-heritage-foundation-interview/,/r/Republican/comments/1gwietp/trump_20_should_focus_on_family_policy_an/
trump,Republican,Ideological Politics,205987,I got us a win!,233,47,No,No,0,https://www.reddit.com/gallery/1gw49zz,/r/Republican/comments/1gw49zz/i_got_us_a_win/
trump,Republican,Ideological Politics,205987,"Texas Land Commissioner offers 1,400 acres to be used for staging President Trump's deportation efforts ",111,6,No,No,0,https://notthebee.com/article/texas-land-commissioner-offers-1400-acres-to-be-used-for-detention-in-trumps-deportation-efforts,/r/Republican/comments/1gw5d1v/texas_land_commissioner_offers_1400_acres_to_be/
house,Republican,Ideological Politics,205987,House Speaker Mike Johnson declared Wednesday that women’s facilities in the Capitol complex are reserved for biological females ✅,415,68,No,No,0,https://nypost.com/2024/11/20/us-news/transgender-people-banned-from-capitol-bathrooms-that-match-their-gender-identity-house-speaker-johnson-declares/,/r/Republican/comments/1gvweb8/house_speaker_mike_johnson_declared_wednesday/
trump,Conservative,Ideological Politics,1149973,Gaetz withdraws his name to become Trump's attorney general,477,175,No,No,0,https://i.redd.it/dbjxunehia2e1.jpeg,/r/Conservative/comments/1gwkxnf/gaetz_withdraws_his_name_to_become_trumps/
trump,Conservative,Ideological Politics,1149973,Ellen DeGeneres and Portia de Rossi moving to ENGLAND after Trump win as they become latest stars to flee US,2204,763,No,No,0,https://www.dailymail.co.uk/tvshowbiz/article-14107471/Ellen-DeGeneres-Portia-Rossi-moving-ENGLAND-Trump-win-latest-stars-flee-US.html,/r/Conservative/comments/1gw5hgv/ellen_degeneres_and_portia_de_rossi_moving_to/
trump,Conservative,Ideological Politics,1149973,UNREAL: ABC News Tries to Blame Donald Trump for Laken Riley's Murder,162,21,No,No,0,https://redstate.com/terichristoph/2024/11/20/unreal-abc-news-tries-to-blame-donald-trump-for-laken-rileys-murder-n2182258,/r/Conservative/comments/1gwin48/unreal_abc_news_tries_to_blame_donald_trump_for/
supreme court,Conservative,Ideological Politics,1149973,Jussie Smollett conviction overturned by Illinois Supreme Court ,139,51,No,No,0,https://www.foxnews.com/entertainment/jussie-smollett-conviction-overturned-illinois-supreme-court,/r/Conservative/comments/1gwiu8k/jussie_smollett_conviction_overturned_by_illinois/
president,Libertarian,Ideological Politics,503610,Lex Friedman interviews Javier Milei: President of Argentina,106,15,Yes,No,0,https://youtu.be/8NLzc9kobDk?si=Clw18RIyD4X04IHP,/r/Libertarian/comments/1gv927s/lex_friedman_interviews_javier_milei_president_of/
loss,Libertarian,Ideological Politics,503610,Opinions on Trumps Tariffs on China?,15,27,No,Yes,0,https://www.reddit.com/r/Libertarian/comments/1gwgggq/opinions_on_trumps_tariffs_on_china/,/r/Libertarian/comments/1gwgggq/opinions_on_trumps_tariffs_on_china/
outcome,Anarchism,Ideological Politics,271376,"If your work-from-home job is returning to office, they WANT you to quit because it has better optics for the company than layoffs.",24,1,No,No,0,https://www.reddit.com/r/Anarchism/comments/1gwho3l/if_your_workfromhome_job_is_returning_to_office/,/r/Anarchism/comments/1gwho3l/if_your_workfromhome_job_is_returning_to_office/
trump,Anarchism,Ideological Politics,271376,A chronology of resistance and direct action under the first Trump administration.,46,0,No,No,0,/r/CrimethInc/comments/1gw666z/a_chronology_of_resistance_and_direct_action/,/r/Anarchism/comments/1gw66g6/a_chronology_of_resistance_and_direct_action/
trump,Socialism,Ideological Politics,461356,Trump tells us that the reason it’s so hard to find a good job or an affordable home is that immigrant workers have taken them – lies to let the real guilty parties off the hook.,150,3,No,No,0,https://www.reddit.com/gallery/1gw2bp8,/r/socialism/comments/1gw2bp8/trump_tells_us_that_the_reason_its_so_hard_to/
victory,Socialism,Ideological Politics,461356,"National People’s Power wins Sri Lanka’s general election – Revolution, reform, or rhetoric?",25,0,No,No,0,https://www.socialistworld.net/2024/11/18/national-peoples-power-wins-sri-lankas-general-election-revolution-reform-or-rhetoric/,/r/socialism/comments/1gwbsm3/national_peoples_power_wins_sri_lankas_general/
trump,Progressive,Ideological Politics,78128,Anti-abortion groups have a to-do list for Trump,20,1,No,No,0,https://www.npr.org/2024/11/20/nx-s1-5191851/anti-abortion-activists-trump-second-term-abortion-pills-comstock-rfk,/r/progressive/comments/1gwd7f2/antiabortion_groups_have_a_todo_list_for_trump/
trump,Progressive,Ideological Politics,78128,"Despite Trump’s Win, School Vouchers Were Again Rejected by Majorities of Voters",8,1,No,No,0,https://www.propublica.org/article/school-vouchers-2024-election-trump,/r/progressive/comments/1guls4r/despite_trumps_win_school_vouchers_were_again/
vance,Progressive,Ideological Politics,78128,Brown not ruling out run for remainder of Vance’s Senate term,2,0,No,No,0,https://thehill.com/homenews/campaign/4992997-brown-vance-senate-term-ohio/amp/,/r/progressive/comments/1gtbps2/brown_not_ruling_out_run_for_remainder_of_vances/
trump,Progressive,Ideological Politics,78128,Behind the Curtain: Trump's business bonanza,14,2,No,No,0,https://www.axios.com/2024/11/07/trump-elon-musk-business-tax-cuts,/r/progressive/comments/1gm4w17/behind_the_curtain_trumps_business_bonanza/
victory,Progressive,Ideological Politics,78128,Far-Right Donald Trump Supporters Celebrate His Victory with Violent Memes and Calls for Executions,249,14,No,No,0,https://www.wired.com/story/donald-trump-far-right-supporters-violent-memes/,/r/progressive/comments/1glfnyf/farright_donald_trump_supporters_celebrate_his/
trump,Progressive,Ideological Politics,78128,What Trump's first 100 days in office could look like,23,6,No,No,0,https://www.npr.org/2024/11/06/nx-s1-5181800/2024-election-trump-first-100-days-agenda,/r/progressive/comments/1glo04a/what_trumps_first_100_days_in_office_could_look/
trump,Progressive,Ideological Politics,78128,Americans in Puerto Rico can't vote for US president. Their anger at Trump is shaping the race.,350,33,No,No,0,https://apnews.com/article/puerto-rico-trump-joke-garbage-a91e2aafd93a06d32365efa013581b85,/r/progressive/comments/1gh2ab4/americans_in_puerto_rico_cant_vote_for_us/
results,Republicanism,Ideological Politics,916,Survey about your political worldview (18+; 12-14 mins to complete),3,0,No,No,0,https://www.reddit.com/r/republicanism/comments/1aq418a/survey_about_your_political_worldview_18_1214/,/r/republicanism/comments/1aq418a/survey_about_your_political_worldview_18_1214/
house,Republicanism,Ideological Politics,916,Meet Susanna Gibson: Virginia Democrat in key state House race calls sharing of pornographic videos ‘the worst gutter politics’,2,0,No,No,0,https://www.celebsweek.com/susanna-gibson/,/r/republicanism/comments/16hfi9k/meet_susanna_gibson_virginia_democrat_in_key/
president,Republicanism,Ideological Politics,916,About the Lopez,4,2,No,No,0,https://www.reddit.com/r/republicanism/comments/1094bh5/about_the_lopez/,/r/republicanism/comments/1094bh5/about_the_lopez/
trump,Conservatives,Ideological Politics,108286,"Ellen DeGeneres Leaves United States, Flees to England over Trump Election",170,53,No,No,0,https://www.breitbart.com/entertainment/2024/11/20/ellen-degeneres-leaves-united-states-flees-to-england-over-trump-election/,/r/conservatives/comments/1gwgf57/ellen_degeneres_leaves_united_states_flees_to/
trump,Conservatives,Ideological Politics,108286,Trump's Legal Team Requests Dismissal of Manhattan Case on New Grounds,34,1,No,No,0,https://redstate.com/smoosieq/2024/11/20/trumps-legal-team-requests-dismissal-of-manhattan-case-on-new-grounds-n2182265,/r/conservatives/comments/1gwfn46/trumps_legal_team_requests_dismissal_of_manhattan/
trump,Conservatives,Ideological Politics,108286,UNREAL: ABC News Tries to Blame Donald Trump for Laken Riley's Murder,10,1,No,No,0,https://redstate.com/terichristoph/2024/11/20/unreal-abc-news-tries-to-blame-donald-trump-for-laken-rileys-murder-n2182258,/r/conservatives/comments/1gwimc2/unreal_abc_news_tries_to_blame_donald_trump_for/
trump,Conservatives,Ideological Politics,108286,It is critically important that Senate Republicans stop radical left judges. The American people gave President Trump a mandate to protect our country from extreme leftist judicial appointees,83,2,No,No,0,https://x.com/mrddmia/status/1859400591048417774?ref_src=twsrc%5Egoogle%7Ctwcamp%5Eserp%7Ctwgr%5Etweet,/r/conservatives/comments/1gw4xff/it_is_critically_important_that_senate/
trump,dailywire,Ideological Politics,24277,Wall of Hate - Help Document Hatred Against Trump on July13th.com,78,16,Yes,No,0,https://july13th.com/hate/,/r/dailywire/comments/1e3cqx8/wall_of_hate_help_document_hatred_against_trump/
trump,dailywire,Ideological Politics,24277,"Sebastian Stan blames Trump because he can't find another actor to interview him for Variety's ""Actors on Actors""",60,8,No,No,0,https://deadline.com/2024/11/donald-trump-hollywood-afraid-sebastian-stan-1236182903/#recipient_hashed=aa34af3e6cb6e5e01eb8a64678d0be9a8090cf8b4923d191dd938adceea81629&recipient_salt=3e462f7cf795e1dc5efb088f073ddb1eb748f554379a3a315fc1f6781b51e9de&utm_medium=email&utm_source=exacttarget&utm_campaign=Deadline_BreakingNews&utm_content=567796_11-20-2024&utm_term=1676431,/r/dailywire/comments/1gw3t7g/sebastian_stan_blames_trump_because_he_cant_find/
results,dailywire,Ideological Politics,24277,I hope they do levy a challenge.,51,18,No,Yes,0,https://youtu.be/-m5cmNt5x9U?si=e7iPDu3dEWHnhQyB,/r/dailywire/comments/1gs0n9f/i_hope_they_do_levy_a_challenge/
trump,dailywire,Ideological Politics,24277,A murder-suicide because Trump won,168,39,No,No,0,https://nypost.com/2024/11/10/us-news/minn-dad-anthony-nephew-ranted-against-trump-killed-family-in-murder-suicide/,/r/dailywire/comments/1grkks1/a_murdersuicide_because_trump_won/
trump,Liberal,Ideological Politics,119977,Russia launched an ICBM at Ukraine. if WW3 starts could we use that to call a state of emergency and block trump's inauguration?,29,46,No,No,0,https://www.cnn.com/world/live-news/ukraine-russia-war-11-21-24/index.html,/r/Liberal/comments/1gwibg9/russia_launched_an_icbm_at_ukraine_if_ww3_starts/
trump,Liberal,Ideological Politics,119977,No more Gaetz!!,10,4,No,No,0,https://www.cnbc.com/2024/11/21/trump-ag-pick-matt-gaetz-says-hes-withdrawing.html,/r/Liberal/comments/1gwld2k/no_more_gaetz/
trump,Liberal,Ideological Politics,119977,JD Vance accidentally confirmed that Trump wants regime change at the FBI,154,15,No,No,0,https://www.salon.com/2024/11/20/jd-vance-accidentally-confirmed-that-wants-regime-change-at-the-fbi/,/r/Liberal/comments/1gvvvn8/jd_vance_accidentally_confirmed_that_trump_wants/
house,Liberal,Ideological Politics,119977,"Gaetz sent over $10K in Venmo payments to 2 women who testified in House probe, records suggest",307,19,No,No,0,https://abcnews.go.com/US/gaetz-10k-venmo-payments-2-women-testified-house/story?id=116019367,/r/Liberal/comments/1gvp4r4/gaetz_sent_over_10k_in_venmo_payments_to_2_women/
trump,Liberal,Ideological Politics,119977,Trump calls for hush money dismissal; bids to run out clock on case,39,9,No,No,0,https://thehill.com/regulation/court-battles/4999903-trump-conviction-dismissal-inauguration/,/r/Liberal/comments/1gvvokn/trump_calls_for_hush_money_dismissal_bids_to_run/
loss,Liberal,Ideological Politics,119977,Follow up: what were democrats like prior to Roe v Wade,3,10,No,No,0,https://www.reddit.com/r/Liberal/comments/1gw9390/follow_up_what_were_democrats_like_prior_to_roe_v/,/r/Liberal/comments/1gw9390/follow_up_what_were_democrats_like_prior_to_roe_v/
