Keyword,Subreddit,Category,Members,Title,Upvotes,Comments,Moderator Interaction,Fact-Checking Mention,Total Awards,URL,Original Post URL
trump,Liberal,Ideological Politics,119937,My main reason for optimism: Now they have to put up or shut up,159,68,No,No,0,https://www.reddit.com/r/Liberal/comments/1gszxrw/my_main_reason_for_optimism_now_they_have_to_put/,/r/Liberal/comments/1gszxrw/my_main_reason_for_optimism_now_they_have_to_put/
trump,Liberal,Ideological Politics,119937,FAFO STORY TIME!,9,10,No,No,0,https://www.reddit.com/r/Liberal/comments/1gtbqeq/fafo_story_time/,/r/Liberal/comments/1gtbqeq/fafo_story_time/
trump,Liberal,Ideological Politics,119937,Is there any upside to Trump winning? ,114,350,No,No,0,https://www.reddit.com/r/Liberal/comments/1gsthn9/is_there_any_upside_to_trump_winning/,/r/Liberal/comments/1gsthn9/is_there_any_upside_to_trump_winning/
outcome,Liberal,Ideological Politics,119937,"Yes, There is a Difference between Liberal and Conservative Brains (It's the Amygdala)",39,8,No,Yes,0,https://www.reddit.com/r/Liberal/comments/1gssfap/yes_there_is_a_difference_between_liberal_and/,/r/Liberal/comments/1gssfap/yes_there_is_a_difference_between_liberal_and/
electoral,Liberal,Ideological Politics,119937,Elon Musk's Experiment in Chaos,45,38,No,No,0,https://www.reddit.com/r/Liberal/comments/1gsoomx/elon_musks_experiment_in_chaos/,/r/Liberal/comments/1gsoomx/elon_musks_experiment_in_chaos/
trump,Liberal,Ideological Politics,119937,“She Was a High School Student and There Were Witnesses.” | The fight to release a damning House Ethics report about allegations that Matt Gaetz—Donald Trump’s pick for attorney general—had sex with a 17-year-old girl has begun.,517,46,No,No,0,https://newrepublic.com/post/188426/matt-gaetz-high-school-girl-witnesses,/r/Liberal/comments/1gs2890/she_was_a_high_school_student_and_there_were/
harris,KamalaHarris,Ideological Politics,74998,"Dear VP Kamala Harris — On behalf of the 69,074,145+ Americans who voted for you, we thank you for your leadership. Thank you for a future-focused, reimagined, unifying and aspirational vision for our country.",2288,121,Yes,No,0,https://www.deseret.com/opinion/2024/11/15/thank-you-vice-president-kamala-harris/,/r/KamalaHarris/comments/1gszdtt/dear_vp_kamala_harris_on_behalf_of_the_69074145/
trump,KamalaHarris,Ideological Politics,74998,"'We can't come together': Trump voters win election, lose family and friends as values clash",521,50,No,No,0,https://v.redd.it/9fqmgoq0ii1e1,/r/KamalaHarris/comments/1gtl9cc/we_cant_come_together_trump_voters_win_election/
trump,KamalaHarris,Ideological Politics,74998,Trump’s Anti-Trans Ads Were Expensive and Unpopular. So Why Were They His Key Strategy?,317,85,No,No,0,https://www.unclosetedmedia.com/p/trumps-anti-trans-ads-were-expensive,/r/KamalaHarris/comments/1gtes3q/trumps_antitrans_ads_were_expensive_and_unpopular/
trump,KamalaHarris,Ideological Politics,74998,Election denialism emerges on the left after Trump’s win ,507,209,No,No,0,https://www.nbcnews.com/tech/tech-news/election-denialism-emerges-left-trumps-win-rcna179797,/r/KamalaHarris/comments/1gt8480/election_denialism_emerges_on_the_left_after/
trump,KamalaHarris,Ideological Politics,74998,Trump taking 'calls from unknown foreign numbers' as he makes cabinet picks: NYT ,1390,117,No,No,0,https://www.rawstory.com/trump-phone-calls/,/r/KamalaHarris/comments/1gsvn60/trump_taking_calls_from_unknown_foreign_numbers/
trump,KamalaHarris,Ideological Politics,74998,AOC Directly Addresses People Who Voted For Both Her And Trump,750,103,No,No,0,https://www.huffpost.com/entry/aoc-trump-voters_n_67320370e4b052f25adcff55,/r/KamalaHarris/comments/1gsyo0m/aoc_directly_addresses_people_who_voted_for_both/
harris,KamalaHarris,Ideological Politics,74998,Trump pro-Israel picks mock anti-Harris pro-Palestinian protest vote,505,55,No,No,0,https://forward.com/opinion/674533/trump-rubio-huckabee-stefanik-israel,/r/KamalaHarris/comments/1gsrmxw/trump_proisrael_picks_mock_antiharris/
trump,KamalaHarris,Ideological Politics,74998,The 13%: Why These LGBTQ Voters Are Thrilled About Trump’s Win,349,170,No,No,0,https://www.unclosetedmedia.com/p/the-13-why-theyre-thrilled-about,/r/KamalaHarris/comments/1gsnqlk/the_13_why_these_lgbtq_voters_are_thrilled_about/
trump,KamalaHarris,Ideological Politics,74998,Muslims who voted for Trump upset by his pro-Israel cabinet picks,1405,374,No,No,0,https://www.reuters.com/world/us/muslims-who-voted-trump-upset-by-his-pro-israel-cabinet-picks-2024-11-15/,/r/KamalaHarris/comments/1gsbxyc/muslims_who_voted_for_trump_upset_by_his/
recount,KamalaHarris,Ideological Politics,74998,Stephen Spoonamore's Duty to Warn letter to Harris regarding request for recount,880,129,No,No,0,https://substack.com/home/post/p-151721941,/r/KamalaHarris/comments/1gs8dv4/stephen_spoonamores_duty_to_warn_letter_to_harris/
harris,KamalaHarris,Ideological Politics,74998,Inside the Republican false-flag effort to turn off Kamala Harris voters,334,16,No,Yes,0,https://www.washingtonpost.com/politics/2024/11/15/republican-ads-false-flag/,/r/KamalaHarris/comments/1gsb3lu/inside_the_republican_falseflag_effort_to_turn/
trump,Impeach_Trump,Ideological Politics,60513,"Jack Smith Soon to Drop 'Eye-Opening' Trump Report, Ex-Prosecutor Predicts ",172,19,No,No,0,https://www.newsweek.com/glenn-kirschner-predicts-jack-smith-soon-drop-eye-opening-trump-report-1987058,/r/Impeach_Trump/comments/1gtixfh/jack_smith_soon_to_drop_eyeopening_trump_report/
trump,Impeach_Trump,Ideological Politics,60513,Trump also appoints Matt Gaetz to serve as attorney general… the insanity of all of this is so outrageous and other worldly. ,211,7,No,No,0,https://www.cnbc.com/amp/2024/11/13/trump-taps-rep-matt-gaetz-as-attorney-general.html,/r/Impeach_Trump/comments/1gqnbam/trump_also_appoints_matt_gaetz_to_serve_as/
trump,Impeach_Trump,Ideological Politics,60513,Trump's defense choice stuns the Pentagon | apnews.com,109,1,No,No,0,https://apnews.com/article/trump-hegseth-defense-secretary-pentagon-2d8030921ecef933778cf92afd40ec72,/r/Impeach_Trump/comments/1gqakjc/trumps_defense_choice_stuns_the_pentagon_apnewscom/
trump,Impeach_Trump,Ideological Politics,60513,"Far-right extremists celebrate Trump’s win — In a burst of hate and misogyny, MAGA militants cheered the return of a president they consider an ally",157,1,No,No,0,https://www.washingtonpost.com/politics/2024/11/07/right-wing-extremists-celebrate-trump-victory/,/r/Impeach_Trump/comments/1gmvba5/farright_extremists_celebrate_trumps_win_in_a/
trump,Impeach_Trump,Ideological Politics,60513,Trump feigned ignorance of Project 2025,220,10,No,No,0,https://imghoster.co/en/FhQ7EhPjtSXOF4R,/r/Impeach_Trump/comments/1glm47g/trump_feigned_ignorance_of_project_2025/
trump,Impeach_Trump,Ideological Politics,60513,The Deep Roots of 4 of Donald Trump’s Highly Xenophobic Remarks,32,2,No,No,0,https://www.nytimes.com/2024/11/01/us/politics/trump-immigration-rhetoric-history.html,/r/Impeach_Trump/comments/1glhq62/the_deep_roots_of_4_of_donald_trumps_highly/
trump,Impeach_Trump,Ideological Politics,60513,Literal Neo-Nazi Leader Endorses Trump,218,1,No,No,0,https://www.rollingstone.com/politics/politics-news/trump-endorsement-neo-nazi-leader-nsc-131-1235154089/,/r/Impeach_Trump/comments/1gkmq6t/literal_neonazi_leader_endorses_trump/
trump,Impeach_Trump,Ideological Politics,60513,Trump's crowds are dwindling as his campaign winds down — Empty seats and early exits have grown more common,430,18,No,No,0,https://www.nytimes.com/2024/11/04/us/politics/trump-rally-crowds.html,/r/Impeach_Trump/comments/1gjn8sb/trumps_crowds_are_dwindling_as_his_campaign_winds/
trump,Impeach_Trump,Ideological Politics,60513,"Donald Trump talks about women at his rallies like they are objects, he doesn't see them as equals",301,3,No,No,0,https://imghoster.co/v3YtmBuQO5WqVHF,/r/Impeach_Trump/comments/1ggdie6/donald_trump_talks_about_women_at_his_rallies/
trump,Impeach_Trump,Ideological Politics,60513,"Donald Trump called half of America ""human scum""",194,5,No,No,0,https://imghoster.co/VN2ORQf6SinlHXJ?utm_source=reddit&utm_medium=impeach_trump,/r/Impeach_Trump/comments/1gg9nmz/donald_trump_called_half_of_america_human_scum/
trump,Impeach_Trump,Ideological Politics,60513,This is an amazing article written by user u/SilkyFluffs in r/democrats which is an amazing resource for combating GOP and Trump misinformation and possibly even converting family members or undecided voters,46,0,No,Yes,0,https://pdflink.to/d6e0bc9d/,/r/Impeach_Trump/comments/1ggd0pc/this_is_an_amazing_article_written_by_user/
