Keyword,Subreddit,Category,Members,Title,Upvotes,Comments,Moderator Interaction,Fact-Checking Mention,Total Awards,URL,Original Post URL
ai,Wikileaks,General Politics,177637,Parliamentary Assembly recognises Julian Assange as a ‘political prisoner’ and warns against the chilling effect of his harsh treatment,38,0,No,No,0,https://www.coe.int/en/web/portal/-/pace-recognises-julian-assange-as-a-political-prisoner-and-warns-against-the-chilling-effect-of-his-harsh-treatment,/r/WikiLeaks/comments/1fx0tn0/parliamentary_assembly_recognises_julian_assange/
ai,Wikileaks,General Politics,177637,"Julian Assange speaks out against deep state, ‘wolves in MAGA hats’: Interview",42,5,No,No,0,https://thehill.com/video/julian-assange-speaks-out-against-deep-state-%e2%80%98wolves-in-maga-hats%e2%80%99-interview/10098442/,/r/WikiLeaks/comments/1fvetjh/julian_assange_speaks_out_against_deep_state/
ai,Wikileaks,General Politics,177637,Julian to speak at a parliamentary hearing in Strasbourg on the chilling effect on human rights his treatment has had.,22,0,No,No,0,https://www.reddit.com/r/WikiLeaks/comments/1ftadxc/julian_to_speak_at_a_parliamentary_hearing_in/,/r/WikiLeaks/comments/1ftadxc/julian_to_speak_at_a_parliamentary_hearing_in/
ai,Wikileaks,General Politics,177637,Why does the US still control every penny of Iraqi oil revenues?,39,6,No,No,0,https://www.reddit.com/r/WikiLeaks/comments/1fso9v7/why_does_the_us_still_control_every_penny_of/,/r/WikiLeaks/comments/1fso9v7/why_does_the_us_still_control_every_penny_of/
ai,Wikileaks,General Politics,177637,Censored Wikileaks content?,12,7,No,No,0,https://www.reddit.com/r/WikiLeaks/comments/1frr2wq/censored_wikileaks_content/,/r/WikiLeaks/comments/1frr2wq/censored_wikileaks_content/
ai,News,General Politics,28951041,Ballet star Vladimir Shklyarov who criticised Putin’s Ukraine invasion dies in fall from building in St Petersburg,54770,2420,No,No,0,https://www.lbc.co.uk/news/vladimir-shklyarov-death-st-petersburg-ballet-star-fall/,/r/news/comments/1gu2atd/ballet_star_vladimir_shklyarov_who_criticised/
ai,News,General Politics,28951041,India’s capital chokes as air pollution levels hit 50 times the safe limit,1706,147,No,No,0,https://apnews.com/article/new-delhi-air-pollution-india-ae1ec1e6292009db198f18b113047cd5,/r/news/comments/1gudxzm/indias_capital_chokes_as_air_pollution_levels_hit/
ai,News,General Politics,28951041,Spirit Airlines files for bankruptcy,8913,893,No,No,0,https://www.cnn.com/2024/11/18/business/spirit-airlines-bankruptcy?cid=ios_app,/r/news/comments/1gu1w72/spirit_airlines_files_for_bankruptcy/
ai,News,General Politics,28951041,"Car fleeing police slams into Culver City house, dragging 300 feet of guardrail",476,32,No,No,0,https://www.latimes.com/california/story/2024-11-17/car-slams-into-culver-city-house-after-high-speed-chase-one-arrest-and-fire-arm-recovered,/r/news/comments/1gu8q11/car_fleeing_police_slams_into_culver_city_house/
ai,News,General Politics,28951041,"In a first, Biden allows Ukraine to strike Russia with U.S. long-range weapons",9469,783,No,No,0,https://www.npr.org/2024/11/17/nx-s1-5194432/biden-long-range-missiles-russia-ukraine-war,/r/news/comments/1gtpsz3/in_a_first_biden_allows_ukraine_to_strike_russia/
ai,PoliticalDiscussion,General Politics,2184573,Casual Questions Thread,42,4882,Yes,No,0,https://www.reddit.com/r/PoliticalDiscussion/comments/1bwbuka/casual_questions_thread/,/r/PoliticalDiscussion/comments/1bwbuka/casual_questions_thread/
ai,PoliticalDiscussion,General Politics,2184573,"For what reason do you believe it is that the public doesn't broadly acknowledge that immigrants are statistically less likely to commit crimes than native born Americans, and instead believe that immigrants are more prone to violence?",410,557,No,Yes,0,https://www.reddit.com/r/PoliticalDiscussion/comments/1gu5dba/for_what_reason_do_you_believe_it_is_that_the/,/r/PoliticalDiscussion/comments/1gu5dba/for_what_reason_do_you_believe_it_is_that_the/
ai,PoliticalDiscussion,General Politics,2184573,"Ecuador has a presidential republic, but also has an interesting mechanism of Simultaneous Death. What do you think are the benefits and adverse effects of such a thing?",35,11,No,No,0,https://www.reddit.com/r/PoliticalDiscussion/comments/1gu2y8x/ecuador_has_a_presidential_republic_but_also_has/,/r/PoliticalDiscussion/comments/1gu2y8x/ecuador_has_a_presidential_republic_but_also_has/
ai,PoliticalDiscussion,General Politics,2184573,Will Biden be able to fill the last remaining judicial nominations? ,116,53,No,No,0,https://www.reddit.com/r/PoliticalDiscussion/comments/1gtxjwv/will_biden_be_able_to_fill_the_last_remaining/,/r/PoliticalDiscussion/comments/1gtxjwv/will_biden_be_able_to_fill_the_last_remaining/
ai,PoliticalDiscussion,General Politics,2184573,What are the chances of WW3 and Nuclear Warfare since US allowed missile strikes in Russia?,1,1,No,No,0,https://www.reddit.com/r/PoliticalDiscussion/comments/1gueb8c/what_are_the_chances_of_ww3_and_nuclear_warfare/,/r/PoliticalDiscussion/comments/1gueb8c/what_are_the_chances_of_ww3_and_nuclear_warfare/
ai,PoliticalDiscussion,General Politics,2184573,What validity does Kennedy have for removing water fluoridation?,1,1,No,No,0,https://www.reddit.com/r/PoliticalDiscussion/comments/1gucz83/what_validity_does_kennedy_have_for_removing/,/r/PoliticalDiscussion/comments/1gucz83/what_validity_does_kennedy_have_for_removing/
ai,PoliticalDiscussion,General Politics,2184573,Will kidnapped ukrainian children ever be brought back home?,40,82,No,No,0,https://www.reddit.com/r/PoliticalDiscussion/comments/1gtqoi5/will_kidnapped_ukrainian_children_ever_be_brought/,/r/PoliticalDiscussion/comments/1gtqoi5/will_kidnapped_ukrainian_children_ever_be_brought/
ai,PoliticalDiscussion,General Politics,2184573,Should more Independents run for senate in solid red states?,49,28,No,No,0,https://www.reddit.com/r/PoliticalDiscussion/comments/1gtkt5i/should_more_independents_run_for_senate_in_solid/,/r/PoliticalDiscussion/comments/1gtkt5i/should_more_independents_run_for_senate_in_solid/
ai,PoliticalDiscussion,General Politics,2184573,"The Pennsylvania Senate race is extremely close and heading for a recount.  What's exactly going on there?  Finally, what is the use for provisional ballots in the first place?",1,2,No,No,0,https://www.reddit.com/r/PoliticalDiscussion/comments/1gu73uj/the_pennsylvania_senate_race_is_extremely_close/,/r/PoliticalDiscussion/comments/1gu73uj/the_pennsylvania_senate_race_is_extremely_close/
ai,PoliticalDiscussion,General Politics,2184573,How Much of America’s Polarization Is Engineered by Foreign Influence?,262,144,No,Yes,0,https://www.reddit.com/r/PoliticalDiscussion/comments/1gt1v4x/how_much_of_americas_polarization_is_engineered/,/r/PoliticalDiscussion/comments/1gt1v4x/how_much_of_americas_polarization_is_engineered/
ai,PoliticalDiscussion,General Politics,2184573,"Is the fear and pearl clutching about the second Trump administration warranted, or are those fears overblown? ",355,1084,No,No,0,https://www.reddit.com/r/PoliticalDiscussion/comments/1gstbge/is_the_fear_and_pearl_clutching_about_the_second/,/r/PoliticalDiscussion/comments/1gstbge/is_the_fear_and_pearl_clutching_about_the_second/
ai,NeutralPolitics,General Politics,610739,What to expect after the U.S. election,283,26,Yes,Yes,0,https://www.reddit.com/r/NeutralPolitics/comments/1gflxpk/what_to_expect_after_the_us_election/,/r/NeutralPolitics/comments/1gflxpk/what_to_expect_after_the_us_election/
ai,NeutralPolitics,General Politics,610739,"Realistically, what things can RFK Jr. do right away with his HHS appointment?",154,124,No,Yes,0,https://www.reddit.com/r/NeutralPolitics/comments/1gs44iq/realistically_what_things_can_rfk_jr_do_right/,/r/NeutralPolitics/comments/1gs44iq/realistically_what_things_can_rfk_jr_do_right/
ai,NeutralPolitics,General Politics,610739,Tracking what bills/decisions are coming to contact reps/senators in a timely manner,37,12,No,No,0,https://www.reddit.com/r/NeutralPolitics/comments/1gqkpdp/tracking_what_billsdecisions_are_coming_to/,/r/NeutralPolitics/comments/1gqkpdp/tracking_what_billsdecisions_are_coming_to/
ai,NeutralPolitics,General Politics,610739,Do any countries have laws to combat politically-driven misinformation?,32,37,No,Yes,0,https://www.reddit.com/r/NeutralPolitics/comments/1gq4agt/do_any_countries_have_laws_to_combat/,/r/NeutralPolitics/comments/1gq4agt/do_any_countries_have_laws_to_combat/
ai,NeutralPolitics,General Politics,610739,Is now the time for a NEW moderate third party in U.S. politics?,0,83,No,No,0,https://www.reddit.com/r/NeutralPolitics/comments/1gms9so/is_now_the_time_for_a_new_moderate_third_party_in/,/r/NeutralPolitics/comments/1gms9so/is_now_the_time_for_a_new_moderate_third_party_in/
ai,NeutralPolitics,General Politics,610739,Are neocons just hawkish cons?,12,23,No,No,0,https://www.reddit.com/r/NeutralPolitics/comments/1gm80f7/are_neocons_just_hawkish_cons/,/r/NeutralPolitics/comments/1gm80f7/are_neocons_just_hawkish_cons/
ai,NeutralPolitics,General Politics,610739,Where is the Western world’s paradigm shift coming from?,118,128,No,Yes,0,https://www.reddit.com/r/NeutralPolitics/comments/1glkk8q/where_is_the_western_worlds_paradigm_shift_coming/,/r/NeutralPolitics/comments/1glkk8q/where_is_the_western_worlds_paradigm_shift_coming/
ai,NeutralPolitics,General Politics,610739,Why Are So Many Men Leaving The Democratic Party Over The Last Few Years?,387,156,No,No,0,https://www.reddit.com/r/NeutralPolitics/comments/1gklb9t/why_are_so_many_men_leaving_the_democratic_party/,/r/NeutralPolitics/comments/1gklb9t/why_are_so_many_men_leaving_the_democratic_party/
elon musk,NeutralPolitics,General Politics,610739,What is the impact of Elon Musk's political engagement on the current U.S. election?,72,40,No,No,0,https://www.reddit.com/r/NeutralPolitics/comments/1gki55b/what_is_the_impact_of_elon_musks_political/,/r/NeutralPolitics/comments/1gki55b/what_is_the_impact_of_elon_musks_political/
ai,NeutralPolitics,General Politics,610739,"What are the pros and cons of predictive election models, like 538, for our discourse around elections?",39,94,No,No,0,https://www.reddit.com/r/NeutralPolitics/comments/1giqib5/what_are_the_pros_and_cons_of_predictive_election/,/r/NeutralPolitics/comments/1giqib5/what_are_the_pros_and_cons_of_predictive_election/
ai,NeutralPolitics,General Politics,610739,Why are there organizations whose only goal is to make sure people vote? ,50,36,No,No,0,https://www.reddit.com/r/NeutralPolitics/comments/1ggtk67/why_are_there_organizations_whose_only_goal_is_to/,/r/NeutralPolitics/comments/1ggtk67/why_are_there_organizations_whose_only_goal_is_to/
ai,NeutralPolitics,General Politics,610739,How do the Trump and Harris plans for workforce pay and taxes compare?,5,6,No,No,0,https://www.reddit.com/r/NeutralPolitics/comments/1ggxh8w/how_do_the_trump_and_harris_plans_for_workforce/,/r/NeutralPolitics/comments/1ggxh8w/how_do_the_trump_and_harris_plans_for_workforce/
ai,moderatepolitics,General Politics,296676,How do Democrats rebuild their coalition?,90,411,No,No,0,https://www.cnn.com/election/2024/exit-polls/national-results/general/president/0,/r/moderatepolitics/comments/1gu3t04/how_do_democrats_rebuild_their_coalition/
ai,moderatepolitics,General Politics,296676,"Biden approves Ukraine’s use of long-range U.S. weapons inside Russia, reversing policy",331,292,No,No,0,https://www.washingtonpost.com/national-security/2024/11/17/ukraine-russia-north-korea-atacms/,/r/moderatepolitics/comments/1gtkw36/biden_approves_ukraines_use_of_longrange_us/
ai,moderatepolitics,General Politics,296676,Trump sues for billions from media he says is biased against him | Donald Trump,117,81,No,No,0,https://www.theguardian.com/us-news/2024/nov/15/trump-sues-media-outlets-bias,/r/moderatepolitics/comments/1gtkvcd/trump_sues_for_billions_from_media_he_says_is/
ai,moderatepolitics,General Politics,296676,Is it just me or has the sub become more left wing in the last few years?,0,147,No,No,0,https://www.reddit.com/r/moderatepolitics/comments/1guas0q/is_it_just_me_or_has_the_sub_become_more_left/,/r/moderatepolitics/comments/1guas0q/is_it_just_me_or_has_the_sub_become_more_left/
ai,technology,General Politics,17418566,Hi! We're the hosts of WIRED's new tech culture podcast Uncanny Valley. AM(us)A!,45,51,Yes,No,0,https://www.reddit.com/r/technology/comments/1gftoz0/hi_were_the_hosts_of_wireds_new_tech_culture/,/r/technology/comments/1gftoz0/hi_were_the_hosts_of_wireds_new_tech_culture/
ai,technology,General Politics,17418566,"Trump’s FCC chair is Brendan Carr, who wants to regulate everyone except ISPs",5676,353,No,No,0,https://arstechnica.com/tech-policy/2024/11/trumps-fcc-chair-is-brendan-carr-who-wants-to-regulate-everyone-except-isps/,/r/technology/comments/1gubnq3/trumps_fcc_chair_is_brendan_carr_who_wants_to/
ai,technology,General Politics,17418566,David Attenborough Reacts to AI Replica of His Voice: 'I Am Profoundly Disturbed' and 'Greatly Object' to It,9500,255,No,No,0,https://variety.com/2024/digital/global/david-attenborough-ai-voice-replica-profoundly-disturbed-1236212952/,/r/technology/comments/1gu324s/david_attenborough_reacts_to_ai_replica_of_his/
ai,technology,General Politics,17418566,"An AI-generated nude photo scandal has shut down a Pennsylvania private school. On Monday, classes were canceled after parents forced leaders to either resign or face a lawsuit potentially seeking criminal penalties and accusing the school of skipping mandatory reporting of the harmful images.",1249,69,No,No,0,https://arstechnica.com/tech-policy/2024/11/school-failed-to-report-ai-nudes-of-kids-for-months-now-parents-are-suing/,/r/technology/comments/1gubjgs/an_aigenerated_nude_photo_scandal_has_shut_down_a/
ai,technology,General Politics,17418566,"Trump Appoints Brendan Carr, Net Neutrality Opponent, as FCC Chairman",21087,1773,No,No,0,https://www.nytimes.com/2024/11/17/technology/fcc-nominee-brendan-carr-trump.html,/r/technology/comments/1gtuhdb/trump_appoints_brendan_carr_net_neutrality/
ai,democrats,Ideological Politics,480975,Trump vote count drops below majority,798,165,No,No,0,https://i.redd.it/fwbvmqa4zo1e1.jpeg,/r/democrats/comments/1gu9mp8/trump_vote_count_drops_below_majority/
ai,democrats,Ideological Politics,480975,Blaming Obama and Harris for the price of fries.,172,48,No,No,0,https://i.redd.it/r8p1uqzkvp1e1.jpeg,/r/democrats/comments/1gue4ve/blaming_obama_and_harris_for_the_price_of_fries/
ai,Republican,Ideological Politics,205835,"Jon 'Bones' Jones performs Donald Trump's famous dance, gives title belt to president-elect after TKO victory",51,15,No,No,0,https://www.foxnews.com/sports/jon-bones-jones-performs-donald-trumps-famous-dance-gives-title-belt-president-elect-after-tko-victory,/r/Republican/comments/1guh6id/jon_bones_jones_performs_donald_trumps_famous/
RFK,Republican,Ideological Politics,205835,The New York Times tried to fact check RFK Jr. and the level of delusion is unreal,133,12,No,Yes,0,https://notthebee.com/article/the-new-york-times-tried-to-fact-check-rfk-jr-and-the-level-of-delusion-is-unreal,/r/Republican/comments/1gu6t2g/the_new_york_times_tried_to_fact_check_rfk_jr_and/
ai,Republican,Ideological Politics,205835,Trump's War on the D.C. Establishment Requires This Exact Cabinet to Fight | Opinion,46,7,No,Yes,0,https://www.newsweek.com/trumps-war-dc-establishment-requires-this-exact-cabinet-fight-opinion-1986309,/r/Republican/comments/1gua2me/trumps_war_on_the_dc_establishment_requires_this/
ai,Republican,Ideological Politics,205835,Biden Allows Ukraine to Strike Russia With Long-Range U.S. Missiles,257,171,No,No,0,https://www.nytimes.com/2024/11/17/us/politics/biden-ukraine-russia-atacms-missiles.html,/r/Republican/comments/1gtmuiy/biden_allows_ukraine_to_strike_russia_with/
ai,Republican,Ideological Politics,205835,This is great news. ,98,45,No,No,0,https://news.mit.edu/2024/mit-engineers-make-converting-co2-into-products-more-practical-1113,/r/Republican/comments/1gte8sp/this_is_great_news/
ai,Conservative,Ideological Politics,1148743,Reports that Kamala Harris paid $1 million for Oprah town hall are false: Turns out she spent $2.5 million.,1225,103,No,Yes,0,https://notthebee.com/article/reports-that-kamala-harris-paid-1-million-for-oprah-appearance-are-false-turns-out-she-spent-25-million-for-it,/r/Conservative/comments/1guaryd/reports_that_kamala_harris_paid_1_million_for/
ai,Conservative,Ideological Politics,1148743,BREAKING: Pennsylvania Supreme Court Orders Blue Counties to Halt Counting of Disqualified Mail-In Ballots - Here Are The Details,641,52,No,No,0,https://www.rightjournalism.com/breaking-pennsylvania-supreme-court-orders-blue-counties-to-halt-counting-of-disqualified-mail-in-ballots-here-are-the-details/,/r/Conservative/comments/1gufl1o/breaking_pennsylvania_supreme_court_orders_blue/
ai,Conservative,Ideological Politics,1148743,Pa. Supreme Court again rules against counting undated mail ballots as U.S. Senate race limbo continues,339,22,No,No,0,https://www.inquirer.com/politics/philadelphia/pennsylvania-supreme-court-undated-mail-ballots-senate-recount-20241118.html,/r/Conservative/comments/1gugq82/pa_supreme_court_again_rules_against_counting/
ai,Conservative,Ideological Politics,1148743,"Pentagon Flunks Seventh Straight Audit, Can't Fully Account for $824 Billion Budget",1252,113,No,No,0,https://redstate.com/mike_miller/2024/11/17/pentagon-flunks-seventh-straight-audit-cant-fully-account-for-more-than-824-billion-budget-n2182107,/r/Conservative/comments/1gu40wr/pentagon_flunks_seventh_straight_audit_cant_fully/
ai,Conservative,Ideological Politics,1148743,BUSTED: The Inside Story Of How The Kamala Harris Campaign Manipulates Reddit (And Breaks The Rules) To Control The Platform,719,58,No,No,0,https://thefederalist.com/2024/10/29/busted-the-inside-story-of-how-the-kamala-harris-campaign-manipulates-reddit-and-breaks-the-rules-to-control-the-platform/,/r/Conservative/comments/1gu6hug/busted_the_inside_story_of_how_the_kamala_harris/
elon musk,Conservative,Ideological Politics,1148743,The View star Sunny Hostin deletes X in 'patriotic' act as she takes aim at Elon Musk,287,74,No,No,0,https://www.dailymail.co.uk/news/article-14092087/The-View-Sunny-Hostin-deletes-X-elon-musk.html,/r/Conservative/comments/1guc91v/the_view_star_sunny_hostin_deletes_x_in_patriotic/
ai,Conservative,Ideological Politics,1148743,"Wait, Huh? After Pledging to Ramrod Left-Wing Agenda Through Senate, Schumer Pleads for Bi-Partisanship",615,56,No,No,0,https://redstate.com/mike_miller/2024/11/17/wait-huh-after-pledging-to-ramrod-left-wing-agenda-through-senate-schumer-pleads-for-bi-partisanship-n2182100,/r/Conservative/comments/1gu4w36/wait_huh_after_pledging_to_ramrod_leftwing_agenda/
ai,Libertarian,Ideological Politics,503661,The Salt Mines: Post-Election Meltdowns from around the Internet. These Sodium levels are off the chart! Link some election Schadenfreude you found.,76,161,Yes,No,0,https://www.reddit.com/r/Libertarian/comments/1glfw5m/the_salt_mines_postelection_meltdowns_from_around/,/r/Libertarian/comments/1glfw5m/the_salt_mines_postelection_meltdowns_from_around/
ai,Libertarian,Ideological Politics,503661,He ain’t wrong,659,21,No,No,0,https://i.imgur.com/JxrkDC4.png,/r/Libertarian/comments/1gu87s2/he_aint_wrong/
ai,Libertarian,Ideological Politics,503661,Pentagon fails 7th audit in a row but hopes to pass by 2028,16,2,No,No,0,https://reason.com/2024/11/18/pentagon-fails-7th-audit-in-a-row-but-hopes-to-pass-by-2028/,/r/Libertarian/comments/1gui2ne/pentagon_fails_7th_audit_in_a_row_but_hopes_to/
ai,Libertarian,Ideological Politics,503661,How to Make America Great Again on an Individual Level,10,1,No,No,0,https://i.redd.it/o17vjyr1tq1e1.jpeg,/r/Libertarian/comments/1guimln/how_to_make_america_great_again_on_an_individual/
ai,Anarchism,Ideological Politics,271283,Mutual Aid Monday,18,0,Yes,No,0,https://www.reddit.com/r/Anarchism/comments/1gty6oa/mutual_aid_monday/,/r/Anarchism/comments/1gty6oa/mutual_aid_monday/
ai,Anarchism,Ideological Politics,271283,Flipping Conservatives,88,60,No,No,0,https://www.reddit.com/r/Anarchism/comments/1gtlvq9/flipping_conservatives/,/r/Anarchism/comments/1gtlvq9/flipping_conservatives/
ai,Anarchism,Ideological Politics,271283,Griters and the Romani left,23,0,No,No,0,https://www.reddit.com/r/Anarchism/comments/1gt09bk/griters_and_the_romani_left/,/r/Anarchism/comments/1gt09bk/griters_and_the_romani_left/
ai,Anarchism,Ideological Politics,271283,Net.art and Activism,8,2,No,No,0,https://www.reddit.com/r/Anarchism/comments/1gt3n2r/netart_and_activism/,/r/Anarchism/comments/1gt3n2r/netart_and_activism/
ai,Socialism,Ideological Politics,461181,"THE PEOPLE OF THE WORLD STAND WITH PALESTINE! This November 29, we call on people all over the world to join us in demonstrating unwavering support for the Palestinian people in the struggle against US-Israeli genocide and occupation.",15,2,No,No,0,https://i.redd.it/r8gcafq9xq1e1.jpeg,/r/socialism/comments/1guj4w0/the_people_of_the_world_stand_with_palestine_this/
ai,Socialism,Ideological Politics,461181,Don’t Move Zim Phone Campaign,40,1,No,No,0,https://www.reddit.com/gallery/1gu64pw,/r/socialism/comments/1gu64pw/dont_move_zim_phone_campaign/
ai,Socialism,Ideological Politics,461181,“Does Israel have the right to exist?” - Francesca Albanese (UN Special Rapporteur on the Occupied Palestinian Territories) deconstructs this bad faith question,1529,45,No,No,0,https://v.redd.it/ix0y7a5bth1e1,/r/socialism/comments/1gti17t/does_israel_have_the_right_to_exist_francesca/
ai,Socialism,Ideological Politics,461181,Readings on Late Fascism,4,1,No,No,0,https://www.reddit.com/r/socialism/comments/1guiicy/readings_on_late_fascism/,/r/socialism/comments/1guiicy/readings_on_late_fascism/
ai,Socialism,Ideological Politics,461181,"Donate to help reunite families this holiday season! Help us raise $3,000 to help families make the journey to visit loved ones incarcerated at Arkansas Valley Prison this December.",18,2,No,No,0,https://i.redd.it/zmb74llv3o1e1.jpeg,/r/socialism/comments/1gu5k0a/donate_to_help_reunite_families_this_holiday/
ai,Progressive,Ideological Politics,78106,Behind the Curtain: Trump's business bonanza,14,2,No,No,0,https://www.axios.com/2024/11/07/trump-elon-musk-business-tax-cuts,/r/progressive/comments/1gm4w17/behind_the_curtain_trumps_business_bonanza/
ai,Progressive,Ideological Politics,78106,Billionaires vs Democracy - The rich are trying to buy elections all over the world and consign democracy to the trash bin of history.,289,12,No,No,0,https://inequality.org/research/billionaires-vs-democracy/,/r/progressive/comments/1ggh1hg/billionaires_vs_democracy_the_rich_are_trying_to/
ai,Progressive,Ideological Politics,78106,A Texas Woman Died After Waiting 40 Hours for Miscarriage Care,299,6,No,No,0,https://www.propublica.org/article/josseli-barnica-death-miscarriage-texas-abortion-ban,/r/progressive/comments/1gfmamd/a_texas_woman_died_after_waiting_40_hours_for/
ai,Republicanism,Ideological Politics,917,Why are monarchists cherry-pickers?,8,0,No,No,0,https://www.reddit.com/r/republicanism/comments/1c22ytx/why_are_monarchists_cherrypickers/,/r/republicanism/comments/1c22ytx/why_are_monarchists_cherrypickers/
ai,Republicanism,Ideological Politics,917,Pro-British monarchy Indian Christian saying mocking the name-reverting done by our governments (especially the renaming of Bombay to Mumbai) and openly doing sedition by saying that Charles III should be the Emperor of India and 'God Save the King' should be the Indian anthem.,3,0,No,No,0,https://www.reddit.com/gallery/1b2xwq8,/r/republicanism/comments/1b2xwq8/probritish_monarchy_indian_christian_saying/
ai,Republicanism,Ideological Politics,917,“Away with college gen ed”,0,4,No,Yes,0,https://www.reddit.com/r/republicanism/comments/19asm4l/away_with_college_gen_ed/,/r/republicanism/comments/19asm4l/away_with_college_gen_ed/
ai,Republicanism,Ideological Politics,917,Question from a Monarchist,8,20,No,No,0,https://www.reddit.com/r/republicanism/comments/z0zqv0/question_from_a_monarchist/,/r/republicanism/comments/z0zqv0/question_from_a_monarchist/
ai,Conservatives,Ideological Politics,108286,"Wait, Huh? After Pledging to Ramrod Left-Wing Agenda Through Senate, Schumer Pleads for Bi-Partisanship",151,34,No,No,0,https://redstate.com/mike_miller/2024/11/17/wait-huh-after-pledging-to-ramrod-left-wing-agenda-through-senate-schumer-pleads-for-bi-partisanship-n2182100,/r/conservatives/comments/1gu4vwz/wait_huh_after_pledging_to_ramrod_leftwing_agenda/
ai,Conservatives,Ideological Politics,108286,"Brendan Carr, Trump's choice for FCC chairman says agency 'will end its promotion of DEI' next year.",31,2,No,No,0,https://www.foxnews.com/politics/trumps-choice-fcc-chairman-agency-will-end-its-promotion-dei-next-year,/r/conservatives/comments/1gueepj/brendan_carr_trumps_choice_for_fcc_chairman_says/
ai,Conservatives,Ideological Politics,108286,NYT Fact-Checks Itself In Fact Check Of RFK Cereal Claims,14,0,No,Yes,0,https://thefederalist.com/2024/11/18/the-new-york-times-fact-checks-itself-in-fumbled-fact-check-of-rfk-froot-loops-claims/,/r/conservatives/comments/1gug9z6/nyt_factchecks_itself_in_fact_check_of_rfk_cereal/
ai,Conservatives,Ideological Politics,108286,Pa. Supreme Court again rules against counting undated mail ballots as U.S. Senate race limbo continues,11,0,No,No,0,https://www.inquirer.com/politics/philadelphia/pennsylvania-supreme-court-undated-mail-ballots-senate-recount-20241118.html,/r/conservatives/comments/1gugpx7/pa_supreme_court_again_rules_against_counting/
ai,Conservatives,Ideological Politics,108286,"Pentagon Flunks Seventh Straight Audit, Can't Fully Account for $824 Billion Budget",51,3,No,No,0,https://redstate.com/mike_miller/2024/11/17/pentagon-flunks-seventh-straight-audit-cant-fully-account-for-more-than-824-billion-budget-n2182107,/r/conservatives/comments/1gu40qb/pentagon_flunks_seventh_straight_audit_cant_fully/
