Keyword,Subreddit,Category,Members,Title,Upvotes,Comments,Moderator Interaction,Fact-Checking Mention,Total Awards,URL,Original Post URL
ai,Wikileaks,General Politics,177619,Parliamentary Assembly recognises Julian Assange as a ‘political prisoner’ and warns against the chilling effect of his harsh treatment,39,0,No,No,0,https://www.coe.int/en/web/portal/-/pace-recognises-julian-assange-as-a-political-prisoner-and-warns-against-the-chilling-effect-of-his-harsh-treatment,/r/WikiLeaks/comments/1fx0tn0/parliamentary_assembly_recognises_julian_assange/
ai,Wikileaks,General Politics,177619,"Julian Assange speaks out against deep state, ‘wolves in MAGA hats’: Interview",42,5,No,No,0,https://thehill.com/video/julian-assange-speaks-out-against-deep-state-%e2%80%98wolves-in-maga-hats%e2%80%99-interview/10098442/,/r/WikiLeaks/comments/1fvetjh/julian_assange_speaks_out_against_deep_state/
ai,Wikileaks,General Politics,177619,Julian to speak at a parliamentary hearing in Strasbourg on the chilling effect on human rights his treatment has had.,22,0,No,No,0,https://www.reddit.com/r/WikiLeaks/comments/1ftadxc/julian_to_speak_at_a_parliamentary_hearing_in/,/r/WikiLeaks/comments/1ftadxc/julian_to_speak_at_a_parliamentary_hearing_in/
ai,Wikileaks,General Politics,177619,Why does the US still control every penny of Iraqi oil revenues?,42,6,No,No,0,https://www.reddit.com/r/WikiLeaks/comments/1fso9v7/why_does_the_us_still_control_every_penny_of/,/r/WikiLeaks/comments/1fso9v7/why_does_the_us_still_control_every_penny_of/
ai,Wikileaks,General Politics,177619,Censored Wikileaks content?,14,7,No,No,0,https://www.reddit.com/r/WikiLeaks/comments/1frr2wq/censored_wikileaks_content/,/r/WikiLeaks/comments/1frr2wq/censored_wikileaks_content/
ai,News,General Politics,28959075,"Bacteria and mold found during inspection of Tom’s of Maine facility, FDA says",5840,260,No,No,0,https://www.cnn.com/2024/11/19/health/toms-of-maine-toothpaste-bacteria-mold-fda/index.html,/r/news/comments/1gvkiep/bacteria_and_mold_found_during_inspection_of_toms/
ai,News,General Politics,28959075,"Egyptians drank cocktails of psychedelics in ancient mugs, research reveals",718,104,No,No,0,https://news.sky.com/story/egyptians-drank-cocktails-of-psychedelic-drugs-in-ancient-mugs-research-reveals-13257252,/r/news/comments/1gvw2an/egyptians_drank_cocktails_of_psychedelics_in/
ai,News,General Politics,28959075,NYC issues first drought warning in over 20 years after record rainless streak,4125,173,No,No,0,https://www.nbcnews.com/news/us-news/nyc-issues-first-drought-warning-20-years-record-rainless-streak-rcna180759,/r/news/comments/1guxx4e/nyc_issues_first_drought_warning_in_over_20_years/
ai,PoliticalDiscussion,General Politics,2184560,Casual Questions Thread,48,4918,Yes,No,0,https://www.reddit.com/r/PoliticalDiscussion/comments/1bwbuka/casual_questions_thread/,/r/PoliticalDiscussion/comments/1bwbuka/casual_questions_thread/
elon musk,PoliticalDiscussion,General Politics,2184560,What can democrats do to be more effective in today’s media environment?,219,889,No,No,0,https://www.reddit.com/r/PoliticalDiscussion/comments/1gv340b/what_can_democrats_do_to_be_more_effective_in/,/r/PoliticalDiscussion/comments/1gv340b/what_can_democrats_do_to_be_more_effective_in/
ai,PoliticalDiscussion,General Politics,2184560,Were Obama and Biden just extraordinary candidates?  (For their time at least),0,13,No,No,0,https://www.reddit.com/r/PoliticalDiscussion/comments/1gvwhem/were_obama_and_biden_just_extraordinary/,/r/PoliticalDiscussion/comments/1gvwhem/were_obama_and_biden_just_extraordinary/
ai,PoliticalDiscussion,General Politics,2184560,What validity does Kennedy have for removing water fluoridation?,338,653,No,No,0,https://www.reddit.com/r/PoliticalDiscussion/comments/1gucz83/what_validity_does_kennedy_have_for_removing/,/r/PoliticalDiscussion/comments/1gucz83/what_validity_does_kennedy_have_for_removing/
ai,PoliticalDiscussion,General Politics,2184560,How Can the Left Redefine Itself?,0,41,No,No,0,https://www.reddit.com/r/PoliticalDiscussion/comments/1gvo61u/how_can_the_left_redefine_itself/,/r/PoliticalDiscussion/comments/1gvo61u/how_can_the_left_redefine_itself/
ai,PoliticalDiscussion,General Politics,2184560,How does a campaign to expand rights differ from a campaign to prevent rights from backsliding?,4,25,No,Yes,0,https://www.reddit.com/r/PoliticalDiscussion/comments/1gv4yrs/how_does_a_campaign_to_expand_rights_differ_from/,/r/PoliticalDiscussion/comments/1gv4yrs/how_does_a_campaign_to_expand_rights_differ_from/
ai,PoliticalDiscussion,General Politics,2184560,"For what reason do you believe it is that the public doesn't broadly acknowledge that immigrants are statistically less likely to commit crimes than native born Americans, and instead believe that immigrants are more prone to violence?",541,713,No,Yes,0,https://www.reddit.com/r/PoliticalDiscussion/comments/1gu5dba/for_what_reason_do_you_believe_it_is_that_the/,/r/PoliticalDiscussion/comments/1gu5dba/for_what_reason_do_you_believe_it_is_that_the/
ai,PoliticalDiscussion,General Politics,2184560,"The Pennsylvania Senate race is extremely close and heading for a recount.  What's exactly going on there?  Finally, what is the use for provisional ballots in the first place?",249,109,No,No,0,https://www.reddit.com/r/PoliticalDiscussion/comments/1gu73uj/the_pennsylvania_senate_race_is_extremely_close/,/r/PoliticalDiscussion/comments/1gu73uj/the_pennsylvania_senate_race_is_extremely_close/
ai,PoliticalDiscussion,General Politics,2184560,Will Biden be able to fill the last remaining judicial nominations? ,172,87,No,No,0,https://www.reddit.com/r/PoliticalDiscussion/comments/1gtxjwv/will_biden_be_able_to_fill_the_last_remaining/,/r/PoliticalDiscussion/comments/1gtxjwv/will_biden_be_able_to_fill_the_last_remaining/
ai,PoliticalDiscussion,General Politics,2184560,"Ecuador has a presidential republic, but also has an interesting mechanism of Simultaneous Death. What do you think are the benefits and adverse effects of such a thing?",50,14,No,No,0,https://www.reddit.com/r/PoliticalDiscussion/comments/1gu2y8x/ecuador_has_a_presidential_republic_but_also_has/,/r/PoliticalDiscussion/comments/1gu2y8x/ecuador_has_a_presidential_republic_but_also_has/
ai,NeutralPolitics,General Politics,610787,What to expect after the U.S. election,283,26,Yes,Yes,0,https://www.reddit.com/r/NeutralPolitics/comments/1gflxpk/what_to_expect_after_the_us_election/,/r/NeutralPolitics/comments/1gflxpk/what_to_expect_after_the_us_election/
ai,NeutralPolitics,General Politics,610787,Is NATO still a credible deterrent? What are the arguments for and against?,15,62,No,No,0,https://www.reddit.com/r/NeutralPolitics/comments/1guw3ls/is_nato_still_a_credible_deterrent_what_are_the/,/r/NeutralPolitics/comments/1guw3ls/is_nato_still_a_credible_deterrent_what_are_the/
ai,NeutralPolitics,General Politics,610787,"Realistically, what things can RFK Jr. do right away with his HHS appointment?",168,133,No,Yes,0,https://www.reddit.com/r/NeutralPolitics/comments/1gs44iq/realistically_what_things_can_rfk_jr_do_right/,/r/NeutralPolitics/comments/1gs44iq/realistically_what_things_can_rfk_jr_do_right/
ai,NeutralPolitics,General Politics,610787,Tracking what bills/decisions are coming to contact reps/senators in a timely manner,36,12,No,No,0,https://www.reddit.com/r/NeutralPolitics/comments/1gqkpdp/tracking_what_billsdecisions_are_coming_to/,/r/NeutralPolitics/comments/1gqkpdp/tracking_what_billsdecisions_are_coming_to/
ai,NeutralPolitics,General Politics,610787,Do any countries have laws to combat politically-driven misinformation?,36,42,No,Yes,0,https://www.reddit.com/r/NeutralPolitics/comments/1gq4agt/do_any_countries_have_laws_to_combat/,/r/NeutralPolitics/comments/1gq4agt/do_any_countries_have_laws_to_combat/
ai,NeutralPolitics,General Politics,610787,Is now the time for a NEW moderate third party in U.S. politics?,7,83,No,No,0,https://www.reddit.com/r/NeutralPolitics/comments/1gms9so/is_now_the_time_for_a_new_moderate_third_party_in/,/r/NeutralPolitics/comments/1gms9so/is_now_the_time_for_a_new_moderate_third_party_in/
ai,NeutralPolitics,General Politics,610787,Are neocons just hawkish cons?,11,23,No,No,0,https://www.reddit.com/r/NeutralPolitics/comments/1gm80f7/are_neocons_just_hawkish_cons/,/r/NeutralPolitics/comments/1gm80f7/are_neocons_just_hawkish_cons/
ai,NeutralPolitics,General Politics,610787,Where is the Western world’s paradigm shift coming from?,115,128,No,Yes,0,https://www.reddit.com/r/NeutralPolitics/comments/1glkk8q/where_is_the_western_worlds_paradigm_shift_coming/,/r/NeutralPolitics/comments/1glkk8q/where_is_the_western_worlds_paradigm_shift_coming/
ai,NeutralPolitics,General Politics,610787,Why Are So Many Men Leaving The Democratic Party Over The Last Few Years?,385,156,No,No,0,https://www.reddit.com/r/NeutralPolitics/comments/1gklb9t/why_are_so_many_men_leaving_the_democratic_party/,/r/NeutralPolitics/comments/1gklb9t/why_are_so_many_men_leaving_the_democratic_party/
elon musk,NeutralPolitics,General Politics,610787,What is the impact of Elon Musk's political engagement on the current U.S. election?,72,40,No,No,0,https://www.reddit.com/r/NeutralPolitics/comments/1gki55b/what_is_the_impact_of_elon_musks_political/,/r/NeutralPolitics/comments/1gki55b/what_is_the_impact_of_elon_musks_political/
ai,NeutralPolitics,General Politics,610787,"What are the pros and cons of predictive election models, like 538, for our discourse around elections?",40,94,No,No,0,https://www.reddit.com/r/NeutralPolitics/comments/1giqib5/what_are_the_pros_and_cons_of_predictive_election/,/r/NeutralPolitics/comments/1giqib5/what_are_the_pros_and_cons_of_predictive_election/
ai,NeutralPolitics,General Politics,610787,Why are there organizations whose only goal is to make sure people vote? ,49,36,No,No,0,https://www.reddit.com/r/NeutralPolitics/comments/1ggtk67/why_are_there_organizations_whose_only_goal_is_to/,/r/NeutralPolitics/comments/1ggtk67/why_are_there_organizations_whose_only_goal_is_to/
ai,moderatepolitics,General Politics,296787,What Explains the Doctor Shortage in America?,42,87,No,No,0,https://church.substack.com/p/what-explains-the-doctor-shortage,/r/moderatepolitics/comments/1gvw0vu/what_explains_the_doctor_shortage_in_america/
ai,moderatepolitics,General Politics,296787,"Biden approves antipersonnel mines for Ukraine, undoing his own policy",177,204,No,No,0,https://www.washingtonpost.com/national-security/2024/11/19/biden-landmines-ukraine-russia,/r/moderatepolitics/comments/1gvgo0a/biden_approves_antipersonnel_mines_for_ukraine/
ai,moderatepolitics,General Politics,296787,Trump picks TV's Dr. Oz to run Medicare and Medicaid,487,657,No,No,0,https://www.reuters.com/world/us/trump-picks-dr-oz-serve-cms-administrator-2024-11-19/,/r/moderatepolitics/comments/1gv93g1/trump_picks_tvs_dr_oz_to_run_medicare_and_medicaid/
ai,moderatepolitics,General Politics,296787,MTG says she will expose ‘sexual harassment claims’ against Republicans if Gaetz report released,293,126,No,No,0,https://www.independent.co.uk/news/world/americas/us-politics/marjorie-taylor-greene-matt-gaetz-ethics-report-b2650038.html,/r/moderatepolitics/comments/1gv90f1/mtg_says_she_will_expose_sexual_harassment_claims/
ai,moderatepolitics,General Politics,296787,“It’s time to clean up shop”: Justice Democrats vow primary challenges against establishment Dems,232,361,No,No,0,https://www.salon.com/2024/11/17/its-time-to-clean-up-shop-justice-democrats-vow-primary-challenges-against-establishment-dems/,/r/moderatepolitics/comments/1gv4hka/its_time_to_clean_up_shop_justice_democrats_vow/
ai,moderatepolitics,General Politics,296787,Case Preview: United States v. Skrmetti,79,293,No,No,0,https://www.reddit.com/r/moderatepolitics/comments/1gv0jsz/case_preview_united_states_v_skrmetti/,/r/moderatepolitics/comments/1gv0jsz/case_preview_united_states_v_skrmetti/
ai,technology,General Politics,17426190,Hi! We're the hosts of WIRED's new tech culture podcast Uncanny Valley. AM(us)A!,46,53,Yes,No,0,https://www.reddit.com/r/technology/comments/1gftoz0/hi_were_the_hosts_of_wireds_new_tech_culture/,/r/technology/comments/1gftoz0/hi_were_the_hosts_of_wireds_new_tech_culture/
ai,technology,General Politics,17426190,"Cable companies and Trump’s FCC chair agree: Data caps are good for you | Data caps reflect ""highly competitive environment,"" cable lobby tells FCC.",4394,693,No,No,0,https://arstechnica.com/tech-policy/2024/11/cable-companies-and-trumps-fcc-chair-agree-data-caps-are-good-for-you/,/r/technology/comments/1gvn11s/cable_companies_and_trumps_fcc_chair_agree_data/
ai,technology,General Politics,17426190,Anyone Can Buy Data Tracking US Soldiers and Spies to Nuclear Vaults and Brothels in Germany - More than 3 billion phone coordinates collected by a US data broker expose the detailed movements of US military and intelligence workers in Germany—and the Pentagon is powerless to stop it.,489,17,No,No,0,https://www.wired.com/story/phone-data-us-soldiers-spies-nuclear-germany/,/r/technology/comments/1gvrb5u/anyone_can_buy_data_tracking_us_soldiers_and/
ai,technology,General Politics,17426190,Inside the Booming 'AI Pimping' Industry | AI-generated influencers that steal content from human models and adult content creators have taken over Instagram,265,43,No,No,0,https://www.404media.co/inside-the-booming-ai-pimping-industry-3/,/r/technology/comments/1gvree5/inside_the_booming_ai_pimping_industry/
ai,technology,General Politics,17426190,Bluesky Sees Greatest Sustained Growth So Far in the US and UK,3330,152,No,No,0,https://www.similarweb.com/blog/insights/social-media-news/bluesky-sustained-growth/,/r/technology/comments/1gvbpxy/bluesky_sees_greatest_sustained_growth_so_far_in/
social media,technology,General Politics,17426190,Tech giants face fines of up to $50 million for flouting proposed social media ban on under-16s,143,42,No,No,0,https://thenightly.com.au/politics/tech-giants-faces-fines-of-up-to-50-million-for-flouting-proposed-social-media-ban-on-under-16s-c-16812310,/r/technology/comments/1gvsr2j/tech_giants_face_fines_of_up_to_50_million_for/
ai,democrats,Ideological Politics,481056,"Do you predict democrats to regain the senate in 2026 and if so, how?",255,335,No,No,0,https://i.redd.it/lctqcuaru22e1.png,/r/democrats/comments/1gvsgm2/do_you_predict_democrats_to_regain_the_senate_in/
ai,democrats,Ideological Politics,481056,Trump will damage this country beyond repair ,504,127,No,No,0,https://i.redd.it/ppci04bvtz1e1.png,/r/democrats/comments/1gvii3s/trump_will_damage_this_country_beyond_repair/
ai,democrats,Ideological Politics,481056,Walmart warns it will have to raise prices if Trump’s tariffs are enacted,1504,160,No,No,0,https://www.independent.co.uk/news/world/americas/walmart-trump-tariffs-cost-of-living-b2650051.html,/r/democrats/comments/1gvav1d/walmart_warns_it_will_have_to_raise_prices_if/
ai,Republican,Ideological Politics,205947,FEMA Chief on the Congressional Hotseat Trying to Explain Why the Agency Bypassed Trump Supporters ,71,18,No,No,0,https://pjmedia.com/rick-moran/2024/11/20/fema-chief-on-the-congressional-hotseat-trying-to-explain-why-trump-supporting-homes-were-bypassed-n4934463#google_vignette,/r/Republican/comments/1gvsfug/fema_chief_on_the_congressional_hotseat_trying_to/
ai,Republican,Ideological Politics,205947,"Democrats Push Through Biden's Leftist Judicial Nominees After Multiple Republican Senators Fail to Show Up | Do Better People, Step Up Or Step Aside 😡",36,1,No,No,0,https://www.westernjournal.com/democrats-push-bidens-leftist-judicial-nominees-multiple-republican-senators-fail-show/,/r/Republican/comments/1gvx8tm/democrats_push_through_bidens_leftist_judicial/
ai,Republican,Ideological Politics,205947,I can’t wait to see what Libeal Reddit had to say about this!!,10,1,No,No,0,https://www.tiktok.com/t/ZP8LqtyAg/,/r/Republican/comments/1gw0oob/i_cant_wait_to_see_what_libeal_reddit_had_to_say/
ai,Conservative,Ideological Politics,1149767,Kamala Harris escapes to Hawaii as Democrats reel from 2024 losses - Washington Examiner,628,189,No,No,0,https://www.washingtonexaminer.com/news/white-house/3235554/kamala-harris-escapes-hawaii-democrats-reel-2024-losses/,/r/Conservative/comments/1gvrjsh/kamala_harris_escapes_to_hawaii_as_democrats_reel/
ai,Libertarian,Ideological Politics,503625,The Salt Mines: Post-Election Meltdowns from around the Internet. These Sodium levels are off the chart! Link some election Schadenfreude you found.,77,161,Yes,No,0,https://www.reddit.com/r/Libertarian/comments/1glfw5m/the_salt_mines_postelection_meltdowns_from_around/,/r/Libertarian/comments/1glfw5m/the_salt_mines_postelection_meltdowns_from_around/
ai,Libertarian,Ideological Politics,503625,Explaining liberty to my toddler,152,11,No,No,0,https://www.reddit.com/r/Libertarian/comments/1gvu8a4/explaining_liberty_to_my_toddler/,/r/Libertarian/comments/1gvu8a4/explaining_liberty_to_my_toddler/
ai,Libertarian,Ideological Politics,503625,"Here is Mike Rogers declaring his full support for FISA wiretapping. He also says he wishes the Intel Community didn’t need a warrant. The neocons want him as FBI Director, libertarians should use every bit of their influence to push against this.",168,17,No,No,0,https://v.redd.it/hq9xd1j1o22e1,/r/Libertarian/comments/1gvrm9x/here_is_mike_rogers_declaring_his_full_support/
ai,Libertarian,Ideological Politics,503625,"Biden approves antipersonnel mines for Ukraine, undoing his own policy",140,41,No,No,0,https://www.washingtonpost.com/national-security/2024/11/19/biden-landmines-ukraine-russia/,/r/Libertarian/comments/1gvevfw/biden_approves_antipersonnel_mines_for_ukraine/
ai,Libertarian,Ideological Politics,503625,"Javier Milei created a security agency to implement AI-driven ""pre-crime"" to monitor citizens",48,9,No,No,0,https://www.reddit.com/r/Libertarian/comments/1gvg8lc/javier_milei_created_a_security_agency_to/,/r/Libertarian/comments/1gvg8lc/javier_milei_created_a_security_agency_to/
ai,Anarchism,Ideological Politics,271362,Radical Women Wednesday,5,0,Yes,No,0,https://www.reddit.com/r/Anarchism/comments/1gviwgf/radical_women_wednesday/,/r/Anarchism/comments/1gviwgf/radical_women_wednesday/
ai,Anarchism,Ideological Politics,271362,The Case for Resistance: What We’re Up Against—and What It Could Look Like to Fight 🏴,55,3,No,No,0,/r/CrimethInc/comments/1gvgplg/the_case_for_resistance_what_were_up_againstand/,/r/Anarchism/comments/1gvgpto/the_case_for_resistance_what_were_up_againstand/
ai,Anarchism,Ideological Politics,271362,Alternative Practices for US nonprofits,8,3,No,No,0,https://www.reddit.com/r/Anarchism/comments/1gvg6im/alternative_practices_for_us_nonprofits/,/r/Anarchism/comments/1gvg6im/alternative_practices_for_us_nonprofits/
ai,Anarchism,Ideological Politics,271362,Any Advice on Purifying Water,45,37,No,No,0,https://www.reddit.com/r/Anarchism/comments/1gv1v5y/any_advice_on_purifying_water/,/r/Anarchism/comments/1gv1v5y/any_advice_on_purifying_water/
ai,Anarchism,Ideological Politics,271362,issues with orbit,8,1,No,No,0,https://www.reddit.com/r/Anarchism/comments/1gvdsua/issues_with_orbit/,/r/Anarchism/comments/1gvdsua/issues_with_orbit/
ai,Anarchism,Ideological Politics,271362,Hoi4 Anarchist Expanison Mods?,2,1,No,No,0,https://www.reddit.com/r/Anarchism/comments/1gv6jrj/hoi4_anarchist_expanison_mods/,/r/Anarchism/comments/1gv6jrj/hoi4_anarchist_expanison_mods/
ai,Socialism,Ideological Politics,461336,🏳️‍⚧️🗣️ When Trans Youth Are Under Attack: STAND UP & FIGHT BACK! Join the PSL for a rally at the Statehouse to fight back against the Ohio Congress and Gov. DeWine passing a bill that attacks trans rights and trans youth! ,57,2,No,No,0,https://i.redd.it/2ljowaqc632e1.jpeg,/r/socialism/comments/1gvu007/when_trans_youth_are_under_attack_stand_up_fight/
ai,Socialism,Ideological Politics,461336,"Black Alliance for Peace: No Matter Who Sits in the White Peoples’ House, the War Being Waged by the U.S. Colonial/Capitalist Class Against the Black Colonized Working Class and All Oppressed Peoples and Nations Will Continue",48,1,No,No,0,https://www.blackagendareport.com/no-matter-who-sits-white-peoples-house-war-being-waged-us-colonialcapitalist-class-against-black,/r/socialism/comments/1gvq007/black_alliance_for_peace_no_matter_who_sits_in/
ai,Socialism,Ideological Politics,461336,BOYCOTT LOCAL FOODS! CEO Benjy Levit participated his hospitality group in a fundraiser for families of IOF soldiers actively committing genocide in Gaza. ,16,3,No,No,0,https://www.reddit.com/gallery/1gvx2pd,/r/socialism/comments/1gvx2pd/boycott_local_foods_ceo_benjy_levit_participated/
ai,Socialism,Ideological Politics,461336,Do you still argue with Zionists?,4,3,No,No,0,https://www.reddit.com/r/socialism/comments/1gw0zgz/do_you_still_argue_with_zionists/,/r/socialism/comments/1gw0zgz/do_you_still_argue_with_zionists/
ai,Socialism,Ideological Politics,461336,"Findings of the 56th Report of the Special Committee to Investigate Israeli Practices Affecting the Human Rights of the Palestinian People & Other Arabs of the Occupied Territories, delivered by H.E. Mohan Pieris, to the 4th Committee of the 79th Session of the UNGA, on 18.11.24",11,1,No,No,0,https://v.redd.it/q7kxkmpzp22e1,/r/socialism/comments/1gvruf8/findings_of_the_56th_report_of_the_special/
ai,Socialism,Ideological Politics,461336,Linda McMahon for Secretary...of Education? ➡️ WWE co-founder Linda McMahon is part of a long tradition of ultra-rich individuals with no professional qualifications whatsoever taking up the destruction of public education essentially as a personal hobby. ,2,0,No,No,0,https://www.reddit.com/gallery/1gw0zrs,/r/socialism/comments/1gw0zrs/linda_mcmahon_for_secretaryof_education_wwe/
ai,Progressive,Ideological Politics,78120,Proposition 32: Measure to Raise California's Minimum Wage Rejected,32,1,No,No,0,https://www.kqed.org/news/12012798/prop-32-measure-to-raise-californias-minimum-wage-remains-too-close-to-call,/r/progressive/comments/1gvn2pd/proposition_32_measure_to_raise_californias/
ai,Progressive,Ideological Politics,78120,"Despite Trump’s Win, School Vouchers Were Again Rejected by Majorities of Voters",1,0,No,No,0,https://www.propublica.org/article/school-vouchers-2024-election-trump,/r/progressive/comments/1guls4r/despite_trumps_win_school_vouchers_were_again/
ai,Progressive,Ideological Politics,78120,Brown not ruling out run for remainder of Vance’s Senate term,1,0,No,No,0,https://thehill.com/homenews/campaign/4992997-brown-vance-senate-term-ohio/amp/,/r/progressive/comments/1gtbps2/brown_not_ruling_out_run_for_remainder_of_vances/
ai,Progressive,Ideological Politics,78120,Behind the Curtain: Trump's business bonanza,16,2,No,No,0,https://www.axios.com/2024/11/07/trump-elon-musk-business-tax-cuts,/r/progressive/comments/1gm4w17/behind_the_curtain_trumps_business_bonanza/
ai,Progressive,Ideological Politics,78120,Billionaires vs Democracy - The rich are trying to buy elections all over the world and consign democracy to the trash bin of history.,291,12,No,No,0,https://inequality.org/research/billionaires-vs-democracy/,/r/progressive/comments/1ggh1hg/billionaires_vs_democracy_the_rich_are_trying_to/
ai,Progressive,Ideological Politics,78120,A Texas Woman Died After Waiting 40 Hours for Miscarriage Care,296,6,No,No,0,https://www.propublica.org/article/josseli-barnica-death-miscarriage-texas-abortion-ban,/r/progressive/comments/1gfmamd/a_texas_woman_died_after_waiting_40_hours_for/
ai,Republicanism,Ideological Politics,916,Why are monarchists cherry-pickers?,7,0,No,No,0,https://www.reddit.com/r/republicanism/comments/1c22ytx/why_are_monarchists_cherrypickers/,/r/republicanism/comments/1c22ytx/why_are_monarchists_cherrypickers/
ai,Republicanism,Ideological Politics,916,Pro-British monarchy Indian Christian saying mocking the name-reverting done by our governments (especially the renaming of Bombay to Mumbai) and openly doing sedition by saying that Charles III should be the Emperor of India and 'God Save the King' should be the Indian anthem.,3,0,No,No,0,https://www.reddit.com/gallery/1b2xwq8,/r/republicanism/comments/1b2xwq8/probritish_monarchy_indian_christian_saying/
ai,Republicanism,Ideological Politics,916,“Away with college gen ed”,0,4,No,Yes,0,https://www.reddit.com/r/republicanism/comments/19asm4l/away_with_college_gen_ed/,/r/republicanism/comments/19asm4l/away_with_college_gen_ed/
ai,Republicanism,Ideological Politics,916,Question from a Monarchist,8,20,No,No,0,https://www.reddit.com/r/republicanism/comments/z0zqv0/question_from_a_monarchist/,/r/republicanism/comments/z0zqv0/question_from_a_monarchist/
RFK,Conservatives,Ideological Politics,108298,Why Americans Like Me Love The Idea Of RFK Leading HHS,11,0,No,No,0,https://thefederalist.com/2024/11/20/americans-sick-of-meds-that-dont-restore-health-love-the-idea-of-rfk-leading-hhs/,/r/conservatives/comments/1gvtp1h/why_americans_like_me_love_the_idea_of_rfk/
ai,Conservatives,Ideological Politics,108298,‘Don’t Cross That Line’: Trump Border Czar Warns Mayors Against Harboring Illegal Immigrants,93,1,No,No,0,https://www.dailywire.com/news/dont-cross-that-line-trump-border-czar-warns-mayors-against-harboring-illegal-immigrants,/r/conservatives/comments/1gvhtak/dont_cross_that_line_trump_border_czar_warns/
ai,dailywire,Ideological Politics,24272,Wall of Hate - Help Document Hatred Against Trump on July13th.com,79,16,Yes,No,0,https://july13th.com/hate/,/r/dailywire/comments/1e3cqx8/wall_of_hate_help_document_hatred_against_trump/
ai,dailywire,Ideological Politics,24272,I hope they do levy a challenge.,52,18,No,Yes,0,https://youtu.be/-m5cmNt5x9U?si=e7iPDu3dEWHnhQyB,/r/dailywire/comments/1gs0n9f/i_hope_they_do_levy_a_challenge/
