Keyword,Subreddit,Category,Members,Title,Upvotes,Comments,Moderator Interaction,Fact-Checking Mention,Total Awards,URL,Original Post URL
poll,News,General Politics,28951052,India’s capital chokes as air pollution levels hit 50 times the safe limit,1710,147,No,No,0,https://apnews.com/article/new-delhi-air-pollution-india-ae1ec1e6292009db198f18b113047cd5,/r/news/comments/1gudxzm/indias_capital_chokes_as_air_pollution_levels_hit/
Texas,News,General Politics,28951052,'The Voice' winner Sundance Head recovers at home after being accidentally shot on his Texas ranch,1384,190,No,No,0,https://abcnews.go.com/US/wireStory/voice-winner-sundance-head-recovers-home-after-accidentally-115946662,/r/news/comments/1gu5rr6/the_voice_winner_sundance_head_recovers_at_home/
survey,PoliticalDiscussion,General Politics,2184573,Casual Questions Thread,46,4882,Yes,No,0,https://www.reddit.com/r/PoliticalDiscussion/comments/1bwbuka/casual_questions_thread/,/r/PoliticalDiscussion/comments/1bwbuka/casual_questions_thread/
vote,PoliticalDiscussion,General Politics,2184573,"For what reason do you believe it is that the public doesn't broadly acknowledge that immigrants are statistically less likely to commit crimes than native born Americans, and instead believe that immigrants are more prone to violence?",409,556,No,Yes,0,https://www.reddit.com/r/PoliticalDiscussion/comments/1gu5dba/for_what_reason_do_you_believe_it_is_that_the/,/r/PoliticalDiscussion/comments/1gu5dba/for_what_reason_do_you_believe_it_is_that_the/
vote,PoliticalDiscussion,General Politics,2184573,"Ecuador has a presidential republic, but also has an interesting mechanism of Simultaneous Death. What do you think are the benefits and adverse effects of such a thing?",37,11,No,No,0,https://www.reddit.com/r/PoliticalDiscussion/comments/1gu2y8x/ecuador_has_a_presidential_republic_but_also_has/,/r/PoliticalDiscussion/comments/1gu2y8x/ecuador_has_a_presidential_republic_but_also_has/
vote,PoliticalDiscussion,General Politics,2184573,Should more Independents run for senate in solid red states?,47,28,No,No,0,https://www.reddit.com/r/PoliticalDiscussion/comments/1gtkt5i/should_more_independents_run_for_senate_in_solid/,/r/PoliticalDiscussion/comments/1gtkt5i/should_more_independents_run_for_senate_in_solid/
vote,PoliticalDiscussion,General Politics,2184573,"The Pennsylvania Senate race is extremely close and heading for a recount.  What's exactly going on there?  Finally, what is the use for provisional ballots in the first place?",1,2,No,No,0,https://www.reddit.com/r/PoliticalDiscussion/comments/1gu73uj/the_pennsylvania_senate_race_is_extremely_close/,/r/PoliticalDiscussion/comments/1gu73uj/the_pennsylvania_senate_race_is_extremely_close/
male,PoliticalDiscussion,General Politics,2184573,Would Biden have won the Presidency?,66,480,No,No,0,https://www.reddit.com/r/PoliticalDiscussion/comments/1gteztp/would_biden_have_won_the_presidency/,/r/PoliticalDiscussion/comments/1gteztp/would_biden_have_won_the_presidency/
survey,PoliticalDiscussion,General Politics,2184573,How Much of America’s Polarization Is Engineered by Foreign Influence?,258,144,No,Yes,0,https://www.reddit.com/r/PoliticalDiscussion/comments/1gt1v4x/how_much_of_americas_polarization_is_engineered/,/r/PoliticalDiscussion/comments/1gt1v4x/how_much_of_americas_polarization_is_engineered/
vote,PoliticalDiscussion,General Politics,2184573,What kind of “energy” would a female politician have to possess to have a shot at the White House?,165,614,No,No,0,https://www.reddit.com/r/PoliticalDiscussion/comments/1gsvz2j/what_kind_of_energy_would_a_female_politician/,/r/PoliticalDiscussion/comments/1gsvz2j/what_kind_of_energy_would_a_female_politician/
vote,NeutralPolitics,General Politics,610739,What to expect after the U.S. election,284,26,Yes,Yes,0,https://www.reddit.com/r/NeutralPolitics/comments/1gflxpk/what_to_expect_after_the_us_election/,/r/NeutralPolitics/comments/1gflxpk/what_to_expect_after_the_us_election/
vote,NeutralPolitics,General Politics,610739,Tracking what bills/decisions are coming to contact reps/senators in a timely manner,37,12,No,No,0,https://www.reddit.com/r/NeutralPolitics/comments/1gqkpdp/tracking_what_billsdecisions_are_coming_to/,/r/NeutralPolitics/comments/1gqkpdp/tracking_what_billsdecisions_are_coming_to/
vote,NeutralPolitics,General Politics,610739,Do any countries have laws to combat politically-driven misinformation?,36,37,No,Yes,0,https://www.reddit.com/r/NeutralPolitics/comments/1gq4agt/do_any_countries_have_laws_to_combat/,/r/NeutralPolitics/comments/1gq4agt/do_any_countries_have_laws_to_combat/
vote,NeutralPolitics,General Politics,610739,Trump won the presidency and popular vote running on the mass deportation of illegal aliens. Who saw this coming and what lessons can be learned?,223,326,No,No,0,https://www.reddit.com/r/NeutralPolitics/comments/1gnk7ih/trump_won_the_presidency_and_popular_vote_running/,/r/NeutralPolitics/comments/1gnk7ih/trump_won_the_presidency_and_popular_vote_running/
poll,NeutralPolitics,General Politics,610739,Is now the time for a NEW moderate third party in U.S. politics?,4,83,No,No,0,https://www.reddit.com/r/NeutralPolitics/comments/1gms9so/is_now_the_time_for_a_new_moderate_third_party_in/,/r/NeutralPolitics/comments/1gms9so/is_now_the_time_for_a_new_moderate_third_party_in/
vote,NeutralPolitics,General Politics,610739,Why Are So Many Men Leaving The Democratic Party Over The Last Few Years?,386,156,No,No,0,https://www.reddit.com/r/NeutralPolitics/comments/1gklb9t/why_are_so_many_men_leaving_the_democratic_party/,/r/NeutralPolitics/comments/1gklb9t/why_are_so_many_men_leaving_the_democratic_party/
vote,NeutralPolitics,General Politics,610739,"What are the pros and cons of predictive election models, like 538, for our discourse around elections?",39,94,No,No,0,https://www.reddit.com/r/NeutralPolitics/comments/1giqib5/what_are_the_pros_and_cons_of_predictive_election/,/r/NeutralPolitics/comments/1giqib5/what_are_the_pros_and_cons_of_predictive_election/
vote,NeutralPolitics,General Politics,610739,Why are there organizations whose only goal is to make sure people vote? ,51,36,No,No,0,https://www.reddit.com/r/NeutralPolitics/comments/1ggtk67/why_are_there_organizations_whose_only_goal_is_to/,/r/NeutralPolitics/comments/1ggtk67/why_are_there_organizations_whose_only_goal_is_to/
vote,moderatepolitics,General Politics,296676,How do Democrats rebuild their coalition?,88,411,No,No,0,https://www.cnn.com/election/2024/exit-polls/national-results/general/president/0,/r/moderatepolitics/comments/1gu3t04/how_do_democrats_rebuild_their_coalition/
poll,moderatepolitics,General Politics,296676,Top pollster Ann Selzer to retire after bombshell Iowa poll ended in huge miss,306,203,No,No,0,https://www.cnn.com/2024/11/17/media/iowa-pollster-ann-selzer-retire-trump-harris/index.html,/r/moderatepolitics/comments/1gtosfc/top_pollster_ann_selzer_to_retire_after_bombshell/
vote,democrats,Ideological Politics,480975,Trump vote count drops below majority,792,165,No,No,0,https://i.redd.it/fwbvmqa4zo1e1.jpeg,/r/democrats/comments/1gu9mp8/trump_vote_count_drops_below_majority/
Texas,democrats,Ideological Politics,480975,Texas Democrats at a crossroads after devastating election,40,22,No,No,0,https://thehill.com/homenews/state-watch/4996197-texas-democrats-loss-strategy/,/r/democrats/comments/1gufxaa/texas_democrats_at_a_crossroads_after_devastating/
white,Socialism,Ideological Politics,461182,"THE PEOPLE OF THE WORLD STAND WITH PALESTINE! This November 29, we call on people all over the world to join us in demonstrating unwavering support for the Palestinian people in the struggle against US-Israeli genocide and occupation.",15,2,No,No,0,https://i.redd.it/r8gcafq9xq1e1.jpeg,/r/socialism/comments/1guj4w0/the_people_of_the_world_stand_with_palestine_this/
vote,Progressive,Ideological Politics,78106,Americans in Puerto Rico can't vote for US president. Their anger at Trump is shaping the race.,341,33,No,No,0,https://apnews.com/article/puerto-rico-trump-joke-garbage-a91e2aafd93a06d32365efa013581b85,/r/progressive/comments/1gh2ab4/americans_in_puerto_rico_cant_vote_for_us/
Texas,Progressive,Ideological Politics,78106,A Texas Woman Died After Waiting 40 Hours for Miscarriage Care,296,6,No,No,0,https://www.propublica.org/article/josseli-barnica-death-miscarriage-texas-abortion-ban,/r/progressive/comments/1gfmamd/a_texas_woman_died_after_waiting_40_hours_for/
michigan,Progressive,Ideological Politics,78106,20k+ attend Michigan Rally,140,2,No,No,0,https://i.redd.it/ywmuqgzbhlxd1.jpeg,/r/progressive/comments/1gelsyg/20k_attend_michigan_rally/
survey,Republicanism,Ideological Politics,917,Survey about your political worldview (18+; 12-14 mins to complete),3,0,No,No,0,https://www.reddit.com/r/republicanism/comments/1aq418a/survey_about_your_political_worldview_18_1214/,/r/republicanism/comments/1aq418a/survey_about_your_political_worldview_18_1214/
vote,Republicanism,Ideological Politics,917,About the Lopez,4,2,No,No,0,https://www.reddit.com/r/republicanism/comments/1094bh5/about_the_lopez/,/r/republicanism/comments/1094bh5/about_the_lopez/
vote,Conservatives,Ideological Politics,108286,Trump’s Historic Win: First Republican President to Cross 76 Million Votes,71,4,No,No,0,https://medium.com/@sdiraguide/trumps-historic-win-first-republican-president-to-cross-76-million-votes-6fa1a03a2236,/r/conservatives/comments/1gu8ezn/trumps_historic_win_first_republican_president_to/
vote,Conservatives,Ideological Politics,108286,Letting Their Freak Flags Fly: More and More Secret Trump Voters Revealing Themselves,39,1,No,No,0,https://redstate.com/bobhoge/2024/11/17/letting-their-freak-flags-fly-more-and-more-secret-trump-voters-revealing-themselves-n2182122,/r/conservatives/comments/1gu3zun/letting_their_freak_flags_fly_more_and_more/
vote,dailywire,Ideological Politics,24271,I hope they do levy a challenge.,49,18,No,Yes,0,https://youtu.be/-m5cmNt5x9U?si=e7iPDu3dEWHnhQyB,/r/dailywire/comments/1gs0n9f/i_hope_they_do_levy_a_challenge/
vote,dailywire,Ideological Politics,24271,These election meltdowns keep getting better,294,42,No,No,0,https://i.redd.it/rierxc82rw0e1.jpeg,/r/dailywire/comments/1grb58d/these_election_meltdowns_keep_getting_better/
vote,Liberal,Ideological Politics,119948,Trump vote count drops below majority,376,67,No,No,0,https://www.cookpolitical.com/vote-tracker/2024/electoral-college,/r/Liberal/comments/1gu85x0/trump_vote_count_drops_below_majority/
vote,Liberal,Ideological Politics,119948,It's official: Donald Trump will use the military to deport Immigrants ,220,131,No,No,0,https://abcnews.go.com/Politics/trump-confirms-plan-declare-national-emergency-military-mass/story?id=115963448,/r/Liberal/comments/1gu8b7s/its_official_donald_trump_will_use_the_military/
vote,Liberal,Ideological Politics,119948,Democrats should let Trump run wild if they want to save country and party,208,142,No,No,0,https://www.reddit.com/r/Liberal/comments/1gtteom/democrats_should_let_trump_run_wild_if_they_want/,/r/Liberal/comments/1gtteom/democrats_should_let_trump_run_wild_if_they_want/
vote,Liberal,Ideological Politics,119948,Gabbard's sympathetic views toward Russia cause alarm as Trump's pick to lead intelligence services,69,10,No,No,0,https://apnews.com/article/gabbard-trump-putin-intelligence-russia-syria-a798adaf9cd531a5d0c9329f7597f0f6,/r/Liberal/comments/1gteen5/gabbards_sympathetic_views_toward_russia_cause/
vote,Liberal,Ideological Politics,119948,FAFO STORY TIME!,19,18,No,No,0,https://www.reddit.com/r/Liberal/comments/1gtbqeq/fafo_story_time/,/r/Liberal/comments/1gtbqeq/fafo_story_time/
vote,KamalaHarris,Ideological Politics,74795,"Dear VP Kamala Harris — On behalf of the 69,074,145+ Americans who voted for you, we thank you for your leadership. Thank you for a future-focused, reimagined, unifying and aspirational vision for our country.",2695,150,Yes,No,0,https://www.deseret.com/opinion/2024/11/15/thank-you-vice-president-kamala-harris/,/r/KamalaHarris/comments/1gszdtt/dear_vp_kamala_harris_on_behalf_of_the_69074145/
vote,KamalaHarris,Ideological Politics,74795,"'We can't come together': Trump voters win election, lose family and friends as values clash",953,128,No,No,0,https://v.redd.it/9fqmgoq0ii1e1,/r/KamalaHarris/comments/1gtl9cc/we_cant_come_together_trump_voters_win_election/
vote,KamalaHarris,Ideological Politics,74795,AOC Directly Addresses People Who Voted For Both Her And Trump,844,110,No,No,0,https://www.huffpost.com/entry/aoc-trump-voters_n_67320370e4b052f25adcff55,/r/KamalaHarris/comments/1gsyo0m/aoc_directly_addresses_people_who_voted_for_both/
vote,KamalaHarris,Ideological Politics,74795,Trump pro-Israel picks mock anti-Harris pro-Palestinian protest vote,541,58,No,No,0,https://forward.com/opinion/674533/trump-rubio-huckabee-stefanik-israel,/r/KamalaHarris/comments/1gsrmxw/trump_proisrael_picks_mock_antiharris/
vote,Impeach_Trump,Ideological Politics,60504,This is an amazing article written by user u/SilkyFluffs in r/democrats which is an amazing resource for combating GOP and Trump misinformation and possibly even converting family members or undecided voters,46,0,No,Yes,0,https://pdflink.to/d6e0bc9d/,/r/Impeach_Trump/comments/1ggd0pc/this_is_an_amazing_article_written_by_user/
