Keyword,Subreddit,Category,Members,Title,Upvotes,Comments,Moderator Interaction,Fact-Checking Mention,Total Awards,URL,Original Post URL
survey,PoliticalDiscussion,General Politics,2184532,Casual Questions Thread,43,4888,Yes,No,0,https://www.reddit.com/r/PoliticalDiscussion/comments/1bwbuka/casual_questions_thread/,/r/PoliticalDiscussion/comments/1bwbuka/casual_questions_thread/
vote,PoliticalDiscussion,General Politics,2184532,"For what reason do you believe it is that the public doesn't broadly acknowledge that immigrants are statistically less likely to commit crimes than native born Americans, and instead believe that immigrants are more prone to violence?",504,672,No,Yes,0,https://www.reddit.com/r/PoliticalDiscussion/comments/1gu5dba/for_what_reason_do_you_believe_it_is_that_the/,/r/PoliticalDiscussion/comments/1gu5dba/for_what_reason_do_you_believe_it_is_that_the/
vote,PoliticalDiscussion,General Politics,2184532,"The Pennsylvania Senate race is extremely close and heading for a recount.  What's exactly going on there?  Finally, what is the use for provisional ballots in the first place?",198,84,No,No,0,https://www.reddit.com/r/PoliticalDiscussion/comments/1gu73uj/the_pennsylvania_senate_race_is_extremely_close/,/r/PoliticalDiscussion/comments/1gu73uj/the_pennsylvania_senate_race_is_extremely_close/
vote,PoliticalDiscussion,General Politics,2184532,"Ecuador has a presidential republic, but also has an interesting mechanism of Simultaneous Death. What do you think are the benefits and adverse effects of such a thing?",43,14,No,No,0,https://www.reddit.com/r/PoliticalDiscussion/comments/1gu2y8x/ecuador_has_a_presidential_republic_but_also_has/,/r/PoliticalDiscussion/comments/1gu2y8x/ecuador_has_a_presidential_republic_but_also_has/
vote,PoliticalDiscussion,General Politics,2184532,Should more Independents run for senate in solid red states?,56,31,No,No,0,https://www.reddit.com/r/PoliticalDiscussion/comments/1gtkt5i/should_more_independents_run_for_senate_in_solid/,/r/PoliticalDiscussion/comments/1gtkt5i/should_more_independents_run_for_senate_in_solid/
male,PoliticalDiscussion,General Politics,2184532,Would Biden have won the Presidency?,80,536,No,No,0,https://www.reddit.com/r/PoliticalDiscussion/comments/1gteztp/would_biden_have_won_the_presidency/,/r/PoliticalDiscussion/comments/1gteztp/would_biden_have_won_the_presidency/
survey,PoliticalDiscussion,General Politics,2184532,How Much of America’s Polarization Is Engineered by Foreign Influence?,269,146,No,Yes,0,https://www.reddit.com/r/PoliticalDiscussion/comments/1gt1v4x/how_much_of_americas_polarization_is_engineered/,/r/PoliticalDiscussion/comments/1gt1v4x/how_much_of_americas_polarization_is_engineered/
white,PoliticalDiscussion,General Politics,2184532,"Do democrats stand a chance to win back the house and or senate in the midterms in 2026? Currently, republicans have all 3 just like they did in 2016 . ",23,83,No,No,0,https://www.reddit.com/r/PoliticalDiscussion/comments/1gtbji9/do_democrats_stand_a_chance_to_win_back_the_house/,/r/PoliticalDiscussion/comments/1gtbji9/do_democrats_stand_a_chance_to_win_back_the_house/
vote,NeutralPolitics,General Politics,610753,What to expect after the U.S. election,281,26,Yes,Yes,0,https://www.reddit.com/r/NeutralPolitics/comments/1gflxpk/what_to_expect_after_the_us_election/,/r/NeutralPolitics/comments/1gflxpk/what_to_expect_after_the_us_election/
vote,NeutralPolitics,General Politics,610753,Tracking what bills/decisions are coming to contact reps/senators in a timely manner,34,12,No,No,0,https://www.reddit.com/r/NeutralPolitics/comments/1gqkpdp/tracking_what_billsdecisions_are_coming_to/,/r/NeutralPolitics/comments/1gqkpdp/tracking_what_billsdecisions_are_coming_to/
vote,NeutralPolitics,General Politics,610753,Do any countries have laws to combat politically-driven misinformation?,36,39,No,Yes,0,https://www.reddit.com/r/NeutralPolitics/comments/1gq4agt/do_any_countries_have_laws_to_combat/,/r/NeutralPolitics/comments/1gq4agt/do_any_countries_have_laws_to_combat/
vote,NeutralPolitics,General Politics,610753,Trump won the presidency and popular vote running on the mass deportation of illegal aliens. Who saw this coming and what lessons can be learned?,227,326,No,No,0,https://www.reddit.com/r/NeutralPolitics/comments/1gnk7ih/trump_won_the_presidency_and_popular_vote_running/,/r/NeutralPolitics/comments/1gnk7ih/trump_won_the_presidency_and_popular_vote_running/
poll,NeutralPolitics,General Politics,610753,Is now the time for a NEW moderate third party in U.S. politics?,4,83,No,No,0,https://www.reddit.com/r/NeutralPolitics/comments/1gms9so/is_now_the_time_for_a_new_moderate_third_party_in/,/r/NeutralPolitics/comments/1gms9so/is_now_the_time_for_a_new_moderate_third_party_in/
vote,NeutralPolitics,General Politics,610753,Why Are So Many Men Leaving The Democratic Party Over The Last Few Years?,390,156,No,No,0,https://www.reddit.com/r/NeutralPolitics/comments/1gklb9t/why_are_so_many_men_leaving_the_democratic_party/,/r/NeutralPolitics/comments/1gklb9t/why_are_so_many_men_leaving_the_democratic_party/
vote,NeutralPolitics,General Politics,610753,"What are the pros and cons of predictive election models, like 538, for our discourse around elections?",40,94,No,No,0,https://www.reddit.com/r/NeutralPolitics/comments/1giqib5/what_are_the_pros_and_cons_of_predictive_election/,/r/NeutralPolitics/comments/1giqib5/what_are_the_pros_and_cons_of_predictive_election/
vote,NeutralPolitics,General Politics,610753,Why are there organizations whose only goal is to make sure people vote? ,50,36,No,No,0,https://www.reddit.com/r/NeutralPolitics/comments/1ggtk67/why_are_there_organizations_whose_only_goal_is_to/,/r/NeutralPolitics/comments/1ggtk67/why_are_there_organizations_whose_only_goal_is_to/
vote,moderatepolitics,General Politics,296711,"1% Swing in Vote Would Have Changed Presidential, House Results",56,52,No,No,0,https://reason.com/volokh/2024/11/18/1-swing-in-vote-would-have-changed-presidential-house-results/,/r/moderatepolitics/comments/1gv4or5/1_swing_in_vote_would_have_changed_presidential/
male,moderatepolitics,General Politics,296711,Case Preview: United States v. Skrmetti,49,134,No,No,0,https://www.reddit.com/r/moderatepolitics/comments/1gv0jsz/case_preview_united_states_v_skrmetti/,/r/moderatepolitics/comments/1gv0jsz/case_preview_united_states_v_skrmetti/
vote,moderatepolitics,General Politics,296711,How do Democrats rebuild their coalition?,121,492,No,No,0,https://www.cnn.com/election/2024/exit-polls/national-results/general/president/0,/r/moderatepolitics/comments/1gu3t04/how_do_democrats_rebuild_their_coalition/
poll,moderatepolitics,General Politics,296711,Top pollster Ann Selzer to retire after bombshell Iowa poll ended in huge miss,338,205,No,No,0,https://www.cnn.com/2024/11/17/media/iowa-pollster-ann-selzer-retire-trump-harris/index.html,/r/moderatepolitics/comments/1gtosfc/top_pollster_ann_selzer_to_retire_after_bombshell/
vote,democrats,Ideological Politics,480992,Democrats won 'highly engaged' voters in 2024 but lost those who barely follow politics at all,1222,174,No,No,0,https://www.nbcnews.com/politics/2024-election/democrats-won-highly-engaged-voters-struggled-everyone-else-2024-rcna179957,/r/democrats/comments/1gukz9o/democrats_won_highly_engaged_voters_in_2024_but/
vote,democrats,Ideological Politics,480992,Trump supporters will come after democrats too,438,208,No,No,0,https://www.nbcnews.com/politics/donald-trump/trump-floats-imprisoning-political-opponents-rcna155543,/r/democrats/comments/1gupuav/trump_supporters_will_come_after_democrats_too/
male,Conservative,Ideological Politics,1148883,Transgender women to be banned from Capitol Hill female bathrooms under new House GOP proposal,1250,313,No,No,0,https://www.foxnews.com/politics/transgender-women-banned-from-capitol-hill-female-bathrooms-under-new-house-gop-proposal,/r/Conservative/comments/1guwmgh/transgender_women_to_be_banned_from_capitol_hill/
vote,Conservative,Ideological Politics,1148883,Minnesota election judge faces charges over accepting unregistered votes | Fox News,309,10,No,No,0,https://www.foxnews.com/politics/minnesota-election-judge-faces-felony-charges-over-accepting-unregistered-votes,/r/Conservative/comments/1guxo1w/minnesota_election_judge_faces_charges_over/
black,Libertarian,Ideological Politics,503632,Public school system in US sucks.,127,55,No,No,0,https://www.reddit.com/r/Libertarian/comments/1gulh48/public_school_system_in_us_sucks/,/r/Libertarian/comments/1gulh48/public_school_system_in_us_sucks/
rural,Socialism,Ideological Politics,461281,Join us on November 23rd at 2pm at the Lockheed Martin in Ocala to demand an end to the genocide of Palestine and an end to genocide factories in our backyard🔻🇵🇸🇵🇸🇵🇸🔻,9,2,No,No,0,https://www.reddit.com/gallery/1gv5h9x,/r/socialism/comments/1gv5h9x/join_us_on_november_23rd_at_2pm_at_the_lockheed/
white,Socialism,Ideological Politics,461281,"THE PEOPLE OF THE WORLD STAND WITH PALESTINE! This November 29, we call on people all over the world to join us in demonstrating unwavering support for the Palestinian people in the struggle against US-Israeli genocide and occupation.",119,2,No,No,0,https://i.redd.it/r8gcafq9xq1e1.jpeg,/r/socialism/comments/1guj4w0/the_people_of_the_world_stand_with_palestine_this/
vote,Progressive,Ideological Politics,78108,Americans in Puerto Rico can't vote for US president. Their anger at Trump is shaping the race.,342,33,No,No,0,https://apnews.com/article/puerto-rico-trump-joke-garbage-a91e2aafd93a06d32365efa013581b85,/r/progressive/comments/1gh2ab4/americans_in_puerto_rico_cant_vote_for_us/
Texas,Progressive,Ideological Politics,78108,A Texas Woman Died After Waiting 40 Hours for Miscarriage Care,298,6,No,No,0,https://www.propublica.org/article/josseli-barnica-death-miscarriage-texas-abortion-ban,/r/progressive/comments/1gfmamd/a_texas_woman_died_after_waiting_40_hours_for/
michigan,Progressive,Ideological Politics,78108,20k+ attend Michigan Rally,140,2,No,No,0,https://i.redd.it/ywmuqgzbhlxd1.jpeg,/r/progressive/comments/1gelsyg/20k_attend_michigan_rally/
survey,Republicanism,Ideological Politics,917,Survey about your political worldview (18+; 12-14 mins to complete),3,0,No,No,0,https://www.reddit.com/r/republicanism/comments/1aq418a/survey_about_your_political_worldview_18_1214/,/r/republicanism/comments/1aq418a/survey_about_your_political_worldview_18_1214/
vote,Republicanism,Ideological Politics,917,About the Lopez,4,2,No,No,0,https://www.reddit.com/r/republicanism/comments/1094bh5/about_the_lopez/,/r/republicanism/comments/1094bh5/about_the_lopez/
vote,dailywire,Ideological Politics,24271,I hope they do levy a challenge.,49,18,No,Yes,0,https://youtu.be/-m5cmNt5x9U?si=e7iPDu3dEWHnhQyB,/r/dailywire/comments/1gs0n9f/i_hope_they_do_levy_a_challenge/
vote,dailywire,Ideological Politics,24271,These election meltdowns keep getting better,290,42,No,No,0,https://i.redd.it/rierxc82rw0e1.jpeg,/r/dailywire/comments/1grb58d/these_election_meltdowns_keep_getting_better/
vote,Liberal,Ideological Politics,119945,Was the Democratic Party this Quiet in 2016 after Trump Won?,122,130,No,No,0,https://www.reddit.com/r/Liberal/comments/1guxn5s/was_the_democratic_party_this_quiet_in_2016_after/,/r/Liberal/comments/1guxn5s/was_the_democratic_party_this_quiet_in_2016_after/
black,Liberal,Ideological Politics,119945,"I'm worried Putin will ""test"" Trump in January.",51,37,No,No,0,https://www.reddit.com/r/Liberal/comments/1gv3wxs/im_worried_putin_will_test_trump_in_january/,/r/Liberal/comments/1gv3wxs/im_worried_putin_will_test_trump_in_january/
vote,Liberal,Ideological Politics,119945,ELI5 why is labor explotation suddenly okay,37,52,No,No,0,https://www.reddit.com/r/Liberal/comments/1guwjsg/eli5_why_is_labor_explotation_suddenly_okay/,/r/Liberal/comments/1guwjsg/eli5_why_is_labor_explotation_suddenly_okay/
vote,Liberal,Ideological Politics,119945,What were republicans like before Trump? TLDR at the bottom,12,31,No,Yes,0,https://www.reddit.com/r/Liberal/comments/1gv3l0j/what_were_republicans_like_before_trump_tldr_at/,/r/Liberal/comments/1gv3l0j/what_were_republicans_like_before_trump_tldr_at/
vote,Liberal,Ideological Politics,119945,How Can Non-Republican Voters Show Support for America?,6,5,No,No,0,https://www.reddit.com/r/Liberal/comments/1gv4wov/how_can_nonrepublican_voters_show_support_for/,/r/Liberal/comments/1gv4wov/how_can_nonrepublican_voters_show_support_for/
vote,Liberal,Ideological Politics,119945,Trump vote count drops below majority,580,87,No,No,0,https://www.cookpolitical.com/vote-tracker/2024/electoral-college,/r/Liberal/comments/1gu85x0/trump_vote_count_drops_below_majority/
vote,Liberal,Ideological Politics,119945,It's official: Donald Trump will use the military to deport Immigrants ,332,156,No,No,0,https://abcnews.go.com/Politics/trump-confirms-plan-declare-national-emergency-military-mass/story?id=115963448,/r/Liberal/comments/1gu8b7s/its_official_donald_trump_will_use_the_military/
vote,Liberal,Ideological Politics,119945,AI's Solution to the 2024/2028 Election,49,16,No,Yes,0,https://www.reddit.com/r/Liberal/comments/1gujrx2/ais_solution_to_the_20242028_election/,/r/Liberal/comments/1gujrx2/ais_solution_to_the_20242028_election/
vote,KamalaHarris,Ideological Politics,74672,"'We can't come together': Trump voters win election, lose family and friends as values clash",1105,145,No,No,0,https://v.redd.it/9fqmgoq0ii1e1,/r/KamalaHarris/comments/1gtl9cc/we_cant_come_together_trump_voters_win_election/
vote,Impeach_Trump,Ideological Politics,60494,This is an amazing article written by user u/SilkyFluffs in r/democrats which is an amazing resource for combating GOP and Trump misinformation and possibly even converting family members or undecided voters,45,0,No,Yes,0,https://pdflink.to/d6e0bc9d/,/r/Impeach_Trump/comments/1ggd0pc/this_is_an_amazing_article_written_by_user/
