Keyword,Subreddit,Category,Members,Title,Upvotes,Comments,Moderator Interaction,Fact-Checking Mention,Total Awards,URL,Original Post URL
europe,Wikileaks,General Politics,177620,"Finally Free, Assange Receives a Measure of Justice From the Council of Europe",38,1,No,No,0,https://truthout.org/articles/finally-free-assange-receives-a-measure-of-justice-from-the-council-of-europe/,/r/WikiLeaks/comments/1fxlpkt/finally_free_assange_receives_a_measure_of/
War,Wikileaks,General Politics,177620,Parliamentary Assembly recognises Julian Assange as a ‘political prisoner’ and warns against the chilling effect of his harsh treatment,40,0,No,No,0,https://www.coe.int/en/web/portal/-/pace-recognises-julian-assange-as-a-political-prisoner-and-warns-against-the-chilling-effect-of-his-harsh-treatment,/r/WikiLeaks/comments/1fx0tn0/parliamentary_assembly_recognises_julian_assange/
europe,Wikileaks,General Politics,177620,Julian Assange attends hearing on his detention and conviction at the Council of Europe,21,1,No,No,0,https://www.youtube.com/watch?v=hzHktIKyt-w,/r/WikiLeaks/comments/1fu7cca/julian_assange_attends_hearing_on_his_detention/
europe,Wikileaks,General Politics,177620,Julian to speak at a parliamentary hearing in Strasbourg on the chilling effect on human rights his treatment has had.,25,0,No,No,0,https://www.reddit.com/r/WikiLeaks/comments/1ftadxc/julian_to_speak_at_a_parliamentary_hearing_in/,/r/WikiLeaks/comments/1ftadxc/julian_to_speak_at_a_parliamentary_hearing_in/
israel,Wikileaks,General Politics,177620,The Hezbollah leader killed by Israel professed to want peace,1,20,No,No,0,https://youtu.be/3M1fHfKenTM?si=5By4wuDaS7IRM2hb&t=185s,/r/WikiLeaks/comments/1fryvhy/the_hezbollah_leader_killed_by_israel_professed/
israel,News,General Politics,28912257,US bulldozer shipments to Israel stalled,219,29,No,No,0,https://www.jns.org/us-bulldozer-shipments-to-israel-stalled/,/r/news/comments/1golr5f/us_bulldozer_shipments_to_israel_stalled/
gaza,News,General Politics,28912257,"At least 40 Palestinians killed in Israeli strikes in Gaza, medics say",958,177,No,No,0,https://www.reuters.com/world/middle-east/dozens-killed-wounded-israeli-strike-northern-gazas-jabalia-medics-say-2024-11-10/,/r/news/comments/1goba0c/at_least_40_palestinians_killed_in_israeli/
uk,News,General Politics,28912257,400 Kilos of Cocaine Seized from vessel in UK Coast Operation,84,16,No,No,0,https://smugglewire.com/400-kilos-of-cocaine-seized-in-uk-coast/,/r/news/comments/1goo4f8/400_kilos_of_cocaine_seized_from_vessel_in_uk/
british,News,General Politics,28912257,British teen hit by paraglider in Turkey in serious condition,1516,127,No,No,0,https://www.bbc.com/news/articles/c4gx57j38ljo,/r/news/comments/1go3j93/british_teen_hit_by_paraglider_in_turkey_in/
ukraine,PoliticalDiscussion,General Politics,2184615,How does the world deal with the schizophrenic foreign policy that America has? ,315,310,No,No,0,https://www.reddit.com/r/PoliticalDiscussion/comments/1go363q/how_does_the_world_deal_with_the_schizophrenic/,/r/PoliticalDiscussion/comments/1go363q/how_does_the_world_deal_with_the_schizophrenic/
War,PoliticalDiscussion,General Politics,2184615,"Some say: ""The Resistance is about to Ignite."" Referencing State Actors, such as Governors and AGs, Federal Courts, the Press and the Educators and Civil Society [the People.] Are those guardrails still there to thwart attempts by Trump to usurp the Constitution?",293,363,No,No,0,https://www.reddit.com/r/PoliticalDiscussion/comments/1gnmmyw/some_say_the_resistance_is_about_to_ignite/,/r/PoliticalDiscussion/comments/1gnmmyw/some_say_the_resistance_is_about_to_ignite/
War,PoliticalDiscussion,General Politics,2184615,What are your thoughts on a purge of senior military by the incoming Trump administration?,548,502,No,Yes,0,https://www.reddit.com/r/PoliticalDiscussion/comments/1gnesig/what_are_your_thoughts_on_a_purge_of_senior/,/r/PoliticalDiscussion/comments/1gnesig/what_are_your_thoughts_on_a_purge_of_senior/
War,PoliticalDiscussion,General Politics,2184615,What can Democrats do to not get annihilated in another election? ,446,1881,No,No,0,https://www.reddit.com/r/PoliticalDiscussion/comments/1gn9x6c/what_can_democrats_do_to_not_get_annihilated_in/,/r/PoliticalDiscussion/comments/1gn9x6c/what_can_democrats_do_to_not_get_annihilated_in/
War,PoliticalDiscussion,General Politics,2184615,"What will be the economic, social and political impacts of Trump's mass deportation policy? Will it even go as far as advertised?",74,183,No,No,0,https://www.reddit.com/r/PoliticalDiscussion/comments/1gng8fd/what_will_be_the_economic_social_and_political/,/r/PoliticalDiscussion/comments/1gng8fd/what_will_be_the_economic_social_and_political/
War,PoliticalDiscussion,General Politics,2184615,What will be the impacts of Trump's tariff policy during his second term?,169,311,No,No,0,https://www.reddit.com/r/PoliticalDiscussion/comments/1gmw1a4/what_will_be_the_impacts_of_trumps_tariff_policy/,/r/PoliticalDiscussion/comments/1gmw1a4/what_will_be_the_impacts_of_trumps_tariff_policy/
War,PoliticalDiscussion,General Politics,2184615,Are 'the fall of the Berlin Wall moments' still possible in today's global landscape under isolationism?,4,27,No,No,0,https://www.reddit.com/r/PoliticalDiscussion/comments/1gnec8k/are_the_fall_of_the_berlin_wall_moments_still/,/r/PoliticalDiscussion/comments/1gnec8k/are_the_fall_of_the_berlin_wall_moments_still/
War,PoliticalDiscussion,General Politics,2184615,What will be the path the Republican Party takes moving forward?,77,246,No,No,0,https://www.reddit.com/r/PoliticalDiscussion/comments/1gmse7c/what_will_be_the_path_the_republican_party_takes/,/r/PoliticalDiscussion/comments/1gmse7c/what_will_be_the_path_the_republican_party_takes/
War,NeutralPolitics,General Politics,610491,What to expect after the U.S. election,281,26,Yes,Yes,0,https://www.reddit.com/r/NeutralPolitics/comments/1gflxpk/what_to_expect_after_the_us_election/,/r/NeutralPolitics/comments/1gflxpk/what_to_expect_after_the_us_election/
War,NeutralPolitics,General Politics,610491,Is now the time for a NEW moderate third party in U.S. politics?,0,66,No,No,0,https://www.reddit.com/r/NeutralPolitics/comments/1gms9so/is_now_the_time_for_a_new_moderate_third_party_in/,/r/NeutralPolitics/comments/1gms9so/is_now_the_time_for_a_new_moderate_third_party_in/
War,NeutralPolitics,General Politics,610491,Where is the Western world’s paradigm shift coming from?,104,128,No,Yes,0,https://www.reddit.com/r/NeutralPolitics/comments/1glkk8q/where_is_the_western_worlds_paradigm_shift_coming/,/r/NeutralPolitics/comments/1glkk8q/where_is_the_western_worlds_paradigm_shift_coming/
War,NeutralPolitics,General Politics,610491,Why Are So Many Men Leaving The Democratic Party Over The Last Few Years?,381,156,No,No,0,https://www.reddit.com/r/NeutralPolitics/comments/1gklb9t/why_are_so_many_men_leaving_the_democratic_party/,/r/NeutralPolitics/comments/1gklb9t/why_are_so_many_men_leaving_the_democratic_party/
War,NeutralPolitics,General Politics,610491,How do the Trump and Harris plans for workforce pay and taxes compare?,3,6,No,No,0,https://www.reddit.com/r/NeutralPolitics/comments/1ggxh8w/how_do_the_trump_and_harris_plans_for_workforce/,/r/NeutralPolitics/comments/1ggxh8w/how_do_the_trump_and_harris_plans_for_workforce/
israel,NeutralPolitics,General Politics,610491,"Why does Israel, a nation with a modern first world economy, need ""aid"" from the US as a part of its conflict?",270,77,No,No,0,https://www.reddit.com/r/NeutralPolitics/comments/1gewboa/why_does_israel_a_nation_with_a_modern_first/,/r/NeutralPolitics/comments/1gewboa/why_does_israel_a_nation_with_a_modern_first/
gaza,NeutralPolitics,General Politics,610491,"War involving Israel, Lebanon, and Iran--Motivations? Scale of Conflict?",14,6,No,No,0,https://www.reddit.com/r/NeutralPolitics/comments/1ge5sct/war_involving_israel_lebanon_and_iranmotivations/,/r/NeutralPolitics/comments/1ge5sct/war_involving_israel_lebanon_and_iranmotivations/
ukraine,NeutralPolitics,General Politics,610491,Military coup in Niger (2023-2024) and relationships with western countries/companies ,49,5,No,No,0,https://www.reddit.com/r/NeutralPolitics/comments/1gdv0aw/military_coup_in_niger_20232024_and_relationships/,/r/NeutralPolitics/comments/1gdv0aw/military_coup_in_niger_20232024_and_relationships/
ukraine,moderatepolitics,General Politics,296037,Trump Told Putin Not to Escalate Ukraine War in Post-Election Call – Washington Post - The Moscow Times,192,332,No,No,0,https://www.themoscowtimes.com/2024/11/10/trump-told-putin-not-to-escalate-ukraine-war-in-post-election-call-washington-post-a86973,/r/moderatepolitics/comments/1goakc0/trump_told_putin_not_to_escalate_ukraine_war_in/
europe,moderatepolitics,General Politics,296037,JD Vance says US could drop support for NATO if Europe tries to regulate Elon Musk’s platforms,229,375,No,No,0,https://www.independent.co.uk/news/world/americas/us-politics/jd-vance-elon-musk-x-twitter-donald-trump-b2614525.html,/r/moderatepolitics/comments/1gnhb1q/jd_vance_says_us_could_drop_support_for_nato_if/
War,moderatepolitics,General Politics,296037,Overlooking the key reason Democrat's lost so badly,132,229,No,No,0,https://www.ft.com/content/e8ac09ea-c300-4249-af7d-109003afb893,/r/moderatepolitics/comments/1gncyo2/overlooking_the_key_reason_democrats_lost_so_badly/
War,moderatepolitics,General Politics,296037,Massachusetts Governor Maura Healy’s stance on Donald Trump’s mass deportation of illegal immigrants order,142,278,No,No,0,https://www.dailymail.co.uk/news/article-14059841/amp/massachusetts-governor-maura-healey-donald-trump-deportation-illegal-migrants.html,/r/moderatepolitics/comments/1gncm7t/massachusetts_governor_maura_healys_stance_on/
uk,technology,General Politics,17382853,"Somebody moved UK's oldest satellite, and no-one knows who or why",433,41,No,No,0,https://www.bbc.co.uk/news/articles/cpwrr58801yo,/r/technology/comments/1goa3hz/somebody_moved_uks_oldest_satellite_and_noone/
War,democrats,Ideological Politics,480454,Billionaire Mark Cuban Warns Trump's Tariff Plan Already Hurting American Businesses,1436,126,No,No,0,https://www.ibtimes.com/billionaire-mark-cuban-says-trumps-tariff-plan-already-hurting-american-businesses-3750316,/r/democrats/comments/1go22sx/billionaire_mark_cuban_warns_trumps_tariff_plan/
War,Republican,Ideological Politics,205007,2024 The Ultimate Uno Reverse Card,104,47,No,No,0,https://www.reddit.com/gallery/1goj69a,/r/Republican/comments/1goj69a/2024_the_ultimate_uno_reverse_card/
War,Republican,Ideological Politics,205007,Tucker is warning us the Swamp is still hates Trump,196,33,No,No,0,https://x.com/TuckerCarlson/status/1855344652422951054,/r/Republican/comments/1go0opy/tucker_is_warning_us_the_swamp_is_still_hates/
china,Libertarian,Ideological Politics,503598,China's Birth Encouragement Official Scold And Threaten Young Man For Not Having Kids ,68,12,No,No,0,https://v.redd.it/efgvuho4t40e1,/r/Libertarian/comments/1gojnzl/chinas_birth_encouragement_official_scold_and/
europe,Libertarian,Ideological Politics,503598,"as libertarian what we should do to prevent dictators,violent cult leader,authoritarianism and tribalism rise in power and abuse his power to harm us?",0,7,No,Yes,0,https://www.reddit.com/r/Libertarian/comments/1gojqbp/as_libertarian_what_we_should_do_to_prevent/,/r/Libertarian/comments/1gojqbp/as_libertarian_what_we_should_do_to_prevent/
War,Libertarian,Ideological Politics,503598,Why Isn’t Bush Hated as Much as Trump?,404,297,No,No,0,https://www.reddit.com/r/Libertarian/comments/1gn9ie0/why_isnt_bush_hated_as_much_as_trump/,/r/Libertarian/comments/1gn9ie0/why_isnt_bush_hated_as_much_as_trump/
War,Anarchism,Ideological Politics,270960,So should we prepare for a massive civil war under the Trump administration? What do you think is going to look like? I'm imagining some return of the occupy movement with far more intensity,48,73,No,No,0,https://www.reddit.com/r/Anarchism/comments/1gnjmy2/so_should_we_prepare_for_a_massive_civil_war/,/r/Anarchism/comments/1gnjmy2/so_should_we_prepare_for_a_massive_civil_war/
War,Anarchism,Ideological Politics,270960,Can you recommend any thing in seattle?,11,4,No,No,0,https://www.reddit.com/r/Anarchism/comments/1gnnoip/can_you_recommend_any_thing_in_seattle/,/r/Anarchism/comments/1gnnoip/can_you_recommend_any_thing_in_seattle/
europe,Anarchism,Ideological Politics,270960,"The far-right always had power, but people where ignoring it.",84,14,No,No,0,https://www.reddit.com/r/Anarchism/comments/1gn5884/the_farright_always_had_power_but_people_where/,/r/Anarchism/comments/1gn5884/the_farright_always_had_power_but_people_where/
War,Socialism,Ideological Politics,460703,Capitalism makes you depressed and miserable,114,10,No,Yes,0,https://www.reddit.com/r/socialism/comments/1gobifa/capitalism_makes_you_depressed_and_miserable/,/r/socialism/comments/1gobifa/capitalism_makes_you_depressed_and_miserable/
War,Socialism,Ideological Politics,460703,Is there really a specter of Communism?,24,7,No,No,0,https://www.reddit.com/r/socialism/comments/1gokika/is_there_really_a_specter_of_communism/,/r/socialism/comments/1gokika/is_there_really_a_specter_of_communism/
israel,Socialism,Ideological Politics,460703,The logistics of Yemen’s embargo on international shipping trade with israel through the Red Sea ,192,2,No,No,0,https://v.redd.it/5s4vhvhd430e1,/r/socialism/comments/1go2nzr/the_logistics_of_yemens_embargo_on_international/
gaza,Socialism,Ideological Politics,460703,Do you think we are on the verge of an era?,109,49,No,No,0,https://www.reddit.com/r/socialism/comments/1go065x/do_you_think_we_are_on_the_verge_of_an_era/,/r/socialism/comments/1go065x/do_you_think_we_are_on_the_verge_of_an_era/
War,Socialism,Ideological Politics,460703,"“A capitalist economy requires constant imperialist wars because it has to constantly suppress prices and wages and reorganize production in the global south around accumulation in the core."" 
Highly informative interview with Jason Hickel. Check it out!",17,1,No,No,0,https://open.spotify.com/episode/4fjHfOPBVy8ArslaLbJiBR,/r/socialism/comments/1goc2iw/a_capitalist_economy_requires_constant/
british,Republicanism,Ideological Politics,917,WANTED: Submissions from around the globe.,6,1,Yes,No,0,https://www.reddit.com/r/republicanism/comments/361f2w/wanted_submissions_from_around_the_globe/,/r/republicanism/comments/361f2w/wanted_submissions_from_around_the_globe/
War,Republicanism,Ideological Politics,917,Why are monarchists cherry-pickers?,6,0,No,No,0,https://www.reddit.com/r/republicanism/comments/1c22ytx/why_are_monarchists_cherrypickers/,/r/republicanism/comments/1c22ytx/why_are_monarchists_cherrypickers/
british,Republicanism,Ideological Politics,917,Pro-British monarchy Indian Christian saying mocking the name-reverting done by our governments (especially the renaming of Bombay to Mumbai) and openly doing sedition by saying that Charles III should be the Emperor of India and 'God Save the King' should be the Indian anthem.,3,0,No,No,0,https://www.reddit.com/gallery/1b2xwq8,/r/republicanism/comments/1b2xwq8/probritish_monarchy_indian_christian_saying/
uk,Republicanism,Ideological Politics,917,Survey about your political worldview (18+; 12-14 mins to complete),3,0,No,No,0,https://www.reddit.com/r/republicanism/comments/1aq418a/survey_about_your_political_worldview_18_1214/,/r/republicanism/comments/1aq418a/survey_about_your_political_worldview_18_1214/
Iran,Conservatives,Ideological Politics,108224,Senator Hagerty Signals Trump Will Once Again Put The Clamps On Iran,36,2,No,No,0,https://www.dailywire.com/news/senator-hagerty-signals-trump-will-once-again-put-the-clamps-on-iran,/r/conservatives/comments/1goijj4/senator_hagerty_signals_trump_will_once_again_put/
War,Conservatives,Ideological Politics,108224,"CNN’s Zakaria Slams Dems ‘Lawfare’ Against Trump, ‘Deeply Illiberal’ Culture War",54,0,No,No,0,https://www.breitbart.com/clips/2024/11/10/cnns-zakaria-slams-dems-lawfare-against-trump-deeply-illiberal-culture-war/,/r/conservatives/comments/1gof9s0/cnns_zakaria_slams_dems_lawfare_against_trump/
gaza,dailywire,Ideological Politics,24172,Israel Eliminates Hamas Leader Yahya Sinwar In Gaza: Reports,134,6,Yes,No,0,https://www.dailywire.com/news/israel-eliminates-hamas-leader-yahya-sinwar-in-gaza-reports?topStoryPosition=1,/r/dailywire/comments/1g5wl85/israel_eliminates_hamas_leader_yahya_sinwar_in/
putin,Liberal,Ideological Politics,119725,I keep hearing theories about how 15m people staying home didn't actually stay home and I'm not buying it.,302,295,No,No,0,https://www.reddit.com/r/Liberal/comments/1gnrlns/i_keep_hearing_theories_about_how_15m_people/,/r/Liberal/comments/1gnrlns/i_keep_hearing_theories_about_how_15m_people/
War,Liberal,Ideological Politics,119725,"Liberals need to stop blaming themselves, and stop blaming Trump voters",153,101,No,Yes,0,https://www.reddit.com/r/Liberal/comments/1gnk7ug/liberals_need_to_stop_blaming_themselves_and_stop/,/r/Liberal/comments/1gnk7ug/liberals_need_to_stop_blaming_themselves_and_stop/
War,Liberal,Ideological Politics,119725,Thinking about these big blue cities where the majority of red states money comes from.  These blue cities could bring their red states to there knees. ,126,122,No,No,0,https://www.reddit.com/r/Liberal/comments/1gne8ji/thinking_about_these_big_blue_cities_where_the/,/r/Liberal/comments/1gne8ji/thinking_about_these_big_blue_cities_where_the/
War,Liberal,Ideological Politics,119725,How to fight and actually win ,12,26,No,Yes,0,https://www.reddit.com/r/Liberal/comments/1gnivma/how_to_fight_and_actually_win/,/r/Liberal/comments/1gnivma/how_to_fight_and_actually_win/
War,KamalaHarris,Ideological Politics,76204,"The best path forward for Democrats (Pod Save America convo with Carlos Odio, 20min) ",33,10,No,No,0,https://youtu.be/jPJYFjQyWHU?feature=shared&t=2793,/r/KamalaHarris/comments/1gohu4f/the_best_path_forward_for_democrats_pod_save/
