Keyword,Subreddit,Category,Members,Title,Upvotes,Comments,Moderator Interaction,Fact-Checking Mention,Total Awards,URL,Original Post URL
MAGA,Wikileaks,General Politics,177604,"Julian Assange speaks out against deep state, ‘wolves in MAGA hats’: Interview",45,5,No,No,0,https://thehill.com/video/julian-assange-speaks-out-against-deep-state-%e2%80%98wolves-in-maga-hats%e2%80%99-interview/10098442/,/r/WikiLeaks/comments/1fvetjh/julian_assange_speaks_out_against_deep_state/
rig,Wikileaks,General Politics,177604,PACE hearing on Julian Assange's detention and conviction and their chilling effects on human rights,5,0,No,No,0,https://www.youtube.com/live/Mq85IZMeigc?t=745s,/r/WikiLeaks/comments/1ftlx8v/pace_hearing_on_julian_assanges_detention_and/
rig,Wikileaks,General Politics,177604,Julian to speak at a parliamentary hearing in Strasbourg on the chilling effect on human rights his treatment has had.,23,0,No,No,0,https://www.reddit.com/r/WikiLeaks/comments/1ftadxc/julian_to_speak_at_a_parliamentary_hearing_in/,/r/WikiLeaks/comments/1ftadxc/julian_to_speak_at_a_parliamentary_hearing_in/
mail,News,General Politics,28889887,"Bomb threats across multiple states traced to Russian email domains, FBI says",25048,379,No,No,0,https://kyivindependent.com/bomb-threats-across-multiple-states-traced-to-russian-email-domains-fbi-says/,/r/news/comments/1gkk1s4/bomb_threats_across_multiple_states_traced_to/
mail,PoliticalDiscussion,General Politics,2185422,"How much does ""ground game"" and canvassing actually help a candidate? Does it ever backfire?",111,56,No,No,0,https://www.reddit.com/r/PoliticalDiscussion/comments/1gkiejf/how_much_does_ground_game_and_canvassing_actually/,/r/PoliticalDiscussion/comments/1gkiejf/how_much_does_ground_game_and_canvassing_actually/
rig,PoliticalDiscussion,General Politics,2185422,"Why are other federations relatively receptive to amending their constitutions, even when they need ratification by subnational governments, when the US and Canada are so incapable of amending theirs?",18,24,No,No,0,https://www.reddit.com/r/PoliticalDiscussion/comments/1gkis5y/why_are_other_federations_relatively_receptive_to/,/r/PoliticalDiscussion/comments/1gkis5y/why_are_other_federations_relatively_receptive_to/
2016,PoliticalDiscussion,General Politics,2185422,"What does Donald Trump do if he loses the election tomorrow, what happens to Trumpism? ",538,768,No,No,0,https://www.reddit.com/r/PoliticalDiscussion/comments/1gjw1uo/what_does_donald_trump_do_if_he_loses_the/,/r/PoliticalDiscussion/comments/1gjw1uo/what_does_donald_trump_do_if_he_loses_the/
rig,PoliticalDiscussion,General Politics,2185422,What're The Most Interesting House Races Going On Right Now?,62,51,No,Yes,0,https://www.reddit.com/r/PoliticalDiscussion/comments/1gjog1j/whatre_the_most_interesting_house_races_going_on/,/r/PoliticalDiscussion/comments/1gjog1j/whatre_the_most_interesting_house_races_going_on/
rig,NeutralPolitics,General Politics,610588,What to expect after the U.S. election,277,23,Yes,Yes,0,https://www.reddit.com/r/NeutralPolitics/comments/1gflxpk/what_to_expect_after_the_us_election/,/r/NeutralPolitics/comments/1gflxpk/what_to_expect_after_the_us_election/
riot,NeutralPolitics,General Politics,610588,Why Are So Many Men Leaving The Democratic Party Over The Last Few Years?,0,6,No,No,0,https://www.reddit.com/r/NeutralPolitics/comments/1gklb9t/why_are_so_many_men_leaving_the_democratic_party/,/r/NeutralPolitics/comments/1gklb9t/why_are_so_many_men_leaving_the_democratic_party/
fraud,NeutralPolitics,General Politics,610588,Has there been any investigative journalism or public legal discovery to examine process irregularities regarding the 2020 election?,10,15,No,No,0,https://www.reddit.com/r/NeutralPolitics/comments/1ggkpzr/has_there_been_any_investigative_journalism_or/,/r/NeutralPolitics/comments/1ggkpzr/has_there_been_any_investigative_journalism_or/
rig,NeutralPolitics,General Politics,610588,Military coup in Niger (2023-2024) and relationships with western countries/companies ,43,5,No,No,0,https://www.reddit.com/r/NeutralPolitics/comments/1gdv0aw/military_coup_in_niger_20232024_and_relationships/,/r/NeutralPolitics/comments/1gdv0aw/military_coup_in_niger_20232024_and_relationships/
rig,moderatepolitics,General Politics,295362,Supreme Court's Ruling on Presidential Immunity,64,325,No,No,0,https://www.reddit.com/r/moderatepolitics/comments/1gjqz6i/supreme_courts_ruling_on_presidential_immunity/,/r/moderatepolitics/comments/1gjqz6i/supreme_courts_ruling_on_presidential_immunity/
rig,democrats,Ideological Politics,480947,"Alright my Cousins across the pond, I've been up past my bedtime refreshing reddit to see all the Voting updates.  I fully expect to wake up and find you all did the thing that needed to be done and Harris/Walz win in a landslide.  Stay strong out there in the lines - GO Blue! Love from the UK.",1634,192,No,No,0,https://i.redd.it/zcx19kdd46zd1.png,/r/democrats/comments/1gkkowd/alright_my_cousins_across_the_pond_ive_been_up/
rig,democrats,Ideological Politics,480947,White guys for Harris!,3668,161,No,No,0,https://i.redd.it/tqpb58t614zd1.jpeg,/r/democrats/comments/1gkarkt/white_guys_for_harris/
rig,Republican,Ideological Politics,202685,*repost with all names covered!* My Instagram story triggered an example of the very tolerant left. Happy Election Day 🇺🇸,369,46,No,No,0,https://www.reddit.com/gallery/1gkk9yw,/r/Republican/comments/1gkk9yw/repost_with_all_names_covered_my_instagram_story/
MAGA,Republican,Ideological Politics,202685,My parents are first time voters and…,221,23,No,No,0,https://www.reddit.com/r/Republican/comments/1gklgr0/my_parents_are_first_time_voters_and/,/r/Republican/comments/1gklgr0/my_parents_are_first_time_voters_and/
2016,Conservative,Ideological Politics,1138042,Vice President Harris will not talk tonight,1370,472,No,No,0,https://www.reddit.com/r/Conservative/comments/1gkrfb1/vice_president_harris_will_not_talk_tonight/,/r/Conservative/comments/1gkrfb1/vice_president_harris_will_not_talk_tonight/
rig,Libertarian,Ideological Politics,503567,Today is a Dark Day for Liberty,38,22,Yes,Yes,0,https://www.reddit.com/r/Libertarian/comments/1gkk9pv/today_is_a_dark_day_for_liberty/,/r/Libertarian/comments/1gkk9pv/today_is_a_dark_day_for_liberty/
rig,Anarchism,Ideological Politics,270405,My thoughts today,7,1,No,No,0,https://i.redd.it/17kqn8l6j5zd1.jpeg,/r/Anarchism/comments/1gkhzs1/my_thoughts_today/
mail,Anarchism,Ideological Politics,270405,Any comrades in London who would be keen for a bi-weekly meetup?,4,0,No,No,0,https://www.reddit.com/r/Anarchism/comments/1gkc4wd/any_comrades_in_london_who_would_be_keen_for_a/,/r/Anarchism/comments/1gkc4wd/any_comrades_in_london_who_would_be_keen_for_a/
rig,Socialism,Ideological Politics,460344,"Join us for a powerful Children’s Art Build in Chicago on Nov. 9th from 1-3 pm at 4613 N Kedzie Ave, as we honor the resilience and voices of Palestine’s children. ",10,2,No,No,0,https://www.reddit.com/gallery/1gko6fq,/r/socialism/comments/1gko6fq/join_us_for_a_powerful_childrens_art_build_in/
rig,Socialism,Ideological Politics,460344,A Forgotten Eyewitness to Civil-Rights-Era Mississippi,16,1,No,No,0,https://www.newyorker.com/culture/photo-booth/florence-mars-a-forgotten-eyewitness-to-civil-rights-era-mississippi,/r/socialism/comments/1gkbwyj/a_forgotten_eyewitness_to_civilrightsera/
rig,Progressive,Ideological Politics,78004,Will Abortion Rights Decide 2024 Election?,65,6,No,No,0,https://www.democracynow.org/2024/11/1/amy_littlefield_abortion_2024_election,/r/progressive/comments/1gigwsj/will_abortion_rights_decide_2024_election/
rig,Progressive,Ideological Politics,78004,Why Catholic bishops are donating less to oppose abortion rights measures this year,45,2,No,No,0,https://www.npr.org/2024/10/20/nx-s1-5144660/catholic-bishops-are-donating-millions-less-to-defeat-abortion-this-year-heres-why,/r/progressive/comments/1g8lhj0/why_catholic_bishops_are_donating_less_to_oppose/
rig,Progressive,Ideological Politics,78004,"Ron DeSantis, using the levers of state government, ramps up efforts to defeat Florida abortion-rights ballot measure",179,4,No,No,0,https://www.nbcnews.com/politics/2024-election/ron-desantis-florida-abortion-ballot-measure-rcna175337,/r/progressive/comments/1g6fyiv/ron_desantis_using_the_levers_of_state_government/
rig,Republicanism,Ideological Politics,915,WANTED: Submissions from around the globe.,6,1,Yes,No,0,https://www.reddit.com/r/republicanism/comments/361f2w/wanted_submissions_from_around_the_globe/,/r/republicanism/comments/361f2w/wanted_submissions_from_around_the_globe/
rig,Republicanism,Ideological Politics,915,“Away with college gen ed”,0,4,No,Yes,0,https://www.reddit.com/r/republicanism/comments/19asm4l/away_with_college_gen_ed/,/r/republicanism/comments/19asm4l/away_with_college_gen_ed/
rig,dailywire,Ideological Politics,24023,"I had comments deleted, being called a bigot, even the ones I know didn't believe me. But I was right ",288,33,No,No,0,https://www.dailywire.com/news/french-journalist-claims-medical-report-proves-olympic-boxer-who-took-gold-in-womens-division-a-man,/r/dailywire/comments/1gju17q/i_had_comments_deleted_being_called_a_bigot_even/
MAGA,dailywire,Ideological Politics,24023,Kamala's hats selling like hotcakes???,114,8,No,No,0,https://i.redd.it/6bq27ghg50zd1.png,/r/dailywire/comments/1gjxi1y/kamalas_hats_selling_like_hotcakes/
rig,Liberal,Ideological Politics,119762,How the Republican War on Women Extends to Voting Rights ,97,4,No,No,0,https://newrepublic.com/article/186160/republican-war-women-extends-voting-rights,/r/Liberal/comments/1gk21wr/how_the_republican_war_on_women_extends_to_voting/
rig,Liberal,Ideological Politics,119762,Alright everybody ,0,75,No,Yes,0,https://www.reddit.com/r/Liberal/comments/1gkt1q5/alright_everybody/,/r/Liberal/comments/1gkt1q5/alright_everybody/
rig,Liberal,Ideological Politics,119762,What is no one gets 270 electoral votes?,28,53,No,No,0,https://www.reddit.com/r/Liberal/comments/1gjqyqe/what_is_no_one_gets_270_electoral_votes/,/r/Liberal/comments/1gjqyqe/what_is_no_one_gets_270_electoral_votes/
rig,KamalaHarris,Ideological Politics,82697,Registered Republican Here; Officially cast my ballot for Kamala! ,2653,138,No,No,0,https://www.reddit.com/r/KamalaHarris/comments/1gkesy2/registered_republican_here_officially_cast_my/,/r/KamalaHarris/comments/1gkesy2/registered_republican_here_officially_cast_my/
MAGA,KamalaHarris,Ideological Politics,82697,Trump supporter asked to see pictures of men voting for Harris. I obliged them.,984,67,No,No,0,https://i.redd.it/80wap4iab6zd1.jpeg,/r/KamalaHarris/comments/1gkli7v/trump_supporter_asked_to_see_pictures_of_men/
rig,KamalaHarris,Ideological Politics,82697,"i, a christian, can’t tell anyone i voted for kamala and it’s making me sick to my stomach.",1001,158,No,No,0,https://www.reddit.com/r/KamalaHarris/comments/1gkjt6d/i_a_christian_cant_tell_anyone_i_voted_for_kamala/,/r/KamalaHarris/comments/1gkjt6d/i_a_christian_cant_tell_anyone_i_voted_for_kamala/
