Keyword,Subreddit,Category,Members,Title,Upvotes,Comments,Moderator Interaction,Fact-Checking Mention,Total Awards,URL,Original Post URL
black,News,General Politics,28912728,6.8 magnitude earthquake shakes Cuba after hurricanes and blackouts,10712,430,No,No,0,https://apnews.com/article/cuba-earthquake-hurricanes-natural-disaster-c28bbf4496a1bbe27a39f80728d63b2d,/r/news/comments/1go9c5c/68_magnitude_earthquake_shakes_cuba_after/
survey,PoliticalDiscussion,General Politics,2184588,Casual Questions Thread,43,4709,Yes,No,0,https://www.reddit.com/r/PoliticalDiscussion/comments/1bwbuka/casual_questions_thread/,/r/PoliticalDiscussion/comments/1bwbuka/casual_questions_thread/
vote,PoliticalDiscussion,General Politics,2184588,Did the plethora of state level abortion amendments neuter the impact of abortion in the presidential race?,33,77,No,No,0,https://www.reddit.com/r/PoliticalDiscussion/comments/1gonhzy/did_the_plethora_of_state_level_abortion/,/r/PoliticalDiscussion/comments/1gonhzy/did_the_plethora_of_state_level_abortion/
vote,PoliticalDiscussion,General Politics,2184588,"Was Trump's win driven by an anti-incumbency sentiment? or was it a successful campaign strategy? had it been the former, would picking a candidate of the same party but not in the incumbent administration have levelled the playing field?",2,35,No,No,0,https://www.reddit.com/r/PoliticalDiscussion/comments/1goqx1f/was_trumps_win_driven_by_an_antiincumbency/,/r/PoliticalDiscussion/comments/1goqx1f/was_trumps_win_driven_by_an_antiincumbency/
white,PoliticalDiscussion,General Politics,2184588,What are your thoughts on a purge of senior military by the incoming Trump administration?,558,507,No,Yes,0,https://www.reddit.com/r/PoliticalDiscussion/comments/1gnesig/what_are_your_thoughts_on_a_purge_of_senior/,/r/PoliticalDiscussion/comments/1gnesig/what_are_your_thoughts_on_a_purge_of_senior/
vote,PoliticalDiscussion,General Politics,2184588,What can Democrats do to not get annihilated in another election? ,451,1902,No,No,0,https://www.reddit.com/r/PoliticalDiscussion/comments/1gn9x6c/what_can_democrats_do_to_not_get_annihilated_in/,/r/PoliticalDiscussion/comments/1gn9x6c/what_can_democrats_do_to_not_get_annihilated_in/
vote,PoliticalDiscussion,General Politics,2184588,why did harris struggle to win traditionally blue states like IL and NJ by larger margins ?,159,278,No,No,0,https://www.reddit.com/r/PoliticalDiscussion/comments/1gnd17f/why_did_harris_struggle_to_win_traditionally_blue/,/r/PoliticalDiscussion/comments/1gnd17f/why_did_harris_struggle_to_win_traditionally_blue/
vote,NeutralPolitics,General Politics,610485,What to expect after the U.S. election,283,26,Yes,Yes,0,https://www.reddit.com/r/NeutralPolitics/comments/1gflxpk/what_to_expect_after_the_us_election/,/r/NeutralPolitics/comments/1gflxpk/what_to_expect_after_the_us_election/
vote,NeutralPolitics,General Politics,610485,Trump won the presidency and popular vote running on the mass deportation of illegal aliens. Who saw this coming and what lessons can be learned?,160,297,No,No,0,https://www.reddit.com/r/NeutralPolitics/comments/1gnk7ih/trump_won_the_presidency_and_popular_vote_running/,/r/NeutralPolitics/comments/1gnk7ih/trump_won_the_presidency_and_popular_vote_running/
poll,NeutralPolitics,General Politics,610485,Is now the time for a NEW moderate third party in U.S. politics?,0,66,No,No,0,https://www.reddit.com/r/NeutralPolitics/comments/1gms9so/is_now_the_time_for_a_new_moderate_third_party_in/,/r/NeutralPolitics/comments/1gms9so/is_now_the_time_for_a_new_moderate_third_party_in/
vote,NeutralPolitics,General Politics,610485,Why Are So Many Men Leaving The Democratic Party Over The Last Few Years?,381,156,No,No,0,https://www.reddit.com/r/NeutralPolitics/comments/1gklb9t/why_are_so_many_men_leaving_the_democratic_party/,/r/NeutralPolitics/comments/1gklb9t/why_are_so_many_men_leaving_the_democratic_party/
vote,NeutralPolitics,General Politics,610485,"What are the pros and cons of predictive election models, like 538, for our discourse around elections?",41,94,No,No,0,https://www.reddit.com/r/NeutralPolitics/comments/1giqib5/what_are_the_pros_and_cons_of_predictive_election/,/r/NeutralPolitics/comments/1giqib5/what_are_the_pros_and_cons_of_predictive_election/
vote,NeutralPolitics,General Politics,610485,Why are there organizations whose only goal is to make sure people vote? ,51,36,No,No,0,https://www.reddit.com/r/NeutralPolitics/comments/1ggtk67/why_are_there_organizations_whose_only_goal_is_to/,/r/NeutralPolitics/comments/1ggtk67/why_are_there_organizations_whose_only_goal_is_to/
vote,NeutralPolitics,General Politics,610485,Has there been any investigative journalism or public legal discovery to examine process irregularities regarding the 2020 election?,11,15,No,No,0,https://www.reddit.com/r/NeutralPolitics/comments/1ggkpzr/has_there_been_any_investigative_journalism_or/,/r/NeutralPolitics/comments/1ggkpzr/has_there_been_any_investigative_journalism_or/
vote,moderatepolitics,General Politics,296039,Overlooking the key reason Democrat's lost so badly,134,228,No,No,0,https://www.ft.com/content/e8ac09ea-c300-4249-af7d-109003afb893,/r/moderatepolitics/comments/1gncyo2/overlooking_the_key_reason_democrats_lost_so_badly/
vote,democrats,Ideological Politics,480419,You were cheated out of a free and fair democratic election. Everyday up until election day.,251,18,No,Yes,0,https://i.redd.it/da3t9ximz90e1.jpeg,/r/democrats/comments/1goscrp/you_were_cheated_out_of_a_free_and_fair/
Arizona,democrats,Ideological Politics,480419,Gallego defeats lake in Arizona race !!!!,313,15,No,No,0,https://thehill.com/homenews/campaign/4969256-ruben-gallego-defeats-kari-lake/,/r/democrats/comments/1goq3ea/gallego_defeats_lake_in_arizona_race/
vote,democrats,Ideological Politics,480419,"Look at these razor thin margins in 6 states, shame on those who didn’t vote",1884,416,No,No,0,https://i.redd.it/f06nuhsxf60e1.jpeg,/r/democrats/comments/1gogu97/look_at_these_razor_thin_margins_in_6_states/
vote,democrats,Ideological Politics,480419,Why this Latino Harris voter says he's 'happy' Trump won,253,125,No,No,0,https://www.msnbc.com/top-stories/latest/latino-voters-trump-harris-win-rcna179359,/r/democrats/comments/1goiru5/why_this_latino_harris_voter_says_hes_happy_trump/
vote,democrats,Ideological Politics,480419,Was it stolen…?,1683,1173,No,No,0,https://i.redd.it/o9wpdezwb30e1.jpeg,/r/democrats/comments/1go2sdb/was_it_stolen/
black,democrats,Ideological Politics,480419,Tulsa elects first Black mayor - a Democrat - in ‘historic and significant’ election,613,19,No,No,0,https://www.dailykos.com/stories/2024/11/10/2284332/-Tulsa-elects-first-Black-mayor-in-historic-and-significant-election?pm_campaign=front_page&pm_source=top_news_slot_1&pm_medium=web,/r/democrats/comments/1go6y1f/tulsa_elects_first_black_mayor_a_democrat_in/
white,Republican,Ideological Politics,205035,Trump appoints UN ambassador Elise Stefanik and border tsar Tom Homan,36,8,No,No,0,https://www.bbc.com/news/articles/c079m9mxx1no,/r/Republican/comments/1goqnt1/trump_appoints_un_ambassador_elise_stefanik_and/
black,Republican,Ideological Politics,205035,2024 The Ultimate Uno Reverse Card,132,58,No,No,0,https://www.reddit.com/gallery/1goj69a,/r/Republican/comments/1goj69a/2024_the_ultimate_uno_reverse_card/
vote,Republican,Ideological Politics,205035,Lying Corporate Media Are Responsible For Kamala Voters’ Delusional Despair,10,2,No,No,0,https://thefederalist.com/2024/11/11/lying-corporate-media-is-responsible-for-kamala-voters-delusional-despair/,/r/Republican/comments/1gotx0n/lying_corporate_media_are_responsible_for_kamala/
vote,Republican,Ideological Politics,205035,Something fishy in Arizona. Kari Lake with more votes than Kamala Harris but not leading her race for Senate?,345,175,No,No,0,https://www.reddit.com/gallery/1go55rx,/r/Republican/comments/1go55rx/something_fishy_in_arizona_kari_lake_with_more/
vote,Republican,Ideological Politics,205035,AP Calls Arizona For Donald Trump - Most Electoral Votes For A Republican Since 1988,528,55,No,No,0,https://www.theguardian.com/us-news/live/2024/nov/10/donald-trump-arizona-swing-states-house-representatives-republicans-us-politics-latest-updates,/r/Republican/comments/1go0eew/ap_calls_arizona_for_donald_trump_most_electoral/
vote,Conservative,Ideological Politics,1144662,Donald Trump wins most popular votes by a Republican ever,2085,171,No,No,0,https://nypost.com/2024/11/10/us-news/donald-trump-wins-most-popular-votes-by-a-republican-ever/,/r/Conservative/comments/1gog5uk/donald_trump_wins_most_popular_votes_by_a/
poll,Conservative,Ideological Politics,1144662,Exit Polling: 40 Percent of Women Under 30 Dumped Harris for Trump,1989,296,No,No,0,https://www.breitbart.com/2024-election/2024/11/10/exit-polling-40-percent-of-women-under-30-dumped-harris-for-trump/,/r/Conservative/comments/1goegkm/exit_polling_40_percent_of_women_under_30_dumped/
Arizona,Conservative,Ideological Politics,1144662,Arizona Announces They Have Counted Another Ballot,101,3,No,No,0,https://babylonbee.com/cleanArticle/breaking-arizona-announces-they-have-counted-another-ballot,/r/Conservative/comments/1goqph3/arizona_announces_they_have_counted_another_ballot/
vote,Libertarian,Ideological Politics,503607,Don't Vote! | Dave Smith On: Voting,18,14,No,No,0,https://youtu.be/e-gdPGrRM2I?si=rXa3V3FrcWVpfjsu,/r/Libertarian/comments/1goi568/dont_vote_dave_smith_on_voting/
white,Anarchism,Ideological Politics,270966,"Im a disabled person, and im begging you to get informed about covid.",54,17,No,No,0,https://www.reddit.com/r/Anarchism/comments/1goj9ja/im_a_disabled_person_and_im_begging_you_to_get/,/r/Anarchism/comments/1goj9ja/im_a_disabled_person_and_im_begging_you_to_get/
black,Anarchism,Ideological Politics,270966,want to buy anarchist stickers,7,7,No,No,0,https://www.reddit.com/r/Anarchism/comments/1goca8x/want_to_buy_anarchist_stickers/,/r/Anarchism/comments/1goca8x/want_to_buy_anarchist_stickers/
vote,Anarchism,Ideological Politics,270966,The fact that an aspiring autocrat has won an election does not oblige us to submit to him. No one should excuse being complicit in tyranny on the grounds that other people voted for it.,211,2,No,No,0,/r/CrimethInc/comments/1gnj01a/the_fact_that_an_aspiring_autocrat_has_won_an/,/r/Anarchism/comments/1gnj0d0/the_fact_that_an_aspiring_autocrat_has_won_an/
white,Anarchism,Ideological Politics,270966,So should we prepare for a massive civil war under the Trump administration? What do you think is going to look like? I'm imagining some return of the occupy movement with far more intensity,44,73,No,No,0,https://www.reddit.com/r/Anarchism/comments/1gnjmy2/so_should_we_prepare_for_a_massive_civil_war/,/r/Anarchism/comments/1gnjmy2/so_should_we_prepare_for_a_massive_civil_war/
vote,Progressive,Ideological Politics,78027,Americans in Puerto Rico can't vote for US president. Their anger at Trump is shaping the race.,345,31,No,No,0,https://apnews.com/article/puerto-rico-trump-joke-garbage-a91e2aafd93a06d32365efa013581b85,/r/progressive/comments/1gh2ab4/americans_in_puerto_rico_cant_vote_for_us/
Texas,Progressive,Ideological Politics,78027,A Texas Woman Died After Waiting 40 Hours for Miscarriage Care,294,5,No,No,0,https://www.propublica.org/article/josseli-barnica-death-miscarriage-texas-abortion-ban,/r/progressive/comments/1gfmamd/a_texas_woman_died_after_waiting_40_hours_for/
michigan,Progressive,Ideological Politics,78027,20k+ attend Michigan Rally,140,2,No,No,0,https://i.redd.it/ywmuqgzbhlxd1.jpeg,/r/progressive/comments/1gelsyg/20k_attend_michigan_rally/
survey,Republicanism,Ideological Politics,917,Survey about your political worldview (18+; 12-14 mins to complete),3,0,No,No,0,https://www.reddit.com/r/republicanism/comments/1aq418a/survey_about_your_political_worldview_18_1214/,/r/republicanism/comments/1aq418a/survey_about_your_political_worldview_18_1214/
vote,Republicanism,Ideological Politics,917,About the Lopez,4,2,No,No,0,https://www.reddit.com/r/republicanism/comments/1094bh5/about_the_lopez/,/r/republicanism/comments/1094bh5/about_the_lopez/
vote,Conservatives,Ideological Politics,108224,Donald Trump wins most popular votes by a Republican ever,305,6,No,No,0,https://nypost.com/2024/11/10/us-news/donald-trump-wins-most-popular-votes-by-a-republican-ever/,/r/conservatives/comments/1gog5qs/donald_trump_wins_most_popular_votes_by_a/
poll,Conservatives,Ideological Politics,108224,Exit Polling: 40 Percent of Women Under 30 Dumped Harris for Trump,187,0,No,No,0,https://www.breitbart.com/2024-election/2024/11/10/exit-polling-40-percent-of-women-under-30-dumped-harris-for-trump/,/r/conservatives/comments/1goeg7p/exit_polling_40_percent_of_women_under_30_dumped/
Arizona,Conservatives,Ideological Politics,108224,UPDATED: Arizona Supreme Court Rejects ACLU's 'Hail Mary' Suit to Draw Out Curing Deadline,17,0,No,No,0,https://redstate.com/beccalower/2024/11/10/rnc-and-az-gop-files-in-arizona-supreme-court-to-stop-aclu-from-getting-ballot-curing-extended-n2181816,/r/conservatives/comments/1gorcol/updated_arizona_supreme_court_rejects_aclus_hail/
white,Conservatives,Ideological Politics,108224,"Byron Donalds Says FEMA Should Be Ripped Out Of DHS, Report Directly To White House",45,1,No,No,0,https://www.dailywire.com/news/byron-donalds-says-fema-should-be-ripped-out-of-dhs-report-directly-to-white-house,/r/conservatives/comments/1gojd47/byron_donalds_says_fema_should_be_ripped_out_of/
vote,dailywire,Ideological Politics,24174,19 year old here. So I'm Gen Z. I am a female!,51,4,No,No,0,https://www.youtube.com/watch?v=ybgV3jSNKEE,/r/dailywire/comments/1gokaic/19_year_old_here_so_im_gen_z_i_am_a_female/
Arizona,Liberal,Ideological Politics,119729,Arizona AG says she won't drop state's fake electors case against Trump allies,96,4,No,No,0,https://www.upi.com/Top_News/US/2024/11/10/Arizona-fake-electors-case/4001731292312/,/r/Liberal/comments/1gosjeh/arizona_ag_says_she_wont_drop_states_fake/
vote,Liberal,Ideological Politics,119729,Why were the polls so wrong?,112,140,No,No,0,https://www.reddit.com/r/Liberal/comments/1go7sv1/why_were_the_polls_so_wrong/,/r/Liberal/comments/1go7sv1/why_were_the_polls_so_wrong/
vote,Liberal,Ideological Politics,119729,Glad to see we have visitors.,4,4,No,Yes,0,https://www.reddit.com/r/Liberal/comments/1gon2jn/glad_to_see_we_have_visitors/,/r/Liberal/comments/1gon2jn/glad_to_see_we_have_visitors/
vote,Liberal,Ideological Politics,119729,I keep hearing theories about how 15m people staying home didn't actually stay home and I'm not buying it.,308,306,No,No,0,https://www.reddit.com/r/Liberal/comments/1gnrlns/i_keep_hearing_theories_about_how_15m_people/,/r/Liberal/comments/1gnrlns/i_keep_hearing_theories_about_how_15m_people/
vote,Liberal,Ideological Politics,119729,"My liberal parents say they will no longer watch any political news on TV, nor will they ever vote in another election.",476,238,No,No,0,https://www.reddit.com/r/Liberal/comments/1gnof4d/my_liberal_parents_say_they_will_no_longer_watch/,/r/Liberal/comments/1gnof4d/my_liberal_parents_say_they_will_no_longer_watch/
vote,Liberal,Ideological Politics,119729,America will NOT elect a woman President.,274,396,No,No,0,https://www.reddit.com/r/Liberal/comments/1gnhckm/america_will_not_elect_a_woman_president/,/r/Liberal/comments/1gnhckm/america_will_not_elect_a_woman_president/
vote,Liberal,Ideological Politics,119729,"Liberals need to stop blaming themselves, and stop blaming Trump voters",150,106,No,Yes,0,https://www.reddit.com/r/Liberal/comments/1gnk7ug/liberals_need_to_stop_blaming_themselves_and_stop/,/r/Liberal/comments/1gnk7ug/liberals_need_to_stop_blaming_themselves_and_stop/
white,Liberal,Ideological Politics,119729,We're all in this together,61,51,No,No,0,https://www.reddit.com/r/Liberal/comments/1gnpdn0/were_all_in_this_together/,/r/Liberal/comments/1gnpdn0/were_all_in_this_together/
vote,Liberal,Ideological Politics,119729,The House is still in play and you can help by curing votes!,25,0,No,No,0,https://votesaveamerica.com/,/r/Liberal/comments/1gnlz7c/the_house_is_still_in_play_and_you_can_help_by/
vote,KamalaHarris,Ideological Politics,76161,...STARLINK was used to transmit votes??,1893,654,No,No,0,https://abc30.com/post/tulare-county-sees-larger-voter-turnout-during-2024-presidential-election/15519472/,/r/KamalaHarris/comments/1gnswq9/starlink_was_used_to_transmit_votes/
vote,KamalaHarris,Ideological Politics,76161,Pennsylvania looking in to fraudulent votes,1613,258,No,No,0,https://cbs6albany.com/news/nation-world/pennsylvania-da-finds-fraud-in-hundreds-of-voter-registrations-amid-ongoing-investigations-lancaster-county-district-attorneys-office-heather-adams,/r/KamalaHarris/comments/1gnmynj/pennsylvania_looking_in_to_fraudulent_votes/
vote,Impeach_Trump,Ideological Politics,60568,This is an amazing article written by user u/SilkyFluffs in r/democrats which is an amazing resource for combating GOP and Trump misinformation and possibly even converting family members or undecided voters,46,0,No,Yes,0,https://pdflink.to/d6e0bc9d/,/r/Impeach_Trump/comments/1ggd0pc/this_is_an_amazing_article_written_by_user/
